baseOrig,compOrig,baseCharStart,baseCharEnd,baseRefStart,baseRefEnd,compCharStart,compCharEnd,compRefStart,compRefEnd,baseStr,compStr,bRange,cRange,compOrder,grp-ref-bible,baseOrder,grp-ref-sifre-n,dam-lev,jac,lcc_len,lcs_str,id,bRangeOriginal,cRangeOriginal
ref-sifre-n.59.1.65-ref-sifre-n.59.1.105,ref-bible.0104.7.89.22-ref-bible.0104.8.4.2,83664,83875,ref-sifre-n.59.1.65,ref-sifre-n.59.1.105,273385,273574,ref-bible.0104.7.89.22,ref-bible.0104.8.4.2,וידבר אליו וידבר יהוה אל משה לאמר דבר אל אהרן ואמרת אליו בהעלתך את הנרת,וידבר אליו וידבר יהוה אל משה לאמר דבר אל אהרן ואמרת אליו בהעלתך את הנרת,10,10,370,370.0,345,345.0,0.0,0.0,10,וידבר אליו וידבר יהוה_אל_משה_לאמר_דבר_אל אהרן ואמרת אליו בהעלתך את הנרת,5090000285,10,10
ref-sifre-n.59.1.82-ref-sifre-n.59.1.100,ref-bible.0208.38.25.5-ref-bible.208.38.25.21,83752,83846,ref-sifre-n.59.1.82,ref-sifre-n.59.1.100,947217,947297,ref-bible.0208.38.25.5,ref-bible.0208.38.25.21,דבור ואמרת אליו הרי זה אמירה לאהרן בהעלותך את הנרות עשה לה מעלות אל מול פני המנורה עשה לה ,דברתי אתך ובאו אליך ואמרו אליך הגידה נא לנו מה דברת אל המלך אל תכחד ממנו ולא ,19,17,1093,1093.0,348,345.0,0.6555555555555556,0.9130434782608696,1,אל,5090000286,19,17
ref-sifre-n.60.1.12-ref-sifre-n.60.1.23,ref-bible.0104.8.2.6-ref-bible.0104.8.4.2,84074,84129,ref-sifre-n.60.1.12,ref-sifre-n.60.1.23,273445,273574,ref-bible.0104.8.2.6,ref-bible.0104.8.4.2,בהעלתך את הנרת אל מול פני המנורה יאירו שבעת הנרות ויעש כן אהרן אל מול פני המנורה העלה נרתיה כאשר צוה יהוה את משה וזה מעשה,בהעלתך את הנרת אל מול פני המנורה יאירו שבעת הנרות ויעש כן אהרן אל מול פני המנורה העלה נרתיה כאשר צוה יהוה את משה וזה מעשה,22,22,373,373.0,349,349.0,0.0,0.0,22,בהעלתך את הנרת אל מול פני המנורה יאירו שבעת הנרות ויעש כן אהרן אל מול פני המנורה העלה נרתיה כאשר_צוה_יהוה_את_משה וזה מעשה,5090000287,22,22
ref-sifre-n.61.1.1-ref-sifre-n.61.1.12,ref-bible.0104.8.4.1-ref-bible.104.8.4.12,85567,85625,ref-sifre-n.61.1.1,ref-sifre-n.61.1.12,273565,273622,ref-bible.0104.8.4.1,ref-bible.0104.8.4.12,וזה מעשה המנורה מקשה זהב עד ירכה עד פרחה מקשה היא כמראה ,וזה מעשה המנרה מקשה זהב עד ירכה עד פרחה מקשה הוא כמראה ,12,12,376,370.0,351,351.0,0.0357142857142857,0.0,10,וזה מעשה מקשה זהב עד ירכה עד פרחה מקשה כמראה,5090000288,12,12
ref-sifre-n.61.1.30-ref-sifre-n.61.1.41,ref-bible.0102.12.1.9-ref-bible.102.12.2.8,85714,85771,ref-sifre-n.61.1.30,ref-sifre-n.61.1.41,127191,127234,ref-bible.0102.12.1.9,ref-bible.0102.12.2.8,אומר החדש הזה לכם ראש חדשים כיוצא בו אתה אומר וזה לכם ,לאמר החדש הזה לכם ראש חדשים ראשון הוא לכם ,9,9,52,52.0,352,352.0,0.3518518518518518,0.25,6,החדש הזה לכם ראש חדשים לכם,5090000289,9,9
ref-sifre-n.61.1.60-ref-sifre-n.61.1.65,ref-bible.0102.25.31.8-ref-bible.102.25.31.13,85851,85890,ref-sifre-n.61.1.60,ref-sifre-n.61.1.65,155269,155306,ref-bible.0102.25.31.8,ref-bible.0102.25.31.13,ירכה ופרחה גביעיה כפתוריה ופרחיה מנין ,ירכה וקנה גביעיה כפתריה ופרחיה ממנה ,6,6,90,89.0,353,353.0,0.1842105263157894,0.4285714285714286,3,ירכה גביעיה ופרחיה,5090000290,6,6
ref-sifre-n.61.1.60-ref-sifre-n.61.1.65,ref-bible.0102.37.17.10-ref-bible.102.37.17.15,85851,85890,ref-sifre-n.61.1.60,ref-sifre-n.61.1.65,183320,183357,ref-bible.0102.37.17.10,ref-bible.0102.37.17.15,ירכה ופרחה גביעיה כפתוריה ופרחיה מנין ,ירכה וקנה גביעיה כפתריה ופרחיה ממנה ,6,6,130,129.0,354,353.0,0.1842105263157894,0.4285714285714286,3,ירכה גביעיה ופרחיה,5090000291,6,6
ref-sifre-n.61.1.181-ref-sifre-n.61.1.186,ref-bible.0102.25.31.7-ref-bible.102.25.31.13,86435,86473,ref-sifre-n.61.1.181,ref-sifre-n.61.1.186,155261,155306,ref-bible.0102.25.31.7,ref-bible.0102.25.31.13,מנורה נרות גביעיה כפתוריה ופרחיה מנין ,המנורה ירכה וקנה גביעיה כפתריה ופרחיה ממנה ,6,7,89,89.0,355,355.0,0.2790697674418604,0.7,2,גביעיה ופרחיה,5090000292,6,7
ref-sifre-n.61.1.184-ref-sifre-n.61.1.201,ref-bible.0102.25.36.1-ref-bible.102.25.37.1,86453,86550,ref-sifre-n.61.1.184,ref-sifre-n.61.1.201,155662,155715,ref-bible.0102.25.36.1,ref-bible.0102.25.37.1,"כפתוריה ופרחיה מנין ת""ל כולה מקשה אחת וגו' יכול אף נרותיה מלקחיה ומחתותיה ת""ל ככר זהב טהור יעשה ",כפתריהם וקנתם ממנה יהיו כלה מקשה אחת זהב טהור ועשית ,18,10,91,91.0,357,355.0,0.6145833333333334,0.7619047619047619,4,מקשה אחת זהב טהור,5090000293,18,10
ref-sifre-n.61.1.195-ref-sifre-n.61.1.206,ref-bible.0102.25.38.1-ref-bible.102.25.39.9,86512,86574,ref-sifre-n.61.1.195,ref-sifre-n.61.1.206,155765,155832,ref-bible.0102.25.38.1,ref-bible.0102.25.39.9,"מלקחיה ומחתותיה ת""ל ככר זהב טהור יעשה אותה את כל הכלים האלה ",ומלקחיה ומחתתיה זהב טהור ככר זהב טהור יעשה אתה את כל הכלים האלה ,12,13,93,93.0,359,355.0,0.171875,0.2727272727272727,8,ככר זהב טהור יעשה את כל הכלים האלה,5090000294,12,13
ref-sifre-n.61.1.181-ref-sifre-n.61.1.186,ref-bible.0102.37.17.9-ref-bible.102.37.17.15,86435,86473,ref-sifre-n.61.1.181,ref-sifre-n.61.1.186,183313,183357,ref-bible.0102.37.17.9,ref-bible.0102.37.17.15,מנורה נרות גביעיה כפתוריה ופרחיה מנין ,המנרה ירכה וקנה גביעיה כפתריה ופרחיה ממנה ,6,7,129,129.0,356,355.0,0.3095238095238095,0.7,2,גביעיה ופרחיה,5090000295,6,7
ref-sifre-n.61.1.184-ref-sifre-n.61.1.202,ref-bible.0102.37.22.1-ref-bible.102.37.24.5,86453,86555,ref-sifre-n.61.1.184,ref-sifre-n.61.1.202,183705,183818,ref-bible.0102.37.22.1,ref-bible.0102.37.24.5,"כפתוריה ופרחיה מנין ת""ל כולה מקשה אחת וגו' יכול אף נרותיה מלקחיה ומחתותיה ת""ל ככר זהב טהור יעשה אותה ",כפתריהם וקנתם ממנה היו כלה מקשה אחת זהב טהור ויעש את נרתיה שבעה ומלקחיה ומחתתיה זהב טהור ככר זהב טהור עשה אתה ,19,22,131,131.0,358,355.0,0.4,0.5652173913043479,5,מקשה אחת ככר זהב טהור,5090000296,19,22
ref-sifre-n.61.1.258-ref-sifre-n.62.1.3,ref-bible.0104.8.4.12-ref-bible.104.8.6.3,86836,86894,ref-sifre-n.61.1.258,ref-sifre-n.62.1.3,273616,273697,ref-bible.0104.8.4.12,ref-bible.0104.8.6.3,כמראה אשר הראה ה' את משה כן עשה את המנורה זאת אשר ללוים ,כמראה אשר הראה יהוה את משה כן עשה את המנרה וידבר יהוה אל משה לאמר קח את הלוים ,11,11,377,370.0,360,360.0,0.3846153846153846,0.4615384615384615,5,כמראה אשר הראה עשה את,5090000297,11,11
ref-sifre-n.62.1.38-ref-sifre-n.62.1.67,ref-bible.0309.2.28.6-ref-bible.309.2.30.4,87089,87256,ref-sifre-n.62.1.38,ref-sifre-n.62.1.67,1374109,1374162,ref-bible.0309.2.28.6,ref-bible.0309.2.30.4,ומבן חמשים חמש ועשרים שנה כתוב אחד אומר מבן חמש ועשרים שנה ומעלה וכתוב אחד אומר מבן שלשים שנה כיצד יתקיימו שני הכתובים מבן חמש ועשרים שנה לתלמוד ומבן שלשים ,עשרים ושלשה בני נבו חמשים ושנים בני מגביש מאה חמשים ,24,10,1220,1220.0,362,361.0,0.7564102564102564,0.8888888888888888,1,חמשים,5090000298,24,10
ref-sifre-n.62.1.38-ref-sifre-n.62.1.61,ref-bible.0310.7.8.6-ref-bible.0310.7.11.1,87089,87220,ref-sifre-n.62.1.38,ref-sifre-n.62.1.61,1404881,1404952,ref-bible.0310.7.8.6,ref-bible.0310.7.11.1,בני שפטיה שלש מאות שבעים ושנים בני ארח שש מאות חמשים ושנים בני שפטיה שלש מאות שבעים ושנים בני ארח שש מאות חמשים ושנים בני,ושנים בני שפטיה שלש מאות שבעים ושנים בני ארח שש מאות חמשים ושנים בני שפטיה שלש מאות שבעים ושנים בני ארח שש מאות חמשים ושנים בני,25,26,1225,1225.0,361,361.0,0.0472440944881889,0.0,25,בני שפטיה שלש מאות שבעים ושנים בני ארח שש מאות חמשים ושנים בני שפטיה שלש מאות שבעים ושנים בני ארח שש מאות חמשים ושנים בני,5090000299,25,26
ref-sifre-n.63.1.8-ref-sifre-n.63.1.18,ref-bible.0104.8.25.6-ref-bible.104.8.26.5,87300,87356,ref-sifre-n.63.1.8,ref-sifre-n.63.1.18,275138,275183,ref-bible.0104.8.25.6,ref-bible.0104.8.26.5,"עבודה במשמע ת""ל ולא יעבוד עוד ושרת את אחיו באהל מועד ",העבדה ולא יעבד עוד ושרת את אחיו באהל מועד ,11,9,378,378.0,364,364.0,0.2452830188679245,0.25,7,ולא עוד ושרת את אחיו באהל מועד,5090000300,11,9
ref-sifre-n.63.1.54-ref-sifre-n.63.1.67,ref-bible.0104.8.25.6-ref-bible.0104.8.26.13,87557,87632,ref-sifre-n.63.1.54,ref-sifre-n.63.1.67,275138,275225,ref-bible.0104.8.25.6,ref-bible.0104.8.26.13,ולא יעבד עוד ושרת את אחיו באהל מועד לשמר משמרת ועבדה לא יעבד ככה תעשה ללוים,העבדה ולא יעבד עוד ושרת את אחיו באהל מועד לשמר משמרת ועבדה לא יעבד ככה תעשה ללוים,16,17,379,379.0,365,365.0,0.074074074074074,0.0,16,ולא יעבד עוד ושרת את אחיו באהל מועד לשמר משמרת ועבדה לא יעבד ככה תעשה ללוים,5090000301,16,17
ref-sifre-n.63.1.106-ref-sifre-n.63.1.112,ref-bible.0103.27.5.2-ref-bible.103.27.5.8,87842,87873,ref-sifre-n.63.1.106,ref-sifre-n.63.1.112,250091,250121,ref-bible.0103.27.5.2,ref-bible.0103.27.5.8,מבן שלשים שנה ועד בן חמשים שנה ,מבן חמש שנים ועד בן עשרים שנה ,7,7,242,242.0,367,367.0,0.2903225806451613,0.5555555555555556,4,מבן ועד בן שנה,5090000302,7,7
ref-sifre-n.64.1.5-ref-sifre-n.64.1.14,ref-bible.0104.9.1.5-ref-bible.104.9.1.14,87974,88036,ref-sifre-n.64.1.5,ref-sifre-n.64.1.14,275254,275315,ref-bible.0104.9.1.5,ref-bible.0104.9.1.14,במדבר סיני בשנה השנית לצאתם מארץ מצרים בחדש הראשון לאמר ,במדבר סיני בשנה השנית לצאתם מארץ מצרים בחדש הראשון לאמר ,10,8,381,381.0,368,368.0,0.0357142857142857,0.3636363636363636,7,במדבר סיני בשנה השנית בחדש הראשון לאמר,5090000303,10,8
ref-sifre-n.64.1.42-ref-sifre-n.64.1.47,ref-bible.0104.1.1.5-ref-bible.104.1.1.11,88184,88218,ref-sifre-n.64.1.42,ref-sifre-n.64.1.47,252211,252250,ref-bible.0104.1.1.5,ref-bible.0104.1.1.11,במדבר סיני באהל מועד בחדש השני ,במדבר סיני באהל מועד באחד לחדש השני ,6,7,243,243.0,369,369.0,0.1388888888888889,0.1428571428571429,5,במדבר סיני באהל מועד השני,5090000304,6,7
ref-sifre-n.64.1.65-ref-sifre-n.64.1.79,ref-bible.0102.16.35.1-ref-bible.0102.16.35.16,88314,88385,ref-sifre-n.64.1.65,ref-sifre-n.64.1.79,139478,139548,ref-bible.0102.16.35.1,ref-bible.0102.16.35.16,ובני ישראל אכלו את המן ארבעים שנה עד באם אל ארץ נושבת את המן אכלו עד,ובני ישראל אכלו את המן ארבעים שנה עד באם אל ארץ נושבת את המן אכלו עד,16,16,66,65.0,370,370.0,0.0,0.0,16,ובני ישראל אכלו את המן ארבעים שנה עד באם אל ארץ נושבת את המן אכלו עד,5090000305,16,16
ref-sifre-n.64.2.21-ref-sifre-n.64.2.33,ref-bible.0205.6.38.18-ref-bible.0205.7.2.5,88546,88618,ref-sifre-n.64.2.21,ref-sifre-n.64.2.33,661572,661650,ref-bible.0205.6.38.18,ref-bible.0205.7.2.5,שלמה שלש עשרה שנה ויכל את כל ביתו ויבן את בית יער הלבנון,שנים ואת ביתו בנה שלמה שלש עשרה שנה ויכל את כל ביתו ויבן את בית יער הלבנון,11,15,1008,1008.0,372,372.0,0.2432432432432432,0.1666666666666666,11,שלמה שלש עשרה שנה ויכל את_כל_ביתו ויבן את בית יער הלבנון,5090000306,11,15
ref-sifre-n.64.2.27-ref-sifre-n.64.2.35,ref-bible.0205.9.10.1-ref-bible.205.9.10.10,88585,88628,ref-sifre-n.64.2.27,ref-sifre-n.64.2.35,672765,672813,ref-bible.0205.9.10.1,ref-bible.0205.9.10.10,ויהי מקץ עשרים שנה אשר בנה שלמה חרב הבית ,ויהי מקצה עשרים שנה אשר בנה שלמה את שני הבתים ,9,10,1012,1012.0,377,372.0,0.217391304347826,0.4,6,ויהי עשרים שנה אשר בנה שלמה,5090000307,9,10
ref-sifre-n.64.2.21-ref-sifre-n.64.2.35,ref-bible.0206.14.9.11-ref-bible.206.14.9.22,88546,88628,ref-sifre-n.64.2.21,ref-sifre-n.64.2.35,746317,746375,ref-bible.0206.14.9.11,ref-bible.0206.14.9.22,נבנה הבית התחילו מונים לבנינו שנאמר ויהי מקץ עשרים שנה אשר בנה שלמה חרב הבית ,אשר בלבנון שלח אל הארז אשר בלבנון לאמר תנה את בתך לבני ,15,12,1035,1035.0,373,372.0,0.7142857142857143,0.9047619047619048,1,אשר,5090000308,15,12
ref-sifre-n.64.2.27-ref-sifre-n.64.2.33,ref-bible.0313.8.1.1-ref-bible.313.8.1.7,88585,88618,ref-sifre-n.64.2.27,ref-sifre-n.64.2.33,1529099,1529132,ref-bible.0313.8.1.1,ref-bible.0313.8.1.7,ויהי מקץ עשרים שנה אשר בנה שלמה ,ויהי מקץ עשרים שנה אשר בנה שלמה ,7,7,1279,1279.0,376,372.0,0.0,0.0,7,ויהי מקץ עשרים שנה אשר בנה שלמה,5090000309,7,7
ref-sifre-n.64.2.21-ref-sifre-n.64.2.35,ref-bible.0313.25.18.11-ref-bible.313.25.18.22,88546,88628,ref-sifre-n.64.2.21,ref-sifre-n.64.2.35,1561775,1561833,ref-bible.0313.25.18.11,ref-bible.0313.25.18.22,נבנה הבית התחילו מונים לבנינו שנאמר ויהי מקץ עשרים שנה אשר בנה שלמה חרב הבית ,אשר בלבנון שלח אל הארז אשר בלבנון לאמר תנה את בתך לבני ,15,12,1283,1283.0,374,372.0,0.7142857142857143,0.9047619047619048,1,אשר,5090000310,15,12
ref-sifre-n.65.1.12-ref-sifre-n.65.1.22,ref-bible.0102.12.6.10-ref-bible.102.12.6.16,88867,88918,ref-sifre-n.65.1.12,ref-sifre-n.65.1.22,127525,127556,ref-bible.0102.12.6.10,ref-bible.0102.12.6.16,ושחטו אותו כל קהל עדת ישראל שומע אני בין בחול בין ,ושחטו אתו כל קהל עדת ישראל בין ,9,7,53,53.0,378,378.0,0.38,0.2222222222222222,6,ושחטו כל קהל עדת ישראל בין,5090000311,9,7
ref-sifre-n.67.1.63-ref-sifre-n.67.1.70,ref-bible.0102.32.26.1-ref-bible.102.32.26.8,90760,90802,ref-sifre-n.67.1.63,ref-sifre-n.67.1.70,172024,172068,ref-bible.0102.32.26.1,ref-bible.0102.32.26.8,ויעמוד משה בשער המחנה ויאמר מי לה' אלי ,ויעמד משה בשער המחנה ויאמר מי ליהוה אלי ,8,8,116,116.0,379,379.0,0.1,0.1428571428571429,6,משה בשער המחנה ויאמר מי אלי,5090000312,8,8
ref-sifre-n.67.1.72-ref-sifre-n.67.1.78,ref-bible.0201.5.4.18-ref-bible.201.5.5.6,90811,90848,ref-sifre-n.67.1.72,ref-sifre-n.67.1.78,418651,418686,ref-bible.0201.5.4.18,ref-bible.0201.5.5.6,ינצורו כי מולים היו כל העם היוצאים י,ממצרים כי מלים היו כל העם היצאים ,8,7,930,930.0,380,380.0,0.2222222222222222,0.3333333333333333,4,כי היו כל העם,5090000313,8,7
ref-sifre-n.68.1.1-ref-sifre-n.68.1.7,ref-bible.0104.9.6.1-ref-bible.104.9.6.7,90984,91019,ref-sifre-n.68.1.1,ref-sifre-n.68.1.7,275585,275620,ref-bible.0104.9.6.1,ref-bible.0104.9.6.7,ויהי אנשים אשר היו טמאים לנפש אדם ,ויהי אנשים אשר היו טמאים לנפש אדם ,7,7,383,383.0,381,381.0,0.0,0.0,7,ויהי אנשים אשר היו טמאים לנפש אדם,5090000314,7,7
ref-sifre-n.68.1.47-ref-sifre-n.68.1.57,ref-bible.0104.9.6.4-ref-bible.104.9.6.13,91220,91280,ref-sifre-n.68.1.47,ref-sifre-n.68.1.57,275601,275653,ref-bible.0104.9.6.4,ref-bible.0104.9.6.13,היו למת מצוה נטמאו שנאמר ולא יכלו לעשות הפסח ביום ההוא ,היו טמאים לנפש אדם ולא יכלו לעשת הפסח ביום ההוא ,11,10,384,383.0,382,382.0,0.3090909090909091,0.5833333333333333,6,היו ולא יכלו הפסח ביום ההוא,5090000315,11,10
ref-sifre-n.69.1.11-ref-sifre-n.69.1.22,ref-bible.0104.9.10.6-ref-bible.104.9.10.14,92651,92704,ref-sifre-n.69.1.11,ref-sifre-n.69.1.22,275892,275931,ref-bible.0104.9.10.6,ref-bible.0104.9.10.14,איש איש כי יהיה טמא לנפש זה דבר ששאל או בדרך רחוקה ,איש איש כי יהיה טמא לנפש או בדרך רחקה ,12,9,385,385.0,383,383.0,0.2549019607843137,0.375,8,איש איש כי יהיה טמא לנפש או בדרך,5090000316,12,9
ref-sifre-n.69.1.52-ref-sifre-n.69.1.67,ref-bible.0207.22.11.7-ref-bible.207.22.11.15,92827,92906,ref-sifre-n.69.1.52,ref-sifre-n.69.1.67,804396,804444,ref-bible.0207.22.11.7,ref-bible.0207.22.11.15,רחוקה ולא ראי דרך רחוקה כראי טמא מת הצד השוה שבהן שלא עשה את הראשון ועשה ,הישנה ולא הבטתם אל עשיה ויצרה מרחוק לא ראיתם ,16,9,1046,1046.0,384,384.0,0.7397260273972602,0.8125,1,ולא,5090000317,16,9
ref-sifre-n.69.2.42-ref-sifre-n.69.2.46,ref-bible.0101.18.9.1-ref-bible.101.18.9.5,93748,93773,ref-sifre-n.69.2.42,ref-sifre-n.69.2.46,28457,28482,ref-bible.0101.18.9.1,ref-bible.0101.18.9.5,ויאמרו אליו איה שרה אשתך ,ויאמרו אליו איה שרה אשתך ,5,5,9,9.0,385,385.0,0.0,0.0,5,ויאמרו אליו איה שרה אשתך,5090000318,5,5
ref-sifre-n.69.2.90-ref-sifre-n.69.2.99,ref-bible.0101.37.11.3-ref-bible.0101.37.12.6,94007,94057,ref-sifre-n.69.2.90,ref-sifre-n.69.2.99,74228,74283,ref-bible.0101.37.11.3,ref-bible.0101.37.12.6,הדבר וילכו אחיו לרעות את צאן אביהם,אחיו ואביו שמר את הדבר וילכו אחיו לרעות את צאן אביהם,7,11,22,22.0,386,386.0,0.3461538461538461,0.2222222222222222,7,הדבר וילכו אחיו לרעות את צאן אביהם,5090000319,7,11
ref-sifre-n.69.2.91-ref-sifre-n.69.2.102,ref-bible.0209.34.8.16-ref-bible.209.34.10.10,94014,94072,ref-sifre-n.69.2.91,ref-sifre-n.69.2.102,1045628,1045778,ref-bible.0209.34.8.16,ref-bible.0209.34.10.10,אחיו לרעות את צאן אביהם שלא הלכו אלא לרעות את עצמם כיוצא ,חית השדה מאין רעה ולא דרשו רעי את צאני וירעו הרעים אותם ואת צאני לא רעו לכן הרעים שמעו דבר יהוה כה אמר אדני יהוה הנני אל הרעים ודרשתי את צאני ,12,26,1117,1117.0,388,386.0,0.7535211267605634,0.8636363636363636,2,את את,5090000320,12,26
ref-sifre-n.69.2.104-ref-sifre-n.69.2.109,ref-bible.0104.21.30.6-ref-bible.104.21.30.11,94076,94102,ref-sifre-n.69.2.104,ref-sifre-n.69.2.109,303836,303862,ref-bible.0104.21.30.6,ref-bible.0104.21.30.11,ונשים עד נפח אשר עד מידבא ,ונשים עד נפח אשר עד מידבא ,6,6,635,635.0,389,389.0,0.0,0.0,6,ונשים עד נפח אשר עד מידבא,5090000321,6,6
ref-sifre-n.69.2.147-ref-sifre-n.69.2.154,ref-bible.0105.29.28.1-ref-bible.105.29.28.8,94289,94338,ref-sifre-n.69.2.147,ref-sifre-n.69.2.154,400487,400537,ref-bible.0105.29.28.1,ref-bible.0105.29.28.8,הנסתרות לה' אלהינו והנגלות לנו ולבנינו עד עולם ,הנסתרת ליהוה אלהינו והנגלת לנו ולבנינו עד עולם ,8,8,912,912.0,390,390.0,0.1063829787234042,0.125,5,אלהינו לנו ולבנינו עד עולם,5090000322,8,8
ref-sifre-n.69.2.234-ref-sifre-n.69.2.239,ref-bible.0103.19.37.3-ref-bible.103.19.37.9,94766,94800,ref-sifre-n.69.2.234,ref-sifre-n.69.2.239,232742,232775,ref-bible.0103.19.37.3,ref-bible.0103.19.37.9,ככל חקותיו וככל משפטיו יעשו אותו ,כל חקתי ואת כל משפטי ועשיתם אתם ,6,7,221,221.0,391,391.0,0.3939393939393939,0.6666666666666667,0,,5090000323,6,7
ref-sifre-n.69.2.234-ref-sifre-n.69.2.239,ref-bible.0103.20.22.3-ref-bible.103.20.22.9,94766,94800,ref-sifre-n.69.2.234,ref-sifre-n.69.2.239,234368,234401,ref-bible.0103.20.22.3,ref-bible.0103.20.22.9,ככל חקותיו וככל משפטיו יעשו אותו ,כל חקתי ואת כל משפטי ועשיתם אתם ,6,7,222,222.0,392,391.0,0.3939393939393939,0.6666666666666667,0,,5090000324,6,7
ref-sifre-n.69.2.234-ref-sifre-n.69.2.239,ref-bible.0104.9.3.11-ref-bible.104.9.3.16,94766,94800,ref-sifre-n.69.2.234,ref-sifre-n.69.2.239,275406,275438,ref-bible.0104.9.3.11,ref-bible.0104.9.3.16,ככל חקותיו וככל משפטיו יעשו אותו ,ככל חקתיו וככל משפטיו תעשו אתו ,6,6,382,382.0,393,391.0,0.0909090909090909,0.2857142857142857,3,ככל וככל משפטיו,5090000325,6,6
ref-sifre-n.70.1.139-ref-sifre-n.71.1.4,ref-bible.0104.9.13.23-ref-bible.104.9.14.4,95829,95868,ref-sifre-n.70.1.139,ref-sifre-n.71.1.4,276215,276244,ref-bible.0104.9.13.23,ref-bible.0104.9.14.4,ההיא להביא את האישה וכי יגור אתכם גר ,האיש ההוא וכי יגור אתכם גר ,8,6,386,386.0,394,394.0,0.3783783783783784,0.3333333333333333,4,וכי יגור אתכם גר,5090000326,8,6
ref-sifre-n.72.1.108-ref-sifre-n.72.1.135,ref-bible.0105.10.1.13-ref-bible.105.10.2.1,96780,96900,ref-sifre-n.72.1.108,ref-sifre-n.72.1.135,360511,360545,ref-bible.0105.10.1.13,ref-bible.0105.10.2.1,"אלי פסל לך ועשית לך ארון עץ ולא היה אלא משל צבור שנאמר ועשו ארון עצי שטים הא מה ת""ל אף קח לך עשה לך בשל צבור הכתוב ",אלי ההרה ועשית לך ארון עץ ואכתב ,26,7,878,878.0,395,395.0,0.7565217391304347,0.625,5,אלי ועשית לך ארון עץ,5090000327,26,7
ref-sifre-n.73.1.1-ref-sifre-n.73.1.16,ref-bible.0104.10.3.1-ref-bible.104.10.4.6,96995,97082,ref-sifre-n.73.1.1,ref-sifre-n.73.1.16,277148,277235,ref-bible.0104.10.3.1,ref-bible.0104.10.4.6,ותקעו בהן ונועדו אליך כל העדה אל פתח אהל מועד ואם באחת יתקעו ונועדו אליך הנשיאים ,ותקעו בהן ונועדו אליך כל העדה אל פתח אהל מועד ואם באחת יתקעו ונועדו אליך הנשיאים ,14,13,392,390.0,396,396.0,0.0123456790123456,0.1818181818181817,12,ותקעו בהן ונועדו אליך כל העדה ואם באחת יתקעו ונועדו אליך הנשיאים,5090000328,14,13
ref-sifre-n.73.1.82-ref-sifre-n.73.1.90,ref-bible.0102.34.31.1-ref-bible.102.34.31.9,97444,97496,ref-sifre-n.73.1.82,ref-sifre-n.73.1.90,176824,176873,ref-bible.0102.34.31.1,ref-bible.0102.34.31.9,ויקרא אליהם משה וישובו אליו אהרן וכל הנשיאים בעדה ,ויקרא אלהם משה וישבו אליו אהרן וכל הנשאים בעדה ,9,9,128,128.0,397,397.0,0.06,0.0,6,ויקרא משה אליו אהרן וכל בעדה,5090000329,9,9
ref-sifre-n.73.2.25-ref-sifre-n.73.2.32,ref-bible.0104.10.7.1-ref-bible.104.10.8.4,97848,97892,ref-sifre-n.73.2.25,ref-sifre-n.73.2.32,277361,277419,ref-bible.0104.10.7.1,ref-bible.0104.10.8.4,ובהקהיל את הקהל תתקעו ולא תריעו הרי תקיעה ,ובהקהיל את הקהל תתקעו ולא תריעו ובני אהרן הכהנים יתקעו ,8,8,396,394.0,398,398.0,0.2909090909090909,0.2222222222222222,6,ובהקהיל את הקהל תתקעו ולא תריעו,5090000330,8,8
ref-sifre-n.73.3.1-ref-sifre-n.73.3.25,ref-bible.0104.10.5.1-ref-bible.104.10.6.10,98966,99127,ref-sifre-n.73.3.1,ref-sifre-n.73.3.25,277252,277360,ref-bible.0104.10.5.1,ref-bible.0104.10.6.10,"ותקעתם תרועה ונסעו המחנות החונים קדמה ותקעתם תרועה ונסעו המחנות החונים תימנה או כשם שתוקע למזרח ולדרום כך תוקע לצפון ולמערב ת""ל תרועה יתקעו למסעיהם ",ותקעתם תרועה ונסעו המחנות החנים קדמה ותקעתם תרועה שנית ונסעו המחנות החנים תימנה תרועה יתקעו למסעיהם ,25,16,394,394.0,399,399.0,0.3918918918918919,0.5,13,ותקעתם תרועה ונסעו המחנות קדמה ותקעתם תרועה ונסעו המחנות תימנה תרועה יתקעו למסעיהם,5090000331,25,16
ref-sifre-n.74.1.9-ref-sifre-n.74.1.19,ref-bible.0104.10.2.9-ref-bible.104.10.3.4,99204,99267,ref-sifre-n.74.1.9,ref-sifre-n.74.1.19,277108,277171,ref-bible.0104.10.2.9,ref-bible.0104.10.3.4,ותקעו בהן ונועדו אליך והיו לך למקרא העדה ולמסע את המחנות ,והיו לך למקרא העדה ולמסע את המחנות ותקעו בהן ונועדו אליך ,11,11,391,390.0,400,400.0,0.7719298245614035,0.0,7,והיו לך למקרא העדה ולמסע את המחנות,5090000332,11,11
