baseOrig,compOrig,baseCharStart,baseCharEnd,baseRefStart,baseRefEnd,compCharStart,compCharEnd,compRefStart,compRefEnd,baseStr,compStr,bRange,cRange,compOrder,grp-ref-sifre-n,baseOrder,grp-ref-mek,dam-lev,jac,lcs_len_char,lcs_str_char,lcc_distance,id
ref-mek.1.1.1.18-ref-mek.1.1.1.26,ref-sifre-n.58.1.177-ref-sifre-n.58.1.187,90,131,ref-mek.1.1.1.18,ref-mek.1.1.1.26,82592,82650,ref-sifre-n.58.1.177,ref-sifre-n.58.1.187,דבר ה' ביד משה לו ואחת במצרים ויהי ביום דבר ה'_אל_משה,דבר ה' ביד משה לו ואחת במצרים ויהי ביום דבר ה'_אל_משה,11,11,266,266.0,1,1.0,0.0,0.0,53,דבר ה' ביד משה לו ואחת במצרים ויהי ביום דבר ה'_אל_משה,0.0,3050000001
ref-mek.1.1.1.13-ref-mek.1.1.1.26,ref-sifre-n.99.1.98-ref-sifre-n.99.1.114,58,131,ref-mek.1.1.1.13,ref-mek.1.1.1.26,135781,135872,ref-sifre-n.99.1.98,ref-sifre-n.99.1.114,הדבר לאהרן ולמשה כשהוא אומר ויהי ביום דבר ה'_אל_משה למשה היה הדבר ,ולא שהיה ברוך רגיל לדבר בפני ירמיה אלא מפני צורך ותדבר מרים ואהרן במשה מנין היתה מרים ,12,17,431,431.0,0,0.0,0.6976744186046512,0.7647058823529411,34,הבר ר למה אא י ו דבר מה משה היה ר ,0.6046511627906976,3050000002
ref-mek.1.1.1.40-ref-mek.1.1.1.49,ref-sifre-n.123.1.188-ref-sifre-n.123.1.197,189,240,ref-mek.1.1.1.40,ref-mek.1.1.1.49,205927,205974,ref-sifre-n.123.1.188,ref-sifre-n.123.1.197,שכשם שהיה משה כלל לדברות כך היה אהרן כלל לדברות ,וכשם שהיה משה גזבר לדבר כך היה אהרן גזבר לדבר ,10,10,709,709.0,3,3.0,0.2708333333333333,0.6666666666666667,37,כשם שהיה משה  לדבר כך היה אהרן  לדבר ,0.22916666666666663,3050000003
ref-mek.1.1.1.372-ref-mek.1.1.1.377,ref-sifre-n.118.1.1063-ref-sifre-n.118.1.1068,1896,1921,ref-mek.1.1.1.372,ref-mek.1.1.1.377,194217,194242,ref-sifre-n.118.1.1063,ref-sifre-n.118.1.1068,ברית מלח עולם היא לפני ה' ,ברית מלח עולם היא לפני ה' ,6,6,670,670.0,4,4.0,0.0,0.0,26,ברית מלח עולם היא לפני ה' ,0.0,3050000004
ref-mek.1.1.1.814-ref-mek.1.1.1.828,ref-sifre-n.84.4.164-ref-sifre-n.84.4.178,4170,4238,ref-mek.1.1.1.814,ref-mek.1.1.1.828,114899,114971,ref-sifre-n.84.4.164,ref-sifre-n.84.4.178,אם ככה את עושה לי הרגני נא הרוג אם מצאתי חן בעיניך ואל אראה ברעתי ,ואם ככה את עושה לי הרגני נא הרוג ואם מצאתי חן בעיניך ואל אראה ברעתי ,15,15,386,386.0,7,5.0,0.029411764705882353,0.0,66,אם ככה את עושה לי הרגני נא הרוג אם מצאתי חן בעיניך ואל אראה ברעתי ,0.02941176470588236,3050000005
ref-mek.1.1.1.814-ref-mek.1.1.1.821,ref-sifre-n.91.1.73-ref-sifre-n.91.1.80,4170,4201,ref-mek.1.1.1.814,ref-mek.1.1.1.821,127775,127806,ref-sifre-n.91.1.73,ref-sifre-n.91.1.80,אם ככה את עושה לי הרגני נא הרוג ,אם ככה את עושה לי הרגני נא הרוג ,8,8,418,418.0,5,5.0,0.0,0.0,32,אם ככה את עושה לי הרגני נא הרוג ,0.0,3050000006
ref-mek.1.1.1.814-ref-mek.1.1.1.821,ref-sifre-n.91.1.133-ref-sifre-n.91.1.140,4170,4201,ref-mek.1.1.1.814,ref-mek.1.1.1.821,128082,128113,ref-sifre-n.91.1.133,ref-sifre-n.91.1.140,אם ככה את עושה לי הרגני נא הרוג ,אם ככה את עושה לי הרגני נא הרוג ,8,8,419,419.0,6,5.0,0.0,0.0,32,אם ככה את עושה לי הרגני נא הרוג ,0.0,3050000007
ref-mek.1.2.1.20-ref-mek.1.2.1.28,ref-sifre-n.61.1.13-ref-sifre-n.61.1.22,6671,6713,ref-mek.1.2.1.20,ref-mek.1.2.1.28,85626,85675,ref-sifre-n.61.1.13,ref-sifre-n.61.1.22,ר'_עקיבא_אומר זה אחד מג' דברים שנתקשה משה ,ר'_עקיבא_אומר זה אחד משלשה דברים שנתקשה בהם משה ,7,8,274,274.0,8,8.0,0.16666666666666666,0.33333333333333337,40,ר'_עקיבא_אומר זה אחד מ דברים שנתקשה משה ,0.16666666666666663,3050000008
ref-mek.1.2.1.155-ref-mek.1.2.1.170,ref-sifre-n.145.2.24-ref-sifre-n.145.2.50,7370,7457,ref-mek.1.2.1.155,ref-mek.1.2.1.170,258782,258931,ref-sifre-n.145.2.24,ref-sifre-n.145.2.50,חדש ניסן ראש חדשים מגיד שניסן ראש לחדשים ומנין אף למלכים תלמוד לומר הוא החדש השני ,"חודש בחדשו מגיד שאם עבר היום בטל קרבנו לחדשי השנה למה_נאמר_לפי_שהוא_אומר ובראשי חדשיכם תקריבו עולה לה' שומעני מיעוט חדשים שנים ת""ל לחדשי השנה ",16,23,815,815.0,9,9.0,0.6901408450704225,0.8518518518518519,50,חדש חדש מגיד שי ר לחדשי מני א ים תו לומ ו חדש שני ,0.647887323943662,3050000009
ref-mek.1.2.1.242-ref-mek.1.2.1.254,ref-sifre-n.108.1.19-ref-sifre-n.108.1.25,7868,7935,ref-mek.1.2.1.242,ref-mek.1.2.1.254,154604,154646,ref-sifre-n.108.1.19,ref-sifre-n.108.1.25,מנה בו אדם הראשון אתה אומר לכם ולא מנה בו אדם הראשון או_אינו_אלא ,מין הדמים אתה אומר מין הדמים או_אינו_אלא ,13,7,480,480.0,10,10.0,0.5538461538461539,0.5555555555555556,31,מ דם אתה אומר מ דם או_אינו_אלא ,0.523076923076923,3050000010
ref-mek.1.2.2.3-ref-mek.1.2.2.16,ref-sifre-n.145.2.32-ref-sifre-n.145.2.50,8467,8565,ref-mek.1.2.2.3,ref-mek.1.2.2.16,258824,258931,ref-sifre-n.145.2.32,ref-sifre-n.145.2.50,"לחדשי השנה למה_נאמר_לפי_שהוא_אומר ובראשי חדשיכם תקריבו עולה לה' שומעני מיעוט חדשים שנים ת""ל לחדשי השנה","לחדשי השנה למה_נאמר_לפי_שהוא_אומר ובראשי חדשיכם תקריבו עולה לה' שומעני מיעוט חדשים שנים ת""ל לחדשי השנה",15,15,816,816.0,11,11.0,0.0,0.0,102,"לחדשי השנה למה_נאמר_לפי_שהוא_אומר ובראשי חדשיכם תקריבו עולה לה' שומעני מיעוט חדשים שנים ת""ל לחדשי השנה",0.0,3050000011
ref-mek.1.4.1.12-ref-mek.1.4.1.31,ref-sifre-n.157.9.132-ref-sifre-n.157.9.153,9923,10023,ref-mek.1.4.1.12,ref-mek.1.4.1.31,282011,282114,ref-sifre-n.157.9.132,ref-sifre-n.157.9.153,מדברים היו_והלא_כבר_נאמר ואתה תדבר אל_בני_ישראל לאמר ומה_תלמוד_לומר דברו אלא כשהיה משה מדבר היה ,לדבר שכשיפטר משה מן העולם לא יהיו אומרים לו בחיי משה רבך לא היתה מדבר עכשיו מה אתה מדבר ר' יאשיה אמר ,13,22,877,877.0,13,13.0,0.7623762376237624,0.7777777777777778,46,דבר כרמ ואה ר לביישר לא הת דבר כשי מה מדבר יה ,0.5445544554455446,3050000012
ref-mek.1.4.2.107-ref-mek.1.4.2.134,ref-sifre-n.153.4.254-ref-sifre-n.153.4.277,11756,11907,ref-mek.1.4.2.107,ref-mek.1.4.2.134,266664,266792,ref-sifre-n.153.4.254,ref-sifre-n.153.4.277,בית אביה ברשות אביה אתה אומר בית אביה ברשות אביה או בית אביה כמשמעו תלמוד לומר בנעוריה בית אביה שכל נעוריה בבית אביה אמרתי,בית אביה ברשות אביה אתה אומר בית אביה ברשות אביה או בית אביה כמשמעו תלמוד לומר בנעוריה בית אביה שכל נעוריה בבית אביה אמרתי,24,24,838,838.0,15,15.0,0.0,0.0,122,בית אביה ברשות אביה אתה אומר בית אביה ברשות אביה או בית אביה כמשמעו תלמוד לומר בנעוריה בית אביה שכל נעוריה בבית אביה אמרתי,0.0,3050000013
ref-mek.1.4.2.107-ref-mek.1.4.2.117,ref-sifre-n.156.3.19-ref-sifre-n.156.3.36,11756,11823,ref-mek.1.4.2.107,ref-mek.1.4.2.117,276242,276346,ref-sifre-n.156.3.19,ref-sifre-n.156.3.36,לבית אבות אין לבית אבות אלא למשפחות שנאמר למשפחותם לבית אבותם ,האב לבעל ואת הבעל לאב בכל מדות שאמרנו בנעוריה בית אביה נעוריה בבית אביה אמרתי ולא נעוריה בבית ,11,18,851,851.0,14,14.0,0.7127659574468085,0.875,34,אב לב ות לא למות שאמר ות בית אבות ,0.6382978723404256,3050000014
ref-mek.1.5.1.38-ref-mek.1.5.1.51,ref-sifre-n.107.2.139-ref-sifre-n.107.2.150,13306,13373,ref-mek.1.5.1.38,ref-mek.1.5.1.51,148427,148483,ref-sifre-n.107.2.139,ref-sifre-n.107.2.150,עולה חמורה כשרה לבא כל שנתה כבת שנתה פסח שהוא קל אינו דין שיוכשר ,עולת חמורה כשרה לבא_מין_אחד פסח הקל אינו דין הוא שיכשר ,14,10,472,470.0,17,17.0,0.4153846153846154,0.5333333333333333,42,עול חמורה כשרה לבא פסח הקל אינו דין שיכשר ,0.3538461538461538,3050000015
ref-mek.1.5.1.66-ref-mek.1.5.1.113,ref-sifre-n.107.2.117-ref-sifre-n.107.2.141,13444,13686,ref-mek.1.5.1.66,ref-mek.1.5.1.113,148311,148442,ref-sifre-n.107.2.117,ref-sifre-n.107.2.141,"מן הכבשים ומן העזים תקחו מזה בפ""ע ומזה בפ""ע או יביא משניהם כאחת ת""ל ואם מן הצאן קרבנו והרי דברים ק""ו ומה עולת חמורה כשרה","מן הכבשים ומן העזים תקחו מזה בפ""ע ומזה בפ""ע או יביא משניהם כאחת ת""ל ואם מן הצאן קרבנו והרי דברים ק""ו ומה עולת חמורה כשרה",25,25,470,470.0,18,18.0,0.0,0.0,120,"מן הכבשים ומן העזים תקחו מזה בפ""ע ומזה בפ""ע או יביא משניהם כאחת ת""ל ואם מן הצאן קרבנו והרי דברים ק""ו ומה עולת חמורה כשרה",0.0,3050000016
ref-mek.1.5.2.159-ref-mek.1.5.2.180,ref-sifre-n.58.1.48-ref-sifre-n.58.1.74,14531,14650,ref-mek.1.5.2.159,ref-mek.1.5.2.180,81986,82120,ref-sifre-n.58.1.48,ref-sifre-n.58.1.74,"כתובים זו מדה בתורה שני כתובים זה כנגד זה והרי הם סותרים זה את זה יתקימו במקומם עד שיבא כתוב אחר ויכריע ביניהם ומה ת""ל","יתקימו שני כתובים זו מדה בתורה שני כתובים זה כנגד זה והרי הם סותרים זה את זה יתקימו במקומם עד שיבא כתוב אחר ויכריע ביניהם ומה ת""ל",25,27,264,264.0,20,20.0,0.08527131782945736,0.0,118,"כתובים זו מדה בתורה שני כתובים זה כנגד זה והרי הם סותרים זה את זה יתקימו במקומם עד שיבא כתוב אחר ויכריע ביניהם ומה ת""ל",0.0852713178294574,3050000017
ref-mek.1.6.1.296-ref-mek.1.6.1.337,ref-sifre-n.111.1.35-ref-sifre-n.111.1.68,16600,16812,ref-mek.1.6.1.296,ref-mek.1.6.1.337,159833,160013,ref-sifre-n.111.1.35,ref-sifre-n.111.1.68,מכל בכל מצוות האמורות בתורה תלמוד לומר והיה אם מעיני העדה נעשתה לשגגה,"תשגו ולא תעשו את כל המצות האלה בע""ג הכתוב_מדבר_אתה_אומר בע""ג או_אינו_אלא באחד מכל בכל מצוות האמורות בתורה תלמוד לומר והיה אם מעיני העדה נעשתה לשגגה ייחד הכתוב מצוה זו",13,29,512,512.0,22,22.0,0.5843373493975904,0.5217391304347826,69,מכל בכל מצוות האמורות בתורה תלמוד לומר והיה אם מעיני העדה נעשתה לשגגה,0.5843373493975903,3050000018
ref-mek.1.6.1.319-ref-mek.1.6.1.367,ref-sifre-n.111.1.78-ref-sifre-n.111.1.155,16717,16971,ref-mek.1.6.1.319,ref-mek.1.6.1.367,160055,160456,ref-sifre-n.111.1.78,ref-sifre-n.111.1.155,"או_אינו_אלא אחת מכל מצות האמורות בתורה תלמוד לומר וכי תשגו ולא תעשו את כל המצות באו כל המצות ללמד על מצויה אחת מה העובר על כל המצות פורק עול ומפר ברית ומגלה פנים בתורה אף מצוה אחת שעובר עליה פורק עול ומפר ברית ומגלה פנים בתורה ואיזה זה ע""ג שפורק עול ומפר ברית אף העובר על מצוה אחת פורק עול ומפר ברית ומגלה פנים בתורה שנאמר לעבור בריתו ואין ברית אלא תורה שנאמר אלה דברי הברית","או_אינו_אלא אחת מכל מצות האמורות בתורה תלמוד לומר וכי תשגו ולא תעשו את כל המצות באו כל המצות ללמד על מצויה אחת מה העובר על כל המצות פורק עול ומפר ברית ומגלה פנים בתורה אף מצוה אחת שעובר עליה פורק עול ומפר ברית ומגלה פנים בתורה ואיזה זה ע""ג שפורק עול ומפר ברית אף העובר על מצוה אחת פורק עול ומפר ברית ומגלה פנים בתורה שנאמר לעבור בריתו ואין ברית אלא תורה שנאמר אלה דברי הברית",76,76,521,521.0,26,26.0,0.0,0.0,374,"או_אינו_אלא אחת מכל מצות האמורות בתורה תלמוד לומר וכי תשגו ולא תעשו את כל המצות באו כל המצות ללמד על מצויה אחת מה העובר על כל המצות פורק עול ומפר ברית ומגלה פנים בתורה אף מצוה אחת שעובר עליה פורק עול ומפר ברית ומגלה פנים בתורה ואיזה זה ע""ג שפורק עול ומפר ברית אף העובר על מצוה אחת פורק עול ומפר ברית ומגלה פנים בתורה שנאמר לעבור בריתו ואין ברית אלא תורה שנאמר אלה דברי הברית",0.0,3050000019
ref-mek.1.6.1.296-ref-mek.1.6.1.309,ref-sifre-n.111.1.287-ref-sifre-n.111.2.11,16600,16677,ref-mek.1.6.1.296,ref-mek.1.6.1.309,161158,161229,ref-sifre-n.111.1.287,ref-sifre-n.111.2.11,כל המצות שנאמר והיה אם מעיני העדה נעשתה בשגגה יחד הכתוב מצוה זה ואמרה ,בכל התורה והיה אם מעיני העדה נעשתה לשגגה יחד הכתוב מצוה זו אמורה ,14,13,526,526.0,23,22.0,0.2,0.33333333333333337,59,כל התר והיה אם מעיני העדה נעשתה שגגה יחד הכתוב מצוה זואמרה ,0.15714285714285714,3050000020
ref-mek.1.6.1.545-ref-mek.1.6.1.576,ref-sifre-n.142.2.69-ref-sifre-n.142.2.93,17904,18081,ref-mek.1.6.1.545,ref-mek.1.6.1.576,253128,253259,ref-sifre-n.142.2.69,ref-sifre-n.142.2.93,עליהם תשמרו נאמרה כאן שמירה ונאמר להלן שמות יב שמירה מה שמירה האמורה להלן מבקרו ד' ימים קודם שחיטתו אף שמירה האמורה כאן מבקרו ד',עליהם תשמרו נאמרה כאן שמירה ונאמר להלן שמות יב שמירה מה שמירה האמורה להלן מבקרו ד' ימים קודם שחיטתו אף שמירה האמורה כאן מבקרו ד',25,25,776,775.0,29,29.0,0.0,0.0,128,עליהם תשמרו נאמרה כאן שמירה ונאמר להלן שמות יב שמירה מה שמירה האמורה להלן מבקרו ד' ימים קודם שחיטתו אף שמירה האמורה כאן מבקרו ד',0.0,3050000021
ref-mek.1.6.1.699-ref-mek.1.6.1.705,ref-sifre-n.1.2.167-ref-sifre-n.1.2.174,18714,18748,ref-mek.1.6.1.699,ref-mek.1.6.1.705,1116,1154,ref-sifre-n.1.2.167,ref-sifre-n.1.2.174,ואמרת אליהם את קרבני לחמי וגו' אם ,ואמרת אלהם את קרבני לחמי לאשי הא אין ,7,8,0,0.0,35,31.0,0.2702702702702703,0.4444444444444444,28,ואמרת אלהם את קרבני לחמי  א ,0.2432432432432432,3050000022
ref-mek.1.6.1.659-ref-mek.1.6.1.670,ref-sifre-n.23.1.251-ref-sifre-n.23.1.265,18525,18583,ref-mek.1.6.1.659,ref-mek.1.6.1.670,35839,35911,ref-sifre-n.23.1.251,ref-sifre-n.23.1.265,בשאר כל הימים חוץ מן השבת או אף בשבת תלמוד לומר ויעשו ,בשאר כל אדם חוץ מן הנזיר או אף בנזיר תלמוד לומר מיין_ושכר_יזיר לעשות ,12,13,103,103.0,34,31.0,0.391304347826087,0.5,44,בשאר כל ם חוץ מן ה או אף ב תלמוד לומר ויעשו ,0.3623188405797102,3050000023
ref-mek.1.6.1.726-ref-mek.1.6.1.734,ref-sifre-n.25.1.640-ref-sifre-n.25.1.649,18854,18906,ref-mek.1.6.1.726,ref-mek.1.6.1.734,42839,42889,ref-sifre-n.25.1.640,ref-sifre-n.25.1.649,להקיש ולדון נאמר כאן במועדו ונאמר להלן במועדו מה ,להקיש גזירה שווה נאמר כאן נזיר ונאמר להלן נזיר מה ,9,10,117,111.0,39,31.0,0.42,0.5,34,להקיש וו נאמר כאן  ונאמר להלן  מה ,0.31999999999999995,3050000024
ref-mek.1.6.1.726-ref-mek.1.6.1.734,ref-sifre-n.26.1.404-ref-sifre-n.26.1.413,18854,18906,ref-mek.1.6.1.726,ref-mek.1.6.1.734,45320,45368,ref-sifre-n.26.1.404,ref-sifre-n.26.1.413,להקיש ולדון נאמר כאן במועדו ונאמר להלן במועדו מה ,"להקיש ולדון ג""ש נאמר כאן אמו ונאמר להלן אמו מה ",9,10,129,124.0,40,31.0,0.24489795918367346,0.33333333333333337,41,להקיש ולדון נאמר כאן מו ונאמר להלן מו מה ,0.16326530612244894,3050000025
ref-mek.1.6.1.725-ref-mek.1.6.1.734,ref-sifre-n.30.1.827-ref-sifre-n.30.1.839,18850,18906,ref-mek.1.6.1.725,ref-mek.1.6.1.734,53438,53502,ref-sifre-n.30.1.827,ref-sifre-n.30.1.839,אלא להקיש ולדון נאמר כאן במועדו ונאמר להלן במועדו מה ,אלא מופנה להקיש לדון גזירה שוה נאמר כאן נזיר ונאמר להלן נזיר מה ,10,13,159,159.0,37,31.0,0.453125,0.5384615384615384,40,אלא להקיש לדון נאמר כאן  ונאמר להלן  מה ,0.375,3050000026
ref-mek.1.6.1.725-ref-mek.1.6.1.734,ref-sifre-n.31.3.317-ref-sifre-n.31.3.329,18850,18906,ref-mek.1.6.1.725,ref-mek.1.6.1.734,57180,57244,ref-sifre-n.31.3.317,ref-sifre-n.31.3.329,אלא להקיש ולדון נאמר כאן במועדו ונאמר להלן במועדו מה ,אלא מופנה להקיש לדון גזירה שוה נאמר כאן נזיר ונאמר להלן נזיר מה ,10,13,170,170.0,38,31.0,0.453125,0.5384615384615384,40,אלא להקיש לדון נאמר כאן  ונאמר להלן  מה ,0.375,3050000027
ref-mek.1.6.1.635-ref-mek.1.6.1.747,ref-sifre-n.65.1.12-ref-sifre-n.65.1.120,18401,18965,ref-mek.1.6.1.635,ref-mek.1.6.1.747,88867,89414,ref-sifre-n.65.1.12,ref-sifre-n.65.1.120,"בחול בין בשבת ומה אני מקים מחלליה מות יומת בשאר כל המלאכות חוץ משחיטת הפסח או אף בשחיטת הפסח ומה_אני_מקיים תשחטו אותו בשאר כל הימים חוץ מן השבת או אף בשבת ת""ל ויעשו במועדו דברי_ר'_יאשיה אמר לו ר' יונתן ממשמע הזה עדיין לא שמענו נם לו רבי יאשיה מפני שהוא אומר צו_את_בני_ישראל את קרבני לחמי וכו' אם ללמד על התמיד שדוחה שבת אינו_צריך_שהרי_כבר_נאמר וביום השבת שני כבשים בני שנה ומה ת""ל במועדו אלא מופנה להקיש לדון הימנו גזרה שוה נאמר כאן במועדו ונאמר להלן במועדו מה מועדו האמור כאן","ושחטו אותו כל קהל עדת ישראל שומע_אני_בין בחול בין בשבת ומה אני מקים מחלליה מות יומת בשאר כל המלאכות חוץ משחיטת הפסח או אף בשחיטת הפסח ומה_אני_מקיים תשחטו אותו בשאר כל הימים חוץ מן השבת או אף בשבת ת""ל ויעשו במועדו דברי_ר'_יאשיה אמר לו ר' יונתן ממשמע הזה עדיין לא שמענו נם לו רבי יאשיה מפני שהוא אומר צו_את_בני_ישראל את קרבני לחמי וכו' אם ללמד על התמיד שדוחה שבת אינו_צריך_שהרי_כבר_נאמר וביום השבת שני כבשים בני שנה ומה ת""ל במועדו אלא מופנה להקיש לדון הימנו גזרה שוה נאמר כאן במועדו ונאמר להלן במועדו מה מועדו האמור כאן",89,96,283,283.0,32,32.0,0.07930367504835589,0.0892857142857143,476,"בחול בין בשבת ומה אני מקים מחלליה מות יומת בשאר כל המלאכות חוץ משחיטת הפסח או אף בשחיטת הפסח ומה_אני_מקיים תשחטו אותו בשאר כל הימים חוץ מן השבת או אף בשבת ת""ל ויעשו במועדו דברי_ר'_יאשיה אמר לו ר' יונתן ממשמע הזה עדיין לא שמענו נם לו רבי יאשיה מפני שהוא אומר צו_את_בני_ישראל את קרבני לחמי וכו' אם ללמד על התמיד שדוחה שבת אינו_צריך_שהרי_כבר_נאמר וביום השבת שני כבשים בני שנה ומה ת""ל במועדו אלא מופנה להקיש לדון הימנו גזרה שוה נאמר כאן במועדו ונאמר להלן במועדו מה מועדו האמור כאן",0.07930367504835589,3050000028
ref-mek.1.6.1.632-ref-mek.1.6.1.691,ref-sifre-n.142.2.108-ref-sifre-n.142.2.174,18385,18684,ref-mek.1.6.1.632,ref-mek.1.6.1.691,253332,253670,ref-sifre-n.142.2.108,ref-sifre-n.142.2.174,ושחטו אותו בין בחול בין בשבת ומה_אני_מקיים מחלליה_מות_יומת בשאר מלאכות חוץ משחיטת הפסח או אף בשחיטת פסח הא מה אני מקיים ושחטו אותו בשאר כל הימים חוץ מן השבת או אף בשבת תלמוד לומר ויעשו בני_ישראל_את הפסח במועדו ואפילו בשבת דברי_ר'_יאשיה אמר_לו_ר' נתן ועדיין לא שמענו נם לו ר' יאשיה ,"ושחטו אותו שומע_אני_בין בחול בין בשבת ומה_אני_מקיים שמות לא מחלליה מות יומת בשאר מלאכות חוץ משחיטת הפסח או אף בשחיטת הפסח ומה_אני_מקיים ושחטו אותו בשאר כל הימים חוץ מן השבת או אף בשבת ת""ל במדבר ט ויעשו בני ישראל את הפסח במועדו במועדו ואפילו בשבת דברי רבי יאשיה נאם לו ר' יונתן כמשמע זה עדין לא שמענו נאם לו ר' יאשיה ",50,61,781,781.0,31,31.0,0.20569620253164558,0.4883720930232558,258,ושחטו אותו בין בחול בין בשבת ומה_אני_מקיים מחלליהמותיומת בשאר מלאכות חוץ משחיטת הפסח או אף בשחיטת פסח מהאנימקיים ושחטו אותו בשאר כל הימים חוץ מן השבת או אף בשבת תל מר ויעשו בניישראלאת הפסח במועדו ואפילו בשבת דבריריאשיה אלור' נתן עדין לא שמענו נם לו ר' יאשיה ,0.18354430379746833,3050000029
ref-mek.1.6.1.705-ref-mek.1.6.1.734,ref-sifre-n.142.2.184-ref-sifre-n.142.2.218,18746,18906,ref-mek.1.6.1.705,ref-mek.1.6.1.734,253710,253889,ref-sifre-n.142.2.184,ref-sifre-n.142.2.218,אם ללמד על התמיד שתדחה את השבת והלא_כבר_נאמר וביום השבת שני כבשים בני שנה ומה_תלמוד_לומר במועדו אלא להקיש ולדון נאמר כאן במועדו ונאמר להלן במועדו מה ,"אם ללמד על התמיד שהוא דוחה_את_השבת אין_צריך_שהרי_כבר_נאמר וביום השבת שני כבשים בני שנה ומה ת""ל במועדו מופנה להקיש לדון הימנו גזירה שוה נאמר כאן במועדו ונא' להלן במועדו מה ",26,29,789,789.0,36,36.0,0.30409356725146197,0.5517241379310345,128,אם ללמד על התמיד שדחהאתהשבת א_כבר_נאמר וביום השבת שני כבשים בני שנה ומהתל במועדו  להקיש לדון נאמר כאן במועדו ונא להלן במועדו מה ,0.2514619883040936,3050000030
ref-mek.1.6.1.728-ref-mek.1.6.1.733,ref-sifre-n.142.2.219-ref-sifre-n.142.3.1,18867,18903,ref-mek.1.6.1.728,ref-mek.1.6.1.733,253890,253960,ref-sifre-n.142.2.219,ref-sifre-n.142.3.1,נאמר כאן במועדו ונאמר להלן במועדו ,מועדו האמור להלן דוחה_את_השבת אף מועדו האמור כאן דוחה_את_השבת ואמרת ,6,10,801,801.0,42,36.0,0.7058823529411765,0.6666666666666667,22,מועדו אמר להלן במועדו ,0.6764705882352942,3050000031
ref-mek.1.6.1.726-ref-mek.1.6.1.734,ref-sifre-n.157.8.86-ref-sifre-n.157.8.96,18854,18906,ref-mek.1.6.1.726,ref-mek.1.6.1.734,281078,281132,ref-sifre-n.157.8.86,ref-sifre-n.157.8.96,להקיש ולדון נאמר כאן במועדו ונאמר להלן במועדו מה ,להקיש ולדון גזירה שוה נאמר כאן בגד ונאמר להלן בגד מה ,9,11,871,864.0,41,31.0,0.33962264150943394,0.4,41,להקיש ולדון נאמר כאן בד ונאמר להלן בד מה ,0.2264150943396226,3050000032
ref-mek.1.7.1.57-ref-mek.1.7.1.64,ref-sifre-n.116.1.340-ref-sifre-n.116.1.348,20143,20184,ref-mek.1.7.1.57,ref-mek.1.7.1.64,179484,179544,ref-sifre-n.116.1.340,ref-sifre-n.116.1.348,מבפנים אתה אומר מבפנים או_אינו_אלא מבחוץ ,מבפנים והלוים מבחוץ אתה אומר הכהנים מבפנים והלוים מבחוץ ,6,9,576,576.0,43,43.0,0.48214285714285715,0.4285714285714286,32,מבפנים אתה אומר מבפנים ול מבחוץ ,0.4285714285714286,3050000033
