,index,baseOrig,compOrig,baseCharStart,baseCharEnd,baseWdStart,baseWdEnd,baseRefStart,baseRefEnd,compCharStart,compCharEnd,compWdStart,compWdEnd,compRefStart,compRefEnd,baseStr,compStr,bRange,cRange,grp-ref-t,grp-ref-sifre-n,dam-lev,jac,id
374,531,ref-t.4.4.13.9.55-ref-t.4.4.13.9.71,ref-sifre-n.113.1.59-ref-sifre-n.113.1.73,927506,927599,147041,147057,ref-t.4.4.13.9.55,ref-t.4.4.13.9.71,167764,167839,26423,26437,ref-sifre-n.113.1.59,ref-sifre-n.113.1.73,נאמ' כאן אבדה ונאמרה להלן אבדה מתבקשת מה אבידה האמורה להלן אבידה מתבקשת אף אבידה האמורה כן ,נאמר כאן מדבר ונאמר להלן מדבר מה מדבר האמור להלן צלפחד אף מדבר האמור כאן ,16,14,463.0,529.0,0.4065934065934066,0.5,2070000375
375,532,ref-t.4.9.1.7.126-ref-t.4.9.1.7.142,ref-sifre-n.113.1.59-ref-sifre-n.113.1.73,1008056,1008133,159905,159921,ref-t.4.9.1.7.126,ref-t.4.9.1.7.142,167764,167839,26423,26437,ref-sifre-n.113.1.59,ref-sifre-n.113.1.73,נאמר כאן דבר ולהלן נאמ' דבר מה דבר אמור להלן מקצתו לא כולו אף דבר האמור כאן ,נאמר כאן מדבר ונאמר להלן מדבר מה מדבר האמור להלן צלפחד אף מדבר האמור כאן ,16,14,566.0,529.0,0.3157894736842105,0.5454545454545454,2070000376
376,533,ref-t.5.5.2.9.33-ref-t.5.5.2.9.50,ref-sifre-n.113.1.59-ref-sifre-n.113.1.73,1184031,1184123,187111,187128,ref-t.5.5.2.9.33,ref-t.5.5.2.9.50,167764,167839,26423,26437,ref-sifre-n.113.1.59,ref-sifre-n.113.1.73,נאמ' כאן וחשב ונאמ' להלן וחשב מה וחשב האמור להלן חמשים סלע לבית כור אף וחשב האמור כאן ,נאמר כאן מדבר ונאמר להלן מדבר מה מדבר האמור להלן צלפחד אף מדבר האמור כאן ,17,14,705.0,529.0,0.4069767441860465,0.7142857142857143,2070000377
377,535,ref-t.5.4.1.4.6-ref-t.5.4.1.4.12,ref-sifre-n.115.1.465-ref-sifre-n.115.1.470,1156295,1156332,182702,182707,ref-t.5.4.1.4.6,ref-t.5.4.1.4.12,172384,172418,27192,27197,ref-sifre-n.115.1.465,ref-sifre-n.115.1.470,המקיים מצות פטר חמור מעלין עליו כאלו ,המקיים מצות ציצית מעלים עליו כאלו ,5,5,696.0,535.0,0.24324324324324326,0.4285714285714286,2070000378
378,536,ref-t.5.4.1.4.5-ref-t.5.4.1.4.20,ref-sifre-n.115.1.664-ref-sifre-n.115.1.689,1156292,1156374,182701,182714,ref-t.5.4.1.4.5,ref-t.5.4.1.4.20,173442,173579,27366,27391,ref-sifre-n.115.1.664,ref-sifre-n.115.1.689,כל המקיים מצות פטר חמור מעלין עליו כאלו קיים מצות בהמה טמאה כולה וכל,"שכל המקיים מצות ציצית מעלים עליו כאלו קיים כל המצות והרי דברים ק""ו ומה מקיים מצות ציצית מעלים עליו כאלו קיים כל המצות ק""ו לכל מצות",14,26,696.0,536.0,0.6,0.5625,2070000379
379,539,ref-t.2.12.3.19.32-ref-t.2.12.3.19.40,ref-sifre-n.116.1.164-ref-sifre-n.116.1.173,505712,505760,79072,79078,ref-t.2.12.3.19.32,ref-t.2.12.3.19.40,178518,178569,28227,28234,ref-sifre-n.116.1.164,ref-sifre-n.116.1.173,ואתה ובניך אתך תשמרו את כהנתכם לכל דבר המזבח ,אתה ובניך אתך תשאו את עוון כהונתכם לכל דבר המזבח ,6,7,146.0,539.0,0.1836734693877551,0.30000000000000004,2070000380
380,540,ref-t.3.5.10.8.39-ref-t.3.5.10.8.51,ref-sifre-n.116.1.230-ref-sifre-n.116.1.251,665351,665417,105332,105344,ref-t.3.5.10.8.39,ref-t.3.5.10.8.51,178842,178948,28281,28298,ref-sifre-n.116.1.230,ref-sifre-n.116.1.251,אתכם ואת טפכם נאמ' כאן כלכול ונאמ' להלן כלכול מה כלכול האמור כאן,"אתך ר""ע אומר נאמר כאן אתך ונאמר להלן אתך מה אתך האמור להלן כאן בלוים הכתוב מדבר אף",13,18,382.0,540.0,0.6097560975609756,0.8125,2070000381
381,542,ref-t.4.4.13.9.55-ref-t.4.4.13.9.65,ref-sifre-n.116.1.236-ref-sifre-n.116.1.251,927506,927566,147041,147051,ref-t.4.4.13.9.55,ref-t.4.4.13.9.65,178868,178948,28285,28298,ref-sifre-n.116.1.236,ref-sifre-n.116.1.251,נאמ' כאן אבדה ונאמרה להלן אבדה מתבקשת מה אבידה האמורה להלן,ונאמר להלן אתך מה אתך האמור להלן כאן בלוים הכתוב מדבר אף אתך האמור,11,14,463.0,540.0,0.6515151515151515,0.6666666666666667,2070000382
382,544,ref-t.4.9.1.7.68-ref-t.4.9.1.7.77,ref-sifre-n.116.1.236-ref-sifre-n.116.1.254,1007784,1007831,159848,159857,ref-t.4.9.1.7.68,ref-t.4.9.1.7.77,178868,178967,28285,28301,ref-sifre-n.116.1.236,ref-sifre-n.116.1.254,נאמ' כאן דבר ונאמר להלן דבר מה דבר האמור להלן ,ונאמר להלן אתך מה אתך האמור להלן כאן בלוים הכתוב מדבר אף אתך האמור כאן להלן בלוים הכתוב מדבר ,9,16,534.0,540.0,0.6344086021505376,0.5,2070000383
383,545,ref-t.5.5.2.9.33-ref-t.5.5.2.9.42,ref-sifre-n.116.1.237-ref-sifre-n.116.1.251,1184031,1184083,187111,187120,ref-t.5.5.2.9.33,ref-t.5.5.2.9.42,178875,178948,28286,28298,ref-sifre-n.116.1.237,ref-sifre-n.116.1.251,נאמ' כאן וחשב ונאמ' להלן וחשב מה וחשב האמור להלן,להלן אתך מה אתך האמור להלן כאן בלוים הכתוב מדבר אף אתך האמור,10,13,705.0,540.0,0.7333333333333333,0.7272727272727273,2070000384
384,547,ref-t.4.9.1.7.126-ref-t.4.9.1.7.135,ref-sifre-n.116.1.239-ref-sifre-n.116.1.254,1008056,1008101,159905,159914,ref-t.4.9.1.7.126,ref-t.4.9.1.7.135,178884,178967,28288,28301,ref-sifre-n.116.1.239,ref-sifre-n.116.1.254,נאמר כאן דבר ולהלן נאמ' דבר מה דבר אמור להלן ,מה אתך האמור להלן כאן בלוים הכתוב מדבר אף אתך האמור כאן להלן בלוים הכתוב מדבר ,9,13,566.0,540.0,0.6666666666666666,0.6,2070000385
385,548,ref-t.1.2.4.13.11-ref-t.1.2.4.13.17,ref-sifre-n.116.1.310-ref-sifre-n.116.1.317,48641,48677,7923,7929,ref-t.1.2.4.13.11,ref-t.1.2.4.13.17,179311,179349,28353,28360,ref-sifre-n.116.1.310,ref-sifre-n.116.1.317,לו לשם מתנה וחוזרין ונותנין לו לשם ,לכם מתנה נתונים לה' לה' הם נתונים ולא ,6,7,13.0,548.0,0.6842105263157895,0.875,2070000386
386,549,ref-t.3.5.7.17.70-ref-t.3.5.7.17.78,ref-sifre-n.116.1.389-ref-sifre-n.116.1.397,652223,652268,103129,103137,ref-t.3.5.7.17.70,ref-t.3.5.7.17.78,179770,179816,28425,28433,ref-sifre-n.116.1.389,ref-sifre-n.116.1.397,וכלי הקדש זה ארון שנ' ולא יבאו לראות כבלע ,"כלי הקדש זה הארון וכה""א ול יבואו לראות כבלע ",8,8,336.0,549.0,0.20454545454545456,0.30000000000000004,2070000387
387,550,ref-t.2.10.3.22.15-ref-t.2.10.3.22.23,ref-sifre-n.116.1.575-ref-sifre-n.116.1.582,485057,485108,75830,75838,ref-t.2.10.3.22.15,ref-t.2.10.3.22.23,180706,180751,28587,28594,ref-sifre-n.116.1.575,ref-sifre-n.116.1.582,והחונים עליו לפני המשכן קדמה לפני אוהל מועד מזרחה ,והחונים לפני המשכן קדמה לפני אהל מועד מזרחה ,8,7,143.0,550.0,0.12,0.125,2070000388
388,551,ref-t.2.9.2.13.48-ref-t.2.9.2.13.55,ref-sifre-n.116.1.661-ref-sifre-n.116.1.680,467141,467179,72964,72970,ref-t.2.9.2.13.48,ref-t.2.9.2.13.55,181171,181266,28661,28674,ref-sifre-n.116.1.661,ref-sifre-n.116.1.680,מביא מבול לעולם שנ' ולא יהיה עוד מבול ,"מלבא לעולם ולא יהיה עוד קצף שאין ת""ל עוד אלא שכבר קצף כיוצא בו אתה אומר ולא יהיה עוד מבול ",6,13,135.0,551.0,0.6555555555555556,0.7142857142857143,2070000389
389,552,ref-t.2.12.3.19.32-ref-t.2.12.3.19.40,ref-sifre-n.116.2.20-ref-sifre-n.116.2.28,505712,505760,79072,79078,ref-t.2.12.3.19.32,ref-t.2.12.3.19.40,181628,181677,28740,28746,ref-sifre-n.116.2.20,ref-sifre-n.116.2.28,ואתה ובניך אתך תשמרו את כהנתכם לכל דבר המזבח ,ואתה ובניך אתך תשמרו את כהונתכם לכל דבר המזבח ,6,6,146.0,552.0,0.021739130434782608,0.0,2070000390
390,553,ref-t.5.3.1.9.3-ref-t.5.3.1.9.14,ref-sifre-n.116.2.179-ref-sifre-n.116.2.191,1101021,1101087,174191,174201,ref-t.5.3.1.9.3,ref-t.5.3.1.9.14,182506,182574,28878,28890,ref-sifre-n.116.2.179,ref-sifre-n.116.2.191,ידים ורגלים כיצד מקדש ידים ידיו ורגליו בכלי שרת בפנים קידש ידיו ,"ידיו ורגליו מקדש ידיו ורגליו מקום שא""צ אלא ידיו אינו מקדש אלא ידיו ",10,12,658.0,553.0,0.5373134328358209,0.7272727272727273,2070000391
391,554,ref-t.4.4.13.9.58-ref-t.4.4.13.9.71,ref-sifre-n.116.2.276-ref-sifre-n.116.2.287,927520,927599,147044,147057,ref-t.4.4.13.9.58,ref-t.4.4.13.9.71,183020,183081,28957,28968,ref-sifre-n.116.2.276,ref-sifre-n.116.2.287,ונאמרה להלן אבדה מתבקשת מה אבידה האמורה להלן אבידה מתבקשת אף אבידה האמורה כן ,ונאמר להלן יומת מה יומת האמור להלן סקילה אף יומת האמור כאן ,13,11,463.0,554.0,0.42857142857142855,0.4444444444444444,2070000392
392,555,ref-t.3.5.7.22.86-ref-t.3.5.7.22.96,ref-sifre-n.116.2.277-ref-sifre-n.116.2.287,654763,654813,103563,103573,ref-t.3.5.7.22.86,ref-t.3.5.7.22.96,183027,183081,28958,28968,ref-sifre-n.116.2.277,ref-sifre-n.116.2.287,להלן אחר מה אחר שנאמ' להלן נכרי אף אחר שנאמ' כאן ,להלן יומת מה יומת האמור להלן סקילה אף יומת האמור כאן ,10,10,340.0,554.0,0.4716981132075472,0.6666666666666667,2070000393
393,556,ref-t.5.5.2.9.37-ref-t.5.5.2.9.50,ref-sifre-n.116.2.277-ref-sifre-n.116.2.287,1184052,1184123,187115,187128,ref-t.5.5.2.9.37,ref-t.5.5.2.9.50,183027,183081,28958,28968,ref-sifre-n.116.2.277,ref-sifre-n.116.2.287,להלן וחשב מה וחשב האמור להלן חמשים סלע לבית כור אף וחשב האמור כאן ,להלן יומת מה יומת האמור להלן סקילה אף יומת האמור כאן ,13,10,705.0,554.0,0.42424242424242425,0.6363636363636364,2070000394
394,557,ref-t.4.4.3.2.14-ref-t.4.4.3.2.26,ref-sifre-n.116.2.278-ref-sifre-n.116.2.288,887769,887850,140706,140718,ref-t.4.4.3.2.14,ref-t.4.4.3.2.26,183032,183087,28959,28969,ref-sifre-n.116.2.278,ref-sifre-n.116.2.288,מיתת השור מה מיתת הבעלים בסקילה ובדחייה ובעשרים ושלשה אף מיתת השור בסקילה ,יומת מה יומת האמור להלן סקילה אף יומת האמור כאן סקילה ,12,10,440.0,554.0,0.6351351351351351,0.8333333333333334,2070000395
395,558,ref-t.6.5.3.8.25-ref-t.6.5.3.9.2,ref-sifre-n.116.2.279-ref-sifre-n.116.2.291,1376776,1376841,216662,216675,ref-t.6.5.3.8.25,ref-t.6.5.3.9.2,183037,183099,28960,28971,ref-sifre-n.116.2.279,ref-sifre-n.116.2.291,מה בשר חי האמור להלן כעדשה אף בשר חי האמור כן כעדשה שיער לבן ,מה יומת האמור להלן סקילה אף יומת האמור כאן סקילה ר' יוחנן בן ,13,11,868.0,554.0,0.47540983606557374,0.6923076923076923,2070000396
396,559,ref-t.4.4.13.9.58-ref-t.4.4.13.9.71,ref-sifre-n.116.2.297-ref-sifre-n.116.2.308,927520,927599,147044,147057,ref-t.4.4.13.9.58,ref-t.4.4.13.9.71,183124,183185,28975,28986,ref-sifre-n.116.2.297,ref-sifre-n.116.2.308,ונאמרה להלן אבדה מתבקשת מה אבידה האמורה להלן אבידה מתבקשת אף אבידה האמורה כן ,ונאמר להלן יומת מה יומת האמור להלן בחנק אף יומת האמור כאן ,13,11,463.0,559.0,0.42857142857142855,0.4444444444444444,2070000397
397,560,ref-t.3.5.7.22.86-ref-t.3.5.7.22.96,ref-sifre-n.116.2.298-ref-sifre-n.116.2.308,654763,654813,103563,103573,ref-t.3.5.7.22.86,ref-t.3.5.7.22.96,183131,183185,28976,28986,ref-sifre-n.116.2.298,ref-sifre-n.116.2.308,להלן אחר מה אחר שנאמ' להלן נכרי אף אחר שנאמ' כאן ,להלן יומת מה יומת האמור להלן בחנק אף יומת האמור כאן ,10,10,340.0,559.0,0.46153846153846156,0.6666666666666667,2070000398
398,561,ref-t.5.5.2.9.37-ref-t.5.5.2.9.50,ref-sifre-n.116.2.298-ref-sifre-n.116.2.308,1184052,1184123,187115,187128,ref-t.5.5.2.9.37,ref-t.5.5.2.9.50,183131,183185,28976,28986,ref-sifre-n.116.2.298,ref-sifre-n.116.2.308,להלן וחשב מה וחשב האמור להלן חמשים סלע לבית כור אף וחשב האמור כאן ,להלן יומת מה יומת האמור להלן בחנק אף יומת האמור כאן ,13,10,705.0,559.0,0.4393939393939394,0.6363636363636364,2070000399
399,562,ref-t.4.4.14.11.9-ref-t.4.4.14.11.25,ref-sifre-n.117.1.48-ref-sifre-n.117.1.71,932017,932114,147759,147775,ref-t.4.4.14.11.9,ref-t.4.4.14.11.25,183501,183635,29038,29057,ref-sifre-n.117.1.48,ref-sifre-n.117.1.71,ששמחה לפני המקום בקיומן של צדיקים כך שמחה לפני המקום באובדן של רשעים שנאמר ובאבד רשעים רנה,שמחה לפני המקום אמר להם יש שמחה לפני המקום כשיאבדו מכעיסים מן העולם וכן הוא אומר בטוב צדיקים תעלוץ קריה,17,20,492.0,562.0,0.5533980582524272,0.8333333333333334,2070000400
400,564,ref-t.5.1.10.9.1-ref-t.5.1.10.9.16,ref-sifre-n.117.2.206-ref-sifre-n.117.2.217,1053924,1054022,166726,166741,ref-t.5.1.10.9.1,ref-t.5.1.10.9.16,184957,185021,29288,29299,ref-sifre-n.117.2.206,ref-sifre-n.117.2.217,אחד חטאות החיצונות ואחד חטאות הפנימיות לכיבוס שנ' תורת החטאת תורה אחת לכל החטאות חטאת העוף,חוטא ומנחת נדבה ולכל חטאתם זו חטאת יחיד וחטאת צבור חטאת העוף,16,12,637.0,564.0,0.6222222222222222,0.7777777777777778,2070000401
401,566,ref-t.5.8.2.7.3-ref-t.5.8.2.7.12,ref-sifre-n.117.2.210-ref-sifre-n.117.2.218,1234147,1234206,195016,195025,ref-t.5.8.2.7.3,ref-t.5.8.2.7.12,184980,185028,29292,29300,ref-sifre-n.117.2.210,ref-sifre-n.117.2.218,חטאותיהן חטאת יחיד וחטאת יחיד חטא' ציבור וחטאת ציבור חטאת,חטאתם זו חטאת יחיד וחטאת צבור חטאת העוף וחטאת,10,9,771.0,564.0,0.38596491228070173,0.625,2070000402
402,568,ref-t.5.1.5.13.10-ref-t.5.1.5.13.18,ref-sifre-n.117.2.221-ref-sifre-n.117.2.229,1034181,1034218,163662,163670,ref-t.5.1.5.13.10,ref-t.5.1.5.13.18,185040,185083,29303,29311,ref-sifre-n.117.2.221,ref-sifre-n.117.2.229,לשם זבח לשם אשם לשם אישים לשם ריח לשם ,אשמם זו אשם ודאי יאשם תלוי ואשם נזיר ואשם ,8,8,626.0,568.0,0.5238095238095238,0.8888888888888888,2070000403
403,569,ref-t.5.8.1.19.4-ref-t.5.8.1.19.14,ref-sifre-n.117.2.221-ref-sifre-n.117.2.230,1231434,1231489,194571,194580,ref-t.5.8.1.19.4,ref-t.5.8.1.19.14,185040,185089,29303,29312,ref-sifre-n.117.2.221,ref-sifre-n.117.2.230,אשם גזילה אשם מעילה אשם שפחה חרופה אשם נזיר ואשם מצורע ,אשמם זו אשם ודאי יאשם תלוי ואשם נזיר ואשם מצורע ,9,9,766.0,568.0,0.36363636363636365,0.7272727272727273,2070000404
404,570,ref-t.5.1.6.16.15-ref-t.5.1.6.16.29,ref-sifre-n.117.2.240-ref-sifre-n.117.2.252,1037826,1037913,164273,164285,ref-t.5.1.6.16.15,ref-t.5.1.6.16.29,185128,185202,29322,29334,ref-sifre-n.117.2.240,ref-sifre-n.117.2.252,ולוג שמן של מצורע ושתי הלחם ולחם הפנים ושירי מנחות והעומר כולן קדשי קדשים ונאכלין ,לוג שמן של מצורע לך הוא ולבניך בזכותך ובזכות בניך בקודש הקדשים תאכלנו ,12,12,628.0,570.0,0.5,0.8,2070000405
405,571,ref-t.5.1.6.16.27-ref-t.5.1.6.16.37,ref-sifre-n.117.2.280-ref-sifre-n.117.2.306,1037894,1037961,164283,164291,ref-t.5.1.6.16.27,ref-t.5.1.6.16.37,185345,185496,29356,29380,ref-sifre-n.117.2.280,ref-sifre-n.117.2.306,קדשי קדשים ונאכלין לפנים מן הקלעים ונאכלין לזכרי כהונה,"לקדשי קדשים שנאכלים אפילו בהיכל ת""ל בקודש הקדשים תאכלנו כל זכר יאכל אותו כרת הכתוב ברית עם אהרן על קדשי הקדשים שלא יהיו נאכלים אלא",9,25,628.0,571.0,0.7,0.8947368421052632,2070000406
406,572,ref-t.5.6.1.20.36-ref-t.5.6.1.20.48,ref-sifre-n.117.2.280-ref-sifre-n.117.2.306,1205202,1205284,190507,190517,ref-t.5.6.1.20.36,ref-t.5.6.1.20.48,185345,185496,29356,29380,ref-sifre-n.117.2.280,ref-sifre-n.117.2.306,על הספק וכולן קדשי קדשים ונאכלין לפנים מן הקלעים ונאכלין לזכרי,"לקדשי קדשים שנאכלים אפילו בהיכל ת""ל בקודש הקדשים תאכלנו כל זכר יאכל אותו כרת הכתוב ברית עם אהרן על קדשי הקדשים שלא יהיו נאכלים אלא",11,25,748.0,571.0,0.7307692307692307,0.8571428571428572,2070000407
407,575,ref-t.5.1.9.10.45-ref-t.5.1.9.11.14,ref-sifre-n.117.2.316-ref-sifre-n.117.2.327,1051757,1051838,166363,166376,ref-t.5.1.9.10.45,ref-t.5.1.9.11.14,185535,185609,29388,29397,ref-sifre-n.117.2.316,ref-sifre-n.117.2.327,הראוי לו כלי הלח מקדשין את הלח ומידת היבש מקדשת את היבש אין כלי הלח מקדשין ,דבר הראוי לאכילה שיתנהג בקדושה שאין ראוי לאכילה מנין תלמוד לומר קודש ,13,9,634.0,575.0,0.7066666666666667,0.8666666666666667,2070000408
408,576,ref-t.1.2.2.13.28-ref-t.1.2.2.13.37,ref-sifre-n.117.2.536-ref-sifre-n.117.2.542,39579,39636,6484,6493,ref-t.1.2.2.13.28,ref-t.1.2.2.13.37,186674,186713,29536,29542,ref-sifre-n.117.2.536,ref-sifre-n.117.2.542,ושאר מתנות כהונה כגון הזרוע והלחיים והקבה יש כהן משם ,אשר יתנו זה הזרוע והלחיים והקיבה לה' ,9,6,11.0,576.0,0.4339622641509434,0.5454545454545454,2070000409
409,577,ref-t.5.4.3.3.7-ref-t.5.4.3.3.14,ref-sifre-n.117.2.553-ref-sifre-n.117.2.571,1163449,1163493,183824,183831,ref-t.5.4.3.3.7,ref-t.5.4.3.3.14,186761,186875,29549,29565,ref-sifre-n.117.2.553,ref-sifre-n.117.2.571,קדושה חלה עליהן הבכור והמעשר אין קדושה חלה ,הביכורים שתהא קדושה חלה עליהם במחובר לקרקע שהיה בדין הואיל וקדושה חלה על הביכורים וקדושה חלה על התרומה אם ,7,16,700.0,577.0,0.6792452830188679,0.8,2070000410
410,578,ref-t.3.2.5.1.139-ref-t.3.2.5.1.222,ref-sifre-n.117.2.742-ref-sifre-n.117.2.830,565819,566266,88731,88801,ref-t.3.2.5.1.139,ref-t.3.2.5.1.222,187761,188239,29689,29764,ref-sifre-n.117.2.742,ref-sifre-n.117.2.830,אצל ר' יהודה בן בתירה לנציבין אמ' לו שמעתי עליך שאתה או' ארוסה בת ישראל המאורסת לכהן אוכלת בתרומה שלח לו ואמ' לו מוחזק הייתי בך שאתה בקי בחדרי תורה לדון קל וחומר אי אתה יודע ומה שפחה כנענית שאין ביאתה קונה אותה לאכול בתרומה כסף קונה אותה להאכילה בתרומה בת ישר' שהביאה קונה אותה להאכילה בתרומה דין הוא שיהא כסף קונה אותה להאכיל' בתרומה אבל מה אעשה שהרי אמרו חכמים,"אצל ר' יהודה בנציבים אמר לו שמעתי עליך שהיית אומר על בת ישראל המאורסת לכהן שהיא אוכלת בתרומה שלח לו ואתה מוחזקני בך שאתה בקי בחדרי תורה ולדון בק""ו אי אתה יודע ומה שפחה כנענית שאין קונה אותה לאכול בתרומה כספה מאכילה בתרומה בת ישראל שביאתה קונה אותה לאכול בתרומה אינו דין שיהא כסף קונה אותה שתהא אוכלת בתרומה אבל מה אעשה שהרי אמרו חכמים שם וש""נ אין ארוסה בת ישראל אוכלת בתרומה עד שתכנס לחופה",71,76,160.0,578.0,0.35218508997429304,0.3653846153846154,2070000411
411,581,ref-t.3.1.10.1.72-ref-t.3.1.10.1.94,ref-sifre-n.117.2.809-ref-sifre-n.117.2.828,532204,532330,83295,83316,ref-t.3.1.10.1.72,ref-t.3.1.10.1.94,188123,188228,29746,29762,ref-sifre-n.117.2.809,ref-sifre-n.117.2.828,אין אוכלת אין אוכלת בתרומה עד שתכנס לחופה לשם נישואין ותבעל לשם אישות בת ישראל חרשת שנישאת לכהן פקח אין אוכלת בתרומה,אין ארוסה בת ישראל אוכלת בתרומה עד שתכנס לחופה נכנסה לחופה אף על פי שלא נבעלה אוכלת,22,17,154.0,578.0,0.5517241379310345,0.65,2070000412
412,583,ref-t.3.2.5.1.96-ref-t.3.2.5.1.111,ref-sifre-n.117.2.809-ref-sifre-n.117.2.830,565597,565683,88693,88707,ref-t.3.2.5.1.96,ref-t.3.2.5.1.111,188123,188239,29746,29764,ref-sifre-n.117.2.809,ref-sifre-n.117.2.830,אין האשה בת ישראל אוכלת בתרומה עד שתכנס לחופה והיבמה עד שתיבעל אם מתה בעלה יורשה ,אין ארוסה בת ישראל אוכלת בתרומה עד שתכנס לחופה נכנסה לחופה אף על פי שלא נבעלה אוכלת בתרומה ואם מתה בעלה יורשה ,14,18,159.0,578.0,0.35454545454545455,0.4444444444444444,2070000413
413,584,ref-t.3.2.4.3.14-ref-t.3.2.4.3.21,ref-sifre-n.117.2.813-ref-sifre-n.117.2.824,561303,561352,88003,88010,ref-t.3.2.4.3.14,ref-t.3.2.4.3.21,188142,188205,29749,29758,ref-sifre-n.117.2.813,ref-sifre-n.117.2.824,אוכלת בתרומה כיון שנכנסה לחופה אע'פ שלא נבעלה ,אוכלת בתרומה עד שתכנס לחופה נכנסה לחופה אף על פי שלא נבעלה ,7,9,158.0,578.0,0.3050847457627119,0.6153846153846154,2070000414
414,585,ref-t.5.5.4.32.4-ref-t.5.5.4.33.4,ref-sifre-n.117.3.52-ref-sifre-n.117.3.89,1195535,1195676,188982,189004,ref-t.5.5.4.32.4,ref-t.5.5.4.33.4,188488,188685,29806,29839,ref-sifre-n.117.3.52,ref-sifre-n.117.3.89,ומפורש לגבוה שנ' כל חרם קדש קדשים הוא לייי ר' יהודה בן בתירא אומ' סתם חרמים לגבוה ומפורש להדיוט שנ' כשדה החרם כהנים,"אומר סתם חרמים לבדק הבית שנאמר שם כל חרם קודש קדשים הוא לה' או אפילו פירש לכהנים ת""ל כשדה החרם לכהן רבי יהודה בן בבא אומר סתם חרמים לכהנים שנאמר כשדה החרם לכהן תהיה",23,34,742.0,585.0,0.5792682926829268,0.7407407407407407,2070000415
415,587,ref-t.5.6.1.4.22-ref-t.5.6.1.5.7,ref-sifre-n.117.3.77-ref-sifre-n.117.3.95,1201426,1201499,189952,189964,ref-t.5.6.1.4.22,ref-t.5.6.1.5.7,188612,188711,29828,29845,ref-sifre-n.117.3.77,ref-sifre-n.117.3.95,מחרימין אותו ומקדישין אותן הקדש עילוי אילו הן חרמים האומ' חרם זה לכהן,"אומר סתם חרמים לכהנים שנאמר כשדה החרם לכהן תהיה אחוזתו או אפילו פירש לשם ת""ל כל חרם קודש",13,18,746.0,585.0,0.7386363636363636,0.75,2070000416
416,588,ref-t.5.5.4.34.13-ref-t.5.5.4.34.19,ref-sifre-n.117.3.79-ref-sifre-n.117.3.96,1195921,1195952,189042,189048,ref-t.5.5.4.34.13,ref-t.5.5.4.34.19,188621,188715,29830,29846,ref-sifre-n.117.3.79,ref-sifre-n.117.3.96,חרמי כהנים כל חרם קדש קדשים הוא ,"חרמים לכהנים שנאמר כשדה החרם לכהן תהיה אחוזתו או אפילו פירש לשם ת""ל כל חרם קודש קדשים הוא ",6,16,744.0,585.0,0.6444444444444445,0.7692307692307692,2070000417
417,590,ref-t.5.4.1.2.16-ref-t.5.4.1.2.42,ref-sifre-n.118.1.26-ref-sifre-n.118.1.62,1155983,1156108,182651,182673,ref-t.5.4.1.2.16,ref-t.5.4.1.2.42,188943,189120,29884,29914,ref-sifre-n.118.1.26,ref-sifre-n.118.1.62,בבכור בהמה ת'ל באדם ובבהמה את שיש לך בו באדם יש לך בו בבהמה את שאין לך בו באדם אין לך בו בבהמה,תלמוד לומר באדם ובבהמה להביא את בעל מום באדם ובבהמה בכורות ד את שיש לך בו באדם יש לך בו בבהמה יצאו לוים שאין לך בהם באדם לא יהיה לך בהם,23,31,694.0,590.0,0.43703703703703706,0.5294117647058824,2070000418
418,592,ref-t.1.5.5.19.21-ref-t.1.5.5.20.11,ref-sifre-n.118.1.42-ref-sifre-n.118.1.65,150827,150963,23796,23818,ref-t.1.5.5.19.21,ref-t.1.5.5.20.11,189022,189133,29896,29917,ref-sifre-n.118.1.42,ref-sifre-n.118.1.65,בהמה ליקח מהן אוכלי בהמה ואין צריך לומ' אוכלי אדם ליקח בהן אוכלי בהמה פירות שביעית אין מאכילין אותן לבהמה ולחיה ולעופות אם,באדם יש לך בו בבהמה יצאו לוים שאין לך בהם באדם לא יהיה לך בהם בבהמה מקיש בכור אדם לבכור בהמה מה,23,22,43.0,590.0,0.6721311475409836,0.8421052631578947,2070000419
419,594,ref-t.5.4.6.13.40-ref-t.5.4.6.14.4,ref-sifre-n.118.1.295-ref-sifre-n.118.1.303,1174491,1174568,185565,185579,ref-t.5.4.6.13.40,ref-t.5.4.6.14.4,190277,190329,30111,30119,ref-sifre-n.118.1.295,ref-sifre-n.118.1.303,לפדיון בני וקרקע זו בחמש סלעים לפדיון בני אין בנו פדוי נתן האב חמש סלעים ,ופדויו מבן חדש תפדה הקודש נפדה בחמש סלעים ונפדה ,14,8,703.0,594.0,0.6986301369863014,0.7857142857142857,2070000420
