,index,baseOrig,compOrig,baseCharStart,baseCharEnd,baseWdStart,baseWdEnd,baseRefStart,baseRefEnd,compCharStart,compCharEnd,compWdStart,compWdEnd,compRefStart,compRefEnd,baseStr,compStr,bRange,cRange,grp-ref-t,grp-ref-mek,dam-lev,jac,id
399,517,ref-t.4.4.11.9.94-ref-t.4.4.11.9.103,ref-mek.7.13.2.147-ref-mek.7.13.2.155,921479,921526,146121,146130,ref-t.4.4.11.9.94,ref-t.4.4.11.9.103,334475,334522,54262,54270,ref-mek.7.13.2.147,ref-mek.7.13.2.155,היו שם כדי יין וכדי שמן ושברן בשעה שהוא חתר ,שהיו לפניו כדי יין וכדי שמן ושברן שהוא חותר ,9,8,499.0,516.0,0.2727272727272727,0.33333333333333337,2050000400
400,518,ref-t.4.1.7.8.1-ref-t.4.1.7.9.12,ref-mek.7.13.3.65-ref-mek.7.13.3.129,754850,755416,119480,119569,ref-t.4.1.7.8.1,ref-t.4.1.7.9.12,335273,335678,54393,54453,ref-mek.7.13.3.65,ref-mek.7.13.3.129,שבעה גנבין הן הראשון שבכולם גונב דעת הבריות והמסרב בחבירו לאורחו ואין בלבו לקרותו והמרבה לו בתקרובת ויודע לו שאינו מקבל והמפתח לו חנויות שמכורות לחנוני והמעויל במידות והמשקר במשקלות והמערב את הגידה בתלתן ואת החומץ בשמן אע'פ שאמרו אין השמן מקבל דלוס לפיכך מושחין בו את המלכים ולא עוד אלא שמעלין עליו שאילו היה יכול לגנוב דעת העליונה שכל היה גונב שכל הגונב דעת הבריות נקרא גנב שנ' ויגנב אבשלום את לב ניגנב שיודע שנגנב ושותק וכן מצינו כשהיו ישראל עומדין על הר סיני בקשו לגנוב דעת העליונה,שבעה גנבין הם הראשון שבגנבים גונב דעת הבריות והמסרב לחבירו לארחו ואין בלבו לקרותו והמרבה בתקרובת ויודע שאינו מקבל והפותח חביותיו והן מכורות לחנוני והמעוול במדות והמשקר במשקולת והמערב את הגררה בתלתן והחול בפול והחומץ בשמן מפני שאמרו השמן אינו מקבל נכל לפיכך מושחין בו מלכים ולא עוד אלא שמעלין עליו שאם היה יכול לגנוב דעת העליונה גונבה וכן מצינו באבשלום,484,351,394.0,518.0,0.3987603305785124,0.48611111111111116,2050000401
401,519,ref-t.4.3.6.14.16-ref-t.4.3.6.14.28,ref-mek.7.13.3.79-ref-mek.7.13.3.88,859144,859217,136066,136078,ref-t.4.3.6.14.16,ref-t.4.3.6.14.28,335363,335434,54407,54416,ref-mek.7.13.3.79,ref-mek.7.13.3.88,ירבה לו בתקרובת ויודע בו שאינו מקבל ולא יפתח לו חנויות מכורות לחנוני ,והמרבה בתקרובת ויודע שאינו מקבל והפותח חביותיו והן מכורות לחנוני ,12,9,445.0,518.0,0.3333333333333333,0.46153846153846156,2050000402
402,522,ref-t.3.5.3.17.2-ref-t.3.5.3.17.10,ref-mek.7.13.3.126-ref-mek.7.13.3.134,630297,630338,99342,99349,ref-t.3.5.3.17.2,ref-t.3.5.3.17.10,335659,335701,54450,54457,ref-mek.7.13.3.126,ref-mek.7.13.3.134,שגנב שלש גנבות לב אביו ולב בית דין ולב ,שגנב שלש גניבות לב אביו ולב בית דין ולב ,7,7,233.0,518.0,0.025,0.0,2050000403
403,523,ref-t.2.1.15.17.13-ref-t.2.1.15.17.22,ref-mek.7.13.3.138-ref-mek.7.13.3.148,285703,285748,44649,44657,ref-t.2.1.15.17.13,ref-t.2.1.15.17.22,335719,335777,54460,54470,ref-mek.7.13.3.138,ref-mek.7.13.3.148,הגנב וגו' בעל הבית מהו ודיי או ספק הוי או' ,ויגנוב אבשלום וגו' וכי מה גדול הגונב או הנגנב הוי אומר ,8,10,80.0,523.0,0.5636363636363636,0.8333333333333334,2050000404
404,524,ref-t.4.1.7.8.64-ref-t.4.1.7.9.71,ref-mek.7.13.3.143-ref-mek.7.13.3.220,755231,755710,119536,119624,ref-t.4.1.7.8.64,ref-t.4.1.7.9.71,335747,336151,54465,54534,ref-mek.7.13.3.143,ref-mek.7.13.3.220,הגונב דעת הבריות נקרא גנב שנ' ויגנב אבשלום את לב אנשי ישראל מי גדול גונב או ניגנב הוי או' ניגנב שיודע שנגנב ושותק וכן מצינו כשהיו ישראל עומדין על הר סיני בקשו לגנוב דעת העליונה שנ' כל אשר דבר ייי נעשה ונשמע כביכול נגנב הוא להם ת'ל מי יתן והיה לבבם זה להם ליראה אותי וגו' אם תאמר שאין הכל גלוי לפניו והלא כבר נאמ' ויפתוהו בפיהם ובלשונם יכזבו לו לו ולבם לא נכון עמו ולא נאמנו בבריתו אע'פ כן והוא רחום יכפר וגו' ואומ' כסף סיגים מצופה על,גדול הגונב או הנגנב הוי אומר זה הנגנב שהוא יודע שהוא נגנב והוא מחריש וכן מצינו באבותינו כשעמדו על הר סיני בקשו לגנוב דעת העליונה שנאמר כל אשר דיבר ה' נעשה ונשמע כביכול ונגנב לב בית דין בידן שנאמר מי יתן והיה לבבם זה להם ואם תאמר שאין הכל גלוי וידוע לפניו תלמוד לומר ויפתוהו בפיהם ולבם לא נכון עמו ואף על פי כן והוא רחום יכפר עון ואומר כסף,433,338,394.0,523.0,0.47113163972286376,0.47058823529411764,2050000405
405,526,ref-t.4.1.7.11.1-ref-t.4.1.7.11.24,ref-mek.7.13.3.221-ref-mek.7.13.3.241,755965,756101,119667,119683,ref-t.4.1.7.11.1,ref-t.4.1.7.11.24,336152,336279,54535,54555,ref-mek.7.13.3.221,ref-mek.7.13.3.241,למעלה מהן גונב את האסורין בהנייה שפטור מלשלם את השטרות ואת הקרקעות ואת ההקדשות אין משלם אלא,למעלה מהן גנב אסורי הנאה פטור מלשלם כסות וכלים בהמה חיה ועוף משלם תשלומי ארבעה וחמישה עבדים ושטרות שפחות וקרקעות והקדשות,91,120,402.0,526.0,0.6416666666666667,0.6086956521739131,2050000406
406,528,ref-t.4.1.7.11.35-ref-t.4.1.7.13.72,ref-mek.7.13.3.256-ref-mek.7.13.3.364,756160,756613,119692,119765,ref-t.4.1.7.11.35,ref-t.4.1.7.13.72,336345,336877,54567,54651,ref-mek.7.13.3.256,ref-mek.7.13.3.364,שאסור בהנאה יש לו היתר לאחר זמן הגונב את השור טבחו ומכרו משלם חמשה שה משלם ארבעה שנ' חמשה בקר ישלם תחת השור וגו' למעלה מהן הגונב את בן חורין שנידון עליו בנפשו ר' שמעון או' הרי הוא אומ' חולק עם גנב שונא נפשו וגו' משלו משל למה הדבר דומה לאחד שטען כלים ויצא מבית חבירו מצאו אחר אמ' לו מה זה פל' אמ' לו ר' טול חלקך ואל תגיד לאחר זמן מצאו בעל,אסור עכשו יש לו היתר לאחר זמן תחת השור ישלם חמשה תחת השה ישלם ארבעה שנאמר חמשה בקר וגו' למעלה מהם הגונב בן חורין שנדון בנפשו גונב נפש בני אדם שהוא מתחייב בנפשו ר' שמעון בן יוחאי אומר הרי הוא אומר חולק עם גנב שונא נפשו משלו משל למה הדבר דומה לאחד שהיה יוצא מביתו של חבירו טעון כלים מצאו חבירו ואמר לו מה אתה עושה אמר לו טול חלקך ואל תגד לאדם לאחר זמן בא בעל הגנבה ואמר לו משביעך אני שלא ראית לפלוני,337,397,406.0,528.0,0.4659949622166247,0.3508771929824561,2050000407
407,530,ref-t.4.1.7.10.43-ref-t.4.1.7.11.3,ref-mek.7.13.3.265-ref-mek.7.13.3.277,755928,755979,119660,119669,ref-t.4.1.7.10.43,ref-t.4.1.7.11.3,336385,336452,54574,54586,ref-mek.7.13.3.265,ref-mek.7.13.3.277,משלם חמשה שה מפני שטוענו משלם ארבעה למעלה מהן גונב ,ישלם חמשה תחת השה ישלם ארבעה שנאמר חמשה בקר וגו' למעלה מהם הגונב ,9,12,402.0,528.0,0.47692307692307695,0.5714285714285714,2050000408
408,532,ref-t.4.1.7.13.77-ref-t.4.1.7.13.108,ref-mek.7.13.3.360-ref-mek.7.13.3.394,756628,756795,119768,119799,ref-t.4.1.7.13.77,ref-t.4.1.7.13.108,336856,337028,54647,54676,ref-mek.7.13.3.360,ref-mek.7.13.3.394,חולק עם גנב שונא נפשו אלה ישמע ולא יגיד אבל המתגנב והולך מאחר חבר והולך ושונה פרקו אע'פ שנקרא גנב זוכה לעצמו שנא' לא יבוזו לגנב וגו' סוף שמתמנה פרנס על הצבור ,חולק עם גנב שונא נפשו אבל המתגנב אחר חבירו והלך לשנות בדברי תורה אף על פי שנקרא גנב הרי זה זכה לעצמו ועליו הוא אומר לא יבוזו לגנב כי יגנוב לסוף נמצא מתמנה על הצבור ,31,29,411.0,528.0,0.4878048780487805,0.5,2050000409
409,533,ref-t.3.2.12.2.60-ref-t.3.2.12.2.64,ref-mek.7.14.1.144-ref-mek.7.14.1.150,583543,583569,91581,91585,ref-t.3.2.12.2.60,ref-t.3.2.12.2.64,337869,337903,54814,54820,ref-mek.7.14.1.144,ref-mek.7.14.1.150,מיטב שדהו ומיטב כרמו ישלם ,מיטב שדהו ומיטב כרמו מיטב שדהו של ,4,6,203.0,533.0,0.29411764705882354,0.33333333333333337,2050000410
410,534,ref-t.4.1.1.1.116-ref-t.4.1.1.1.120,ref-mek.7.14.1.144-ref-mek.7.14.1.150,727070,727096,115168,115172,ref-t.4.1.1.1.116,ref-t.4.1.1.1.120,337869,337903,54814,54820,ref-mek.7.14.1.144,ref-mek.7.14.1.150,מיטב שדהו ומיטב כרמו ישלם ,מיטב שדהו ומיטב כרמו מיטב שדהו של ,4,6,343.0,533.0,0.29411764705882354,0.33333333333333337,2050000411
411,535,ref-t.4.1.6.22.20-ref-t.4.1.6.22.42,ref-mek.7.14.2.102-ref-mek.7.14.2.125,750035,750149,118732,118750,ref-t.4.1.6.22.20,ref-t.4.1.6.22.42,338520,338643,54913,54931,ref-mek.7.14.2.102,ref-mek.7.14.2.125,שלם ישלם המבעיר את הבערה הכל לפי הדליקה המדליק בתוך שלו כמה תעבר הדליקה ר' לעזר בן עזריה אומ',שש עשרה אמה בדרך הרבים ר' עקיבא אומר חמשים אמה ר' שמעון אומר שלם ישלם המבעיר את הבעירה הכל,93,90,386.0,535.0,0.7419354838709677,0.7083333333333333,2050000412
412,537,ref-t.4.1.6.22.77-ref-t.4.1.6.22.101,ref-mek.7.14.2.123-ref-mek.7.14.2.141,750328,750463,118780,118798,ref-t.4.1.6.22.77,ref-t.4.1.6.22.101,338626,338734,54929,54945,ref-mek.7.14.2.123,ref-mek.7.14.2.141,מעשה שעיברה הדליקה את הירדן שהיתה קשה במי דברים אמורים בזמן שקפצה אבל אם היתה מסכסכת והולכת או שהיו עצים מצוין להר אפי' עד מיל ,מעשה שעברה דליקה הירדן והזיקה מפני שהיא מרובה אימתי בזמן שקפצה אבל אם היתה מצפצפת ומהלכת אפילו עד מיל ,18,16,388.0,535.0,0.4251968503937008,0.5862068965517242,2050000413
413,538,ref-t.4.1.1.9.9-ref-t.4.1.1.9.23,ref-mek.7.14.2.273-ref-mek.7.14.2.297,729135,729217,115488,115501,ref-t.4.1.1.9.9,ref-t.4.1.1.9.23,339419,339563,55049,55072,ref-mek.7.14.2.273,ref-mek.7.14.2.297,בנזקין כל מקום שיש רשות לנזק ולא במזיק חייב בנזק שלם למזיק ולא לניזק,בנזקין כל מקום שיש רשות למזיק ולא לניזק פטור לניזק ולא למזיק חייב בכל לניזק ולמזיק אפילו מיוחדת כגון חבר של שותפין והפונדק לא,68,125,345.0,538.0,0.536,0.6111111111111112,2050000414
414,540,ref-t.4.1.5.8.1-ref-t.4.1.5.8.10,ref-mek.7.14.2.278-ref-mek.7.14.2.287,743996,744048,117801,117810,ref-t.4.1.5.8.1,ref-t.4.1.5.8.10,339445,339504,55053,55062,ref-mek.7.14.2.278,ref-mek.7.14.2.287,הזיק פטור הוזק חייב בנוס שורך ושמרו הוזק חייב הזיק ,למזיק ולא לניזק פטור לניזק ולא למזיק חייב בכל לניזק ,9,9,375.0,538.0,0.6730769230769231,0.8,2050000415
415,541,ref-t.4.1.7.13.119-ref-t.4.1.7.14.15,ref-mek.7.15.1.138-ref-mek.7.15.1.146,756851,756955,119808,119826,ref-t.4.1.7.13.119,ref-t.4.1.7.14.15,340494,340541,55223,55231,ref-mek.7.15.1.138,ref-mek.7.15.1.146,ונמצא ישלם שבעתים וגו' גנב ונתן לאחר וטבח גנב ונתן לאחר ומכר גנב ונתן לאחר והחליף גנב והקדיש גנב,הגונב מאחר הגנב אם ימצא הגנב שנים ישלם הגנב,96,43,412.0,541.0,0.7083333333333334,0.7857142857142857,2050000416
416,543,ref-t.4.1.10.5.52-ref-t.4.1.10.6.1,ref-mek.7.15.1.141-ref-mek.7.15.1.150,772869,772944,122258,122269,ref-t.4.1.10.5.52,ref-t.4.1.10.6.1,340512,340564,55226,55235,ref-mek.7.15.1.141,ref-mek.7.15.1.150,ואם שינה אותה מברייתה משלם כשעת הגזילה והגנב משלם כשעת הגניבה הגוזל ,אם ימצא הגנב שנים ישלם הגנב משלם תשלומי כפל הגזלן ,11,9,428.0,541.0,0.5735294117647058,0.6666666666666667,2050000417
417,544,ref-t.4.1.7.1.12-ref-t.4.1.7.2.44,ref-mek.7.15.1.150-ref-mek.7.15.1.198,752657,752930,119129,119174,ref-t.4.1.7.1.12,ref-t.4.1.7.2.44,340558,340825,55235,55279,ref-mek.7.15.1.150,ref-mek.7.15.1.198,הגזלנין בין כך ובין כך אין משלמין אלא קרן שאלו תלמידיו את רבן יוחנן בן זכיי וכי מה ראת תורה להחמיר בגנב יותר מבגזלן אמ' להן גזלן השוה עבד לקוניו וגנב חלק כבוד לעבד יתר על כבוד קוניו כביכול עשה גנב עין העליונה כולה אינה רואה ואת האזן שאינה שומעת שנ' הוי המעמיקים ,הגזלן אינו משלם תשלומי כפל ומה ראתה תורה להחמיר על הגנב יותר מהגזלן ר' יוחנן בן זכאי אומר הגזלן השוה כבוד העבד לכבוד קונו והגנב חלק כבוד לעבד יותר מקונו כביכול הגנב עשה את העין של מטה כאלו אינה רואה ואת האוזן כאילו אינה שומעת כענין שנאמר הוי המעמיקים ,45,44,389.0,541.0,0.5190839694656488,0.43181818181818177,2050000418
418,545,ref-t.4.6.1.7.86-ref-t.4.6.1.7.119,ref-mek.7.15.2.218-ref-mek.7.15.2.249,948668,948830,150400,150431,ref-t.4.6.1.7.86,ref-t.4.6.1.7.119,342000,342148,55477,55504,ref-mek.7.15.2.218,ref-mek.7.15.2.249,כלל ופרט וכלל אי אתה דן אלא כעין הפרט כשהוא אומ' לכל טומאתו אשר יטמא בה והוא וכלל אם כלל כלל הראשון אמרת ליו אלא כלל ופרט וכלל אי אתה דן אלא,כלל ופרט אין בכלל אלא מה שבפרט וכשהוא אומר על כל אבדה אשר יאמר חזר וכלל או כלל כלל הראשון אמרת לאו אלא כלל ופרט וכלל אי אתה,140,123,528.0,545.0,0.32857142857142857,0.6363636363636364,2050000419
419,548,ref-t.4.4.3.7.63-ref-t.4.4.3.7.76,ref-mek.7.15.3.132-ref-mek.7.15.3.144,891064,891132,141258,141269,ref-t.4.4.3.7.63,ref-t.4.4.3.7.76,342886,342948,55610,55621,ref-mek.7.15.3.132,ref-mek.7.15.3.144,שנים אין בית דין שקול מוסיפין עליהן עוד אחד הרי עשרים ושלשה ר' אומ' ,שנים ואין בית דין שקול מוסיפין עליהם עוד אחד הרי שלשה ר' אומר ,11,11,466.0,548.0,0.14705882352941177,0.33333333333333337,2050000420
420,549,ref-t.4.4.3.7.115-ref-t.4.4.3.7.122,ref-mek.7.15.3.136-ref-mek.7.15.3.142,891319,891362,141297,141304,ref-t.4.4.3.7.115,ref-t.4.4.3.7.122,342905,342940,55613,55619,ref-mek.7.15.3.136,ref-mek.7.15.3.142,שקול מוסיפין עליהן עוד אחד הרי עשרים ושלשה ,שקול מוסיפין עליהם עוד אחד הרי שלשה ,7,6,471.0,548.0,0.18604651162790697,0.33333333333333337,2050000421
421,550,ref-t.4.4.3.7.115-ref-t.4.4.3.7.122,ref-mek.7.15.3.183-ref-mek.7.15.3.190,891319,891362,141297,141304,ref-t.4.4.3.7.115,ref-t.4.4.3.7.122,343140,343179,55648,55655,ref-mek.7.15.3.183,ref-mek.7.15.3.190,שקול מוסיפין עליהן עוד אחד הרי עשרים ושלשה ,שקול מוסיפין עליהם עוד אחד הרי כאן שלשה ,7,7,471.0,550.0,0.16279069767441862,0.4,2050000422
422,551,ref-t.4.4.3.7.67-ref-t.4.4.3.7.76,ref-mek.7.15.3.183-ref-mek.7.15.3.192,891081,891132,141260,141269,ref-t.4.4.3.7.67,ref-t.4.4.3.7.76,343140,343189,55648,55657,ref-mek.7.15.3.183,ref-mek.7.15.3.192,שקול מוסיפין עליהן עוד אחד הרי עשרים ושלשה ר' אומ' ,שקול מוסיפין עליהם עוד אחד הרי כאן שלשה מכאן אמרו ,9,9,466.0,550.0,0.27450980392156865,0.5714285714285714,2050000423
423,552,ref-t.4.4.1.1.1-ref-t.4.4.1.1.10,ref-mek.7.15.3.193-ref-mek.7.15.3.202,880128,880186,139467,139475,ref-t.4.4.1.1.1,ref-t.4.4.1.1.10,343190,343247,55658,55664,ref-mek.7.15.3.193,ref-mek.7.15.3.202,דיני ממונות בשלשה ור' אומ' בחמשה כדי שיגמר הדין בשלשה ,דיני ממונות בשלשה ר' מאיר אומר בחמישה כדי שיגמר בשלשה ,8,6,450.0,552.0,0.24074074074074073,0.30000000000000004,2050000424
424,553,ref-t.4.1.8.8.41-ref-t.4.1.8.8.54,ref-mek.7.15.3.230-ref-mek.7.15.3.243,761284,761352,120410,120422,ref-t.4.1.8.8.41,ref-t.4.1.8.8.54,343396,343468,55686,55695,ref-mek.7.15.3.230,ref-mek.7.15.3.243,כל המשלם קרן משלם חומש ואשם וכל שאין משלם את הקרן אין משלם,כל המשלם את הקרן חייב לשלם את החומש ושאינו משלם,58,47,418.0,553.0,0.5517241379310345,0.4545454545454546,2050000425
425,555,ref-t.1.4.7.8.19-ref-t.1.4.7.8.27,ref-mek.7.15.3.230-ref-mek.7.15.3.246,116748,116798,18560,18568,ref-t.1.4.7.8.19,ref-t.1.4.7.8.27,343396,343487,55686,55698,ref-mek.7.15.3.230,ref-mek.7.15.3.246,לרעהו ולא להקדש אכלה משלם שני חומשין קרן וחומש,כל המשלם את הקרן חייב לשלם את החומש ושאינו משלם את הקרן פטור,46,60,50.0,553.0,0.6666666666666666,0.5833333333333333,2050000426
426,557,ref-t.4.6.6.3.14-ref-t.4.6.6.3.30,ref-mek.7.16.2.38-ref-mek.7.16.2.51,962387,962476,152642,152658,ref-t.4.6.6.3.14,ref-t.4.6.6.3.30,344762,344840,55914,55925,ref-mek.7.16.2.38,ref-mek.7.16.2.51,שבועת ייי תהיה בין שניהם בזמן שאחד מהן חשוד לא בזמן ששניהן חשודין בין שניהם אינה יוצא ,שניהם להוציא את היורשין בין שניהם להוציא את שכנגדו חשוד על השבועה בין שניהם ,16,11,546.0,557.0,0.6744186046511628,0.6923076923076923,2050000427
427,558,ref-t.4.6.6.1.2-ref-t.4.6.6.1.11,ref-mek.7.16.2.124-ref-mek.7.16.2.136,961599,961660,152517,152526,ref-t.4.6.6.1.2,ref-t.4.6.6.1.11,345181,345255,55981,55991,ref-mek.7.16.2.124,ref-mek.7.16.2.136,הנשבעין שבתורה נשבעין ולא משלמין שנ' ולקח בעליו ולא ישלם,ולקח בעליו ולא ישלם מכאן אמרו כל הנשבעים נשבעים ולא משלמין,56,58,543.0,558.0,0.7068965517241379,0.4,2050000428
428,560,ref-t.4.4.1.3.34-ref-t.4.4.1.3.52,ref-mek.7.16.4.90-ref-mek.7.16.4.102,881249,881333,139642,139659,ref-t.4.4.1.3.34,ref-t.4.4.1.3.52,346281,346346,56139,56151,ref-mek.7.16.4.90,ref-mek.7.16.4.102,שיש משפט אמת אין שלום וכל מקום שיש שלום אין משפט אמת אלא אי זהו משפט שיש בו שלום ,יש טרפה שהוא משלם ויש טרפה שאינו משלם ואי זה טרפה שחייב לשלם ,17,12,451.0,560.0,0.5925925925925926,0.8333333333333334,2050000429
429,561,ref-t.5.4.1.10.35-ref-t.5.4.1.10.40,ref-mek.7.16.4.140-ref-mek.7.16.4.145,1157501,1157543,182905,182910,ref-t.5.4.1.10.35,ref-t.5.4.1.10.40,346537,346579,56183,56188,ref-mek.7.16.4.140,ref-mek.7.16.4.145,הזאב והארי והדוב והנמר והברדלס והנחש ,הזאב והארי והדוב והנמר והברדלס והנחש ,5,5,603.0,561.0,0.0,0.0,2050000430
430,562,ref-t.4.9.1.7.71-ref-t.4.9.1.7.84,ref-mek.7.16.5.40-ref-mek.7.16.5.51,1007797,1007864,159851,159864,ref-t.4.9.1.7.71,ref-t.4.9.1.7.84,346915,346973,56239,56250,ref-mek.7.16.5.40,ref-mek.7.16.5.51,ונאמר להלן דבר מה דבר האמור להלן מקצתו ולא כולו אף דבר האמור כך ,ונאמר להלן מיתה מה מיתה האמורה להלן שבויה בכלל אף כאן כך ,13,11,557.0,562.0,0.4375,0.5833333333333333,2050000431
431,563,ref-t.4.4.13.9.58-ref-t.4.4.13.9.72,ref-mek.7.16.5.40-ref-mek.7.16.5.53,927520,927605,147044,147058,ref-t.4.4.13.9.58,ref-t.4.4.13.9.72,346915,346985,56239,56252,ref-mek.7.16.5.40,ref-mek.7.16.5.53,ונאמרה להלן אבדה מתבקשת מה אבידה האמורה להלן אבידה מתבקשת אף אבידה האמורה כן אבידה ,ונאמר להלן מיתה מה מיתה האמורה להלן שבויה בכלל אף כאן כך גנבה ואבדה ,14,13,511.0,562.0,0.43373493975903615,0.5,2050000432
432,564,ref-t.4.2.3.2.23-ref-t.4.2.3.2.35,ref-mek.7.16.6.25-ref-mek.7.16.6.39,793584,793652,125584,125594,ref-t.4.2.3.2.23,ref-t.4.2.3.2.35,347367,347458,56315,56329,ref-mek.7.16.6.25,ref-mek.7.16.6.39,ונגנבה או אבדה ואמ' הריני משלם ואיני נשבע שילם ואחר כך נמצא הגנב ,שנשבע על האונסין משלם הגנבה והאבדה אף שוכר נשבע על האונסין וישלם הגנבה והאבדה והרי ,10,14,431.0,564.0,0.7228915662650602,0.7647058823529411,2050000433
433,565,ref-t.3.5.7.9.77-ref-t.3.5.7.9.90,ref-mek.7.16.6.101-ref-mek.7.17.1.7,650224,650297,102778,102791,ref-t.3.5.7.9.77,ref-t.3.5.7.9.90,347789,347862,56385,56399,ref-mek.7.16.6.101,ref-mek.7.17.1.7,אנשים באו ללמוד נשים באו לשמוע טפילין למה הן באין כדי ליתן שכר למביאיהן ,ומהנה לכך נאמר אם שכיר הוא בא בשכרו וכי יפתה איש בתולה בא הכתוב ללמד ,13,14,297.0,565.0,0.7777777777777778,0.7777777777777778,2050000434
434,566,ref-t.5.5.2.9.33-ref-t.5.5.2.9.51,ref-mek.7.17.1.132-ref-mek.7.17.1.147,1184031,1184129,187111,187129,ref-t.5.5.2.9.33,ref-t.5.5.2.9.51,348519,348592,56502,56513,ref-mek.7.17.1.132,ref-mek.7.17.1.147,נאמ' כאן וחשב ונאמ' להלן וחשב מה וחשב האמור להלן חמשים סלע לבית כור אף וחשב האמור כאן חמשים ,נאמר כאן אשר לא אורשה ונאמר להלן אשר לא אורשה מה להלן חמשים אף כאן חמשים ,18,11,620.0,566.0,0.5217391304347826,0.6428571428571428,2050000435
435,567,ref-t.5.3.7.13.40-ref-t.5.3.7.13.44,ref-mek.7.17.2.107-ref-mek.7.17.2.112,1124889,1124915,177513,177517,ref-t.5.3.7.13.40,ref-t.5.3.7.13.44,350337,350369,56806,56811,ref-mek.7.17.2.107,ref-mek.7.17.2.112,בכלל היתה ולמה יצאת להקיש ,בכלל מכשפים היו ולמה יצאו להקיש ,4,5,595.0,567.0,0.28125,0.5714285714285714,2050000436
436,568,ref-t.3.5.7.20.53-ref-t.3.5.7.20.61,ref-mek.7.17.2.107-ref-mek.7.17.2.116,653452,653493,103338,103346,ref-t.3.5.7.20.53,ref-t.3.5.7.20.61,350337,350388,56806,56815,ref-mek.7.17.2.107,ref-mek.7.17.2.116,בכלל היה ולמה יצאה להקיש עליו לומר לך מה ,בכלל מכשפים היו ולמה יצאו להקיש עליהם ולומר לך מה ,8,9,298.0,567.0,0.24,0.5,2050000437
437,569,ref-t.4.1.6.18.62-ref-t.4.1.6.18.68,ref-mek.7.17.2.107-ref-mek.7.17.2.116,748673,748707,118520,118526,ref-t.4.1.6.18.62,ref-t.4.1.6.18.68,350337,350388,56806,56815,ref-mek.7.17.2.107,ref-mek.7.17.2.116,בכלל היו ולמה יצאו להקיש עליהן מה ,בכלל מכשפים היו ולמה יצאו להקיש עליהם ולומר לך מה ,6,9,383.0,567.0,0.34,0.5555555555555556,2050000438
438,570,ref-t.3.5.13.9.23-ref-t.3.5.13.9.32,ref-mek.7.18.1.219-ref-mek.7.18.1.226,676658,676702,107296,107304,ref-t.3.5.13.9.23,ref-t.3.5.13.9.32,353042,353081,57233,57240,ref-mek.7.18.1.219,ref-mek.7.18.1.226,נאמר הנה לא ינום ולא ישן אלא כל זמן שישראל ,שנאמר הנה לא ינום ולא יישן שומר ישראל ,8,7,330.0,570.0,0.27906976744186046,0.6,2050000439
439,571,ref-t.3.6.6.3.42-ref-t.3.6.6.4.8,ref-mek.7.18.1.360-ref-mek.7.18.1.375,702635,702690,111388,111399,ref-t.3.6.6.3.42,ref-t.3.6.6.4.8,353758,353831,57365,57380,ref-mek.7.18.1.360,ref-mek.7.18.1.375,נקראין על שמו כשר גר ששינה שמו כשם הגוים כשר וכן אתה,לה' ובשם ישראל יכנה לה' אני ואל יתערב בי חטא וזה יקרא בשם יעקב אלו גרי,52,70,340.0,571.0,0.7857142857142857,0.7777777777777778,2050000440
440,573,ref-t.3.5.10.2.54-ref-t.3.5.10.2.75,ref-mek.7.18.3.117-ref-mek.7.18.3.140,663440,663545,105000,105020,ref-t.3.5.10.2.54,ref-t.3.5.10.2.75,354726,354847,57518,57540,ref-mek.7.18.3.117,ref-mek.7.18.3.140,ואין איש שם על לב ואומ' יבא שלום ינוחו על משכותם וגו' הולך שלום אל הקבר ואומ' ואתם קרבו הנה בני עוננה ,ואין איש שם על לב ואנשי חסד נאספו ואין מבין ואומר יבא שלום ינוחו על משכבם הולך נכוחו ולבסוף ואתם קרבו הנה בני עוננה ,20,22,314.0,573.0,0.41379310344827586,0.5217391304347826,2050000441
