baseOrig,compOrig,baseCharStart,baseCharEnd,baseRefStart,baseRefEnd,compCharStart,compCharEnd,compRefStart,compRefEnd,baseStr,compStr,bRange,cRange,compOrder,grp-ref-sifre-n,baseOrder,grp-ref-m,dam-lev,jac,id
ref-m.1.1.8.6.3-ref-m.1.1.8.6.12,ref-sifre-n.16.1.110-ref-sifre-n.16.1.116,9257,9307,ref-m.1.1.8.6.3,ref-m.1.1.8.6.12,27523,27557,ref-sifre-n.16.1.110,ref-sifre-n.16.1.116,לא על הנר ולא על הבשמים של עובדי כוכבים ולא על ,לא על הלוח ולא על הנייר ולא על ,11,8,120,118.0,0,0.0,0.46808510638297873,0.625,1050000001
ref-m.1.2.1.6.5-ref-m.1.2.1.6.29,ref-sifre-n.110.2.263-ref-sifre-n.110.2.276,12289,12437,ref-m.1.2.1.6.5,ref-m.1.2.1.6.29,159403,159493,ref-sifre-n.110.2.263,ref-sifre-n.110.2.276,פאה ופטור מן המעשרות עד שימרח ונותן משום הפקר ופטור מן המעשרות עד שימרח ומאכיל לבהמה ולחיה ולעופות ופטור מן המעשרות עד שימרח ונוטל מן ,ופאה שמינם חיבת במעשרות לפיכך חייבים בחלה תאמר בעיסת שביעית שמינם פטורים מן המעשרות ,25,14,316,311.0,1,1.0,0.7014925373134329,0.8181818181818181,1050000002
ref-m.1.2.4.6.9-ref-m.1.2.4.6.15,ref-sifre-n.110.2.138-ref-sifre-n.110.2.145,16311,16347,ref-m.1.2.4.6.9,ref-m.1.2.4.6.15,158690,158732,ref-sifre-n.110.2.138,ref-sifre-n.110.2.145,פטור מן הלקט ומן השכחה ומן הפאה ,פטורים מן החלה לקט שכחה ופאה שפטורים מן ,7,8,303,301.0,2,2.0,0.525,0.5555555555555556,1050000003
ref-m.1.3.5.10.34-ref-m.1.3.5.11.14,ref-sifre-n.120.1.59-ref-sifre-n.120.1.85,31019,31115,ref-m.1.3.5.10.34,ref-m.1.3.5.11.14,201025,201178,ref-sifre-n.120.1.59,ref-sifre-n.120.1.85,מעשר בפירות והרמותם ממנו ממין על מינו ולא ממין על שאינו מינו והרמותם ממנו מופנה להקיש ולדון ממנו גזירה שוה והרמותם ממנו שלא יתרום מן המחובר על,מעשר בפירות והרמותם ממנו ממין על מינו ולא ממין על שאינו מינו והרמותם ממנו מופנה להקיש ולדון ממנו גזירה שוה והרמותם ממנו שלא יתרום מן המחובר על,15,25,416,416.0,3,3.0,0.0,0.0,1050000004
ref-m.1.4.1.9.36-ref-m.1.4.2.1.1,ref-sifre-n.110.2.28-ref-sifre-n.110.2.38,36319,36390,ref-m.1.4.1.9.36,ref-m.1.4.2.1.1,158041,158121,ref-sifre-n.110.2.28,ref-sifre-n.110.2.38,עד שיהו שני חטים ושעורה או חטה ושתי שעורים או חטה ושעורה וכוסמת כל ,עד שתתגלגל בחטים ותיטמטם בשעורים בלבלה גלגלה בחטים וטימטמה בשעורים האוכל ,14,11,299,298.0,5,5.0,0.6301369863013698,0.7857142857142857,1050000005
ref-m.1.5.1.4.1-ref-m.1.5.1.4.13,ref-sifre-n.70.1.11-ref-sifre-n.70.1.51,50894,50957,ref-m.1.5.1.4.1,ref-m.1.5.1.4.13,95184,95391,ref-sifre-n.70.1.11,ref-sifre-n.70.1.51,"ואחד צבור עושה פסח שני ת""ל ויהי אנשים היחיד עושה פסח שני ואין הצבור עושים פסח שני רבי נתן אומר אין צריך שהרי כבר נאמר והאיש איש וגו' היחיד עושה פסח שני ואין הצבור עושים פסח שני וחדל לעשות הפסח אין","ואחד צבור עושה פסח שני ת""ל ויהי אנשים היחיד עושה פסח שני ואין הצבור עושים פסח שני רבי נתן אומר אין צריך שהרי כבר נאמר והאיש איש וגו' היחיד עושה פסח שני ואין הצבור עושים פסח שני וחדל לעשות הפסח אין",13,41,248,248.0,6,6.0,0.0,0.0,1050000006
ref-m.1.5.2.7.1-ref-m.1.5.2.7.4,ref-sifre-n.110.1.138-ref-sifre-n.110.1.141,53039,53073,ref-m.1.5.2.7.1,ref-m.1.5.2.7.4,156908,156940,ref-sifre-n.110.1.138,ref-sifre-n.110.1.141,האורז והדוחן והפרגין והשומשמין ,אורז ודוחן והפרגים והשומשומים ,4,4,295,295.0,8,8.0,0.16129032258064516,0.0,1050000007
ref-m.1.5.9.9.30-ref-m.1.5.9.9.38,ref-sifre-n.110.2.287-ref-sifre-n.110.2.302,66393,66442,ref-m.1.5.9.9.30,ref-m.1.5.9.9.38,159551,159638,ref-sifre-n.110.2.287,ref-sifre-n.110.2.302,עיסת שביעית שתהא חיבת בחלה מכאן אמרו האוכל מעיסת שביעית עד שלא הורמה חלתה חיב מיתה,עיסת שביעית שתהא חיבת בחלה מכאן אמרו האוכל מעיסת שביעית עד שלא הורמה חלתה חיב מיתה,9,16,320,320.0,9,9.0,0.0,0.0,1050000008
ref-m.1.6.1.5.3-ref-m.1.6.1.5.12,ref-sifre-n.110.2.139-ref-sifre-n.110.2.146,68716,68771,ref-m.1.6.1.5.3,ref-m.1.6.1.5.12,158697,158739,ref-sifre-n.110.2.139,ref-sifre-n.110.2.146,מן הלקט ומן השכחה ומן הפאה ומן ההפקר ולא ממעשר ,מן החלה לקט שכחה ופאה שפטורים מן המעשר ,10,8,304,301.0,13,11.0,0.5106382978723404,0.6363636363636364,1050000009
ref-m.1.6.1.5.3-ref-m.1.6.1.5.12,ref-sifre-n.110.2.170-ref-sifre-n.110.2.180,68716,68771,ref-m.1.6.1.5.3,ref-m.1.6.1.5.12,158884,158941,ref-sifre-n.110.2.170,ref-sifre-n.110.2.180,מן הלקט ומן השכחה ומן הפאה ומן ההפקר ולא ממעשר ,מן החלה שהיה בדין ומה לקט שכחה ופאה שפטורים מן המעשר ,10,11,308,306.0,14,11.0,0.5849056603773585,0.7142857142857143,1050000010
ref-m.1.6.1.4.23-ref-m.1.6.1.5.68,ref-sifre-n.120.1.76-ref-sifre-n.120.1.138,68699,69065,ref-m.1.6.1.4.23,ref-m.1.6.1.5.68,201125,201464,ref-sifre-n.120.1.76,ref-sifre-n.120.1.138,"ממנו גזירה שוה והרמותם ממנו שלא יתרום מן המחובר על התלוש ולא מן התלוש על המחובר ולא מן החדש על הישן ולא מן הישן על החדש והרמותם ממנו שלא יתרום מפירות הארץ על פירות חו""ל ולא מפירות חו""ל על פירות הארץ ת""ל ויקרא כז וכל מעשר הארץ שלא יתרום מפירות הארץ על פירות חו""ל ולא מפירות חו""ל על פירות הארץ והרמותם ממנו תרומת","ממנו גזירה שוה והרמותם ממנו שלא יתרום מן המחובר על התלוש ולא מן התלוש על המחובר ולא מן החדש על הישן ולא מן הישן על החדש והרמותם ממנו שלא יתרום מפירות הארץ על פירות חו""ל ולא מפירות חו""ל על פירות הארץ ת""ל ויקרא כז וכל מעשר הארץ שלא יתרום מפירות הארץ על פירות חו""ל ולא מפירות חו""ל על פירות הארץ והרמותם ממנו תרומת",59,48,419,419.0,11,11.0,0.0,0.0,1050000011
ref-m.1.6.2.6.43-ref-m.1.6.2.6.64,ref-sifre-n.120.1.82-ref-sifre-n.120.1.103,71217,71315,ref-m.1.6.2.6.43,ref-m.1.6.2.6.64,201159,201271,ref-sifre-n.120.1.82,ref-sifre-n.120.1.103,יתרום מן המחובר על התלוש ולא מן התלוש על המחובר ולא מן החדש על הישן ולא מן הישן על החדש והרמותם ממנו,יתרום מן המחובר על התלוש ולא מן התלוש על המחובר ולא מן החדש על הישן ולא מן הישן על החדש והרמותם ממנו,15,22,422,422.0,16,16.0,0.0,0.0,1050000012
ref-m.1.6.4.4.25-ref-m.1.6.4.5.9,ref-sifre-n.121.1.272-ref-sifre-n.121.1.284,73811,73927,ref-m.1.6.4.4.25,ref-m.1.6.4.5.9,203004,203069,ref-sifre-n.121.1.272,ref-sifre-n.121.1.284,"מעשרותיכם הרי תרומת מעשר אמור הא מה ת""ל תרימו את תרומת ה' בתרומה","מעשרותיכם הרי תרומת מעשר אמור הא מה ת""ל תרימו את תרומת ה' בתרומה",19,13,426,426.0,18,18.0,0.0,0.0,1050000013
ref-m.1.6.6.5.3-ref-m.1.6.6.5.12,ref-sifre-n.110.2.139-ref-sifre-n.110.2.146,78264,78319,ref-m.1.6.6.5.3,ref-m.1.6.6.5.12,158697,158739,ref-sifre-n.110.2.139,ref-sifre-n.110.2.146,מן הלקט ומן השכחה ומן הפאה ומן ההפקר ולא ממעשר ,מן החלה לקט שכחה ופאה שפטורים מן המעשר ,10,8,305,301.0,20,20.0,0.5106382978723404,0.6363636363636364,1050000014
ref-m.1.6.6.5.3-ref-m.1.6.6.5.12,ref-sifre-n.110.2.170-ref-sifre-n.110.2.180,78264,78319,ref-m.1.6.6.5.3,ref-m.1.6.6.5.12,158884,158941,ref-sifre-n.110.2.170,ref-sifre-n.110.2.180,מן הלקט ומן השכחה ומן הפאה ומן ההפקר ולא ממעשר ,מן החלה שהיה בדין ומה לקט שכחה ופאה שפטורים מן המעשר ,10,11,309,306.0,21,20.0,0.5849056603773585,0.7142857142857143,1050000015
ref-m.1.6.6.6.47-ref-m.1.6.6.6.63,ref-sifre-n.5.1.174-ref-sifre-n.6.1.21,78674,78763,ref-m.1.6.6.6.47,ref-m.1.6.6.6.63,11032,11156,ref-sifre-n.5.1.174,ref-sifre-n.6.1.21,ונתן לכהן את הקדש כל שהוא ראוי להיות קדש דברי רבי אליעזר ורבי עקיבא אומר ונתן לכהן ,נתונים לכהנים ואיש את קדשיו לו יהיו כל הקדשים היו בכלל שנאמר ואיש את קדשיו לו יהיו משך הכתוב כל הקדשים ונתנם לכהנים ,17,23,35,35.0,22,22.0,0.646551724137931,0.7222222222222222,1050000016
ref-m.1.8.5.11.17-ref-m.1.8.5.11.43,ref-sifre-n.120.1.62-ref-sifre-n.120.1.104,107500,107633,ref-m.1.8.5.11.17,ref-m.1.8.5.11.43,201047,201276,ref-sifre-n.120.1.62,ref-sifre-n.120.1.104,שלא יתרום מן המחובר על התלוש ולא מן התלוש על המחובר ולא מן החדש על הישן ולא מן הישן על החדש והרמותם ממנו שלא,ממנו ממין על מינו ולא ממין על שאינו מינו והרמותם ממנו מופנה להקיש ולדון ממנו גזירה שוה והרמותם ממנו שלא יתרום מן המחובר על התלוש ולא מן התלוש על המחובר ולא מן החדש על הישן ולא מן הישן על החדש והרמותם ממנו שלא יתרום מן המחובר על התלוש ולא מן התלוש על המחובר ולא מן החדש על הישן ולא מן הישן על החדש והרמותם ממנו שלא,27,43,418,418.0,23,23.0,0.6549520766773163,0.3529411764705882,1050000017
ref-m.1.9.1.1.5-ref-m.1.9.1.1.10,ref-sifre-n.110.1.131-ref-sifre-n.110.1.136,108540,108587,ref-m.1.9.1.1.5,ref-m.1.9.1.1.10,156859,156902,ref-sifre-n.110.1.131,ref-sifre-n.110.1.136,החטים והשעורים והכוסמין ושבולת שועל ושיפון ,חטים ושעורים וכוסמין ושבולת שועל ושיפון ,6,6,293,292.0,25,25.0,0.06976744186046512,0.0,1050000018
ref-m.1.9.1.1.5-ref-m.1.9.1.1.10,ref-sifre-n.142.5.13-ref-sifre-n.142.5.22,108540,108587,ref-m.1.9.1.1.5,ref-m.1.9.1.1.10,254568,254628,ref-sifre-n.142.5.13,ref-sifre-n.142.5.22,החטים והשעורים והכוסמין ושבולת שועל ושיפון ,החטים או אינו אלא מן השעורים וכוסמים ושבולת שועל ושיפון ,6,10,588,587.0,26,25.0,0.2857142857142857,0.25,1050000019
ref-m.1.9.1.1.5-ref-m.1.9.1.1.10,ref-sifre-n.146.1.47-ref-sifre-n.146.1.52,108540,108587,ref-m.1.9.1.1.5,ref-m.1.9.1.1.10,259274,259321,ref-sifre-n.146.1.47,ref-sifre-n.146.1.52,החטים והשעורים והכוסמין ושבולת שועל ושיפון ,החטים והשעורים והכוסמים ושבולת שועל ושיפון ,6,6,601,601.0,27,25.0,0.023255813953488372,0.0,1050000020
ref-m.1.9.1.1.25-ref-m.1.9.1.2.2,ref-sifre-n.148.1.84-ref-sifre-n.148.1.103,108672,108763,ref-m.1.9.1.1.25,ref-m.1.9.1.2.2,260583,260686,ref-sifre-n.148.1.84,ref-sifre-n.148.1.103,העומר ואם השרישו קודם לעומר העומר מתירן ואם לאו אסורין עד שיבא העומר הבא האוכל מהם ,לעומר ואם הביא פסול קודם לשתי הלחם לא יביא ואם הביא כשר מה הפרש בין עומר לשתי הלחם הקודם לעומר ,16,20,606,604.0,28,28.0,0.5684210526315789,0.7333333333333334,1050000021
ref-m.1.9.1.3.2-ref-m.1.9.1.3.11,ref-sifre-n.110.2.126-ref-sifre-n.110.2.146,108989,109058,ref-m.1.9.1.3.2,ref-m.1.9.1.3.11,158618,158739,ref-sifre-n.110.2.126,ref-sifre-n.110.2.146,ופאה שחיבים בחלה שהיה בדין ומה שאר הפירות שחייבים במעשר פטורים מן החלה לקט שכחה ופאה שפטורים מן המעשר,לקט שכחה ופאה שחיבים בחלה שהיה בדין ומה שאר הפירות שחייבים במעשר פטורים מן החלה לקט שכחה ופאה שפטורים מן המעשר,8,21,301,301.0,34,34.0,0.08181818181818182,0.0,1050000022
ref-m.1.9.1.2.40-ref-m.1.9.1.3.11,ref-sifre-n.110.2.169-ref-sifre-n.110.2.191,108956,109058,ref-m.1.9.1.2.40,ref-m.1.9.1.3.11,158875,159009,ref-sifre-n.110.2.169,ref-sifre-n.110.2.191,לקט שכחה ופאה שפטורים מן המעשר חייבים בחלה שאר פירות שחייבים,שפטורים מן החלה שהיה בדין ומה לקט שכחה ופאה שפטורים מן המעשר חייבים בחלה שאר פירות שחייבים במעשר אינו דין שיהיו חייבים בחלה,13,23,307,307.0,29,29.0,0.5121951219512195,0.2142857142857143,1050000023
ref-m.1.9.1.2.40-ref-m.1.9.1.3.11,ref-sifre-n.110.2.219-ref-sifre-n.110.2.268,108956,109058,ref-m.1.9.1.2.40,ref-m.1.9.1.3.11,159158,159442,ref-sifre-n.110.2.219,ref-sifre-n.110.2.268,שפטורה מן המעשר שתהא חיבת בחלה לא אם אמרת בלקט שכחה ופאה שמינם חיבת במעשרות לפיכך חייבים,שחייבים במעשר פטורים מן החלה עיסת שביעית שפטורה מן המעשר אינו דיו שתהא פטורה מן החלה והרי לקט שכחה ופאה יוכיחו שפטורים מו המעשר חייבים בחלה והן יוכיחו לעיסת שביעית שאף על פי שפטורה מן המעשר שתהא חיבת בחלה לא אם אמרת בלקט שכחה ופאה שמינם חיבת במעשרות,13,48,313,313.0,30,30.0,0.751004016064257,0.45833333333333337,1050000024
ref-m.1.9.1.4.7-ref-m.1.9.1.4.10,ref-sifre-n.110.1.138-ref-sifre-n.110.1.141,109230,109264,ref-m.1.9.1.4.7,ref-m.1.9.1.4.10,156908,156940,ref-sifre-n.110.1.138,ref-sifre-n.110.1.141,האורז והדוחן והפרגים והשומשמין ,אורז ודוחן והפרגים והשומשומים ,4,4,296,295.0,36,36.0,0.12903225806451613,0.0,1050000025
ref-m.1.9.1.4.19-ref-m.1.9.1.5.18,ref-sifre-n.110.2.209-ref-sifre-n.110.2.234,109335,109488,ref-m.1.9.1.4.19,ref-m.1.9.1.5.18,159104,159249,ref-sifre-n.110.2.209,ref-sifre-n.110.2.234,עיסת שביעית שהיא חיבת בחלה שהיה בדין ומה שאר פירות שחייבים במעשר פטורים מן החלה עיסת שביעית שפטורה מן המעשר אינו דיו שתהא פטורה מן החלה,עיסת שביעית שהיא חיבת בחלה שהיה בדין ומה שאר פירות שחייבים במעשר פטורים מן החלה עיסת שביעית שפטורה מן המעשר אינו דיו שתהא פטורה מן החלה,24,19,311,311.0,37,37.0,0.0,0.0,1050000026
ref-m.1.9.1.4.22-ref-m.1.9.1.5.18,ref-sifre-n.110.2.279-ref-sifre-n.110.2.291,109357,109488,ref-m.1.9.1.4.22,ref-m.1.9.1.5.18,159505,159579,ref-sifre-n.110.2.279,ref-sifre-n.110.2.291,פטורה מן החלה תלמוד לומר לדורותיכם להביא אה עיסת שביעית שתהא חיבת בחלה,פטורה מן החלה תלמוד לומר לדורותיכם להביא אה עיסת שביעית שתהא חיבת בחלה,21,13,318,318.0,39,39.0,0.0,0.0,1050000027
ref-m.1.9.1.7.19-ref-m.1.9.1.8.8,ref-sifre-n.110.2.169-ref-sifre-n.110.2.182,109748,109814,ref-m.1.9.1.7.19,ref-m.1.9.1.8.8,158875,158954,ref-sifre-n.110.2.169,ref-sifre-n.110.2.182,פטורה מן החלה עיסת הכלבים בזמן שהרועים אוכלין ממנה חייבת בחלה ,שפטורים מן החלה שהיה בדין ומה לקט שכחה ופאה שפטורים מן המעשר חייבים בחלה ,11,14,306,306.0,41,41.0,0.5342465753424658,0.8947368421052632,1050000028
ref-m.1.9.2.1.1-ref-m.1.9.2.2.8,ref-sifre-n.110.1.42-ref-sifre-n.110.1.70,110367,110506,ref-m.1.9.2.1.1,ref-m.1.9.2.2.8,156382,156541,ref-sifre-n.110.1.42,ref-sifre-n.110.1.70,"שנכנסו לארץ מיד נתחייבו בחלה אשר אני מביא אתכם שמה מכאן אתה אומר פירות חו""ל שנכנסו לארץ חייבים בחלה ובמעשר יצאו מכאן לשם ר' אליעזר מחייב ור' עקיבא פוטר","שנכנסו לארץ מיד נתחייבו בחלה אשר אני מביא אתכם שמה מכאן אתה אומר פירות חו""ל שנכנסו לארץ חייבים בחלה ובמעשר יצאו מכאן לשם ר' אליעזר מחייב ור' עקיבא פוטר",16,29,287,287.0,42,42.0,0.0,0.0,1050000029
ref-m.1.9.3.1.1-ref-m.1.9.3.1.31,ref-sifre-n.110.2.24-ref-sifre-n.110.2.53,111777,111955,ref-m.1.9.3.1.1,ref-m.1.9.3.1.31,158019,158199,ref-sifre-n.110.2.24,ref-sifre-n.110.2.53,אוכלין עראי מן העיסה עד שתתגלגל בחטים ותטמטם בשעורים גלגלה בחטים וטמטמה בשעורים האוכל ממנה חייב מיתה כיון שהיא נותנת את המים מגבהת חלתה ובלבד שלא יהא שם חמשה רבעי קמח ,אוכלים ארעי מן העיסה עד שתתגלגל בחטים ותיטמטם בשעורים בלבלה גלגלה בחטים וטימטמה בשעורים האוכל ממנה חייב מיתה כאן כיון שנותנת מים מגבהת חלתה ובלבד שתהא שם חמשת רבעים קמח ,31,30,298,298.0,44,44.0,0.16568047337278108,0.3666666666666667,1050000030
ref-m.1.9.3.1.5-ref-m.1.9.3.1.9,ref-sifre-n.110.2.81-ref-sifre-n.110.2.85,111799,111834,ref-m.1.9.3.1.5,ref-m.1.9.3.1.9,158341,158376,ref-sifre-n.110.2.81,ref-sifre-n.110.2.85,עד שתתגלגל בחטים ותטמטם בשעורים ,עד שיתגלגל בחטים ומטמטם בשעורים ,5,5,300,300.0,45,44.0,0.0625,0.5714285714285714,1050000031
ref-m.1.10.1.6.3-ref-m.1.10.1.6.17,ref-sifre-n.121.1.427-ref-sifre-n.121.1.432,116409,116491,ref-m.1.10.1.6.3,ref-m.1.10.1.6.17,203767,203801,ref-sifre-n.121.1.427,ref-sifre-n.121.1.432,ערלה ושל כלאי הכרם שנתערבו בנטיעות הרי זה לא ילקוט ואם לקט יעלה באחד ומאתים ,עולה באחד ומאה ערלה וכלאי הכרם ,15,6,428,428.0,46,46.0,0.7631578947368421,0.6666666666666667,1050000032
ref-m.1.10.2.1.8-ref-m.1.10.2.1.29,ref-sifre-n.121.1.427-ref-sifre-n.122.1.3,117136,117261,ref-m.1.10.2.1.8,ref-m.1.10.2.1.29,203767,203835,ref-sifre-n.121.1.427,ref-sifre-n.122.1.3,עולה באחד ומאה ערלה וכלאי הכרם באחד ומאתים אמרת אליהם בהרימכם,עולה באחד ומאה ערלה וכלאי הכרם באחד ומאתים אמרת אליהם בהרימכם,15,11,429,429.0,47,47.0,0.0,0.0,1050000033
ref-m.1.11.1.9.10-ref-m.1.11.1.9.16,ref-sifre-n.5.1.149-ref-sifre-n.5.1.155,122913,122948,ref-m.1.11.1.9.10,ref-m.1.11.1.9.16,10908,10943,ref-sifre-n.5.1.149,ref-sifre-n.5.1.155,ראשית בכורי אדמתך תביא בית ה' אלהיך ,ראשית בכורי אדמתך תביא בית ה' אלהיך ,7,7,34,34.0,49,49.0,0.0,0.0,1050000034
ref-m.1.11.4.1.23-ref-m.1.11.4.2.17,ref-sifre-n.22.1.115-ref-sifre-n.22.1.136,127656,127788,ref-m.1.11.4.1.23,ref-m.1.11.4.2.17,33114,33226,ref-sifre-n.22.1.115,ref-sifre-n.22.1.136,נשים כאנשים תלמוד לומר איש או אשה לעשות נשים כאנשים איש ולא קטן שהיה בדין ומה אם במקום שלא עשה נשים כאנשים תלמוד לומר איש או אשה לעשות נשים כאנשים איש ולא קטן שהיה בדין ומה אם במקום שלא עשה נשים כאנשים,נשים כאנשים תלמוד לומר איש או אשה לעשות נשים כאנשים איש ולא קטן שהיה בדין ומה אם במקום שלא עשה נשים כאנשים תלמוד לומר איש או אשה לעשות נשים כאנשים איש ולא קטן שהיה בדין ומה אם במקום שלא עשה נשים כאנשים,21,22,133,133.0,50,50.0,0.0,0.0,1050000035
ref-m.2.2.10.15.45-ref-m.2.2.10.15.51,ref-sifre-n.112.1.336-ref-sifre-n.112.1.354,178725,178762,ref-m.2.2.10.15.45,ref-m.2.2.10.15.51,165314,165416,ref-sifre-n.112.1.336,ref-sifre-n.112.1.354,שחייבין על זדונה כרת ושגגתה חטאת אף כל העושה מעשה בשגגה מעשה שחייבים על זדונה כרת ועל שגגתה חטאת,שחייבין על זדונה כרת ושגגתה חטאת אף כל העושה מעשה בשגגה מעשה שחייבים על זדונה כרת ועל שגגתה חטאת,7,6,341,341.0,52,52.0,0.0,0.0,1050000036
ref-m.2.3.1.6.41-ref-m.2.3.1.6.52,ref-sifre-n.1.4.76-ref-sifre-n.1.4.94,180055,180118,ref-m.2.3.1.6.41,ref-m.2.3.1.6.52,2203,2294,ref-sifre-n.1.4.76,ref-sifre-n.1.4.94,שטבול יום מטמא טמא מת מטמא חמור טמא מת שהוא מטמא את האדם כל שמחוסר כפורים פוסל טבול יום,שטבול יום מטמא טמא מת מטמא חמור טמא מת שהוא מטמא את האדם כל שמחוסר כפורים פוסל טבול יום,12,17,9,9.0,55,55.0,0.0,0.0,1050000037
ref-m.2.3.2.5.5-ref-m.2.3.2.5.15,ref-sifre-n.110.1.130-ref-sifre-n.110.1.137,180996,181073,ref-m.2.3.2.5.5,ref-m.2.3.2.5.15,156856,156907,ref-sifre-n.110.1.130,ref-sifre-n.110.1.137,בהן ידי חובתו בפסח בחיטים בשעורים בכוסמין ובשיפון ובשבולת שועל ויוצאין ,הן חטים ושעורים וכוסמין ושבולת שועל ושיפון יצאו ,11,8,292,292.0,57,57.0,0.5070422535211268,0.5384615384615384,1050000038
ref-m.2.3.2.5.9-ref-m.2.3.2.5.14,ref-sifre-n.142.5.13-ref-sifre-n.142.5.22,181016,181064,ref-m.2.3.2.5.9,ref-m.2.3.2.5.14,254568,254628,ref-sifre-n.142.5.13,ref-sifre-n.142.5.22,החטים או אינו אלא מן השעורים וכוסמים ושבולת שועל ושיפון,החטים או אינו אלא מן השעורים וכוסמים ושבולת שועל ושיפון,6,9,587,587.0,58,58.0,0.0,0.0,1050000039
ref-m.2.3.2.5.9-ref-m.2.3.2.5.15,ref-sifre-n.146.1.47-ref-sifre-n.146.1.53,181016,181073,ref-m.2.3.2.5.9,ref-m.2.3.2.5.15,259274,259325,ref-sifre-n.146.1.47,ref-sifre-n.146.1.53,בחיטים בשעורים בכוסמין ובשיפון ובשבולת שועל ויוצאין ,החטים והשעורים והכוסמים ושבולת שועל ושיפון יצא ,7,7,603,601.0,60,57.0,0.4230769230769231,0.4444444444444444,1050000040
ref-m.2.3.7.7.26-ref-m.2.3.7.8.1,ref-sifre-n.26.1.134-ref-sifre-n.26.1.188,191404,191469,ref-m.2.3.7.7.26,ref-m.2.3.7.8.1,43949,44231,ref-sifre-n.26.1.134,ref-sifre-n.26.1.188,ואין הציץ מרצה על טומאת הגוף נטמא טומאת התהום הציץ מרצה נטמא ,שאינו מביא קרבן על טומאתו לפיכך מטמא למת מצוה תאמר בנזיר שמביא קרבן על טומאתו שלא יטמא למת מצוה תלמוד לומר לאביו ולאמו לא יטמא לאביו ולאמו לא יטמא אבל מטמא הוא למת מצוה או לאביו ולאמו לא יטמא אבל מטמא הוא לשאר מתים אמרת קל וחומר ומה כהן הדיוט שמטמא הוא לקרובים אין מטמא ,12,55,168,166.0,61,61.0,0.8296296296296296,0.9032258064516129,1050000041
ref-m.2.4.3.2.67-ref-m.2.4.3.2.74,ref-sifre-n.41.1.103-ref-sifre-n.41.1.110,203151,203195,ref-m.2.4.3.2.67,ref-m.2.4.3.2.74,65914,65958,ref-sifre-n.41.1.103,ref-sifre-n.41.1.110,ואומר ומצא חן ושכל טוב בעיני אלהים ואדם ,ואומר ומצא חן ושכל טוב בעיני אלהים ואדם ,8,8,218,218.0,62,62.0,0.0,0.0,1050000042
ref-m.2.4.3.3.18-ref-m.2.4.3.3.28,ref-sifre-n.110.1.161-ref-sifre-n.110.1.176,203297,203353,ref-m.2.4.3.3.18,ref-m.2.4.3.3.28,157046,157126,ref-sifre-n.110.1.161,ref-sifre-n.110.1.176,התורם תורם עד שיאמר להם אתרום והן אומרים לו תרום תרום ,כשהוא אומר חלה תרימו תרומה הרי חלה אמורה הא מה אני מקיים תרימו תרומת ה' בתרומה ,11,16,297,297.0,63,63.0,0.6329113924050633,0.75,1050000043
ref-m.2.4.6.6.61-ref-m.2.4.6.6.70,ref-sifre-n.4.1.77-ref-sifre-n.4.1.88,209364,209420,ref-m.2.4.6.6.61,ref-m.2.4.6.6.70,8595,8660,ref-sifre-n.4.1.77,ref-sifre-n.4.1.88,כתובים קיימים אשם לה' ואשם לכהנים ואומר כסף אשם וכסף ,הכתוב מדבר אשם המושב לה' לכהן בכסף הכתוב מדבר אתה אומר בכסף ,10,12,22,22.0,64,64.0,0.5833333333333334,0.5833333333333333,1050000044
ref-m.2.4.6.6.64-ref-m.2.4.6.6.69,ref-sifre-n.4.3.80-ref-sifre-n.4.3.87,209382,209414,ref-m.2.4.6.6.64,ref-m.2.4.6.6.69,9774,9818,ref-sifre-n.4.3.80,ref-sifre-n.4.3.87,לה' ואשם לכהנים ואומר כסף אשם ,אשם והקרב והוא אומר האשם המושב לה' לכהן ,6,8,29,29.0,65,64.0,0.725,0.4285714285714286,1050000045
ref-m.2.4.7.5.19-ref-m.2.4.7.6.28,ref-sifre-n.107.3.136-ref-sifre-n.108.1.2,210446,210610,ref-m.2.4.7.5.19,ref-m.2.4.7.6.28,154445,154517,ref-sifre-n.107.3.136,ref-sifre-n.108.1.2,נכרי ששילח עולותיו ממדינת הים לא שלח עמה נסכים יקרבו משל צבור כי יגור,נכרי ששילח עולותיו ממדינת הים לא שלח עמה נסכים יקרבו משל צבור כי יגור,32,14,285,285.0,66,66.0,0.0,0.0,1050000046
