baseOrig,compOrig,baseCharStart,baseCharEnd,baseRefStart,baseRefEnd,compCharStart,compCharEnd,compRefStart,compRefEnd,baseStr,compStr,bRange,cRange,compOrder,grp-ref-bible,baseOrder,grp-ref-sifre-n,dam-lev,jac,lcc_len,lcs_str,id,bRangeOriginal,cRangeOriginal
ref-sifre-n.131.1.193-ref-sifre-n.131.1.217,ref-bible.0210.1.8.4-ref-bible.0210.2.1.19,228879,228993,ref-sifre-n.131.1.193,ref-sifre-n.131.1.217,1080726,1080889,ref-bible.0210.1.8.4,ref-bible.0210.2.1.19,ויאמר קרא שמו לא עמי כי אתם לא עמי ואנכי לא אהיה לכם והיה מספר בני ישראל כחול הים אשר לא ימד ולא יספר והיה במקום אשר יאמר להם לא עמי,רחמה ותהר ותלד בן ויאמר קרא שמו לא עמי כי אתם לא עמי ואנכי לא אהיה לכם והיה מספר בני ישראל כחול הים אשר לא ימד ולא יספר והיה במקום אשר יאמר להם לא עמי אתם,31,36,1129,1129.0,919,919.0,0.1428571428571428,0.1578947368421053,31,ויאמר קרא שמו לא עמי כי אתם לא עמי ואנכי לא אהיה לכם והיה מספר בני ישראל כחול הים אשר לא ימד ולא יספר והיה במקום אשר יאמר להם לא עמי,5090000758,31,36
ref-sifre-n.131.1.249-ref-sifre-n.131.1.267,ref-bible.0209.13.9.10-ref-bible.209.13.9.22,229141,229234,ref-sifre-n.131.1.249,ref-sifre-n.131.1.267,999944,1000005,ref-bible.0209.13.9.10,ref-bible.0209.13.9.22,אלא אמור לו בוא כתוב שאני כופל לה כתובתה לכך נאמר כי אתם לא עמי ואומר והיה מספר בני ישראל ,עמי לא יהיו ובכתב בית ישראל לא יכתבו ואל אדמת ישראל לא יבאו ,20,13,1107,1107.0,921,921.0,0.6888888888888889,0.8235294117647058,2,עמי ישראל,5090000759,20,13
ref-sifre-n.131.1.260-ref-sifre-n.131.1.270,ref-bible.0210.1.8.4-ref-bible.0210.2.1.6,229193,229245,ref-sifre-n.131.1.260,ref-sifre-n.131.1.270,1080726,1080832,ref-bible.0210.1.8.4,ref-bible.0210.2.1.6,רחמה ותהר ותלד בן ויאמר קרא שמו לא עמי כי אתם לא עמי ואנכי לא אהיה לכם והיה מספר בני ישראל כחול הים,רחמה ותהר ותלד בן ויאמר קרא שמו לא עמי כי אתם לא עמי ואנכי לא אהיה לכם והיה מספר בני ישראל כחול הים,23,23,1128,1128.0,922,922.0,0.0,0.0,23,רחמה ותהר ותלד בן ויאמר קרא שמו לא עמי כי אתם לא עמי ואנכי לא אהיה לכם והיה מספר בני ישראל כחול הים,5090000760,23,23
ref-sifre-n.131.1.277-ref-sifre-n.131.1.285,ref-bible.0210.14.1.1-ref-bible.210.14.2.3,229273,229321,ref-sifre-n.131.1.277,ref-sifre-n.131.1.285,1091952,1092032,ref-bible.0210.14.1.1,ref-bible.0210.14.2.3,תאשם שומרון כי מרתה באלהיה ואומר שובה ישראל עד ,תאשם שמרון כי מרתה באלהיה בחרב יפלו עלליהם ירטשו והריותיו יבקעו שובה ישראל עד ,9,14,1138,1137.0,924,924.0,0.4487179487179487,0.4615384615384615,7,תאשם כי מרתה באלהיה שובה ישראל עד,5090000761,9,14
ref-sifre-n.131.1.331-ref-sifre-n.131.1.335,ref-bible.0210.14.1.1-ref-bible.210.14.1.5,229583,229610,ref-sifre-n.131.1.331,ref-sifre-n.131.1.335,1091952,1091978,ref-bible.0210.14.1.1,ref-bible.0210.14.1.5,תאשם שומרון כי מרתה באלהיה ,תאשם שמרון כי מרתה באלהיה ,5,5,1137,1137.0,925,925.0,0.037037037037037,0.0,4,תאשם כי מרתה באלהיה,5090000762,5,5
ref-sifre-n.131.2.12-ref-sifre-n.131.2.17,ref-bible.0104.20.5.10-ref-bible.104.20.5.15,229692,229722,ref-sifre-n.131.2.12,ref-sifre-n.131.2.17,299962,299992,ref-bible.0104.20.5.10,ref-bible.0104.20.5.15,לא מקום זרע ותאנה וגפן ורמון ,לא מקום זרע ותאנה וגפן ורמון ,6,6,631,631.0,926,926.0,0.0,0.0,6,לא מקום זרע ותאנה וגפן ורמון,5090000763,6,6
ref-sifre-n.131.2.50-ref-sifre-n.131.2.65,ref-bible.0105.3.4.14-ref-bible.105.3.4.21,229904,229987,ref-sifre-n.131.2.50,ref-sifre-n.131.2.65,343782,343818,ref-bible.0105.3.4.14,ref-bible.0105.3.4.21,ששים עיר וכולם ראויות למלכות שנאמר דברים ג ששים עיר כל חבל ארגוב ממלכת עוג בבשן ,ששים עיר כל חבל ארגב ממלכת עוג בבשן ,16,8,862,862.0,927,927.0,0.55,0.3846153846153846,7,ששים עיר כל חבל ממלכת עוג בבשן,5090000764,16,8
ref-sifre-n.131.2.60-ref-sifre-n.131.2.65,ref-bible.0105.3.13.3-ref-bible.105.3.13.15,229959,229987,ref-sifre-n.131.2.60,ref-sifre-n.131.2.65,344429,344496,ref-bible.0105.3.13.3,ref-bible.0105.3.13.15,כל חבל ארגוב ממלכת עוג בבשן ,וכל הבשן ממלכת עוג נתתי לחצי שבט המנשה כל חבל הארגב לכל הבשן ,6,13,864,864.0,928,927.0,0.7049180327868853,0.4545454545454546,2,ממלכת עוג,5090000765,6,13
ref-sifre-n.131.2.104-ref-sifre-n.131.2.109,ref-bible.0105.3.7.1-ref-bible.105.3.7.6,230202,230236,ref-sifre-n.131.2.104,ref-sifre-n.131.2.109,343958,343992,ref-bible.0105.3.7.1,ref-bible.0105.3.7.6,וכל הבהמה ושלל הערים בזונו לנו ,וכל הבהמה ושלל הערים בזונו לנו ,6,6,863,863.0,929,929.0,0.0,0.0,6,וכל הבהמה ושלל הערים בזונו לנו,5090000766,6,6
ref-sifre-n.131.2.105-ref-sifre-n.131.2.112,ref-bible.0201.8.2.9-ref-bible.201.8.2.14,230207,230251,ref-sifre-n.131.2.105,ref-sifre-n.131.2.112,425100,425128,ref-bible.0201.8.2.9,ref-bible.0201.8.2.14,הבהמה ושלל הערים בזונו לנו באו וישבו להם ,שללה ובהמתה תבזו לכם שים לך ,8,6,933,933.0,931,929.0,0.6585365853658537,0.9166666666666666,0,,5090000767,8,6
ref-sifre-n.131.2.104-ref-sifre-n.131.2.109,ref-bible.0201.11.14.1-ref-bible.201.11.14.7,230202,230236,ref-sifre-n.131.2.104,ref-sifre-n.131.2.109,435583,435621,ref-bible.0201.11.14.1,ref-bible.0201.11.14.7,וכל הבהמה ושלל הערים בזונו לנו ,וכל שלל הערים האלה והבהמה בזזו להם ,6,7,936,936.0,930,929.0,0.5714285714285714,0.5555555555555556,2,וכל הערים,5090000768,6,7
ref-sifre-n.131.2.238-ref-sifre-n.131.2.248,ref-bible.0201.15.18.11-ref-bible.0201.15.19.14,230938,230986,ref-sifre-n.131.2.238,ref-sifre-n.131.2.248,443086,443170,ref-bible.0201.15.18.11,ref-bible.0201.15.19.14,ויאמר לה כלב מה לך ותאמר תנה לי ברכה כי ארץ הנגב נתתני ונתתה לי גלת מים ויתן לה,ויאמר לה כלב מה לך ותאמר תנה לי ברכה כי ארץ הנגב נתתני ונתתה לי גלת מים ויתן לה,19,19,941,941.0,932,932.0,0.0,0.0,19,ויאמר לה כלב מה לך ותאמר תנה לי ברכה כי ארץ הנגב נתתני ונתתה לי גלת מים ויתן לה,5090000769,19,19
ref-sifre-n.131.2.280-ref-sifre-n.131.2.284,ref-bible.0210.9.10.14-ref-bible.210.9.10.18,231146,231181,ref-sifre-n.131.2.280,ref-sifre-n.131.2.284,1088089,1088123,ref-bible.0210.9.10.14,ref-bible.0210.9.10.18,וינזרו לבושת ויהיו שקוצים כאהבם ,וינזרו לבשת ויהיו שקוצים כאהבם ,5,5,1136,1135.0,934,934.0,0.03125,0.0,4,וינזרו ויהיו שקוצים כאהבם,5090000770,5,5
ref-sifre-n.131.2.486-ref-sifre-n.131.2.493,ref-bible.0104.25.5.4-ref-bible.104.25.5.11,232226,232272,ref-sifre-n.131.2.486,ref-sifre-n.131.2.493,311173,311218,ref-bible.0104.25.5.4,ref-bible.0104.25.5.11,שופטי ישראל הרגו איש אנשיו הנצמדים לבעל פעור ,שפטי ישראל הרגו איש אנשיו הנצמדים לבעל פעור ,8,8,639,639.0,935,935.0,0.0222222222222222,0.0,7,ישראל הרגו איש אנשיו הנצמדים לבעל פעור,5090000771,8,8
ref-sifre-n.131.2.558-ref-sifre-n.131.2.577,ref-bible.0104.25.6.1-ref-bible.104.25.6.20,232596,232708,ref-sifre-n.131.2.558,ref-sifre-n.131.2.577,311219,311330,ref-bible.0104.25.6.1,ref-bible.0104.25.6.20,והנה איש מבני ישראל בא ויקרב אל אחיו את המדינית לעיני משה ולעיני כל עדת בני ישראל והמה בוכים פתח אהל מועד ,והנה איש מבני ישראל בא ויקרב אל אחיו את המדינית לעיני משה ולעיני כל עדת בני ישראל והמה בכים פתח אהל מועד ,20,17,640,640.0,936,936.0,0.0377358490566037,0.125,15,והנה איש מבני ישראל בא ויקרב אל אחיו את המדינית לעיני משה ולעיני והמה פתח_אהל_מועד,5090000772,20,17
ref-sifre-n.131.2.743-ref-sifre-n.131.2.751,ref-bible.0301.106.30.1-ref-bible.301.106.31.6,233574,233631,ref-sifre-n.131.2.743,ref-sifre-n.131.2.751,1228158,1228221,ref-bible.0301.106.30.1,ref-bible.0301.106.31.6,ויעמוד פינחס ויפלל ותעצר המגפה ותחשב לו לצדקה ועוד ,ויעמד פינחס ויפלל ותעצר המגפה ותחשב לו לצדקה לדר ודר עד ,9,11,1185,1185.0,937,937.0,0.1607142857142857,0.1111111111111111,7,פינחס ויפלל ותעצר המגפה ותחשב לו לצדקה,5090000773,9,11
ref-sifre-n.131.5.1-ref-sifre-n.131.5.18,ref-bible.0104.25.13.1-ref-bible.104.25.13.12,234507,234609,ref-sifre-n.131.5.1,ref-sifre-n.131.5.18,311709,311774,ref-bible.0104.25.13.1,ref-bible.0104.25.13.12,"והיתה לו ולזרעו אחריו ברית כהונת עולם אלו כ""ד מתנות כהונה שניתנו לכהנים תחת אשר קנא לאלהיו ויכפר ",והיתה לו ולזרעו אחריו ברית כהנת עולם תחת אשר קנא לאלהיו ויכפר ,18,12,641,641.0,938,938.0,0.3608247422680412,0.3125,11,והיתה לו ולזרעו אחריו ברית עולם תחת אשר קנא לאלהיו ויכפר,5090000774,18,12
ref-sifre-n.132.1.23-ref-sifre-n.132.1.29,ref-bible.0104.18.20.4-ref-bible.104.18.20.12,234896,234933,ref-sifre-n.132.1.23,ref-sifre-n.132.1.29,296904,296946,ref-bible.0104.18.20.4,ref-bible.0104.18.20.12,אהרן בארצם לא תנחל יצאו כהנים ובתוך ,אהרן בארצם לא תנחל וחלק לא יהיה לך בתוכם ,7,7,570,566.0,939,939.0,0.3902439024390244,0.6666666666666667,4,אהרן בארצם לא תנחל,5090000775,7,7
ref-sifre-n.132.1.170-ref-sifre-n.132.2.6,ref-bible.0104.26.53.4-ref-bible.104.26.54.6,235706,235747,ref-sifre-n.132.1.170,ref-sifre-n.132.2.6,315050,315103,ref-bible.0104.26.53.4,ref-bible.0104.26.54.6,תתנחלו לרב תרבו נחלתו ולמעט תמעיט נחלתו ,בנחלה במספר שמות לרב תרבה נחלתו ולמעט תמעיט נחלתו ,7,9,643,643.0,940,940.0,0.28,0.4444444444444444,5,לרב נחלתו ולמעט תמעיט נחלתו,5090000776,7,9
ref-sifre-n.132.2.1-ref-sifre-n.132.2.6,ref-bible.0104.33.54.6-ref-bible.104.33.54.13,235713,235747,ref-sifre-n.132.2.1,ref-sifre-n.132.2.6,331914,331954,ref-bible.0104.33.54.6,ref-bible.0104.33.54.13,לרב תרבו נחלתו ולמעט תמעיט נחלתו ,לרב תרבו את נחלתו ולמעט תמעיט את נחלתו ,6,8,773,773.0,941,940.0,0.1538461538461538,0.1666666666666666,6,לרב תרבו נחלתו ולמעט תמעיט נחלתו,5090000777,6,8
ref-sifre-n.132.2.1-ref-sifre-n.132.2.6,ref-bible.0104.35.8.8-ref-bible.104.35.8.15,235713,235747,ref-sifre-n.132.2.1,ref-sifre-n.132.2.6,334363,334405,ref-bible.0104.35.8.8,ref-bible.0104.35.8.15,לרב תרבו נחלתו ולמעט תמעיט נחלתו ,הרב תרבו ומאת המעט תמעיטו איש כפי נחלתו ,6,8,776,776.0,942,940.0,0.4,0.5555555555555556,2,תרבו נחלתו,5090000778,6,8
ref-sifre-n.132.2.67-ref-sifre-n.132.2.98,ref-bible.0201.17.14.15-ref-bible.0201.17.15.21,236074,236219,ref-sifre-n.132.2.67,ref-sifre-n.132.2.98,446741,446874,ref-bible.0201.17.14.15,ref-bible.0201.17.15.21,ואני עם רב עד אשר עד כה ברכני יהוה ויאמר אליהם יהושע אם עם רב אתה עלה לך היערה ובראת לך שם בארץ הפרזי והרפאים כי אץ לך הר אפרים,ואני עם רב עד אשר עד כה ברכני יהוה ויאמר אליהם יהושע אם עם רב אתה עלה לך היערה ובראת לך שם בארץ הפרזי והרפאים כי אץ לך הר אפרים,30,30,948,948.0,943,943.0,0.0,0.0,30,ואני עם רב עד אשר עד כה ברכני יהוה ויאמר אליהם יהושע אם עם רב אתה עלה לך היערה ובראת לך שם בארץ הפרזי והרפאים כי אץ לך הר אפרים,5090000779,30,30
ref-sifre-n.132.3.10-ref-sifre-n.132.3.15,ref-bible.0202.1.20.1-ref-bible.202.1.20.6,236448,236482,ref-sifre-n.132.3.10,ref-sifre-n.132.3.15,465996,466030,ref-bible.0202.1.20.1,ref-bible.0202.1.20.6,ויתנו לכלב את חברון כאשר דבר משה ,ויתנו לכלב את חברון כאשר דבר משה ,7,7,963,963.0,945,945.0,0.0,0.0,7,ויתנו לכלב את חברון כאשר דבר משה,5090000780,7,7
ref-sifre-n.132.3.20-ref-sifre-n.132.3.39,ref-bible.0201.19.49.6-ref-bible.201.19.50.12,236499,236586,ref-sifre-n.132.3.20,ref-sifre-n.132.3.39,451929,452019,ref-bible.0201.19.49.6,ref-bible.0201.19.50.12,ויתנו בני ישראל נחלתם ליהושע בן נון בתוכם על פי ה' נתנו לו את עיר אשר שאל את תמנת סרח ,ויתנו בני ישראל נחלה ליהושע בן נון בתוכם על פי יהוה נתנו לו את העיר אשר שאל את תמנת סרח ,16,16,950,950.0,947,946.0,0.0681818181818181,0.2666666666666667,13,ויתנו בני ישראל ליהושע_בן_נון בתוכם נתנו לו את אשר שאל את תמנת סרח,5090000781,16,16
ref-sifre-n.132.3.20-ref-sifre-n.132.3.34,ref-bible.0201.21.2.11-ref-bible.201.21.3.5,236499,236566,ref-sifre-n.132.3.20,ref-sifre-n.132.3.34,453209,453277,ref-bible.0201.21.2.11,ref-bible.0201.21.3.5,ויתנו בני ישראל נחלתם ליהושע בן נון בתוכם על פי ה' נתנו לו את עיר ,לתת לנו ערים לשבת ומגרשיהן לבהמתנו ויתנו בני ישראל ללוים מנחלתם ,11,11,957,957.0,946,946.0,0.7727272727272727,0.8125,3,ויתנו בני ישראל,5090000782,11,11
ref-sifre-n.133.1.58-ref-sifre-n.133.1.65,ref-bible.0104.27.1.2-ref-bible.104.27.1.13,237023,237053,ref-sifre-n.133.1.58,ref-sifre-n.133.1.65,315950,316004,ref-bible.0104.27.1.2,ref-bible.0104.27.1.13,בן חפר בן גלעד בן מכיר בן מנשה ,בנות צלפחד בן חפר בן גלעד בן מכיר בן מנשה למשפחת מנשה ,8,10,645,645.0,948,948.0,0.4444444444444444,0.5555555555555556,6,בן חפר בן גלעד בן מנשה,5090000783,8,10
ref-sifre-n.133.2.47-ref-sifre-n.133.2.56,ref-bible.0104.26.33.10-ref-bible.104.26.33.18,237831,237887,ref-sifre-n.133.2.47,ref-sifre-n.133.2.56,313941,313989,ref-bible.0104.26.33.10,ref-bible.0104.26.33.18,בנות צלפחד ואלה בנות צלפחד מחלה נועה חגלה ומלכה ותרצה ,בנות ושם בנות צלפחד מחלה ונעה חגלה מלכה ותרצה ,10,9,642,642.0,952,949.0,0.2037037037037037,0.5454545454545454,6,בנות בנות צלפחד מחלה חגלה ותרצה,5090000784,10,9
ref-sifre-n.133.2.35-ref-sifre-n.133.2.56,ref-bible.0104.27.1.2-ref-bible.104.27.1.23,237770,237887,ref-sifre-n.133.2.35,ref-sifre-n.133.2.56,315950,316059,ref-bible.0104.27.1.2,ref-bible.0104.27.1.23,ולמשפחות מנשה בן יוסף כשם שחיבב יוסף את ארץ ישראל כך חיבבו בנות צלפחד ואלה בנות צלפחד מחלה נועה חגלה ומלכה ותרצה ,בנות צלפחד בן חפר בן גלעד בן מכיר בן מנשה למשפחת מנשה בן יוסף ואלה שמות בנתיו מחלה נעה וחגלה ומלכה ותרצה ,22,20,646,645.0,951,949.0,0.5663716814159292,0.5416666666666667,7,מנשה בן יוסף ואלה מחלה ומלכה ותרצה,5090000785,22,20
ref-sifre-n.133.2.35-ref-sifre-n.133.2.55,ref-bible.0104.36.10.8-ref-bible.0104.36.12.4,237770,237880,ref-sifre-n.133.2.35,ref-sifre-n.133.2.55,337051,337155,ref-bible.0104.36.10.8,ref-bible.0104.36.12.4,בנות צלפחד ותהיינה מחלה תרצה וחגלה ומלכה ונעה בנות צלפחד לבני דדיהן לנשים ממשפחת בני מנשה בן יוסף,בנות צלפחד ותהיינה מחלה תרצה וחגלה ומלכה ונעה בנות צלפחד לבני דדיהן לנשים ממשפחת בני מנשה בן יוסף,18,18,851,851.0,949,949.0,0.0,0.0,18,בנות צלפחד ותהיינה מחלה תרצה וחגלה ומלכה ונעה בנות צלפחד לבני דדיהן לנשים ממשפחת בני מנשה בן יוסף,5090000786,18,18
ref-sifre-n.133.2.47-ref-sifre-n.133.2.56,ref-bible.0201.17.3.16-ref-bible.201.17.3.24,237831,237887,ref-sifre-n.133.2.47,ref-sifre-n.133.2.56,445720,445769,ref-bible.0201.17.3.16,ref-bible.0201.17.3.24,בנות צלפחד ואלה בנות צלפחד מחלה נועה חגלה ומלכה ותרצה ,בנות ואלה שמות בנתיו מחלה ונעה חגלה מלכה ותרצה ,10,9,943,943.0,953,949.0,0.2777777777777778,0.5454545454545454,5,בנות ואלה מחלה חגלה ותרצה,5090000787,10,9
ref-sifre-n.133.2.67-ref-sifre-n.133.2.74,ref-bible.0104.36.11.1-ref-bible.104.36.11.8,237941,237989,ref-sifre-n.133.2.67,ref-sifre-n.133.2.74,337062,337111,ref-bible.0104.36.11.1,ref-bible.0104.36.11.8,ותהיינה מחלה תרצה חגלה ומלכה ונועה בנות צלפחד ,ותהיינה מחלה תרצה וחגלה ומלכה ונעה בנות צלפחד ,8,8,853,851.0,954,954.0,0.0434782608695652,0.0,6,ותהיינה מחלה תרצה ומלכה בנות צלפחד,5090000788,8,8
ref-sifre-n.133.3.18-ref-sifre-n.133.3.30,ref-bible.0104.33.38.1-ref-bible.104.33.38.13,238113,238173,ref-sifre-n.133.3.18,ref-sifre-n.133.3.30,331024,331086,ref-bible.0104.33.38.1,ref-bible.0104.33.38.13,ויעל אהרן הכהן אל הר ההר על פי ה' וימת שם בשנת הארבעים ,ויעל אהרן הכהן אל הר ההר על פי יהוה וימת שם בשנת הארבעים ,11,11,770,770.0,955,955.0,0.0526315789473684,0.1818181818181817,10,ויעל אהרן הכהן אל הר ההר וימת שם בשנת הארבעים,5090000789,11,11
ref-sifre-n.133.3.87-ref-sifre-n.133.4.6,ref-bible.0104.27.3.4-ref-bible.104.27.4.6,238461,238667,ref-sifre-n.133.3.87,ref-sifre-n.133.4.6,316157,316267,ref-bible.0104.27.3.4,ref-bible.0104.27.4.6,והוא לא היה בתוך העדה זו עדת מלינים הנועדים על ה' זו עדת מרגלים בעדת קרח זו עדה של קרח כי בחטאו מת שלא החטיא את אחרים עמו ובנים לא היו לו שאם היתה לו בן לא היינו תובעות למה יגרע שם אבינו מתוך משפחתו ,והוא לא היה בתוך העדה הנועדים על יהוה בעדת קרח כי בחטאו מת ובנים לא היו לו למה יגרע שם אבינו מתוך משפחתו ,45,23,647,647.0,956,956.0,0.4874371859296482,0.3913043478260869,22,והוא לא היה בתוך העדה הנועדים על בעדת קרח כי בחטאו מת ובנים לא היו לו למה יגרע שם אבינו מתוך משפחתו,5090000790,45,23
ref-sifre-n.133.4.68-ref-sifre-n.133.4.73,ref-bible.0104.27.4.11-ref-bible.104.27.4.16,238934,238962,ref-sifre-n.133.4.68,ref-sifre-n.133.4.73,316281,316308,ref-bible.0104.27.4.11,ref-bible.0104.27.4.16,תנה לנו אחוזה בתוך אחי אבינו ,תנה לנו אחזה בתוך אחי אבינו ,6,6,648,648.0,958,957.0,0.0344827586206896,0.0,5,תנה לנו בתוך אחי אבינו,5090000791,6,6
ref-sifre-n.133.4.68-ref-sifre-n.133.4.73,ref-bible.0104.27.7.5-ref-bible.104.27.7.12,238934,238962,ref-sifre-n.133.4.68,ref-sifre-n.133.4.73,316381,316417,ref-bible.0104.27.7.5,ref-bible.0104.27.7.12,תנה לנו אחוזה בתוך אחי אבינו ,נתן תתן להם אחזת נחלה בתוך אחי אביהם ,6,8,651,651.0,959,957.0,0.4324324324324324,0.7272727272727273,2,בתוך אחי,5090000792,6,8
ref-sifre-n.133.4.66-ref-sifre-n.133.4.73,ref-bible.0201.17.4.12-ref-bible.201.17.4.29,238921,238962,ref-sifre-n.133.4.66,ref-sifre-n.133.4.73,445837,445917,ref-bible.0201.17.4.12,ref-bible.0201.17.4.29,היינו תובעות תנה לנו אחוזה בתוך אחי אבינו ,יהוה צוה את משה לתת לנו נחלה בתוך אחינו ויתן להם אל פי יהוה נחלה בתוך אחי אביהן ,8,18,944,944.0,957,957.0,0.6375,0.6875,3,לנו בתוך אחי,5090000793,8,18
ref-sifre-n.133.4.83-ref-sifre-n.133.4.92,ref-bible.0104.14.3.17-ref-bible.0104.14.5.2,239004,239062,ref-sifre-n.133.4.83,ref-sifre-n.133.4.92,285138,285202,ref-bible.0104.14.3.17,ref-bible.0104.14.5.2,ויאמרו איש אל אחיו נתנה ראש ונשובה מצרימה ויפל משה,שוב מצרימה ויאמרו איש אל אחיו נתנה ראש ונשובה מצרימה ויפל משה,8,10,455,455.0,960,960.0,0.180327868852459,0.1111111111111111,8,ויאמרו איש_אל_אחיו נתנה ראש ונשובה מצרימה ויפל משה,5090000794,8,10
ref-sifre-n.133.4.92-ref-sifre-n.133.4.102,ref-bible.0104.27.4.11-ref-bible.104.27.5.5,239059,239112,ref-sifre-n.133.4.92,ref-sifre-n.133.4.102,316281,316333,ref-bible.0104.27.4.11,ref-bible.0104.27.5.5,תנה לנו אחוזה בתוך אחי אבינו ויקרב משה את משפטן לפני ,תנה לנו אחזה בתוך אחי אבינו ויקרב משה את משפטן לפני ,11,11,650,648.0,964,960.0,0.0188679245283018,0.0,10,תנה לנו בתוך אחי אבינו ויקרב משה את משפטן לפני,5090000795,11,11
ref-sifre-n.133.4.92-ref-sifre-n.133.4.97,ref-bible.0104.27.7.5-ref-bible.104.27.7.12,239059,239087,ref-sifre-n.133.4.92,ref-sifre-n.133.4.97,316381,316417,ref-bible.0104.27.7.5,ref-bible.0104.27.7.12,תנה לנו אחוזה בתוך אחי אבינו ,נתן תתן להם אחזת נחלה בתוך אחי אביהם ,6,8,652,651.0,963,960.0,0.4324324324324324,0.7272727272727273,2,בתוך אחי,5090000796,6,8
ref-sifre-n.133.4.90-ref-sifre-n.133.4.99,ref-bible.0201.17.4.15-ref-bible.201.17.5.3,239045,239098,ref-sifre-n.133.4.90,ref-sifre-n.133.4.99,445849,445934,ref-bible.0201.17.4.15,ref-bible.0201.17.5.3,ונשים אומרות תנה לנו אחוזה בתוך אחי אבינו ויקרב משה ,משה לתת לנו נחלה בתוך אחינו ויתן להם אל פי יהוה נחלה בתוך אחי אביהן ויפלו חבלי מנשה ,10,18,945,944.0,962,960.0,0.5952380952380952,0.6842105263157895,3,לנו בתוך אחי,5090000797,10,18
ref-sifre-n.134.1.53-ref-sifre-n.134.1.63,ref-bible.0104.27.4.11-ref-bible.104.27.4.16,239649,239701,ref-sifre-n.134.1.53,ref-sifre-n.134.1.63,316281,316308,ref-bible.0104.27.4.11,ref-bible.0104.27.4.16,נתון תתן להם אחוזת נחלה זו נחלת אביהן בתוך אחי אביהם ,תנה לנו אחזה בתוך אחי אבינו ,11,6,649,648.0,968,965.0,0.5849056603773585,0.6923076923076923,2,בתוך אחי,5090000798,11,6
ref-sifre-n.134.1.53-ref-sifre-n.134.1.72,ref-bible.0104.27.7.5-ref-bible.104.27.7.17,239649,239745,ref-sifre-n.134.1.53,ref-sifre-n.134.1.72,316381,316443,ref-bible.0104.27.7.5,ref-bible.0104.27.7.17,נתון תתן להם אחוזת נחלה זו נחלת אביהן בתוך אחי אביהם זו נחלת אחי אביהם והעברת את נחלת אביהן להן ,נתן תתן להם אחזת נחלה בתוך אחי אביהם והעברת את נחלת אביהן להן ,20,13,653,651.0,972,965.0,0.3541666666666667,0.0714285714285714,11,תתן להם נחלה בתוך אחי אביהם והעברת את נחלת אביהן להן,5090000799,20,13
ref-sifre-n.134.1.53-ref-sifre-n.134.1.66,ref-bible.0201.17.4.16-ref-bible.0201.17.4.29,239649,239713,ref-sifre-n.134.1.53,ref-sifre-n.134.1.66,445853,445917,ref-bible.0201.17.4.16,ref-bible.0201.17.4.29,לתת לנו נחלה בתוך אחינו ויתן להם אל פי יהוה נחלה בתוך אחי אביהן,לתת לנו נחלה בתוך אחינו ויתן להם אל פי יהוה נחלה בתוך אחי אביהן,14,14,946,946.0,969,969.0,0.0,0.0,14,לתת לנו נחלה בתוך אחינו ויתן להם אל פי יהוה נחלה בתוך אחי אביהן,5090000800,14,14
ref-sifre-n.134.1.53-ref-sifre-n.134.1.59,ref-bible.0209.44.28.2-ref-bible.0209.44.28.12,239649,239680,ref-sifre-n.134.1.53,ref-sifre-n.134.1.59,1070850,1070907,ref-bible.0209.44.28.2,ref-bible.0209.44.28.12,להם לנחלה אני נחלתם ואחזה לא תתנו להם בישראל אני אחזתם,להם לנחלה אני נחלתם ואחזה לא תתנו להם בישראל אני אחזתם,11,11,1126,1126.0,965,965.0,0.0,0.0,11,להם לנחלה אני נחלתם ואחזה לא תתנו להם בישראל אני אחזתם,5090000801,11,11
ref-sifre-n.134.1.53-ref-sifre-n.134.1.66,ref-bible.0303.42.15.9-ref-bible.0303.42.15.14,239649,239713,ref-sifre-n.134.1.53,ref-sifre-n.134.1.66,1333814,1333845,ref-bible.0303.42.15.9,ref-bible.0303.42.15.14,ויתן להם אביהם נחלה בתוך אחיהם,ויתן להם אביהם נחלה בתוך אחיהם,6,6,1211,1211.0,967,967.0,0.0,0.0,6,ויתן להם אביהם נחלה בתוך אחיהם,5090000802,6,6
