baseOrig,compOrig,baseCharStart,baseCharEnd,baseRefStart,baseRefEnd,compCharStart,compCharEnd,compRefStart,compRefEnd,baseStr,compStr,bRange,cRange,compOrder,grp-ref-bible,baseOrder,grp-ref-sifre-n,dam-lev,jac,lcc_len,lcs_str,id,bRangeOriginal,cRangeOriginal
ref-sifre-n.107.2.922-ref-sifre-n.107.2.936,ref-bible.0104.15.6.9-ref-bible.0104.15.9.4,152404,152482,ref-sifre-n.107.2.922,ref-sifre-n.107.2.936,288476,288611,ref-bible.0104.15.6.9,ref-bible.0104.15.9.4,בשמן שלשית ההין ויין לנסך שלשית ההין תקריב ריח ניחח ליהוה וכי תעשה בן בקר עלה או זבח לפלא נדר או שלמים ליהוה והקריב על בן הבקר,בשמן שלשית ההין ויין לנסך שלשית ההין תקריב ריח ניחח ליהוה וכי תעשה בן בקר עלה או זבח לפלא נדר או שלמים ליהוה והקריב על בן הבקר,25,25,467,467.0,638,638.0,0.0,0.0,25,בשמן שלשית ההין ויין לנסך שלשית ההין תקריב ריח_ניחח_ליהוה וכי תעשה בן בקר עלה או זבח לפלא נדר או שלמים ליהוה והקריב על בן הבקר,5090000530,25,25
ref-sifre-n.107.2.1100-ref-sifre-n.107.2.1141,ref-bible.0104.15.12.1-ref-bible.0104.15.13.6,153297,153502,ref-sifre-n.107.2.1100,ref-sifre-n.107.2.1141,288761,288825,ref-bible.0104.15.12.1,ref-bible.0104.15.13.6,כמספר אשר תעשו ככה תעשו לאחד כמספרם כל האזרח יעשה ככה את אלה,כמספר אשר תעשו ככה תעשו לאחד כמספרם כל האזרח יעשה ככה את אלה,13,13,472,472.0,640,640.0,0.0,0.0,13,כמספר אשר תעשו ככה תעשו לאחד כמספרם כל האזרח יעשה ככה את אלה,5090000531,13,13
ref-sifre-n.107.2.1148-ref-sifre-n.107.2.1160,ref-bible.0104.15.12.1-ref-bible.104.15.12.7,153533,153599,ref-sifre-n.107.2.1148,ref-sifre-n.107.2.1160,288761,288799,ref-bible.0104.15.12.1,ref-bible.0104.15.12.7,"כמספר אשר תעשו יכול אם רצה לכפול יכפול ת""ל ככה תעשו לאחד כמספרם ",כמספר אשר תעשו ככה תעשו לאחד כמספרם ,13,7,471,471.0,642,642.0,0.4375,0.4545454545454546,7,כמספר אשר תעשו ככה תעשו לאחד כמספרם,5090000532,13,7
ref-sifre-n.107.3.64-ref-sifre-n.107.3.76,ref-bible.0104.15.12.4-ref-bible.104.15.13.4,154070,154136,ref-sifre-n.107.3.64,ref-sifre-n.107.3.76,288777,288818,ref-bible.0104.15.12.4,ref-bible.0104.15.13.4,ככה תעשו לאחד כמספרם להביא את אחד עשר שבמעשר כל האזרח יעשה ככה ,ככה תעשו לאחד כמספרם כל האזרח יעשה ככה ,13,8,474,471.0,643,643.0,0.3809523809523809,0.3636363636363636,8,ככה תעשו לאחד כמספרם כל האזרח יעשה ככה,5090000533,13,8
ref-sifre-n.107.3.145-ref-sifre-n.108.1.17,ref-bible.0104.15.13.7-ref-bible.104.15.14.9,154495,154599,ref-sifre-n.107.3.145,ref-sifre-n.108.1.17,288826,288898,ref-bible.0104.15.13.7,ref-bible.0104.15.14.9,יקרבו משל צבור כי יגור אין לי אלא גר המתגייר גר שנתגייר מנין תלמוד לומר או אשר בתוככם לדורותיכם ועשה ,להקריב אשה ריח ניחח ליהוה וכי יגור אתכם גר או אשר בתוככם לדרתיכם ועשה ,16,11,475,475.0,644,644.0,0.5643564356435643,0.6,6,יגור גר או אשר בתוככם ועשה,5090000534,16,11
ref-sifre-n.109.1.10-ref-sifre-n.109.1.17,ref-bible.0104.9.14.2-ref-bible.0104.9.14.17,155669,155707,ref-sifre-n.109.1.10,ref-sifre-n.109.1.17,276232,276313,ref-bible.0104.9.14.2,ref-bible.0104.9.14.17,יגור אתכם גר ועשה פסח ליהוה כחקת הפסח וכמשפטו כן יעשה חקה אחת יהיה לכם ולגר,יגור אתכם גר ועשה פסח ליהוה כחקת הפסח וכמשפטו כן יעשה חקה אחת יהיה לכם ולגר,16,16,387,387.0,645,645.0,0.0,0.0,16,יגור אתכם גר ועשה פסח ליהוה כחקת הפסח וכמשפטו כן יעשה חקה אחת יהיה לכם ולגר,5090000535,16,16
ref-sifre-n.109.1.12-ref-sifre-n.109.1.24,ref-bible.0104.19.10.11-ref-bible.104.19.10.18,155677,155745,ref-sifre-n.109.1.12,ref-sifre-n.109.1.24,298608,298654,ref-bible.0104.19.10.11,ref-bible.0104.19.10.18,יהיה לכם ולגר הגר לפי שמעשה בישראל צריך להביא את הגרים חקת עולם ,והיתה לבני ישראל ולגר הגר בתוכם לחקת עולם ,13,8,609,606.0,647,645.0,0.59375,0.5714285714285714,3,ולגר הגר עולם,5090000536,13,8
ref-sifre-n.109.1.74-ref-sifre-n.109.1.81,ref-bible.0102.28.38.17-ref-bible.102.28.38.23,155989,156028,ref-sifre-n.109.1.74,ref-sifre-n.109.1.81,162652,162686,ref-bible.0102.28.38.17,ref-bible.0102.28.38.23,והיה על מצח אהרן וגו' תמיד לרצון לפני ,והיה על מצחו תמיד לרצון להם לפני ,8,7,98,98.0,648,648.0,0.3421052631578947,0.375,5,והיה על תמיד לרצון לפני,5090000537,8,7
ref-sifre-n.109.1.89-ref-sifre-n.109.1.100,ref-bible.0104.15.15.5-ref-bible.104.15.16.4,156062,156119,ref-sifre-n.109.1.89,ref-sifre-n.109.1.100,288954,289025,ref-bible.0104.15.15.5,ref-bible.0104.15.16.4,"לגרים מנין ת""ל ככם כגר יהיה לפני ה' תורה אחת ומשפט אחד ",ולגר הגר חקת עולם לדרתיכם ככם כגר יהיה לפני יהוה תורה אחת ומשפט אחד ,12,12,476,476.0,649,649.0,0.3382352941176471,0.4615384615384615,8,ככם כגר יהיה לפני תורה אחת ומשפט אחד,5090000538,12,12
ref-sifre-n.110.1.149-ref-sifre-n.110.1.165,ref-bible.0104.15.19.6-ref-bible.0104.15.20.6,156980,157073,ref-sifre-n.110.1.149,ref-sifre-n.110.1.165,289172,289221,ref-bible.0104.15.19.6,ref-bible.0104.15.20.6,תרומה ליהוה ראשית ערסתכם חלה תרימו תרומה כתרומת,תרומה ליהוה ראשית ערסתכם חלה תרימו תרומה כתרומת,8,8,477,477.0,650,650.0,0.0,0.0,8,תרומה ליהוה ראשית ערסתכם חלה תרימו תרומה כתרומת,5090000539,8,8
ref-sifre-n.110.1.281-ref-sifre-n.110.1.307,ref-bible.0104.15.19.6-ref-bible.0104.15.20.10,157637,157786,ref-sifre-n.110.1.281,ref-sifre-n.110.1.307,289172,289238,ref-bible.0104.15.19.6,ref-bible.0104.15.20.10,תרומה ליהוה ראשית ערסתכם חלה תרימו תרומה כתרומת גרן כן תרימו אתה,תרומה ליהוה ראשית ערסתכם חלה תרימו תרומה כתרומת גרן כן תרימו אתה,12,12,479,479.0,652,652.0,0.0,0.0,12,תרומה ליהוה ראשית ערסתכם חלה תרימו תרומה כתרומת גרן כן תרימו אתה,5090000540,12,12
ref-sifre-n.111.1.34-ref-sifre-n.111.1.41,ref-bible.0104.15.22.1-ref-bible.104.15.22.8,159828,159866,ref-sifre-n.111.1.34,ref-sifre-n.111.1.41,289282,289320,ref-bible.0104.15.22.1,ref-bible.0104.15.22.8,וכי תשגו ולא תעשו את כל המצות האלה ,וכי תשגו ולא תעשו את כל המצות האלה ,8,8,481,481.0,654,654.0,0.0,0.0,8,וכי תשגו ולא תעשו את כל המצות האלה,5090000541,8,8
ref-sifre-n.111.1.59-ref-sifre-n.111.1.64,ref-bible.0104.15.24.1-ref-bible.104.15.24.6,159959,159993,ref-sifre-n.111.1.59,ref-sifre-n.111.1.64,289413,289447,ref-bible.0104.15.24.1,ref-bible.0104.15.24.6,והיה אם מעיני העדה נעשתה לשגגה ,והיה אם מעיני העדה נעשתה לשגגה ,6,6,482,482.0,655,655.0,0.0,0.0,6,והיה אם מעיני העדה נעשתה לשגגה,5090000542,6,6
ref-sifre-n.111.1.193-ref-sifre-n.111.1.213,ref-bible.0101.39.19.5-ref-bible.101.39.19.12,160643,160747,ref-sifre-n.111.1.193,ref-sifre-n.111.1.213,79466,79508,ref-bible.0101.39.19.5,ref-bible.0101.39.19.12,הדברות תלמוד לומר אשר דבר ה' אל משה ולהלן הוא אומר וידבר אלהים את כל הדברים האלה לאמר אחת דבר אלהים ,דברי אשתו אשר דברה אליו לאמר כדברים האלה ,19,8,25,25.0,656,656.0,0.66,0.6153846153846154,2,אשר לאמר,5090000543,19,8
ref-sifre-n.111.2.1-ref-sifre-n.111.2.6,ref-bible.0104.15.24.1-ref-bible.104.15.24.6,161170,161204,ref-sifre-n.111.2.1,ref-sifre-n.111.2.6,289413,289447,ref-bible.0104.15.24.1,ref-bible.0104.15.24.6,והיה אם מעיני העדה נעשתה לשגגה ,והיה אם מעיני העדה נעשתה לשגגה ,6,6,483,482.0,657,657.0,0.0,0.0,6,והיה אם מעיני העדה נעשתה לשגגה,5090000544,6,6
ref-sifre-n.111.2.51-ref-sifre-n.111.2.59,ref-bible.0104.15.24.5-ref-bible.104.15.24.19,161426,161469,ref-sifre-n.111.2.51,ref-sifre-n.111.2.59,289435,289514,ref-bible.0104.15.24.5,ref-bible.0104.15.24.19,ועשו כל העדה פר בן בקר אחד ומנחתו ונסכו ,נעשתה לשגגה ועשו כל העדה פר בן בקר אחד לעלה לריח ניחח ליהוה ומנחתו ונסכו ,9,11,484,482.0,658,658.0,0.4794520547945205,0.5714285714285714,6,ועשו כל העדה אחד ומנחתו ונסכו,5090000545,9,11
ref-sifre-n.111.2.54-ref-sifre-n.111.2.59,ref-bible.0104.29.17.3-ref-bible.104.29.18.2,161441,161469,ref-sifre-n.111.2.54,ref-sifre-n.111.2.59,320546,320624,ref-bible.0104.29.17.3,ref-bible.0104.29.18.2,פר בן בקר אחד ומנחתו ונסכו ,פרים בני בקר שנים עשר אילם שנים כבשים בני שנה ארבעה עשר תמימם ומנחתם ונסכיהם ,6,8,700,700.0,659,658.0,0.7142857142857143,0.8333333333333334,1,בקר,5090000546,6,8
ref-sifre-n.111.3.75-ref-sifre-n.111.3.95,ref-bible.0103.5.18.8-ref-bible.103.5.19.4,162084,162185,ref-sifre-n.111.3.75,ref-sifre-n.111.3.95,199338,199418,ref-bible.0103.5.18.8,ref-bible.0103.5.19.4,כשגגה תלמוד לומר כי שגגה היא לכל העם בשגגה והם הביאו את קרבנם אשה לה' ר' יאשיה אומר שבט שעשה על ,אל הכהן וכפר עליו הכהן על שגגתו אשר שגג והוא לא ידע ונסלח לו אשם הוא אשם אשם ,17,16,165,165.0,660,660.0,0.7395833333333334,0.9090909090909092,1,על,5090000547,17,16
ref-sifre-n.111.3.264-ref-sifre-n.111.3.278,ref-bible.0104.15.25.23-ref-bible.104.15.26.12,163025,163108,ref-sifre-n.111.3.264,ref-sifre-n.111.3.278,289651,289718,ref-bible.0104.15.25.23,ref-bible.0104.15.26.12,בשגגה ולגר הגר בתוכם לפי שמעשה בישראל צריך להביא את הגרים כי לכל העם בשגגה ,שגגתם ונסלח לכל עדת בני ישראל ולגר הגר בתוכם כי לכל העם בשגגה ,15,10,485,485.0,661,661.0,0.52,0.625,7,ולגר הגר בתוכם כי לכל העם בשגגה,5090000548,15,10
ref-sifre-n.111.3.357-ref-sifre-n.112.1.5,ref-bible.0104.15.26.10-ref-bible.104.15.27.5,163485,163543,ref-sifre-n.111.3.357,ref-sifre-n.112.1.5,289703,289743,ref-bible.0104.15.26.10,ref-bible.0104.15.27.5,לכל העם בשגגה להוציא את המשיח ואם נפש אחת תחטא בשגגה ,לכל העם בשגגה ואם נפש אחת תחטא בשגגה ,11,8,486,485.0,662,662.0,0.3018867924528302,0.3,8,לכל העם בשגגה ואם נפש אחת תחטא בשגגה,5090000549,11,8
ref-sifre-n.112.1.39-ref-sifre-n.112.1.49,ref-bible.0104.15.27.2-ref-bible.104.15.27.10,163733,163782,ref-sifre-n.112.1.39,ref-sifre-n.112.1.49,289724,289770,ref-bible.0104.15.27.2,ref-bible.0104.15.27.10,עז בת שנתה לחטאת לכך נאמרה פרשה זו נפש אחת תחטא ,נפש אחת תחטא בשגגה והקריבה עז בת שנתה לחטאת ,9,9,489,485.0,663,663.0,0.6875,0.3636363636363636,4,עז בת שנתה לחטאת,5090000550,9,9
ref-sifre-n.112.1.122-ref-sifre-n.112.1.150,ref-bible.0104.15.27.1-ref-bible.0104.15.28.6,164179,164325,ref-sifre-n.112.1.122,ref-sifre-n.112.1.150,289719,289805,ref-bible.0104.15.27.1,ref-bible.0104.15.28.6,ואם נפש אחת תחטא בשגגה והקריבה עז בת שנתה,ואם נפש אחת תחטא בשגגה והקריבה עז בת שנתה,9,9,487,487.0,664,664.0,0.0,0.0,9,ואם נפש אחת תחטא בשגגה והקריבה עז בת שנתה,5090000551,9,9
ref-sifre-n.112.1.344-ref-sifre-n.112.2.5,ref-bible.0104.15.29.11-ref-bible.0104.15.30.5,165355,165441,ref-sifre-n.112.1.344,ref-sifre-n.112.2.5,289897,289933,ref-bible.0104.15.29.11,ref-bible.0104.15.30.5,לעשה בשגגה והנפש אשר תעשה ביד רמה,לעשה בשגגה והנפש אשר תעשה ביד רמה,7,7,491,491.0,667,667.0,0.0,0.0,7,לעשה בשגגה והנפש אשר תעשה ביד רמה,5090000552,7,7
ref-sifre-n.112.2.46-ref-sifre-n.112.2.70,ref-bible.0301.50.20.1-ref-bible.301.50.21.10,165646,165784,ref-sifre-n.112.2.46,ref-sifre-n.112.2.70,1185794,1185888,ref-bible.0301.50.20.1,ref-bible.0301.50.21.10,תשב באחיי תדבר בבן אמך תתן דופי אלה עשית והחרשתי דמית היות אהיה כמוך כסבור אתה שמא כדרכי בשר ודם דרכי המקום אוכיחך ואערכה לעיניך ,תשב באחיך תדבר בבן אמך תתן דפי אלה עשית והחרשתי דמית היות אהיה כמוך אוכיחך ואערכה לעיניך ,25,17,1163,1163.0,669,669.0,0.3178294573643411,0.3636363636363636,15,תשב תדבר בבן אמך תתן אלה עשית והחרשתי דמית היות אהיה כמוך אוכיחך ואערכה לעיניך,5090000553,25,17
ref-sifre-n.112.2.75-ref-sifre-n.112.2.82,ref-bible.0207.5.18.1-ref-bible.207.5.18.8,165808,165856,ref-sifre-n.112.2.75,ref-sifre-n.112.2.82,783746,783793,ref-bible.0207.5.18.1,ref-bible.0207.5.18.8,הוי מושכי העון בחבלי השוא ובעבות העגלה חטאה ,הוי משכי העון בחבלי השוא וכעבות העגלה חטאה ,8,8,1044,1044.0,670,670.0,0.0454545454545454,0.25,6,הוי העון בחבלי השוא העגלה חטאה,5090000554,8,8
ref-sifre-n.112.2.159-ref-sifre-n.112.2.171,ref-bible.0105.18.22.16-ref-bible.105.19.1.2,166248,166319,ref-sifre-n.112.2.159,ref-sifre-n.112.2.171,377774,377819,ref-bible.0105.18.22.16,ref-bible.0105.19.1.2,ולא שיירת ממנה כלום ונכרתה אין הכרתה אלא הפסקה הנפש ההוא מזידה דברי ,יהוה בזדון דברו הנביא לא תגור ממנו כי יכרית ,13,9,896,896.0,671,671.0,0.7352941176470589,0.7857142857142857,0,,5090000555,13,9
ref-sifre-n.112.2.275-ref-sifre-n.112.2.289,ref-bible.0102.20.5.12-ref-bible.102.20.5.20,166833,166902,ref-sifre-n.112.2.275,ref-sifre-n.112.2.289,145027,145067,ref-bible.0102.20.5.12,ref-bible.0102.20.5.20,"פוקד עון אבות על בנים יכול אף עכו""ם נפקדת על בנים על שלשים ועל רבעים ",פקד עון אבת על בנים על שלשים ועל רבעים ,15,9,71,71.0,672,672.0,0.4347826086956521,0.3636363636363636,7,עון על בנים על שלשים ועל רבעים,5090000556,15,9
ref-sifre-n.112.2.275-ref-sifre-n.112.2.289,ref-bible.0102.34.7.11-ref-bible.102.34.7.22,166833,166902,ref-sifre-n.112.2.275,ref-sifre-n.112.2.289,175064,175118,ref-bible.0102.34.7.11,ref-bible.0102.34.7.22,"פוקד עון אבות על בנים יכול אף עכו""ם נפקדת על בנים על שלשים ועל רבעים ",פקד עון אבות על בנים ועל בני בנים על שלשים ועל רבעים ,15,10,123,123.0,673,672.0,0.3188405797101449,0.5384615384615384,6,עון בנים על שלשים ועל רבעים,5090000557,15,10
ref-sifre-n.112.2.275-ref-sifre-n.112.2.292,ref-bible.0104.14.18.12-ref-bible.104.14.19.3,166833,166918,ref-sifre-n.112.2.275,ref-sifre-n.112.2.292,286215,286268,ref-bible.0104.14.18.12,ref-bible.0104.14.19.3,"פוקד עון אבות על בנים יכול אף עכו""ם נפקדת על בנים על שלשים ועל רבעים תלמוד לומר עונה ",פקד עון אבות על בנים על שלשים ועל רבעים סלח נא לעון ,18,10,462,462.0,675,672.0,0.4941176470588235,0.6666666666666667,5,עון על שלשים ועל רבעים,5090000558,18,10
ref-sifre-n.112.2.275-ref-sifre-n.112.2.289,ref-bible.0105.5.9.12-ref-bible.105.5.9.20,166833,166902,ref-sifre-n.112.2.275,ref-sifre-n.112.2.289,350604,350646,ref-bible.0105.5.9.12,ref-bible.0105.5.9.20,"פוקד עון אבות על בנים יכול אף עכו""ם נפקדת על בנים על שלשים ועל רבעים ",פקד עון אבות על בנים ועל שלשים ועל רבעים ,15,7,874,874.0,674,672.0,0.4347826086956521,0.5833333333333333,4,עון שלשים ועל רבעים,5090000559,15,7
ref-sifre-n.112.2.316-ref-sifre-n.112.2.321,ref-bible.0208.16.4.1-ref-bible.208.16.4.7,167028,167056,ref-sifre-n.112.2.316,ref-sifre-n.112.2.321,896190,896228,ref-bible.0208.16.4.1,ref-bible.0208.16.4.7,מיתתו מת ולא נספד ולא נקבר ,ממותי תחלאים ימתו לא יספדו ולא יקברו ,6,7,1079,1079.0,676,676.0,0.4054054054054054,0.5714285714285714,1,ולא,5090000560,6,7
ref-sifre-n.112.2.345-ref-sifre-n.112.2.360,ref-bible.0208.8.1.1-ref-bible.0208.8.2.3,167171,167256,ref-sifre-n.112.2.345,ref-sifre-n.112.2.360,881831,881993,ref-bible.0208.8.1.1,ref-bible.0208.8.2.3,בעת ההיא נאם יהוה ויציאו יוציאו את עצמות מלכי יהודה ואת עצמות שריו ואת עצמות הכהנים ואת עצמות הנביאים ואת עצמות יושבי ירושלם מקבריהם ושטחום לשמש ולירח,בעת ההיא נאם יהוה ויציאו יוציאו את עצמות מלכי יהודה ואת עצמות שריו ואת עצמות הכהנים ואת עצמות הנביאים ואת עצמות יושבי ירושלם מקבריהם ושטחום לשמש ולירח,27,27,1076,1076.0,677,677.0,0.0,0.0,27,בעת ההיא נאם יהוה ויציאו יוציאו את עצמות מלכי יהודה ואת עצמות שריו ואת עצמות הכהנים ואת עצמות הנביאים ואת עצמות יושבי ירושלם מקבריהם ושטחום לשמש ולירח,5090000561,27,27
ref-sifre-n.112.2.381-ref-sifre-n.112.2.386,ref-bible.0104.15.31.8-ref-bible.104.15.31.13,167360,167389,ref-sifre-n.112.2.381,ref-sifre-n.112.2.386,290030,290059,ref-bible.0104.15.31.8,ref-bible.0104.15.31.13,הכרת תכרת הנפש ההוא עונה בה ,הכרת תכרת הנפש ההוא עונה בה ,6,6,493,493.0,680,680.0,0.0,0.0,6,הכרת תכרת הנפש ההוא עונה בה,5090000562,6,6
ref-sifre-n.113.1.36-ref-sifre-n.113.1.49,ref-bible.0104.15.32.5-ref-bible.104.15.33.6,167641,167719,ref-sifre-n.113.1.36,ref-sifre-n.113.1.49,290084,290152,ref-bible.0104.15.32.5,ref-bible.0104.15.33.6,ויקריבו אותו המוצאים אותו מקושש עצים הא מה תלמוד לומר וימצאו איש מקושש עצים ,וימצאו איש מקשש עצים ביום השבת ויקריבו אתו המצאים אתו מקשש עצים ,11,12,496,494.0,681,681.0,0.5657894736842105,0.3,3,וימצאו איש עצים,5090000563,11,12
ref-sifre-n.113.1.111-ref-sifre-n.113.1.125,ref-bible.0104.15.32.5-ref-bible.0104.15.33.5,168027,168117,ref-sifre-n.113.1.111,ref-sifre-n.113.1.125,290084,290147,ref-bible.0104.15.32.5,ref-bible.0104.15.33.5,וימצאו איש מקשש עצים ביום השבת ויקריבו אתו המצאים אתו מקשש,וימצאו איש מקשש עצים ביום השבת ויקריבו אתו המצאים אתו מקשש,11,11,494,494.0,683,683.0,0.0,0.0,11,וימצאו איש מקשש עצים ביום השבת ויקריבו אתו המצאים אתו מקשש,5090000564,11,11
ref-sifre-n.113.1.107-ref-sifre-n.113.1.114,ref-bible.0211.2.5.3-ref-bible.211.2.5.13,168009,168049,ref-sifre-n.113.1.107,ref-sifre-n.113.1.114,1094119,1094171,ref-bible.0211.2.5.3,ref-bible.0211.2.5.13,לעלות אל ראש ההר וימצאו איש מקושש עצים ,על ראשי ההרים ירקדון כקול להב אש אכלה קש כעם עצום ,8,11,1139,1139.0,682,682.0,0.68,0.8125,0,,5090000565,8,11
ref-sifre-n.114.1.1-ref-sifre-n.114.1.20,ref-bible.0104.15.34.1-ref-bible.104.15.35.6,168654,168755,ref-sifre-n.114.1.1,ref-sifre-n.114.1.20,290183,290250,ref-bible.0104.15.34.1,ref-bible.0104.15.35.6,ויניחו אותו במשמר מלמד שכל חיבני מיתות נחבשים כי לא פורש מה יעשה לו והלא כבר נאמר מחלליה מות יומת ,ויניחו אתו במשמר כי לא פרש מה יעשה לו ויאמר יהוה אל משה מות יומת ,18,12,498,497.0,685,685.0,0.4591836734693877,0.5714285714285714,9,ויניחו במשמר כי לא מה יעשה לו מות יומת,5090000566,18,12
ref-sifre-n.114.1.47-ref-sifre-n.114.1.60,ref-bible.0104.14.9.18-ref-bible.0104.14.10.6,168882,168955,ref-sifre-n.114.1.47,ref-sifre-n.114.1.60,285542,285590,ref-bible.0104.14.9.18,ref-bible.0104.14.10.6,ויאמרו כל העדה לרגום אתם באבנים,אתנו אל תיראם ויאמרו כל העדה לרגום אתם באבנים,6,9,457,457.0,688,688.0,0.3111111111111111,0.25,6,ויאמרו כל העדה לרגום אתם באבנים,5090000567,6,9
ref-sifre-n.114.1.43-ref-sifre-n.114.1.56,ref-bible.0104.15.33.12-ref-bible.0104.15.36.9,168859,168934,ref-sifre-n.114.1.43,ref-sifre-n.114.1.56,290174,290342,ref-bible.0104.15.33.12,ref-bible.0104.15.36.9,כל העדה ויניחו אתו במשמר כי לא פרש מה יעשה לו ויאמר יהוה אל משה מות יומת האיש רגום אתו באבנים כל העדה מחוץ למחנה ויציאו אתו כל העדה אל מחוץ למחנה וירגמו אתו,כל העדה ויניחו אתו במשמר כי לא פרש מה יעשה לו ויאמר יהוה אל משה מות יומת האיש רגום אתו באבנים כל העדה מחוץ למחנה ויציאו אתו כל העדה אל מחוץ למחנה וירגמו אתו,29,29,497,497.0,686,686.0,0.0,0.0,29,כל העדה ויניחו אתו במשמר כי לא פרש מה יעשה לו ויאמר_יהוה_אל_משה מות יומת האיש רגום אתו באבנים כל העדה מחוץ למחנה ויציאו אתו כל העדה אל_מחוץ_למחנה וירגמו אתו,5090000568,29,29
ref-sifre-n.114.1.67-ref-sifre-n.114.1.77,ref-bible.0105.13.10.4-ref-bible.105.13.10.10,168987,169040,ref-sifre-n.114.1.67,ref-sifre-n.114.1.77,368380,368415,ref-bible.0105.13.10.4,ref-bible.0105.13.10.10,יד העדים תהיה בו בראשונה להמיתו הא מה תלמוד לומר כל ,ידך תהיה בו בראשונה להמיתו ויד כל ,8,7,883,883.0,691,686.0,0.4038461538461538,0.375,5,תהיה בו בראשונה להמיתו כל,5090000569,8,7
ref-sifre-n.114.1.60-ref-sifre-n.114.1.77,ref-bible.0105.17.6.4-ref-bible.105.17.7.8,168950,169040,ref-sifre-n.114.1.60,ref-sifre-n.114.1.77,374934,375024,ref-bible.0105.17.6.4,ref-bible.0105.17.7.8,העדה או כל העדה כמשמעו תלמוד לומר יד העדים תהיה בו בראשונה להמיתו הא מה תלמוד לומר כל ,עדים או שלשה עדים יומת המת לא יומת על פי עד אחד יד העדים תהיה בו בראשנה להמיתו ויד כל ,15,20,889,889.0,690,686.0,0.5465116279069767,0.5333333333333333,7,או יד העדים תהיה בו להמיתו כל,5090000570,15,20
ref-sifre-n.114.1.80-ref-sifre-n.114.1.94,ref-bible.0104.15.35.8-ref-bible.0104.15.36.3,169054,169141,ref-sifre-n.114.1.80,ref-sifre-n.114.1.94,290257,290310,ref-bible.0104.15.35.8,ref-bible.0104.15.36.3,רגום אתו באבנים כל העדה מחוץ למחנה ויציאו אתו כל,רגום אתו באבנים כל העדה מחוץ למחנה ויציאו אתו כל,10,10,500,500.0,692,692.0,0.0,0.0,10,רגום אתו באבנים כל העדה מחוץ למחנה ויציאו אתו כל,5090000571,10,10
ref-sifre-n.114.1.158-ref-sifre-n.114.1.167,ref-bible.0105.13.10.4-ref-bible.105.13.10.12,169441,169495,ref-sifre-n.114.1.158,ref-sifre-n.114.1.167,368380,368428,ref-bible.0105.13.10.4,ref-bible.0105.13.10.12,יד העדים תהיה בו בראשונה להמיתו ויד כל העם באחרונה ,ידך תהיה בו בראשונה להמיתו ויד כל העם באחרנה ,10,9,884,883.0,694,694.0,0.1372549019607843,0.2222222222222222,7,תהיה בו בראשונה להמיתו ויד כל העם,5090000572,10,9
ref-sifre-n.114.1.158-ref-sifre-n.114.1.167,ref-bible.0105.17.7.1-ref-bible.105.17.7.10,169441,169495,ref-sifre-n.114.1.158,ref-sifre-n.114.1.167,374983,375037,ref-bible.0105.17.7.1,ref-bible.0105.17.7.10,יד העדים תהיה בו בראשונה להמיתו ויד כל העם באחרונה ,יד העדים תהיה בו בראשנה להמיתו ויד כל העם באחרנה ,10,10,890,889.0,695,694.0,0.0392156862745098,0.0,8,יד העדים תהיה בו להמיתו ויד כל העם,5090000573,10,10
ref-sifre-n.114.1.195-ref-sifre-n.114.1.205,ref-bible.0105.21.22.1-ref-bible.105.21.22.11,169637,169688,ref-sifre-n.114.1.195,ref-sifre-n.114.1.205,382676,382728,ref-bible.0105.21.22.1,ref-bible.0105.21.22.11,כי יהיה באיש חטא משפט מות והומת ותלית אותו על עץ ,וכי יהיה באיש חטא משפט מות והומת ותלית אתו על עץ ,6,6,903,903.0,696,696.0,0.0408163265306122,0.1111111111111111,9,יהיה באיש חטא משפט מות והומת ותלית על עץ,5090000574,11,11
