,index,baseOrig,compOrig,baseCharStart,baseCharEnd,baseWdStart,baseWdEnd,baseRefStart,baseRefEnd,compCharStart,compCharEnd,compWdStart,compWdEnd,compRefStart,compRefEnd,baseStr,compStr,bRange,cRange,grp-ref-t,grp-ref-mek,dam-lev,jac,id
255,320,ref-t.4.5.5.14.73-ref-t.4.5.5.14.94,ref-mek.5.3.7.30-ref-mek.5.3.7.43,945449,945567,149870,149887,ref-t.4.5.5.14.73,ref-t.4.5.5.14.94,224418,224492,36895,36908,ref-mek.5.3.7.30,ref-mek.5.3.7.43,האשה ברעי דברי ר' יוסי ר' יהודה אומ' האיש ברעי והאשה במים וחכמים אומ' אחד האיש ואחד האשה בין ברעי בין במים ,למי כשהוא אומר וישאלו איש לרעהו מי קרוי איש הלא משה שנאמר והאיש משה ,17,13,524.0,320.0,0.6728971962616822,0.8,2050000256
256,321,ref-t.5.3.7.7.115-ref-t.5.3.7.8.15,ref-mek.5.4.1.70-ref-mek.5.4.2.7,1123317,1123396,177231,177245,ref-t.5.3.7.7.115,ref-t.5.3.7.8.15,227809,227849,37466,37474,ref-mek.5.4.1.70,ref-mek.5.4.2.7,בבקר וגו' דבר אחר וירא משה את המלאכה והנה עשו אתם אתה ויברך אתם משה מה היא ,בקר וגו' וירא חתן משה מה ראה ראהו שהיה ,14,8,593.0,321.0,0.6,0.7857142857142857,2050000257
257,322,ref-t.4.4.12.7.12-ref-t.4.4.12.7.25,ref-mek.5.4.4.134-ref-mek.5.4.4.144,923813,923901,146475,146486,ref-t.4.4.12.7.12,ref-t.4.4.12.7.25,228789,228851,37636,37646,ref-mek.5.4.4.134,ref-mek.5.4.4.144,ושנייה ובשלישית כונסין אותו לכיפה אבא שאול אומ' אף בשלישית מתרין בו וברביעית כונסין ,שנים שלשה נכנסין תחתיה ואין יכולין לעמוד בה ארבעה חמשה נכנסין ,11,10,508.0,322.0,0.6309523809523809,0.9473684210526316,2050000258
258,323,ref-t.2.3.7.7.1-ref-t.2.3.7.7.13,ref-mek.6.1.1.81-ref-mek.6.1.1.94,359024,359098,56027,56039,ref-t.2.3.7.7.1,ref-t.2.3.7.7.13,234795,234877,38650,38663,ref-mek.6.1.1.81,ref-mek.6.1.1.94,בני חבורה שרצו להמנות אחרים על פסחן הרשות בידן רצו להמשך ולהמנות אחרים ,לבנינו ימנו לחורבנו שנאמר אחרי אשר הוכתה העיר לא רצו למנות לעצמם ימנו לאחרים ,12,13,106.0,323.0,0.6233766233766234,0.8421052631578947,2050000259
259,324,ref-t.3.2.5.10.10-ref-t.3.2.5.10.15,ref-mek.6.1.1.136-ref-mek.6.1.1.143,567941,567978,89074,89079,ref-t.3.2.5.10.10,ref-t.3.2.5.10.15,235101,235143,38698,38705,ref-mek.6.1.1.136,ref-mek.6.1.1.143,ראיתיה שמלקטת שעורים מתחת טלפי סוסים ,ראה ריבה אחת מלקטת שעורים מתחת גללי הסוס ,5,7,196.0,324.0,0.3170731707317073,0.7272727272727273,2050000260
260,325,ref-t.4.1.7.9.43-ref-t.4.1.7.9.60,ref-mek.6.1.2.231-ref-mek.6.1.2.249,755558,755655,119596,119613,ref-t.4.1.7.9.43,ref-t.4.1.7.9.60,237171,237271,39027,39043,ref-mek.6.1.2.231,ref-mek.6.1.2.249,ויפתוהו בפיהם ובלשונם יכזבו לו לו ולבם לא נכון עמו ולא נאמנו בבריתו אע'פ כן והוא רחום יכפר ,ויפתוהו בפיהם ובלשונם יכזבו לו ולבם לא נכון עמו ולא נאמנו בבריתו ואף על פי כן והוא רחום יכפר ,17,16,394.0,325.0,0.0967741935483871,0.1875,2050000261
261,326,ref-t.1.2.1.2.13-ref-t.1.2.1.2.19,ref-mek.6.2.2.30-ref-mek.6.2.2.37,34654,34693,5668,5674,ref-t.1.2.1.2.13,ref-t.1.2.1.2.19,239301,239347,39391,39397,ref-mek.6.2.2.30,ref-mek.6.2.2.37,על ע'ז ועל גלוי עריות ועל שפיכות דמים ,על עבודה זרה ועל גילוי עריות ועל שפיכות דמים ,6,6,34.0,326.0,0.17777777777777778,0.375,2050000262
262,327,ref-t.4.8.8.4.7-ref-t.4.8.8.4.18,ref-mek.6.2.2.30-ref-mek.6.2.2.37,1004740,1004807,159357,159368,ref-t.4.8.8.4.7,ref-t.4.8.8.4.18,239301,239347,39391,39397,ref-mek.6.2.2.30,ref-mek.6.2.2.37,על הדינין ועל ע'ז ועל קללת השם ועל גלוי עריות ועל שפיכות דמים ,על עבודה זרה ועל גילוי עריות ועל שפיכות דמים ,11,6,555.0,326.0,0.3870967741935484,0.5454545454545454,2050000263
263,328,ref-t.4.8.4.5.18-ref-t.4.8.4.5.41,ref-mek.6.2.3.104-ref-mek.6.2.4.5,989824,989935,156955,156976,ref-t.4.8.4.5.18,ref-t.4.8.4.5.41,240629,240700,39622,39634,ref-mek.6.2.3.104,ref-mek.6.2.4.5,לכם את ארץ כנען להיות לכם לאלים כל זמן שאתם בארץ כנען הרי אני לכם אלוה אין אתם בארץ כנען כביכול אין אני לכם ,אתם מסגלין לי מאחרי תלמוד לומר כי לי כל הארץ ואתם תהיו לי כביכול איני ,21,12,549.0,328.0,0.6203703703703703,0.6,2050000264
264,329,ref-t.1.3.2.9.4-ref-t.1.3.2.9.21,ref-mek.6.2.7.155-ref-mek.6.2.7.169,57207,57308,9314,9326,ref-t.1.3.2.9.4,ref-t.1.3.2.9.21,242967,243043,40022,40034,ref-mek.6.2.7.155,ref-mek.6.2.7.169,אין מקבלין אותן עולמית דברי ר' מאיר ר' יהודה או' חזרו בפרהסיא מקבלין,אם מקבלים אתם עליכם עונשים בשמחה הרי אתם מקבלים שכר ואם לאו הרי,68,63,41.0,329.0,0.6911764705882353,0.875,2050000265
265,331,ref-t.5.1.10.10.7-ref-t.5.1.10.10.26,ref-mek.6.3.1.222-ref-mek.6.3.1.239,1054321,1054428,166796,166810,ref-t.5.1.10.10.7,ref-t.5.1.10.10.26,244582,244683,40291,40306,ref-mek.6.3.1.222,ref-mek.6.3.1.239,אין טעונין כיבוס משהופשט טעון כבוס דברי ר' יהודה ר' ליעזר אומ' אף משהופשט אין טעון כיבוס ואין טעון כיבוס ,שאין טעונין כיבוס בגדים טעונין טבילה וכאן שהוא טעון כיבוס בגדים אינו דין שיהא טעון טבילה אין כיבוס ,14,15,579.0,331.0,0.5619047619047619,0.7857142857142857,2050000266
266,332,ref-t.4.6.1.7.165-ref-t.4.6.1.7.177,ref-mek.6.3.4.33-ref-mek.6.3.4.40,949080,949144,150471,150481,ref-t.4.6.1.7.165,ref-t.4.6.1.7.177,245549,245582,40452,40457,ref-mek.6.3.4.33,ref-mek.6.3.4.40,אין לי אלא בהמה וחיה ועוף טהור בהמה וחיה ועוף טמאין,אין לי אלא בהמה חיה מנין,51,24,538.0,332.0,0.5490196078431373,0.5714285714285714,2050000267
267,334,ref-t.1.3.1.13.9-ref-t.1.3.1.13.27,ref-mek.6.5.1.632-ref-mek.6.5.1.642,53116,53208,8652,8667,ref-t.1.3.1.13.9,ref-t.1.3.1.13.27,254918,254963,42032,42042,ref-mek.6.5.1.632,ref-mek.6.5.1.642,יחיד אבל באוצר של מלכים הולכין אחר הרוב אמרו לו אחר שהוריתה לנו על אוצר של יבנה שלפנים מן ,אחד ממונה על אוצר של תבן וא' ממונה על אוצר של ,15,10,40.0,334.0,0.6777777777777778,0.75,2050000268
268,335,ref-t.4.3.11.2.89-ref-t.4.3.11.2.110,ref-mek.6.6.2.64-ref-mek.6.6.2.79,876336,876428,138821,138840,ref-t.4.3.11.2.89,ref-t.4.3.11.2.110,258246,258309,42549,42558,ref-mek.6.6.2.64,ref-mek.6.6.2.79,של כסף ודינר של זהב היה כת' בו כסף נותן לו דינר של כסף כסף דינרין נותן לו שני דינרין של כסף ,של כסף תלמוד לומר אלהי כסף לא יעשה לו של כסף אבל יעשה לו של זהב ,19,9,449.0,335.0,0.6195652173913043,0.75,2050000269
269,336,ref-t.3.5.13.9.23-ref-t.3.5.13.9.32,ref-mek.6.6.3.88-ref-mek.6.6.3.95,676658,676702,107296,107304,ref-t.3.5.13.9.23,ref-t.3.5.13.9.32,259611,259650,42746,42753,ref-mek.6.6.3.88,ref-mek.6.6.3.95,נאמר הנה לא ינום ולא ישן אלא כל זמן שישראל ,שנאמר הנה לא ינום ולא יישן שומר ישראל ,8,7,330.0,336.0,0.27906976744186046,0.6,2050000270
270,337,ref-t.5.3.12.9.8-ref-t.5.3.12.9.18,ref-mek.6.6.3.104-ref-mek.6.6.3.117,1150201,1150260,181682,181692,ref-t.5.3.12.9.8,ref-t.5.3.12.9.18,259683,259757,42761,42774,ref-mek.6.6.3.104,ref-mek.6.6.3.117,ששולט בה לבוללה אמרו לי בששים שולט בששים ואחד אין שולט ,שליט בקנאה ואין קנאה שולטת בי אני שליט בנומה ואין נומה שולטת בי שנאמר ,10,13,597.0,337.0,0.6571428571428571,0.9166666666666666,2050000271
271,338,ref-t.3.5.13.9.23-ref-t.3.5.13.9.32,ref-mek.6.6.3.117-ref-mek.6.6.3.124,676658,676702,107296,107304,ref-t.3.5.13.9.23,ref-t.3.5.13.9.32,259751,259790,42774,42781,ref-mek.6.6.3.117,ref-mek.6.6.3.124,נאמר הנה לא ינום ולא ישן אלא כל זמן שישראל ,שנאמר הנה לא ינום ולא יישן שומר ישראל ,8,7,330.0,337.0,0.27906976744186046,0.6,2050000272
272,339,ref-t.4.8.6.7.10-ref-t.4.8.6.7.33,ref-mek.6.6.3.254-ref-mek.6.6.3.281,997176,997310,158143,158164,ref-t.4.8.6.7.10,ref-t.4.8.6.7.33,260423,260595,42893,42918,ref-mek.6.6.3.254,ref-mek.6.6.3.281,מפני מה אינו מבטלה אמרו להן אילו לדבר אחד היו עובדין היו אומרין הרי הן עובדין לחמה וללבנה לכוכבים ולמזלות יאבד עולמו מפני השוטים ,מפני מה אינו מבטלה אמר לו וכי לדבר אחד אתם עובדין והרי אתם עובדין לחמה וללבנה ולכוכבים ולמזלות להרים ולגבעות לאפיקים וגיאיות ואפילו לאדם יאבד עולמו מפני השוטים ,21,25,552.0,339.0,0.4125,0.41666666666666663,2050000273
273,340,ref-t.3.1.1.6.1-ref-t.3.1.1.6.7,ref-mek.6.7.1.27-ref-mek.6.7.1.35,509276,509313,79624,79630,ref-t.3.1.1.6.1,ref-t.3.1.1.6.7,261671,261712,43104,43112,ref-mek.6.7.1.27,ref-mek.6.7.1.35,כשם שפוטרות מן הנשואין כך פוטרות מן ,כשם שהיא פטורה מן הקרבן כך תהא פטורה מן ,6,8,183.0,340.0,0.475,0.5555555555555556,2050000274
274,341,ref-t.2.5.4.9.24-ref-t.2.5.4.9.35,ref-mek.6.7.1.106-ref-mek.6.7.1.127,410008,410068,64194,64203,ref-t.2.5.4.9.24,ref-t.2.5.4.9.35,262039,262153,43166,43186,ref-mek.6.7.1.106,ref-mek.6.7.1.127,לו ר' לעזר אומ' ונקה מנקה הוא לשבים ואין מנקה,לא ינקה שכבר נאמר ינקה ואי אפשר לומר ינקה שכבר נאמר לא ינקה אמור מעתה מנקה הוא לשבים ואינו מנקה לשאינן,45,102,148.0,341.0,0.6470588235294118,0.8181818181818181,2050000275
275,342,ref-t.3.5.8.8.76-ref-t.3.5.8.8.91,ref-mek.6.7.1.108-ref-mek.6.7.1.120,658767,658848,104229,104242,ref-t.3.5.8.8.76,ref-t.3.5.8.8.91,262047,262112,43168,43179,ref-mek.6.7.1.108,ref-mek.6.7.1.120,שכבר נאמ' לוי למעלה ואין אתה יכול לומר לוי למעלה שכבר נאמר לוי למטה אמור מעתה ,שכבר נאמר ינקה ואי אפשר לומר ינקה שכבר נאמר לא ינקה אמור מעתה ,13,11,310.0,341.0,0.358974358974359,0.7,2050000276
276,344,ref-t.2.5.4.5.102-ref-t.2.5.4.7.18,ref-mek.6.7.1.159-ref-mek.6.7.1.175,409034,409519,64029,64113,ref-t.2.5.4.5.102,ref-t.2.5.4.7.18,262301,262396,43210,43224,ref-mek.6.7.1.159,ref-mek.6.7.1.175,ויום הכפורים מכפרין על התשובה תשובה מכפרת ויום הכפורים מכפר שנ' כי ביום הזה יכפר עליכם,שובבים הא למדת שתשובה מכפרת וכתוב אחד אומר ביום הזה יכפר עליכם הא למדת שיום,86,75,135.0,344.0,0.627906976744186,0.6666666666666667,2050000277
277,345,ref-t.2.5.4.9.40-ref-t.2.5.4.9.49,ref-mek.6.7.1.159-ref-mek.6.7.1.175,410087,410147,64206,64215,ref-t.2.5.4.9.40,ref-t.2.5.4.9.49,262301,262396,43210,43224,ref-mek.6.7.1.159,ref-mek.6.7.1.175,ויום הכפורים מכפרין עם התשובה תשובה מכפרת עם המיתה ויום ,שובבים הא למדת שתשובה מכפרת וכתוב אחד אומר ביום הזה יכפר עליכם הא למדת שיום הכיפורים מכפר ,9,14,148.0,344.0,0.6777777777777778,0.8,2050000278
278,348,ref-t.2.5.4.5.149-ref-t.2.5.4.8.65,ref-mek.6.7.1.206-ref-mek.6.7.1.316,409276,409890,64071,64172,ref-t.2.5.4.5.149,ref-t.2.5.4.8.65,262566,263186,43255,43350,ref-mek.6.7.1.206,ref-mek.6.7.1.316,תשובה תולה ויום הכפורים מכפר ר' ישמעאל ארבעה חלוקי כפרה הן עבר על מצות עשה ועשה תשובה אין זז ממקומו עד שמוחלין לו שנ' שובו בנים שובבים ארפא משובתם עבר על מצות לא תעשה ועשה תשוב' תשובה תולה ויום הכפורים מכפר שנ' כי ביום הזה יכפר עליכם וגו' עבר על כריתות ומיתות בית דין ועשה תשובה תשובה ויום הכפורים תולין ויסורין שבשאר ימות השנה ממרקין שנ' ופקדתי בשבט פשעם וגו' אבל מי שנתחלל בו שם שמים מזיד ועשה תשובה אין בה לא בתשובה לתלות ולא ביום הכפורים לכפר אלא תשובה ויום שליש ומיתה ממרקת עם הייסורין ועל זה נאמ' אם יכופר העון,העובר על מצוות עשה ועשה תשובה אינו זז משם עד שמוחלין לו ועל זה נאמר שובו בנים שובבים והעובר על מצוות לא תעשה ועשה תשובה אין כאן בתשובה לכפר אלא תשובה תולה ויום הכיפורים מכפר ועל זה נאמר כי ביום הזה יכפר עליכם והמזיד על כריתות ועל מיתת בית דין ועשה תשובה אין כח תשובה לתלות ויום הכיפורים לכפר אלא תשובה ויום הכיפורים מכפרין מחצה וייסורין ממרקין מכפרין מחצה ועל זה נאמר ופקדתי בשבט פשעם ובנגעים עוונם מי שמחלל שם שמים ועשה תשובה אין כח בתשובה לתלות ולא יום הכיפורים מכפר ולא ייסורין בלבד ממרקין אלא,516,496,135.0,348.0,0.560077519379845,0.5344827586206897,2050000279
279,352,ref-t.2.5.4.9.31-ref-t.2.5.4.9.46,ref-mek.6.7.1.257-ref-mek.6.7.1.269,410039,410131,64199,64212,ref-t.2.5.4.9.31,ref-t.2.5.4.9.46,262830,262908,43298,43308,ref-mek.6.7.1.257,ref-mek.6.7.1.269,לשבים ואין מנקה לשאין שבים ר' יהודה או' מיתה ויום הכפורים מכפרין עם התשובה תשובה מכפרת ,תשובה אין כח תשובה לתלות ויום הכיפורים לכפר אלא תשובה ויום הכיפורים מכפרין ,13,10,148.0,348.0,0.5977011494252874,0.8,2050000280
280,355,ref-t.2.5.4.5.105-ref-t.2.5.4.5.152,ref-mek.6.7.1.352-ref-mek.6.7.1.387,409056,409301,64032,64074,ref-t.2.5.4.5.105,ref-t.2.5.4.5.152,263375,263559,43385,43417,ref-mek.6.7.1.352,ref-mek.6.7.1.387,על התשובה תשובה מכפרת על עבירות קלות על עשה ועל לא תעשה חוץ מלא תשא ואילו הן עבירות חמורות כריתות ומיתות בית דין ולא תשא עמהן ר' יהודה אומ' כל שהו מלא תשא ולמטה תשובה מכפרת וכל שהוא מלא תשא ולמעלה ולא תשא,מכפר ר' אומר כל שהוא מלא תשא ולמעלן התשובה מכפרת מלא תשא ולמטה ולא תשא עימהם התשובה תולה ויום הכיפורים מכפר ואי זה הוא מלא תשא ולמעלה עשה ולא תעשה חוץ מלא תשא,204,158,135.0,355.0,0.6421568627450981,0.6333333333333333,2050000281
281,358,ref-t.4.5.5.16.18-ref-t.4.5.5.16.26,ref-mek.6.7.1.389-ref-mek.6.7.1.398,945765,945816,149922,149928,ref-t.4.5.5.16.18,ref-t.4.5.5.16.26,263566,263622,43419,43425,ref-mek.6.7.1.389,ref-mek.6.7.1.398,שחייבין מיתה בידי שמים וכרת בידי שמים אין מלקין ,שחייבין עליהם מיתות בית דין מיתה בידי שמים כרת ומלקות ,6,6,525.0,358.0,0.42592592592592593,0.5555555555555556,2050000282
282,359,ref-t.5.5.5.9.106-ref-t.5.5.5.9.115,ref-mek.6.7.4.128-ref-mek.6.7.4.139,1198129,1198177,189436,189445,ref-t.5.5.5.9.106,ref-t.5.5.5.9.115,265245,265297,43687,43696,ref-mek.6.7.4.128,ref-mek.6.7.4.139,לגר ולא לגר צדק אלא לגר תושב שנ' ונמכר לגר ,וגרך זה גר צדק או אינו אלא גר תושב כשהוא אומר הגר ,9,9,633.0,359.0,0.44,0.6363636363636364,2050000283
283,360,ref-t.4.6.3.6.37-ref-t.4.6.3.6.42,ref-mek.6.8.2.16-ref-mek.6.8.2.39,955574,955597,151535,151540,ref-t.4.6.3.6.37,ref-t.4.6.3.6.42,267817,267934,44063,44075,ref-mek.6.8.2.16,ref-mek.6.8.2.39,לא תרצח לא תנאף לא תגנב ,לא תרצח לא תנאף למה נאמר לפי שהוא אומר מות יומת הנואף והנואפת עונש שמענו אזהרה לא שמענו תלמוד לומר לא תנאף לא תגנוב ,5,12,541.0,360.0,0.7931034482758621,0.7857142857142857,2050000284
284,361,ref-t.4.6.1.5.28-ref-t.4.6.1.5.43,ref-mek.6.8.2.105-ref-mek.6.8.2.119,947754,947842,150233,150248,ref-t.4.6.1.5.28,ref-t.4.6.1.5.43,268266,268349,44110,44123,ref-mek.6.8.2.105,ref-mek.6.8.2.119,נאמ' לפי ששלש מצות אמורות בפרשה ב' מפורשה וא' סתומה תלמד סתומה מן המפורשה מה מפורשה ,אמרת שלש מצות נאמרו בענין זה שתים מפורשות וא' סתומה נלמד סתומה ממפורשות מה מפורשת ,15,13,526.0,361.0,0.34523809523809523,0.6666666666666667,2050000285
285,362,ref-t.4.1.2.3.11-ref-t.4.1.2.3.16,ref-mek.6.8.2.161-ref-mek.6.8.2.166,731077,731109,115783,115788,ref-t.4.1.2.3.11,ref-t.4.1.2.3.16,268558,268590,44147,44152,ref-mek.6.8.2.161,ref-mek.6.8.2.166,ועשיתם לו כאשר זמם לעשות לאחיו ,ועשיתם לו כאשר זמם לעשות לאחיו ,5,5,351.0,362.0,0.0,0.0,2050000286
286,363,ref-t.4.1.7.23.40-ref-t.4.1.7.23.45,ref-mek.6.8.2.161-ref-mek.6.8.2.166,759098,759130,120089,120094,ref-t.4.1.7.23.40,ref-t.4.1.7.23.45,268558,268590,44147,44152,ref-mek.6.8.2.161,ref-mek.6.8.2.166,ועשיתם לו כאשר זמם לעשות לאחיו ,ועשיתם לו כאשר זמם לעשות לאחיו ,5,5,414.0,362.0,0.0,0.0,2050000287
287,364,ref-t.4.1.8.1.81-ref-t.4.1.8.1.86,ref-mek.6.8.2.161-ref-mek.6.8.2.166,759693,759725,120191,120196,ref-t.4.1.8.1.81,ref-t.4.1.8.1.86,268558,268590,44147,44152,ref-mek.6.8.2.161,ref-mek.6.8.2.166,ועשיתם לו כאשר זמם לעשות לאחיו ,ועשיתם לו כאשר זמם לעשות לאחיו ,5,5,417.0,362.0,0.0,0.0,2050000288
288,365,ref-t.4.5.1.7.58-ref-t.4.5.1.7.63,ref-mek.6.8.2.161-ref-mek.6.8.2.166,934570,934602,148180,148185,ref-t.4.5.1.7.58,ref-t.4.5.1.7.63,268558,268590,44147,44152,ref-mek.6.8.2.161,ref-mek.6.8.2.166,ועשיתם לו כאשר זמם לעשות לאחיו ,ועשיתם לו כאשר זמם לעשות לאחיו ,5,5,521.0,362.0,0.0,0.0,2050000289
289,366,ref-t.4.6.1.7.86-ref-t.4.6.1.7.119,ref-mek.6.8.3.38-ref-mek.6.8.3.70,948668,948830,150400,150431,ref-t.4.6.1.7.86,ref-t.4.6.1.7.119,270276,270433,44407,44436,ref-mek.6.8.3.38,ref-mek.6.8.3.70,כלל ופרט וכלל אי אתה דן אלא כעין הפרט כשהוא אומ' לכל טומאתו אשר יטמא בה והוא וכלל אם כלל כלל הראשון אמרת ליו אלא כלל ופרט וכלל אי אתה דן אלא,כלל ופרט אין בכלל אלא מה שבפרט וכשהוא אומר וכל אשר לרעך חזר וכלל או כלל כלל הראשון הרי אמרת לאו אלא חזר וכלל כלל ופרט וכלל אי אתה דן,140,132,528.0,366.0,0.4142857142857143,0.5454545454545454,2050000290
290,368,ref-t.5.5.1.10.15-ref-t.5.5.1.10.22,ref-mek.6.9.1.323-ref-mek.6.9.1.333,1181332,1181371,186671,186676,ref-t.5.5.1.10.15,ref-t.5.5.1.10.22,272737,272794,44793,44799,ref-mek.6.9.1.323,ref-mek.6.9.1.333,לפניהן שנים עשר מיל על כל דיבור ודיבור ,לפניהם שנים עשר מיל עשרים וארבעה מיל על כל דיבור ודיבור ,5,6,619.0,368.0,0.32142857142857145,0.375,2050000291
291,369,ref-t.5.3.12.8.84-ref-t.5.3.12.9.11,ref-mek.6.9.2.127-ref-mek.6.9.2.135,1150142,1150223,181670,181685,ref-t.5.3.12.8.84,ref-t.5.3.12.9.11,274028,274075,45003,45010,ref-mek.6.9.2.127,ref-mek.6.9.2.135,אמרו לי אם לאו אתה אמרתי להן ת'ל סלת בלולה בשמן מנחה ששולט בה לבוללה אמרו,ישלוט בהם מלאך המות שנאמר אני אמרתי אלהים,73,41,597.0,369.0,0.7808219178082192,0.8125,2050000292
292,371,ref-t.5.3.5.5.6-ref-t.5.3.5.5.18,ref-mek.6.11.1.95-ref-mek.6.11.1.112,1112887,1112955,175805,175817,ref-t.5.3.5.5.6,ref-t.5.3.5.5.18,279332,279439,45876,45893,ref-mek.6.11.1.95,ref-mek.6.11.1.112,הן מפוגלין והלחם כשר הן כשרין והלחם מפוגל הן כשרין והלחם כשר שחטן ,כשר לכפרה כשר לשחיטה ראש המזבח שהוא כשר לכפרה דין הוא שיוכשר לשחיטה והרי המזבח הפנימי יוכיח שהוא ,12,17,591.0,371.0,0.7319587628865979,0.9333333333333333,2050000293
293,372,ref-t.5.3.5.5.6-ref-t.5.3.5.5.18,ref-mek.6.11.1.138-ref-mek.6.11.1.155,1112887,1112955,175805,175817,ref-t.5.3.5.5.6,ref-t.5.3.5.5.18,279576,279683,45915,45932,ref-mek.6.11.1.138,ref-mek.6.11.1.155,הן מפוגלין והלחם כשר הן כשרין והלחם מפוגל הן כשרין והלחם כשר שחטן ,כשר לכפרה כשר לשחיטה ראש המזבח שהוא כשר לכפרה דין הוא שיוכשר לשחיטה והרי המזבח הפנימי יוכיח שהוא ,12,17,591.0,372.0,0.7319587628865979,0.9333333333333333,2050000294
294,373,ref-t.2.5.3.1.20-ref-t.2.5.3.1.42,ref-mek.6.11.1.152-ref-mek.6.11.1.169,401356,401485,62844,62866,ref-t.2.5.3.1.20,ref-t.2.5.3.1.42,279657,279756,45929,45944,ref-mek.6.11.1.152,ref-mek.6.11.1.169,על מזבח החיצון שם הוא גומר על מזבח הפנימי וממקום שמתחיל בעולה במזבח החיצון משם הוא גומר בחטאת במזבח הפנימי על כולן הוא,המזבח הפנימי יוכיח שהוא כשר לכפרה ואינו כשר לשחיטה והוא יוכיח על מזבח החיצון אף על,118,82,132.0,372.0,0.6864406779661016,0.7222222222222222,2050000295
295,375,ref-t.5.2.1.14.25-ref-t.5.2.1.14.35,ref-mek.6.11.1.164-ref-mek.6.11.1.182,1069750,1069810,169212,169222,ref-t.5.2.1.14.25,ref-t.5.2.1.14.35,279729,279826,45941,45955,ref-mek.6.11.1.164,ref-mek.6.11.1.182,במזבח פנימי פסול ב כשר במזבח פנימי פסול במזבח החיצון כשר,מזבח החיצון אף על פי שהוא כשר לכפרה לא יוכשר לשחיטה לא אם אמרת במזבח,56,68,585.0,372.0,0.7352941176470589,0.7857142857142857,2050000296
296,377,ref-t.1.8.5.27.19-ref-t.1.8.5.27.25,ref-mek.6.11.1.231-ref-mek.6.11.1.237,215084,215117,33881,33887,ref-t.1.8.5.27.19,ref-t.1.8.5.27.25,280111,280145,46002,46008,ref-mek.6.11.1.231,ref-mek.6.11.1.237,המזבח שנ' מזבח אדמה תעשה לי וגו' ,מזבח אדמה תעשה לי וזבחת עליו וגו' ,6,6,67.0,377.0,0.5882352941176471,0.5,2050000297
297,378,ref-t.5.1.7.1.19-ref-t.5.1.7.1.26,ref-mek.6.11.1.262-ref-mek.6.11.1.268,1038595,1038647,164389,164396,ref-t.5.1.7.1.19,ref-t.5.1.7.1.26,280279,280326,46021,46027,ref-mek.6.11.1.262,ref-mek.6.11.1.268,מחצי המזבח ולצפון כצפון מחצי מזבח ולחוץ כדרום ,מחצי המזבח לצפון כצפון ומחצי המזבח לדרום ,7,6,575.0,378.0,0.1956521739130435,0.5,2050000298
298,379,ref-t.2.6.4.3.4-ref-t.2.6.4.3.29,ref-mek.6.11.1.387-ref-mek.6.11.1.405,424281,424414,66487,66512,ref-t.2.6.4.3.4,ref-t.2.6.4.3.29,280947,281039,46121,46138,ref-mek.6.11.1.387,ref-mek.6.11.1.405,למקום שלבי אוהב לשם רגליי מוליכות אותי אם אתה תבוא לביתי אני אבא לביתיך אם אתה לא תבוא לביתי אני לא אבוא לביתיך שנ' בכל המקום,אם תבא לביתי אבא לביתך אם לא תבא לביתי לא אבא לביתך מקום שלבי אוהב שם רגלי מוליכות,125,82,157.0,379.0,0.624,0.4,2050000299
299,381,ref-t.1.8.2.14.14-ref-t.1.8.2.15.5,ref-mek.6.11.2.178-ref-mek.6.11.2.193,199418,199491,31377,31388,ref-t.1.8.2.14.14,ref-t.1.8.2.15.5,282159,282248,46312,46324,ref-mek.6.11.2.178,ref-mek.6.11.2.193,בה קדשי קדשים וחייבין עליה משום טומאה בנויה בקודש ופתוחה לחול ולקודש ,בונה בהיכל ובקדש הקדשים שהיה בדין ומה אם מזבח הקל אסור לבנות בו ההיכל וקדש הקדשים ,11,12,64.0,381.0,0.6585365853658537,0.8888888888888888,2050000300
300,382,ref-t.5.1.10.14.14-ref-t.5.1.10.14.22,ref-mek.6.11.2.180-ref-mek.6.11.2.193,1055267,1055316,166946,166954,ref-t.5.1.10.14.14,ref-t.5.1.10.14.22,282171,282248,46314,46324,ref-mek.6.11.2.180,ref-mek.6.11.2.193,בו קדשי קדשים מורק ושוטף לקדשי קדשים קדשים קלים ,ובקדש הקדשים שהיה בדין ומה אם מזבח הקל אסור לבנות בו ההיכל וקדש הקדשים ,8,10,580.0,381.0,0.6619718309859155,0.8333333333333334,2050000301
301,383,ref-t.3.5.15.1.76-ref-t.3.5.15.1.80,ref-mek.6.11.2.222-ref-mek.6.11.2.226,679393,679422,107750,107754,ref-t.3.5.15.1.76,ref-t.3.5.15.1.80,282388,282415,46346,46350,ref-mek.6.11.2.222,ref-mek.6.11.2.226,ומקבות והגרזן וכל כלי ברזל ,ומקבות והגרזן כל כלי ברזל ,4,4,334.0,383.0,0.037037037037037035,0.19999999999999996,2050000302
