,index,baseOrig,compOrig,baseCharStart,baseCharEnd,baseWdStart,baseWdEnd,baseRefStart,baseRefEnd,compCharStart,compCharEnd,compWdStart,compWdEnd,compRefStart,compRefEnd,baseStr,compStr,bRange,cRange,grp-ref-t,grp-ref-mek,dam-lev,jac,id
102,133,ref-t.3.5.4.6.13-ref-t.3.5.4.6.33,ref-mek.1.19.7.1-ref-mek.1.19.7.24,633655,633759,99926,99945,ref-t.3.5.4.6.13,ref-t.3.5.4.6.33,86013,86146,13546,13568,ref-mek.1.19.7.1,ref-mek.1.19.7.24,ויקח משה את עצמות יוסף וגו' מלמד שכל העם היו עסוקין בביזה והוא עוסק במצוה שנ' חכם יקח לבב יקח מצות ,ויקח משה את עצמות יוסף להודיע חכמתו וחסידותו שכל ישראל עוסקין בבזה ומשה עוסק במצות עצמות יוסף עליו הכתוב אומר חכם לב יקח מצוות ,19,22,263.0,133.0,0.4566929133858268,0.56,2050000103
103,134,ref-t.3.5.4.6.110-ref-t.3.5.4.6.121,ref-mek.1.19.7.28-ref-mek.1.19.7.41,634153,634208,100013,100024,ref-t.3.5.4.6.110,ref-t.3.5.4.6.121,86165,86236,13572,13585,ref-mek.1.19.7.28,ref-mek.1.19.7.41,היה משה יודע היכן יוסף קבור אמרו סרח בת אשר היתה באותו ,ומשה מהיכן היה יודע היכן היה קבור יוסף אמרו סרח בת אשר נשתיירה מאותו ,11,13,266.0,134.0,0.36231884057971014,0.2727272727272727,2050000104
104,135,ref-t.3.5.4.6.131-ref-t.3.5.4.6.143,ref-mek.1.19.7.53-ref-mek.1.19.7.64,634259,634327,100034,100046,ref-t.3.5.4.6.131,ref-t.3.5.4.6.143,86295,86354,13597,13608,ref-mek.1.19.7.53,ref-mek.1.19.7.64,שעשו לו מצרים שפודין של מתכת וחברום בבעץ והלך משה ועמד על נילוס ,עשו לו מצרים ארון של מתכת ושקעהו לנילוס בא ועמד על נילוס ,12,11,267.0,135.0,0.328125,0.625,2050000105
105,136,ref-t.3.5.4.6.272-ref-t.3.5.4.6.292,ref-mek.1.19.7.93-ref-mek.1.19.7.107,634986,635095,100158,100174,ref-t.3.5.4.6.272,ref-t.3.5.4.6.292,86504,86585,13633,13646,ref-mek.1.19.7.93,ref-mek.1.19.7.107,מגלה את עצמך מוטב ואם לאו נקיים אנחנו משבועה שהשבעת את אבותינו מיד הקיץ את ארונו של,בגללך אנו מעוכבים ואם לאו נקיים אנחנו משבועתך מיד צף ארונו של יוסף ונטלו,83,72,271.0,136.0,0.4939759036144578,0.7142857142857143,2050000106
106,138,ref-t.3.5.4.6.166-ref-t.3.5.4.6.199,ref-mek.1.19.7.93-ref-mek.1.19.7.124,634442,634619,100068,100095,ref-t.3.5.4.6.166,ref-t.3.5.4.6.199,86504,86678,13633,13660,ref-mek.1.19.7.93,ref-mek.1.19.7.124,מגלה את עצמך מוטב ואם לאו נקיים אנו משבועה שנשבעת את אבותינו צף ארונו ליספר ונטלו משה ובא לו ואל תתמה שהרי הוא אומ' ויהי האחד מפיל את הקורה ואת הברזל נפל וגו' ויאמר ,בגללך אנו מעוכבים ואם לאו נקיים אנחנו משבועתך מיד צף ארונו של יוסף ונטלו משה ואל תתמה בדבר הזה הרי הוא אומר ויהי האחד מפיל את הקורה והברזל נפל למים ויצעק ויאמר ,27,27,268.0,136.0,0.38181818181818183,0.5945945945945945,2050000107
107,139,ref-t.3.5.4.6.209-ref-t.3.5.4.6.231,ref-mek.1.19.7.134-ref-mek.1.19.7.150,634667,634778,100104,100121,ref-t.3.5.4.6.209,ref-t.3.5.4.6.231,86722,86811,13666,13679,ref-mek.1.19.7.134,ref-mek.1.19.7.150,וישלך שמה ויצף הברזל והלא דברים קל וחומר ומה אלישע תלמידו של אליהו תלמידו של משה כך משה,אלישע תלמידו של אליהו הציף הברזל קל וחומר למשה רבו של אליהו ר' נתן,87,66,269.0,139.0,0.6206896551724138,0.5555555555555556,2050000108
108,141,ref-t.3.5.4.1.4-ref-t.3.5.4.1.11,ref-mek.1.19.7.156-ref-mek.1.19.7.161,631001,631043,99474,99481,ref-t.3.5.4.1.4,ref-t.3.5.4.1.11,86838,86870,13685,13690,ref-mek.1.19.7.156,ref-mek.1.19.7.161,מדת פורענות שבמדה שאדם מודד בה מודדין לו ,שבמידה שהאדם מודד בה מודדים לו ,7,5,241.0,141.0,0.36585365853658536,0.4,2050000109
109,142,ref-t.3.5.4.7.1-ref-t.3.5.4.7.9,ref-mek.1.19.7.219-ref-mek.1.19.7.228,635352,635395,100228,100235,ref-t.3.5.4.7.1,ref-t.3.5.4.7.9,87174,87225,13745,13753,ref-mek.1.19.7.219,ref-mek.1.19.7.228,משה זכה בעצמות יוסף אף הוא לא נתעסק,כיוסף שלא נתעסק בו אלא משה משה נתעסק בעצמות,35,43,275.0,142.0,0.7441860465116279,0.5,2050000110
110,144,ref-t.3.5.4.6.8-ref-t.3.5.4.6.17,ref-mek.1.19.7.221-ref-mek.1.19.7.234,633634,633678,99922,99929,ref-t.3.5.4.6.8,ref-t.3.5.4.6.17,87186,87262,13747,13759,ref-mek.1.19.7.221,ref-mek.1.19.7.234,נתעסק בו אלא משה שנ' ויקח משה את עצמות יוסף ,נתעסק בו אלא משה משה נתעסק בעצמות יוסף שאין בישראל גדול ממנו שנאמר ויקח ,7,12,263.0,142.0,0.5694444444444444,0.5,2050000111
111,145,ref-t.3.5.4.7.8-ref-t.3.5.4.7.17,ref-mek.1.19.7.245-ref-mek.1.19.7.252,635383,635434,100234,100240,ref-t.3.5.4.7.8,ref-t.3.5.4.7.17,87308,87352,13769,13775,ref-mek.1.19.7.245,ref-mek.1.19.7.252,נתעסק בו אלא המקום ברוך הוא שנ' ויקבור אותו בגיא ,נתעסק בו אלא שכינה שנאמר ויקבור אותו בגיא ,6,6,275.0,145.0,0.32653061224489793,0.5,2050000112
112,146,ref-t.3.5.4.6.301-ref-t.3.5.4.6.346,ref-mek.1.19.7.282-ref-mek.1.19.7.343,635139,635351,100183,100227,ref-t.3.5.4.6.301,ref-t.3.5.4.6.346,87511,87834,13801,13859,ref-mek.1.19.7.282,ref-mek.1.19.7.343,ארון של מת והיו כל עוברין ושבין אומ' מה טיבן של שני ארונות הללו אמרו להם אחד ארון קדש ואחד ארון של מת אמרו להם וכי איפשר לארון קדש להלך עם ארונו של מת אמרו להם מת מוטל בארון זה קיים מה שכת' ומונח בארון,עם ארון חי העולמים והיו עוברים ושבים אומרים מה טיבן של שני ארונות הללו והם אומרים להם זה ארונו של מת וזה ארונו של חי העולמים ואומרים להם מה טיבו של מת להלוך עם ארון חי העולמים ואומר להם המונח בארון זה קיים מה שכתוב במונח בארון זה במונח בארון זה כתיב אנכי ה' אלהיך וביוסף כתיב התחת אלהים,201,286,273.0,146.0,0.5244755244755245,0.5,2050000113
113,147,ref-t.3.2.1.6.1-ref-t.3.2.1.6.7,ref-mek.1.19.7.286-ref-mek.1.19.7.298,555382,555412,87041,87047,ref-t.3.2.1.6.1,ref-t.3.2.1.6.7,87531,87600,13805,13817,ref-mek.1.19.7.286,ref-mek.1.19.7.298,היתה מעוברת אמרו לה מה טיבו של ,והיו עוברים ושבים אומרים מה טיבן של שני ארונות הללו והם אומרים להם ,6,12,194.0,146.0,0.7313432835820896,0.8333333333333334,2050000114
114,149,ref-t.4.6.3.6.36-ref-t.4.6.3.6.43,ref-mek.1.19.7.415-ref-mek.1.19.7.429,955569,955600,151534,151541,ref-t.4.6.3.6.36,ref-t.4.6.3.6.43,88196,88264,13920,13934,ref-mek.1.19.7.415,ref-mek.1.19.7.429,אביך לא תרצח לא תנאף לא תגנב לא ,אביך לא תרצח לא רצח לפוטיפר לא תנאף לא נאף לאשת פוטיפר לא תגנוב לא ,7,14,541.0,149.0,0.5223880597014925,0.5,2050000115
115,150,ref-t.3.5.4.6.47-ref-t.3.5.4.6.56,ref-mek.1.19.7.576-ref-mek.1.19.7.585,633818,633871,99957,99965,ref-t.3.5.4.6.47,ref-t.3.5.4.6.56,88989,89042,14060,14068,ref-mek.1.19.7.576,ref-mek.1.19.7.585,ואת עצמות יוסף אשר העלו בני ישראל ממצרים קברו בשכם ,ואת עצמות יוסף אשר העלו בני ישראל ממצרים קברו בשכם ,8,8,265.0,150.0,0.0,0.0,2050000116
116,151,ref-t.2.5.2.16.38-ref-t.2.5.2.16.78,ref-mek.1.19.9.92-ref-mek.1.19.9.108,400896,401093,62766,62803,ref-t.2.5.2.16.38,ref-t.2.5.2.16.78,90225,90318,14266,14280,ref-mek.1.19.9.92,ref-mek.1.19.9.108,אחת אחת ואחת אחת ושתים אחת ושלש אחת וארבע אחת וחמש אחת ושש אחת ושבע ר' יהודה אמ' משם ר' ליעזר כך היה מונה אחת אחת ואחת שתים ואחת שלש ואחת ארבע ואחת חמש ואחת שש ואחת שבע,ואחד שהיה מהלך לפניהם ר' יאשיה אומר ארבעה אחד לפניהם ואחד לאחריהם אחד למעלה ואחד,168,80,130.0,151.0,0.7380952380952381,0.9047619047619048,2050000117
117,153,ref-t.3.5.4.2.84-ref-t.3.5.4.2.95,ref-mek.1.19.9.100-ref-mek.1.19.9.106,631956,632034,99637,99648,ref-t.3.5.4.2.84,ref-t.3.5.4.2.95,90269,90310,14272,14278,ref-mek.1.19.9.100,ref-mek.1.19.9.106,אחד מימינם ואחד משמאלם אחד לפניהם ואחד לאחריהם ואחד למעלה מראשיהם ואחד,אחד לפניהם ואחד לאחריהם אחד למעלה ואחד,70,38,255.0,151.0,0.45714285714285713,0.4285714285714286,2050000118
118,155,ref-t.3.5.3.1.8-ref-t.3.5.3.1.13,ref-mek.1.19.9.116-ref-mek.1.19.9.121,626408,626438,98643,98648,ref-t.3.5.3.1.8,ref-t.3.5.3.1.13,90355,90385,14286,14291,ref-mek.1.19.9.116,ref-mek.1.19.9.121,שבמדה שאדם מודד בה מודדין לו ,שבמדה שאדם מודד בה מודדין לו ,5,5,210.0,155.0,0.0,0.0,2050000119
119,156,ref-t.3.5.3.2.5-ref-t.3.5.3.2.9,ref-mek.1.19.9.116-ref-mek.1.19.9.121,626718,626742,98696,98700,ref-t.3.5.3.2.5,ref-t.3.5.3.2.9,90355,90385,14286,14291,ref-mek.1.19.9.116,ref-mek.1.19.9.121,שבמדה שמדדה בה מדדו לה ,שבמדה שאדם מודד בה מודדין לו ,4,5,213.0,155.0,0.3448275862068966,0.5,2050000120
120,157,ref-t.3.5.4.1.6-ref-t.3.5.4.1.11,ref-mek.1.19.9.116-ref-mek.1.19.9.121,631013,631043,99476,99481,ref-t.3.5.4.1.6,ref-t.3.5.4.1.11,90355,90385,14286,14291,ref-mek.1.19.9.116,ref-mek.1.19.9.121,שבמדה שאדם מודד בה מודדין לו ,שבמדה שאדם מודד בה מודדין לו ,5,5,241.0,155.0,0.0,0.0,2050000121
121,158,ref-t.3.5.4.1.61-ref-t.3.5.4.1.69,ref-mek.1.19.9.116-ref-mek.1.19.9.124,631302,631351,99529,99537,ref-t.3.5.4.1.61,ref-t.3.5.4.1.69,90355,90408,14286,14294,ref-mek.1.19.9.116,ref-mek.1.19.9.124,שבמדה שמדד בה מדדו לו אברהם רץ לפני מלאכי השרת ,שבמדה שאדם מודד בה מודדין לו אברהם לווה מלאכי השרת ,8,8,252.0,155.0,0.27450980392156865,0.4444444444444444,2050000122
122,159,ref-t.3.5.4.5.1-ref-t.3.5.4.5.16,ref-mek.1.19.9.122-ref-mek.1.19.9.137,633481,633563,99896,99907,ref-t.3.5.4.5.1,ref-t.3.5.4.5.16,90386,90474,14292,14305,ref-mek.1.19.9.122,ref-mek.1.19.9.137,באברהם מהו אומ' ואברהם הולך עמם לשלחם אף המקום ברוך הוא הלוה את בניו ארבעים שנה ,אברהם לווה מלאכי השרת שנאמר ובאברהם הולך עמם לשלחם והמקום לווה את בניו במדבר מ' שנה ,11,13,261.0,155.0,0.4642857142857143,0.5555555555555556,2050000123
123,160,ref-t.3.5.4.2.27-ref-t.3.5.4.2.42,ref-mek.1.19.9.160-ref-mek.1.19.9.171,631654,631732,99587,99598,ref-t.3.5.4.2.27,ref-t.3.5.4.2.42,90592,90654,14325,14335,ref-mek.1.19.9.160,ref-mek.1.19.9.171,באברהם הוא אומ' יקח נא מעט מים אף המקום ברוך הוא בישר ונתן לבניו באר במדבר ,"באברהם הוא אומר יוקח נא מעט מים והקב""ה העלה לבניו באר במדבר ",11,10,253.0,160.0,0.32,0.6,2050000124
124,161,ref-t.2.6.3.11.44-ref-t.2.6.3.11.50,ref-mek.1.19.9.174-ref-mek.1.19.9.182,421558,421589,66014,66019,ref-t.2.6.3.11.44,ref-t.2.6.3.11.50,90665,90706,14338,14345,ref-mek.1.19.9.174,ref-mek.1.19.9.182,השורה את השירה עלי באר ענו לה ,ישיר ישראל את השירה הזאת עלי באר ענו לה ,5,7,156.0,161.0,0.325,0.2857142857142857,2050000125
125,162,ref-t.3.5.4.3.113-ref-t.3.5.4.3.137,ref-mek.1.19.9.183-ref-mek.1.19.9.202,632955,633077,99816,99836,ref-t.3.5.4.3.113,ref-t.3.5.4.3.137,90707,90813,14346,14364,ref-mek.1.19.9.183,ref-mek.1.19.9.202,באברהם הוא אומ' ואל הבקר רץ אברהם אף המקום ברוך הוא הגיז לבניו שליו מן הים שנ' ורוח נסע מאת ייי,"באברהם הוא אומר ואל הבקר רץ אברהם והקב""ה הגיז שליו לבניו שנאמר ורוח נסע מאת ה' ויגז שלויים מן",95,93,257.0,162.0,0.4421052631578947,0.44999999999999996,2050000126
126,164,ref-t.3.5.4.2.70-ref-t.3.5.4.2.82,ref-mek.1.19.9.203-ref-mek.1.19.9.214,631879,631948,99624,99635,ref-t.3.5.4.2.70,ref-t.3.5.4.2.82,90814,90880,14365,14375,ref-mek.1.19.9.203,ref-mek.1.19.9.214,באברהם הוא אומ' והשענו תחת העץ אף המקום נתן לבניו שבעה ענני כבוד ,"באברהם הוא אומר והשענו תחת העץ והקב""ה פרש לבניו שבעה ענני כבוד ",11,10,254.0,164.0,0.16923076923076924,0.4666666666666667,2050000127
127,165,ref-t.3.5.4.4.1-ref-t.3.5.4.4.20,ref-mek.1.19.9.222-ref-mek.1.19.9.239,633380,633480,99880,99895,ref-t.3.5.4.4.1,ref-t.3.5.4.4.20,90918,91012,14383,14400,ref-mek.1.19.9.222,ref-mek.1.19.9.239,באברהם מהו אומ' והוא עומד עליהם וגו' אף המקום ברוך הוא הגין את בניו במצרים שנ' ופסח ייי על הפתח ,"באברהם הוא כתיב והוא עומד עליהם והקב""ה מגין על בני בניו במצרים שלא ינגעו ופסח ה' על הפתח ",15,17,260.0,165.0,0.4166666666666667,0.5714285714285714,2050000128
128,166,ref-t.1.2.1.2.13-ref-t.1.2.1.2.19,ref-mek.1.19.9.408-ref-mek.1.19.9.415,34654,34693,5668,5674,ref-t.1.2.1.2.13,ref-t.1.2.1.2.19,91909,91955,14540,14546,ref-mek.1.19.9.408,ref-mek.1.19.9.415,על ע'ז ועל גלוי עריות ועל שפיכות דמים ,על עבודה זרה ועל גילוי עריות ועל שפיכות דמים ,6,6,34.0,166.0,0.17777777777777778,0.375,2050000129
129,167,ref-t.4.8.8.4.7-ref-t.4.8.8.4.18,ref-mek.1.19.9.408-ref-mek.1.19.9.415,1004740,1004807,159357,159368,ref-t.4.8.8.4.7,ref-t.4.8.8.4.18,91909,91955,14540,14546,ref-mek.1.19.9.408,ref-mek.1.19.9.415,על הדינין ועל ע'ז ועל קללת השם ועל גלוי עריות ועל שפיכות דמים ,על עבודה זרה ועל גילוי עריות ועל שפיכות דמים ,11,6,555.0,166.0,0.3870967741935484,0.5454545454545454,2050000130
130,168,ref-t.4.4.13.9.47-ref-t.4.4.13.9.55,ref-mek.2.2.1.324-ref-mek.2.2.2.1,927466,927510,147034,147041,ref-t.4.4.13.9.47,ref-t.4.4.13.9.55,94143,94209,14909,14918,ref-mek.2.2.1.324,ref-mek.2.2.2.1,הן ועליהן הוא או' תעיתי כשה אובד וגו' נאמ' ,שהוא הציל את עצמו ועליו הוא אומר משגיא לגוים ויאבדם וגו' ואמר ,7,9,511.0,168.0,0.5645161290322581,0.875,2050000131
131,169,ref-t.3.5.4.7.53-ref-t.3.5.4.7.59,ref-mek.2.2.2.51-ref-mek.2.2.2.57,635610,635639,100276,100282,ref-t.3.5.4.7.53,ref-t.3.5.4.7.59,94475,94504,14964,14970,ref-mek.2.2.2.51,ref-mek.2.2.2.57,עלה אל הר העברים הזה הר נבו ,עלה אל הר העברים הזה הר נבו ,6,6,278.0,169.0,0.0,0.0,2050000132
132,170,ref-t.1.1.1.15.3-ref-t.1.1.1.15.7,ref-mek.2.2.3.169-ref-mek.2.2.3.173,4297,4329,713,717,ref-t.1.1.1.15.3,ref-t.1.1.1.15.7,95909,95941,15203,15207,ref-mek.2.2.3.169,ref-mek.2.2.3.173,ויהי בשלם סוכו ומעונתו בציון ,ויהי בשלם סוכו והעונתו בציון ,4,4,15.0,170.0,0.034482758620689655,0.4,2050000133
133,171,ref-t.2.4.2.13.40-ref-t.2.4.2.13.48,ref-mek.2.2.4.112-ref-mek.2.2.4.128,380146,380197,59325,59333,ref-t.2.4.2.13.40,ref-t.2.4.2.13.48,96844,96930,15368,15380,ref-mek.2.2.4.112,ref-mek.2.2.4.128,שולחני ושולחני נוטלן ממנו ונותן לו מן מטבע היוצא ,ושלחנו ונטלו ממונינו משל למה הדבר דומה לאחד שאמר לעבדו צא והבא לי דג מן השוק יצא ,8,12,123.0,171.0,0.6790123456790124,0.8421052631578947,2050000134
134,172,ref-t.4.4.3.8.6-ref-t.4.4.3.8.18,ref-mek.2.2.6.162-ref-mek.2.2.6.175,891442,891506,141320,141331,ref-t.4.4.3.8.6,ref-t.4.4.3.8.18,101129,101200,16082,16095,ref-mek.2.2.6.162,ref-mek.2.2.6.175,הוסיף עליהן הכת' עוד אחד דבר אחר לנטו' אחרי רבים להטות שלא תאמר ,אחרי ישראל ר' אנטונינוס אומר ג' היו הוסיף עליהם עוד א' והיו ד' דבר אחר ,11,13,473.0,172.0,0.7605633802816901,0.8,2050000135
135,173,ref-t.1.1.3.6.47-ref-t.1.1.3.6.56,ref-mek.2.3.2.157-ref-mek.2.3.2.163,10664,10716,1764,1773,ref-t.1.1.3.6.47,ref-t.1.1.3.6.56,103429,103471,16468,16474,ref-mek.2.3.2.157,ref-mek.2.3.2.163,ערב ובקר וצהרים אשיחה ואהמה ערב זו תפלת ערבית בקר,תפלה שנאמר ערב ובקר וצהרים אשיחה ואהמה,49,38,17.0,173.0,0.673469387755102,0.5454545454545454,2050000136
136,175,ref-t.2.5.2.7.51-ref-t.2.5.2.7.57,ref-mek.2.3.3.438-ref-mek.2.3.3.454,396915,396949,62109,62115,ref-t.2.5.2.7.51,ref-t.2.5.2.7.57,108106,108200,17265,17281,ref-mek.2.3.3.438,ref-mek.2.3.3.454,אמ' למעלה עשן כנגדי אמרתי לו הראהו ,אומרת לעשות מלחמה כנגדו ואחת אומרת נצווח כנגדן זאת שאמרה ליפול אל הים נאמר להם התיצבו וראו ,6,16,125.0,175.0,0.7252747252747253,0.8333333333333334,2050000137
137,176,ref-t.2.5.2.7.50-ref-t.2.5.2.7.57,ref-mek.2.3.3.462-ref-mek.2.3.3.475,396910,396949,62108,62115,ref-t.2.5.2.7.50,ref-t.2.5.2.7.57,108236,108302,17288,17300,ref-mek.2.3.3.462,ref-mek.2.3.3.475,ראית אמ' למעלה עשן כנגדי אמרתי לו הראהו,נאמר להם כי אשר ראיתם את מצרים זו שאמרה נעשה מלחמה כנגדו נאמר,39,61,125.0,176.0,0.7704918032786885,0.9411764705882353,2050000138
138,178,ref-t.3.3.2.7.12-ref-t.3.3.2.7.22,ref-mek.2.4.1.273-ref-mek.2.4.1.284,590703,590754,92730,92739,ref-t.3.3.2.7.12,ref-t.3.3.2.7.22,110299,110355,17616,17626,ref-mek.2.4.1.273,ref-mek.2.4.1.284,אם לא בריתי יומם ולילה חקות שמים וארץ לא שמתי אין ,אם לא בריתי יומם ולילה חוקות שמים וארץ לא שמתי אמרת אי ,9,10,204.0,178.0,0.12727272727272726,0.11111111111111116,2050000139
139,179,ref-t.3.1.1.7.9-ref-t.3.1.1.8.2,ref-mek.2.4.1.619-ref-mek.2.4.1.636,509516,509598,79655,79668,ref-t.3.1.1.7.9,ref-t.3.1.1.8.2,112078,112172,17906,17923,ref-mek.2.4.1.619,ref-mek.2.4.1.636,צרותיהן מותרות שאין צרה אלא מאה ניסו לאחים שלא בעבירה צרותיהן פטורות הלכו צרות,"ועבר בים צרה ואין צרה אלא ע""ז שנאמר והמסכה צרה כהתכנס ואומר ואשה אל אחותה לא תקח לצרור",78,86,184.0,179.0,0.6511627906976745,0.7894736842105263,2050000140
140,181,ref-t.3.3.6.6.3-ref-t.3.3.6.6.11,ref-mek.2.5.3.24-ref-mek.2.5.3.41,601388,601433,94489,94496,ref-t.3.3.6.6.3,ref-t.3.3.6.6.11,115131,115213,18424,18438,ref-mek.2.5.3.24,ref-mek.2.5.3.41,אישה יקימנו ואישה יפרנו את שבא לכלל הקם בא ,איש את אחיו ולא קמו איש מתחתיו שלשת ימים וכן את מוצא לעתיד לבוא קומו אורי כי בא ,7,14,205.0,181.0,0.6625,0.8235294117647058,2050000141
141,182,ref-t.1.1.4.18.182-ref-t.1.1.4.18.201,ref-mek.2.6.1.19-ref-mek.2.6.1.47,20636,20729,3363,3382,ref-t.1.1.4.18.182,ref-t.1.1.4.18.201,118827,118975,19045,19069,ref-mek.2.6.1.19,ref-mek.2.6.1.47,שבטים ועמדו על הים זה אומ' אני ארד וזה אומ' אני ארד קפץ שבטו של יהודה וירד תחלה וקדש שמו ,כשעמדו שבטים על הים זה אומר אני יורד תחלה לים וזה אומר אני יורד תחלה לים מתוך שהיו עומדין וצווחין קפץ שבטו של בנימן וירד לים תחלה שנאמר שם ,19,24,27.0,182.0,0.539568345323741,0.5,2050000142
142,183,ref-t.1.1.4.18.211-ref-t.1.1.4.18.222,ref-mek.2.6.2.45-ref-mek.2.6.2.57,20769,20828,3391,3402,ref-t.1.1.4.18.211,ref-t.1.1.4.18.222,120550,120617,19344,19356,ref-mek.2.6.2.45,ref-mek.2.6.2.57,הושיעני אלים כי באו מים עד נפש טבעתי ביון מצולה ואין מעמד ,הושיעני אלהים כי באו מים עד נפש ואומר טבעתי ביון מצולה ואין מעמד ,11,12,29.0,183.0,0.1076923076923077,0.11111111111111116,2050000143
143,184,ref-t.1.1.4.16.16-ref-t.1.1.4.16.39,ref-mek.2.6.2.182-ref-mek.2.6.2.223,18978,19104,3098,3116,ref-t.1.1.4.16.16,ref-t.1.1.4.16.39,121286,121498,19473,19508,ref-mek.2.6.2.182,ref-mek.2.6.2.223,או' להם לתלמידיו השותה מים לצמאו מאי מברך אמרו לו ילמדנו רבינו אמ' להם בורא נפשות וחסרונן אמ' להם,אמר לו למדתנו רבנו שעל זכות יוסף היה אמרו לו רבנו השותה מים לצמאו כיצד הוא מברך אמר להם בורא נפשות רבות וחסרונן על כל מה שבראת חי העולמים אמרו לו למדתנו מברך אמרו לו למדנו,97,171,19.0,184.0,0.6549707602339181,0.64,2050000144
144,186,ref-t.1.1.4.18.165-ref-t.1.1.4.18.171,ref-mek.2.6.2.211-ref-mek.2.6.2.230,20548,20586,3348,3353,ref-t.1.1.4.18.165,ref-t.1.1.4.18.171,121430,121536,19498,19515,ref-mek.2.6.2.211,ref-mek.2.6.2.230,זכה יהודה למלכות אמרו לו ילמדנו,אמרו לו למדתנו רבינו השותה מים לצמאו כיצד מברך אמרו לו למדנו רבינו באי זו זכות זכה יהודה,31,88,25.0,184.0,0.75,0.7692307692307692,2050000145
145,187,ref-t.1.1.4.17.55-ref-t.1.1.4.17.71,ref-mek.2.6.2.211-ref-mek.2.6.2.234,19641,19725,3191,3202,ref-t.1.1.4.17.55,ref-t.1.1.4.17.71,121430,121551,19498,19517,ref-mek.2.6.2.211,ref-mek.2.6.2.234,אמ' להם אשאל אמרו לו ילמדנו רבנו אמ' להם מפני מה זכה יהודה למלכות מפני שהודה בתמר ,אמרו לו למדתנו רבינו השותה מים לצמאו כיצד מברך אמרו לו למדנו רבינו באי זו זכות זכה יהודה למלכות אמר להם רבי טרפון אמרו ,11,19,22.0,184.0,0.5882352941176471,0.7142857142857143,2050000146
146,190,ref-t.1.1.4.18.71-ref-t.1.1.4.18.90,ref-mek.2.6.2.226-ref-mek.2.6.2.254,20101,20200,3266,3282,ref-t.1.1.4.18.71,ref-t.1.1.4.18.90,121506,121658,19511,19535,ref-mek.2.6.2.226,ref-mek.2.6.2.254,ויאמר יהודה אל אחיו מה בצע וגו' אמ' להם דיה להצלה שתכפר על המכירה אלא מפני מה,זכות זכה יהודה למלכות אמר להם רבי טרפון אמרו אתם אמרו בזכות שאמר מה בצע כי נהרוג את אחינו שהצילו ממיתה אמר להם דייה להצלה,77,121,23.0,184.0,0.6694214876033058,0.7916666666666666,2050000147
147,192,ref-t.1.1.4.18.182-ref-t.1.1.4.18.191,ref-mek.2.6.2.307-ref-mek.2.6.2.317,20636,20682,3363,3372,ref-t.1.1.4.18.182,ref-t.1.1.4.18.191,121914,121967,19581,19589,ref-mek.2.6.2.307,ref-mek.2.6.2.317,שבטים ועמדו על הים זה אומ' אני ארד וזה אומ' ,כשעמדו שבטים על הים זה אומר אני יורד תחלה וזה אומר ,9,8,27.0,192.0,0.37254901960784315,0.5,2050000148
148,193,ref-t.1.1.4.18.229-ref-t.1.1.4.18.239,ref-mek.2.6.2.354-ref-mek.2.6.2.367,20858,20911,3409,3419,ref-t.1.1.4.18.229,ref-t.1.1.4.18.239,122169,122240,19622,19634,ref-mek.2.6.2.354,ref-mek.2.6.2.367,היתה יהודה לקדשו וגו' יהודה קדש שמו של הקב'ה על הים ,"היתה יהודה לקדשו לכך ישראל ממשלותיו אמר להם הקב""ה מי שקדש שמי על הים ",10,12,30.0,193.0,0.4782608695652174,0.6666666666666667,2050000149
149,194,ref-t.2.5.4.6.20-ref-t.2.5.4.6.24,ref-mek.2.6.3.182-ref-mek.2.6.3.186,409399,409427,64093,64097,ref-t.2.5.4.6.20,ref-t.2.5.4.6.24,123334,123365,19825,19829,ref-mek.2.6.3.182,ref-mek.2.6.3.186,שובו בנים שובבים ארפא משובתם ,שובו בנים שובבים ארפא משובותיכם ,4,4,135.0,194.0,0.09375,0.33333333333333337,2050000150
150,195,ref-t.3.5.6.2.11-ref-t.3.5.6.2.19,ref-mek.2.7.6.144-ref-mek.2.7.6.150,641844,641890,101357,101365,ref-t.3.5.6.2.11,ref-t.3.5.6.2.19,131643,131681,21234,21240,ref-mek.2.7.6.144,ref-mek.2.7.6.150,שירה שרת עליהן רוח הקדש ואמרו שירה כיצד אמרו ,שרתה עליהם רוח הקדש ואמרו שירה שנאמר ,8,6,281.0,195.0,0.26666666666666666,0.4444444444444444,2050000151
151,196,ref-t.3.5.6.2.11-ref-t.3.5.6.2.19,ref-mek.2.7.7.29-ref-mek.2.7.7.35,641844,641890,101357,101365,ref-t.3.5.6.2.11,ref-t.3.5.6.2.19,132010,132051,21286,21292,ref-mek.2.7.7.29,ref-mek.2.7.7.35,שירה שרת עליהן רוח הקדש ואמרו שירה כיצד אמרו ,ושרתה עליהם רוח הקדש ואמרו שירה שנאמר ,8,6,281.0,196.0,0.28888888888888886,0.4444444444444444,2050000152
152,197,ref-t.3.5.6.2.10-ref-t.3.5.6.2.15,ref-mek.2.7.7.73-ref-mek.2.7.7.78,641839,641868,101356,101361,ref-t.3.5.6.2.10,ref-t.3.5.6.2.15,132260,132293,21321,21326,ref-mek.2.7.7.73,ref-mek.2.7.7.78,לומ' שירה שרת עליהן רוח הקדש ,שאמרו שירה ושרת עליהם רוח הקדש ,5,5,281.0,197.0,0.1935483870967742,0.5,2050000153
