,index,baseOrig,compOrig,baseCharStart,baseCharEnd,baseWdStart,baseWdEnd,baseRefStart,baseRefEnd,compCharStart,compCharEnd,compWdStart,compWdEnd,compRefStart,compRefEnd,baseStr,compStr,bRange,cRange,grp-ref-t,grp-ref-sifre-n,dam-lev,jac,id
188,254,ref-t.3.4.5.2.7-ref-t.3.4.5.3.2,ref-sifre-n.38.1.168-ref-sifre-n.38.1.272,615321,616030,96777,96916,ref-t.3.4.5.2.7,ref-t.3.4.5.3.2,61548,62082,8842,8941,ref-sifre-n.38.1.168,ref-sifre-n.38.1.272,הרי שהיה נזיר ומצורע מהו שיגלח תגלחת אחת ותעלה לו לנזרו ולצרעתו אמ' להן אין מגלח אמרו לו למה אמ' להם אילו זה מגלח להעביר שער וזה מגלח להעביר שער יפה אתם אומ' אלא נזיר מגלח להעביר שער ומצורע מגלח לגדל שער אמרו לו אף אנו אומרין לא תעלה לו בימי גמרו תעלה לו בימי ספרו אמ' להם אילו וזה לאחר ביאת מים יפה אתם אומ' אלא נזיר מגלח מגלח לאחר ביאת מים ומצורע מגלח לפני ביאת מים אמרו לו אף אנו אומ' לא תעלה לו בטהור תעלה לו אילו זה מגלח לאחר דמים וזה מגלח לאחר דמים יפה אתה אומ' אלא נזיר מגלח אלא נזיר מגלח לאחר דמים ומצורע מגלח לפני דמים אמרו לו תקון הדבר לא תעלה לו בימי גמרו תעלה לו בימי ספרו תעלה לו בטמא נזיר שנצטרע ומצורע שנזר מגלח תגלחת אחת על שתיהן שני נזירין,"הרי שהיה נזיר טהור ומצורע מהו שיגלח תגלחת אחת ותעלה לו לנזרו ולצרעתו אמר להם וכי אפשר אלו זה מגלח לגדל שער וזה מגלח לגדל שער יפה אתם אומרים אלא שהמצורע מגלח לגדל שער והנזיר מגלה להעביר שער איך אפשר לו לגלח תגלחת אחת ותעלה לו לנזרו ולצרעתו אמרו לו אם כן לא עולה לו בטהור עולה לו בטטא לא תעלה לו לימי חליטו ותעלה לימי ספרו א""ל וכי אפשר אלו מגלח לפני דמים וזה מגלח לפני דמים יפה אתם אומרים אלא שהמצורע מגלח לפני דמים ונזיר מגלח לאחר זריקת דמים איך אפשר שיגלח תגלחת אחת ותעלה לו לנזרו ולצרעתו",140,100,258.0,254.0,0.5335365853658537,0.4,2070000189
189,266,ref-t.2.10.1.10.8-ref-t.2.10.1.10.22,ref-sifre-n.38.1.254-ref-sifre-n.38.1.262,474836,474913,74194,74205,ref-t.2.10.1.10.8,ref-t.2.10.1.10.22,61980,62028,8924,8932,ref-sifre-n.38.1.254,ref-sifre-n.38.1.262,שדם המת נזיר מגלח עליו וחייבין על טומאת מקדש וקדשיו דם תפיסה אין נזיר מגלח ,דמים ונזיר מגלח לאחר זריקת דמים איך אפשר שיגלח ,11,8,141.0,254.0,0.6266666666666667,0.875,2070000190
190,269,ref-t.3.4.5.2.54-ref-t.3.4.5.2.142,ref-sifre-n.38.1.295-ref-sifre-n.38.1.318,615555,615968,96821,96905,ref-t.3.4.5.2.54,ref-t.3.4.5.2.142,62210,62326,8964,8987,ref-sifre-n.38.1.295,ref-sifre-n.38.1.318,לא תעלה לו בימי גמרו תעלה לו בימי ספרו אמ' להם אילו זה מגלח לאחר ביאת וזה לאחר ביאת מים תקון הדבר לא תעלה לו בימי גמרו תעלה לו בימי ספרו לא תעלה לו בטהור תעלה לו בטמא,זה לפני ביאת מים וזה לאהר ביאת מים תקון הדבר לא עולה בימי גמרו לא עולה בימי ספרו לא עולה בטהור ולא עולה בטמא,85,24,258.0,269.0,0.4879518072289157,0.4117647058823529,2070000191
191,272,ref-t.6.2.11.7.59-ref-t.6.2.11.7.75,ref-sifre-n.38.1.306-ref-sifre-n.38.1.318,1294769,1294856,204285,204301,ref-t.6.2.11.7.59,ref-t.6.2.11.7.75,62261,62326,8975,8987,ref-sifre-n.38.1.306,ref-sifre-n.38.1.318,מלמעלה קבעו ולא נתן עליו מעזיבה טהור נתן עליו מעזיבה ולא קבעו טמא קבעו ולא נתן עליו ,עולה בימי גמרו לא עולה בימי ספרו לא עולה בטהור ולא עולה בטמא ,16,12,828.0,269.0,0.7023809523809523,0.6363636363636364,2070000192
192,273,ref-t.4.9.1.7.68-ref-t.4.9.1.7.77,ref-sifre-n.39.1.88-ref-sifre-n.39.1.97,1007784,1007831,159848,159857,ref-t.4.9.1.7.68,ref-t.4.9.1.7.77,62788,62839,9054,9063,ref-sifre-n.39.1.88,ref-sifre-n.39.1.97,נאמ' כאן דבר ונאמר להלן דבר מה דבר האמור להלן ,נאמר כאן ברכה ונאמר להלן ברכה מה ברכה האמורה להלן ,9,9,534.0,273.0,0.22,0.4285714285714286,2070000193
193,274,ref-t.3.5.7.22.82-ref-t.3.5.7.22.96,ref-sifre-n.39.1.88-ref-sifre-n.39.1.102,654744,654813,103559,103573,ref-t.3.5.7.22.82,ref-t.3.5.7.22.96,62788,62867,9054,9068,ref-sifre-n.39.1.88,ref-sifre-n.39.1.102,נאמ' כאן אחר ונאמ' להלן אחר מה אחר שנאמ' להלן נכרי אף אחר שנאמ' כאן ,נאמר כאן ברכה ונאמר להלן ברכה מה ברכה האמורה להלן בעמידה אף ברכה האמורה כאן ,14,14,340.0,273.0,0.4342105263157895,0.75,2070000194
194,275,ref-t.4.4.13.9.55-ref-t.4.4.13.9.71,ref-sifre-n.39.1.88-ref-sifre-n.39.1.102,927506,927599,147041,147057,ref-t.4.4.13.9.55,ref-t.4.4.13.9.71,62788,62867,9054,9068,ref-sifre-n.39.1.88,ref-sifre-n.39.1.102,נאמ' כאן אבדה ונאמרה להלן אבדה מתבקשת מה אבידה האמורה להלן אבידה מתבקשת אף אבידה האמורה כן ,נאמר כאן ברכה ונאמר להלן ברכה מה ברכה האמורה להלן בעמידה אף ברכה האמורה כאן ,16,14,463.0,273.0,0.3516483516483517,0.5,2070000195
195,276,ref-t.4.9.1.7.126-ref-t.4.9.1.7.142,ref-sifre-n.39.1.88-ref-sifre-n.39.1.102,1008056,1008133,159905,159921,ref-t.4.9.1.7.126,ref-t.4.9.1.7.142,62788,62867,9054,9068,ref-sifre-n.39.1.88,ref-sifre-n.39.1.102,נאמר כאן דבר ולהלן נאמ' דבר מה דבר אמור להלן מקצתו לא כולו אף דבר האמור כאן ,נאמר כאן ברכה ונאמר להלן ברכה מה ברכה האמורה להלן בעמידה אף ברכה האמורה כאן ,16,14,566.0,273.0,0.47368421052631576,0.6666666666666667,2070000196
196,277,ref-t.5.5.2.9.33-ref-t.5.5.2.9.50,ref-sifre-n.39.1.88-ref-sifre-n.39.1.102,1184031,1184123,187111,187128,ref-t.5.5.2.9.33,ref-t.5.5.2.9.50,62788,62867,9054,9068,ref-sifre-n.39.1.88,ref-sifre-n.39.1.102,נאמ' כאן וחשב ונאמ' להלן וחשב מה וחשב האמור להלן חמשים סלע לבית כור אף וחשב האמור כאן ,נאמר כאן ברכה ונאמר להלן ברכה מה ברכה האמורה להלן בעמידה אף ברכה האמורה כאן ,17,14,705.0,273.0,0.4186046511627907,0.7142857142857143,2070000197
197,278,ref-t.2.9.3.1.31-ref-t.2.9.3.1.43,ref-sifre-n.39.1.194-ref-sifre-n.39.1.203,468271,468339,73151,73161,ref-t.2.9.3.1.31,ref-t.2.9.3.1.43,63335,63383,9144,9151,ref-sifre-n.39.1.194,ref-sifre-n.39.1.203,מקיש בניו לו מה הוא מעומד ונשיאות כפים בבקר אף בניו מעומד ונשיאות ,מקיש בניו לו מה הוא בנשיאת כפים אף בניו בנשיאת ,10,7,136.0,278.0,0.3181818181818182,0.5714285714285714,2070000198
198,279,ref-t.3.5.13.9.23-ref-t.3.5.13.9.32,ref-sifre-n.40.1.81-ref-sifre-n.40.1.88,676658,676702,107296,107304,ref-t.3.5.13.9.23,ref-t.3.5.13.9.32,64640,64679,9337,9344,ref-sifre-n.40.1.81,ref-sifre-n.40.1.88,נאמר הנה לא ינום ולא ישן אלא כל זמן שישראל ,ואומר הנה לא ינום ולא יישן שומר ישראל ,8,7,392.0,279.0,0.3023255813953488,0.4444444444444444,2070000199
199,280,ref-t.3.7.5.16.69-ref-t.3.7.5.16.75,ref-sifre-n.40.1.221-ref-sifre-n.40.1.227,725606,725643,114937,114943,ref-t.3.7.5.16.69,ref-t.3.7.5.16.75,65359,65394,9447,9453,ref-sifre-n.40.1.221,ref-sifre-n.40.1.227,וקויי ייי יחליפו כח יעלו אבר כנשרים ,וקוי ה' יחליפו כח יעלו אבר כנשרים ,6,6,411.0,280.0,0.1111111111111111,0.1428571428571429,2070000200
200,281,ref-t.2.4.2.2.46-ref-t.2.4.2.2.52,ref-sifre-n.41.1.104-ref-sifre-n.41.1.110,376870,376906,58823,58829,ref-t.2.4.2.2.46,ref-t.2.4.2.2.52,65921,65958,9542,9548,ref-sifre-n.41.1.104,ref-sifre-n.41.1.110,ומצא חן ושכל טוב בעיני אלים ואדם ,ומצא חן ושכל טוב בעיני אלהים ואדם ,6,6,114.0,281.0,0.029411764705882353,0.0,2070000201
201,282,ref-t.2.1.13.5.75-ref-t.2.1.13.5.87,ref-sifre-n.42.2.383-ref-sifre-n.42.2.398,273041,273110,42704,42716,ref-t.2.1.13.5.75,ref-t.2.1.13.5.87,68419,68504,9934,9948,ref-sifre-n.42.2.383,ref-sifre-n.42.2.398,להטיל שלום בין איש לאשתו אמ' המקום ספר שנכתב בקדושה ימחה על המים ,"שנכתב בקדושה נמחה ע""י המים מפני שלום בשביל להטיל שלום בין איש לאשתו ר' אלעזר אומר ",12,14,74.0,282.0,0.7926829268292683,0.5555555555555556,2070000202
202,283,ref-t.4.2.3.5.46-ref-t.4.2.3.5.53,ref-sifre-n.42.2.530-ref-sifre-n.42.2.548,794184,794221,125681,125688,ref-t.4.2.3.5.46,ref-t.4.2.3.5.53,69208,69320,10071,10089,ref-sifre-n.42.2.530,ref-sifre-n.42.2.548,אומ' מת מאתים שלי וזה אומ' מאתים שלי ,אומר ועתה השיבה אתהן בשלום גדול שלום שאפילו מתים צריכים שלום שנאמר ואתה תבוא אל אבותיך בשלום ואומר בשלום ,7,18,433.0,283.0,0.7428571428571429,0.9375,2070000203
203,284,ref-t.4.4.4.5.18-ref-t.4.4.4.5.23,ref-sifre-n.42.3.290-ref-sifre-n.42.3.295,894104,894139,141741,141746,ref-t.4.4.4.5.18,ref-t.4.4.4.5.23,71818,71853,10469,10474,ref-sifre-n.42.3.290,ref-sifre-n.42.3.295,ויהי לשלמה ארבעים אלף ארוות סוסים ,ויהי לשלמה ארבעים אלף ארוות סוסים ,5,5,454.0,284.0,0.0,0.0,2070000204
204,285,ref-t.3.5.11.18.1-ref-t.3.5.11.18.12,ref-sifre-n.42.3.317-ref-sifre-n.42.3.326,670193,670249,106180,106191,ref-t.3.5.11.18.1,ref-t.3.5.11.18.12,71967,72016,10490,10499,ref-sifre-n.42.3.317,ref-sifre-n.42.3.326,כת' אחד אומ' ואת חמשת בני מיכל וכת' אחד או' ולמיכל בת ,כתוב א' אומר מחזיק בתים שלשת אלפים יכיל וכתוב א' ,11,9,391.0,285.0,0.6666666666666666,0.8125,2070000205
205,286,ref-t.6.2.5.2.9-ref-t.6.2.5.2.43,ref-sifre-n.42.3.319-ref-sifre-n.42.3.343,1278179,1278363,201709,201741,ref-t.6.2.5.2.9,ref-t.6.2.5.2.43,71975,72101,10492,10512,ref-sifre-n.42.3.319,ref-sifre-n.42.3.343,מחזיק בתים שלשת אלפים יכיל במקום אחר הוא אומ' אלפים בת יכיל אי איפשר לומר אלפים שכבר נאמר שלשת אלפים ואי איפשר לומר שלשת אלפים שכבר נאמר אלפים אמור מעתה אלפים בלח שלשת,"אומר מחזיק בתים שלשת אלפים יכיל וכתוב א' אומר מ""א ד אלפים בת יכיל כיצד יתקיימו שני כתובים הללו אלפים בלח",33,21,809.0,285.0,0.6047904191616766,0.6818181818181819,2070000206
206,288,ref-t.6.2.5.1.32-ref-t.6.2.5.1.36,ref-sifre-n.42.3.339-ref-sifre-n.42.3.351,1277991,1278018,201676,201680,ref-t.6.2.5.1.32,ref-t.6.2.5.1.36,72077,72145,10508,10520,ref-sifre-n.42.3.339,ref-sifre-n.42.3.351,ארבעים לח שהן כוריים ביבש ,בלח שהן ג' אלפים ביבש מכאן אמרו חכמים ארבעים סאה בלח שהם כוריים ,4,12,808.0,285.0,0.765625,0.6923076923076923,2070000207
207,289,ref-t.3.7.2.5.53-ref-t.3.7.2.5.63,ref-sifre-n.49.1.106-ref-sifre-n.49.1.119,713234,713281,113073,113083,ref-t.3.7.2.5.53,ref-t.3.7.2.5.63,79405,79463,11720,11733,ref-sifre-n.49.1.106,ref-sifre-n.49.1.119,כסף ונמצא של זהב רוצה היא בשל זהב יתר משל כסף,זהב היא של זהב ומשקלה של כסף או היא של כסף ומשקלה של זהב,11,14,407.0,289.0,0.6428571428571429,0.5714285714285714,2070000208
208,290,ref-t.3.7.2.6.55-ref-t.3.7.2.6.65,ref-sifre-n.49.1.106-ref-sifre-n.49.1.119,713643,713691,113140,113150,ref-t.3.7.2.6.55,ref-t.3.7.2.6.65,79405,79463,11720,11733,ref-sifre-n.49.1.106,ref-sifre-n.49.1.119,כסף ונמצא של זהב רוצה היא בשל זהב יותר משל כסף,זהב היא של זהב ומשקלה של כסף או היא של כסף ומשקלה של זהב,11,14,409.0,289.0,0.6428571428571429,0.5714285714285714,2070000209
209,293,ref-t.5.8.2.3b.2-ref-t.5.8.2.3b.37,ref-sifre-n.51.1.47-ref-sifre-n.51.1.72,1233422,1233588,194893,194922,ref-t.5.8.2.3b.2,ref-t.5.8.2.3b.37,80060,80181,11838,11863,ref-sifre-n.51.1.47,ref-sifre-n.51.1.72,חטא ספק לא חטא מביא אשם תלוי חטא ואין ידוע באי זו חטא מביא חטא ונודע לו חטאו ושכח באי זה חטא חטא הרי זה מביא חטאת ותשחט לשום מה,והביא זה קרבן זה מביא נדבה ואין היחיד מביא נדבה זה קרבן זה מביא חטאת שלא על חטא ואין היחיד מביא חטאת שלא על חטא זה,30,26,767.0,293.0,0.6220472440944882,0.7647058823529411,2070000210
210,295,ref-t.5.8.4.1.9-ref-t.5.8.4.1.27,ref-sifre-n.51.1.60-ref-sifre-n.51.1.68,1239702,1239793,195842,195859,ref-t.5.8.4.1.9,ref-t.5.8.4.1.27,80122,80166,11851,11859,ref-sifre-n.51.1.60,ref-sifre-n.51.1.68,אחד אין מביא אלא חטאת אחת ועל ספיקן אין מביא אלא אשם תלוי אחד בחמשה העלמות מביא חמש חטאות ,מביא חטאת שלא על חטא ואין היחיד מביא חטאת ,17,8,776.0,293.0,0.6444444444444445,0.6153846153846154,2070000211
211,296,ref-t.5.2.1.14.3-ref-t.5.2.1.14.18,ref-sifre-n.53.1.83-ref-sifre-n.57.1.17,1069626,1069713,169190,169205,ref-t.5.2.1.14.3,ref-t.5.2.1.14.18,81395,81494,12065,12079,ref-sifre-n.53.1.83,ref-sifre-n.57.1.17,בהמה למעלה ודם כל הזבחים למטה נמצאת או' כשר בחטאת פסול בכל הזבחים כשר בכל הזבחים ,בהם פסול וכל בקר זבח השלמים למה נאמר לפי שהוא אומר ולזבח השלמים בקר שנים מלמד שכולם כשרו לזבח ,15,14,642.0,296.0,0.6595744680851063,0.7619047619047619,2070000212
212,297,ref-t.3.5.8.8.76-ref-t.3.5.8.8.87,ref-sifre-n.58.1.35-ref-sifre-n.58.1.44,658767,658828,104229,104238,ref-t.3.5.8.8.76,ref-t.3.5.8.8.87,81914,81969,12148,12156,ref-sifre-n.58.1.35,ref-sifre-n.58.1.44,שכבר נאמ' לוי למעלה ואין אתה יכול לומר לוי למעלה שכבר נאמר ,שכבר נאמר מעל הכפורת ואי אפשר מעל הכפורת שכבר נאמר ,9,8,367.0,297.0,0.5084745762711864,0.7777777777777778,2070000213
213,298,ref-t.5.2.1.19.15-ref-t.5.2.1.19.24,ref-sifre-n.61.1.169-ref-sifre-n.61.1.177,1070626,1070688,169361,169370,ref-t.5.2.1.19.15,ref-t.5.2.1.19.24,86365,86423,12882,12890,ref-sifre-n.61.1.169,ref-sifre-n.61.1.177,נמצאתה או' כשר במנורה פסול בחצוצרת כשר בחצוצרת פסול במנורה ,נמצא כשר במנורה פסול בחצוצרות כשר בחצוצרות פסול במנורה ,9,8,649.0,298.0,0.13559322033898305,0.625,2070000214
214,299,ref-t.5.3.9.20.3-ref-t.5.3.9.20.10,ref-sifre-n.61.1.170-ref-sifre-n.61.1.177,1136325,1136376,179423,179430,ref-t.5.3.9.20.3,ref-t.5.3.9.20.10,86370,86423,12883,12890,ref-sifre-n.61.1.170,ref-sifre-n.61.1.177,פסול במנורה כשר בחצוצרת פסול בחצוצרת כשר במנורה,כשר במנורה פסול בחצוצרות כשר בחצוצרות פסול במנורה,8,8,680.0,298.0,0.3673469387755102,0.4,2070000215
215,301,ref-t.5.2.1.16.9-ref-t.5.2.1.16.30,ref-sifre-n.62.1.4-ref-sifre-n.62.1.10,1070119,1070235,169275,169296,ref-t.5.2.1.16.9,ref-t.5.2.1.16.30,86895,86937,12968,12974,ref-sifre-n.62.1.4,ref-sifre-n.62.1.10,והמום פוסל בהן הלוים מבן שלשים שנה ועד בן חמשים שנה כשירה ואין המום פוסל בהן נמצאתה או' כשר בכהנים פסול בלוים ,שנים פוסלים בלוים ואין המום פוסל בלוים ,21,6,643.0,301.0,0.6727272727272727,0.6923076923076923,2070000216
216,302,ref-t.5.2.1.16.9-ref-t.5.2.1.16.30,ref-sifre-n.62.1.31-ref-sifre-n.62.1.56,1070119,1070235,169275,169296,ref-t.5.2.1.16.9,ref-t.5.2.1.16.30,87047,87189,12992,13013,ref-sifre-n.62.1.31,ref-sifre-n.62.1.56,והמום פוסל בהן הלוים מבן שלשים שנה ועד בן חמשים שנה כשירה ואין המום פוסל בהן נמצאתה או' כשר בכהנים פסול בלוים,שנים פוסלים בלוים ואין מומים פוסלים בהם ומבן חמשים חמש ועשרים שנה כתוב אחד אומר מבן חמש ועשרים שנה ומעלה וכתוב אחד,22,22,643.0,302.0,0.6666666666666666,0.7619047619047619,2070000217
217,304,ref-t.6.7.6.2.35-ref-t.6.7.6.2.74,ref-sifre-n.62.1.37-ref-sifre-n.63.1.2,1444644,1444830,227406,227432,ref-t.6.7.6.2.35,ref-t.6.7.6.2.74,87085,87276,12998,13025,ref-sifre-n.62.1.37,ref-sifre-n.63.1.2,שנה ויום אחד ועד בן שלש עשרה שנה ויום אחד שהביא שתי שערות הרי הוא כאיש לכל דבר בן ארבע עשרה ובן חמש עשרה שלא הביא שתי,בהם ומבן חמשים חמש ועשרים שנה כתוב אחד אומר מבן חמש ועשרים שנה ומעלה וכתוב אחד אומר מבן שלשים שנה כיצד יתקיימו שני הכתובים מבן חמש ועשרים שנה,27,28,947.0,302.0,0.6950354609929078,0.7307692307692308,2070000218
218,305,ref-t.2.4.3.26.6-ref-t.2.4.3.26.50,ref-sifre-n.62.1.37-ref-sifre-n.63.1.3,386248,386469,60340,60379,ref-t.2.4.3.26.6,ref-t.2.4.3.26.50,87085,87280,12998,13026,ref-sifre-n.62.1.37,ref-sifre-n.63.1.3,לעבודה אלא אם כן למד חמש שנים שנ' זאת אשר ללוים מבן חמש ועשרים שנה ולהלן הוא אומ' ומבן שלשים שנה אם נאמ' מבן חמש שלשים ואם נאמ' מבן שלשים למה נאמ' מבן חמש ועשרים אלא כל אותן שנים שבין,בהם ומבן חמשים חמש ועשרים שנה כתוב אחד אומר מבן חמש ועשרים שנה ומעלה וכתוב אחד אומר מבן שלשים שנה כיצד יתקיימו שני הכתובים מבן חמש ועשרים שנה לתלמוד,40,29,118.0,302.0,0.546448087431694,0.7307692307692308,2070000219
219,307,ref-t.6.6.1.1.31-ref-t.6.6.1.1.45,ref-sifre-n.62.1.38-ref-sifre-n.62.1.61,1399839,1399906,220356,220367,ref-t.6.6.1.1.31,ref-t.6.6.1.1.45,87089,87220,12999,13016,ref-sifre-n.62.1.38,ref-sifre-n.62.1.61,שנים פרסתם בן שלש שנים ועד בן חמש שנים ר' יוסי הגלילי,ומבן חמשים חמש ועשרים שנה כתוב אחד אומר מבן חמש ועשרים שנה ומעלה וכתוב אחד אומר מבן שלשים,12,18,906.0,302.0,0.6966292134831461,0.8235294117647058,2070000220
220,311,ref-t.5.2.1.16.1-ref-t.5.2.1.16.48,ref-sifre-n.63.1.93-ref-sifre-n.63.1.126,1070071,1070343,169268,169312,ref-t.5.2.1.16.1,ref-t.5.2.1.16.48,87763,87956,13106,13138,ref-sifre-n.63.1.93,ref-sifre-n.63.1.126,כהנים משיביאו שתי שערות ואפי' הן זקינים כשירה והמום פוסל בהן הלוים מבן שלשים שנה ועד בן חמשים שנה כשירה ואין המום פוסל בהן נמצאתה או' כשר בכהנים פסול בלוים כשר בלוים פסול בכהנים במה דברים אמורים באהל מועד שבמדבר אבל בבית העולמים אין הלוים,שנים פוסלים בלוים ואין פוסלים בכהונה שעד שלא נכנסו לארץ היו הלוים כשרים מבן שלשים שנה ועד בן חמשים שנה והכהנים משיביאו שתי שערות עד עולם אבל משנכנסו לארץ אין הלוים נפסלים אלא,45,33,643.0,311.0,0.6512605042016807,0.5,2070000221
221,313,ref-t.2.4.3.26.16-ref-t.2.4.3.26.30,ref-sifre-n.63.1.104-ref-sifre-n.63.1.111,386291,386367,60348,60360,ref-t.2.4.3.26.16,ref-t.2.4.3.26.30,87829,87869,13117,13124,ref-sifre-n.63.1.104,ref-sifre-n.63.1.111,ללוים מבן חמש ועשרים שנה ולהלן הוא אומ' ומבן שלשים שנה אם נאמ',הלוים כשרים מבן שלשים שנה ועד בן חמשים,13,8,118.0,311.0,0.6451612903225806,0.6153846153846154,2070000222
222,315,ref-t.2.12.1.3.47-ref-t.2.12.1.3.65,ref-sifre-n.63.1.104-ref-sifre-n.63.1.117,494957,495050,77374,77388,ref-t.2.12.1.3.47,ref-t.2.12.1.3.65,87829,87904,13117,13129,ref-sifre-n.63.1.104,ref-sifre-n.63.1.117,שיביא שתי שערות ר' אומ' אומ' אני עד שיהא בן עשרים שנה שנ' ויעמידו את הלוים מבן עשרים שנה ,הלוים כשרים מבן שלשים שנה ועד בן חמשים שנה והכהנים משיביאו שתי שערות עד ,14,12,144.0,311.0,0.6741573033707865,0.5789473684210527,2070000223
223,316,ref-t.6.6.1.1.29-ref-t.6.6.1.1.39,ref-sifre-n.63.1.106-ref-sifre-n.63.1.112,1399832,1399877,220354,220364,ref-t.6.6.1.1.29,ref-t.6.6.1.1.39,87842,87873,13119,13125,ref-sifre-n.63.1.106,ref-sifre-n.63.1.112,בן שתי שנים פרסתם בן שלש שנים ועד בן חמש שנים,מבן שלשים שנה ועד בן חמשים שנה,11,7,906.0,311.0,0.5333333333333333,0.375,2070000224
224,318,ref-t.6.7.6.4.37-ref-t.6.7.6.4.47,ref-sifre-n.63.1.106-ref-sifre-n.63.1.112,1445378,1445426,227510,227518,ref-t.6.7.6.4.37,ref-t.6.7.6.4.47,87842,87873,13119,13125,ref-sifre-n.63.1.106,ref-sifre-n.63.1.112,מבן שתים עשרה שנה ויום אחד ועד בן שלש עשרה שנה ,מבן שלשים שנה ועד בן חמשים שנה ,8,6,953.0,311.0,0.48936170212765956,0.5,2070000225
225,319,ref-t.6.7.6.2.10-ref-t.6.7.6.2.57,ref-sifre-n.63.1.106-ref-sifre-n.63.1.115,1444526,1444749,227391,227422,ref-t.6.7.6.2.10,ref-t.6.7.6.2.57,87842,87901,13119,13128,ref-sifre-n.63.1.106,ref-sifre-n.63.1.115,מבן תשע שנים ויום אחד ועד בן שתים עשרה שנה ויום אחד שהביא שתי שערות שומא ר' יוסי בר' יהודה או' סימן מבן שתים עשרה שנה ויום אחד ועד בן שלש עשרה,מבן שלשים שנה ועד בן חמשים שנה והכהנים משיביאו שתי,32,10,947.0,311.0,0.7394366197183099,0.65,2070000226
226,321,ref-t.3.5.11.6.37-ref-t.3.5.11.6.43,ref-sifre-n.64.1.65-ref-sifre-n.64.1.71,666867,666901,105607,105612,ref-t.3.5.11.6.37,ref-t.3.5.11.6.43,88314,88348,13192,13197,ref-sifre-n.64.1.65,ref-sifre-n.64.1.71,ובני ישראל אכלו את המן ארבעי' שנה ,ובני ישראל אכלו את המן ארבעים שנה ,5,5,390.0,321.0,0.029411764705882353,0.25,2070000227
227,322,ref-t.3.5.11.2.49-ref-t.3.5.11.2.63,ref-sifre-n.64.1.65-ref-sifre-n.64.1.77,666183,666251,105481,105493,ref-t.3.5.11.2.49,ref-t.3.5.11.2.63,88314,88377,13192,13202,ref-sifre-n.64.1.65,ref-sifre-n.64.1.77,ובני ישראל אכלו את המן ארבעים שנה עד באם אל ארץ נושבת שאין ת'ל עד ,ובני ישראל אכלו את המן ארבעים שנה עד בואם אל ארץ נושבת ועדיין ,12,10,388.0,321.0,0.18181818181818182,0.1428571428571429,2070000228
228,323,ref-t.5.5.2.9.29-ref-t.5.5.2.9.41,ref-sifre-n.65.1.101-ref-sifre-n.65.1.119,1184014,1184078,187107,187119,ref-t.5.5.2.9.29,ref-t.5.5.2.9.41,89305,89410,13349,13366,ref-sifre-n.65.1.101,ref-sifre-n.65.1.119,מה ת'ל וחשב אלא נאמ' כאן וחשב ונאמ' להלן וחשב מה וחשב האמור ,"ומה ת""ל במועדו אלא מופנה להקיש לדון הימנו גזרה שוה נאמר כאן במועדו ונאמר להלן במועדו מה מועדו האמור ",12,17,705.0,323.0,0.55,0.7894736842105263,2070000229
229,324,ref-t.3.5.10.8.42-ref-t.3.5.10.8.56,ref-sifre-n.65.1.111-ref-sifre-n.65.1.127,665366,665442,105335,105349,ref-t.3.5.10.8.42,ref-t.3.5.10.8.56,89358,89448,13358,13372,ref-sifre-n.65.1.111,ref-sifre-n.65.1.127,נאמ' כאן כלכול ונאמ' להלן כלכול מה כלכול האמור כאן רעב אף כלכול האמור להלן ,נאמר כאן במועדו ונאמר להלן במועדו מה מועדו האמור כאן דוחה את השבת אף מועדו האמור להלן ,14,14,382.0,323.0,0.4069767441860465,0.7142857142857143,2070000230
230,325,ref-t.2.3.4.14.5-ref-t.2.3.4.14.17,ref-sifre-n.65.1.113-ref-sifre-n.65.1.124,349692,349755,54601,54611,ref-t.2.3.4.14.5,ref-t.2.3.4.14.17,89367,89430,13360,13369,ref-sifre-n.65.1.113,ref-sifre-n.65.1.124,מועדו ונאמ' בפסח מועדו מה תמיד שנאמ' בו מועדו דוחה את השבת אף ,במועדו ונאמר להלן במועדו מה מועדו האמור כאן דוחה את השבת אף ,10,9,94.0,323.0,0.3548387096774194,0.6428571428571428,2070000231
231,326,ref-t.2.3.8.7.13-ref-t.2.3.8.7.22,ref-sifre-n.65.1.169-ref-sifre-n.65.1.186,363490,363549,56711,56718,ref-t.2.3.8.7.13,ref-t.2.3.8.7.22,89646,89735,13396,13408,ref-sifre-n.65.1.169,ref-sifre-n.65.1.186,הראשון דוחה את הטומאה ואין השני דוחה את,שאינה דוחה את השבת דוחה טומאה פסח ראשון שדוחה את השבת אינו דין,8,13,110.0,326.0,0.5967741935483871,0.5,2070000232
