baseOrig,compOrig,baseCharStart,baseCharEnd,baseRefStart,baseRefEnd,compCharStart,compCharEnd,compRefStart,compRefEnd,baseStr,compStr,bRange,cRange,compOrder,grp-ref-sifre-n,baseOrder,grp-ref-mek,dam-lev,jac,lcs_len_char,lcs_str_char,lcc_distance,id
ref-mek.5.3.2.18-ref-mek.5.3.2.29,ref-sifre-n.29.1.150-ref-sifre-n.29.1.165,220672,220729,ref-mek.5.3.2.18,ref-mek.5.3.2.29,48822,48907,ref-sifre-n.29.1.150,ref-sifre-n.29.1.165,נאמר כאן שלוח ונאמר להלן שילוח מה שלוח האמור להלן גט אף ,נאמר כאן שמיני ונאמר להלן שמיני מה שמיני האמור להלן הכשיר_בו_שמיני_ומשמיני_והלאה אף ,12,12,147,144.0,427,413.0,0.47619047619047616,0.4444444444444444,45,נאמר כאן ש ונאמר להלן שי מה ש האמור להלן  אף ,0.4642857142857143,3050000321
ref-mek.5.3.2.18-ref-mek.5.3.2.27,ref-sifre-n.30.1.833-ref-sifre-n.30.1.842,220672,220723,ref-mek.5.3.2.18,ref-mek.5.3.2.27,53469,53519,ref-sifre-n.30.1.833,ref-sifre-n.30.1.842,נאמר כאן שלוח ונאמר להלן שילוח מה שלוח האמור להלן ,נאמר כאן נזיר ונאמר להלן נזיר מה נזיר האמור להלן ,10,10,166,159.0,421,413.0,0.26,0.33333333333333337,38,נאמר כאן  ונאמר להלן י מה  האמור להלן ,0.24,3050000322
ref-mek.5.3.2.18-ref-mek.5.3.2.27,ref-sifre-n.31.3.323-ref-sifre-n.31.3.332,220672,220723,ref-mek.5.3.2.18,ref-mek.5.3.2.27,57211,57261,ref-sifre-n.31.3.323,ref-sifre-n.31.3.332,נאמר כאן שלוח ונאמר להלן שילוח מה שלוח האמור להלן ,נאמר כאן נזיר ונאמר להלן נזיר מה נזיר האמור להלן ,10,10,177,170.0,422,413.0,0.26,0.33333333333333337,38,נאמר כאן  ונאמר להלן י מה  האמור להלן ,0.24,3050000323
ref-mek.5.3.2.18-ref-mek.5.3.2.29,ref-sifre-n.39.1.88-ref-sifre-n.39.1.99,220672,220729,ref-mek.5.3.2.18,ref-mek.5.3.2.29,62788,62850,ref-sifre-n.39.1.88,ref-sifre-n.39.1.99,נאמר כאן שלוח ונאמר להלן שילוח מה שלוח האמור להלן גט אף ,נאמר כאן ברכה ונאמר להלן ברכה מה ברכה האמורה להלן בעמידה אף ,12,12,192,192.0,428,413.0,0.3333333333333333,0.4444444444444444,41,נאמר כאן  ונאמר להלן  מה  האמור להלן  אף ,0.31666666666666665,3050000324
ref-mek.5.3.2.16-ref-mek.5.3.2.26,ref-sifre-n.65.1.108-ref-sifre-n.65.1.119,220661,220718,ref-mek.5.3.2.16,ref-mek.5.3.2.26,89343,89410,ref-sifre-n.65.1.108,ref-sifre-n.65.1.119,הימנו בגט נאמר כאן שלוח ונאמר להלן שילוח מה שלוח האמור ,הימנו גזרה שוה נאמר כאן במועדו ונאמר להלן במועדו מה מועדו האמור ,11,12,298,283.0,413,413.0,0.375,0.5454545454545454,43,הימנו ג נאמר כאן ו ונאמר להלן ו מה ו האמור ,0.328125,3050000325
ref-mek.5.3.2.18-ref-mek.5.3.2.27,ref-sifre-n.73.2.58-ref-sifre-n.73.2.67,220672,220723,ref-mek.5.3.2.18,ref-mek.5.3.2.27,98021,98075,ref-sifre-n.73.2.58,ref-sifre-n.73.2.67,נאמר כאן שלוח ונאמר להלן שילוח מה שלוח האמור להלן ,נאמר כאן תרועה ונאמר להלן תרועה מה תרועה האמורה להלן ,10,10,327,327.0,423,413.0,0.2641509433962264,0.33333333333333337,40,נאמר כאן ו ונאמר להלן ו מה ו האמור להלן ,0.24528301886792447,3050000326
ref-mek.5.3.2.16-ref-mek.5.3.2.27,ref-sifre-n.73.2.135-ref-sifre-n.73.2.145,220661,220723,ref-mek.5.3.2.16,ref-mek.5.3.2.27,98427,98486,ref-sifre-n.73.2.135,ref-sifre-n.73.2.145,הימנו בגט נאמר כאן שלוח ונאמר להלן שילוח מה שלוח האמור להלן ,מנין נאמר כאן תרועה ונאמר להלן תרועה מה תרועה האמורה להלן ,12,11,332,332.0,414,413.0,0.35,0.5555555555555556,43,מנ נאמר כאן ו ונאמר להלן ו מה ו האמור להלן ,0.2833333333333333,3050000327
ref-mek.5.3.2.16-ref-mek.5.3.2.27,ref-sifre-n.75.1.38-ref-sifre-n.75.1.48,220661,220723,ref-mek.5.3.2.16,ref-mek.5.3.2.27,99683,99742,ref-sifre-n.75.1.38,ref-sifre-n.75.1.48,הימנו בגט נאמר כאן שלוח ונאמר להלן שילוח מה שלוח האמור להלן ,מומין נאמר כאן כהנים ונאמר להלן כהנים מה כהנים האמור להלן ,12,11,339,338.0,415,413.0,0.36666666666666664,0.375,41,מו נאמר כאן  ונאמר להלן י מה  האמור להלן ,0.31666666666666665,3050000328
ref-mek.5.3.2.18-ref-mek.5.3.2.29,ref-sifre-n.110.1.111-ref-sifre-n.110.1.126,220672,220729,ref-mek.5.3.2.18,ref-mek.5.3.2.29,156758,156836,ref-sifre-n.110.1.111,ref-sifre-n.110.1.126,כאן לחם עוני ונאמר להלן לחם מה לחם האמור להלן חמשת המינים אף לחם האמור כאן,כאן לחם עוני ונאמר להלן לחם מה לחם האמור להלן חמשת המינים אף לחם האמור כאן,16,16,487,487.0,429,429.0,0.0,0.0,74,כאן לחם עוני ונאמר להלן לחם מה לחם האמור להלן חמשת המינים אף לחם האמור כאן,0.0,3050000329
ref-mek.5.3.2.18-ref-mek.5.3.2.29,ref-sifre-n.113.1.59-ref-sifre-n.113.1.70,220672,220729,ref-mek.5.3.2.18,ref-mek.5.3.2.29,167764,167823,ref-sifre-n.113.1.59,ref-sifre-n.113.1.70,נאמר כאן שלוח ונאמר להלן שילוח מה שלוח האמור להלן גט אף ,נאמר כאן מדבר ונאמר להלן מדבר מה מדבר האמור להלן צלפחד אף ,12,12,538,538.0,431,413.0,0.3103448275862069,0.4444444444444444,41,נאמר כאן  ונאמר להלן  מה  האמור להלן  אף ,0.2931034482758621,3050000330
ref-mek.5.3.2.18-ref-mek.5.3.2.30,ref-sifre-n.116.1.236-ref-sifre-n.116.1.251,220672,220733,ref-mek.5.3.2.18,ref-mek.5.3.2.30,178868,178948,ref-sifre-n.116.1.236,ref-sifre-n.116.1.251,ונאמר להלן אתך מה אתך האמור להלן כאן בלוים הכתוב_מדבר_אף אתך האמור כאן להלן,ונאמר להלן אתך מה אתך האמור להלן כאן בלוים הכתוב_מדבר_אף אתך האמור כאן להלן,14,14,567,567.0,435,435.0,0.0,0.0,75,ונאמר להלן אתך מה אתך האמור להלן כאן בלוים הכתוב_מדבר_אף אתך האמור כאן להלן,0.0,3050000331
ref-mek.5.3.2.21-ref-mek.5.3.2.29,ref-sifre-n.116.2.276-ref-sifre-n.116.2.284,220686,220729,ref-mek.5.3.2.21,ref-mek.5.3.2.29,183020,183065,ref-sifre-n.116.2.276,ref-sifre-n.116.2.284,ונאמר להלן שילוח מה שלוח האמור להלן גט אף ,ונאמר להלן יומת מה יומת האמור להלן סקילה אף ,9,9,591,591.0,441,441.0,0.29545454545454547,0.5,34,ונאמר להלן יו מה ו האמור להלן  אף ,0.2272727272727273,3050000332
ref-mek.5.3.2.21-ref-mek.5.3.2.29,ref-sifre-n.116.2.297-ref-sifre-n.116.2.305,220686,220729,ref-mek.5.3.2.21,ref-mek.5.3.2.29,183124,183169,ref-sifre-n.116.2.297,ref-sifre-n.116.2.305,ונאמר להלן שילוח מה שלוח האמור להלן גט אף ,ונאמר להלן יומת מה יומת האמור להלן בחנק אף ,9,9,605,605.0,442,441.0,0.27906976744186046,0.5,34,ונאמר להלן יו מה ו האמור להלן  אף ,0.2093023255813954,3050000333
ref-mek.5.3.2.16-ref-mek.5.3.2.30,ref-sifre-n.121.1.382-ref-sifre-n.121.1.396,220661,220733,ref-mek.5.3.2.16,ref-mek.5.3.2.30,203549,203619,ref-sifre-n.121.1.382,ref-sifre-n.121.1.396,הימנו בגט נאמר כאן שלוח ונאמר להלן שילוח מה שלוח האמור להלן גט אף כאן ,מנין נאמר כאן מלאה ונאמר להלן דברים כב מלאה מה להלן שהיא עולה אף כאן ,15,15,693,692.0,417,413.0,0.4714285714285714,0.6428571428571428,46,מנ נאמר כאן ל ונאמר להלן יל מה ל הא לה אף כאן ,0.34285714285714286,3050000334
ref-mek.5.3.2.18-ref-mek.5.3.2.29,ref-sifre-n.124.1.255-ref-sifre-n.124.1.268,220672,220729,ref-mek.5.3.2.18,ref-mek.5.3.2.29,212021,212093,ref-sifre-n.124.1.255,ref-sifre-n.124.1.268,נאמר כאן שלוח ונאמר להלן שילוח מה שלוח האמור להלן גט אף ,נאמרה כאן לקיחה ונאמרה להלן שמות יב לקיחה מה לקיחה האמורה להלן שלשה אף ,12,14,715,715.0,432,413.0,0.3380281690140845,0.5454545454545454,49,נאמר כאן לח ונאמר להלן שילח מה לח האמור להלן  אף ,0.3098591549295775,3050000335
ref-mek.5.3.2.18-ref-mek.5.3.2.30,ref-sifre-n.127.5.22-ref-sifre-n.127.5.38,220672,220733,ref-mek.5.3.2.18,ref-mek.5.3.2.30,223948,224024,ref-sifre-n.127.5.22,ref-sifre-n.127.5.38,נאמר כאן שלוח ונאמר להלן שילוח מה שלוח האמור להלן גט אף כאן ,נאמר כאן עפר ונאמר להלן במדבר ה עפר מה עפר האמור להלן על פני המים אף כאן ,13,17,731,729.0,437,413.0,0.410958904109589,0.5833333333333333,45,נאמר כאן  ונאמר להלן  מה  האמור להלן  אף כאן ,0.3835616438356164,3050000336
ref-mek.5.3.2.18-ref-mek.5.3.2.29,ref-sifre-n.128.2.2-ref-sifre-n.128.2.15,220672,220729,ref-mek.5.3.2.18,ref-mek.5.3.2.29,224593,224663,ref-sifre-n.128.2.2,ref-sifre-n.128.2.15,נאמר כאן שלוח ונאמר להלן שילוח מה שלוח האמור להלן גט אף ,נאמרה כאן לקיחה ונאמרה להלן שמות יב לקיחה מה לקיחה האמורה להלן ג' אף ,12,14,733,733.0,433,413.0,0.30434782608695654,0.5454545454545454,50,נאמר כאן לח ונאמר להלן שילח מה לח האמור להלן ג אף ,0.2753623188405797,3050000337
ref-mek.5.3.2.18-ref-mek.5.3.2.27,ref-sifre-n.142.2.71-ref-sifre-n.142.2.82,220672,220723,ref-mek.5.3.2.18,ref-mek.5.3.2.27,253140,253203,ref-sifre-n.142.2.71,ref-sifre-n.142.2.82,נאמר כאן שלוח ונאמר להלן שילוח מה שלוח האמור להלן ,נאמרה כאן שמירה ונאמר להלן שמות יב שמירה מה שמירה האמורה להלן ,10,12,777,775.0,424,413.0,0.3387096774193548,0.5,41,נאמר כאן ש ונאמר להלן שו מה ש האמור להלן ,0.33870967741935487,3050000338
ref-mek.5.3.2.16-ref-mek.5.3.2.29,ref-sifre-n.142.2.209-ref-sifre-n.142.2.225,220661,220729,ref-mek.5.3.2.16,ref-mek.5.3.2.29,253835,253923,ref-sifre-n.142.2.209,ref-sifre-n.142.2.225,הימנו בגט נאמר כאן שלוח ונאמר להלן שילוח מה שלוח האמור להלן גט אף ,הימנו גזירה שוה נאמר כאן במועדו ונא' להלן במועדו מה מועדו האמור להלן דוחה_את_השבת אף ,14,15,796,789.0,416,413.0,0.4588235294117647,0.6428571428571428,50,הימנו ג נאמר כאן ו ונא להלן ו מה ו האמור להלן  אף ,0.4117647058823529,3050000339
ref-mek.5.3.2.19-ref-mek.5.3.2.27,ref-sifre-n.153.3.18-ref-sifre-n.153.3.26,220677,220723,ref-mek.5.3.2.19,ref-mek.5.3.2.27,264584,264626,ref-sifre-n.153.3.18,ref-sifre-n.153.3.26,כאן שלוח ונאמר להלן שילוח מה שלוח האמור להלן ,כאן נדר ונאמר להלן נדר מה נדר האמור להלן ,9,9,833,833.0,438,413.0,0.28888888888888886,0.33333333333333337,32,כאן  ונאמר להלן  מה  האמור להלן ,0.28888888888888886,3050000340
ref-mek.5.3.2.18-ref-mek.5.3.2.27,ref-sifre-n.157.8.90-ref-sifre-n.157.8.99,220672,220723,ref-mek.5.3.2.18,ref-mek.5.3.2.27,281101,281148,ref-sifre-n.157.8.90,ref-sifre-n.157.8.99,נאמר כאן שלוח ונאמר להלן שילוח מה שלוח האמור להלן ,נאמר כאן בגד ונאמר להלן בגד מה בגד האמור להלן ,10,10,872,864.0,425,413.0,0.26,0.33333333333333337,37,נאמר כאן  ונאמר להלן  מה  האמור להלן ,0.26,3050000341
ref-mek.5.3.3.74-ref-mek.5.3.3.82,ref-sifre-n.12.1.37-ref-sifre-n.12.1.43,221679,221723,ref-mek.5.3.3.74,ref-mek.5.3.3.82,23443,23483,ref-sifre-n.12.1.37,ref-sifre-n.12.1.43,השבע וישבע לו שנאמר ויואל משה אין אלה אלא ,משביעה ואינה נשבעת מאליה ואמר אל האשה ,9,7,46,46.0,443,443.0,0.6190476190476191,0.4285714285714286,23,שבע וישבע ל אמר אל האה ,0.45238095238095233,3050000342
ref-mek.5.3.6.42-ref-mek.5.3.6.57,ref-sifre-n.12.1.77-ref-sifre-n.12.1.108,223912,223994,ref-mek.5.3.6.42,ref-mek.5.3.6.57,23652,23809,ref-sifre-n.12.1.77,ref-sifre-n.12.1.108,נאמר ויאמר אל משה וגו' ר'_אליעזר_אומר נאמר למשה אני הוא שאמרתי והיה העולם אני ,ואמר אל האשה בכל לשון שהיא שומעת דברי_ר'_יאשיה_ר'_ישמעאל_אומר_אינו_צריך_שהרי_כבר_נאמר ואמרה האשה אמן אמן ואם אינה שומעת כיצד היא אומרת אמן אמן או אינה ,14,22,47,47.0,444,444.0,0.6754966887417219,0.7647058823529411,52,ואמר אל שה וו ר'_איר_אומרנאמר משה א וא אמתי הי ו אי ,0.6556291390728477,3050000343
ref-mek.5.3.6.57-ref-mek.5.3.6.72,ref-sifre-n.131.2.427-ref-sifre-n.131.2.434,223991,224077,ref-mek.5.3.6.57,ref-mek.5.3.6.72,231929,231970,ref-sifre-n.131.2.427,ref-sifre-n.131.2.434,אני המקרב ולא המרחק שנאמר האלהי מקרוב באו אני נאם ה' ולא אלי מרחוק אני שקרבתי ,שאנו מקריבים לו או איל אחד שאנו מקריבים ,16,8,739,739.0,446,444.0,0.6923076923076923,0.9230769230769231,29,אנו מקרי ו או איל אח אנ קרבי ,0.6282051282051282,3050000344
ref-mek.5.3.6.50-ref-mek.5.3.6.72,ref-sifre-n.149.1.7-ref-sifre-n.149.1.19,223951,224077,ref-mek.5.3.6.50,ref-mek.5.3.6.72,261346,261409,ref-sifre-n.149.1.7,ref-sifre-n.149.1.19,נאמר למשה אני הוא שאמרתי והיה העולם אני המקרב ולא המרחק שנאמר האלהי מקרוב באו אני נאם ה' ולא אלי מרחוק אני שקרבתי ,אלו אתה מקריב חוץ מן האמור בתורת כהנים אתה אומר אלו אתה מקריב ,23,13,826,826.0,445,444.0,0.6754385964912281,0.7777777777777778,43,אלו אתה מקרב ח מ האמו בו נים ה א אלו א קרי ,0.6228070175438596,3050000345
ref-mek.5.4.11.97-ref-mek.5.4.11.106,ref-sifre-n.52.1.104-ref-sifre-n.52.1.116,231310,231361,ref-mek.5.4.11.97,ref-mek.5.4.11.106,80810,80886,ref-sifre-n.52.1.104,ref-sifre-n.52.1.116,ואומר וילך וישב את העם ואין עם אלא חכמה שנאמר ,"שנאמר לישוב משפחת הישובי ואין ישוב אלא ב""ד שנאמר ויבואו אליך כמבוא עם ",10,13,262,262.0,447,447.0,0.6571428571428571,0.5384615384615384,30,אמר לישב ת ה ואין  אלא  שנאמר ,0.5714285714285714,3050000346
ref-mek.5.4.11.168-ref-mek.5.4.11.177,ref-sifre-n.78.1.277-ref-sifre-n.78.1.286,231678,231742,ref-mek.5.4.11.168,ref-mek.5.4.11.177,103570,103627,ref-sifre-n.78.1.277,ref-sifre-n.78.1.286,תרעתים שהיו מתריעים ונענים שמעתים ששמעו קול תרועת תורה בסיני ,ששמעו תרועה מהר סיני תרעתים על שם שהיו מתריעים ומתענים ,10,10,347,347.0,448,448.0,0.6885245901639344,0.6666666666666667,29,תרע הי תרעים ע שם שו תרע וני ,0.5245901639344263,3050000347
ref-mek.5.4.11.213-ref-mek.5.4.11.229,ref-sifre-n.119.5.1-ref-sifre-n.119.5.8,231945,232035,ref-mek.5.4.11.213,ref-mek.5.4.11.229,198239,198288,ref-sifre-n.119.5.1,ref-sifre-n.119.5.8,גדולה ברית שנכרתה לו לאהרן מברית שנכרתה לדוד,גדולה ברית שנכרתה לו לאהרן מברית שנכרתה לדוד,8,8,680,680.0,449,449.0,0.0,0.0,44,גדולה ברית שנכרתה לו לאהרן מברית שנכרתה לדוד,0.0,3050000348
ref-mek.5.4.11.218-ref-mek.5.4.11.225,ref-sifre-n.119.5.45-ref-sifre-n.119.5.55,231974,232019,ref-mek.5.4.11.218,ref-mek.5.4.11.225,198473,198535,ref-sifre-n.119.5.45,ref-sifre-n.119.5.55,בן רכב מהברית שנכרתה עם דוד שהברית שנכרתה ,ולבני לוי מגיד_הכתוב_שכשם שהברית כרותה לכהונה כך ברית כרותה ,8,9,683,683.0,451,449.0,0.6166666666666667,0.9166666666666666,28,ב כב הברית כרתה והברית כרתה ,0.5333333333333333,3050000349
ref-mek.5.4.11.349-ref-mek.5.4.11.354,ref-sifre-n.119.5.22-ref-sifre-n.119.5.27,232630,232657,ref-mek.5.4.11.349,ref-mek.5.4.11.354,198365,198392,ref-sifre-n.119.5.22,ref-sifre-n.119.5.27,אם ישמרו בניך את בריתי וגו' ,אם ישמרו בניך את בריתי וגו' ,6,6,682,682.0,452,452.0,0.0,0.0,28,אם ישמרו בניך את בריתי וגו' ,0.0,3050000350
ref-mek.5.4.11.385-ref-mek.5.4.11.392,ref-sifre-n.131.5.1-ref-sifre-n.131.5.7,232814,232857,ref-mek.5.4.11.385,ref-mek.5.4.11.392,234507,234546,ref-sifre-n.131.5.1,ref-sifre-n.131.5.7,היא והיתה לו ולזרעו אחריו ברית כהונת עולם ,והיתה לו ולזרעו אחריו ברית כהונת עולם ,8,7,741,741.0,453,453.0,0.09523809523809523,0.0,38,והיתה לו ולזרעו אחריו ברית כהונת עולם ,0.09523809523809523,3050000351
ref-mek.5.4.11.393-ref-mek.5.4.11.404,ref-sifre-n.78.1.452-ref-sifre-n.78.1.465,232858,232918,ref-mek.5.4.11.393,ref-mek.5.4.11.404,104255,104319,ref-sifre-n.78.1.452,ref-sifre-n.78.1.465,ומנין שבניו של יונדב בן רכב הן הן מבני בניו של יתרו הם שנאמר,ומנין שבניו של יונדב בן רכב הן הן מבני בניו של יתרו הם שנאמר,14,14,349,348.0,454,454.0,0.0,0.0,60,ומנין שבניו של יונדב בן רכב הן הן מבני בניו של יתרו הם שנאמר,0.0,3050000352
ref-mek.6.1.1.47-ref-mek.6.1.1.57,ref-sifre-n.81.1.45-ref-sifre-n.81.1.63,234620,234683,ref-mek.6.1.1.47,ref-mek.6.1.1.57,109805,109914,ref-sifre-n.81.1.45,ref-sifre-n.81.1.63,והיו אוכלים אותו ארבע מאות שנה וארבעים שנה שנאמר ויהי כשמונים שנה וארבע מאות שנה לצאת_בני_ישראל ממצרים,והיו אוכלים אותו ארבע מאות שנה וארבעים שנה שנאמר ויהי כשמונים שנה וארבע מאות שנה לצאת_בני_ישראל ממצרים,17,17,364,364.0,456,456.0,0.0,0.0,102,והיו אוכלים אותו ארבע מאות שנה וארבעים שנה שנאמר ויהי כשמונים שנה וארבע מאות שנה לצאת_בני_ישראל ממצרים,0.0,3050000353
ref-mek.6.1.1.62-ref-mek.6.1.1.108,ref-sifre-n.64.2.19-ref-sifre-n.64.2.57,234699,234965,ref-mek.6.1.1.62,ref-mek.6.1.1.108,88537,88768,ref-sifre-n.64.2.19,ref-sifre-n.64.2.57,הארץ נבנה הבית התחילו מונים לבנינו שנאמר ויהי מקץ עשרים שנה אשר בנה שלמה חרב הבית התחילו מונים לחרבנו שנאמר אחרי אשר הוכתה העיר תקף עליהם עול השעבוד התחילו מונים לשעבודם שנאמר ובשנת שתים לדריוש ובשנת שתים למלכות,אל הארץ נבנה הבית התחילו מונים לבנינו שנאמר ויהי מקץ עשרים שנה אשר בנה שלמה חרב הבית התחילו מונים לחרבנו שנאמר אחרי אשר הוכתה העיר תקף עליהם עול השעבוד התחילו מונים לשעבודם שנאמר ובשנת שתים לדריוש ובשנת שתים למלכות,38,39,281,281.0,459,459.0,0.014018691588785047,0.0357142857142857,211,הארץ נבנה הבית התחילו מונים לבנינו שנאמר ויהי מקץ עשרים שנה אשר בנה שלמה חרב הבית התחילו מונים לחרבנו שנאמר אחרי אשר הוכתה העיר תקף עליהם עול השעבוד התחילו מונים לשעבודם שנאמר ובשנת שתים לדריוש ובשנת שתים למלכות,0.014018691588784993,3050000354
ref-mek.6.1.1.62-ref-mek.6.1.1.77,ref-sifre-n.78.1.922-ref-sifre-n.78.1.932,234699,234781,ref-mek.6.1.1.62,ref-mek.6.1.1.77,106702,106750,ref-sifre-n.78.1.922,ref-sifre-n.78.1.932,מקצה עשרים שנה אשר בנה שלמה את הבתים את בית ה',מקצה עשרים שנה אשר בנה שלמה את הבתים את בית ה',11,11,352,352.0,458,458.0,0.0,0.0,46,מקצה עשרים שנה אשר בנה שלמה את הבתים את בית ה',0.0,3050000355
ref-mek.6.1.1.189-ref-mek.6.1.1.196,ref-sifre-n.139.2.162-ref-sifre-n.139.2.170,235350,235383,ref-mek.6.1.1.189,ref-mek.6.1.1.196,250605,250646,ref-sifre-n.139.2.162,ref-sifre-n.139.2.170,מה הוא אם לא תדעי לך היפה בנשים ,"מה הקב""ה השיבו אם לא תדעי לך היפה בנשים ",8,9,773,773.0,462,462.0,0.25,0.2857142857142857,31,מה הו אם לא תדעי לך היפה בנשים ,0.22499999999999998,3050000356
ref-mek.6.1.2.336-ref-mek.6.1.2.347,ref-sifre-n.42.2.294-ref-sifre-n.42.2.303,237750,237806,ref-mek.6.1.2.336,ref-mek.6.1.2.347,67967,68012,ref-sifre-n.42.2.294,ref-sifre-n.42.2.303,שנאמר ה' עוז לעמו יתן ה' יברך את עמו בשלום,שנאמר ה' עוז לעמו יתן ה' יברך את עמו בשלום,10,10,224,224.0,464,464.0,0.0,0.0,42,שנאמר ה' עוז לעמו יתן ה' יברך את עמו בשלום,0.0,3050000357
ref-mek.6.1.2.336-ref-mek.6.1.2.347,ref-sifre-n.42.2.350-ref-sifre-n.42.2.359,237750,237806,ref-mek.6.1.2.336,ref-mek.6.1.2.347,68241,68286,ref-sifre-n.42.2.350,ref-sifre-n.42.2.359,שנאמר ה' עוז לעמו יתן ה' יברך את עמו בשלום,שנאמר ה' עוז לעמו יתן ה' יברך את עמו בשלום,10,10,232,232.0,465,465.0,0.0,0.0,42,שנאמר ה' עוז לעמו יתן ה' יברך את עמו בשלום,0.0,3050000358
ref-mek.6.1.2.336-ref-mek.6.1.2.346,ref-sifre-n.42.2.424-ref-sifre-n.42.2.428,237750,237799,ref-mek.6.1.2.336,ref-mek.6.1.2.346,68637,68660,ref-sifre-n.42.2.424,ref-sifre-n.42.2.428,שנאמר ה' עוז לעמו יתן,שנאמר ה' עוז לעמו יתן,5,5,239,239.0,463,463.0,0.0,0.0,21,שנאמר ה' עוז לעמו יתן,0.0,3050000359
ref-mek.6.2.3.13-ref-mek.6.2.3.29,ref-sifre-n.68.1.245-ref-sifre-n.68.1.253,240162,240244,ref-mek.6.2.3.13,ref-mek.6.2.3.29,92275,92324,ref-sifre-n.68.1.245,ref-sifre-n.68.1.253,שמעתי עמדו ואשמעה כאדם האומר אשמע דבר מפי רבי,שמעתי עמדו ואשמעה כאדם האומר אשמע דבר מפי רבי,9,9,304,304.0,469,469.0,0.0,0.0,45,שמעתי עמדו ואשמעה כאדם האומר אשמע דבר מפי רבי,0.0,3050000360
ref-mek.6.2.6.27-ref-mek.6.2.6.33,ref-sifre-n.86.1.2-ref-sifre-n.86.1.18,241982,242010,ref-mek.6.2.6.27,ref-mek.6.2.6.33,118996,119072,ref-sifre-n.86.1.2,ref-sifre-n.86.1.18,העם אל משה וכי מה היה משה מועילם והלא אין ראוי לומר אלא ויצעק העם אל ה',העם אל משה וכי מה היה משה מועילם והלא אין ראוי לומר אלא ויצעק העם אל ה',17,17,401,401.0,471,471.0,0.0,0.0,71,העם אל משה וכי מה היה משה מועילם והלא אין ראוי לומר אלא ויצעק העם אל ה',0.0,3050000361
ref-mek.6.2.7.103-ref-mek.6.2.7.110,ref-sifre-n.86.1.2-ref-sifre-n.86.1.18,242708,242743,ref-mek.6.2.7.103,ref-mek.6.2.7.110,118996,119072,ref-sifre-n.86.1.2,ref-sifre-n.86.1.18,העם אל משה וכי מה היה משה מועילם והלא אין ראוי לומר אלא ויצעק העם אל ה',העם אל משה וכי מה היה משה מועילם והלא אין ראוי לומר אלא ויצעק העם אל ה',17,17,402,402.0,473,473.0,0.0,0.0,71,העם אל משה וכי מה היה משה מועילם והלא אין ראוי לומר אלא ויצעק העם אל ה',0.0,3050000362
ref-mek.6.3.1.218-ref-mek.6.3.2.3,ref-sifre-n.158.2.35-ref-sifre-n.158.3.3,244565,244733,ref-mek.6.3.1.218,ref-mek.6.3.2.3,282648,282793,ref-sifre-n.158.2.35,ref-sifre-n.158.3.3,"שאין טעון טבילה טעון הזייה מי שטעון הזייה אינו דין שיטעון טבילה והרי_דברים_ק""ו מי שאין טעון הזייה דין הוא שיטעון טבילה וכבסתם בגדיכם ביום","שאין טעון טבילה טעון הזייה מי שטעון הזייה אינו דין שיטעון טבילה והרי_דברים_ק""ו מי שאין טעון הזייה דין הוא שיטעון טבילה וכבסתם בגדיכם ביום",24,24,878,878.0,475,475.0,0.0,0.0,137,"שאין טעון טבילה טעון הזייה מי שטעון הזייה אינו דין שיטעון טבילה והרי_דברים_ק""ו מי שאין טעון הזייה דין הוא שיטעון טבילה וכבסתם בגדיכם ביום",0.0,3050000363
ref-mek.6.3.2.23-ref-mek.6.3.2.31,ref-sifre-n.93.1.2-ref-sifre-n.93.1.9,244825,244874,ref-mek.6.3.2.23,ref-mek.6.3.2.31,130383,130429,ref-sifre-n.93.1.2,ref-sifre-n.93.1.9,זה אחד מעשר ירידות שכתובות בתורה לעיני כל העם ,זו אחת מעשר ירידות שכתובות בתורה וירדתי עמך ,9,8,422,422.0,477,477.0,0.2608695652173913,0.5454545454545454,36,ז אח מעשר ירידות שכתובות בתורה יי ע ,0.21739130434782605,3050000364
