,baseOrig,compOrig,baseCharStart,baseCharEnd,baseWdStart,baseWdEnd,baseRefStart,baseRefEnd,compCharStart,compCharEnd,compWdStart,compWdEnd,compRefStart,compRefEnd,baseStr,compStr,compWork
2854,ref-sifre-d.43.30.21-ref-sifre-d.43.30.26,ref-bible.0208.36.30.17-ref-bible.0208.36.30.22,84291,84331,14185,14190,ref-sifre-d.00043.00030.00021,ref-sifre-d.00043.00030.00026,943707,943743,159894,159899,ref-bible.00208.00036.00030.00017,ref-bible.00208.00036.00030.00022,שהיתה מושלכת לחורב ביום ולקרח בלילה ,תהיה משלכת לחרב ביום ולקרח בלילה ,ref-bible
2855,ref-sifre-d.43.32.64-ref-sifre-d.43.32.78,ref-bible.0207.8.23.1-ref-bible.0207.8.23.15,84913,84993,14284,14297,ref-sifre-d.00043.00032.00064,ref-sifre-d.00043.00032.00078,789766,789846,133218,133231,ref-bible.00207.00008.00023.00001,ref-bible.00207.00008.00023.00015,כי לא מועף לאשר מוצק לה כעת הראשון היקל ארצה זבולן וארצה נפתלי והאחרון הכביד ,כי לא מועף לאשר מוצק לה כעת הראשון הקל ארצה זבלון וארצה נפתלי והאחרון הכביד ,ref-bible
2856,ref-sifre-d.43.34.78-ref-sifre-d.43.34.105,ref-bible.0208.31.21.7-ref-bible.0208.31.21.19,85529,85677,14385,14409,ref-sifre-d.00043.00034.00078,ref-sifre-d.00043.00034.00105,928919,928981,157594,157606,ref-bible.00208.00031.00021.00007,ref-bible.00208.00031.00021.00019,"שיתי לבך למסלה דרך הלכת אמר_להם_הקב""ה_לישראל בני ראו באלו דרכים הלכתם ועשו תשובה מיד אתם חוזרים לעריכם שנאמר שובי בתולת ישראל שובי אל עריך אלה ",שתי לבך למסלה דרך הלכתי הלכת שובי בתולת ישראל שבי אל עריך אלה ,ref-bible
2857,ref-sifre-d.43.35.26-ref-sifre-d.43.35.31,ref-bible.0302.4.2.2-ref-bible.0302.4.2.7,85800,85825,14430,14435,ref-sifre-d.00043.00035.00026,ref-sifre-d.00043.00035.00031,1260695,1260720,214766,214771,ref-bible.00302.00004.00002.00002,ref-bible.00302.00004.00002.00007,לקח טוב נתתי לכם תורתי אל ,לקח טוב נתתי לכם תורתי אל ,ref-bible
2858,ref-sifre-d.43.35.28-ref-sifre-d.44.1.15,ref-bible.0105.11.17.23-ref-bible.0105.11.18.13,85808,85906,14432,14450,ref-sifre-d.00043.00035.00028,ref-sifre-d.00044.00001.00015,364028,364100,60875,60888,ref-bible.00105.00011.00017.00023,ref-bible.00105.00011.00018.00013,נתתי לכם תורתי אל תעזובו ושמתם את דברי אלה על לבבכם ועל נפשכם זו תורה וקשרתם אותם לאות על ידכם ,נתן לכם ושמתם את דברי אלה על לבבכם ועל נפשכם וקשרתם אתם לאות על ידכם ,ref-bible
2859,ref-sifre-d.45.1.1-ref-sifre-d.45.1.8,ref-bible.0105.11.18.1-ref-bible.0105.11.18.8,86220,86258,14500,14506,ref-sifre-d.00045.00001.00001,ref-sifre-d.00045.00001.00008,364036,364074,60877,60883,ref-bible.00105.00011.00018.00001,ref-bible.00105.00011.00018.00008,ושמתם את דברי אלה על לבבכם ועל נפשכם ,ושמתם את דברי אלה על לבבכם ועל נפשכם ,ref-bible
2860,ref-sifre-d.45.1.93-ref-sifre-d.45.1.112,ref-bible.0101.4.7.5-ref-bible.0101.4.8.3,86677,86779,14580,14596,ref-sifre-d.00045.00001.00093,ref-sifre-d.00045.00001.00112,6160,6230,1079,1091,ref-bible.00101.00004.00007.00005,ref-bible.00101.00004.00008.00003,ואם לא תטיב לפתח חטאת רובץ ולא_עוד_אלא שמשאו ומתנו בך שנאמר ואליך תשוקתו ואם אתה רוצה אתה מושל ,ואם לא תיטיב לפתח חטאת רבץ ואליך תשוקתו ואתה תמשל בו ויאמר קין אל ,ref-bible
2861,ref-sifre-d.45.1.119-ref-sifre-d.45.1.137,ref-bible.0302.25.21.1-ref-bible.0302.25.22.6,86810,86901,14603,14620,ref-sifre-d.00045.00001.00119,ref-sifre-d.00045.00001.00137,1285302,1285369,219569,219583,ref-bible.00302.00025.00021.00001,ref-bible.00302.00025.00022.00006,אם רעב שונאך האכילהו לחם האכילהו לחמה של תורה ואם צמא השקהו מים כי גחלים אתה חותה על ראשו ,אם רעב שנאך האכלהו לחם ואם צמא השקהו מים כי גחלים אתה חתה על ראשו ,ref-bible
2862,ref-sifre-d.46.1.1-ref-sifre-d.46.1.9,ref-bible.0105.11.19.1-ref-bible.0105.11.19.8,86971,87019,14635,14642,ref-sifre-d.00046.00001.00001,ref-sifre-d.00046.00001.00009,364126,364168,60893,60899,ref-bible.00105.00011.00019.00001,ref-bible.00105.00011.00019.00008,ולמדתם אותם את בניכם לדבר בם בניכם ולא בנותיכם ,ולמדתם אתם את בניכם לדבר בם בשבתך בביתך ,ref-bible
2863,ref-sifre-d.46.1.41-ref-sifre-d.46.1.46,ref-bible.0105.11.19.1-ref-bible.0105.11.19.6,87184,87213,14671,14675,ref-sifre-d.00046.00001.00041,ref-sifre-d.00046.00001.00046,364126,364154,60893,60897,ref-bible.00105.00011.00019.00001,ref-bible.00105.00011.00019.00006,ולמדתם אותם את בניכם לדבר בם ,ולמדתם אתם את בניכם לדבר בם ,ref-bible
2864,ref-sifre-d.47.1.1-ref-sifre-d.47.1.12,ref-bible.0105.11.21.1-ref-bible.0105.11.21.16,87339,87414,14697,14707,ref-sifre-d.00047.00001.00001,ref-sifre-d.00047.00001.00012,364231,364320,60909,60920,ref-bible.00105.00011.00021.00001,ref-bible.00105.00011.00021.00016,למען ירבו ימיכם בעולם הזה וימי בניכם לימות המשיח כימי השמים על הארץ ,למען ירבו ימיכם וימי בניכם על_האדמה_אשר_נשבע_יהוה לאבתיכם לתת להם כימי השמים על הארץ ,ref-bible
2865,ref-sifre-d.47.6.76-ref-sifre-d.47.6.81,ref-bible.0206.13.7.16-ref-bible.0206.13.7.21,88866,88897,14923,14928,ref-sifre-d.00047.00006.00076,ref-sifre-d.00047.00006.00081,744929,744959,125953,125958,ref-bible.00206.00013.00007.00016,ref-bible.00206.00013.00007.00021,אבדם מלך ארם וישימם כעפר לדוש ,אבדם מלך ארם וישמם כעפר לדש ,ref-bible
2866,ref-sifre-d.47.7.18-ref-sifre-d.47.7.27,ref-bible.0207.66.22.3-ref-bible.0207.66.22.12,88992,89049,14941,14949,ref-sifre-d.00047.00007.00018,ref-sifre-d.00047.00007.00027,867055,867110,147261,147268,ref-bible.00207.00066.00022.00003,ref-bible.00207.00066.00022.00012,השמים החדשים והארץ החדשה אשר אני עושה עומדים לפני נאם ,השמים החדשים והארץ החדשה אשר_אני_עשה עמדים לפני נאם ,ref-bible
2867,ref-sifre-d.47.9.35-ref-sifre-d.47.9.47,ref-bible.0210.1.9.12-ref-bible.0210.2.1.11,89578,89640,15030,15040,ref-sifre-d.00047.00009.00035,ref-sifre-d.00047.00009.00047,1082033,1082094,182733,182743,ref-bible.00210.00001.00009.00012,ref-bible.00210.00002.00001.00011,והיה מספר בני ישראל כחול הים וכתוב שם אשר לא ימד ולא יספר ,אהיה לכם והיה מספר בני ישראל כחול הים אשר לא ימד ולא יספר ,ref-bible
2868,ref-sifre-d.47.9.65-ref-sifre-d.47.9.71,ref-bible.0207.30.17.10-ref-bible.0207.30.17.16,89732,89763,15053,15059,ref-sifre-d.00047.00009.00065,ref-sifre-d.00047.00009.00071,816576,816605,138103,138109,ref-bible.00207.00030.00017.00010,ref-bible.00207.00030.00017.00016,עד אם נותרתם כתורן על ראש ההר ,עד אם נותרתם כתרן על ראש ההר ,ref-bible
2869,ref-sifre-d.47.9.77-ref-sifre-d.47.9.87,ref-bible.0212.5.3.6-ref-bible.0212.5.4.6,89784,89847,15063,15073,ref-sifre-d.00047.00009.00077,ref-sifre-d.00047.00009.00087,1103547,1103636,186506,186517,ref-bible.00212.00005.00003.00006,ref-bible.00212.00005.00004.00006,העיר היוצאת אלף תשאיר מאה והיוצאת מאה תשאיר עשרה לבית ישראל ,העיר היצאת אלף תשאיר מאה והיוצאת מאה תשאיר עשרה לבית_ישראל_כי_כה_אמר_יהוה לבית ישראל ,ref-bible
2870,ref-sifre-d.48.1.61-ref-sifre-d.48.1.74,ref-bible.0303.28.17.1-ref-bible.0303.28.17.7,90197,90280,15129,15142,ref-sifre-d.00048.00001.00061,ref-sifre-d.00048.00001.00074,1318954,1318992,226020,226026,ref-bible.00303.00028.00017.00001,ref-bible.00303.00028.00017.00007,לא יערכנה זהב וזכוכית קשים לקנותם כזהב ונוחים לאבדם ככלי זכוכית ותמורתה כלי פז ,לא יערכנה זהב וזכוכית ותמורתה כלי פז ,ref-bible
2871,ref-sifre-d.48.2.5-ref-sifre-d.48.2.10,ref-bible.0105.4.9.1-ref-bible.0105.4.9.6,90299,90325,15145,15150,ref-sifre-d.00048.00002.00005,ref-sifre-d.00048.00002.00010,347001,347027,58157,58162,ref-bible.00105.00004.00009.00001,ref-bible.00105.00004.00009.00006,רק השמר לך ושמור נפשך מאד ,רק השמר לך ושמר נפשך מאד ,ref-bible
2872,ref-sifre-d.48.3.92-ref-sifre-d.48.3.105,ref-bible.0302.24.30.1-ref-bible.0302.24.30.10,90971,91028,15266,15279,ref-sifre-d.00048.00003.00092,ref-sifre-d.00048.00003.00105,1284266,1284306,219359,219368,ref-bible.00302.00024.00030.00001,ref-bible.00302.00024.00030.00010,על שדה איש עצל עברתי זה שקנה שדה כבר ועל כרם אדם חסר לב ,על שדה איש עצל עברתי ועל כרם אדם חסר לב ,ref-bible
2873,ref-sifre-d.48.3.123-ref-sifre-d.48.3.138,ref-bible.0302.24.30.1-ref-bible.0302.24.31.2,91111,91176,15297,15312,ref-sifre-d.00048.00003.00123,ref-sifre-d.00048.00003.00138,1284266,1284316,219359,219370,ref-bible.00302.00024.00030.00001,ref-bible.00302.00024.00031.00002,על שדה איש עצל עברתי ועל כרם אדם חסר לב ולמה נקרא שמו חסר לב על ,על שדה איש עצל עברתי ועל כרם אדם חסר לב והנה עלה ,ref-bible
2874,ref-sifre-d.48.3.165-ref-sifre-d.48.3.173,ref-bible.0302.24.31.5-ref-bible.0302.24.31.10,91321,91369,15339,15346,ref-sifre-d.00048.00003.00165,ref-sifre-d.00048.00003.00173,1284328,1284360,219373,219378,ref-bible.00302.00024.00031.00005,ref-bible.00302.00024.00031.00010,כסו פניו חרולים ועוד הוא אומר וגדר אבניו נהרסה ,כסו פניו חרלים וגדר אבניו נהרסה ,ref-bible
2875,ref-sifre-d.48.4.9-ref-sifre-d.48.4.22,ref-bible.0302.27.7.1-ref-bible.0302.27.7.9,91619,91686,15386,15399,ref-sifre-d.00048.00004.00009,ref-sifre-d.00048.00004.00022,1286949,1286988,219894,219902,ref-bible.00302.00027.00007.00001,ref-bible.00302.00027.00007.00009,נפש שבעה תבוס נופת זה תלמיד שלא למד מתחילתו ונפש רעבה כל מר מתוק ,נפש שבעה תבוס נפת ונפש רעבה כל מר מתוק ,ref-bible
2876,ref-sifre-d.48.5.174-ref-sifre-d.48.5.181,ref-bible.0302.3.15.1-ref-bible.0302.3.15.9,92763,92802,15576,15583,ref-sifre-d.00048.00005.00174,ref-sifre-d.00048.00005.00181,1259842,1259889,214605,214613,ref-bible.00302.00003.00015.00001,ref-bible.00302.00003.00015.00009,יקרה היא מפנינים וכל חפצים לא ישוו בה ,יקרה היא מפניים מפנינים וכל חפציך לא ישוו בה ,ref-bible
2877,ref-sifre-d.48.5.176-ref-sifre-d.48.5.181,ref-bible.0302.8.11.4-ref-bible.0302.8.11.9,92772,92802,15578,15583,ref-sifre-d.00048.00005.00176,ref-sifre-d.00048.00005.00181,1265247,1265277,215641,215646,ref-bible.00302.00008.00011.00004,ref-bible.00302.00008.00011.00009,מפנינים וכל חפצים לא ישוו בה ,מפנינים וכל חפצים לא ישוו בה ,ref-bible
2878,ref-sifre-d.48.7.15-ref-sifre-d.48.7.20,ref-bible.0304.1.3.1-ref-bible.0304.1.3.6,93328,93358,15675,15680,ref-sifre-d.00048.00007.00015,ref-sifre-d.00048.00007.00020,1335467,1335497,229201,229206,ref-bible.00304.00001.00003.00001,ref-bible.00304.00001.00003.00006,לריח שמניך טובים שמן תורק שמך ,לריח שמניך טובים שמן תורק שמך ,ref-bible
2879,ref-sifre-d.48.7.34-ref-sifre-d.48.7.38,ref-bible.0302.3.8.1-ref-bible.0302.3.8.5,93425,93458,15694,15698,ref-sifre-d.00048.00007.00034,ref-sifre-d.00048.00007.00038,1259579,1259611,214558,214562,ref-bible.00302.00003.00008.00001,ref-bible.00302.00003.00008.00005,רפאות תהיה לשרך ושקוי לעצמותיך ,רפאות תהי לשרך ושקוי לעצמותיך ,ref-bible
2880,ref-sifre-d.48.7.40-ref-sifre-d.48.7.46,ref-bible.0302.1.9.1-ref-bible.0302.1.9.7,93466,93505,15700,15706,ref-sifre-d.00048.00007.00040,ref-sifre-d.00048.00007.00046,1257507,1257545,214175,214181,ref-bible.00302.00001.00009.00001,ref-bible.00302.00001.00009.00007,כי לוית חן הם לראשך וענקים לגרגרותיך ,כי לוית חן הם לראשך וענקים לגרגרתיך ,ref-bible
2881,ref-sifre-d.48.7.48-ref-sifre-d.48.7.54,ref-bible.0302.4.9.1-ref-bible.0302.4.9.7,93513,93548,15708,15714,ref-sifre-d.00048.00007.00048,ref-sifre-d.00048.00007.00054,1260955,1260990,214818,214824,ref-bible.00302.00004.00009.00001,ref-bible.00302.00004.00009.00007,תתן לראשך לוית חן עטרת תפארת תמגנך ,תתן לראשך לוית חן עטרת תפארת תמגנך ,ref-bible
2882,ref-sifre-d.48.8.69-ref-sifre-d.48.8.79,ref-bible.0302.23.5.3-ref-bible.0302.23.5.14,93977,94032,15773,15783,ref-sifre-d.00048.00008.00069,ref-sifre-d.00048.00008.00079,1281825,1281886,218886,218897,ref-bible.00302.00023.00005.00003,ref-bible.00302.00023.00005.00014,עיניך בו ואיננו כי עשה יעשה לו כנפים כנשר יעוף השמים ,עיניך בו ואיננו כי עשה יעשה לו כנפים כנשר ועיף יעוף השמים ,ref-bible
2883,ref-sifre-d.48.9.35-ref-sifre-d.48.9.45,ref-bible.0105.33.4.1-ref-bible.0105.33.4.7,94251,94304,15810,15818,ref-sifre-d.00048.00009.00035,ref-sifre-d.00048.00009.00045,408979,409011,68339,68345,ref-bible.00105.00033.00004.00001,ref-bible.00105.00033.00004.00007,בתורה וכן_הוא_אומר תורה צוה לנו משה מורשה קהלת יעקב ,תורה צוה לנו משה מורשה קהלת יעקב ,ref-bible
2884,ref-sifre-d.48.9.58-ref-sifre-d.48.9.67,ref-bible.0105.29.9.1-ref-bible.0105.29.9.10,94367,94423,15829,15836,ref-sifre-d.00048.00009.00058,ref-sifre-d.00048.00009.00067,399384,399442,66750,66757,ref-bible.00105.00029.00009.00001,ref-bible.00105.00029.00009.00010,אתם נצבים היום כלכם לפני_ה'_אלהיכם ראשיכם שבטיכם זקניכם ,אתם נצבים היום כלכם לפני_יהוה_אלהיכם ראשיכם שבטיכם זקניכם ,ref-bible
2885,ref-sifre-d.48.10.21-ref-sifre-d.48.10.41,ref-bible.0105.32.47.1-ref-bible.0105.32.47.13,95054,95147,15942,15957,ref-sifre-d.00048.00010.00021,ref-sifre-d.00048.00010.00041,408280,408337,68225,68234,ref-bible.00105.00032.00047.00001,ref-bible.00105.00032.00047.00013,כי לא דבר רק הוא מכם דבר שאתם אומרים ריקים הוא לא ריקה הוא אלא מכם כי הוא חייכם ואורך ימיכם ,כי לא דבר רק הוא מכם כי הוא חייכם ובדבר הזה תאריכו ימים ,ref-bible
2886,ref-sifre-d.48.10.66-ref-sifre-d.48.10.84,ref-bible.0105.8.3.12-ref-bible.0105.8.3.28,95262,95343,15971,15986,ref-sifre-d.00048.00010.00066,ref-sifre-d.00048.00010.00084,357071,357145,59763,59776,ref-bible.00105.00008.00003.00012,ref-bible.00105.00008.00003.00028,למען הודיעך כי לא על הלחם לבדו יחיה האדם זה מדרש כי על כל מוצא פי ה' יחיה האדם ,למען הודעך כי לא על הלחם לבדו יחיה האדם כי_על_כל מוצא פי יהוה יחיה האדם ,ref-bible
2887,ref-sifre-d.48.10.91-ref-sifre-d.48.10.97,ref-bible.0302.27.11.1-ref-bible.0302.27.11.7,95376,95411,15991,15997,ref-sifre-d.00048.00010.00091,ref-sifre-d.00048.00010.00097,1287150,1287184,219936,219942,ref-bible.00302.00027.00011.00001,ref-bible.00302.00027.00011.00007,חכם בני ושמח לבי ואשיבה חורפי דבר ,חכם בני ושמח לבי ואשיבה חרפי דבר ,ref-bible
2888,ref-sifre-d.48.10.91-ref-sifre-d.48.10.106,ref-bible.0302.23.15.1-ref-bible.0302.23.15.8,95376,95449,15991,16006,ref-sifre-d.00048.00010.00091,ref-sifre-d.00048.00010.00106,1282247,1282277,218968,218975,ref-bible.00302.00023.00015.00001,ref-bible.00302.00023.00015.00008,חכם בני ושמח לבי ואשיבה חורפי דבר ואומר בני אם חכם לבך ישמח לבי גם אני ,בני אם חכם לבך ישמח לבי גם אני ,ref-bible
2889,ref-sifre-d.48.11.1-ref-sifre-d.48.11.16,ref-bible.0105.6.17.1-ref-bible.0105.6.18.1,95544,95622,16020,16030,ref-sifre-d.00048.00011.00001,ref-sifre-d.00048.00011.00016,353955,354016,59265,59273,ref-bible.00105.00006.00017.00001,ref-bible.00105.00006.00018.00001,אשר אנכי מצוה אתכם לעשותה למה_נאמר_לפי_שהוא_אומר שמור תשמרו את מצות ה' אלהיכם ,שמור תשמרון את_מצות_יהוה אלהיכם ועדתיו וחקיו אשר צוך ועשית ,ref-bible
2890,ref-sifre-d.48.12.43-ref-sifre-d.48.12.49,ref-bible.0302.3.18.1-ref-bible.0302.3.18.7,96018,96057,16098,16104,ref-sifre-d.00048.00012.00043,ref-sifre-d.00048.00012.00049,1259961,1259998,214626,214632,ref-bible.00302.00003.00018.00001,ref-bible.00302.00003.00018.00007,עץ חיים היא למחזיקים בה ותומכיה מאושר ,עץ חיים היא למחזיקים בה ותמכיה מאשר ,ref-bible
2891,ref-sifre-d.48.12.51-ref-sifre-d.48.12.59,ref-bible.0302.4.9.1-ref-bible.0302.4.9.7,96065,96112,16106,16113,ref-sifre-d.00048.00012.00051,ref-sifre-d.00048.00012.00059,1260955,1260990,214818,214824,ref-bible.00302.00004.00009.00001,ref-bible.00302.00004.00009.00007,תתן לראשך לוית חן בעולם הזה עטרת תפארת תמגנך ,תתן לראשך לוית חן עטרת תפארת תמגנך ,ref-bible
2892,ref-sifre-d.49.1.10-ref-sifre-d.49.1.25,ref-bible.0102.34.6.8-ref-bible.0102.34.7.8,96498,96581,16172,16187,ref-sifre-d.00049.00001.00010,ref-sifre-d.00049.00001.00025,175185,175265,30682,30694,ref-bible.00102.00034.00006.00008,ref-bible.00102.00034.00007.00008,אל רחום וחנון ארץ אפים ורב חסד ואמת נוצר חסד לאלפים נושא עון ופשע וחטאה ונקה ,אל רחום וחנון ארך_אפים_ורב_חסד ואמת נצר חסד לאלפים נשא עון ופשע וחטאה ונקה ,ref-bible
2893,ref-sifre-d.49.1.27-ref-sifre-d.49.1.33,ref-bible.0211.3.5.2-ref-bible.0211.3.5.8,96588,96616,16189,16194,ref-sifre-d.00049.00001.00027,ref-sifre-d.00049.00001.00033,1097336,1097364,185516,185521,ref-bible.00211.00003.00005.00002,ref-bible.00211.00003.00005.00008,כל אשר יקרא בשם ה' ימלט וכי ,כל אשר יקרא בשם יהוה ימלט כי ,ref-bible
2894,ref-sifre-d.49.1.62-ref-sifre-d.49.1.71,ref-bible.0301.145.17.1-ref-bible.0301.145.18.2,96757,96804,16222,16231,ref-sifre-d.00049.00001.00062,ref-sifre-d.00049.00001.00071,1254655,1254703,213670,213678,ref-bible.00301.00145.00017.00001,ref-bible.00301.00145.00018.00002,צדיק ה' בכל דרכיו וחסיד בכל מעשיו אף אתה הוי ,צדיק יהוה בכל דרכיו וחסיד בכל מעשיו קרוב יהוה ,ref-bible
2895,ref-sifre-d.49.1.93-ref-sifre-d.49.1.100,ref-bible.0207.43.7.1-ref-bible.0207.43.7.8,96908,96956,16252,16259,ref-sifre-d.00049.00001.00093,ref-sifre-d.00049.00001.00100,835912,835960,141582,141589,ref-bible.00207.00043.00007.00001,ref-bible.00207.00043.00007.00008,כל הנקרא בשמי ולכבודי בראתיו יצרתיו אף עשיתיו ,כל הנקרא בשמי ולכבודי בראתיו יצרתיו אף עשיתיו ,ref-bible
2896,ref-sifre-d.49.2.52-ref-sifre-d.49.2.58,ref-bible.0301.68.19.1-ref-bible.0301.68.19.7,97267,97305,16309,16315,ref-sifre-d.00049.00002.00052,ref-sifre-d.00049.00002.00058,1197846,1197884,203361,203367,ref-bible.00301.00068.00019.00001,ref-bible.00301.00068.00019.00007,עלית למרום שבית שבי לקחת מתנות באדם ,עלית למרום שבית שבי לקחת מתנות באדם ,ref-bible
2897,ref-sifre-d.50.2.14-ref-sifre-d.50.2.26,ref-bible.0303.5.22.4-ref-bible.0303.5.23.9,97775,97839,16392,16402,ref-sifre-d.00050.00002.00014,ref-sifre-d.00050.00002.00026,1298257,1298321,222015,222025,ref-bible.00303.00005.00022.00004,ref-bible.00303.00005.00023.00009,החיה והלא_כבר_נאמר כי עם אבני השדה בריתך וחית השדה השלמה לך ,ומחית הארץ אל_תירא_כי עם אבני השדה בריתך וחית השדה השלמה לך ,ref-bible
2898,ref-sifre-d.50.2.43-ref-sifre-d.50.3.4,ref-bible.0201.23.9.1-ref-bible.0201.23.9.6,97921,97955,16419,16423,ref-sifre-d.00050.00002.00043,ref-sifre-d.00050.00003.00004,461023,461061,76890,76895,ref-bible.00201.00023.00009.00001,ref-bible.00201.00023.00009.00006,מפניך וירשתם גוים גדולים ועצומים ,ויורש יהוה מפניכם גוים גדלים ועצומים ,ref-bible
2899,ref-sifre-d.50.3.1-ref-sifre-d.50.3.5,ref-bible.0105.4.38.1-ref-bible.0105.4.38.5,97927,97959,16420,16424,ref-sifre-d.00050.00003.00001,ref-sifre-d.00050.00003.00005,349581,349610,58577,58581,ref-bible.00105.00004.00038.00001,ref-bible.00105.00004.00038.00005,וירשתם גוים גדולים ועצומים מכם ,להוריש גוים גדלים ועצמים ממך ,ref-bible
2900,ref-sifre-d.50.3.1-ref-sifre-d.50.3.6,ref-bible.0105.9.1.9-ref-bible.0105.9.1.15,97927,97966,16420,16425,ref-sifre-d.00050.00003.00001,ref-sifre-d.00050.00003.00006,358353,358390,59972,59978,ref-bible.00105.00009.00001.00009,ref-bible.00105.00009.00001.00015,וירשתם גוים גדולים ועצומים מכם גדולים ,לרשת גוים גדלים ועצמים ממך ערים גדלת ,ref-bible
2901,ref-sifre-d.50.3.1-ref-sifre-d.50.3.5,ref-bible.0105.11.23.8-ref-bible.0105.11.23.12,97927,97959,16420,16424,ref-sifre-d.00050.00003.00001,ref-sifre-d.00050.00003.00005,364470,364500,60940,60944,ref-bible.00105.00011.00023.00008,ref-bible.00105.00011.00023.00012,וירשתם גוים גדולים ועצומים מכם ,וירשתם גוים גדלים ועצמים מכם ,ref-bible
2902,ref-sifre-d.50.4.28-ref-sifre-d.50.4.39,ref-bible.0212.2.9.1-ref-bible.0212.2.9.12,98269,98342,16474,16484,ref-sifre-d.00050.00004.00028,ref-sifre-d.00050.00004.00039,1100677,1100747,186027,186037,ref-bible.00212.00002.00009.00001,ref-bible.00212.00002.00009.00012,ואנכי השמדתי את האמורי מפניכם אשר כגובה ארזים גבהו וחסון הוא כאלונים ,ואנכי השמדתי את האמרי מפניהם אשר כגבה ארזים גבהו וחסן הוא כאלונים ,ref-bible
2903,ref-sifre-d.51.1.1-ref-sifre-d.51.1.9,ref-bible.0105.11.24.1-ref-bible.0105.11.24.9,98343,98383,16485,16493,ref-sifre-d.00051.00001.00001,ref-sifre-d.00051.00001.00009,364501,364540,60945,60953,ref-bible.00105.00011.00024.00001,ref-bible.00105.00011.00024.00009,כל המקום אשר תדרוך כף רגלכם בו לכם יהיה ,כל המקום אשר תדרך כף רגלכם בו לכם יהיה ,ref-bible
2904,ref-sifre-d.51.1.3-ref-sifre-d.51.1.8,ref-bible.0201.1.3.3-ref-bible.0201.1.3.8,98353,98378,16487,16492,ref-sifre-d.00051.00001.00003,ref-sifre-d.00051.00001.00008,411604,411628,68803,68808,ref-bible.00201.00001.00003.00003,ref-bible.00201.00001.00003.00008,אשר תדרוך כף רגלכם בו לכם ,אשר תדרך כף רגלכם בו לכם ,ref-bible
2905,ref-sifre-d.51.1.3-ref-sifre-d.51.1.9,ref-bible.0201.14.9.9-ref-bible.0201.14.9.14,98353,98383,16487,16493,ref-sifre-d.00051.00001.00003,ref-sifre-d.00051.00001.00009,441526,441550,73728,73733,ref-bible.00201.00014.00009.00009,ref-bible.00201.00014.00009.00014,אשר תדרוך כף רגלכם בו לכם יהיה ,אשר דרכה רגלך בה לך תהיה ,ref-bible
2906,ref-sifre-d.51.1.18-ref-sifre-d.51.1.32,ref-bible.0105.11.24.3-ref-bible.0105.11.24.16,98420,98497,16502,16516,ref-sifre-d.00051.00001.00018,ref-sifre-d.00051.00001.00032,364511,364576,60947,60960,ref-bible.00105.00011.00024.00003,ref-bible.00105.00011.00024.00016,"מן המדבר והלבנון הזה ועד הנהר הגדול נהר פרת ומה ת""ל אשר תדרוך כף רגלכם ",אשר תדרך כף רגלכם בו לכם יהיה מן המדבר והלבנון מן הנהר נהר פרת ,ref-bible
2907,ref-sifre-d.51.1.19-ref-sifre-d.51.1.32,ref-bible.0201.1.3.3-ref-bible.0201.1.4.8,98423,98497,16503,16516,ref-sifre-d.00051.00001.00019,ref-sifre-d.00051.00001.00032,411604,411700,68803,68821,ref-bible.00201.00001.00003.00003,ref-bible.00201.00001.00004.00008,"המדבר והלבנון הזה ועד הנהר הגדול נהר פרת ומה ת""ל אשר תדרוך כף רגלכם ",אשר תדרך כף רגלכם בו לכם נתתיו כאשר דברתי אל משה מהמדבר והלבנון הזה ועד הנהר הגדול נהר פרת ,ref-bible
2908,ref-sifre-d.51.1.20-ref-sifre-d.51.1.26,ref-bible.0105.1.7.18-ref-bible.0105.1.7.23,98430,98469,16504,16510,ref-sifre-d.00051.00001.00020,ref-sifre-d.00051.00001.00026,338277,338308,56677,56682,ref-bible.00105.00001.00007.00018,ref-bible.00105.00001.00007.00023,והלבנון הזה ועד הנהר הגדול נהר פרת ,והלבנון עד הנהר הגדל נהר פרת ,ref-bible
2909,ref-sifre-d.51.1.58-ref-sifre-d.51.1.62,ref-bible.0105.4.38.1-ref-bible.0105.4.38.5,98618,98650,16535,16539,ref-sifre-d.00051.00001.00058,ref-sifre-d.00051.00001.00062,349581,349610,58577,58581,ref-bible.00105.00004.00038.00001,ref-bible.00105.00004.00038.00005,וירשתם גוים גדולים ועצומים מכם ,להוריש גוים גדלים ועצמים ממך ,ref-bible
