,baseOrig,compOrig,baseCharStart,baseCharEnd,baseWdStart,baseWdEnd,baseRefStart,baseRefEnd,compCharStart,compCharEnd,compWdStart,compWdEnd,compRefStart,compRefEnd,baseStr,compStr,compWork
10415,ref-sifre-d.270.8.19-ref-sifre-d.270.8.27,ref-y.03.01.10.00.87-ref-y.03.01.10.00.94,259033,259077,43273,43281,ref-sifre-d.00270.00008.00019,ref-sifre-d.00270.00008.00027,2118563,2118603,323254,323261,ref-y.00003.00001.00010.00000.00087,ref-y.00003.00001.00010.00000.00094,"ואמרו לה הרי מת בעליך וניסת ואח""כ בא בעלה ","אמרו לה מת בעליך ונתקדשה ואח""כ בא בעלה ",ref-y
10416,ref-sifre-d.270.8.46-ref-sifre-d.270.8.54,ref-y.03.01.14.00.99-ref-y.03.01.14.00.105,259173,259221,43298,43306,ref-sifre-d.00270.00008.00046,ref-sifre-d.00270.00008.00054,2169392,2169429,330601,330607,ref-y.00003.00001.00014.00000.00099,ref-y.00003.00001.00014.00000.00105,בעלה הראשון אשר שלחה לשוב לקחתה להיות לו לאשה ,בעלה הראשון אשר שלחה לשוב לקחתה אשתו ,ref-y
10417,ref-sifre-d.270.8.46-ref-sifre-d.270.8.51,ref-y.03.06.9.00.2106-ref-y.03.06.9.00.2111,259173,259206,43298,43303,ref-sifre-d.00270.00008.00046,ref-sifre-d.00270.00008.00051,2753997,2754029,418075,418080,ref-y.00003.00006.00009.00000.02106,ref-y.00003.00006.00009.00000.02111,בעלה הראשון אשר שלחה לשוב לקחתה ,בעלה הראשון אשר שלחה לשוב לקחתה ,ref-y
10418,ref-sifre-d.270.8.46-ref-sifre-d.270.8.51,ref-y.03.07.1.00.799-ref-y.03.07.1.00.804,259173,259206,43298,43303,ref-sifre-d.00270.00008.00046,ref-sifre-d.00270.00008.00051,2758567,2758599,418779,418784,ref-y.00003.00007.00001.00000.00799,ref-y.00003.00007.00001.00000.00804,בעלה הראשון אשר שלחה לשוב לקחתה ,בעלה הראשון אשר שלחה לשוב לקחתה ,ref-y
10419,ref-sifre-d.270.8.46-ref-sifre-d.270.8.52,ref-y.03.07.3.00.692-ref-y.03.07.3.00.698,259173,259212,43298,43304,ref-sifre-d.00270.00008.00046,ref-sifre-d.00270.00008.00052,2841650,2841686,431038,431044,ref-y.00003.00007.00003.00000.00692,ref-y.00003.00007.00003.00000.00698,בעלה הראשון אשר שלחה לשוב לקחתה להיות ,בעלה הראשון אשר שלחה לשוב לקחתה היו ,ref-y
10420,ref-sifre-d.270.9.31-ref-sifre-d.270.9.44,ref-y.03.01.14.00.97-ref-y.03.01.14.00.104,259406,259480,43333,43344,ref-sifre-d.00270.00009.00031,ref-sifre-d.00270.00009.00044,2169384,2169424,330600,330606,ref-y.00003.00001.00014.00000.00097,ref-y.00003.00001.00014.00000.00104,לא יוכל הראשון לקחתה את אשר שילח לקחתה הראשון לקחתה אשר שלחה לקחתה לשוב ,לא יוכל בעלה הראשון אשר שלחה לשוב לקחתה ,ref-y
10421,ref-sifre-d.270.9.31-ref-sifre-d.270.9.44,ref-y.03.06.9.00.2104-ref-y.03.06.9.00.2111,259406,259480,43333,43344,ref-sifre-d.00270.00009.00031,ref-sifre-d.00270.00009.00044,2753989,2754029,418074,418080,ref-y.00003.00006.00009.00000.02104,ref-y.00003.00006.00009.00000.02111,לא יוכל הראשון לקחתה את אשר שילח לקחתה הראשון לקחתה אשר שלחה לקחתה לשוב ,לא יוכל בעלה הראשון אשר שלחה לשוב לקחתה ,ref-y
10422,ref-sifre-d.270.9.31-ref-sifre-d.270.9.44,ref-y.03.07.1.00.797-ref-y.03.07.1.00.804,259406,259480,43333,43344,ref-sifre-d.00270.00009.00031,ref-sifre-d.00270.00009.00044,2758559,2758599,418778,418784,ref-y.00003.00007.00001.00000.00797,ref-y.00003.00007.00001.00000.00804,לא יוכל הראשון לקחתה את אשר שילח לקחתה הראשון לקחתה אשר שלחה לקחתה לשוב ,לא יוכל בעלה הראשון אשר שלחה לשוב לקחתה ,ref-y
10423,ref-sifre-d.270.9.31-ref-sifre-d.270.9.44,ref-y.03.07.3.00.690-ref-y.03.07.3.00.697,259406,259480,43333,43344,ref-sifre-d.00270.00009.00031,ref-sifre-d.00270.00009.00044,2841642,2841682,431037,431043,ref-y.00003.00007.00003.00000.00690,ref-y.00003.00007.00003.00000.00697,לא יוכל הראשון לקחתה את אשר שילח לקחתה הראשון לקחתה אשר שלחה לקחתה לשוב ,לא יוכל בעלה הראשון אשר שלחה לשוב לקחתה ,ref-y
10424,ref-sifre-d.270.12.1-ref-sifre-d.270.12.11,ref-y.03.01.4.00.3469-ref-y.03.01.4.00.3476,259767,259821,43390,43398,ref-sifre-d.00270.00012.00001,ref-sifre-d.00270.00012.00011,2061928,2061969,315105,315112,ref-y.00003.00001.00004.00000.03469,ref-y.00003.00001.00004.00000.03476,כי תועבה היא ר'_יהודה_אומר היא תועבה ואין הולד תועבה ,כי תועבה היא היא תועבה ואין הוולד תועבה ,ref-y
10425,ref-sifre-d.271.1.40-ref-sifre-d.271.1.48,ref-y.04.04.8.00.1397-ref-y.04.04.8.00.1405,260066,260123,43433,43440,ref-sifre-d.00271.00001.00040,ref-sifre-d.00271.00001.00048,3172276,3172333,482839,482846,ref-y.00004.00004.00008.00000.01397,ref-y.00004.00004.00008.00000.01405,לכהן הדיוט ממזרת ונתינה לישראל בת ישראל לנתין ולממזר ,לכהן הדיוט ממזרת ונתינה לישראל בת ישראל לנתין ולממזר ,ref-y
10426,ref-sifre-d.271.2.9-ref-sifre-d.271.2.18,ref-y.03.05.8.00.2265-ref-y.03.05.8.00.2276,260159,260215,43447,43456,ref-sifre-d.00271.00002.00009,ref-sifre-d.00271.00002.00018,2625166,2625238,399029,399039,ref-y.00003.00005.00008.00000.02265,ref-y.00003.00005.00008.00000.02276,"יספיק כלי זיין ומים ומזון ת""ל ולא יעבור עליו לכל דבר ",מספקים מים ומזון ואינן מתקנין את הדרכי' שנאמר ולא יעבר עליו לכל דבר ,ref-y
10427,ref-sifre-d.271.2.33-ref-sifre-d.271.2.42,ref-y.03.05.8.00.2273-ref-y.03.05.8.00.2283,260272,260321,43470,43478,ref-sifre-d.00271.00002.00033,ref-sifre-d.00271.00002.00042,2625215,2625269,399036,399044,ref-y.00003.00005.00008.00000.02273,ref-y.00003.00005.00008.00000.02283,"ולא לקחה ת""ל עליו עליו אינו עובר אבל עובר הוא על ",ולא יעבר עליו לכל דבר עליו אינו עובר אבל עובר הוא על ,ref-y
10428,ref-sifre-d.272.1.1-ref-sifre-d.272.1.9,ref-y.03.04.6.00.1771-ref-y.03.04.6.00.1777,260407,260448,43496,43502,ref-sifre-d.00272.00001.00001,ref-sifre-d.00272.00001.00009,2486727,2486765,377674,377680,ref-y.00003.00004.00006.00000.01771,ref-y.00003.00004.00006.00000.01777,לא יחבול רחים ורכב אין_לי_אלא רחים ורכב ,לא יחבול ריחים ורכב ממשמע שנאמר רכב ,ref-y
10429,ref-sifre-d.274.4.4-ref-sifre-d.274.4.9,ref-y.04.04.11.00.305-ref-y.04.04.11.00.312,261408,261439,43660,43665,ref-sifre-d.00274.00004.00004,ref-sifre-d.00274.00004.00009,3220858,3220904,490730,490737,ref-y.00004.00004.00011.00000.00305,ref-y.00004.00004.00011.00000.00312,נגעי אדם נגעי בגדים ונגעי בתים ,לנגע בין ניגעי אדם לניגעי בגדים ולנגעי בתים ,ref-y
10430,ref-sifre-d.276.1.2-ref-sifre-d.276.1.9,ref-y.03.07.4.00.2429-ref-y.03.07.4.00.2437,262266,262302,43804,43809,ref-sifre-d.00276.00001.00002,ref-sifre-d.00276.00001.00009,2874597,2874637,436077,436083,ref-y.00003.00007.00004.00000.02429,ref-y.00003.00007.00004.00000.02437,תשה ברעך אין_לי_אלא מלוה מנין לרבות ,תשים עליך מלך אין_לי_אלא מלך מניין לרבות ,ref-y
10431,ref-sifre-d.276.2.27-ref-sifre-d.276.2.33,ref-y.03.06.5.00.533-ref-y.03.06.5.00.539,262483,262516,43842,43848,ref-sifre-d.00276.00002.00027,ref-sifre-d.00276.00002.00033,2697389,2697422,409799,409805,ref-y.00003.00006.00005.00000.00533,ref-y.00003.00006.00005.00000.00539,והאיש אשר אתה נושה בו יוציא אליך ,והאיש אשר אתה נושה בו יוציא אליך ,ref-y
10432,ref-sifre-d.277.3.1-ref-sifre-d.277.3.15,ref-y.04.02.9.00.744-ref-y.04.02.9.00.759,262770,262841,43892,43903,ref-sifre-d.00277.00003.00001,ref-sifre-d.00277.00003.00015,2994465,2994538,454965,454979,ref-y.00004.00002.00009.00000.00744,ref-y.00004.00002.00009.00000.00759,השב תשיב לו את העבוט כבוא השמש ולהלן_הוא_אומר עד בא השמש תשיבנו לו ,השב תשיב לו את העבוד כבוא השמש עם מעלי שמשא עד בוא השמש תשיבנו לו עד ,ref-y
10433,ref-sifre-d.279.1.2-ref-sifre-d.279.1.13,ref-y.04.02.9.00.432-ref-y.04.02.9.00.452,264098,264163,44115,44126,ref-sifre-d.00279.00001.00002,ref-sifre-d.00279.00001.00013,2992795,2992905,454690,454708,ref-y.00004.00002.00009.00000.00432,ref-y.00004.00002.00009.00000.00452,תתן שכרו מלמד ששכיר יום גובה כל הלילה ושכיר לילה גובה כל היום ,כל היום וכל הלילה ותני כן שכיר שעות ביום גובה כל היום בלילה גובה כל הלילה שכיר שעות ביום ובלילה גובה ,ref-y
10434,ref-sifre-d.280.1.1-ref-sifre-d.280.1.41,ref-y.04.04.3.00.1947-ref-y.04.04.3.00.1980,264718,264915,44222,44256,ref-sifre-d.00280.00001.00001,ref-sifre-d.00280.00001.00041,3105960,3106127,472372,472403,ref-y.00004.00004.00003.00000.01947,ref-y.00004.00004.00003.00000.01980,לא יומתו אבות על בנים וכי_מה_בא_הכתוב_ללמדנו שלא יומתו אבות על ידי בנים ולא בנים על ידי אבות והרי כבר נאמר איש בחטאו יומתו אלא בא ללמד שלא יומתו אבות בעדותם של בנים ולא בנים בעדותם של אבות ,"לא יומתו אבות על בנים והלא_כבר_נאמר איש בחטאו יומת מה ת""ל לא יומתו אבות על בנים לא יומתו אבות בעדות בנים ובנים לא יומתו בעדות אבות מניין שלא יהו העדים קרובין של ",ref-y
10435,ref-sifre-d.280.1.32-ref-sifre-d.280.2.24,ref-y.04.04.3.00.1286-ref-y.04.04.3.00.1348,264863,265049,44247,44278,ref-sifre-d.00280.00001.00032,ref-sifre-d.00280.00002.00024,3102679,3102992,471865,471924,ref-y.00004.00004.00003.00000.01286,ref-y.00004.00004.00003.00000.01348,יומתו אבות בעדותם של בנים ולא בנים בעדותם של אבות כשהוא אומר ובנים לרבות את הקרובים ואלו הם הקרובים אחיו ואחי אביו ואחי אמו ובעל אחותו ובעל אחות אביו ובעל אחות אמו ובעל אמו ,למיתני אחי אביו לומר בנו וחתנו של חתן אחי אביו מכיון דתנינן אחי אביו מה צורכה למיתני אחי אמו לומר בנו וחתנו של חתן אחי אמו מכיון דתנינן בעל אחותו מה צורכה למיתני בעל אחות אביו לומר בנו וחתנו של חתן בעל אחות אביו מכיון דתנינן בעל אחות אביו מה צורכה למיתני בעל אחות אמו לומר בנו וחתנו של חתן בעל אחות אמו ,ref-y
10436,ref-sifre-d.280.3.1-ref-sifre-d.280.3.12,ref-y.04.04.3.00.1955-ref-y.04.04.3.00.1967,265064,265134,44281,44292,ref-sifre-d.00280.00003.00001,ref-sifre-d.00280.00003.00012,3105997,3106055,472378,472390,ref-y.00004.00004.00003.00000.01955,ref-y.00004.00004.00003.00000.01967,איש בחטאו יומתו גדולים מתים בעון עצמם ובנים קטנים מתים בעון אבותם ל,"איש בחטאו יומת מה ת""ל לא יומתו אבות על בנים לא יומתו אבות ",ref-y
10437,ref-sifre-d.281.2.1-ref-sifre-d.281.2.8,ref-y.04.02.9.00.764-ref-y.04.02.9.00.777,265250,265289,44313,44320,ref-sifre-d.00281.00002.00001,ref-sifre-d.00281.00002.00008,2994560,2994631,454984,454997,ref-y.00004.00002.00009.00000.00764,ref-y.00004.00002.00009.00000.00777,ולא תחבול בגד אלמנה בין עניה בין עשירה ,בין ענייה בין עשירה אין ממשכנין אותה שנאמר לא תחבל בגד אלמנה אחד ענייה ,ref-y
10438,ref-sifre-d.282.1.7-ref-sifre-d.282.1.11,ref-y.01.02.2.00.344-ref-y.01.02.2.00.348,265525,265552,44362,44366,ref-sifre-d.00282.00001.00007,ref-sifre-d.00282.00001.00011,219778,219803,34716,34720,ref-y.00001.00002.00002.00000.00344,ref-y.00001.00002.00002.00000.00348,נמלים ושברתו הרוח או בהמה ,נמלים שברתו הרוח או בהמה ,ref-y
10439,ref-sifre-d.282.2.16-ref-sifre-d.282.2.21,ref-y.01.02.2.00.419-ref-y.01.02.2.00.425,265640,265672,44381,44386,ref-sifre-d.00282.00002.00016,ref-sifre-d.00282.00002.00021,220147,220183,34778,34784,ref-y.00001.00002.00002.00000.00419,ref-y.00001.00002.00002.00000.00425,פטור מן הלקט ומן השכחה והפאה ,פטור מן הלקט ומן השכחה ומן הפאה ,ref-y
10440,ref-sifre-d.282.2.16-ref-sifre-d.282.2.21,ref-y.01.02.2.00.437-ref-y.01.02.2.00.443,265640,265672,44381,44386,ref-sifre-d.00282.00002.00016,ref-sifre-d.00282.00002.00021,220236,220272,34794,34800,ref-y.00001.00002.00002.00000.00437,ref-y.00001.00002.00002.00000.00443,פטור מן הלקט ומן השכחה והפאה ,פטור מן הלקט ומן השכחה ומן הפאה ,ref-y
10441,ref-sifre-d.282.3.7-ref-sifre-d.282.3.11,ref-y.01.02.6.00.752-ref-y.01.02.6.00.756,265858,265885,44416,44420,ref-sifre-d.00282.00003.00007,ref-sifre-d.00282.00003.00011,252979,253006,39924,39928,ref-y.00001.00002.00006.00000.00752,ref-y.00001.00002.00006.00000.00756,כי תקצור קצירך בשדך ושכחת ,כי תקצור קצירך בשדך ושכחת ,ref-y
10442,ref-sifre-d.282.3.7-ref-sifre-d.282.3.12,ref-y.01.02.6.00.1238-ref-y.01.02.6.00.1245,265858,265890,44416,44421,ref-sifre-d.00282.00003.00007,ref-sifre-d.00282.00003.00012,255469,255511,40344,40349,ref-y.00001.00002.00006.00000.01238,ref-y.00001.00002.00006.00000.01245,כי תקצור קצירך בשדך ושכחת עומר ,כי תקצור קצירך בשדך ושכחת_עומר_בשדה עומר ,ref-y
10443,ref-sifre-d.282.3.7-ref-sifre-d.282.3.12,ref-y.01.02.6.00.1293-ref-y.01.02.6.00.1300,265858,265890,44416,44421,ref-sifre-d.00282.00003.00007,ref-sifre-d.00282.00003.00012,255766,255808,40395,40400,ref-y.00001.00002.00006.00000.01293,ref-y.00001.00002.00006.00000.01300,כי תקצור קצירך בשדך ושכחת עומר ,כי תקצור קצירך בשדה ושכחת_עומר_בשדה עומר ,ref-y
10444,ref-sifre-d.282.3.7-ref-sifre-d.282.3.12,ref-y.01.02.6.00.1334-ref-y.01.02.6.00.1341,265858,265890,44416,44421,ref-sifre-d.00282.00003.00007,ref-sifre-d.00282.00003.00012,255979,256021,40430,40435,ref-y.00001.00002.00006.00000.01334,ref-y.00001.00002.00006.00000.01341,כי תקצור קצירך בשדך ושכחת עומר ,כי תקצור קצירך בשדה ושכחת_עומר_בשדה עומר ,ref-y
10445,ref-sifre-d.282.3.11-ref-sifre-d.282.3.18,ref-y.01.02.7.00.434-ref-y.01.02.7.00.442,265879,265916,44420,44425,ref-sifre-d.00282.00003.00011,ref-sifre-d.00282.00003.00018,260085,260128,41084,41090,ref-y.00001.00002.00007.00000.00434,ref-y.00001.00002.00007.00000.00442,ושכחת עומר כל זמן שיש לו קציר יש לו ,ושכחו אינו שכחה כל זמן שיש לו תחתיו יש לו ,ref-y
10446,ref-sifre-d.282.3.18-ref-sifre-d.282.3.38,ref-y.01.02.4.00.772-ref-y.01.02.4.00.781,265911,266003,44425,44439,ref-sifre-d.00282.00003.00018,ref-sifre-d.00282.00003.00038,238690,238733,37753,37759,ref-y.00001.00002.00004.00000.00772,ref-y.00001.00002.00004.00000.00781,יש לו עומר ויש לו שכחה יש לו שכחה בעומרין וכל זמן שאין לו קציר אין לו עומר ואין לו שכחה ,שכחת קמה יש לו שכחת עומרין את שאין לו שכחת ,ref-y
10447,ref-sifre-d.282.4.14-ref-sifre-d.282.4.26,ref-y.01.02.5.00.1098-ref-y.01.02.5.00.1113,266156,266232,44464,44474,ref-sifre-d.00282.00004.00014,ref-sifre-d.00282.00004.00026,248024,248118,39134,39149,ref-y.00001.00002.00005.00000.01098,ref-y.00001.00002.00005.00000.01113,העומר ששכחוהו פועלים ולא שכחו בעל הבית שכחו בעל הבית ולא שכחוהו פועלים ,"העומר ששכחוהו פועלים ולא שכחו בעה""ב אינה שכחה דכתיב קצירך ושכחת שכחו בע""ה ולא שכחו פועלים ",ref-y
10448,ref-sifre-d.282.4.14-ref-sifre-d.282.4.25,ref-y.01.02.5.00.1132-ref-y.01.02.5.00.1142,266156,266225,44464,44473,ref-sifre-d.00282.00004.00014,ref-sifre-d.00282.00004.00025,248213,248275,39168,39178,ref-y.00001.00002.00005.00000.01132,ref-y.00001.00002.00005.00000.01142,העומר ששכחוהו פועלים ולא שכחו בעל הבית שכחו בעל הבית ולא שכחוהו ,"עומר א' ששכחוהו פועלין ולא שכחהו בע""ה אינו שכחה עד שישכחוהו ",ref-y
10449,ref-sifre-d.283.2.19-ref-sifre-d.283.2.49,ref-y.01.02.6.00.1417-ref-y.01.02.6.00.1460,266582,266721,44531,44555,ref-sifre-d.00283.00002.00019,ref-sifre-d.00283.00002.00049,256416,256638,40505,40546,ref-y.00001.00002.00006.00000.01417,ref-y.00001.00002.00006.00000.01460,עומר שהורע כח עני יש לו שכחה קמה שיפה כח עני בה אינו דין שיש לו שכחה לא_אם_אמרת בעומר שאינו מציל לא את העומר ולא את הקמה תאמר בקמה ,העני ושכחה הרי מצלת עומר שהורע בו כח העני אינו דין שיציל אמר_לו_רבי מה אם קמה שיפה כח העני בה ושכחה הרי מצלת עומר שהורע כח העני בו ושכחו אינו דין שיציל מדברי שניהם נלמד מצילין עומר מעומר ואין מצילין קמה מקמה ,ref-y
10450,ref-sifre-d.283.3.1-ref-sifre-d.283.3.11,ref-y.01.02.6.00.778-ref-y.01.02.6.00.791,266779,266837,44565,44575,ref-sifre-d.00283.00003.00001,ref-sifre-d.00283.00003.00011,253111,253184,39947,39960,ref-y.00001.00002.00006.00000.00778,ref-y.00001.00002.00006.00000.00791,לא תשוב לקחתו פרט לראשי שורות מכאן אמרו ראשי שורות העומר ,לא תשוב לקחתו עד כדון ראשי שורות קמה וסוף שורות עומרים ראשי שורות עומרים ,ref-y
10451,ref-sifre-d.283.3.5-ref-sifre-d.283.3.13,ref-y.01.02.6.00.799-ref-y.01.02.6.00.813,266797,266851,44569,44577,ref-sifre-d.00283.00003.00005,ref-sifre-d.00283.00003.00013,253219,253309,39966,39980,ref-y.00001.00002.00006.00000.00799,ref-y.00001.00002.00006.00000.00813,לראשי שורות מכאן אמרו ראשי שורות העומר שכנגדו יוכיח ,ראשי שורות עומרים מראשי שורות קמה וסוף שורות קמה מסוף שורות עומרים העומר שכנגדו מוכיח ,ref-y
10452,ref-sifre-d.283.3.14-ref-sifre-d.283.3.22,ref-y.01.02.6.00.1046-ref-y.01.02.6.00.1061,266852,266909,44578,44586,ref-sifre-d.00283.00003.00014,ref-sifre-d.00283.00003.00022,254449,254542,40176,40188,ref-y.00001.00002.00006.00000.01046,ref-y.00001.00002.00006.00000.01061,והעומר שהחזיקו בו להוליכו לעיר ושכחו מודים שאין שכחה ,עומר שנוטלו להוליכו לעיר ונתנו על גבי חבירו ושכח את שניהן התחתון שכחה והעליון אינו שכחה ,ref-y
10453,ref-sifre-d.283.3.19-ref-sifre-d.283.3.28,ref-y.01.02.5.00.1135-ref-y.01.02.5.00.1153,266886,266952,44583,44592,ref-sifre-d.00283.00003.00019,ref-sifre-d.00283.00003.00028,248230,248337,39171,39188,ref-y.00001.00002.00005.00000.01135,ref-y.00001.00002.00005.00000.01153,ושכחו מודים שאין שכחה העומר ששכחוהו פועלים ולא שכחו בעל הבית ,"פועלין ולא שכחהו בע""ה אינו שכחה עד שישכחוהו כל אדם היה עומד בעיר ואומר יודע אני שהפועלין שכיחין עומרין ",ref-y
10454,ref-sifre-d.283.3.19-ref-sifre-d.283.3.33,ref-y.01.02.5.00.1098-ref-y.01.02.5.00.1113,266886,266975,44583,44596,ref-sifre-d.00283.00003.00019,ref-sifre-d.00283.00003.00033,248024,248118,39134,39149,ref-y.00001.00002.00005.00000.01098,ref-y.00001.00002.00005.00000.01113,ושכחו מודים שאין שכחה העומר ששכחוהו פועלים ולא שכחו בעל הבית שכחו הבית ולא שכחוהו ,"העומר ששכחוהו פועלים ולא שכחו בעה""ב אינה שכחה דכתיב קצירך ושכחת שכחו בע""ה ולא שכחו פועלים ",ref-y
10455,ref-sifre-d.283.3.21-ref-sifre-d.283.3.27,ref-y.01.02.5.00.1164-ref-y.01.02.5.00.1178,266899,266942,44585,44591,ref-sifre-d.00283.00003.00021,ref-sifre-d.00283.00003.00027,248395,248484,39199,39211,ref-y.00001.00002.00005.00000.01164,ref-y.00001.00002.00005.00000.01178,שאין שכחה העומר ששכחוהו פועלים ולא שכחו ,אני שהפועלין שכיחין עומרין במקום פלוני הרי_זו_שכחה שנאמר בשדה ושכחת ולא בעיר ושכחת ,ref-y
10456,ref-sifre-d.283.3.21-ref-sifre-d.283.3.30,ref-y.01.07.3.00.1718-ref-y.01.07.3.00.1733,266899,266957,44585,44593,ref-sifre-d.00283.00003.00021,ref-sifre-d.00283.00003.00030,665160,665257,102296,102310,ref-y.00001.00007.00003.00000.01718,ref-y.00001.00007.00003.00000.01733,שאין שכחה העומר ששכחוהו פועלים ולא שכחו בעל הבית שכחו ,אני שהפועלים שוכחין עומר שבמקום פלוני ושכחוהו הרי זה שכחה דכתיב בשדה ושכחת ולא בעיר ושכחת ,ref-y
10457,ref-sifre-d.283.4.16-ref-sifre-d.283.4.22,ref-y.01.02.6.00.1300-ref-y.01.02.6.00.1306,267115,267151,44621,44626,ref-sifre-d.00283.00004.00016,ref-sifre-d.00283.00004.00022,255804,255839,40400,40405,ref-y.00001.00002.00006.00000.01300,ref-y.00001.00002.00006.00000.01306,העומר שיש בו סאתים ושכחו אין שכחה ,עומר שיש בו סאתים ושכחו אינו שכחה ,ref-y
10458,ref-sifre-d.283.4.16-ref-sifre-d.283.4.24,ref-y.01.02.6.00.1266-ref-y.01.02.6.00.1277,267115,267162,44621,44628,ref-sifre-d.00283.00004.00016,ref-sifre-d.00283.00004.00024,255618,255681,40368,40379,ref-y.00001.00002.00006.00000.01266,ref-y.00001.00002.00006.00000.01277,העומר שיש בו סאתים ושכחו אין שכחה שני עומרים ,"עומר ד""ה שכחה ואין תעבדינא גדיש מחלוקת ב""ש וב""ה שכח שני עומרים ",ref-y
10459,ref-sifre-d.283.5.8-ref-sifre-d.283.5.13,ref-y.01.02.5.00.321-ref-y.01.02.5.00.326,267529,267560,44684,44689,ref-sifre-d.00283.00005.00008,ref-sifre-d.00283.00005.00013,244087,244119,38528,38533,ref-y.00001.00002.00005.00000.00321,ref-y.00001.00002.00005.00000.00326,שבולת של קציר וראשה מגיע לקמה ,שיבולת של קציר וראשה מגיע לקמה ,ref-y
10460,ref-sifre-d.283.5.8-ref-sifre-d.283.5.15,ref-y.01.02.5.00.407-ref-y.01.02.5.00.414,267529,267569,44684,44691,ref-sifre-d.00283.00005.00008,ref-sifre-d.00283.00005.00015,244552,244599,38605,38612,ref-y.00001.00002.00005.00000.00407,ref-y.00001.00002.00005.00000.00414,שבולת של קציר וראשה מגיע לקמה אם נקצרת ,שיבולת של קציר וראשה מגיע לקמה שיבולת שבקציר ,ref-y
10461,ref-sifre-d.283.5.11-ref-sifre-d.283.5.17,ref-y.01.02.5.00.335-ref-y.01.02.5.00.349,267543,267578,44687,44693,ref-sifre-d.00283.00005.00011,ref-sifre-d.00283.00005.00017,244166,244246,38542,38556,ref-y.00001.00002.00005.00000.00335,ref-y.00001.00002.00005.00000.00349,וראשה מגיע לקמה אם נקצרת עם הקמה ,ראשה מגיע לקמה והוא שתהא יכולה להקצר עם הקמה היתה יכולה להקצר עם הקמה ואין ,ref-y
10462,ref-sifre-d.284.3.23-ref-sifre-d.284.3.33,ref-y.01.02.5.00.1028-ref-y.01.02.5.00.1046,268361,268408,44824,44832,ref-sifre-d.00284.00003.00023,ref-sifre-d.00284.00003.00033,247667,247760,39073,39088,ref-y.00001.00002.00005.00000.01028,ref-y.00001.00002.00005.00000.01046,הרי זה גוזל העניים על זה נאמר אל תסג גבול עולם ,"הרי זה גוזל את העניים פועל שעושה כן הרי זה גוזל לבע""ה ולעניי' וע""ז נאמר אל תשיג גבול עולי' ",ref-y
10463,ref-sifre-d.284.6.4-ref-sifre-d.284.6.15,ref-y.01.01.7.00.1527-ref-y.01.01.7.00.1542,268475,268529,44842,44853,ref-sifre-d.00284.00006.00004,ref-sifre-d.00284.00006.00015,142327,142407,22466,22480,ref-y.00001.00001.00007.00000.01527,ref-y.00001.00001.00007.00000.01542,נאמר כאן גר יתום ונאמר להלן גר יתום מה גר יתום האמור ,נאמר כאן תוך ונאמר להלן תוך ויבאו בני ישראל לשבור בר בתוך הבאים מה תוך האמור ,ref-y
10464,ref-sifre-d.284.6.4-ref-sifre-d.284.6.15,ref-y.04.04.1.00.4773-ref-y.04.04.1.00.4781,268475,268529,44842,44853,ref-sifre-d.00284.00006.00004,ref-sifre-d.00284.00006.00015,3076380,3076422,467686,467694,ref-y.00004.00004.00001.00000.04773,ref-y.00004.00004.00001.00000.04781,נאמר כאן גר יתום ונאמר להלן גר יתום מה גר יתום האמור ,נאמר כאן תוך ונאמר להלן תוך מה תוך שנאמר ,ref-y
10465,ref-sifre-d.284.6.4-ref-sifre-d.284.6.16,ref-y.01.01.1.00.2633-ref-y.01.01.1.00.2642,268475,268534,44842,44854,ref-sifre-d.00284.00006.00004,ref-sifre-d.00284.00006.00016,13806,13856,2206,2215,ref-y.00001.00001.00001.00000.02633,ref-y.00001.00001.00001.00000.02642,נאמר כאן גר יתום ונאמר להלן גר יתום מה גר יתום האמור להלן ,נאמר כאן לילה ונאמר להלן לילה מה לילה שנאמר להלן ,ref-y
