,baseOrig,compOrig,baseCharStart,baseCharEnd,baseWdStart,baseWdEnd,baseRefStart,baseRefEnd,compCharStart,compCharEnd,compWdStart,compWdEnd,compRefStart,compRefEnd,baseStr,compStr,compWork
3473,ref-sifre-d.302.1.86-ref-sifre-d.302.1.101,ref-bible.0105.26.12.3-ref-bible.0105.26.12.11,288960,289059,48366,48380,ref-sifre-d.00302.00001.00086,ref-sifre-d.00302.00001.00101,391167,391214,65451,65458,ref-bible.00105.00026.00012.00003,ref-bible.00105.00026.00012.00011,במעשר בבעור תלמוד לומר בשנה השלישית שנה שחייבת במעשר יצאת שנה שביעית שאינה חייבת במעשר יכול ,לעשר את כל מעשר תבואתך בשנה השלישת שנת המעשר ,ref-bible
3474,ref-sifre-d.302.1.117-ref-sifre-d.303.2.3,ref-bible.0105.26.12.3-ref-bible.0105.26.12.19,289132,289241,48391,48404,ref-sifre-d.00302.00001.00117,ref-sifre-d.00303.00002.00003,391167,391270,65451,65466,ref-bible.00105.00026.00012.00003,ref-bible.00105.00026.00012.00019,מעשרות תלמוד לומר מעשר תבואתך ריבה ונתת ללוי לגר_ליתום_ולאלמנה תן לכל_אחד_ואחד חלקו ואכלו בשעריך ושבעו ,לעשר את כל מעשר תבואתך בשנה השלישת שנת המעשר ונתתה ללוי לגר ליתום ולאלמנה ואכלו בשעריך ושבעו ,ref-bible
3475,ref-sifre-d.303.11.10-ref-sifre-d.303.13.11,ref-bible.0105.26.13.15-ref-bible.0105.26.14.7,289829,289927,48505,48521,ref-sifre-d.00303.00011.00010,ref-sifre-d.00303.00013.00011,391354,391439,65476,65491,ref-bible.00105.00026.00013.00015,ref-bible.00105.00026.00014.00007,כלום כאשר צויתני לא נתתיו למי שאינו ראוי לא עברתי ממצותי' ולא הפרשתי ממין על שאינו מינו לא מן ,ככל מצותך אשר צויתני לא עברתי ממצותיך ולא שכחתי לא אכלתי באני ממנו ולא בערתי ממנו ,ref-bible
3476,ref-sifre-d.303.14.1-ref-sifre-d.303.16.4,ref-bible.0105.26.13.22-ref-bible.0105.26.14.8,290018,290129,48540,48559,ref-sifre-d.00303.00014.00001,ref-sifre-d.00303.00016.00004,391394,391445,65483,65492,ref-bible.00105.00026.00013.00022,ref-bible.00105.00026.00014.00008,ולא שכחתי לא שכחתי מהזכיר שמך ולברכך לא אכלתי באוני ממנו הא אם אכלו אינו יכול להתוודות ולא בערתי ממנו בטמא ,ולא שכחתי לא אכלתי באני ממנו ולא בערתי ממנו בטמא ,ref-bible
3477,ref-sifre-d.303.16.14-ref-sifre-d.303.17.7,ref-bible.0105.26.14.5-ref-bible.0105.26.14.12,290173,290210,48569,48576,ref-sifre-d.00303.00016.00014,ref-sifre-d.00303.00017.00007,391424,391465,65489,65496,ref-bible.00105.00026.00014.00005,ref-bible.00105.00026.00014.00012,טמא ולא נתתי ממנו למת לא לקחתי ממנו ,ולא בערתי ממנו בטמא ולא נתתי ממנו למת ,ref-bible
3478,ref-sifre-d.303.18.1-ref-sifre-d.303.19.4,ref-bible.0105.26.14.17-ref-bible.0105.26.15.4,290323,290391,48597,48607,ref-sifre-d.00303.00018.00001,ref-sifre-d.00303.00019.00004,391488,391539,65501,65508,ref-bible.00105.00026.00014.00017,ref-bible.00105.00026.00015.00004,עשיתי ככל אשר צויתני שמחתי ושמחתי בו השקיפה ממעון קדשך מן השמים ,עשיתי ככל אשר צויתני השקיפה ממעון קדשך מן השמים ,ref-bible
3479,ref-sifre-d.303.19.15-ref-sifre-d.303.19.18,ref-bible.0105.26.15.1-ref-bible.0105.26.15.4,290440,290469,48617,48620,ref-sifre-d.00303.00019.00015,ref-sifre-d.00303.00019.00018,391510,391539,65505,65508,ref-bible.00105.00026.00015.00001,ref-bible.00105.00026.00015.00004,השקיפה ממעון קדשך מן השמים ,השקיפה ממעון קדשך מן השמים ,ref-bible
3480,ref-sifre-d.304.1.40-ref-sifre-d.304.1.46,ref-bible.0105.32.4.8-ref-bible.0105.32.4.14,290660,290693,48651,48657,ref-sifre-d.00304.00001.00040,ref-sifre-d.00304.00001.00046,405863,405896,67774,67780,ref-bible.00105.00032.00004.00008,ref-bible.00105.00032.00004.00014,אל אמונה ואין עול צדיק וישר הוא ,אל אמונה ואין עול צדיק וישר הוא ,ref-bible
3481,ref-sifre-d.304.2.47-ref-sifre-d.304.2.60,ref-bible.0304.8.8.1-ref-bible.0304.8.9.4,290938,291011,48696,48708,ref-sifre-d.00304.00002.00047,ref-sifre-d.00304.00002.00060,1341804,1341880,230339,230353,ref-bible.00304.00008.00008.00001,ref-bible.00304.00008.00009.00004,אחות לנו קטנה ושדים אין לה ארבע מלכיות מושלות בהם בישראל ואין בהם נבון ,אחות לנו קטנה ושדים אין לה מה נעשה לאחתנו ביום שידבר בה אם חומה היא נבנה ,ref-bible
3482,ref-sifre-d.304.2.74-ref-sifre-d.304.2.81,ref-bible.0313.18.16.6-ref-bible.0313.18.16.13,291081,291120,48722,48728,ref-sifre-d.00304.00002.00074,ref-sifre-d.00304.00002.00081,1548433,1548471,265654,265661,ref-bible.00313.00018.00016.00006,ref-bible.00313.00018.00016.00013,נפוצים על ההרים כצאן אשר אין להם רועה ,נפוצים על ההרים כצאן אשר אין להן רעה ,ref-bible
3483,ref-sifre-d.304.2.74-ref-sifre-d.304.2.81,ref-bible.0205.22.17.6-ref-bible.0205.22.17.13,291081,291120,48722,48728,ref-sifre-d.00304.00002.00074,ref-sifre-d.00304.00002.00081,710864,710901,120151,120157,ref-bible.00205.00022.00017.00006,ref-bible.00205.00022.00017.00013,נפוצים על ההרים כצאן אשר אין להם רועה ,נפצים אל ההרים כצאן אשר אין להם רעה ,ref-bible
3484,ref-sifre-d.304.2.77-ref-sifre-d.305.1.6,ref-bible.0104.27.17.15-ref-bible.0104.27.18.6,291098,291143,48725,48732,ref-sifre-d.00304.00002.00077,ref-sifre-d.00305.00001.00006,317495,317541,53464,53470,ref-bible.00104.00027.00017.00015,ref-bible.00104.00027.00018.00006,כצאן אשר אין להם רועה ויאמר ה'_אל_משה קח לך ,כצאן אשר אין להם רעה ויאמר_יהוה_אל_משה קח לך ,ref-bible
3485,ref-sifre-d.305.2.95-ref-sifre-d.305.2.107,ref-bible.0105.31.7.1-ref-bible.0105.31.7.12,292233,292302,48923,48934,ref-sifre-d.00305.00002.00095,ref-sifre-d.00305.00002.00107,403308,403371,67375,67385,ref-bible.00105.00031.00007.00001,ref-bible.00105.00031.00007.00012,ויקרא משה ליהושע ויאמר אליו לעיני כל ישראל חזק ואמץ הנה עם שאני ,ויקרא משה ליהושע ויאמר אליו לעיני כל ישראל חזק ואמץ כי אתה ,ref-bible
3486,ref-sifre-d.305.3.132-ref-sifre-d.305.3.147,ref-bible.0304.1.8.1-ref-bible.0304.1.8.16,293211,293292,49090,49103,ref-sifre-d.00305.00003.00132,ref-sifre-d.00305.00003.00147,1335829,1335908,229265,229278,ref-bible.00304.00001.00008.00001,ref-bible.00304.00001.00008.00016,אם לא תדעי לך היפה בנשים צאי לך בעקבי הצאן ורעי את גדיותיך על משכנות הרועים ,אם לא תדעי לך היפה בנשים צאי לך בעקבי הצאן ורעי את גדיתיך על משכנות הרעים ,ref-bible
3487,ref-sifre-d.305.4.18-ref-sifre-d.305.4.23,ref-bible.0220.11.8.1-ref-bible.0220.11.8.6,293563,293596,49149,49153,ref-sifre-d.00305.00004.00018,ref-sifre-d.00305.00004.00023,1144241,1144272,193525,193529,ref-bible.00220.00011.00008.00001,ref-bible.00220.00011.00008.00006,ואכחיד את שלשת הרועים בירח אחד ,ואכחד את שלשת הרעים בירח אחד ,ref-bible
3488,ref-sifre-d.305.4.33-ref-sifre-d.305.4.38,ref-bible.0301.47.10.1-ref-bible.0301.47.10.6,293643,293673,49163,49168,ref-sifre-d.00305.00004.00033,ref-sifre-d.00305.00004.00038,1184877,1184907,200938,200943,ref-bible.00301.00047.00010.00001,ref-bible.00301.00047.00010.00006,נדיבי עמים נאספו עם אלהי אברהם ,נדיבי עמים נאספו עם אלהי אברהם ,ref-bible
3489,ref-sifre-d.305.4.130-ref-sifre-d.305.4.144,ref-bible.0221.2.6.1-ref-bible.0221.2.6.15,294150,294235,49254,49268,ref-sifre-d.00305.00004.00130,ref-sifre-d.00305.00004.00144,1150633,1150717,194602,194616,ref-bible.00221.00002.00006.00001,ref-bible.00221.00002.00006.00015,תורת אמת הייתה בפיהו ועולה לא נמצא בשפתיו בשלום ובמישור הלך אתי ורבים השיב מעון ,תורת אמת היתה בפיהו ועולה לא נמצא בשפתיו בשלום ובמישור הלך אתי ורבים השיב מעון ,ref-bible
3490,ref-sifre-d.306.1.22-ref-sifre-d.306.1.26,ref-bible.0210.12.1.1-ref-bible.0210.12.1.5,295178,295214,49432,49436,ref-sifre-d.00306.00001.00022,ref-sifre-d.00306.00001.00026,1091476,1091511,184465,184469,ref-bible.00210.00012.00001.00001,ref-bible.00210.00012.00001.00005,סבבוני בכחש אפרים ובמרמה בית ישראל ,סבבני בכחש אפרים ובמרמה בית ישראל ,ref-bible
3491,ref-sifre-d.306.1.34-ref-sifre-d.306.1.47,ref-bible.0207.5.3.1-ref-bible.0207.5.4.4,295247,295321,49443,49456,ref-sifre-d.00306.00001.00034,ref-sifre-d.00306.00001.00047,783669,783742,132112,132125,ref-bible.00207.00005.00003.00001,ref-bible.00207.00005.00004.00004,ועתה יושבי ירושלם ואיש יהודה שפטו נא ביני ובין כרמי מה לעשות עוד לכרמי ,ועתה יושב ירושלם ואיש יהודה שפטו נא ביני ובין כרמי מה לעשות עוד לכרמי ,ref-bible
3492,ref-sifre-d.306.1.59-ref-sifre-d.306.1.66,ref-bible.0206.17.13.1-ref-bible.0206.17.13.10,295379,295424,49466,49473,ref-sifre-d.00306.00001.00059,ref-sifre-d.00306.00001.00066,754839,754893,127433,127442,ref-bible.00206.00017.00013.00001,ref-bible.00206.00017.00013.00010,ויעד ה' בישראל וביהודה ביד נביאים כל חוזה ,ויעד יהוה בישראל וביהודה ביד כל נביאו נביאי כל חזה ,ref-bible
3493,ref-sifre-d.306.1.70-ref-sifre-d.306.1.75,ref-bible.0313.36.16.1-ref-bible.0313.36.16.8,295445,295492,49477,49482,ref-sifre-d.00306.00001.00070,ref-sifre-d.00306.00001.00075,1589897,1589959,272240,272247,ref-bible.00313.00036.00016.00001,ref-bible.00313.00036.00016.00008,ויהיו מלעיבים במלאכי אלהים ומתעתעים בנביאיו ,ויהיו מלעבים במלאכי האלהים ובוזים דבריו ומתעתעים בנבאיו ,ref-bible
3494,ref-sifre-d.306.1.91-ref-sifre-d.306.1.109,ref-bible.0208.7.17.1-ref-bible.0208.7.18.14,295575,295684,49495,49512,ref-sifre-d.00306.00001.00091,ref-sifre-d.00306.00001.00109,881298,881431,149746,149764,ref-bible.00208.00007.00017.00001,ref-bible.00208.00007.00018.00014,האינך רואה מה הם עושים הבנים מלקטים עצים והאבות מבערים את האש והנשים לשות בצק לעשות כוונים למלכת השמים ,האינך ראה מה המה עשים בערי_יהודה_ובחצות_ירושלם הבנים מלקטים עצים והאבות מבערים את האש והנשים לשות בצק לעשות כונים למלכת השמים ,ref-bible
3495,ref-sifre-d.306.1.115-ref-sifre-d.306.1.120,ref-bible.0208.6.19.1-ref-bible.0208.6.19.6,295708,295733,49516,49521,ref-sifre-d.00306.00001.00115,ref-sifre-d.00306.00001.00120,879207,879235,149397,149402,ref-bible.00208.00006.00019.00001,ref-bible.00208.00006.00019.00006,שמעי ארץ הנה אני מביא רעה ,שמעי הארץ הנה אנכי מביא רעה ,ref-bible
3496,ref-sifre-d.306.1.124-ref-sifre-d.306.1.128,ref-bible.0210.12.12.9-ref-bible.0210.12.12.15,295753,295779,49525,49529,ref-sifre-d.00306.00001.00124,ref-sifre-d.00306.00001.00128,1092140,1092174,184584,184590,ref-bible.00210.00012.00012.00009,ref-bible.00210.00012.00012.00015,מזבחותם כגלים על תלמי שדי ,זבחו גם מזבחותם כגלים על תלמי שדי ,ref-bible
3497,ref-sifre-d.306.1.186-ref-sifre-d.306.1.191,ref-bible.0207.1.3.1-ref-bible.0207.1.3.6,296079,296111,49577,49582,ref-sifre-d.00306.00001.00186,ref-sifre-d.00306.00001.00191,778455,778486,131197,131202,ref-bible.00207.00001.00003.00001,ref-bible.00207.00001.00003.00006,ידע שור קונהו וחמור אבוס בעליו ,ידע שור קנהו וחמור אבוס בעליו ,ref-bible
3498,ref-sifre-d.306.1.195-ref-sifre-d.306.1.201,ref-bible.0301.106.20.1-ref-bible.0301.106.20.7,296130,296167,49586,49591,ref-sifre-d.00306.00001.00195,ref-sifre-d.00306.00001.00201,1229129,1229165,209091,209096,ref-bible.00301.00106.00020.00001,ref-bible.00301.00106.00020.00007,וימירו את כבודם בתבנית שור אוכל עשב ,וימירו את כבודם בתבנית שור אכל עשב ,ref-bible
3499,ref-sifre-d.306.1.207-ref-sifre-d.306.1.214,ref-bible.0208.8.7.1-ref-bible.0208.8.7.9,296190,296237,49595,49602,ref-sifre-d.00306.00001.00207,ref-sifre-d.00306.00001.00214,883480,883532,150089,150097,ref-bible.00208.00008.00007.00001,ref-bible.00208.00008.00007.00009,גם חסידה בשמים ידעה מועדיה ותור וסיס ועגור ,גם חסידה בשמים ידעה מועדיה ותר וסוס וסיס ועגור ,ref-bible
3500,ref-sifre-d.306.1.219-ref-sifre-d.306.1.224,ref-bible.0209.8.10.2-ref-bible.0209.8.10.8,296262,296295,49607,49612,ref-sifre-d.00306.00001.00219,ref-sifre-d.00306.00001.00224,992933,992969,168107,168113,ref-bible.00209.00008.00010.00002,ref-bible.00209.00008.00010.00008,ואראה והנה תבנית רמש ובהמה שקץ ,ואראה והנה כל תבנית רמש ובהמה שקץ ,ref-bible
3501,ref-sifre-d.306.1.230-ref-sifre-d.306.1.237,ref-bible.0303.12.8.1-ref-bible.0303.12.8.8,296320,296359,49616,49623,ref-sifre-d.00306.00001.00230,ref-sifre-d.00306.00001.00237,1304487,1304525,223236,223243,ref-bible.00303.00012.00008.00001,ref-bible.00303.00012.00008.00008,או שיח לארץ ותורך ויספרו לך דגי הים ,או שיח לארץ ותרך ויספרו לך דגי הים ,ref-bible
3502,ref-sifre-d.306.1.250-ref-sifre-d.306.1.263,ref-bible.0302.6.6.1-ref-bible.0302.6.8.3,296425,296488,49634,49646,ref-sifre-d.00306.00001.00250,ref-sifre-d.00306.00001.00263,1262724,1262797,215153,215167,ref-bible.00302.00006.00006.00001,ref-bible.00302.00006.00008.00003,לך אל נמלה עצל ראה דרכיה וחכם אשר אין לה קצין תכין בקיץ לחמה ,לך אל נמלה עצל ראה דרכיה וחכם אשר אין לה קצין שטר ומשל תכין בקיץ לחמה ,ref-bible
3503,ref-sifre-d.306.2.38-ref-sifre-d.306.2.43,ref-bible.0208.2.23.9-ref-bible.0208.2.23.14,296811,296837,49703,49708,ref-sifre-d.00306.00002.00038,ref-sifre-d.00306.00002.00043,870288,870314,147789,147794,ref-bible.00208.00002.00023.00009,ref-bible.00208.00002.00023.00014,ראי דרכך בגיא דעי מה עשית ,ראי דרכך בגיא דעי מה עשית ,ref-bible
3504,ref-sifre-d.306.2.109-ref-sifre-d.306.2.119,ref-bible.0208.3.1.1-ref-bible.0208.3.1.11,297180,297234,49770,49779,ref-sifre-d.00306.00002.00109,ref-sifre-d.00306.00002.00119,871336,871390,147986,147995,ref-bible.00208.00003.00001.00001,ref-bible.00208.00003.00001.00011,לאמר הן ישלח איש את אשתו והלכה מאתו והיתה לאיש אחר ,לאמר הן ישלח איש את אשתו והלכה מאתו והיתה לאיש אחר ,ref-bible
3505,ref-sifre-d.306.2.116-ref-sifre-d.306.2.134,ref-bible.0202.14.2.13-ref-bible.0202.14.3.15,297212,297300,49776,49792,ref-sifre-d.00306.00002.00116,ref-sifre-d.00306.00002.00134,498290,498377,83251,83267,ref-bible.00202.00014.00002.00013,ref-bible.00202.00014.00003.00015,מאתו והיתה לאיש אחר אומר לה כלום הכתבתי לך אלא איש והלא_כבר_נאמר כי אל אנכי ולא איש ,אותה לי לאשה ויאמר לו אביו ואמו האין בבנות אחיך ובכל עמי אשה כי אתה הולך לקחת אשה ,ref-bible
3506,ref-sifre-d.306.2.148-ref-sifre-d.306.2.159,ref-bible.0207.50.1.6-ref-bible.0207.50.1.17,297360,297417,49801,49812,ref-sifre-d.00306.00002.00148,ref-sifre-d.00306.00002.00159,846322,846379,143490,143501,ref-bible.00207.00050.00001.00006,ref-bible.00207.00050.00001.00017,ספר כריתות אמכם אשר שלחתיה או מי מנושי אשר מכרתי אתכם לו ,ספר כריתות אמכם אשר שלחתיה או מי מנושי אשר מכרתי אתכם לו ,ref-bible
3507,ref-sifre-d.306.3.68-ref-sifre-d.306.3.78,ref-bible.0303.20.27.1-ref-bible.0303.20.27.6,297777,297839,49870,49880,ref-sifre-d.00306.00003.00068,ref-sifre-d.00306.00003.00078,1312676,1312708,224811,224816,ref-bible.00303.00020.00027.00001,ref-bible.00303.00020.00027.00006,יגלו שמים עוונו ומנין שאף הארץ מודעת שנא' וארץ מתקוממה לו ,יגלו שמים עונו וארץ מתקוממה לו ,ref-bible
3508,ref-sifre-d.306.4.58-ref-sifre-d.306.4.72,ref-bible.0105.28.12.1-ref-bible.0105.28.12.16,298413,298487,49975,49987,ref-sifre-d.00306.00004.00058,ref-sifre-d.00306.00004.00072,394308,394382,65906,65918,ref-bible.00105.00028.00012.00001,ref-bible.00105.00028.00012.00016,יפתח ה' לך את אוצרו הטוב את השמים לתת מטר ארצך בעתו וכשאין ישראל עושים ,יפתח יהוה לך את אוצרו הטוב את השמים לתת מטר ארצך בעתו ולברך את כל מעשה ,ref-bible
3509,ref-sifre-d.306.4.83-ref-sifre-d.306.4.93,ref-bible.0105.11.17.5-ref-bible.0105.11.17.15,298530,298583,49990,49997,ref-sifre-d.00306.00004.00083,ref-sifre-d.00306.00004.00093,363937,363990,60860,60867,ref-bible.00105.00011.00017.00005,ref-bible.00105.00011.00017.00015,ועצר את השמים ולא יהיה מטר והאדמה לא תתן את יבולה ,ועצר את השמים ולא יהיה מטר והאדמה לא תתן את יבולה ,ref-bible
3510,ref-sifre-d.306.7.49-ref-sifre-d.306.7.56,ref-bible.0301.19.6.1-ref-bible.0301.19.6.8,299483,299529,50136,50143,ref-sifre-d.00306.00007.00049,ref-sifre-d.00306.00007.00056,1164216,1164259,197096,197103,ref-bible.00301.00019.00006.00001,ref-bible.00301.00019.00006.00008,והוא כחתן יוצא מחופתו ישיש כגבור לרוץ אורח ,והוא כחתן יצא מחפתו ישיש כגבור לרוץ ארח ,ref-bible
3511,ref-sifre-d.306.8.43-ref-sifre-d.306.8.59,ref-bible.0208.5.22.1-ref-bible.0208.5.22.16,299751,299831,50181,50197,ref-sifre-d.00306.00008.00043,ref-sifre-d.00306.00008.00059,877250,877322,149039,149054,ref-bible.00208.00005.00022.00001,ref-bible.00208.00005.00022.00016,ואותי לא תיראו נאם ה' אם מפני לא תחילו אשר שמתי חול גבול לים שמשעה שגזרתי על ,האותי לא תיראו נאם יהוה אם מפני לא תחילו אשר שמתי חול גבול לים חק עולם ,ref-bible
3512,ref-sifre-d.306.8.73-ref-sifre-d.306.8.80,ref-bible.0303.38.10.1-ref-bible.0303.38.11.5,299900,299939,50209,50216,ref-sifre-d.00306.00008.00073,ref-sifre-d.00306.00008.00080,1329762,1329820,228126,228136,ref-bible.00303.00038.00010.00001,ref-bible.00303.00038.00011.00005,ואשבר עליו חוקי ואומר עד פה תבוא ולא ,ואשבר עליו חקי ואשים בריח ודלתים ואמר עד פה תבוא ולא ,ref-bible
3513,ref-sifre-d.306.9.18-ref-sifre-d.306.9.32,ref-bible.0105.17.7.1-ref-bible.0105.17.7.9,300394,300476,50296,50309,ref-sifre-d.00306.00009.00018,ref-sifre-d.00306.00009.00032,375493,375538,62701,62709,ref-bible.00105.00017.00007.00001,ref-bible.00105.00017.00007.00009,"יד העדים תהיה בו בראשונה להמיתו ואח""כ בני אדם שמשתמשים ובאים שנא' ויד כל העם ",יד העדים תהיה בו בראשנה להמיתו ויד כל העם ,ref-bible
3514,ref-sifre-d.306.9.18-ref-sifre-d.306.9.32,ref-bible.0105.13.10.4-ref-bible.0105.13.10.11,300394,300476,50296,50309,ref-sifre-d.00306.00009.00018,ref-sifre-d.00306.00009.00032,368874,368913,61621,61628,ref-bible.00105.00013.00010.00004,ref-bible.00105.00013.00010.00011,"יד העדים תהיה בו בראשונה להמיתו ואח""כ בני אדם שמשתמשים ובאים שנא' ויד כל העם ",ידך תהיה בו בראשונה להמיתו ויד כל העם ,ref-bible
3515,ref-sifre-d.306.10.41-ref-sifre-d.306.10.55,ref-bible.0201.10.12.9-ref-bible.0201.10.13.4,300939,301028,50379,50393,ref-sifre-d.00306.00010.00041,ref-sifre-d.00306.00010.00055,432184,432280,72181,72195,ref-bible.00201.00010.00012.00009,ref-bible.00201.00010.00013.00004,נאמר ביהושע ויאמר לעיני ישראל שמש בגבעון דום וירח בעמק אילון וידום השמש וירח עמד ,האמרי לפני בני_ישראל_ויאמר לעיני ישראל שמש בגבעון דום וירח בעמק אילון וידם השמש וירח עמד ,ref-bible
3516,ref-sifre-d.306.13.10-ref-sifre-d.306.13.17,ref-bible.0102.20.22.6-ref-bible.0102.20.22.16,301904,301944,50536,50542,ref-sifre-d.00306.00013.00010,ref-sifre-d.00306.00013.00017,146163,146214,25678,25685,ref-bible.00102.00020.00022.00006,ref-bible.00102.00020.00022.00016,שנאמר אתם ראיתם כי מן השמים דברתי עמכם ,תאמר אל_בני_ישראל אתם ראיתם כי מן השמים דברתי עמכם ,ref-bible
3517,ref-sifre-d.306.14.4-ref-sifre-d.306.14.15,ref-bible.0205.21.6.18-ref-bible.0205.21.7.2,302033,302095,50553,50563,ref-sifre-d.00306.00014.00004,ref-sifre-d.00306.00014.00015,707541,707599,119603,119614,ref-bible.00205.00021.00006.00018,ref-bible.00205.00021.00007.00002,שלא עשו מצוות שניתנו להם מן השמים ואלו הם מצות שניתנו להם ,אתה אתנה לך כרם תחתיו ויאמר לא אתן לך את כרמי ותאמר אליו ,ref-bible
3518,ref-sifre-d.306.15.63-ref-sifre-d.306.15.68,ref-bible.0105.31.19.13-ref-bible.0105.31.19.18,302600,302630,50640,50645,ref-sifre-d.00306.00015.00063,ref-sifre-d.00306.00015.00068,404624,404654,67576,67581,ref-bible.00105.00031.00019.00013,ref-bible.00105.00031.00019.00018,למען תהיה לי השירה הזאת לעד ,למען תהיה לי השירה הזאת לעד ,ref-bible
3519,ref-sifre-d.306.15.84-ref-sifre-d.306.15.89,ref-bible.0221.3.5.1-ref-bible.0221.3.5.6,302713,302747,50661,50666,ref-sifre-d.00306.00015.00084,ref-sifre-d.00306.00015.00089,1152016,1152052,194846,194851,ref-bible.00221.00003.00005.00001,ref-bible.00221.00003.00005.00006,וקרבתי לכם למשפט והייתי עד ממהר ,וקרבתי אליכם למשפט והייתי עד ממהר ,ref-bible
3520,ref-sifre-d.306.15.88-ref-sifre-d.306.15.98,ref-bible.0105.31.26.12-ref-bible.0105.31.27.5,302740,302800,50665,50675,ref-sifre-d.00306.00015.00088,ref-sifre-d.00306.00015.00098,405261,405306,67674,67682,ref-bible.00105.00031.00026.00012,ref-bible.00105.00031.00027.00005,עד ממהר ואומר ואנכי היודע ועד ואומר ויהי ה' אלהיכם בכם ,אלהיכם והיה שם בך לעד כי אנכי ידעתי את מריך ,ref-bible
3521,ref-sifre-d.306.27.51-ref-sifre-d.306.27.56,ref-bible.0302.7.26.1-ref-bible.0302.7.26.7,305415,305450,51111,51116,ref-sifre-d.00306.00027.00051,ref-sifre-d.00306.00027.00056,1264809,1264845,215558,215564,ref-bible.00302.00007.00026.00001,ref-bible.00302.00007.00026.00007,כי רבים חללים הפילה ועצומים הרוגיה ,כי רבים חללים הפילה ועצמים כל הרגיה ,ref-bible
3522,ref-sifre-d.306.28.24-ref-sifre-d.306.28.29,ref-bible.0302.5.15.4-ref-bible.0302.5.16.3,305573,305611,51135,51140,ref-sifre-d.00306.00028.00024,ref-sifre-d.00306.00028.00029,1262190,1262227,215054,215059,ref-bible.00302.00005.00015.00004,ref-bible.00302.00005.00016.00003,ונוזלים מתוך בארך יפוצו מעייניך חוצה ,ונזלים מתוך בארך יפוצו מעינתיך חוצה ,ref-bible
3523,ref-sifre-d.306.33.15-ref-sifre-d.306.33.22,ref-bible.0205.18.45.1-ref-bible.0205.18.45.8,306681,306722,51317,51324,ref-sifre-d.00306.00033.00015,ref-sifre-d.00306.00033.00022,700953,700992,118471,118478,ref-bible.00205.00018.00045.00001,ref-bible.00205.00018.00045.00008,ויהי עד כה ועד כה והשמים התקדרו בעבים ,ויהי עד כה ועד כה והשמים התקדרו עבים ,ref-bible
3524,ref-sifre-d.306.35.85-ref-sifre-d.306.35.102,ref-bible.0301.82.6.1-ref-bible.0301.82.7.3,307738,307833,51491,51507,ref-sifre-d.00306.00035.00085,ref-sifre-d.00306.00035.00102,1211581,1211634,205873,205882,ref-bible.00301.00082.00006.00001,ref-bible.00301.00082.00007.00003,אני אמרתי אלהים אתם ובני עליון כלכם לא עשה תורה ולא רצון אביו שבשמים שנאמר אכן כאדם תמותון ,אני אמרתי אלהים אתם ובני עליון כלכם אכן כאדם תמותון ,ref-bible
3525,ref-sifre-d.306.35.121-ref-sifre-d.306.35.128,ref-bible.0301.50.4.1-ref-bible.0301.50.4.8,307921,307959,51522,51529,ref-sifre-d.00306.00035.00121,ref-sifre-d.00306.00035.00128,1186502,1186541,201249,201256,ref-bible.00301.00050.00004.00001,ref-bible.00301.00050.00004.00008,יקרא אל השמים מעל ואל הארץ לדון עמו ,יקרא אל השמים מעל ואל הארץ לדין עמו ,ref-bible
3526,ref-sifre-d.306.36.32-ref-sifre-d.306.36.41,ref-bible.0207.6.3.1-ref-bible.0207.6.3.10,308238,308282,51577,51586,ref-sifre-d.00306.00036.00032,ref-sifre-d.00306.00036.00041,785764,785810,132488,132497,ref-bible.00207.00006.00003.00001,ref-bible.00207.00006.00003.00010,וקרא זה אל זה ואמר קדוש קדוש קדוש ה' צבאות ,וקרא זה אל זה ואמר קדוש קדוש קדוש יהוה צבאות ,ref-bible
