,baseOrig,compOrig,baseCharStart,baseCharEnd,baseWdStart,baseWdEnd,baseRefStart,baseRefEnd,compCharStart,compCharEnd,compWdStart,compWdEnd,compRefStart,compRefEnd,baseStr,compStr,compWork
3174,ref-sifre-d.150.1.21-ref-sifre-d.150.2.2,ref-bible.0105.17.5.24-ref-bible.0105.17.6.10,180346,180414,30089,30099,ref-sifre-d.00150.00001.00021,ref-sifre-d.00150.00002.00002,375427,375474,62688,62697,ref-bible.00105.00017.00005.00024,ref-bible.00105.00017.00006.00010,המומתים תלמוד לומר על_פי_שנים עדים או שלשה עדים יומת המת מנין שלא ,ומתו על פי שנים עדים או שלשה עדים יומת המת לא ,ref-bible
3175,ref-sifre-d.150.3.10-ref-sifre-d.151.2.4,ref-bible.0105.17.6.7-ref-bible.0105.17.7.9,180507,180615,30113,30130,ref-sifre-d.00150.00003.00010,ref-sifre-d.00151.00002.00004,375457,375538,62694,62709,ref-bible.00105.00017.00006.00007,ref-bible.00105.00017.00007.00009,יומת על_פי_עד_אחד יד העדים תהיה בו בראשונה להמיתו ויד כל העם באחרונה מצוה בעדים להמיתו ומנין שאם לא מת ,עדים יומת המת לא יומת על פי עד אחד יד העדים תהיה בו בראשנה להמיתו ויד כל העם ,ref-bible
3176,ref-sifre-d.151.1.1-ref-sifre-d.151.1.9,ref-bible.0105.13.10.4-ref-bible.0105.13.10.11,180525,180570,30115,30123,ref-sifre-d.00151.00001.00001,ref-sifre-d.00151.00001.00009,368874,368913,61621,61628,ref-bible.00105.00013.00010.00004,ref-bible.00105.00013.00010.00011,יד העדים תהיה בו בראשונה להמיתו ויד כל העם ,ידך תהיה בו בראשונה להמיתו ויד כל העם ,ref-bible
3177,ref-sifre-d.152.4.1-ref-sifre-d.152.8.1,ref-bible.0105.17.8.5-ref-bible.0105.17.8.15,180784,180956,30162,30194,ref-sifre-d.00152.00004.00001,ref-sifre-d.00152.00008.00001,375580,375633,62716,62726,ref-bible.00105.00017.00008.00005,ref-bible.00105.00017.00008.00015,למשפט זה הדין בין דם לדם בין דם נידה לדם זיבה לדם יולדת בין דין לדין בין דיני ממונות לדיני נפשות לדיני מכות בין נגע לנגע בין נגעי אדם לנגעי בתים לנגעי בגדים דברי ,למשפט בין דם לדם בין דין לדין ובין נגע לנגע דברי ,ref-bible
3178,ref-sifre-d.153.5.1-ref-sifre-d.154.1.10,ref-bible.0105.17.9.11-ref-bible.0105.17.10.10,182075,182170,30384,30400,ref-sifre-d.00153.00005.00001,ref-sifre-d.00154.00001.00010,375747,375826,62744,62757,ref-bible.00105.00017.00009.00011,ref-bible.00105.00017.00010.00010,ודרשת והגידו לך את דבר המשפט אלו דקדוקי משפט ועשית על פי הדבר אשר יגידו לך מן המקום ההוא ,ודרשת והגידו לך את דבר המשפט ועשית על פי הדבר אשר יגידו לך מן המקום ההוא ,ref-bible
3179,ref-sifre-d.154.2.14-ref-sifre-d.154.5.2,ref-bible.0105.17.11.6-ref-bible.0105.17.11.20,182339,182453,30427,30445,ref-sifre-d.00154.00002.00014,ref-sifre-d.00154.00005.00002,375892,375963,62768,62782,ref-bible.00105.00017.00011.00006,ref-bible.00105.00017.00011.00020,על דברי סופרים ועל המשפט אשר יאמרו לך תעשה זו_מצות_עשה לא תסור מן הדבר אשר יגידו לך זו_מצות_לא_תעשה ימין ושמאל ,ועל המשפט אשר יאמרו לך תעשה לא תסור מן הדבר אשר יגידו לך ימין ושמאל ,ref-bible
3180,ref-sifre-d.154.5.13-ref-sifre-d.155.1.6,ref-bible.0105.17.11.18-ref-bible.0105.17.12.6,182509,182553,30456,30463,ref-sifre-d.00154.00005.00013,ref-sifre-d.00155.00001.00006,375949,375997,62780,62787,ref-bible.00105.00017.00011.00018,ref-bible.00105.00017.00012.00006,שמאל שמע להם והאיש אשר יעשה בזדון ולא שמע ,לך ימין ושמאל והאיש אשר יעשה בזדון לבלתי שמע ,ref-bible
3181,ref-sifre-d.155.4.1-ref-sifre-d.155.5.4,ref-bible.0105.17.12.5-ref-bible.0105.17.12.10,182667,182728,30483,30494,ref-sifre-d.00155.00004.00001,ref-sifre-d.00155.00005.00004,375987,376016,62786,62791,ref-bible.00105.00017.00012.00005,ref-bible.00105.00017.00012.00010,לבלתי שמוע אל הכהן ולא שומע מפי שומע אל הכהן העומד לשרת ,לבלתי שמע אל הכהן העמד לשרת ,ref-bible
3182,ref-sifre-d.156.3.1-ref-sifre-d.156.4.4,ref-bible.0105.17.14.10-ref-bible.0105.17.14.16,183062,183118,30548,30557,ref-sifre-d.00156.00003.00001,ref-sifre-d.00156.00004.00004,376160,376199,62814,62820,ref-bible.00105.00017.00014.00010,ref-bible.00105.00017.00014.00016,וירשתה וישבתה בה בשכר שתירש תשב ואמרת אשימה עלי מלך ,וירשתה וישבתה בה ואמרת אשימה עלי מלך ,ref-bible
3183,ref-sifre-d.156.4.15-ref-sifre-d.156.4.24,ref-bible.0203.8.7.10-ref-bible.0203.8.7.20,183169,183217,30568,30576,ref-sifre-d.00156.00004.00015,ref-sifre-d.00156.00004.00024,531560,531609,88998,89007,ref-bible.00203.00008.00007.00010,ref-bible.00203.00008.00007.00020,שנאמר כי לא אותך מאסו כי אותי מאסו ממלוך עליהם ,יאמרו אליך כי לא אתך מאסו כי אתי מאסו ממלך עליהם ,ref-bible
3184,ref-sifre-d.156.6.17-ref-sifre-d.156.6.28,ref-bible.0203.8.19.11-ref-bible.0203.8.20.12,183447,183522,30615,30625,ref-sifre-d.00156.00006.00017,ref-sifre-d.00156.00006.00028,532426,532510,89143,89155,ref-bible.00203.00008.00019.00011,ref-bible.00203.00008.00020.00012,והיינו גם אנחנו ככל הגוים ושפטנו מלכנו ויצא לפנינו ונלחם את מלחמותינו ,יהיה עלינו והיינו גם אנחנו ככל הגוים ושפטנו מלכנו ויצא לפנינו ונלחם את מלחמתנו ,ref-bible
3185,ref-sifre-d.157.5.1-ref-sifre-d.157.6.9,ref-bible.0105.17.15.1-ref-bible.0105.17.15.13,183619,183677,30643,30652,ref-sifre-d.00157.00005.00001,ref-sifre-d.00157.00006.00009,376222,376282,62823,62832,ref-bible.00105.00017.00015.00001,ref-bible.00105.00017.00015.00013,אחיך ולא אחרים תשים עליך מלך והלא_כבר_נאמר שום תשים עליך ,שום תשים עליך מלך אשר_יבחר_יהוה_אלהיך בו מקרב אחיך תשים עליך ,ref-bible
3186,ref-sifre-d.157.8.3-ref-sifre-d.157.9.6,ref-bible.0105.17.15.1-ref-bible.0105.17.15.20,183954,184009,30699,30709,ref-sifre-d.00157.00008.00003,ref-sifre-d.00157.00009.00006,376222,376312,62823,62839,ref-bible.00105.00017.00015.00001,ref-bible.00105.00017.00015.00020,שום תשים עליך מלך זו_מצות_עשה לא תוכל לתת עליך איש נכרי ,שום תשים עליך מלך אשר_יבחר_יהוה_אלהיך בו מקרב אחיך תשים עליך מלך לא תוכל לתת עליך איש נכרי ,ref-bible
3187,ref-sifre-d.160.1.15-ref-sifre-d.160.2.8,ref-bible.0105.17.18.3-ref-bible.0105.17.18.13,185072,185122,30877,30886,ref-sifre-d.00160.00001.00015,ref-sifre-d.00160.00002.00008,376506,376556,62878,62887,ref-bible.00105.00017.00018.00003,ref-bible.00105.00017.00018.00013,על כסא ממלכתו וכתב לו את משנה התורה הזאת על ספר ,על כסא ממלכתו וכתב לו את משנה התורה הזאת על ספר ,ref-bible
3188,ref-sifre-d.161.3.64-ref-sifre-d.161.3.71,ref-bible.0105.17.19.20-ref-bible.0105.17.20.4,185955,186002,31029,31036,ref-sifre-d.00161.00003.00064,ref-sifre-d.00161.00003.00071,376668,376714,62902,62909,ref-bible.00105.00017.00019.00020,ref-bible.00105.00017.00020.00004,ואת החקים האלה לעשותם לבלתי רום לבבו מאחיו ,ואת החקים האלה לעשתם לבלתי רום לבבו מאחיו ,ref-bible
3189,ref-sifre-d.162.1.1-ref-sifre-d.162.4.2,ref-bible.0105.17.20.1-ref-bible.0105.17.20.17,186212,186421,31073,31108,ref-sifre-d.00162.00001.00001,ref-sifre-d.00162.00004.00002,376692,376786,62906,62921,ref-bible.00105.00017.00020.00001,ref-bible.00105.00017.00020.00017,לבלתי רום לבבו מאחיו ולא משל הקדש הקודם ולבלתי סור מן המצוה ימין ושמאל שלא יסור מן המצוה ימין ושמאל למען יאריך ימים על ממלכתו אם עושה הוא מה שכתוב בענין כדאי הוא שיאריך ימים על ממלכתו הוא ובניו ,לבלתי רום לבבו מאחיו ולבלתי סור מן המצוה ימין ושמאול למען יאריך ימים על ממלכתו הוא ובניו ,ref-bible
3190,ref-sifre-d.162.5.9-ref-sifre-d.162.5.18,ref-bible.0205.3.13.1-ref-bible.0205.3.13.10,186616,186656,31141,31149,ref-sifre-d.00162.00005.00009,ref-sifre-d.00162.00005.00018,654570,654609,110680,110688,ref-bible.00205.00003.00013.00001,ref-bible.00205.00003.00013.00010,וגם אשר לא שאלת נתתי לך גם עושר גם כבוד ,וגם אשר לא שאלת נתתי לך גם עשר גם כבוד ,ref-bible
3191,ref-sifre-d.162.5.39-ref-sifre-d.162.5.56,ref-bible.0205.9.4.1-ref-bible.0205.9.4.18,186745,186838,31166,31183,ref-sifre-d.00162.00005.00039,ref-sifre-d.00162.00005.00056,672893,672983,113784,113801,ref-bible.00205.00009.00004.00001,ref-bible.00205.00009.00004.00018,ואתה אם תלך לפני כאשר הלך דוד אביך בתם לבב וביושר לעשות ככל אשר צויתיך חוקי ומשפטי תשמור ,ואתה אם תלך לפני כאשר הלך דוד אביך בתם לבב ובישר לעשות ככל אשר צויתיך חקי ומשפטי תשמר ,ref-bible
3192,ref-sifre-d.162.5.39-ref-sifre-d.162.5.56,ref-bible.0313.7.17.1-ref-bible.0313.7.17.15,186745,186838,31166,31183,ref-sifre-d.00162.00005.00039,ref-sifre-d.00162.00005.00056,1530290,1530370,262634,262648,ref-bible.00313.00007.00017.00001,ref-bible.00313.00007.00017.00015,ואתה אם תלך לפני כאשר הלך דוד אביך בתם לבב וביושר לעשות ככל אשר צויתיך חוקי ומשפטי תשמור ,ואתה אם תלך לפני כאשר הלך דויד אביך ולעשות ככל אשר צויתיך וחקי ומשפטי תשמור ,ref-bible
3193,ref-sifre-d.163.1.1-ref-sifre-d.163.1.9,ref-bible.0105.18.1.1-ref-bible.0105.18.1.9,186856,186900,31186,31193,ref-sifre-d.00163.00001.00001,ref-sifre-d.00163.00001.00009,376798,376842,62924,62931,ref-bible.00105.00018.00001.00001,ref-bible.00105.00018.00001.00009,לא יהיה לכהנים הלוים כל שבט לוי חלק ונחלה ,לא יהיה לכהנים הלוים כל שבט לוי חלק ונחלה ,ref-bible
3194,ref-sifre-d.164.3.2-ref-sifre-d.165.1.4,ref-bible.0105.18.2.8-ref-bible.0105.18.3.4,187186,187243,31244,31255,ref-sifre-d.00164.00003.00002,ref-sifre-d.00165.00001.00004,376909,376953,62943,62951,ref-bible.00105.00018.00002.00008,ref-bible.00105.00018.00003.00004,הוא נחלתו כאשר דבר לו להגיד מה גרם וזה יהיה משפט הכהנים ,הוא נחלתו כאשר דבר לו וזה יהיה משפט הכהנים ,ref-bible
3195,ref-sifre-d.165.2.28-ref-sifre-d.165.4.3,ref-bible.0105.18.3.1-ref-bible.0105.18.3.9,187436,187526,31285,31300,ref-sifre-d.00165.00002.00028,ref-sifre-d.00165.00004.00003,376931,376979,62948,62956,ref-bible.00105.00018.00003.00001,ref-bible.00105.00018.00003.00009,וזה יהיה משפט הכהנים מאת העם לא מאת אחריםגוים ולא מאת אחיו הכהנים מאת זובחי הזבח ,וזה יהיה משפט הכהנים מאת העם מאת זבחי הזבח ,ref-bible
3196,ref-sifre-d.165.14.14-ref-sifre-d.165.14.19,ref-bible.0104.25.7.8-ref-bible.0104.25.7.13,188467,188500,31455,31460,ref-sifre-d.00165.00014.00014,ref-sifre-d.00165.00014.00019,311765,311797,52587,52592,ref-bible.00104.00025.00007.00008,ref-bible.00104.00025.00007.00013,ויקם מתוך העדה ויקח רומח בידו ,ויקם מתוך העדה ויקח רמח בידו ,ref-bible
3197,ref-sifre-d.166.7.18-ref-sifre-d.166.7.23,ref-bible.0207.7.21.4-ref-bible.0207.7.21.9,189207,189234,31590,31595,ref-sifre-d.00166.00007.00018,ref-sifre-d.00166.00007.00023,787997,788024,132899,132904,ref-bible.00207.00007.00021.00004,ref-bible.00207.00007.00021.00009,יחיה איש עגלת בקר ושתי צאן ,יחיה איש עגלת בקר ושתי צאן ,ref-bible
3198,ref-sifre-d.166.9.4-ref-sifre-d.167.1.10,ref-bible.0105.18.4.5-ref-bible.0105.18.5.9,189295,189372,31603,31618,ref-sifre-d.00166.00009.00004,ref-sifre-d.00167.00001.00010,377052,377116,62970,62983,ref-bible.00105.00018.00004.00005,ref-bible.00105.00018.00005.00009,ראשית גז שתים צאנך ארבע תתן הרי חמש כי בו בחר ה'_א_להיך מכל שבטיך לעמוד לשרת ,וראשית גז צאנך תתן לו כי בו בחר יהוה אלהיך מכל שבטיך לעמד לשרת ,ref-bible
3199,ref-sifre-d.168.2.1-ref-sifre-d.168.3.4,ref-bible.0105.18.6.6-ref-bible.0105.18.6.15,189675,189740,31666,31678,ref-sifre-d.00168.00002.00001,ref-sifre-d.00168.00003.00004,377174,377217,62994,63003,ref-bible.00105.00018.00006.00006,ref-bible.00105.00018.00006.00015,מכל ישראל אשר הוא גר שם מכל מקומות מושבותיהם ובא בכל אות נפשו ,מכל ישראל אשר הוא גר שם ובא בכל אות נפשו ,ref-bible
3200,ref-sifre-d.168.4.14-ref-sifre-d.168.4.19,ref-bible.0105.18.6.12-ref-bible.0105.18.7.2,189897,189925,31704,31709,ref-sifre-d.00168.00004.00014,ref-sifre-d.00168.00004.00019,377199,377250,63000,63006,ref-bible.00105.00018.00006.00012,ref-bible.00105.00018.00007.00002,ובא בכל אות נפשו ושרת בשם ,ובא בכל אות נפשו אל_המקום_אשר_יבחר_יהוה ושרת בשם ,ref-bible
3201,ref-sifre-d.169.3.18-ref-sifre-d.170.3.6,ref-bible.0105.18.8.4-ref-bible.0105.18.9.16,190511,190715,31803,31831,ref-sifre-d.00169.00003.00018,ref-sifre-d.00170.00003.00006,377316,377412,63019,63033,ref-bible.00105.00018.00008.00004,ref-bible.00105.00018.00009.00016,לבד ממכריו על האבות מה מכרו האבות זה לזה אני בשבתיבשבת שבוע שליואתה בשבתך כי אתה בא אל הארץ עשה_מצוה_האמורה_בענין_שבשכרה תכנס לארץ אשר_ה'_א_להיך_נותן_לך בשכרה לא תלמד לעשות כתועבות הגוים ההם ,לבד ממכריו על האבות כי אתה בא אל הארץ_אשר_יהוה_אלהיך_נתן_לך לא תלמד לעשות כתועבת הגוים ההם ,ref-bible
3202,ref-sifre-d.171.1.1-ref-sifre-d.171.2.4,ref-bible.0105.18.10.1-ref-bible.0105.18.10.7,190809,190861,31847,31856,ref-sifre-d.00171.00001.00001,ref-sifre-d.00171.00002.00004,377413,377444,63034,63040,ref-bible.00105.00018.00010.00001,ref-bible.00105.00018.00010.00007,לא ימצא בך להזהיר בית דין על כך מעביר בנו ובתו באש ,לא ימצא בך מעביר בנו ובתו באש ,ref-bible
3203,ref-sifre-d.171.3.25-ref-sifre-d.171.3.39,ref-bible.0206.6.28.1-ref-bible.0206.6.28.9,191063,191147,31884,31898,ref-sifre-d.00171.00003.00025,ref-sifre-d.00171.00003.00039,728390,728435,123163,123171,ref-bible.00206.00006.00028.00001,ref-bible.00206.00006.00028.00009,מה העברה האמורה כאן באש אף העברה האמורה להן באש ומה העברה האמורה להן למולך ,ויאמר לה המלך מה לך ותאמר האשה הזאת אמרה ,ref-bible
3204,ref-sifre-d.171.4.19-ref-sifre-d.171.4.29,ref-bible.0105.18.10.1-ref-bible.0105.18.10.7,191353,191404,31931,31939,ref-sifre-d.00171.00004.00019,ref-sifre-d.00171.00004.00029,377413,377444,63034,63040,ref-bible.00105.00018.00010.00001,ref-bible.00105.00018.00010.00007,לא שמענו תלמוד_לומר_לא ימצא בך מעביר בנו ובתו באש ,לא ימצא בך מעביר בנו ובתו באש ,ref-bible
3205,ref-sifre-d.171.4.29-ref-sifre-d.171.4.42,ref-bible.0101.15.17.10-ref-bible.0101.15.18.8,191400,191477,31939,31952,ref-sifre-d.00171.00004.00029,ref-sifre-d.00171.00004.00042,24737,24804,4290,4302,ref-bible.00101.00015.00017.00010,ref-bible.00101.00015.00018.00008,באש זה שהוא מעביר בנו ובתו לעבודת כוכבים וכורת עמה ברית שנאמר העגל אשר ,אש אשר עבר בין הגזרים האלה ביום ההוא כרת יהוה את אברם ברית לאמר ,ref-bible
3206,ref-sifre-d.171.4.41-ref-sifre-d.171.4.47,ref-bible.0208.34.18.16-ref-bible.0208.34.18.22,191468,191508,31951,31957,ref-sifre-d.00171.00004.00041,ref-sifre-d.00171.00004.00047,938510,938550,159083,159089,ref-bible.00208.00034.00018.00016,ref-bible.00208.00034.00018.00022,העגל אשר כרתו לשנים ויעברו בין בתריו ,העגל אשר כרתו לשנים ויעברו בין בתריו ,ref-bible
3207,ref-sifre-d.171.6.12-ref-sifre-d.171.6.21,ref-bible.0202.4.8.1-ref-bible.0202.4.8.11,191591,191631,31973,31979,ref-sifre-d.00171.00006.00012,ref-sifre-d.00171.00006.00021,472938,472991,78811,78820,ref-bible.00202.00004.00008.00001,ref-bible.00202.00004.00008.00011,ואמר אם אלך אם לא אלך וכן_הוא_אומר עמי ,ויאמר אליה ברק אם תלכי עמי והלכתי ואם לא תלכי עמי ,ref-bible
3208,ref-sifre-d.171.6.21-ref-sifre-d.171.6.26,ref-bible.0210.4.12.1-ref-bible.0210.4.12.6,191628,191657,31979,31984,ref-sifre-d.00171.00006.00021,ref-sifre-d.00171.00006.00026,1084894,1084923,183234,183239,ref-bible.00210.00004.00012.00001,ref-bible.00210.00004.00012.00006,עמי בעצו ישאל ומקלו יגיד לו ,עמי בעצו ישאל ומקלו יגיד לו ,ref-bible
3209,ref-sifre-d.172.5.44-ref-sifre-d.172.5.51,ref-bible.0207.59.2.1-ref-bible.0207.59.2.8,192834,192879,32176,32182,ref-sifre-d.00172.00005.00044,ref-sifre-d.00172.00005.00051,856507,856549,145358,145364,ref-bible.00207.00059.00002.00001,ref-bible.00207.00059.00002.00008,כי אם עונותיכם היו מבדילים ביניכם לבין אלהיכם ,כי אם עונתיכם היו מבדלים בינכם לבין אלהיכם ,ref-bible
3210,ref-sifre-d.173.1.4-ref-sifre-d.173.2.5,ref-bible.0105.18.12.4-ref-bible.0105.18.12.14,192893,193084,32186,32217,ref-sifre-d.00173.00001.00004,ref-sifre-d.00173.00002.00005,377533,377592,63055,63065,ref-bible.00105.00018.00012.00004,ref-bible.00105.00018.00012.00014,כל עושה אלה ואפילו אחת מהם לפי שאומר ובגלל התועבות האלה ה'_א_להיך מוריש אותם מפניך יכול לא יהא חייב עד שיעבור על כולם תלמוד_לומר_כל עושה אלה אפילו אחת מהם ובגלל התועבות האלה ה' אלהיך ,כל עשה אלה ובגלל התועבת האלה יהוה אלהיך מוריש אותם מפניך ,ref-bible
3211,ref-sifre-d.173.3.17-ref-sifre-d.173.3.21,ref-bible.0301.26.11.1-ref-bible.0301.26.11.5,193462,193490,32283,32287,ref-sifre-d.00173.00003.00017,ref-sifre-d.00173.00003.00021,1168929,1168956,197970,197974,ref-bible.00301.00026.00011.00001,ref-bible.00301.00026.00011.00005,ואני בתומי אלך פדני וחנני ,ואני בתמי אלך פדני וחנני ,ref-bible
3212,ref-sifre-d.173.3.22-ref-sifre-d.173.3.28,ref-bible.0301.41.13.1-ref-bible.0301.41.13.7,193491,193532,32288,32294,ref-sifre-d.00173.00003.00022,ref-sifre-d.00173.00003.00028,1181023,1181063,200233,200239,ref-bible.00301.00041.00013.00001,ref-bible.00301.00041.00013.00007,ואני בתומי תמכת בי ותציבני לפניך לעולם ,ואני בתמי תמכת בי ותציבני לפניך לעולם ,ref-bible
3213,ref-sifre-d.174.1.2-ref-sifre-d.174.2.5,ref-bible.0105.18.14.2-ref-bible.0105.18.14.12,193536,193638,32296,32310,ref-sifre-d.00174.00001.00002,ref-sifre-d.00174.00002.00005,377620,377678,63070,63080,ref-bible.00105.00018.00014.00002,ref-bible.00105.00018.00014.00012,הגוים האלה אשר אתה יורש אותם עשה_מצוה_האמורה_בענין_שבשכרה אתה יורש אותם אל מעוננים ואל קוסמים ישמעו ,הגוים האלה אשר אתה יורש אותם אל מעננים ואל קסמים ישמעו ,ref-bible
3214,ref-sifre-d.175.1.1-ref-sifre-d.175.1.6,ref-bible.0105.18.15.1-ref-bible.0105.18.15.6,193763,193795,32332,32337,ref-sifre-d.00175.00001.00001,ref-sifre-d.00175.00001.00006,377709,377740,63087,63092,ref-bible.00105.00018.00015.00001,ref-bible.00105.00018.00015.00006,נביא מקרבך מאחיך כמוני יקים לך ,נביא מקרבך מאחיך כמני יקים לך ,ref-bible
3215,ref-sifre-d.175.1.1-ref-sifre-d.175.1.6,ref-bible.0105.18.18.1-ref-bible.0105.18.18.6,193763,193795,32332,32337,ref-sifre-d.00175.00001.00001,ref-sifre-d.00175.00001.00006,377924,377953,63124,63129,ref-bible.00105.00018.00018.00001,ref-bible.00105.00018.00018.00006,נביא מקרבך מאחיך כמוני יקים לך ,נביא אקים להם מקרב אחיהם כמוך ,ref-bible
3216,ref-sifre-d.175.2.18-ref-sifre-d.176.1.19,ref-bible.0105.18.15.6-ref-bible.0105.18.16.15,194030,194125,32378,32395,ref-sifre-d.00175.00002.00018,ref-sifre-d.00176.00001.00019,377738,377836,63092,63108,ref-bible.00105.00018.00015.00006,ref-bible.00105.00018.00016.00015,שמע לו ככל אשר שאלת מעם ה'_א_להיך בחורב בזו זכו שעמדו להם נביאים דכתיב לא אוסף לשמוע את קול ,לך יהוה_אלהיך_אליו תשמעון ככל אשר שאלת מעם יהוה אלהיך בחרב ביום הקהל לאמר לא אסף לשמע את קול ,ref-bible
3217,ref-sifre-d.176.1.26-ref-sifre-d.176.2.2,ref-bible.0105.18.17.4-ref-bible.0105.18.18.2,194150,194188,32400,32406,ref-sifre-d.00176.00001.00026,ref-sifre-d.00176.00002.00002,377908,377933,63121,63125,ref-bible.00105.00018.00017.00004,ref-bible.00105.00018.00018.00002,היטיבו אשר דברו כוונו לדעתי נביא אקים ,היטיבו אשר דברו נביא אקים ,ref-bible
3218,ref-sifre-d.177.1.1-ref-sifre-d.177.1.7,ref-bible.0105.18.19.1-ref-bible.0105.18.19.7,194445,194476,32451,32456,ref-sifre-d.00177.00001.00001,ref-sifre-d.00177.00001.00007,378000,378031,63137,63142,ref-bible.00105.00018.00019.00001,ref-bible.00105.00018.00019.00007,והיה האיש אשר לא ישמע אל דברי ,והיה האיש אשר לא ישמע אל דברי ,ref-bible
3219,ref-sifre-d.177.1.86-ref-sifre-d.178.1.13,ref-bible.0105.18.19.10-ref-bible.0105.18.20.18,194913,195012,32524,32543,ref-sifre-d.00177.00001.00086,ref-sifre-d.00178.00001.00013,378041,378150,63145,63164,ref-bible.00105.00018.00019.00010,ref-bible.00105.00018.00020.00018,אך הנביא אשר יזיד לדבר דבר בשמי אך הנביא אשר יזיד לדבר דבר בשמי ואשר ידבר בשם אלהים אחרים ומת ,בשמי אנכי אדרש מעמו אך הנביא אשר יזיד לדבר דבר בשמי את אשר לא צויתיו לדבר ואשר ידבר בשם אלהים אחרים ומת ,ref-bible
3220,ref-sifre-d.177.1.88-ref-sifre-d.178.1.9,ref-bible.0208.23.27.15-ref-bible.0208.23.28.11,194923,194991,32526,32539,ref-sifre-d.00177.00001.00088,ref-sifre-d.00178.00001.00009,911608,911672,154844,154856,ref-bible.00208.00023.00027.00015,ref-bible.00208.00023.00028.00011,אשר יזיד לדבר דבר בשמי אך הנביא אשר יזיד לדבר דבר בשמי ואשר ידבר ,שמי בבעל הנביא אשר אתו חלום יספר חלום ואשר דברי אתו ידבר דברי ,ref-bible
3221,ref-sifre-d.178.2.12-ref-sifre-d.178.2.20,ref-bible.0208.27.16.19-ref-bible.0208.27.16.27,195102,195143,32560,32568,ref-sifre-d.00178.00002.00012,ref-sifre-d.00178.00002.00020,920601,920645,156252,156260,ref-bible.00208.00027.00016.00019,ref-bible.00208.00027.00016.00027,אמר הנה כלי בית ה' מושבים מבבלה עתה מהרה ,לאמר הנה כלי בית יהוה מושבים מבבלה עתה מהרה ,ref-bible
3222,ref-sifre-d.178.2.21-ref-sifre-d.178.2.29,ref-bible.0208.27.21.8-ref-bible.0208.27.22.4,195144,195192,32569,32577,ref-sifre-d.00178.00002.00021,ref-sifre-d.00178.00002.00029,921092,921167,156328,156340,ref-bible.00208.00027.00021.00008,ref-bible.00208.00027.00022.00004,על הכלים הנותרים בית ה' בבלה יובאו ושמה יהיו ,על הכלים הנותרים בית יהוה ובית מלך יהודה וירושלם בבלה יובאו ושמה יהיו ,ref-bible
3223,ref-sifre-d.178.2.52-ref-sifre-d.178.3.3,ref-bible.0105.18.21.10-ref-bible.0105.18.22.22,195298,195434,32597,32622,ref-sifre-d.00178.00002.00052,ref-sifre-d.00178.00003.00003,378205,378324,63174,63194,ref-bible.00105.00018.00021.00010,ref-bible.00105.00018.00022.00022,ידבר הנביא בשם ה' וגו' ואיזה הדבר אשר דברו המקום זה שהוא אומר בזדון דברו הנביא על זדון הוא חייב ואינו חייב על שגגה לא תגור ממנו ,דברו יהוה אשר ידבר הנביא בשם יהוה ולא יהיה הדבר ולא יבוא הוא הדבר_אשר_לא דברו יהוה בזדון דברו הנביא לא תגור ממנו ,ref-bible
3224,ref-sifre-d.179.1.1-ref-sifre-d.179.2.4,ref-bible.0105.19.1.1-ref-bible.0105.19.1.17,195465,195533,32629,32638,ref-sifre-d.00179.00001.00001,ref-sifre-d.00179.00002.00004,378325,378416,63195,63204,ref-bible.00105.00019.00001.00001,ref-bible.00105.00019.00001.00017,כי יכרית ה' אלוהיך את הגוים בזכותך וירשתם וישבת בעריהם ובבתיהם ,כי יכרית יהוה_אלהיך_את הגוים אשר_יהוה_אלהיך_נתן_לך את ארצם וירשתם וישבת בעריהם ובבתיהם ,ref-bible
