,baseOrig,compOrig,baseCharStart,baseCharEnd,baseWdStart,baseWdEnd,baseRefStart,baseRefEnd,compCharStart,compCharEnd,compWdStart,compWdEnd,compRefStart,compRefEnd,baseStr,compStr,compWork
12069,ref-m.5.3.3.3.1-ref-m.5.3.3.3.7,ref-sifra.5.02-03.5.20-ref-sifra.5.02-03.6.4,689847,689891,107451,107457,ref-m.00005.00003.00003.00003.00001,ref-m.00005.00003.00003.00003.00007,264044,264088,38968,38974,ref-sifra.00005.02-03.00005.00020,ref-sifra.00005.02-03.00006.00004,ואלו טרפות בעוף נקובת הוושט פסוקת הגרגרת ,ואלו הן הטריפות נקובת הושט ופסוקת הגרגרת ,ref-sifra
12070,ref-m.5.3.3.5.5-ref-m.5.3.3.5.13,ref-sifra.5.02-03.10.3-ref-sifra.5.02-03.10.12,690344,690402,107533,107541,ref-m.00005.00003.00003.00005.00005,ref-m.00005.00003.00003.00005.00013,264928,264984,39117,39126,ref-sifra.00005.02-03.00010.00003,ref-sifra.00005.02-03.00010.00012,ושאכלה הרדופני ושאכלה צואת תרנגולים או ששתת מים הרעים ,אכלה הרדופני או שאכלה צואת תרנגולים או ששתתה מים הרעים ,ref-sifra
12071,ref-m.5.3.3.7.5-ref-m.5.3.3.7.13,ref-sifra.5.03-05.8.6-ref-sifra.5.03-05.8.14,690683,690738,107587,107594,ref-m.00005.00003.00003.00007.00005,ref-m.00005.00003.00003.00007.00013,272483,272539,40272,40279,ref-sifra.00005.03-05.00008.00006,ref-sifra.00005.03-05.00008.00014,ארבע רגלים וארבע כנפים וקרסולים וכנפיו חופין את רובו ,ארבעה רגלים וארבע כנפים וקרסוליו וכנפיו חופים את רובו ,ref-sifra
12072,ref-m.5.3.3.7.24-ref-m.5.3.3.7.34,ref-sifra.5.03-00.5.14-ref-sifra.5.03-00.5.29,690787,690848,107601,107609,ref-m.00005.00003.00003.00007.00024,ref-m.00005.00003.00003.00007.00034,269840,269917,39850,39859,ref-sifra.00005.03-00.00005.00014,ref-sifra.00005.03-00.00005.00029,וקשקשת רבי_יהודה_אומר שני קשקשין וסנפיר אחד ואלו הן קשקשין ,סנפיר אחד ואין לו אלא קשקשת אחת_תלמוד_לומר קשקשת ר'_יהודה_אומר_אף שני קשקשים ,ref-sifra
12073,ref-m.5.3.4.1.4-ref-m.5.3.4.1.17,ref-sifra.5.02-00.9.17-ref-sifra.5.02-00.9.29,690900,690976,107617,107626,ref-m.00005.00003.00004.00001.00004,ref-m.00005.00003.00004.00001.00017,262186,262261,38694,38704,ref-sifra.00005.02-00.00009.00017,ref-sifra.00005.02-00.00009.00029,והוציא העובר את ידו והחזירו מותר באכילה הוציא את ראשו אף_על_פי שהחזירו ,הוציא העובר את ידו והחזירה מותר באכילה יכול אפילו הוציא את ראשו והחזירו ,ref-sifra
12074,ref-m.5.3.4.1.4-ref-m.5.3.4.1.17,ref-sifra.5.02-00.9.38-ref-sifra.5.02-00.9.54,690900,690976,107617,107626,ref-m.00005.00003.00004.00001.00004,ref-m.00005.00003.00004.00001.00017,262299,262397,38711,38725,ref-sifra.00005.02-00.00009.00038,ref-sifra.00005.02-00.00009.00054,והוציא העובר את ידו והחזירו מותר באכילה הוציא את ראשו אף_על_פי שהחזירו ,הוציא העובר את ידו והחזירה מותר באכילה מפני שאינו כילוד ומה ראית לומר הוציא את ראשו והחזירו ,ref-sifra
12075,ref-m.5.3.4.3.12-ref-m.5.3.4.3.24,ref-sifra.10.06-10.7.48-ref-sifra.10.06-10.7.64,691249,691318,107673,107682,ref-m.00005.00003.00004.00003.00012,ref-m.00005.00003.00004.00003.00024,463976,464057,70635,70648,ref-sifra.00010.06-10.00007.00048,ref-sifra.00010.06-10.00007.00064,בין בבהמה טמאה בין בבהמה טהורה טהור רבי_יוסי_הגלילי_אומר בטמאה טמא ,בין קדש טמא בין טהור חייב ר'_יוסי_הגלילי_אומר טמא שאכל טהור חייב וטמא שאכל טמא ,ref-sifra
12076,ref-m.5.3.4.3.13-ref-m.5.3.4.3.24,ref-sifra.5.09-11.4.19-ref-sifra.5.09-11.4.44,691253,691318,107674,107682,ref-m.00005.00003.00004.00003.00013,ref-m.00005.00003.00004.00003.00024,299795,299937,44370,44394,ref-sifra.00005.09-11.00004.00019,ref-sifra.00005.09-11.00004.00044,בבהמה טמאה בין בבהמה טהורה טהור רבי_יוסי_הגלילי_אומר בטמאה טמא ,טמאים טמאת מקצת ואם אומר אתה אוכלי בהמה טמאים אוכלי אדם טהורים טמאת את הכל וכשאתה אומר אוכלי אדם טמאים ואוכלי בהמה טהורים טמאת מקצת וטהרת ,ref-sifra
12077,ref-m.5.3.4.4.36-ref-m.5.3.4.4.52,ref-sifra.5.04-06.2.14-ref-sifra.5.04-06.3.5,691613,691696,107728,107741,ref-m.00005.00003.00004.00004.00036,ref-m.00005.00003.00004.00004.00052,276088,276153,40788,40797,ref-sifra.00005.04-06.00002.00014,ref-sifra.00005.04-06.00003.00005,ששחיטתה מטהרתה אף שחיטת בהמה תטהר את האבר אמר להם רבי מאיר לא אם טיהרה שחיטת טרפה ,שחיטתו מטהרתו אף בהמה טמאה אין שחיטתה מטהרתה או_כלך_לדרך_זו טריפה ,ref-sifra
12078,ref-m.5.3.4.4.36-ref-m.5.3.4.4.52,ref-sifra.5.10-00.3.43-ref-sifra.5.10-00.3.64,691613,691696,107728,107741,ref-m.00005.00003.00004.00004.00036,ref-m.00005.00003.00004.00004.00052,302877,302988,44862,44875,ref-sifra.00005.10-00.00003.00043,ref-sifra.00005.10-00.00003.00064,ששחיטתה מטהרתה אף שחיטת בהמה תטהר את האבר אמר להם רבי מאיר לא אם טיהרה שחיטת טרפה ,ואין שחיטה מטהרתו אף_אתה_אל_תתמה_על הטריפה שאף_על_פי שיש למינה שחיטה לא תטהרנה שחיטתה תלמוד_לומר_מן הבהמה ,ref-sifra
12079,ref-m.5.3.4.4.63-ref-m.5.3.4.4.89,ref-sifra.5.04-06.2.15-ref-sifra.5.04-06.3.20,691748,691895,107750,107774,ref-m.00005.00003.00004.00004.00063,ref-m.00005.00003.00004.00004.00089,276095,276244,40789,40812,ref-sifra.00005.04-06.00002.00015,ref-sifra.00005.04-06.00003.00020,לטרפה ששחיטתה מטהרתה בהמה טמאה אסורה באכילה אף טרפה אסורה באכילה מה בהמה טמאה אין שחיטתה מטהרתה אף טרפה לא תטהרנה שחיטתה לא_אם_אמרת בבהמה טמאה ,מטהרתו אף בהמה טמאה אין שחיטתה מטהרתה או_כלך_לדרך_זו טריפה אסורה באכילה ובהמה טמאה אסורה באכילה מה טריפה שחיטתה מטהרתה אף בהמה טמאה תטהרנה שחיטתה ,ref-sifra
12080,ref-m.5.3.4.4.64-ref-m.5.3.4.4.89,ref-sifra.5.10-00.4.14-ref-sifra.5.10-00.4.30,691755,691895,107751,107774,ref-m.00005.00003.00004.00004.00064,ref-m.00005.00003.00004.00004.00089,303315,303418,44927,44943,ref-sifra.00005.10-00.00004.00014,ref-sifra.00005.10-00.00004.00030,ששחיטתה מטהרתה בהמה טמאה אסורה באכילה אף טרפה אסורה באכילה מה בהמה טמאה אין שחיטתה מטהרתה אף טרפה לא תטהרנה שחיטתה לא_אם_אמרת בבהמה טמאה ,ששחיטתה מטהרתה מטמא במשא בהמה טמאה שאין שחיטתה מטהרתה אינו דין שתטמא במשא השרץ יוכיח שאין שחיטה ,ref-sifra
12081,ref-m.5.3.4.4.65-ref-m.5.3.4.4.78,ref-sifra.5.04-06.1.52-ref-sifra.5.04-06.2.14,691764,691840,107752,107765,ref-m.00005.00003.00004.00004.00065,ref-m.00005.00003.00004.00004.00078,275967,276094,40769,40788,ref-sifra.00005.04-06.00001.00052,ref-sifra.00005.04-06.00002.00014,מטהרתה בהמה טמאה אסורה באכילה אף טרפה אסורה באכילה מה בהמה טמאה אין שחיטתה ,מטהרתה להביא את בהמה טמאה שלא תהיה שחיטתה מטהרתה והלא_דין_הוא שרץ אסור באכילה ובהמה טמאה אסורה באכילה מה שרץ אין שחיטתו ,ref-sifra
12082,ref-m.5.3.4.4.66-ref-m.5.3.4.4.88,ref-sifra.5.10-00.1.55-ref-sifra.5.10-00.1.78,691771,691890,107753,107773,ref-m.00005.00003.00004.00004.00066,ref-m.00005.00003.00004.00004.00088,302345,302480,44774,44795,ref-sifra.00005.10-00.00001.00055,ref-sifra.00005.10-00.00001.00078,בהמה טמאה אסורה באכילה אף טרפה אסורה באכילה מה בהמה טמאה אין שחיטתה מטהרתה אף טרפה לא תטהרנה שחיטתה לא_אם_אמרת בבהמה ,בהמה טמאה אסורה קודם למיתתה וטריפה אסורה קודם למיתתה מה בהמה טמאה אין שחיטתה מטהרתה אף טריפה לא תטהרנה שחיטתה תלמוד_לומר_מן הבהמה ,ref-sifra
12083,ref-m.5.3.4.4.66-ref-m.5.3.4.4.83,ref-sifra.5.10-00.2.3-ref-sifra.5.10-00.2.19,691771,691865,107753,107770,ref-m.00005.00003.00004.00004.00066,ref-m.00005.00003.00004.00004.00083,302554,302650,44810,44826,ref-sifra.00005.10-00.00002.00003,ref-sifra.00005.10-00.00002.00019,בהמה טמאה אסורה באכילה אף טרפה אסורה באכילה מה בהמה טמאה אין שחיטתה מטהרתה אף טרפה לא תטהרנה ,בהמה טמאה אסורה באכילה וטריפה אסורה באכילה מה בהמה טמאה אין שחיטתה מטהרתה אף טריפה לא תטהרנה ,ref-sifra
12084,ref-m.5.3.4.4.75-ref-m.5.3.4.4.134,ref-sifra.5.10-00.3.10-ref-sifra.5.10-00.3.60,691820,692126,107762,107815,ref-m.00005.00003.00004.00004.00075,ref-m.00005.00003.00004.00004.00134,302701,302967,44833,44873,ref-sifra.00005.10-00.00003.00010,ref-sifra.00005.10-00.00003.00060,בהמה טמאה אין שחיטתה מטהרתה אף טרפה לא תטהרנה שחיטתה לא_אם_אמרת בבהמה טמאה שלא היתה לה שעת הכושר תאמר בטרפה שהיתה לה שעת הכושר טול לך מה שהבאת הרי שנולדה טרפה מן הבטן מנין לא_אם_אמרת בבהמה טמאה שכן אין במינה שחיטה תאמר בטרפה שיש במינה שחיטה בן שמנה חי אין שחיטתו מטהרתו לפי שאין במינו שחיטה ,תאמר בטריפה שהיתה לה_שעת_הכושר טול לך מה שהבאת טריפה מן הבטן מנין לא_אם_אמרת בבהמה טמאה שאין למינה שחיטה תאמר בטריפה שיש למינה שחיטה בן שמונה יוכיח שיש למינו שחיטה ואין שחיטה מטהרתו אף_אתה_אל_תתמה_על הטריפה שאף_על_פי שיש למינה שחיטה לא תטהרנה שחיטתה ,ref-sifra
12085,ref-m.5.3.4.4.90-ref-m.5.3.4.4.99,ref-sifra.4.09-00.9.35-ref-sifra.4.09-00.9.48,691896,691945,107775,107783,ref-m.00005.00003.00004.00004.00090,ref-m.00005.00003.00004.00004.00099,208848,208922,30279,30289,ref-sifra.00004.09-00.00009.00035,ref-sifra.00004.09-00.00009.00048,שלא היתה לה שעת הכושר תאמר בטרפה שהיתה לה שעת ,שהיתה להם שעת הכושר ומוציא_אני_את הפיגול ואת הנותר שלא היתה להם שעת ,ref-sifra
12086,ref-m.5.3.4.4.114-ref-m.5.3.4.4.130,ref-sifra.5.04-06.2.13-ref-sifra.5.04-06.3.5,692012,692103,107796,107812,ref-m.00005.00003.00004.00004.00114,ref-m.00005.00003.00004.00004.00130,276084,276153,40787,40797,ref-sifra.00005.04-06.00002.00013,ref-sifra.00005.04-06.00003.00005,בבהמה טמאה שכן אין במינה שחיטה תאמר בטרפה שיש במינה שחיטה בן שמנה חי אין שחיטתו מטהרתו ,אין שחיטתו מטהרתו אף בהמה טמאה אין שחיטתה מטהרתה או_כלך_לדרך_זו טריפה ,ref-sifra
12087,ref-m.5.3.4.4.117-ref-m.5.3.4.4.129,ref-sifra.5.04-06.4.8-ref-sifra.5.04-06.4.18,692028,692096,107799,107811,ref-m.00005.00003.00004.00004.00117,ref-m.00005.00003.00004.00004.00129,276283,276347,40819,40829,ref-sifra.00005.04-06.00004.00008,ref-sifra.00005.04-06.00004.00018,אין במינה שחיטה תאמר בטרפה שיש במינה שחיטה בן שמנה חי אין שחיטתו ,שחיטה מדבר שאין למינו שחיטה ואל תוכיח טריפה שיש למינה שחיטה ,ref-sifra
12088,ref-m.5.3.4.7.10-ref-m.5.3.4.7.25,ref-sifra.12.01-00.13.3-ref-sifra.12.01-00.13.17,692636,692723,107899,107911,ref-m.00005.00003.00004.00007.00010,ref-m.00005.00003.00004.00007.00025,532091,532165,81177,81190,ref-sifra.00012.01-00.00013.00003,ref-sifra.00012.01-00.00013.00017,ואינה מטמאה לא טומאת אוכלין ולא טומאת נבלות חישב עליה מטמאה טומאת אוכלין אבל לא טומאת ,מטמא הוא על הודאי ואינו מטמא על הספק לה יטמא אינו מטמא לאחרים עמה שלא ,ref-sifra
12089,ref-m.5.3.5.3.1-ref-m.5.3.5.3.7,ref-sifra.10.07-11.7.1-ref-sifra.10.07-11.7.8,693826,693871,108051,108056,ref-m.00005.00003.00005.00003.00001,ref-m.00005.00003.00005.00003.00007,467198,467256,71138,71144,ref-sifra.00010.07-11.00007.00001,ref-sifra.00010.07-11.00007.00008,השוחט ונמצא טרפה השוחט לעבודה זרה והשוחט ,"השוחט ונמצאת טריפה השוחט לעכו""םבס""א לעבודה זרה השוחט ",ref-sifra
12090,ref-m.5.3.5.3.1-ref-m.5.3.5.3.25,ref-sifra.12.08-08.5.7-ref-sifra.12.08-08.6.25,693826,693999,108051,108072,ref-m.00005.00003.00005.00003.00001,ref-m.00005.00003.00005.00003.00025,568889,569117,86549,86580,ref-sifra.00012.08-08.00005.00007,ref-sifra.00012.08-08.00006.00025,השוחט ונמצא טרפה השוחט לעבודה זרה והשוחט פרת חטאת ושור הנסקל ועגלה ערופה רבי_שמעון_פוטר וחכמים מחייבין השוחט ונתנבלה בידו והנוחר והמעקר פטור משום אותו_ואת_בנו ש,"לנוחר ולמעקר להביא את השוחט לאכילת עכומ""ז ולאכילת כלבים השוחט ונמצאת טריפה השוחט לעכו""ם השוחט פרת חטאת ושור הנסקל ועגלה ערופה ר' מאיר מחייב ור' שמעון פוטר השוחט ונתנבלה בידו הנוחר והמעקר פטור משום אותו_ואת_בנו ב",ref-sifra
12091,ref-m.5.3.5.3.19-ref-m.5.3.5.3.23,ref-sifra.10.07-11.6.3-ref-sifra.10.07-11.6.7,693938,693975,108066,108070,ref-m.00005.00003.00005.00003.00019,ref-m.00005.00003.00005.00003.00023,467109,467146,71127,71131,ref-sifra.00010.07-11.00006.00003,ref-sifra.00010.07-11.00006.00007,השוחט ונתנבלה בידו והנוחר והמעקר ,לשוחט ונתנבלה בידו ולנוחר ולמעקר ,ref-sifra
12092,ref-m.5.3.5.3.48-ref-m.5.3.5.3.82,ref-sifra.12.08-08.3.82-ref-sifra.12.08-08.4.19,694095,694263,108091,108117,ref-m.00005.00003.00005.00003.00048,ref-m.00005.00003.00005.00003.00082,568616,568753,86501,86526,ref-sifra.00012.08-08.00003.00082,ref-sifra.00012.08-08.00004.00019,סופג שמונים שחט שני בניה ואחר כך שחטה סופג_את_הארבעים שחטה ואת בתה ואת בת בתה סופג שמונים שחטה ואת בת בתה ואחר כך שחט בתה סופג_את_הארבעים סומכוס אומר_משום_רבי מאיר ,מאיר סופג שמונים שחטה ואת אמה ואת אם אמה סופג שמונים אותו_ואת_בנו ולא אותה ואת בת בתה כיצד שחטה ואת בת בתה שכן הוא רשאי ואחר כך שחט ,ref-sifra
12093,ref-m.5.3.5.3.48-ref-m.5.3.5.3.82,ref-sifra.12.08-08.4.28-ref-sifra.12.08-08.4.38,694095,694263,108091,108117,ref-m.00005.00003.00005.00003.00048,ref-m.00005.00003.00005.00003.00082,568798,568853,86532,86542,ref-sifra.00012.08-08.00004.00028,ref-sifra.00012.08-08.00004.00038,סופג שמונים שחט שני בניה ואחר כך שחטה סופג_את_הארבעים שחטה ואת בתה ואת בת בתה סופג שמונים שחטה ואת בת בתה ואחר כך שחט בתה סופג_את_הארבעים סומכוס אומר_משום_רבי מאיר ,מאיר סופג שמונים שחטה ואת בתה ואת בת בתה סופג שמונים ,ref-sifra
12094,ref-m.5.3.5.3.86-ref-m.5.3.5.5.16,ref-sifra.12.08-08.8.4-ref-sifra.12.08-08.9.56,694284,694932,108121,108219,ref-m.00005.00003.00005.00003.00086,ref-m.00005.00003.00005.00005.00016,569176,569827,86591,86694,ref-sifra.00012.08-08.00008.00004,ref-sifra.00012.08-08.00009.00056,פרקים בשנה המוכר בהמה לחבירו צריך להודיעו אמה מכרתי לשחוט בתה מכרתי לשחוט ואלו הן ערב יום טוב האחרון של חג וערב יום_טוב_הראשון_של פסח וערב עצרת וערב ראש השנה וכדברי רבי_יוסי_הגלילי אף ערב יום הכפורים בגליל אמר_רבי_יהודה_אימתי_בזמן שאין לו ריוח אבל יש לו ריוח אין צריך להודיעו ומודה רבי יהודה במוכר את האם לחתן ואת הבת לכלה שצריך להודיע בידוע ששניהם שוחטין ביום אחד בארבעה פרקים אלו משחיטין את הטבח בעל כרחו אפילו שור שוה אלף דינרין ואין לו ללוקח אלא דינר כופין אותו לשחוט לפיכך אם מת מת ללוקח אבל בשאר ימות השנה אינו כן לפיכך אם מת מת למוכר יום אחד האמור באותו_ואת_בנו היום הולך אחר הלילה את זו דרש שמעון בן זומא ,פרקים בשנה המוכר בהמה לחבירו צריך להודיעו  מכרתי לשחוט אלו הן ערב יום טוב האחרון של חג וערב יום טוב הראשון של פסח וערב עצרת וערב ראש השנה וכדברי_ר'_יוסי_הגלילי אף ערב יום הכפורים בגליל אמר_ר'_יהודה אימתי בזמן שאין לו ריוח אבל יש לו ריוח אינו צריך להודיעו ומודה ר' יהודה במוכר את  לחתן ואת הבת לכלה שהוא צריך להודיעו שהדבר ידוע ששניהם שוחטים ביום אחד ובארבעה פרקים אלו כופים את הטבח לשחוט בכל כרחו אפילו שור שוה אלף דינרים ואין ללוקח אלא דינר כופים אותו לשחוט לפיכך אם מת מת ללוקח אבל בשאר ימות השנה אינו כן לפיכך אם מת מת למוכר מפני שלא משך יום אחד האמור ב'אותו_ואת_בנו' היום הולך אחר הלילה זו דרש ר'_שמעון_בן זומא ,ref-sifra
12095,ref-m.5.3.5.5.1-ref-m.5.3.5.5.41,ref-sifra.12.08-08.9.86-ref-sifra.12.08-08.9.105,694857,695063,108209,108238,ref-m.00005.00003.00005.00005.00001,ref-m.00005.00003.00005.00005.00041,569990,570097,86719,86735,ref-sifra.00012.08-08.00009.00086,ref-sifra.00012.08-08.00009.00105,יום אחד האמור באותו_ואת_בנו היום הולך אחר הלילה את זו דרש שמעון בן זומא נאמר במעשה בראשית יום אחד ונאמר באותו_ואת_בנו יום אחד מה יום אחד האמור במעשה בראשית היום הולך אחר הלילה אף יום אחד האמור ,ונאמר להלן במעשה בראשית יום אחד מה יום אחד האמור במעשה בראשית היום הולך אחר הלילה אף יום אחד האמור ,ref-sifra
12096,ref-m.5.3.5.5.29-ref-m.5.3.5.5.37,ref-sifra.12.08-08.9.41-ref-sifra.12.08-08.9.50,694994,695045,108228,108235,ref-m.00005.00003.00005.00005.00029,ref-m.00005.00003.00005.00005.00037,569751,569803,86684,86690,ref-sifra.00012.08-08.00009.00041,ref-sifra.00012.08-08.00009.00050,יום אחד האמור במעשה בראשית היום הולך אחר הלילה ,יום אחד האמור ב'אותו_ואת_בנו' היום הולך אחר הלילה ,ref-sifra
12097,ref-m.5.3.6.2.1-ref-m.5.3.6.2.24,ref-sifra.10.07-11.6.3-ref-sifra.10.07-11.7.16,695310,695468,108270,108289,ref-m.00005.00003.00006.00002.00001,ref-m.00005.00003.00006.00002.00024,467109,467310,71127,71152,ref-sifra.00010.07-11.00006.00003,ref-sifra.00010.07-11.00007.00016,השוחט ונמצא טרפה והשוחט לעבודה זרה והשוחט חולין בפנים וקדשים בחוץ חיה ועוף הנסקלים רבי מאיר מחייב_וחכמים_פוטרין השוחט ונתנבלה בידו הנוחר והמעקר ,"לשוחט ונתנבלה בידו ולנוחר ולמעקר ולהביא השוחט לאכילת נכריםבס""א גויםולאכילת כלבים השוחט ונמצאת טריפה השוחט לעכו""םבס""א לעבודה זרה השוחט חולין בפנים וקדשים בחוץ חיה ועוף הנסקלים ר' מאיר ",ref-sifra
12098,ref-m.5.3.6.2.20-ref-m.5.3.6.2.24,ref-sifra.12.08-08.5.2-ref-sifra.12.08-08.5.8,695432,695468,108285,108289,ref-m.00005.00003.00006.00002.00020,ref-m.00005.00003.00006.00002.00024,568857,568903,86544,86550,ref-sifra.00012.08-08.00005.00002,ref-sifra.00012.08-08.00005.00008,השוחט ונתנבלה בידו הנוחר והמעקר ,תשחטו פרט לשוחט ונתנבלה בידו לנוחר ולמעקר ,ref-sifra
12099,ref-m.5.3.6.2.20-ref-m.5.3.6.2.25,ref-sifra.12.08-08.6.19-ref-sifra.12.08-08.6.24,695432,695473,108285,108290,ref-m.00005.00003.00006.00002.00020,ref-m.00005.00003.00006.00002.00025,569057,569098,86574,86579,ref-sifra.00012.08-08.00006.00019,ref-sifra.00012.08-08.00006.00024,השוחט ונתנבלה בידו הנוחר והמעקר פטור ,השוחט ונתנבלה בידו הנוחר והמעקר פטור ,ref-sifra
12100,ref-m.5.3.6.4.1-ref-m.5.3.6.4.33,ref-sifra.10.07-11.5.37-ref-sifra.10.07-11.5.69,695729,695895,108328,108353,ref-m.00005.00003.00006.00004.00001,ref-m.00005.00003.00006.00004.00033,466865,467028,71086,71111,ref-sifra.00010.07-11.00005.00037,ref-sifra.00010.07-11.00005.00069,שחט מאה חיות במקום אחד כיסוי אחד לכולן מאה עופות במקום אחד כיסוי אחד לכולן חיה ועוף במקום אחד כיסוי אחד לכולן רבי_יהודה_אומר שחט חיה יכסנה ואחר כך ישחוט את העוף ,שחט מאה חיות במקום אחד כיסוי אחד לכולם מאה עופות במקום אחד כיסוי אחד לכולם חיה ועוף במקום אחד כיסוי אחד לכולם ר'_יהודה_אומר שחט חיה יכסה ואחר כך ישחט את העוף ,ref-sifra
12101,ref-m.5.3.6.4.36-ref-m.5.3.6.5.10,ref-sifra.10.07-11.9.6-ref-sifra.10.07-11.10.8,695905,696024,108356,108376,ref-m.00005.00003.00006.00004.00036,ref-m.00005.00003.00006.00005.00010,467682,467768,71214,71228,ref-sifra.00010.07-11.00009.00006,ref-sifra.00010.07-11.00010.00008,כסה וראהו אחר חייב לכסות כסהו ונתגלה פטור מלכסות כסהו הרוח חייב לכסות דם שנתערב במים אם_יש_בו מראית דם חייב לכסות ,כסהו ונתגלה פטור מלכסות כסהו הרוח חייב לכסות את דמו וכסה' מלמד שכל דמו חייב לכסות ,ref-sifra
12102,ref-m.5.3.6.5.35-ref-m.5.3.6.7.6,ref-sifra.10.07-11.9.10-ref-sifra.10.07-11.11.1,696146,696295,108392,108414,ref-m.00005.00003.00006.00005.00035,ref-m.00005.00003.00006.00007.00006,467708,467902,71218,71249,ref-sifra.00010.07-11.00009.00010,ref-sifra.00010.07-11.00011.00001,דם דם הניתז ושעל הסכין חייב לכסות אמר_רבי_יהודה_אימתי_בזמן שאין שם דם אלא הוא אבל יש שם דם שלא הוא פטור מלכסות במה מכסין ובמה אין מכסין מכסין ,כסהו הרוח חייב לכסות את דמו וכסה' מלמד שכל דמו חייב לכסות מכאן אמרו דם הניתז ושעל הסכין חייב לכסות אמר_ר'_יהודה אימתי בזמן שאין שם דם אלא הוא אבל אם יש שם דם שלא הוא פטור מלכסות וכסהו ,ref-sifra
12103,ref-m.5.3.6.6.22-ref-m.5.3.6.7.6,ref-sifra.10.07-11.9.4-ref-sifra.10.07-11.9.10,696246,696295,108406,108414,ref-m.00005.00003.00006.00006.00022,ref-m.00005.00003.00006.00007.00006,467670,467712,71212,71218,ref-sifra.00010.07-11.00009.00004,ref-sifra.00010.07-11.00009.00010,הוא פטור מלכסות במה מכסין ובמה אין מכסין מכסין ,שיכסנו הוא כסהו ונתגלה פטור מלכסות כסהו ,ref-sifra
12104,ref-m.5.3.6.7.2-ref-m.5.3.6.7.14,ref-sifra.10.07-11.11.29-ref-sifra.10.07-11.11.42,696268,696350,108410,108422,ref-m.00005.00003.00006.00007.00002,ref-m.00005.00003.00006.00007.00014,468044,468129,71274,71286,ref-sifra.00010.07-11.00011.00029,ref-sifra.00010.07-11.00011.00042,מכסין ובמה אין מכסין מכסין בזבל הדק ובחול הדק בסיד ובחרסית ובלבנה ובמגופה ,בזבל דק בחול דק בסיד ובחרסית ובלבינה ובמגופה שכתשה תלמוד לומר וכסהו אי וכסהו ,ref-sifra
12105,ref-m.5.3.6.7.42-ref-m.5.3.6.7.52,ref-sifra.10.07-11.12.15-ref-sifra.10.07-11.12.33,696488,696544,108444,108454,ref-m.00005.00003.00006.00007.00042,ref-m.00005.00003.00006.00007.00052,468381,468476,71317,71333,ref-sifra.00010.07-11.00012.00015,ref-sifra.00010.07-11.00012.00033,שמגדל בו צמחין מכסין בו ושאינו מגדל צמחין אין מכסין בו ,מגדל הצמחים ומכסים בו אף כל דבר שמגדל צמחים ומכסים בו יצא דבר שאין מגדל צמחים אין מכסים בו ,ref-sifra
