,baseOrig,compOrig,baseCharStart,baseCharEnd,baseWdStart,baseWdEnd,baseRefStart,baseRefEnd,compCharStart,compCharEnd,compWdStart,compWdEnd,compRefStart,compRefEnd,baseStr,compStr,compWork
12503,ref-m.6.1.8.3.12-ref-m.6.1.8.3.22,ref-sifra.5.07-00.10.10-ref-sifra.5.07-00.10.23,814915,814984,127187,127197,ref-m.00006.00001.00008.00003.00012,ref-m.00006.00001.00008.00003.00022,288999,289083,42743,42754,ref-sifra.00005.07-00.00010.00010,ref-sifra.00005.07-00.00010.00023,השרץ בתוכה התנור טמא השרץ בתנור אוכלים שבתוכה טמאין שאין מצילין ,השרץ בתוכה התנור טמא השרץ בתנור אוכלים ומשקים שבתוכה טמאים ר'_אליעזר_אומר מצלת ,ref-sifra
12504,ref-m.6.1.8.3.28-ref-m.6.1.8.4.4,ref-sifra.5.07-00.7.11-ref-sifra.5.07-00.7.24,815007,815200,127202,127232,ref-m.00006.00001.00008.00003.00028,ref-m.00006.00001.00008.00004.00004,287804,287892,42554,42567,ref-sifra.00005.07-00.00007.00011,ref-sifra.00005.07-00.00007.00024,חבית שהיא מלאה משקין טהורין ונתונה למטה מנחושתו של תנור השרץ בתנור החבית והמשקין טהורין היתה כפויה ופיה לאויר התנור השרץ בתנור משקה טופח שבשולי החבית טהור קדירה שהיא נתונה בתנור ,חבית שהיא נתונה בתנור ופיה למעלה מן התנור השרץ בחבית אוכלים ומשקין שבתנור טהורים ,ref-sifra
12505,ref-m.6.1.8.3.37-ref-m.6.1.8.4.4,ref-sifra.5.07-00.8.11-ref-sifra.5.07-00.8.23,815061,815200,127211,127232,ref-m.00006.00001.00008.00003.00037,ref-m.00006.00001.00008.00004.00004,288343,288426,42642,42654,ref-sifra.00005.07-00.00008.00011,ref-sifra.00005.07-00.00008.00023,תנור השרץ בתנור החבית והמשקין טהורין היתה כפויה ופיה לאויר התנור השרץ בתנור משקה טופח שבשולי החבית טהור קדירה שהיא נתונה בתנור ,שהיא נתונה בתנור ופיה למעלה מן התנור השרץ בתנור אוכלים ומשקים שבחבית טהורים ,ref-sifra
12506,ref-m.6.1.8.4.5-ref-m.6.1.8.5.10,ref-sifra.5.07-00.3.10-ref-sifra.5.07-00.3.22,815201,815376,127233,127256,ref-m.00006.00001.00008.00004.00005,ref-m.00006.00001.00008.00005.00010,287101,287170,42446,42457,ref-sifra.00005.07-00.00003.00010,ref-sifra.00005.07-00.00003.00022,השרץ בתנור הקדירה טהורה שאין כלי חרס מטמא כלים היה בה משקה טופח נטמא וטמאה הרי_זה_אומר_מטמאיך_לא_טמאוני_ואתה_טמאתני תרנגול שבלע את השרץ ונפל לאויר התנור טהור ואם מת ,לטמא פרט לתרנגול שבלע את השרץ ונפל לאויר התנור טהור ואם מת טמא ,ref-sifra
12507,ref-m.6.1.8.5.11-ref-m.6.1.8.5.18,ref-sifra.5.07-00.10.12-ref-sifra.5.07-00.10.18,815377,815426,127257,127264,ref-m.00006.00001.00008.00005.00011,ref-m.00006.00001.00008.00005.00018,289011,289057,42745,42751,ref-sifra.00005.07-00.00010.00012,ref-sifra.00005.07-00.00010.00018,טמא השרץ שנמצא בתנור הפת שבתוכו שניה שהתנור ,התנור טמא השרץ בתנור אוכלים ומשקים שבתוכה ,ref-sifra
12508,ref-m.6.1.8.6.3-ref-m.6.1.8.6.8,ref-sifra.5.07-09.2.2-ref-sifra.5.07-09.2.9,815441,815474,127268,127273,ref-m.00006.00001.00008.00006.00003,ref-m.00006.00001.00008.00006.00008,290913,290958,43031,43038,ref-sifra.00005.07-09.00002.00002,ref-sifra.00005.07-09.00002.00009,מוקף צמיד פתיל ונתון לתוך התנור ,המוקף צמיד פתיל בכלי חרס ונתון לתוך התנור ,ref-sifra
12509,ref-m.6.1.8.6.3-ref-m.6.1.8.6.8,ref-sifra.5.07-09.2.20-ref-sifra.5.07-09.2.27,815441,815474,127268,127273,ref-m.00006.00001.00008.00006.00003,ref-m.00006.00001.00008.00006.00008,291008,291053,43047,43054,ref-sifra.00005.07-09.00002.00020,ref-sifra.00005.07-09.00002.00027,מוקף צמיד פתיל ונתון לתוך התנור ,למוקף צמיד פתיל בכלי חרס ונתון לתוך התנור ,ref-sifra
12510,ref-m.6.1.8.6.3-ref-m.6.1.8.6.8,ref-sifra.5.07-09.2.30-ref-sifra.5.07-09.2.37,815441,815474,127268,127273,ref-m.00006.00001.00008.00006.00003,ref-m.00006.00001.00008.00006.00008,291062,291107,43057,43064,ref-sifra.00005.07-09.00002.00030,ref-sifra.00005.07-09.00002.00037,מוקף צמיד פתיל ונתון לתוך התנור ,המוקף צמיד פתיל בכלי שטף ונתון לתוך התנור ,ref-sifra
12511,ref-m.6.1.8.6.3-ref-m.6.1.8.6.8,ref-sifra.5.07-09.2.91-ref-sifra.5.07-09.2.98,815441,815474,127268,127273,ref-m.00006.00001.00008.00006.00003,ref-m.00006.00001.00008.00006.00008,291358,291403,43087,43094,ref-sifra.00005.07-09.00002.00091,ref-sifra.00005.07-09.00002.00098,מוקף צמיד פתיל ונתון לתוך התנור ,המוקף צמיד פתיל בכלי שטף ונתון לתוך התנור ,ref-sifra
12512,ref-m.6.1.8.6.3-ref-m.6.1.8.6.8,ref-sifra.5.07-09.2.162-ref-sifra.5.07-09.2.169,815441,815474,127268,127273,ref-m.00006.00001.00008.00006.00003,ref-m.00006.00001.00008.00006.00008,291695,291740,43119,43126,ref-sifra.00005.07-09.00002.00162,ref-sifra.00005.07-09.00002.00169,מוקף צמיד פתיל ונתון לתוך התנור ,המוקף צמיד פתיל בכלי שטף ונתון לתוך התנור ,ref-sifra
12513,ref-m.6.1.8.6.8-ref-m.6.1.8.6.15,ref-sifra.5.07-00.10.9-ref-sifra.5.07-00.10.13,815468,815519,127273,127280,ref-m.00006.00001.00008.00006.00008,ref-m.00006.00001.00008.00006.00015,288992,289021,42742,42746,ref-sifra.00005.07-00.00010.00009,ref-sifra.00005.07-00.00010.00013,התנור השאור והשרץ בתוכו והקרץ בינתים התנור טמא ,התנור השרץ בתוכה התנור טמא ,ref-sifra
12514,ref-m.6.1.8.10.2-ref-m.6.1.8.10.15,ref-sifra.5.01-01.9.28-ref-sifra.5.01-01.9.37,816262,816342,127390,127403,ref-m.00006.00001.00008.00010.00002,ref-m.00006.00001.00008.00010.00015,257397,257458,37913,37922,ref-sifra.00005.01-01.00009.00028,ref-sifra.00005.01-01.00009.00037,טמא מת שהיו אוכלין ומשקין לתוך פיו הכניס ראשו לאויר התנור טהור טמאוהו וטהור ,טהרה שאינה ממין טומאה לטהר מטומאת מצורע לומר שיהיו נאכלים ,ref-sifra
12515,ref-m.6.1.9.1.32-ref-m.6.1.9.1.45,ref-sifra.9.04-07.5.14-ref-sifra.9.04-07.5.25,816909,816994,127497,127510,ref-m.00006.00001.00009.00001.00032,ref-m.00006.00001.00009.00001.00045,418197,418263,63450,63461,ref-sifra.00009.04-07.00005.00014,ref-sifra.00009.04-07.00005.00025,אם בטמא טמאין ואם בטהור טהורים נמצאו במגופת החבית מצדיה טמאים מכנגד פיה טהורים ,אם כנגדו נתונה טמאה שאם נטמאה המפה נטמאה הככר ושלא כנגדו טהורה ,ref-sifra
12516,ref-m.6.1.9.6.30-ref-m.6.1.9.6.40,ref-sifra.5.07-00.3.16-ref-sifra.5.07-00.3.22,817926,817991,127656,127666,ref-m.00006.00001.00009.00006.00030,ref-m.00006.00001.00009.00006.00040,287134,287170,42451,42457,ref-sifra.00005.07-00.00003.00016,ref-sifra.00005.07-00.00003.00022,טהורים נכנסו לאהל המת נטמאו הסיטן הזב נטמאו נפלו לאויר התנור ,ונפל לאויר התנור טהור ואם מת טמא ,ref-sifra
12517,ref-m.6.1.10.3.20-ref-m.6.1.10.3.28,ref-sifra.5.07-00.10.10-ref-sifra.5.07-00.10.19,819668,819725,127937,127945,ref-m.00006.00001.00010.00003.00020,ref-m.00006.00001.00010.00003.00028,288999,289063,42743,42752,ref-sifra.00005.07-00.00010.00010,ref-sifra.00005.07-00.00010.00019,השרץ בתוכה החבית טמאה השרץ בחבית אוכלין שבתוכה טמאים ,השרץ בתוכה התנור טמא השרץ בתנור אוכלים ומשקים שבתוכה טמאים ,ref-sifra
12518,ref-m.6.1.11.1.1-ref-m.6.1.11.1.13,ref-sifra.5.09-00.7.17-ref-sifra.5.09-00.7.32,820720,820796,128115,128127,ref-m.00006.00001.00011.00001.00001,ref-m.00006.00001.00011.00001.00013,298672,298763,44199,44212,ref-sifra.00005.09-00.00007.00017,ref-sifra.00005.09-00.00007.00032,כלי מתכות פשוטיהן ומקבליהן טמאין נשברו טהרו חזר ועשה מהן כלי חזרו לטומאתן ,טהור כלים הנעשים ממנו טמאים העצם שאביו טמא אינו_דין_שיהיו כלים הנעשים ממנו מקבלים טומאה ,ref-sifra
12519,ref-m.6.1.11.7.31-ref-m.6.1.11.8.13,ref-sifra.7.05-16.12.83-ref-sifra.7.05-16.12.97,822017,822105,128304,128319,ref-m.00006.00001.00011.00007.00031,ref-m.00006.00001.00011.00008.00013,364585,364662,54899,54913,ref-sifra.00007.05-16.00012.00083,ref-sifra.00007.05-16.00012.00097,טמאים ובשעת חבורן הכל טמא קסדא טמאה ולחיים טהורים אם_יש_בהן בית קבול מים טמאים כל כלי ,מטמא בביאה אף כולם מטמאים בביאה אי מה בגד מטמא בכל הטומאות אף כולם מטמאים ,ref-sifra
12520,ref-m.6.1.12.2.50-ref-m.6.1.12.2.60,ref-sifra.5.09-11.3.51-ref-sifra.5.09-11.3.66,823239,823299,128504,128512,ref-m.00006.00001.00012.00002.00050,ref-m.00006.00001.00012.00002.00060,299588,299690,44338,44352,ref-sifra.00005.09-11.00003.00051,ref-sifra.00005.09-11.00003.00066,טהור זה_הכלל_כל המחובר לטמא טמא והמחובר לטהור טהור וכולן ,מחוברים טמאים ותלושים טהורים טמאת את הכל וכשאתה אומר מחוברים טהורים ותלושים טמאים טמאת מקצת וטהרת ,ref-sifra
12521,ref-m.6.1.15.1.14-ref-m.6.1.15.1.20,ref-sifra.5.09-00.7.17-ref-sifra.5.09-00.7.32,828262,828298,129300,129306,ref-m.00006.00001.00015.00001.00014,ref-m.00006.00001.00015.00001.00020,298672,298763,44199,44212,ref-sifra.00005.09-00.00007.00017,ref-sifra.00005.09-00.00007.00032,טהרו חזר ועשה מהן כלים מקבלין טומאה ,טהור כלים הנעשים ממנו טמאים העצם שאביו טמא אינו_דין_שיהיו כלים הנעשים ממנו מקבלים טומאה ,ref-sifra
12522,ref-m.6.1.15.1.23-ref-m.6.1.15.1.43,ref-sifra.5.06-00.5.4-ref-sifra.5.06-00.5.24,828311,828442,129309,129328,ref-m.00006.00001.00015.00001.00023,ref-m.00006.00001.00015.00001.00043,282583,282703,41741,41759,ref-sifra.00005.06-00.00005.00004,ref-sifra.00005.06-00.00005.00024,השידה והתיבה והמגדל כוורת הקש וכוורת הקנים ובור ספינה אלכסנדרית שיש להם שולים והן מחזיקין ארבעים סאה בלח שהם כורים ביבש ,השדה תיבה ומגדל וכוורת קש וכוורת קנים ובור ספינה אלכסנדית שיש להם שולים והם מחזיקים מ' סאה בלח שהם כוריים ביבש ,ref-sifra
12523,ref-m.6.1.15.1.23-ref-m.6.1.15.1.43,ref-sifra.5.06-00.5.92-ref-sifra.5.06-00.5.112,828311,828442,129309,129328,ref-m.00006.00001.00015.00001.00023,ref-m.00006.00001.00015.00001.00043,283067,283194,41808,41826,ref-sifra.00005.06-00.00005.00092,ref-sifra.00005.06-00.00005.00112,השידה והתיבה והמגדל כוורת הקש וכוורת הקנים ובור ספינה אלכסנדרית שיש להם שולים והן מחזיקין ארבעים סאה בלח שהם כורים ביבש ,השידה התיבה והמגדול וכוורת קש וכוורת קנים ובור ספינה אלכסנדרית שיש להם שוליים והם מחזיקים מ' סאה בלח שהם כוריים ביבש ,ref-sifra
12524,ref-m.6.1.15.1.35-ref-m.6.1.15.1.43,ref-sifra.5.06-00.7.10-ref-sifra.5.06-00.7.17,828391,828442,129320,129328,ref-m.00006.00001.00015.00001.00035,ref-m.00006.00001.00015.00001.00043,283433,283477,41862,41869,ref-sifra.00005.06-00.00007.00010,ref-sifra.00005.06-00.00007.00017,שולים והן מחזיקין ארבעים סאה בלח שהם כורים ביבש ,שולים והם מחזיקים מ' בלח שהם כוריים ביבש ,ref-sifra
12525,ref-m.6.1.15.1.63-ref-m.6.1.15.1.71,ref-sifra.5.06-00.5.38-ref-sifra.5.06-00.5.46,828542,828605,129342,129350,ref-m.00006.00001.00015.00001.00063,ref-m.00006.00001.00015.00001.00071,282764,282824,41768,41776,ref-sifra.00005.06-00.00005.00038,ref-sifra.00005.06-00.00005.00046,עגלה וקוסטות המלכים ועריבת העבדנין ובור ספינה קטנה והארון ,עגלה וקסתות מלכים ועריבת העבדנים ובור ספינה קטנה והארון ,ref-sifra
12526,ref-m.6.1.15.1.63-ref-m.6.1.15.1.71,ref-sifra.5.06-00.5.78-ref-sifra.5.06-00.5.86,828542,828605,129342,129350,ref-m.00006.00001.00015.00001.00063,ref-m.00006.00001.00015.00001.00071,282974,283033,41794,41802,ref-sifra.00005.06-00.00005.00078,ref-sifra.00005.06-00.00005.00086,עגלה וקוסטות המלכים ועריבת העבדנין ובור ספינה קטנה והארון ,עגלה וקסתות מלכים וערבת העבדנים ובור ספינה קטנה והארון ,ref-sifra
12527,ref-m.6.1.15.1.90-ref-m.6.1.15.1.101,ref-sifra.5.06-00.6.18-ref-sifra.5.06-00.6.31,828715,828779,129367,129374,ref-m.00006.00001.00015.00001.00090,ref-m.00006.00001.00015.00001.00101,283308,283382,41843,41853,ref-sifra.00005.06-00.00006.00018,ref-sifra.00005.06-00.00006.00031,טמאין אין בין דברי_רבי_מאיר לדברי_רבי_יהודה אלא עריבת בעל הבית ,טמא והשאר טהור אין בין דברי_רבי_מאיר לדברי רבי יהודה אלא עריבת בעל הבית ,ref-sifra
12528,ref-m.6.1.17.13.16-ref-m.6.1.17.13.27,ref-sifra.5.06-00.10.57-ref-sifra.5.06-00.10.78,835021,835081,130341,130352,ref-m.00006.00001.00017.00013.00016,ref-m.00006.00001.00017.00013.00027,284293,284398,41998,42014,ref-sifra.00005.06-00.00010.00057,ref-sifra.00005.06-00.00010.00078,מן הגדל בים וחבר להם מן הגדל בארץ אפילו חוט אפילו משיחה ,בארץ אף עור מן הגדל בארץ או_יכול_שאני_מוציא_את שחיבר לו מן הגדל בארץ כל שהוא אפילו חוט אפילו משיחה ,ref-sifra
12529,ref-m.6.1.17.13.17-ref-m.6.1.17.13.23,ref-sifra.7.05-13.9.58-ref-sifra.7.05-13.9.69,835024,835059,130342,130348,ref-m.00006.00001.00017.00013.00017,ref-m.00006.00001.00017.00013.00023,358567,358625,53898,53905,ref-sifra.00007.05-13.00009.00058,ref-sifra.00007.05-13.00009.00069,הגדל בים וחבר להם מן הגדל בארץ ,הגדל בארץ או_יכול_שאני_מוציא_את שחיבר לו מן הגדל בארץ ,ref-sifra
12530,ref-m.6.1.17.13.19-ref-m.6.1.17.13.27,ref-sifra.7.05-13.9.77-ref-sifra.7.05-13.9.87,835035,835081,130344,130352,ref-m.00006.00001.00017.00013.00019,ref-m.00006.00001.00017.00013.00027,358655,358709,53911,53920,ref-sifra.00007.05-13.00009.00077,ref-sifra.00007.05-13.00009.00087,וחבר להם מן הגדל בארץ אפילו חוט אפילו משיחה ,שחבר לו מן הגדל בארץ כל שהוא אפילו חוט אפילו משיחה ,ref-sifra
12531,ref-m.6.1.18.7.15-ref-m.6.1.18.7.25,ref-sifra.4.09-15.1.1-ref-sifra.4.09-15.1.16,837486,837541,130723,130733,ref-m.00006.00001.00018.00007.00015,ref-m.00006.00001.00018.00007.00025,210037,210116,30448,30460,ref-sifra.00004.09-15.00001.00001,ref-sifra.00004.09-15.00001.00016,מגע מדרס היתה טמאה טומאת ז' וחברה למטה כולה טמאה טומאת ,יכול יהיו טמא מטמא את הטהור לקדש במשא תלמוד_לומר_כי תגע במגע מטמא ואין מטמא ,ref-sifra
12532,ref-m.6.1.18.7.15-ref-m.6.1.18.7.25,ref-sifra.7.05-12.3.13-ref-sifra.7.05-12.4.5,837486,837541,130723,130733,ref-m.00006.00001.00018.00007.00015,ref-m.00006.00001.00018.00007.00025,354348,354441,53207,53219,ref-sifra.00007.05-12.00003.00013,ref-sifra.00007.05-12.00004.00005,מגע מדרס היתה טמאה טומאת ז' וחברה למטה כולה טמאה טומאת ,נגעם ומנין לרבות_שאר_המנוגעים_תל_ל טמא יטמאנו הכהן יטמאנו הכהן יכול שאר הטמאים תהא טומאתם ,ref-sifra
12533,ref-m.6.1.19.2.1-ref-m.6.1.19.2.11,ref-sifra.9.02-00.4.3-ref-sifra.9.02-00.4.18,838332,838387,130858,130868,ref-m.00006.00001.00019.00002.00001,ref-m.00006.00001.00019.00002.00011,403629,403710,61191,61203,ref-sifra.00009.02-00.00004.00003,ref-sifra.00009.02-00.00004.00018,החבל היוצא מן המטה עד ה' טפחים טהור מחמשה ועד עשרה ,בחבל היוצא מן המטה פחות מחמשה או יתר מעשרה או_יכול_שאני_מוציא מחמשה עד עשרה ,ref-sifra
12534,ref-m.6.1.19.5.16-ref-m.6.1.19.5.27,ref-sifra.4.09-15.1.1-ref-sifra.4.09-15.1.16,838875,838935,130939,130950,ref-m.00006.00001.00019.00005.00016,ref-m.00006.00001.00019.00005.00027,210037,210116,30448,30460,ref-sifra.00004.09-15.00001.00001,ref-sifra.00004.09-15.00001.00016,מגע מדרס היתה טמאה טומאת שבעה וכרך לה מיזרן כולה טמאה טומאת ,יכול יהיו טמא מטמא את הטהור לקדש במשא תלמוד_לומר_כי תגע במגע מטמא ואין מטמא ,ref-sifra
12535,ref-m.6.1.19.5.16-ref-m.6.1.19.5.27,ref-sifra.7.05-12.3.13-ref-sifra.7.05-12.4.5,838875,838935,130939,130950,ref-m.00006.00001.00019.00005.00016,ref-m.00006.00001.00019.00005.00027,354348,354441,53207,53219,ref-sifra.00007.05-12.00003.00013,ref-sifra.00007.05-12.00004.00005,מגע מדרס היתה טמאה טומאת שבעה וכרך לה מיזרן כולה טמאה טומאת ,נגעם ומנין לרבות_שאר_המנוגעים_תל_ל טמא יטמאנו הכהן יטמאנו הכהן יכול שאר הטמאים תהא טומאתם ,ref-sifra
12536,ref-m.6.1.20.1.11-ref-m.6.1.20.1.21,ref-sifra.9.01-02.3.12-ref-sifra.9.01-02.3.22,839900,839960,131093,131103,ref-m.00006.00001.00020.00001.00011,ref-m.00006.00001.00020.00001.00021,400138,400201,60729,60739,ref-sifra.00009.01-02.00003.00012,ref-sifra.00009.01-02.00003.00022,ארבע קבין התורמל חמשת קבין הכריתית סאה החמת של שבעת קבין ,ארבעת קבים והתורמל חמשת קבים והכריתית סאה והחמת של שבעה קבים ,ref-sifra
12537,ref-m.6.1.20.1.12-ref-m.6.1.20.1.21,ref-sifra.9.01-02.4.11-ref-sifra.9.01-02.4.20,839905,839960,131094,131103,ref-m.00006.00001.00020.00001.00012,ref-m.00006.00001.00020.00001.00021,400453,400505,60772,60781,ref-sifra.00009.01-02.00004.00011,ref-sifra.00009.01-02.00004.00020,קבין התורמל חמשת קבין הכריתית סאה החמת של שבעת קבין ,קבים ותורמל ה' קבים והכריתית סאה והחמת של ז' קבים ,ref-sifra
12538,ref-m.6.1.20.2.17-ref-m.6.1.20.2.23,ref-sifra.9.01-02.5.14-ref-sifra.9.01-02.5.20,840161,840197,131131,131137,ref-m.00006.00001.00020.00002.00017,ref-m.00006.00001.00020.00002.00023,400923,400963,60839,60845,ref-sifra.00009.01-02.00005.00014,ref-sifra.00009.01-02.00005.00020,עריבה מב' לוג ועד תשעה קבין שנסדקה ,ועריבה משני לוג ועד תשעה קבין שנסדקה ,ref-sifra
12539,ref-m.6.1.20.2.17-ref-m.6.1.20.2.23,ref-sifra.9.01-02.6.10-ref-sifra.9.01-02.6.16,840161,840197,131131,131137,ref-m.00006.00001.00020.00002.00017,ref-m.00006.00001.00020.00002.00023,401199,401241,60883,60889,ref-sifra.00009.01-02.00006.00010,ref-sifra.00009.01-02.00006.00016,עריבה מב' לוג ועד תשעה קבין שנסדקה ,ועריבה משני לוגין ועד תשעה קבין שנסדקה ,ref-sifra
12540,ref-m.6.1.23.2.4-ref-m.6.1.23.2.32,ref-sifra.9.02-03.11.2-ref-sifra.9.02-03.11.29,843983,844135,131719,131744,ref-m.00006.00001.00023.00002.00004,ref-m.00006.00001.00023.00002.00032,406463,406615,61638,61663,ref-sifra.00009.02-03.00011.00002,ref-sifra.00009.02-03.00011.00029,מרכב זריז האשקלוני ומדוכה המדית ועביט של גמל וטפיטן של סוס רבי_יוסי_אומר_אף טפיטן של סוס טמא משום מושב מפני שעומדין עליו בקומפון אבל אוכף של נאקה ,המרכב המיוחד זרז האשקלוני ומדוכה המדית ועביט של גמל וטפיטו של סוס ר'_יוסי_אומר טפיטו של סוס טמא מושב מפני שעומדים עליו בקומפון אבל אוכף של נאקה ,ref-sifra
12541,ref-m.6.1.23.3.2-ref-m.6.1.23.3.12,ref-sifra.9.02-03.3.35-ref-sifra.9.02-03.3.44,844143,844198,131747,131757,ref-m.00006.00001.00023.00003.00002,ref-m.00006.00001.00023.00003.00012,405220,405274,61434,61443,ref-sifra.00009.02-03.00003.00035,ref-sifra.00009.02-03.00003.00044,בין מרכב למושב מרכב חלק מגעו ממשאו ומושב לא חלק מגעו ,מגעו ממשאו לא נחלק בין נישא לנושא למרכב שחלק מגעו ,ref-sifra
12542,ref-m.6.1.24.3.2-ref-m.6.1.24.3.10,ref-sifra.9.01-02.5.14-ref-sifra.9.01-02.5.20,844717,844765,131838,131846,ref-m.00006.00001.00024.00003.00002,ref-m.00006.00001.00024.00003.00010,400923,400963,60839,60845,ref-sifra.00009.01-02.00005.00014,ref-sifra.00009.01-02.00005.00020,עריבות הן עריבה משני לוג ועד תשעה קבין שנסדקה ,ועריבה משני לוג ועד תשעה קבין שנסדקה ,ref-sifra
12543,ref-m.6.1.24.3.2-ref-m.6.1.24.3.10,ref-sifra.9.01-02.6.10-ref-sifra.9.01-02.6.16,844717,844765,131838,131846,ref-m.00006.00001.00024.00003.00002,ref-m.00006.00001.00024.00003.00010,401199,401241,60883,60889,ref-sifra.00009.01-02.00006.00010,ref-sifra.00009.01-02.00006.00016,עריבות הן עריבה משני לוג ועד תשעה קבין שנסדקה ,ועריבה משני לוגין ועד תשעה קבין שנסדקה ,ref-sifra
12544,ref-m.6.1.24.17.31-ref-m.6.1.24.17.42,ref-sifra.5.08-10.8.20-ref-sifra.5.08-10.8.31,846141,846202,132066,132077,ref-m.00006.00001.00024.00017.00031,ref-m.00006.00001.00024.00017.00042,296166,296232,43806,43815,ref-sifra.00005.08-10.00008.00020,ref-sifra.00005.08-10.00008.00031,מבפנים טמא מבחוץ טהור טליה על צדה בין מבפנים בין מבחוץ טהור ,בין מבפנים בין מבחוץ טהורה ר'_יהודה_אומר מבפנים טמאה מבחוץ טהורה ,ref-sifra
12545,ref-m.6.1.25.6.26-ref-m.6.1.25.6.42,ref-sifra.5.08-00.5.61-ref-sifra.5.08-00.5.70,847470,847571,132257,132273,ref-m.00006.00001.00025.00006.00026,ref-m.00006.00001.00025.00006.00042,293966,294025,43444,43452,ref-sifra.00005.08-00.00005.00061,ref-sifra.00005.08-00.00005.00070,משקין על מקצתו כולו טמא כלי שנטמא אחוריו במשקין אחוריו טמאים תוכו ואוגנו ואזנו וידיו טהורין נטמא ,ידי טומאתם בו ביום וכלים שנטמאו במשקין עולים ידי טומאתן ,ref-sifra
12546,ref-m.6.1.25.6.26-ref-m.6.1.25.6.44,ref-sifra.5.08-00.5.94-ref-sifra.5.08-00.5.118,847470,847581,132257,132275,ref-m.00006.00001.00025.00006.00026,ref-m.00006.00001.00025.00006.00044,294149,294280,43472,43490,ref-sifra.00005.08-00.00005.00094,ref-sifra.00005.08-00.00005.00118,משקין על מקצתו כולו טמא כלי שנטמא אחוריו במשקין אחוריו טמאים תוכו ואוגנו ואזנו וידיו טהורין נטמא תוכו כולו ,תוכו טמא וכלים שנטמאו במשקים תוכו טהור אם_כן_למה_נאמר משקה בכל כלי יטמא מלמד שהכלים מטמאים את המשקים ר'_אליעזר_אומר אין טומאה ,ref-sifra
12547,ref-m.6.1.25.6.26-ref-m.6.1.25.6.36,ref-sifra.5.08-00.5.142-ref-sifra.5.08-00.5.148,847470,847532,132257,132267,ref-m.00006.00001.00025.00006.00026,ref-m.00006.00001.00025.00006.00036,294391,294439,43510,43515,ref-sifra.00005.08-00.00005.00142,ref-sifra.00005.08-00.00005.00148,משקין על מקצתו כולו טמא כלי שנטמא אחוריו במשקין אחוריו טמאים ,המשקין והמשקים מטמאין את הכלים והכלים מטמאין ,ref-sifra
12548,ref-m.6.1.25.6.30-ref-m.6.1.25.6.43,ref-sifra.5.07-00.5.16-ref-sifra.5.07-00.5.23,847490,847576,132261,132274,ref-m.00006.00001.00025.00006.00030,ref-m.00006.00001.00025.00006.00043,287445,287492,42500,42506,ref-sifra.00005.07-00.00005.00016,ref-sifra.00005.07-00.00005.00023,טמא כלי שנטמא אחוריו במשקין אחוריו טמאים תוכו ואוגנו ואזנו וידיו טהורין נטמא תוכו ,מטמא מתוכו מטמא מאחוריו כלי חרס שמטמא מתוכו ,ref-sifra
12549,ref-m.6.1.27.1.7-ref-m.6.1.27.1.17,ref-sifra.11.01-00.12.40-ref-sifra.11.01-00.12.53,850319,850375,132700,132710,ref-m.00006.00001.00027.00001.00007,ref-m.00006.00001.00027.00001.00017,485597,485663,73952,73962,ref-sifra.00011.01-00.00012.00040,ref-sifra.00011.01-00.00012.00053,משום ארבעה העור משום שלשה העץ משום שנים וכלי חרס משום ,שתי אזהרות משום לא תעשה תעשה ומשום לכם ר'_יוסי_אומר משום שלש משום ,ref-sifra
12550,ref-m.6.1.27.1.23-ref-m.6.1.27.1.33,ref-sifra.5.07-00.4.32-ref-sifra.5.07-00.4.40,850398,850447,132715,132723,ref-m.00006.00001.00027.00001.00023,ref-m.00006.00001.00027.00001.00033,287328,287368,42484,42490,ref-sifra.00005.07-00.00004.00032,ref-sifra.00005.07-00.00004.00040,כלי קבול כל שאין לו תוך בכלי חרס אין לו אחוריים ,כל שאין לו תוך בכלי חרס אין לו אחוריים ,ref-sifra
