,baseOrig,compOrig,baseCharStart,baseCharEnd,baseWdStart,baseWdEnd,baseRefStart,baseRefEnd,compCharStart,compCharEnd,compWdStart,compWdEnd,compRefStart,compRefEnd,baseStr,compStr,compWork
14850,ref-m.03.01.12.1.13-ref-m.03.01.12.1.28,ref-sifre-d.291.3.35-ref-sifre-d.291.4.9,305813,305898,47429,47443,ref-m.00003.00001.00012.00001.00013,ref-m.00003.00001.00012.00001.00028,276026,276118,46241,46256,ref-sifre-d.00291.00003.00035,ref-sifre-d.00291.00004.00009,חליצתה פסולה בסנדל שיש לו עקב כשר ושאין לו עקב פסול מן הארכובה ולמטה חליצתה כשרה ,ושאין לו עקב שחלציתה אולי שחליצתה פסולה מעל רגלו מכאן אמרו מן הארכובה ולמטה חליצתה כשרה ,ref-sifre-d
14851,ref-m.03.01.12.2.16-ref-m.03.01.12.2.27,ref-sifre-d.291.3.24-ref-sifre-d.291.3.34,306007,306066,47464,47474,ref-m.00003.00001.00012.00002.00016,ref-m.00003.00001.00012.00002.00027,275969,276025,46231,46240,ref-sifre-d.00291.00003.00024,ref-sifre-d.00291.00003.00034,בגדול שהוא יכול להלוך בו או בקטן שהוא חופה את רוב רגלו ,לגדול שאין יכול לילך בו ולקטן שאין חופה את רוב הרגל ,ref-sifre-d
14852,ref-m.03.01.12.2.39-ref-m.03.01.12.3.29,ref-sifre-d.291.5.18-ref-sifre-d.291.5.40,306135,306312,47485,47509,ref-m.00003.00001.00012.00002.00039,ref-m.00003.00001.00012.00003.00029,276323,276448,46294,46313,ref-sifre-d.00291.00005.00018,ref-sifre-d.00291.00005.00040,פסולה ורבי אליעזר מכשיר חלצה ורקקה אבל לא קראה חליצתה כשרה קראה ורקקה אבל לא חלצה חליצתה פסולה חלצה וקראה אבל לא רקקה רבי_אליעזר_אומר חליצתה פסולה רבי_עקיבא_אומר חליצתה כשרה ,"קראה חליצתה כשרה קראה ורקקה ולא חלצה חליצתה פסולה חלצה וקראה אבל לא רקקה ר'_אליעזר_אומר חליצתה פסולה ור""ע אומר חליצתה כשרה ",ref-sifre-d
14853,ref-m.03.01.12.2.34-ref-m.03.01.12.4.2,ref-sifre-d.291.7.3-ref-sifre-d.291.7.51,306103,306436,47481,47526,ref-m.00003.00001.00012.00002.00034,ref-m.00003.00001.00012.00004.00002,276574,276823,46336,46381,ref-sifre-d.00291.00007.00003,ref-sifre-d.00291.00007.00051,ורבי אליעזר פוסל בשמאל חליצתה פסולה ורבי אליעזר מכשיר חלצה ורקקה אבל לא קראה חליצתה כשרה קראה ורקקה אבל לא חלצה חליצתה פסולה חלצה וקראה אבל לא רקקה רבי_אליעזר_אומר חליצתה פסולה רבי_עקיבא_אומר חליצתה כשרה אמר_רבי_אליעזר ככה יעשה כל_דבר_שהוא מעשה מעכב אמר_לו_רבי_עקיבא משם ראיה ככה יעשה לאיש כל_דבר_שהוא מעשה באיש החרש שנחלץ ,"לאיש מכאן אמרו חלצה ורקקה ולא קראה חליצתה כשרה קראה ורקקה ולא חלצה חליצתה פסולה חלצה וקראה אבל לא רקקה ר""א אומר חליצתה פסולה ור""ע אומר חליצתה כשרה א""ל ר""א ככה יעשה כל דבר שהוא מעשה מעכב א""ל ר""ע משם ראיה ככה יעשה לאיש כל דבר שהוא מעשה באיש ",ref-sifre-d
14854,ref-m.03.01.12.6.15-ref-m.03.01.12.6.31,ref-sifre-d.289.10.21-ref-sifre-d.290.2.2,306785,306873,47578,47594,ref-m.00003.00001.00012.00006.00015,ref-m.00003.00001.00012.00006.00031,275271,275388,46109,46130,ref-sifre-d.00289.00010.00021,ref-sifre-d.00290.00002.00002,וקראו לו זקני עירו ודברו אליו והיא אומרת מאן יבמי להקים לאחיו שם בישראל לא אבה יבמי ,בישראל ולא בגרים לא אבה יבמי ולא שלא אבה בה המקום וקראו לו זקני עירו מצוה בזקני עירו ולא בשלוחם ודברו אליו ,ref-sifre-d
14855,ref-m.03.01.12.6.21-ref-m.03.01.12.6.28,ref-sifre-d.289.8.10-ref-sifre-d.289.9.6,306817,306861,47584,47591,ref-m.00003.00001.00012.00006.00021,ref-m.00003.00001.00012.00006.00028,274852,274900,46031,46038,ref-sifre-d.00289.00008.00010,ref-sifre-d.00289.00009.00006,והיא אומרת מאן יבמי להקים לאחיו שם בישראל ,ושיהיה בזקנים מאן יבמי להקים לאחיו שם בישראל ,ref-sifre-d
14856,ref-m.03.01.12.6.41-ref-m.03.01.12.6.45,ref-sifre-d.291.1.1-ref-sifre-d.291.1.5,306925,306957,47601,47605,ref-m.00003.00001.00012.00006.00041,ref-m.00003.00001.00012.00006.00045,275698,275730,46190,46194,ref-sifre-d.00291.00001.00001,ref-sifre-d.00291.00001.00005,ונגשה יבמתו אליו לעיני הזקנים ,ונגשה יבמתו אליו לעיני הזקנים ,ref-sifre-d
14857,ref-m.03.01.12.6.44-ref-m.03.01.12.6.53,ref-sifre-d.291.2.5-ref-sifre-d.291.3.6,306943,307002,47604,47613,ref-m.00003.00001.00012.00006.00044,ref-m.00003.00001.00012.00006.00053,275789,275882,46204,46217,ref-sifre-d.00291.00002.00005,ref-sifre-d.00291.00003.00006,לעיני הזקנים וחלצה נעלו מעל רגלו וירקה בפניו רוק הנראה ,וירקה רוק הנראה לעיני הזקנים מלמד שמתיחדת עמו לעיני הזקנים וחלצה נעלו אין_לי_אלא נעלו ,ref-sifre-d
14858,ref-m.03.01.12.6.57-ref-m.03.01.12.6.65,ref-sifre-d.291.7.44-ref-sifre-d.291.8.6,307026,307064,47617,47623,ref-m.00003.00001.00012.00006.00057,ref-m.00003.00001.00012.00006.00065,276785,276847,46375,46385,ref-sifre-d.00291.00007.00044,ref-sifre-d.00291.00008.00006,ככה יעשה לאיש אשר לא יבנה את בית אחיו ,ככה יעשה לאיש כל דבר שהוא מעשה באיש אשר לא יבנה את בית אחיו ,ref-sifre-d
14859,ref-m.03.01.12.6.87-ref-m.03.01.12.6.109,ref-sifre-d.291.10.4-ref-sifre-d.291.10.21,307180,307305,47643,47662,ref-m.00003.00001.00012.00006.00087,ref-m.00003.00001.00012.00006.00109,277007,277104,46412,46426,ref-sifre-d.00291.00010.00004,ref-sifre-d.00291.00010.00021,שמו בישראל בית חלוץ הנעל מצוה בדיינין ולא מצוה בתלמידים רבי_יהודה_אומר מצוה על כל העומדים שם לומר חלוץ הנעל חלוץ הנעל ,מצוה בדיינים ולא מצוה בתלמידים ר'_יהודה_אומר מצוה על כל העומדים שם לומר חלוץ הנעל חלוץ הנעל ,ref-sifre-d
14860,ref-m.03.01.12.6.105-ref-m.03.01.12.6.109,ref-sifre-d.291.10.37-ref-sifre-d.291.10.41,307279,307305,47658,47662,ref-m.00003.00001.00012.00006.00105,ref-m.00003.00001.00012.00006.00109,277178,277206,46438,46442,ref-sifre-d.00291.00010.00037,ref-sifre-d.00291.00010.00041,לומר חלוץ הנעל חלוץ הנעל ,ואמרו חלוץ הנעל חלוץ הנעל ,ref-sifre-d
14861,ref-m.03.01.13.2.8-ref-m.03.01.13.2.13,ref-sifre-d.17.7.75-ref-sifre-d.17.7.83,307767,307803,47717,47722,ref-m.00003.00001.00013.00002.00008,ref-m.00003.00001.00013.00002.00013,21789,21837,3673,3680,ref-sifre-d.00017.00007.00075,ref-sifre-d.00017.00007.00083,אמה ואחיה לדעתה השיאוה שלא לדעתה ,חייך שאני מודיעך שאין אתה רואה ואימתי הודיע לו ,ref-sifre-d
14862,ref-m.03.01.13.4.9-ref-m.03.01.13.4.28,ref-sifre-d.270.7.27-ref-sifre-d.270.8.6,308161,308269,47772,47791,ref-m.00003.00001.00013.00004.00009,ref-m.00003.00001.00013.00004.00028,258536,258594,43271,43280,ref-sifre-d.00270.00007.00027,ref-sifre-d.00270.00008.00006,ולא פסלה מן הכהונה נתן לה גט הוא אסור בקרובותיה והיא אסורה בקרוביו ופסלה מן הכהונה נתן לה גט והחזירה ,תהיה אסורה לחזור לו ומנין לנותן גט ליבמתו שאסורה לחזור ,ref-sifre-d
14863,ref-m.03.01.13.4.41-ref-m.03.01.13.4.60,ref-sifre-d.270.7.6-ref-sifre-d.270.8.3,308335,308437,47804,47823,ref-m.00003.00001.00013.00004.00041,ref-m.00003.00001.00013.00004.00060,258429,258572,43252,43277,ref-sifre-d.00270.00007.00006,ref-sifre-d.00270.00008.00003,והחזירה נתן לה גט ונשאת לאחר ונתארמלה או נתגרשה אסורה לחזור לו זה הכלל גט אחר מיאון אסורה לחזור לו ,"לאחר שנתגרשה תהא אסורה לחזור לו ת""ל וכתב לה  ויצאה היוצאה בגט תהא אסורה לחזור לו ולא שקלקלה על בעלה תהיה אסורה לחזור לו ומנין לנותן גט ",ref-sifre-d
14864,ref-m.03.01.15.1.1-ref-m.03.01.15.1.15,ref-sifre-d.270.8.14-ref-sifre-d.270.8.23,312359,312447,48437,48451,ref-m.00003.00001.00015.00001.00001,ref-m.00003.00001.00015.00001.00015,258630,258682,43287,43296,ref-sifre-d.00270.00008.00014,ref-sifre-d.00270.00008.00023,האשה שהלכה היא ובעלה למדינת הים שלום בינו לבינה ושלום בעולם ובאתה ואמרה מת בעלי ,לאשה שהלך בעלה למדינת הים ואמרו לה הרי מת בעליך ,ref-sifre-d
14865,ref-m.03.01.15.4.31-ref-m.03.01.15.4.44,ref-sifre-d.190.3.20-ref-sifre-d.190.3.36,313368,313430,48593,48603,ref-m.00003.00001.00015.00004.00031,ref-m.00003.00001.00015.00004.00044,201409,201492,33686,33702,ref-sifre-d.00190.00003.00020,ref-sifre-d.00190.00003.00036,עד אומר מת ושנים אומרים לא מת_אף_על_פי שנשאת תצא שנים אומרים ,לעדות נאמר כאן שני ונאמר להלן שני מה שני האמור כאן אנשים ולא נשים אף שני האמור ,ref-sifre-d
14866,ref-m.03.01.15.5.64-ref-m.03.01.15.6.10,ref-sifre-d.270.8.14-ref-sifre-d.270.8.23,313779,313863,48664,48677,ref-m.00003.00001.00015.00005.00064,ref-m.00003.00001.00015.00006.00010,258630,258682,43287,43296,ref-sifre-d.00270.00008.00014,ref-sifre-d.00270.00008.00023,אומרת לא מת הרי זו לא תנשא האשה שהלכה היא ובעלה למדינת הים ובאה ואמרה מת בעלי ,לאשה שהלך בעלה למדינת הים ואמרו לה הרי מת בעליך ,ref-sifre-d
14867,ref-m.03.01.15.8.1-ref-m.03.01.15.8.12,ref-sifre-d.270.8.14-ref-sifre-d.270.8.23,314611,314679,48786,48797,ref-m.00003.00001.00015.00008.00001,ref-m.00003.00001.00015.00008.00012,258630,258682,43287,43296,ref-sifre-d.00270.00008.00014,ref-sifre-d.00270.00008.00023,האשה שהלכה היא ובעלה למדינת הים ובנה עמהם ובאה ואמרה מת בעלי ,לאשה שהלך בעלה למדינת הים ואמרו לה הרי מת בעליך ,ref-sifre-d
14868,ref-m.03.01.15.10.18-ref-m.03.01.15.10.26,ref-sifre-d.270.8.15-ref-sifre-d.270.8.23,314985,315033,48840,48848,ref-m.00003.00001.00015.00010.00018,ref-m.00003.00001.00015.00010.00026,258636,258682,43288,43296,ref-sifre-d.00270.00008.00015,ref-sifre-d.00270.00008.00023,הלכה היא ובעלה ויבמה למדינת הים אמרה מת בעלי ,שהלך בעלה למדינת הים ואמרו לה הרי מת בעליך ,ref-sifre-d
14869,ref-m.03.01.16.1.1-ref-m.03.01.16.1.11,ref-sifre-d.270.8.14-ref-sifre-d.270.8.23,315215,315276,48879,48889,ref-m.00003.00001.00016.00001.00001,ref-m.00003.00001.00016.00001.00011,258630,258682,43287,43296,ref-sifre-d.00270.00008.00014,ref-sifre-d.00270.00008.00023,האשה שהלך בעלה וצרתה למדינת הים ובאו ואמרו לה מת בעליך ,לאשה שהלך בעלה למדינת הים ואמרו לה הרי מת בעליך ,ref-sifre-d
14870,ref-m.03.01.16.4.49-ref-m.03.01.16.4.61,ref-sifre-d.291.4.1-ref-sifre-d.291.4.7,316226,316299,49048,49060,ref-m.00003.00001.00016.00004.00049,ref-m.00003.00001.00016.00004.00061,276069,276106,46248,46254,ref-sifre-d.00291.00004.00001,ref-sifre-d.00291.00004.00007,עלה בידם אלא רגלו אמרו חכמים מן הארכובה ולמעלה תנשא מן הארכובה ולמטה ,מעל רגלו מכאן אמרו מן הארכובה ולמטה ,ref-sifre-d
14871,ref-m.03.02.3.1.32-ref-m.03.02.3.1.47,ref-sifre-d.280.2.12-ref-sifre-d.280.2.23,322052,322127,49933,49947,ref-m.00003.00002.00003.00001.00032,ref-m.00003.00002.00003.00001.00047,264600,264663,44285,44295,ref-sifre-d.00280.00002.00012,ref-sifre-d.00280.00002.00023,ועל אחות אביו ועל אחות אמו ועל אחות אשתו ועל אשת אחיו ועל אשת אחי אביו ,אביו ואחי אמו ובעל אחותו ובעל אחות אביו ובעל אחות אמו ובעל ,ref-sifre-d
14872,ref-m.03.02.3.1.36-ref-m.03.02.3.1.47,ref-sifre-d.116.5.9-ref-sifre-d.116.6.1,322072,322127,49936,49947,ref-m.00003.00002.00003.00001.00036,ref-m.00003.00002.00003.00001.00047,153593,153640,25760,25767,ref-sifre-d.00116.00005.00009,ref-sifre-d.00116.00006.00001,אחות אמו ועל אחות אשתו ועל אשת אחיו ועל אשת אחי אביו ,אחיך מלמד שאחיך מאביך קודם לאחיך מאמך באחת ,ref-sifre-d
14873,ref-m.03.02.3.5.2-ref-m.03.02.3.5.31,ref-sifre-d.238.8.3-ref-sifre-d.238.8.35,322909,323071,50072,50100,ref-m.00003.00002.00003.00005.00002,ref-m.00003.00002.00003.00005.00031,237835,238014,39765,39796,ref-sifre-d.00238.00008.00003,ref-sifre-d.00238.00008.00035,שותה בעציצו אפילו היא חגרת אפילו היא סומא ואפילו היתה מוכת שחין נמצא בה דבר ערוה או שאינה ראויה לבא בישראל אינו רשאי לקיימה שנאמר ולו תהיה לאשה אשה הראויה ,"לאשה מלמד ששותה בעציצו ואפילו היא חיגרת ואפי' היא סומא ואפי' היא מוכת שחין נמצא בה דבר זימה או שאינה ראויה לבא בישראל יכול יהיה רשאי לקיימה ת""ל ולו תהיה לאשה אשה הראויה ",ref-sifre-d
14874,ref-m.03.02.3.5.2-ref-m.03.02.3.5.32,ref-sifre-d.245.5.3-ref-sifre-d.245.5.36,322909,323074,50072,50101,ref-m.00003.00002.00003.00005.00002,ref-m.00003.00002.00003.00005.00032,243762,243945,40708,40739,ref-sifre-d.00245.00005.00003,ref-sifre-d.00245.00005.00036,שותה בעציצו אפילו היא חגרת אפילו היא סומא ואפילו היתה מוכת שחין נמצא בה דבר ערוה או שאינה ראויה לבא בישראל אינו רשאי לקיימה שנאמר ולו תהיה לאשה אשה הראויה לו ,"לאשה מלמד ששותה בעציצו ואפילו היא חיגרת ואפילו היא סומא ואפילו היא מוכת עץ שחין נמצא בה דבר זימה או שאינה ראויה לבא בישראל יכול יהיה רשאי לקיימה ת""ל ולו תהיה לאשה הראויה לו ",ref-sifre-d
14875,ref-m.03.02.3.6.1-ref-m.03.02.3.6.8,ref-sifre-d.245.6.9-ref-sifre-d.245.6.17,323075,323125,50102,50107,ref-m.00003.00002.00003.00006.00001,ref-m.00003.00002.00003.00006.00008,243985,244046,40747,40755,ref-sifre-d.00245.00006.00009,ref-sifre-d.00245.00006.00017,יתומה שנתארסה ונתגרשה רבי_אלעזר_אומר המפתה פטור ,יתומה שנתארסה שנתארמלה או שנתגרשה האונס חייב והמפתה פטור ,ref-sifre-d
14876,ref-m.03.02.4.3.15-ref-m.03.02.4.3.23,ref-sifre-d.238.6.4-ref-sifre-d.238.6.12,324387,324439,50310,50318,ref-m.00003.00002.00004.00003.00015,ref-m.00003.00002.00004.00003.00023,237678,237736,39736,39744,ref-sifre-d.00238.00006.00004,ref-sifre-d.00238.00006.00012,ולא מאה סלע היתה הורתה שלא בקדושה ולידתה בקדושה ,ולא לאבי גיורת שהיתה הורתה שלא בקדושה ולידתה בקדושה ,ref-sifre-d
14877,ref-m.03.02.4.3.18-ref-m.03.02.4.3.23,ref-sifre-d.289.10.9-ref-sifre-d.289.10.14,324400,324439,50313,50318,ref-m.00003.00002.00004.00003.00018,ref-m.00003.00002.00004.00003.00023,275192,275233,46097,46102,ref-sifre-d.00289.00010.00009,ref-sifre-d.00289.00010.00014,היתה הורתה שלא בקדושה ולידתה בקדושה ,שהיתה הורתן שלא בקדושה ולידתן בקדושה ,ref-sifre-d
14878,ref-m.03.02.4.3.46-ref-m.03.02.4.3.58,ref-sifre-d.239.2.5-ref-sifre-d.239.2.26,324546,324595,50337,50347,ref-m.00003.00002.00004.00003.00046,ref-m.00003.00002.00004.00003.00058,238260,238342,39841,39856,ref-sifre-d.00239.00002.00005,ref-sifre-d.00239.00002.00026,יש לה אב ואין לה פתח בית האב יש לה פתח בית האב ,פתח בית אביה אין_לי_אלא שיש לה אב ויש לה פתח בית אב יש לה פתח בית אב ואין לה אב ,ref-sifre-d
14879,ref-m.03.02.5.1.21-ref-m.03.02.5.1.40,ref-sifre-d.270.9.9-ref-sifre-d.270.9.17,326325,326428,50617,50630,ref-m.00003.00002.00005.00001.00021,ref-m.00003.00002.00005.00001.00040,258884,258948,43332,43340,ref-sifre-d.00270.00009.00009,ref-sifre-d.00270.00009.00017,מן האירוסין בין מן הנשואין גובה את הכל רבי_אלעזר_בן_עזריה_אומר מן הנשואין גובה את הכל מן האירוסין ,מן הנשואים לנשואים לארוסים מן האירוסים מן האירוסים לנשואים ,ref-sifre-d
14880,ref-m.03.02.5.9.26-ref-m.03.02.5.9.34,ref-sifre-d.166.6.12-ref-sifre-d.166.6.18,328930,328978,51028,51036,ref-m.00003.00002.00005.00009.00026,ref-m.00003.00002.00005.00009.00034,188682,188720,31567,31573,ref-sifre-d.00166.00006.00012,ref-sifre-d.00166.00006.00018,משקל חמש סלעים שתי ביהודה שהן עשר סלעים בגליל ,משקל ה' סלעים ביהודה שהם עשרה בגליל ,ref-sifre-d
14881,ref-m.03.02.8.4.6-ref-m.03.02.8.4.16,ref-sifre-d.283.4.42-ref-sifre-d.283.4.52,333985,334048,51776,51786,ref-m.00003.00002.00008.00004.00006,ref-m.00003.00002.00008.00004.00016,266872,266916,44658,44665,ref-sifre-d.00283.00004.00042,ref-sifre-d.00283.00004.00052,כחו בכניסתה הורע כחו ביציאתה מקום שהורע כחו בכניסתה יפה כחו ,כחו של_בעל_הבית או הורע כחו אמרו לו יופי כחו ,ref-sifre-d
14882,ref-m.03.02.10.1.4-ref-m.03.02.10.1.20,ref-sifre-d.289.4.9-ref-sifre-d.289.4.17,338536,338639,52452,52467,ref-m.00003.00002.00010.00001.00004,ref-m.00003.00002.00010.00001.00020,274332,274370,45936,45944,ref-sifre-d.00289.00004.00009,ref-sifre-d.00289.00004.00017,שתי נשים ומת הראשונה קודמת לשניה ויורשי הראשונה קודמים ליורשי שניה נשא את הראשונה ומתה נשא שניה ,אשת שנים מנין מת ראשון ייבם שני מת שני ,ref-sifre-d
14883,ref-m.03.02.10.1.14-ref-m.03.02.10.2.5,ref-sifre-d.190.2.1-ref-sifre-d.190.2.16,338604,338708,52462,52477,ref-m.00003.00002.00010.00001.00014,ref-m.00003.00002.00010.00002.00005,201201,201271,33651,33663,ref-sifre-d.00190.00002.00001,ref-sifre-d.00190.00002.00016,שניה נשא את הראשונה ומתה נשא שניה ומת הוא שניה ויורשיה קודמים ליורשי הראשונה מי_שהיה_נשוי שתי נשים ,שני האנשים אין_לי_אלא_בזמן שהם שני אנשים איש עם אשה ואשה עם איש שתי ,ref-sifre-d
14884,ref-m.03.02.10.4.7-ref-m.03.02.10.4.26,ref-sifre-d.38.10.131-ref-sifre-d.38.11.12,339153,339243,52552,52570,ref-m.00003.00002.00010.00004.00007,ref-m.00003.00002.00010.00004.00026,60936,61006,10262,10276,ref-sifre-d.00038.00010.00131,ref-sifre-d.00038.00011.00012,כתובתה של זו מנה ושל זו מאתים ושל זו שלש מאות ואין שם אלא מנה חולקות בשוה היו שם מאתים ,שהייתם אתם שם אתה אומר לכך בא הכתוב להקיש ביאתה של זו לביאתה של זו ,ref-sifre-d
14885,ref-m.03.02.11.2.6-ref-m.03.02.11.3.1,ref-sifre-d.118.4.18-ref-sifre-d.118.4.26,340152,340337,52723,52749,ref-m.00003.00002.00011.00002.00006,ref-m.00003.00002.00011.00003.00001,156362,156405,26233,26241,ref-sifre-d.00118.00004.00018,ref-sifre-d.00118.00004.00026,מן הנשואין מוכרת שלא בבית דין רבי_שמעון_אומר מן הנשואין מוכרת שלא בבית דין מן הארוסין לא תמכור אלא בבית דין מפני שאין לה מזונות וכל שאין לה מזונות לא תמכור אלא בבית דין מכרה ,"מנין כשמוכר עצמו לא ימכר אלא לך ת""ל ונמכר ",ref-sifre-d
14886,ref-m.03.02.12.4.65-ref-m.03.02.13.1.10,ref-sifre-d.105.19.5-ref-sifre-d.105.19.13,342572,342633,53106,53116,ref-m.00003.00002.00012.00004.00065,ref-m.00003.00002.00013.00001.00010,144050,144096,24163,24170,ref-sifre-d.00105.00019.00005,ref-sifre-d.00105.00019.00013,שנים שני דייני גזירות היו בירושלם אדמון וחנן בן אבישלום חנן ,חנויות בני חנן שתי שנים קודם לארץ ישראל שהיו ,ref-sifre-d
14887,ref-m.03.03.5.5.27-ref-m.03.03.5.5.43,ref-sifre-d.357.28.6-ref-sifre-d.357.28.26,354004,354102,54942,54956,ref-m.00003.00003.00005.00005.00027,ref-m.00003.00003.00005.00005.00043,385629,385729,64940,64953,ref-sifre-d.00357.00028.00006,ref-sifre-d.00357.00028.00026,לנשיא רבי_יהודה_אומר אחד כותב לנשיא ואחד כותב להדיוט מה בין כותב לנשיא לכותב להדיוט שהכותב ,משה וכתיב וימת שם משה אלא עד כאן כתב משה ומכאן ואילך כתב יהושע ר'_מאיר_אומר_הרי_הוא_אומר ויכתוב ,ref-sifre-d
14888,ref-m.03.03.5.6.55-ref-m.03.03.5.6.67,ref-sifre-d.11.1.87-ref-sifre-d.11.1.100,354543,354598,55028,55037,ref-m.00003.00003.00005.00006.00055,ref-m.00003.00003.00005.00006.00067,14970,15028,2525,2536,ref-sifre-d.00011.00001.00087,ref-sifre-d.00011.00001.00100,לא נתתי את שלי שתקדישם לשמים אמר לו לא נתתה לי את שלך ,משלו כדי פרנסתו אמר לו כל מה שנתתי לך לא נתתי לך אלא משלי ,ref-sifre-d
14889,ref-m.03.03.9.4.18-ref-m.03.03.9.4.34,ref-sifre-d.235.3.17-ref-sifre-d.235.3.37,361875,361955,56242,56257,ref-m.00003.00003.00009.00004.00018,ref-m.00003.00003.00009.00004.00034,235362,235461,39360,39379,ref-sifre-d.00235.00003.00017,ref-sifre-d.00235.00003.00037,לא תקום ועל לא תטור ועל לא תשנא את אחיך בלבבך ואהבת לרעך כמוך וחי אחיך עמך ,כמוך סופו לעבור על לא תקום ולא תטור ועל לא תשנא את אחיך ואהבת לרעך כמוך וחי אחיך אמך אולי עמך ע,ref-sifre-d
14890,ref-m.03.03.9.4.18-ref-m.03.03.9.4.34,ref-sifre-d.186.2.24-ref-sifre-d.186.2.42,361875,361955,56242,56257,ref-m.00003.00003.00009.00004.00018,ref-m.00003.00003.00009.00004.00034,197875,197967,33112,33130,ref-sifre-d.00186.00002.00024,ref-sifre-d.00186.00002.00042,לא תקום ועל לא תטור ועל לא תשנא את אחיך בלבבך ואהבת לרעך כמוך וחי אחיך עמך ,ואהבת לרעך כמוך סופו לעבור על לא תשנא ועל לא תקום ולא תטור וסופו לעבור על וחי אחיך עמך ,ref-sifre-d
14891,ref-m.03.03.10.4.24-ref-m.03.03.10.4.34,ref-sifre-d.273.5.7-ref-sifre-d.273.5.17,364411,364469,56657,56666,ref-m.00003.00003.00010.00004.00024,ref-m.00003.00003.00010.00004.00034,260569,260639,43605,43613,ref-sifre-d.00273.00005.00007,ref-sifre-d.00273.00005.00017,תכנס לרשותו אומר לה כל נדרים שנדרת עד שלא תכנסי לרשותי ,שיכניסנו לרשותו ר'_יהודה_אומר עד שיכניסנו לרשותו וישתמש בו שנאמר ,ref-sifre-d
14892,ref-m.03.03.11.10.12-ref-m.03.03.11.10.33,ref-sifre-d.245.2.1-ref-sifre-d.245.3.5,367434,367549,57129,57150,ref-m.00003.00003.00011.00010.00012,ref-m.00003.00003.00011.00010.00033,243638,243732,40686,40701,ref-sifre-d.00245.00002.00001,ref-sifre-d.00245.00003.00005,נערה שלא בגרה והיא יתומה בוגרת ומת אביה נערה בוגרת ומת אביה נערה שלא בגרה ומת אביה נערה שמת אביה ומשמת אביה ,לאבי הנערה כל שכיבה לאבי הנערה שיהיה שלו השוכב כל שכיבה לאבי הנערה ולא לאבי הבוגרות ,ref-sifre-d
14893,ref-m.03.04.7.1.57-ref-m.03.04.7.2.1,ref-sifre-d.71.6.53-ref-sifre-d.71.6.68,380249,380309,59140,59150,ref-m.00003.00004.00007.00001.00057,ref-m.00003.00004.00007.00002.00001,115716,115804,19420,19434,ref-sifre-d.00071.00006.00053,ref-sifre-d.00071.00006.00068,שאין קדושתו קדושת עולם ואל יטמא כהן שקדושתו קדושת עולם על ,קדושתו מרחם וקדושתו חלה עליו על בעל מום קבוע תאמר בקדשים שאין קדושתם מרחם ואין קדושה ,ref-sifre-d
14894,ref-m.03.04.7.1.57-ref-m.03.04.7.2.1,ref-sifre-d.124.3.86-ref-sifre-d.124.3.100,380249,380309,59140,59150,ref-m.00003.00004.00007.00001.00057,ref-m.00003.00004.00007.00002.00001,161029,161119,27036,27050,ref-sifre-d.00124.00003.00086,ref-sifre-d.00124.00003.00100,שאין קדושתו קדושת עולם ואל יטמא כהן שקדושתו קדושת עולם על ,קדושתו מרחם וקדושתו חלה עליו בבעל מום קבוע תאמר בקדשים שאין קדושתם מרחם ואין קדושתם ,ref-sifre-d
14895,ref-m.03.04.7.4.88-ref-m.03.04.7.4.92,ref-sifre-d.218.8.1-ref-sifre-d.218.8.5,381404,381442,59338,59342,ref-m.00003.00004.00007.00004.00088,ref-m.00003.00004.00007.00004.00092,221047,221087,36980,36984,ref-sifre-d.00218.00008.00001,ref-sifre-d.00218.00008.00005,וכשבאתי והרציתי דברים לפני רבי יהושע ,וכשבאתי והרציתי הדברים לפני רבי יהודה ,ref-sifre-d
