,baseOrig,compOrig,baseCharStart,baseCharEnd,baseWdStart,baseWdEnd,baseRefStart,baseRefEnd,compCharStart,compCharEnd,compWdStart,compWdEnd,compRefStart,compRefEnd,baseStr,compStr,compWork
22709,ref-y.4.1.2.6.2.16-ref-y.4.1.2.6.2.25,ref-mek.7.10.2.83-ref-mek.7.10.2.94,2967755,2967809,445311,445318,ref-y.00004.00001.00002.00006.00002.00016,ref-y.00004.00001.00002.00006.00002.00025,324250,324309,52652,52660,ref-mek.00007.00010.00002.00083,ref-mek.00007.00010.00002.00094,פעמים ביום אחד אינו מועד ומה_תלמוד_לומר מתמול שלשום ,פעמים ביום אחד זה אחר זה חייב ומה_תלמוד_לומר מתמול שלשום ,ref-mek
22710,ref-y.4.1.3.9.1.26-ref-y.4.1.3.9.1.33,ref-mek.7.12.1.153-ref-mek.7.12.1.158,2976501,2976534,446627,446633,ref-y.00004.00001.00003.00009.00001.00026,ref-y.00004.00001.00003.00009.00001.00033,330788,330813,53661,53666,ref-mek.00007.00012.00001.00153,ref-mek.00007.00012.00001.00158,שור שוה מנה כו' שור שוה מנה שנגח ,שור שוה מנה שנגח שור שוה ,ref-mek
22711,ref-y.4.1.3.9.1.26-ref-y.4.1.3.9.1.34,ref-mek.7.12.1.159-ref-mek.7.12.1.173,2976501,2976540,446627,446634,ref-y.00004.00001.00003.00009.00001.00026,ref-y.00004.00001.00003.00009.00001.00034,330814,330882,53667,53681,ref-mek.00007.00012.00001.00159,ref-mek.00007.00012.00001.00173,שור שוה מנה כו' שור שוה מנה שנגח לשור ,מנה או שוה מאתים שנגח שור שוה מאתים נוטל חציו שור שוה מאה שנגח שור ,ref-mek
22712,ref-y.4.1.3.9.1.52-ref-y.4.1.3.9.1.66,ref-mek.7.12.1.153-ref-mek.7.12.1.166,2976620,2976691,446649,446661,ref-y.00004.00001.00003.00009.00001.00052,ref-y.00004.00001.00003.00009.00001.00066,330788,330850,53661,53674,ref-mek.00007.00012.00001.00153,ref-mek.00007.00012.00001.00166,או שהכחיש אין_לו_אלא אותו השור בלבד שור שוה מנה שנגח לשור שוה מאתים ,שור שוה מנה שנגח שור שוה מנה או שוה מאתים שנגח שור שוה מאתים ,ref-mek
22713,ref-y.4.1.3.9.1.60-ref-y.4.1.3.9.1.66,ref-mek.7.12.1.169-ref-mek.7.12.1.175,2976658,2976691,446655,446661,ref-y.00004.00001.00003.00009.00001.00060,ref-y.00004.00001.00003.00009.00001.00066,330861,330892,53677,53683,ref-mek.00007.00012.00001.00169,ref-mek.00007.00012.00001.00175,שור שוה מנה שנגח לשור שוה מאתים ,שור שוה מאה שנגח שור שוה מאתים ,ref-mek
22714,ref-y.4.1.3.9.1.80-ref-y.4.1.3.9.1.88,ref-mek.7.12.1.150-ref-mek.7.12.1.166,2976761,2976801,446675,446683,ref-y.00004.00001.00003.00009.00001.00080,ref-y.00004.00001.00003.00009.00001.00088,330772,330850,53658,53674,ref-mek.00007.00012.00001.00150,ref-mek.00007.00012.00001.00166,חצי דינר זהב שור שוה מאתים שנגח שור שוה ,יחצון מכאן אמרו שור שוה מנה שנגח שור שוה מנה או שוה מאתים שנגח שור שוה מאתים ,ref-mek
22715,ref-y.4.1.3.9.1.80-ref-y.4.1.3.9.1.98,ref-mek.7.12.1.168-ref-mek.7.12.1.187,2976761,2976852,446675,446692,ref-y.00004.00001.00003.00009.00001.00080,ref-y.00004.00001.00003.00009.00001.00098,330856,330951,53676,53695,ref-mek.00007.00012.00001.00168,ref-mek.00007.00012.00001.00187,חצי דינר זהב שור שוה מאתים שנגח שור שוה מאתים השביח והרי הוא יפה ארבע מאות שאילו לא נגחו ,חציו שור שוה מאה שנגח שור שוה מאתים נוטל כלו שוה מאתים שנגח שוה מנה נוטל רבעו שוה מאתים שנגח ,ref-mek
22716,ref-y.4.1.3.9.1.80-ref-y.4.1.3.9.1.88,ref-mek.7.12.1.213-ref-mek.7.12.1.223,2976761,2976801,446675,446683,ref-y.00004.00001.00003.00009.00001.00080,ref-y.00004.00001.00003.00009.00001.00088,331064,331111,53712,53720,ref-mek.00007.00012.00001.00213,ref-mek.00007.00012.00001.00223,חצי דינר זהב שור שוה מאתים שנגח שור שוה ,יחצון ואי_זה_זה זה שור שוה מאתים שנגח שור שוה ,ref-mek
22717,ref-y.4.1.4.4.5.130-ref-y.4.1.4.4.5.145,ref-mek.7.10.1.673-ref-mek.7.10.1.691,2983571,2983654,447689,447704,ref-y.00004.00001.00004.00004.00005.00130,ref-y.00004.00001.00004.00004.00005.00145,323197,323305,52485,52499,ref-mek.00007.00010.00001.00673,ref-mek.00007.00010.00001.00691,נקי מחצי כופר נאמר כאן השור יסקל ונאמר להלן השור יסקל מה שור שנאמר להלן במועד ,נקי מחצי כופר שהיה_בדין_הואיל ושור שהמית את השור בתשלומין ושור שהמית את האדם בתשלומין מה להלן מועד ,ref-mek
22718,ref-y.4.1.4.4.5.133-ref-y.4.1.4.4.5.144,ref-mek.1.18.4.282-ref-mek.1.18.4.294,2983586,2983647,447692,447703,ref-y.00004.00001.00004.00004.00005.00133,ref-y.00004.00001.00004.00004.00005.00144,76979,77049,12046,12058,ref-mek.00001.00018.00004.00282,ref-mek.00001.00018.00004.00294,נאמר כאן השור יסקל ונאמר להלן השור יסקל מה שור שנאמר להלן ,נאמר כאן מימים ימימה ונאמר להלן ימים תהיה גאולתו מה ימים האמור להלן ,ref-mek
22719,ref-y.4.1.4.4.5.133-ref-y.4.1.4.4.5.144,ref-mek.5.3.2.18-ref-mek.5.3.2.27,2983586,2983647,447692,447703,ref-y.00004.00001.00004.00004.00005.00133,ref-y.00004.00001.00004.00004.00005.00144,220672,220723,36268,36277,ref-mek.00005.00003.00002.00018,ref-mek.00005.00003.00002.00027,נאמר כאן השור יסקל ונאמר להלן השור יסקל מה שור שנאמר להלן ,נאמר כאן שלוח ונאמר להלן שילוח מה שלוח האמור להלן ,ref-mek
22720,ref-y.4.1.4.4.5.133-ref-y.4.1.4.4.5.144,ref-mek.7.1.2.114-ref-mek.7.1.2.123,2983586,2983647,447692,447703,ref-y.00004.00001.00004.00004.00005.00133,ref-y.00004.00001.00004.00004.00005.00144,285420,285470,46810,46819,ref-mek.00007.00001.00002.00114,ref-mek.00007.00001.00002.00123,נאמר כאן השור יסקל ונאמר להלן השור יסקל מה שור שנאמר להלן ,נאמר כאן עברי ונאמר להלן עברי מה עברי האמור להלן ,ref-mek
22721,ref-y.4.1.4.4.5.135-ref-y.4.1.4.4.5.143,ref-mek.7.10.1.42-ref-mek.7.10.1.48,2983595,2983642,447694,447702,ref-y.00004.00001.00004.00004.00005.00135,ref-y.00004.00001.00004.00004.00005.00143,319874,319907,52011,52017,ref-mek.00007.00010.00001.00042,ref-mek.00007.00010.00001.00048,השור יסקל ונאמר להלן השור יסקל מה שור שנאמר ,שור ונאמר להלן שור מה שור האמור ,ref-mek
22722,ref-y.4.1.4.4.5.169-ref-y.4.1.4.4.5.176,ref-mek.7.10.1.578-ref-mek.7.10.1.591,2983757,2983797,447725,447732,ref-y.00004.00001.00004.00004.00005.00169,ref-y.00004.00001.00004.00004.00005.00176,322729,322808,52419,52431,ref-mek.00007.00010.00001.00578,ref-mek.00007.00010.00001.00591,סקול יסקל השור אמר מוטב ילמד השור יסקל ,תאמר בשור הנסקל שהוא אסור בהנאה לפיכך יהא עורו אסור במיתתו סקול יסקל השור ,ref-mek
22723,ref-y.4.1.4.5.2.177-ref-y.4.1.4.5.2.188,ref-mek.3.5.2.139-ref-mek.3.5.2.151,2984761,2984823,447865,447876,ref-y.00004.00001.00004.00005.00002.00177,ref-y.00004.00001.00004.00005.00002.00188,155273,155324,25265,25277,ref-mek.00003.00005.00002.00139,ref-mek.00003.00005.00002.00151,מה להלן במתכוין אף כאן במתכוין מה כאן בשאינו מתכוין אף להלן ,מה להלן מטר אף כאן מטר או מה כאן גפרית ואש אף להלן ,ref-mek
22724,ref-y.4.1.4.5.2.177-ref-y.4.1.4.5.2.188,ref-mek.7.7.1.422-ref-mek.7.7.1.433,2984761,2984823,447865,447876,ref-y.00004.00001.00004.00005.00002.00177,ref-y.00004.00001.00004.00005.00002.00188,312889,312936,50973,50983,ref-mek.00007.00007.00001.00422,ref-mek.00007.00007.00001.00433,מה להלן במתכוין אף כאן במתכוין מה כאן בשאינו מתכוין אף להלן ,מה להלן חרב אף כאן חרב מה כאן בבית דין אף להלן ,ref-mek
22725,ref-y.4.1.4.5.2.177-ref-y.4.1.4.5.2.188,ref-mek.7.11.4.23-ref-mek.7.11.4.33,2984761,2984823,447865,447876,ref-y.00004.00001.00004.00005.00002.00177,ref-y.00004.00001.00004.00005.00002.00188,329820,329863,53496,53506,ref-mek.00007.00011.00004.00023,ref-mek.00007.00011.00004.00033,מה להלן במתכוין אף כאן במתכוין מה כאן בשאינו מתכוין אף להלן ,מה להלן בהמה אף כאן בהמה מה כאן כסף אף להלן ,ref-mek
22726,ref-y.4.1.4.5.2.177-ref-y.4.1.4.5.2.188,ref-mek.7.12.2.45-ref-mek.7.12.2.55,2984761,2984823,447865,447876,ref-y.00004.00001.00004.00005.00002.00177,ref-y.00004.00001.00004.00005.00002.00188,331435,331482,53769,53779,ref-mek.00007.00012.00002.00045,ref-mek.00007.00012.00002.00055,מה להלן במתכוין אף כאן במתכוין מה כאן בשאינו מתכוין אף להלן ,מה להלן בבהמה אף כאן בבהמה מה כאן כסף אף להלן ,ref-mek
22727,ref-y.4.1.4.5.2.177-ref-y.4.1.4.5.2.191,ref-mek.7.15.2.112-ref-mek.7.15.2.126,2984761,2984842,447865,447879,ref-y.00004.00001.00004.00005.00002.00177,ref-y.00004.00001.00004.00005.00002.00191,341516,341581,55396,55410,ref-mek.00007.00015.00002.00112,ref-mek.00007.00015.00002.00126,מה להלן במתכוין אף כאן במתכוין מה כאן בשאינו מתכוין אף להלן בשאינו מתכוין מאי ,"מה להלן שבועה אף כאן שבועה מה להלן ביו""ד הא אף להלן ביו""ד הא מה ",ref-mek
22728,ref-y.4.1.4.5.2.177-ref-y.4.1.4.5.2.188,ref-mek.7.15.2.131-ref-mek.7.15.2.146,2984761,2984823,447865,447876,ref-y.00004.00001.00004.00005.00002.00177,ref-y.00004.00001.00004.00005.00002.00188,341599,341666,55414,55425,ref-mek.00007.00015.00002.00131,ref-mek.00007.00015.00002.00146,מה להלן במתכוין אף כאן במתכוין מה כאן בשאינו מתכוין אף להלן ,להלן בבית דין מה להלן לצרכה אף כאן לצרכה מה כאן על_כל_דבר_פשע אף ,ref-mek
22729,ref-y.4.1.4.5.3.44-ref-y.4.1.4.5.3.52,ref-mek.7.4.1.48-ref-mek.7.4.1.56,2985109,2985147,447920,447927,ref-y.00004.00001.00004.00005.00003.00044,ref-y.00004.00001.00004.00005.00003.00052,298941,298979,48888,48895,ref-mek.00007.00004.00001.00048,ref-mek.00007.00004.00001.00056,ואיש כי יכה כל נפש אדם להביא את המכה ,ואיש כי יכה כל נפש אדם להביא את שהכה ,ref-mek
22730,ref-y.4.1.5.4.2.44-ref-y.4.1.5.4.2.49,ref-mek.7.14.1.117-ref-mek.7.14.1.122,2988952,2988986,448528,448533,ref-y.00004.00001.00005.00004.00002.00044,ref-y.00004.00001.00005.00004.00002.00049,337728,337762,54790,54795,ref-mek.00007.00014.00001.00117,ref-mek.00007.00014.00001.00122,המגדיש בתוך שדה חבירו שלא ברשות ,המגדיש בתוך שדה חבירו שלא ברשות ,ref-mek
22731,ref-y.4.1.5.4.2.71-ref-y.4.1.5.4.2.87,ref-mek.7.10.1.768-ref-mek.7.10.1.781,2989092,2989182,448550,448563,ref-y.00004.00001.00005.00004.00002.00071,ref-y.00004.00001.00005.00004.00002.00087,323681,323763,52554,52567,ref-mek.00007.00010.00001.00768,ref-mek.00007.00010.00001.00781,שור שהיה מתכוין לחבירו הא אם היה מתכוין לאשה חייב ולא_שנייא_היא בין שהוא מתכוין להכות ,שהוא מתכוין לחבירו והכה אשה ויצאו ילדיה משלם דמי ולדות אף שור שמתכוין לחבירו ,ref-mek
22732,ref-y.4.1.5.4.2.113-ref-y.4.1.5.4.2.124,ref-mek.7.10.1.767-ref-mek.7.10.1.777,2989304,2989372,448585,448595,ref-y.00004.00001.00005.00004.00002.00113,ref-y.00004.00001.00005.00004.00002.00124,323677,323739,52553,52563,ref-mek.00007.00010.00001.00767,ref-mek.00007.00010.00001.00777,אדם שהיה מתכוין לחבירו והכה את האשה ויצאו ילדיה משלם דמי וולדות ,אדם שהוא מתכוין לחבירו והכה אשה ויצאו ילדיה משלם דמי ולדות ,ref-mek
22733,ref-y.4.1.5.4.2.115-ref-y.4.1.5.4.2.124,ref-mek.7.10.1.780-ref-mek.7.10.1.788,2989314,2989372,448587,448595,ref-y.00004.00001.00005.00004.00002.00115,ref-y.00004.00001.00005.00004.00002.00124,323747,323801,52566,52574,ref-mek.00007.00010.00001.00780,ref-mek.00007.00010.00001.00788,מתכוין לחבירו והכה את האשה ויצאו ילדיה משלם דמי וולדות ,שמתכוין לחבירו והכה אשה ויצאו ילדיה משלם דמי ולדות ,ref-mek
22734,ref-y.4.1.5.5.2.24-ref-y.4.1.5.5.2.44,ref-mek.7.8.2.144-ref-mek.7.8.2.170,2989495,2989600,448615,448634,ref-y.00004.00001.00005.00005.00002.00024,ref-y.00004.00001.00005.00005.00002.00044,314632,314768,51216,51236,ref-mek.00007.00008.00002.00144,ref-mek.00007.00008.00002.00170,"ונגפו אשה הרה ויצאו ילדיה אבא יוסי בן חנן אומר ממשמע שנאמ' ויצאו ילדיה איני יודע שהיא הרה מה ת""ל הרה ",ונגפו אשה הרה ויצאו ילדיה אבא חנין משום ר' אלעזר ונגפו אשה הרה למה_נאמר_לפי_שנאמר ויצאו ילדיה הא למדנו שהיא הרה ומה_תלמוד_לומר הרה ,ref-mek
22735,ref-y.4.1.5.5.2.49-ref-y.4.1.5.5.2.83,ref-mek.7.8.2.171-ref-mek.7.8.2.222,2989622,2989786,448639,448668,ref-y.00004.00001.00005.00005.00002.00049,ref-y.00004.00001.00005.00005.00002.00083,314769,315023,51237,51271,ref-mek.00007.00008.00002.00171,ref-mek.00007.00008.00002.00222,שיכה במקום עוברה הא אם הכה על כף ידה או על כף רגלה פטור כאשר יושת עליו בעל האש' שומעני אף_על_פי_שאין ההריון שלו תלמוד לומר הרה מגיד שאינו משלם אלא לבעל ההריון ,שאם הכה על ראשה או על אחת מאיבריה שומע_אני_יהא_חייב_תלמוד_לומר הרה מגיד_שאינו_חייב_עד שיכה במקום עוברה דבר אחר ונגפו אשה הרה מה_תלמוד_לומר לפי שנאמר כאשר ישית עליו בעל האשה אף_על_פי שאין ההריון שלו תלמוד לומר הרה מגיד_שאינו_חייב אלא לבעל ההריון ,ref-mek
22736,ref-y.4.1.5.5.2.63-ref-y.4.1.5.5.2.81,ref-mek.7.8.2.345-ref-mek.7.8.2.361,2989679,2989772,448652,448666,ref-y.00004.00001.00005.00005.00002.00063,ref-y.00004.00001.00005.00005.00002.00081,315635,315725,51366,51379,ref-mek.00007.00008.00002.00345,ref-mek.00007.00008.00002.00361,כאשר יושת עליו בעל האש' שומעני אף_על_פי_שאין ההריון שלו תלמוד לומר הרה מגיד שאינו משלם אלא ,כאשר ישית עליו בעל האשה שומע_אני_כל שירצה תלמוד לומר ונתן בפלילים מגיד שאינו משלם אלא ,ref-mek
22737,ref-y.4.1.5.7.5.3-ref-y.4.1.5.7.5.14,ref-mek.7.11.3.282-ref-mek.7.11.3.301,2991213,2991285,448900,448910,ref-y.00004.00001.00005.00007.00005.00003,ref-y.00004.00001.00005.00007.00005.00014,329353,329453,53425,53439,ref-mek.00007.00011.00003.00282,ref-mek.00007.00011.00003.00301,שור וכליו ונשתברו חמור וכליו ונתקרעו חייב על הבהמה ופטור על הכלים ,שור ולא שור וכליו חמור ולא חמור וכליו שהיה_בדין_ומה_אם במקום שלא חייב על הבהמה חייב על הכלים ,ref-mek
22738,ref-y.4.1.5.7.5.37-ref-y.4.1.5.7.5.51,ref-mek.7.11.3.267-ref-mek.7.11.3.289,2991409,2991482,448928,448942,ref-y.00004.00001.00005.00007.00005.00037,ref-y.00004.00001.00005.00007.00005.00051,329289,329394,53416,53432,ref-mek.00007.00011.00003.00267,ref-mek.00007.00011.00003.00289,פטרה תורה ונפל שמה שור או חמור שור ולא שור בבליו חמור ולא חמור בכליו ,פטור ונפל שם שור או חמור חייב על זה_בפני_עצמו_ועל_זה_בפני עצמו שור ולא שור וכליו חמור ולא חמור וכליו ,ref-mek
22739,ref-y.4.1.5.7.5.39-ref-y.4.1.5.7.5.51,ref-mek.7.11.3.314-ref-mek.7.11.3.324,2991419,2991482,448930,448942,ref-y.00004.00001.00005.00007.00005.00039,ref-y.00004.00001.00005.00007.00005.00051,329517,329567,53448,53458,ref-mek.00007.00011.00003.00314,ref-mek.00007.00011.00003.00324,ונפל שמה שור או חמור שור ולא שור בבליו חמור ולא חמור בכליו ,ונפל שמה שור או חמור שור ולא כליו חמור ולא כליו ,ref-mek
22740,ref-y.4.1.5.7.5.68-ref-y.4.1.5.7.6.1,ref-mek.7.11.3.303-ref-mek.7.11.3.325,2991561,2991685,448958,448978,ref-y.00004.00001.00005.00007.00005.00068,ref-y.00004.00001.00005.00007.00006.00001,329460,329573,53441,53459,ref-mek.00007.00011.00003.00303,ref-mek.00007.00011.00003.00325,שחייב על המיתה אינו_דין_שיהא חייב על הכלים תלמוד לומר ונפל שמה שור או חמור שור ולא שור בכליו חמור ולא חמור בכליו נפל ,שחייב על הבהמה אינו_דין_שיהא חייב על הכלים תלמוד לומר ונפל שמה שור או חמור שור ולא כליו חמור ולא כליו ונפל ,ref-mek
22741,ref-y.4.1.5.7.5.79-ref-y.4.1.5.7.5.91,ref-mek.7.11.3.268-ref-mek.7.11.3.289,2991618,2991681,448965,448977,ref-y.00004.00001.00005.00007.00005.00079,ref-y.00004.00001.00005.00007.00005.00091,329294,329394,53417,53432,ref-mek.00007.00011.00003.00268,ref-mek.00007.00011.00003.00289,ונפל שמה שור או חמור שור ולא שור בכליו חמור ולא חמור בכליו ,ונפל שם שור או חמור חייב על זה_בפני_עצמו_ועל_זה_בפני עצמו שור ולא שור וכליו חמור ולא חמור וכליו ,ref-mek
22742,ref-y.4.1.5.8.1.48-ref-y.4.1.5.8.1.52,ref-mek.8.3.6.14-ref-mek.8.3.6.20,2992041,2992068,449043,449047,ref-y.00004.00001.00005.00008.00001.00048,ref-y.00004.00001.00005.00008.00001.00052,371326,371368,60150,60156,ref-mek.00008.00003.00006.00014,ref-mek.00008.00003.00006.00020,לשבת למען ינוח שורך וחמורך ,שבת בראשית ממקומה למען ינוח שורך וחמורך ,ref-mek
22743,ref-y.4.1.5.8.1.49-ref-y.4.1.5.8.1.52,ref-mek.8.3.6.49-ref-mek.8.3.6.52,2992046,2992068,449044,449047,ref-y.00004.00001.00005.00008.00001.00049,ref-y.00004.00001.00005.00008.00001.00052,371503,371525,60177,60180,ref-mek.00008.00003.00006.00049,ref-mek.00008.00003.00006.00052,למען ינוח שורך וחמורך ,למען ינוח שורך וחמורך ,ref-mek
22744,ref-y.4.1.6.6.1.20-ref-y.4.1.6.6.1.26,ref-mek.7.14.2.98-ref-mek.7.14.2.106,2996457,2996491,449711,449717,ref-y.00004.00001.00006.00006.00001.00020,ref-y.00004.00001.00006.00006.00001.00026,338499,338544,54911,54917,ref-mek.00007.00014.00002.00098,ref-mek.00007.00014.00002.00106,ליעזר או' שש עשרה אמה כדרך הרבים ,עזריה ר'_אליעזר_אומר שש עשרה אמה בדרך הרבים ,ref-mek
22745,ref-y.4.1.6.6.1.56-ref-y.4.1.6.6.1.73,ref-mek.7.14.2.131-ref-mek.7.14.2.144,2996645,2996735,449743,449758,ref-y.00004.00001.00006.00006.00001.00056,ref-y.00004.00001.00006.00006.00001.00073,338676,338746,54937,54947,ref-mek.00007.00014.00002.00131,ref-mek.00007.00014.00002.00144,אמה אימתי בזמן שקפץ אבל_אם_היו עצים מצויין לפניו או שהיח מספסף והולך אפילו עד מיל חייב ,אימתי בזמן שקפצה אבל אם היתה מצפצפת ומהלכת אפילו עד מיל הרי זה חייב ,ref-mek
22746,ref-y.4.1.7.4.4.5-ref-y.4.1.7.4.4.13,ref-mek.7.12.2.109-ref-mek.7.12.2.124,3001480,3001538,450470,450478,ref-y.00004.00001.00007.00004.00004.00005,ref-y.00004.00001.00007.00004.00004.00013,331747,331818,53818,53826,ref-mek.00007.00012.00002.00109,ref-mek.00007.00012.00002.00124,במוכר ויש במוכר שאין בטובח שהטובח בשבת חייב והמוכר ,טובח מוכר מנין_תלמוד_לומר או מכרו עד_שלא_יאמר_יש_לי_בדין אם הטובח חייב ,ref-mek
22747,ref-y.4.1.8.1.5.16-ref-y.4.1.8.1.5.32,ref-mek.4.1.5.169-ref-mek.4.1.5.183,3004142,3004223,450909,450923,ref-y.00004.00001.00008.00001.00005.00016,ref-y.00004.00001.00008.00001.00005.00032,183193,183268,30025,30038,ref-mek.00004.00001.00005.00169,ref-mek.00004.00001.00005.00183,נש ואמרין ליה כמה_את_בעי למיתן ולא ייאבך אהן צערא ומה דהוא אמר יהבין ליה אמר ,למשה אמור להם לישראל דברי תורה שנתתי לכם רפואה הם לכם חיים הם לכם שנאמר ,ref-mek
22748,ref-y.4.1.8.1.5.111-ref-y.4.1.8.1.5.120,ref-mek.7.6.2.197-ref-mek.7.6.2.203,3004614,3004664,450994,451001,ref-y.00004.00001.00008.00001.00005.00111,ref-y.00004.00001.00008.00001.00005.00120,310588,310624,50632,50638,ref-mek.00007.00006.00002.00197,ref-mek.00007.00006.00002.00203,לרפותו בו' רבי_ירמיה_בעי עלו בו צמחין סביבות המכה ,ורפא ירפא ועלו בו צמחין סביבות מכה ,ref-mek
22749,ref-y.4.1.8.1.5.134-ref-y.4.1.8.1.5.155,ref-mek.7.6.2.194-ref-mek.7.6.2.203,3004727,3004835,451012,451030,ref-y.00004.00001.00008.00001.00005.00134,ref-y.00004.00001.00008.00001.00005.00155,310569,310624,50630,50638,ref-mek.00007.00006.00002.00194,ref-mek.00007.00006.00002.00203,רופא תני חורין ורפא ירפא שאם עלת גרגותני חייב לרפותו תני רבי_יוסי_בי_ר' יודן או' עלו בו צמחים סביבות המכה ,לרפאתו תלמוד לומר ורפא ירפא ועלו בו צמחין סביבות מכה ,ref-mek
22750,ref-y.4.1.8.1.5.176-ref-y.4.1.8.1.5.185,ref-mek.7.6.2.163-ref-mek.7.6.2.183,3004938,3004987,451045,451054,ref-y.00004.00001.00008.00001.00005.00176,ref-y.00004.00001.00008.00001.00005.00185,310409,310513,50600,50619,ref-mek.00007.00006.00002.00163,ref-mek.00007.00006.00002.00183,הזאת שיתן לו שבת וריפוי רק שבתו יתן ורפא ירפא ,זה כשם שנותנין לו שבת לזה כך נותנין שבת לזה תלמוד לומר רק שבתו יתן מגיד שחלוק מכלל השבת ורפא ירפא ,ref-mek
22751,ref-y.4.1.8.1.5.177-ref-y.4.1.8.1.5.184,ref-mek.7.6.2.117-ref-mek.7.6.2.131,3004944,3004982,451046,451053,ref-y.00004.00001.00008.00001.00005.00177,ref-y.00004.00001.00008.00001.00005.00184,310180,310258,50556,50570,ref-mek.00007.00006.00002.00117,ref-mek.00007.00006.00002.00131,שיתן לו שבת וריפוי רק שבתו יתן ורפא ,ירפא חוץ ממה שנותנין לו דמי איבריו ונותנין לו דמי שבתו וריפויו רק שבתו יתן ,ref-mek
22752,ref-y.4.1.8.1.5.179-ref-y.4.1.8.1.5.184,ref-mek.7.6.2.109-ref-mek.7.6.2.116,3004953,3004982,451048,451053,ref-y.00004.00001.00008.00001.00005.00179,ref-y.00004.00001.00008.00001.00005.00184,310136,310179,50549,50555,ref-mek.00007.00006.00002.00109,ref-mek.00007.00006.00002.00116,שבת וריפוי רק שבתו יתן ורפא ,השבת והריפוי תלמוד לומר רק שבתו יתן ורפא ,ref-mek
22753,ref-y.4.1.8.1.5.181-ref-y.4.1.8.1.5.188,ref-mek.7.6.2.212-ref-mek.7.6.2.218,3004965,3004999,451050,451056,ref-y.00004.00001.00008.00001.00005.00181,ref-y.00004.00001.00008.00001.00005.00188,310673,310702,50647,50653,ref-mek.00007.00006.00002.00212,ref-mek.00007.00006.00002.00218,רק שבתו יתן ורפא ירפא הלכה ג' שבת ,רק שבתו יתן ורפא ירפא מה שבת ,ref-mek
22754,ref-y.4.1.8.1.5.181-ref-y.4.1.8.1.5.185,ref-mek.7.6.2.234-ref-mek.7.6.2.238,3004965,3004987,451050,451054,ref-y.00004.00001.00008.00001.00005.00181,ref-y.00004.00001.00008.00001.00005.00185,310771,310793,50664,50668,ref-mek.00007.00006.00002.00234,ref-mek.00007.00006.00002.00238,רק שבתו יתן ורפא ירפא ,רק שבתו יתן ורפא ירפא ,ref-mek
22755,ref-y.4.2.2.9.1.132-ref-y.4.2.2.9.1.139,ref-mek.8.2.6.67-ref-mek.8.2.6.74,3032328,3032365,455359,455365,ref-y.00004.00002.00002.00009.00001.00132,ref-y.00004.00002.00002.00009.00001.00139,365803,365840,59305,59311,ref-mek.00008.00002.00006.00067,ref-mek.00008.00002.00006.00074,בין הקברות אל יטמא אמר לו אביו היטמא ,בין הקברות אל יטמא אמר לו אביו הטמא ,ref-mek
22756,ref-y.4.2.2.10.3.8-ref-y.4.2.2.10.3.28,ref-mek.8.2.5.9-ref-mek.8.2.5.34,3032723,3032825,455426,455444,ref-y.00004.00002.00002.00010.00003.00008,ref-y.00004.00002.00002.00010.00003.00028,364345,364480,59077,59096,ref-mek.00008.00002.00005.00009,ref-mek.00008.00002.00005.00034,תראה אי כי תראה יכול אפילו רחוק מאה מיל תלמוד_לומר_כי תפגע הא כיצד שיערו חכמים אחד משבעה ומחצה במיל ,תראה או כי תראה שומע אני אפילו בריחוק ממנו מלא מיל תלמוד_לומר_כי תפגע כיצד_יתקיימו_שני_מקראות_הללו שיערו חכמים אחד משבעה ומחצה כמיל ,ref-mek
22757,ref-y.4.2.2.10.3.31-ref-y.4.2.2.10.3.50,ref-mek.8.2.6.193-ref-mek.8.2.6.214,3032836,3032937,455447,455461,ref-y.00004.00002.00002.00010.00003.00031,ref-y.00004.00002.00002.00010.00003.00050,366425,366538,59404,59421,ref-mek.00008.00002.00006.00193,ref-mek.00008.00002.00006.00214,עזוב תעזוב זו פריקה הקם תקים זו טעינה רבי_שמעון_בן_יוחי_אומר כשם שפורקו מן התורה כך טוענו מן התורה ,הקם תקים עמו טעינה עזוב תעזוב עמו פריקה מכאן_היה_ר' שמעון בר יוחאי אומר כשם שהפריקה מן התורה כך טעינה מן התורה ,ref-mek
