,baseOrig,compOrig,baseCharStart,baseCharEnd,baseWdStart,baseWdEnd,baseRefStart,baseRefEnd,compCharStart,compCharEnd,compWdStart,compWdEnd,compRefStart,compRefEnd,baseStr,compStr,compWork
15110,ref-m.04.05.3.10.8-ref-m.04.05.3.10.27,ref-sifre-d.286.8.7-ref-sifre-d.286.8.23,544998,545110,85183,85199,ref-m.00004.00005.00003.00010.00008,ref-m.00004.00005.00003.00010.00027,270017,270108,45204,45219,ref-sifre-d.00286.00008.00007,ref-sifre-d.00286.00008.00023,במספר ארבעים מנין שהוא סמוך לארבעים רבי_יהודה_אומר ארבעים שלמות הוא לוקה והיכן הוא לוקה את היתירה בין כתפיו ,במספר ארבעים מנין סמוך לארבעים ר' יהודא אומר מ' שלמות והיכן הוא לוקה את היתרה בין כתפיו ,ref-sifre-d
15111,ref-m.04.05.3.13.10-ref-m.04.05.3.13.16,ref-sifre-d.286.6.1-ref-sifre-d.286.6.8,545669,545712,85297,85303,ref-m.00004.00005.00003.00013.00010,ref-m.00004.00005.00003.00013.00016,269741,269791,45154,45161,ref-sifre-d.00286.00006.00001,ref-sifre-d.00286.00006.00008,ומכה אותו שליש מלפניו ושתי ידות מלאחריו ,והכהו לפניו במספר שליש מלפניו שתי ידות מלאחריו ,ref-sifre-d
15112,ref-m.04.05.3.14.49-ref-m.04.05.3.15.11,ref-sifre-d.286.12.1-ref-sifre-d.286.13.8,546054,546193,85365,85386,ref-m.00004.00005.00003.00014.00049,ref-m.00004.00005.00003.00015.00011,270463,270611,45279,45302,ref-sifre-d.00286.00012.00001,ref-sifre-d.00286.00013.00008,נתקלקל בין בריעי בין במים פטור רבי_יהודה_אומר האיש בריעי והאשה במים כל חייבי כריתות שלקו נפטרו ידי כריתתם שנאמר ונקלה אחיך לעיניך ,ונקלה אחיך לעיניך מכאן אמרו נתקלקל בין ברעי בין במים פטור ר'_יהודה_אומר האיש ברעי והאשה במים מלמד שכל חייבי כריתות שלקו נפטרו מידי כריתתן ,ref-sifre-d
15113,ref-m.04.05.3.15.26-ref-m.04.05.3.15.61,ref-sifre-d.286.14.27-ref-sifre-d.286.15.26,546263,546451,85396,85425,ref-m.00004.00005.00003.00015.00026,ref-m.00004.00005.00003.00015.00061,270749,270970,45328,45363,ref-sifre-d.00286.00014.00027,ref-sifre-d.00286.00015.00026,מה אם העובר עבירה אחת נוטל נפשו עליה העושה מצוה אחת על אחת כמה וכמה שתינתן לו נפשו ר' שמעון אומר ממקומו הוא למד שנאמר ונכרתו הנפשות העושות וגו' ואומר אשר יעשה אותם האדם וחי בהם ,"ומה אם העובר עבירה אחת נוטל נפשו עליה העושה מצוה אחת עאכו""כ שתנתן לו נפשו ר'_שמעון_אומר ממקומו הוא מוכרע שנאמר כי כל אשר יעשה מכל התועבות האלה ונכרתו הנפשות העושות מקרב עמם ואומר אשר יעשה אותם האדם וחי בהם ",ref-sifre-d
15114,ref-m.04.05.3.15.62-ref-m.04.05.3.15.72,ref-sifre-d.286.16.35-ref-sifre-d.286.16.45,546452,546505,85426,85436,ref-m.00004.00005.00003.00015.00062,ref-m.00004.00005.00003.00015.00072,271258,271311,45407,45417,ref-sifre-d.00286.00016.00035,ref-sifre-d.00286.00016.00045,הא כל היושב ולא עבר עבירה נותנין לו שכר כעושה מצוה ,הא כל היושב ולא עבר עבירה נותנין לו שכר כעושי מצוה ,ref-sifre-d
15115,ref-m.04.05.3.15.63-ref-m.04.05.3.15.77,ref-sifre-d.286.17.66-ref-sifre-d.286.18.4,546455,546527,85427,85440,ref-m.00004.00005.00003.00015.00063,ref-m.00004.00005.00003.00015.00077,271612,271682,45474,45486,ref-sifre-d.00286.00017.00066,ref-sifre-d.00286.00018.00004,כל היושב ולא עבר עבירה נותנין לו שכר כעושה מצוה רבי שמעון בר רבי אומר ,כל היושב ולא עבר עבירה נותנים לו שכר כעושי מצוה ר' שמעון ברבי אומר ,ref-sifre-d
15116,ref-m.04.05.3.15.81-ref-m.04.05.3.15.87,ref-sifre-d.76.2.21-ref-sifre-d.76.2.27,546541,546572,85443,85449,ref-m.00004.00005.00003.00015.00081,ref-m.00004.00005.00003.00015.00087,122287,122316,20485,20491,ref-sifre-d.00076.00002.00021,ref-sifre-d.00076.00002.00027,רק חזק לבלתי אכול הדם כי הדם ,רק חזק לבלתי אכול הדם מה דם ,ref-sifre-d
15117,ref-m.04.05.3.15.81-ref-m.04.05.3.15.87,ref-sifre-d.76.9.7-ref-sifre-d.76.9.13,546541,546572,85443,85449,ref-m.00004.00005.00003.00015.00081,ref-m.00004.00005.00003.00015.00087,123840,123869,20750,20756,ref-sifre-d.00076.00009.00007,ref-sifre-d.00076.00009.00013,רק חזק לבלתי אכול הדם כי הדם ,רק חזק לבלתי אכול הדם מה דם ,ref-sifre-d
15118,ref-m.04.05.3.15.91-ref-m.04.05.3.15.100,ref-sifre-d.343.14.58-ref-sifre-d.343.14.72,546588,546635,85453,85461,ref-m.00004.00005.00003.00015.00091,ref-m.00004.00005.00003.00015.00100,360054,360132,60522,60536,ref-sifre-d.00343.00014.00058,ref-sifre-d.00343.00014.00072,ומה אם הדם שנפשו של אדם קצה ממנו הפורש ממנו ,"מהם ממיתים אותו ואין לאדם להתחמם ממנה כך ד""ת נשתמש ממנה נאבד מעה""ז פירש ממנה ",ref-sifre-d
15119,ref-m.04.05.3.15.91-ref-m.04.05.3.15.122,ref-sifre-d.286.16.5-ref-sifre-d.286.16.31,546588,546773,85453,85479,ref-m.00004.00005.00003.00015.00091,ref-m.00004.00005.00003.00015.00122,271098,271257,45382,45406,ref-sifre-d.00286.00016.00005,ref-sifre-d.00286.00016.00031,ומה אם הדם שנפשו של אדם קצה ממנו הפורש ממנו מקבל שכר גזל ועריות שנפשו של אדם מתאוה להן ומחמדתן הפורש מהן על אחת כמה וכמה שיזכה לו ולדורותיו ולדורות דורותיו עד סוף כל הדורות ,"ומה הדם שנפשו של אדם קצה הימנו הפורש ממנו מקבל שכר טוב גזל ועריות שנפשו של אדם מתאוה להם ומחמדתן הפורש מהם עאכ""ו שיזכה לו ולדורותיו עד סוף כל הדורות ",ref-sifre-d
15120,ref-m.04.05.3.15.91-ref-m.04.05.3.15.122,ref-sifre-d.286.18.5-ref-sifre-d.286.18.31,546588,546773,85453,85479,ref-m.00004.00005.00003.00015.00091,ref-m.00004.00005.00003.00015.00122,271683,271842,45487,45511,ref-sifre-d.00286.00018.00005,ref-sifre-d.00286.00018.00031,ומה אם הדם שנפשו של אדם קצה ממנו הפורש ממנו מקבל שכר גזל ועריות שנפשו של אדם מתאוה להן ומחמדתן הפורש מהן על אחת כמה וכמה שיזכה לו ולדורותיו ולדורות דורותיו עד סוף כל הדורות ,"ומה הדם שנפשו של אדם קצה הימנו הפורש ממנו מקבל שכר טוב גזל ועריות שנפשו של אדם מתאוה להם ומחמדתן הפורש מהם עאכ""ו שיזכה לו ולדורותיו עד סוף כל הדורות ",ref-sifre-d
15121,ref-m.04.06.1.6.15-ref-m.04.06.1.6.19,ref-sifre-d.2.8.16-ref-sifre-d.2.8.20,548624,548666,85763,85767,ref-m.00004.00006.00001.00006.00015,ref-m.00004.00006.00001.00006.00019,8718,8760,1444,1448,ref-sifre-d.00002.00008.00016,ref-sifre-d.00002.00008.00020,שבתורה הקלות והחמורות הזדונות והשגגות ,שבתורה הקלות והחמורות הזדונות והשגגות ,ref-sifre-d
15122,ref-m.04.06.4.13.23-ref-m.04.06.4.13.28,ref-sifre-d.49.1.11-ref-sifre-d.49.1.16,555732,555765,86851,86856,ref-m.00004.00006.00004.00013.00023,ref-m.00004.00006.00004.00013.00028,96300,96329,16184,16189,ref-sifre-d.00049.00001.00011,ref-sifre-d.00049.00001.00016,בחנון ורחום בארך אפים ורב חסד ,רחום וחנון ארץ אפים ורב חסד ,ref-sifre-d
15123,ref-m.04.06.7.6.54-ref-m.04.06.7.6.70,ref-sifre-d.118.3.13-ref-sifre-d.118.3.28,561905,561977,87738,87749,ref-m.00004.00006.00007.00006.00054,ref-m.00004.00006.00007.00006.00070,156162,156234,26191,26206,ref-sifre-d.00118.00003.00013,ref-sifre-d.00118.00003.00028,תן לי בדינר מעות ונתן לו אמר_לו_תן_לי את הדינר אמר לו נתתיו לך ונתתו ,נותנים לו פת הראוי לתת לו עסה נותנים לו עסה הראוי לתת לו מעה נותנים לו ,ref-sifre-d
15124,ref-m.04.07.2.4.29-ref-m.04.07.2.4.48,ref-sifre-d.283.5.8-ref-sifre-d.283.5.28,569224,569319,88731,88745,ref-m.00004.00007.00002.00004.00029,ref-m.00004.00007.00002.00004.00048,267139,267233,44703,44718,ref-sifre-d.00283.00005.00008,ref-sifre-d.00283.00005.00028,שבולת שבקציר וראשה מגעת לקמה אם נקצרה עם הקמה הרי היא של_בעל_הבית ואם_לאו_הרי היא של עניים ,שבולת של קציר וראשה מגיע לקמה אם נקצרת עם הקמה הרי היא של_בעל_הבית ואם לאו הרי היא של עניים ,ref-sifre-d
15125,ref-m.04.07.2.4.38-ref-m.04.07.2.4.48,ref-sifre-d.285.2.23-ref-sifre-d.285.2.33,569274,569319,88740,88745,ref-m.00004.00007.00002.00004.00038,ref-m.00004.00007.00002.00004.00048,268519,268563,44942,44947,ref-sifre-d.00285.00002.00023,ref-sifre-d.00285.00002.00033,הרי היא של_בעל_הבית ואם_לאו_הרי היא של עניים ,הרי היא של_בעל_הבית ואם לאו הרי הם של עניים ,ref-sifre-d
15126,ref-m.04.07.2.8.6-ref-m.04.07.2.8.13,ref-sifre-d.218.8.9-ref-sifre-d.218.8.16,570189,570221,88876,88883,ref-m.00004.00007.00002.00008.00006,ref-m.00004.00007.00002.00008.00013,221098,221130,36987,36994,ref-sifre-d.00218.00008.00009,ref-sifre-d.00218.00008.00016,על שנים הודו לו ועל אחד לא הודו ,על שנים הודה לי ועל אחד לא הודה ,ref-sifre-d
15127,ref-m.04.07.3.7.7-ref-m.04.07.3.7.20,ref-sifre-d.75.12.10-ref-sifre-d.75.12.22,572356,572441,89200,89212,ref-m.00004.00007.00003.00007.00007,ref-m.00004.00007.00003.00007.00020,121445,121513,20338,20348,ref-sifre-d.00075.00012.00010,ref-sifre-d.00075.00012.00022,מטהרין כיצד הטמא עומד וטהור עובר הטהור עומד והטמא עובר טומאה ברשות היחיד וטהרה ,"והטמא יאכלנו אין_לי_אלא טמא טהור מנין ת""ל טהור יאכלנו הטמא והטהור ",ref-sifre-d
15128,ref-m.04.07.4.3.32-ref-m.04.07.4.4.8,ref-sifre-d.282.4.36-ref-sifre-d.283.1.8,574239,574319,89446,89456,ref-m.00004.00007.00004.00003.00032,ref-m.00004.00007.00004.00004.00008,265897,265944,44500,44508,ref-sifre-d.00282.00004.00036,ref-sifre-d.00283.00001.00008,שכחה ובית_הלל_אומרים שכחה העומר שהוא סמוך לגפה ולגדיש ולבקר ולכלים ושכחו ,שכחה ושכחת עומר בשדה ולא הגדיש יכול אף שכחו ,ref-sifre-d
15129,ref-m.04.07.4.9.1-ref-m.04.07.4.9.17,ref-sifre-d.288.3.37-ref-sifre-d.288.3.61,575695,575784,89651,89667,ref-m.00004.00007.00004.00009.00001,ref-m.00004.00007.00004.00009.00017,272933,273049,45681,45702,ref-sifre-d.00288.00003.00037,ref-sifre-d.00288.00003.00061,שלשה אחים שנים מהם נשואים לשתי אחיות ואחד מופנה מת אחד מבעלי אחיות ועשה בה מופנה מאמר ,"מהם א""כ מה ת""ל אחד אשת אחד מתיבמת ולא אשת שנים מכאן אמרו שלשה אחים נשואים ג' נכריות ומת א' מהם ועשה בה השני מאמר ",ref-sifre-d
15130,ref-m.04.07.8.7.80-ref-m.04.07.8.7.95,ref-sifre-d.41.22.37-ref-sifre-d.41.22.56,585209,585286,91019,91033,ref-m.00004.00007.00008.00007.00080,ref-m.00004.00007.00008.00007.00095,71388,71479,12040,12058,ref-sifre-d.00041.00022.00037,ref-sifre-d.00041.00022.00056,הנני שולח לכם את אליה הנביא וגומר והשיב לב אבות על בנים ולב בנים על אבותם ,הנה אנכי שולח לכם את אליהו הנביא לפני בוא יום ה' והשיב לב אבות על בנים ולב בנים על אבותם ,ref-sifre-d
15131,ref-m.04.07.8.7.80-ref-m.04.07.8.7.94,ref-sifre-d.342.7.25-ref-sifre-d.342.7.44,585209,585280,91019,91032,ref-m.00004.00007.00008.00007.00080,ref-m.00004.00007.00008.00007.00094,354200,354296,59522,59540,ref-sifre-d.00342.00007.00025,ref-sifre-d.00342.00007.00044,הנני שולח לכם את אליה הנביא וגומר והשיב לב אבות על בנים ולב בנים על ,הנה אנכי שולח לכם את אליהו הנביא לפני בא יום ה' הגדול והנורא והשיב לב אבות על בנים וכי עלתה ,ref-sifre-d
15132,ref-m.04.08.3.3.40-ref-m.04.08.3.3.45,ref-sifre-d.96.2.1-ref-sifre-d.96.2.6,590468,590498,91760,91765,ref-m.00004.00008.00003.00003.00040,ref-m.00004.00008.00003.00003.00045,136269,136299,22847,22852,ref-sifre-d.00096.00002.00001,ref-sifre-d.00096.00002.00006,ולא ידבק בידך מאומה מן החרם ,ולא ידבק בידך מאומה מן החרם ,ref-sifre-d
15133,ref-m.04.08.3.4.18-ref-m.04.08.3.4.23,ref-sifre-d.96.2.1-ref-sifre-d.96.2.6,590593,590623,91780,91785,ref-m.00004.00008.00003.00004.00018,ref-m.00004.00008.00003.00004.00023,136269,136299,22847,22852,ref-sifre-d.00096.00002.00001,ref-sifre-d.00096.00002.00006,ולא ידבק בידך מאומה מן החרם ,ולא ידבק בידך מאומה מן החרם ,ref-sifre-d
15134,ref-m.04.08.3.5.23-ref-m.04.08.3.5.34,ref-sifre-d.60.4.14-ref-sifre-d.60.4.35,591155,591228,91867,91878,ref-m.00004.00008.00003.00005.00023,ref-m.00004.00008.00003.00005.00034,106803,106928,17948,17969,ref-sifre-d.00060.00004.00014,ref-sifre-d.00060.00004.00035,אלהיהם על ההרים ולא ההרים אלהיהם אלהיהם על הגבעות ולא הגבעות אלהיהם ,אלהיהם על ההרים הרמים ועל הגבעות ותחת כל עץ רענן אלהיהם על ההרים ולא ההרים אלהיהם אלהיהם על הגבעות ולא גבעות אלהיהם ,ref-sifre-d
15135,ref-m.04.08.3.5.59-ref-m.04.08.3.5.71,ref-sifre-d.60.4.51-ref-sifre-d.60.4.62,591345,591404,91899,91910,ref-m.00004.00008.00003.00005.00059,ref-m.00004.00008.00003.00005.00071,107008,107061,17984,17994,ref-sifre-d.00060.00004.00051,ref-sifre-d.00060.00004.00062,כל מקום שאתה מוצא הר גבוה וגבעה נשאה ועץ רענן דע שיש שם ,כל מקום שאתה מוצא הר גבוה וגבעה ועץ רענן דע שיש שם ,ref-sifre-d
15136,ref-m.04.08.3.7.1-ref-m.04.08.3.7.27,ref-sifre-d.61.7.1-ref-sifre-d.61.7.38,591691,591836,91959,91980,ref-m.00004.00008.00003.00007.00001,ref-m.00004.00008.00003.00007.00027,107725,107927,18093,18124,ref-sifre-d.00061.00007.00001,ref-sifre-d.00061.00007.00038,שלשה בתים הן בית שבנוי מתחלה לעבודה זרה הרי זה אסור סיידו וכיירו לעבודה זרה וחידש נוטל מה שחידש הכניס לתוכה עבודה זרה והוציאה הרי זה מותר ,שלשה בתים הם בית שבנאו מתחלה לעבודת כוכבים הרי זה אסור שנאמר אבד תאבדון את כל המקומות ונתצתם חידש נוטל מה שחידש שנאמר ואבדתם_את_שמם תגדעון לא חידש אלא הכניס בתוכו עבודה זרה והוציאה הרי זה מותר ,ref-sifre-d
15137,ref-m.04.08.3.7.67-ref-m.04.08.3.7.83,ref-sifre-d.61.6.23-ref-sifre-d.61.6.47,592040,592132,92011,92024,ref-m.00004.00008.00003.00007.00067,ref-m.00004.00008.00003.00007.00083,107517,107663,18061,18083,ref-sifre-d.00061.00006.00023,ref-sifre-d.00061.00006.00047,גידעו ופסלו לשם עבודה זרה והחליף נוטל מה שהחליף העמיד תחתיה עבודה זרה וביטלה הרי זה מותר ,גדעו ופסלו לעבודת כוכבים והחליף נוטל מה שהחליף שנאמר ופסילי אלהיהם תגדעון לא החליף אלא שהעמידו תחת העמיד תחתיה עבודה זרה וסלקה הרי זה מותר ,ref-sifre-d
15138,ref-m.04.08.3.9.24-ref-m.04.08.3.9.33,ref-sifre-d.96.2.18-ref-sifre-d.96.2.35,592763,592819,92129,92136,ref-m.00004.00008.00003.00009.00024,ref-m.00004.00008.00003.00009.00033,136348,136441,22864,22879,ref-sifre-d.00096.00002.00018,ref-sifre-d.00096.00002.00035,כולן אסורות בהנאה רבי_אליעזר_אומר יוליך הנאה לים המלח ,כולם אסורים בהנאה מה יעשה להם יוליכם לים המלח כללו של דבר כל הנהנה מעבודה זרה יוליך הנאה ,ref-sifre-d
15139,ref-m.04.08.3.9.56-ref-m.04.08.3.10.8,ref-sifre-d.96.2.9-ref-sifre-d.96.2.35,592942,593068,92153,92171,ref-m.00004.00008.00003.00009.00056,ref-m.00004.00008.00003.00010.00008,136310,136441,22855,22879,ref-sifre-d.00096.00002.00009,ref-sifre-d.00096.00002.00035,כולן אסורין בהנאה רבי_אליעזר_אומר יוליך הנאה לים המלח אמרו_לו_אין פדיון לעבודה זרה כיצד מבטלה קירסם וזירד נטל ממנה מקל או ,נטל ממנה מקל או מזלג או כרכר או שרביט כולם אסורים בהנאה מה יעשה להם יוליכם לים המלח כללו של דבר כל הנהנה מעבודה זרה יוליך הנאה ,ref-sifre-d
15140,ref-m.04.08.4.7.16-ref-m.04.08.4.7.31,ref-sifre-d.318.13.5-ref-sifre-d.318.13.16,594140,594232,92346,92360,ref-m.00004.00008.00004.00007.00016,ref-m.00004.00008.00004.00007.00031,328716,328799,55145,55156,ref-sifre-d.00318.00013.00005,ref-sifre-d.00318.00013.00016,לדבר שאין צורך לעולם בו היו עובדין היה מבטלו הרי הן עובדין לחמה וללבנה ולכוכבים ולמזלות ,שעובדים לחמה וללבנה לכוכבים ולמזלות ודברים שהם צורך העולם והנייה לעולם בהם ,ref-sifre-d
15141,ref-m.04.09.1.1.23-ref-m.04.09.1.1.28,ref-sifre-d.16.1.46-ref-sifre-d.16.1.51,598252,598291,92972,92977,ref-m.00004.00009.00001.00001.00023,ref-m.00004.00009.00001.00001.00028,18383,18422,3102,3107,ref-sifre-d.00016.00001.00046,ref-sifre-d.00016.00001.00051,והעמידו תלמידים הרבה ועשו סייג לתורה ,והעמידו תלמידים הרבה ועשו סייג לתורה ,ref-sifre-d
15142,ref-m.04.09.1.1.23-ref-m.04.09.1.2.1,ref-sifre-d.16.3.130-ref-sifre-d.16.4.1,598252,598297,92972,92978,ref-m.00004.00009.00001.00001.00023,ref-m.00004.00009.00001.00002.00001,19203,19247,3226,3232,ref-sifre-d.00016.00003.00130,ref-sifre-d.00016.00004.00001,והעמידו תלמידים הרבה ועשו סייג לתורה שמעון ,והעמידו תלמידים הרבה ועשו סייג לתורה שמוע ,ref-sifre-d
15143,ref-m.04.09.3.6.53-ref-m.04.09.3.6.61,ref-sifre-d.62.4.55-ref-sifre-d.62.4.63,605514,605560,94175,94182,ref-m.00004.00009.00003.00006.00053,ref-m.00004.00009.00003.00006.00061,110357,110404,18524,18530,ref-sifre-d.00062.00004.00055,ref-sifre-d.00062.00004.00063,בכל המקום אשר אזכיר את שמי אבא אליך וברכתיך ,בכל המקום אשר אזכיר את שמי אבוא אליך וברכתיך ,ref-sifre-d
15144,ref-m.04.09.3.8.21-ref-m.04.09.3.8.26,ref-sifre-d.48.2.5-ref-sifre-d.48.2.10,605899,605925,94237,94242,ref-m.00004.00009.00003.00008.00021,ref-m.00004.00009.00003.00008.00026,90111,90137,15153,15158,ref-sifre-d.00048.00002.00005,ref-sifre-d.00048.00002.00010,רק השמר לך ושמור נפשך מאד ,רק השמר לך ושמור נפשך מאד ,ref-sifre-d
15145,ref-m.04.09.3.14.29-ref-m.04.09.3.14.36,ref-sifre-d.34.4.10-ref-sifre-d.34.4.16,607098,607144,94417,94424,ref-m.00004.00009.00003.00014.00029,ref-m.00004.00009.00003.00014.00036,46609,46647,7848,7854,ref-sifre-d.00034.00004.00010,ref-sifre-d.00034.00004.00016,שנקראו בנים למקום שנאמר בנים אתם לה' אלהיכם ,קרויים בנים שנאמר בנים אתם לה' אלהיכם ,ref-sifre-d
15146,ref-m.04.09.3.14.56-ref-m.04.09.3.14.62,ref-sifre-d.43.35.26-ref-sifre-d.43.35.32,607245,607277,94444,94450,ref-m.00004.00009.00003.00014.00056,ref-m.00004.00009.00003.00014.00062,85631,85663,14434,14440,ref-sifre-d.00043.00035.00026,ref-sifre-d.00043.00035.00032,לקח טוב נתתי לכם תורתי אל תעזובו ,לקח טוב נתתי לכם תורתי אל תעזובו ,ref-sifre-d
15147,ref-m.04.09.4.5.3-ref-m.04.09.4.5.19,ref-sifre-d.161.3.22-ref-sifre-d.161.3.33,609099,609194,94753,94767,ref-m.00004.00009.00004.00005.00003,ref-m.00004.00009.00004.00005.00019,185391,185459,31003,31014,ref-sifre-d.00161.00003.00022,ref-sifre-d.00161.00003.00033,בנו אומר הלומד על מנת ללמד מספיקין בידו ללמוד וללמד והלומד על מנת לעשות מספיקין בידו ללמוד ,מביא לידי תלמוד תלמוד מביא לידי מעשה מעשה מביא לידי יראה שהתלמוד ,ref-sifre-d
15148,ref-m.04.09.4.5.4-ref-m.04.09.4.5.20,ref-sifre-d.41.11.22-ref-sifre-d.41.12.7,609103,609201,94754,94768,ref-m.00004.00009.00004.00005.00004,ref-m.00004.00009.00004.00005.00020,69884,69967,11792,11802,ref-sifre-d.00041.00011.00022,ref-sifre-d.00041.00012.00007,אומר הלומד על מנת ללמד מספיקין בידו ללמוד וללמד והלומד על מנת לעשות מספיקין בידו ללמוד וללמד ,ואמרו תלמוד גדול שהתלמוד מביא לידי מעשה רבי יוסי_הגלילי_אומר גדול תלמוד שהתלמוד ,ref-sifre-d
15149,ref-m.04.09.4.10.31-ref-m.04.09.4.11.14,ref-sifre-d.286.16.38-ref-sifre-d.286.16.45,609916,609996,94891,94902,ref-m.00004.00009.00004.00010.00031,ref-m.00004.00009.00004.00011.00014,271271,271311,45410,45417,ref-sifre-d.00286.00016.00038,ref-sifre-d.00286.00016.00045,ליתן לך רבי_אליעזר_בן_יעקב_אומר העושה מצוה אחת קונה לו פרקליט אחד והעובר עבירה ,ולא עבר עבירה נותנין לו שכר כעושי מצוה ,ref-sifre-d
15150,ref-m.04.09.4.10.31-ref-m.04.09.4.11.14,ref-sifre-d.286.17.68-ref-sifre-d.286.17.75,609916,609996,94891,94902,ref-m.00004.00009.00004.00010.00031,ref-m.00004.00009.00004.00011.00014,271622,271662,45476,45483,ref-sifre-d.00286.00017.00068,ref-sifre-d.00286.00017.00075,ליתן לך רבי_אליעזר_בן_יעקב_אומר העושה מצוה אחת קונה לו פרקליט אחד והעובר עבירה ,ולא עבר עבירה נותנים לו שכר כעושי מצוה ,ref-sifre-d
15151,ref-m.04.09.4.11.6-ref-m.04.09.4.11.15,ref-sifre-d.286.14.29-ref-sifre-d.286.14.40,609948,610000,94894,94903,ref-m.00004.00009.00004.00011.00006,ref-m.00004.00009.00004.00011.00015,270757,270821,45330,45341,ref-sifre-d.00286.00014.00029,ref-sifre-d.00286.00014.00040,העושה מצוה אחת קונה לו פרקליט אחד והעובר עבירה אחת ,"העובר עבירה אחת נוטל נפשו עליה העושה מצוה אחת עאכו""כ שתנתן לו ",ref-sifre-d
15152,ref-m.04.09.5.9.38-ref-m.04.09.5.11.1,ref-sifre-d.302.1.62-ref-sifre-d.302.1.79,614208,614523,95591,95644,ref-m.00004.00009.00005.00009.00038,ref-m.00004.00009.00005.00011.00001,288412,288520,48364,48381,ref-sifre-d.00302.00001.00062,ref-sifre-d.00302.00001.00079,שנה ושנה ברביעית מפני מעשר עני שבשלישית בשביעית מפני מעשר עני שבששית ובמוצאי שביעית מפני פירות שביעית ובמוצאי החג שבכל שנה ושנה מפני גזל מתנות עניים ארבע מדות באדם האומר שלי שלי ושלך שלך זו מדה בינונית ויש אומרים זו מדת סדום שלי שלך ושלך שלי עם הארץ שלי שלך ושלך שלך חסיד שלי שלי ושלך שלי רשע ארבע ,"של פסח של רביעית ושל שביעית הוה ביעור בשנה השלישית ברביעית מפני מ""ע שבשלישית ובשביעית מפני מ""ע שבששית ",ref-sifre-d
15153,ref-m.04.09.5.9.40-ref-m.04.09.5.9.49,ref-sifre-d.109.3.41-ref-sifre-d.109.3.50,614218,614281,95593,95600,ref-m.00004.00009.00005.00009.00040,ref-m.00004.00009.00005.00009.00049,148381,148444,24878,24885,ref-sifre-d.00109.00003.00041,ref-sifre-d.00109.00003.00050,ברביעית מפני מעשר עני שבשלישית בשביעית מפני מעשר עני שבששית ,ברביעית מפני מעשר עני שבשלישית בשביעית מפני מעשר עני שבששית ,ref-sifre-d
15154,ref-m.04.09.5.13.3-ref-m.04.09.5.13.29,ref-sifre-d.117.8.7-ref-sifre-d.117.8.21,614829,614968,95702,95727,ref-m.00004.00009.00005.00013.00003,ref-m.00004.00009.00005.00013.00029,155555,155634,26089,26103,ref-sifre-d.00117.00008.00007,ref-sifre-d.00117.00008.00021,בנותני צדקה הרוצה שיתן ולא יתנו אחרים עינו רעה בשל אחרים יתנו אחרים והוא לא יתן עינו רעה בשלו יתן ויתנו אחרים חסיד לא יתן ולא יתנו ,ליתן ונתן נותנים לו שכר אמירה ושכר מעשה אמר ליתן ולא הספיק בידו ליתן נותנים ,ref-sifre-d
15155,ref-m.04.09.6.3.97-ref-m.04.09.6.3.106,ref-sifre-d.306.16.4-ref-sifre-d.306.16.14,618499,618544,96332,96341,ref-m.00004.00009.00006.00003.00097,ref-m.00004.00009.00006.00003.00106,302381,302430,50701,50710,ref-sifre-d.00306.00016.00004,ref-sifre-d.00306.00016.00014,ואין טוב אלא תורה שנאמר כי לקח טוב נתתי לכם ,אין לקחי אלא דברי תורה שנאמר כי לקח טוב נתתי לכם ,ref-sifre-d
