,baseOrig,compOrig,baseCharStart,baseCharEnd,baseWdStart,baseWdEnd,baseRefStart,baseRefEnd,compCharStart,compCharEnd,compWdStart,compWdEnd,compRefStart,compRefEnd,baseStr,compStr,compWork
22471,ref-y.3.5.1.7.1.3-ref-y.3.5.1.7.1.8,ref-mek.1.19.7.156-ref-mek.1.19.7.161,2256481,2256511,337406,337411,ref-y.00003.00005.00001.00007.00001.00003,ref-y.00003.00005.00001.00007.00001.00008,86838,86870,13685,13690,ref-mek.00001.00019.00007.00156,ref-mek.00001.00019.00007.00161,במידה שאדם מודד בה מודדין לו ,שבמידה שהאדם מודד בה מודדים לו ,ref-mek
22472,ref-y.3.5.1.7.1.3-ref-y.3.5.1.7.1.8,ref-mek.3.4.2.4-ref-mek.3.4.2.9,2256481,2256511,337406,337411,ref-y.00003.00005.00001.00007.00001.00003,ref-y.00003.00005.00001.00007.00001.00008,152580,152609,24785,24790,ref-mek.00003.00004.00002.00004,ref-mek.00003.00004.00002.00009,במידה שאדם מודד בה מודדין לו ,במדה שאדם מודד בה מודדין לו ,ref-mek
22473,ref-y.3.5.1.7.1.3-ref-y.3.5.1.7.1.8,ref-mek.3.4.2.52-ref-mek.3.4.2.57,2256481,2256511,337406,337411,ref-y.00003.00005.00001.00007.00001.00003,ref-y.00003.00005.00001.00007.00001.00008,152823,152852,24828,24833,ref-mek.00003.00004.00002.00052,ref-mek.00003.00004.00002.00057,במידה שאדם מודד בה מודדין לו ,במדה שאדם מודד בה מודדין לו ,ref-mek
22474,ref-y.3.5.1.7.1.3-ref-y.3.5.1.7.1.8,ref-mek.3.5.1.168-ref-mek.3.5.1.173,2256481,2256511,337406,337411,ref-y.00003.00005.00001.00007.00001.00003,ref-y.00003.00005.00001.00007.00001.00008,154200,154229,25067,25072,ref-mek.00003.00005.00001.00168,ref-mek.00003.00005.00001.00173,במידה שאדם מודד בה מודדין לו ,במדה שאדם מודד בה מודדין לו ,ref-mek
22475,ref-y.3.5.1.7.1.3-ref-y.3.5.1.7.1.8,ref-mek.5.2.1.83-ref-mek.5.2.1.88,2256481,2256511,337406,337411,ref-y.00003.00005.00001.00007.00001.00003,ref-y.00003.00005.00001.00007.00001.00008,210437,210466,34559,34564,ref-mek.00005.00002.00001.00083,ref-mek.00005.00002.00001.00088,במידה שאדם מודד בה מודדין לו ,במדה שאדם מודד בה מודדין לו ,ref-mek
22476,ref-y.3.5.1.7.4.49-ref-y.3.5.1.7.4.63,ref-mek.1.8.1.330-ref-mek.1.8.1.336,2258261,2258352,337697,337711,ref-y.00003.00005.00001.00007.00004.00049,ref-y.00003.00005.00001.00007.00004.00063,25663,25706,4085,4091,ref-mek.00001.00008.00001.00330,ref-mek.00001.00008.00001.00336,לצבות בטן ולנפיל ירך לבועל וצבתה בטנה ונפלה יריכה לאשה הדעת מברעת ירך התחילה בעבירה ,וצבתה בטנה ונפלה יריכה אבר שהתחיל בעברה ,ref-mek
22477,ref-y.3.5.1.7.4.88-ref-y.3.5.1.7.4.102,ref-mek.7.18.3.204-ref-mek.7.18.3.216,2258466,2258551,337728,337742,ref-y.00003.00005.00001.00007.00004.00088,ref-y.00003.00005.00001.00007.00004.00102,355153,355220,57590,57602,ref-mek.00007.00018.00003.00204,ref-mek.00007.00018.00003.00216,מה אם מידת הפורענות מעוטה אבר אחד לוקה ושאר כל האיברים מרגישין מידת הטובה המרובה ,ומה אם מדת פורענות מעוטה כשיחיד צועק על הרבים כך מדה טובה ורבים ,ref-mek
22478,ref-y.3.5.1.7.4.88-ref-y.3.5.1.7.4.107,ref-mek.1.8.1.453-ref-mek.1.8.2.3,2258466,2258572,337728,337744,ref-y.00003.00005.00001.00007.00004.00088,ref-y.00003.00005.00001.00007.00004.00107,26322,26436,4192,4207,ref-mek.00001.00008.00001.00453,ref-mek.00001.00008.00002.00003,מה אם מידת הפורענות מעוטה אבר אחד לוקה ושאר כל האיברים מרגישין מידת הטובה המרובה על_אחת_כמה_וכמה הלכה ,"מהם והלא_דברים_קל_וחומר_ומה מדת פורענות מעוטה אמר הקב""ה לעשות ועשה מדה טובה מרובה על_אחת_כמה_וכמה והיה הדם לכם ",ref-mek
22479,ref-y.3.5.1.7.4.90-ref-y.3.5.1.7.4.103,ref-mek.1.14.3.64-ref-mek.1.14.3.74,2258472,2258568,337730,337743,ref-y.00003.00005.00001.00007.00004.00090,ref-y.00003.00005.00001.00007.00004.00103,50740,50815,7905,7915,ref-mek.00001.00014.00003.00064,ref-mek.00001.00014.00003.00074,מידת הפורענות מעוטה אבר אחד לוקה ושאר כל האיברים מרגישין מידת הטובה המרובה על_אחת_כמה_וכמה ה,"מדת פורענות מועטת העושה בסתר הקב""ה מפרסמו מדה טובה מרובה על_אחת_כמה_וכמה ו",ref-mek
22480,ref-y.3.5.1.8.10.2-ref-y.3.5.1.8.10.12,ref-mek.3.6.2.228-ref-mek.3.6.2.243,2261440,2261494,338190,338199,ref-y.00003.00005.00001.00008.00010.00002,ref-y.00003.00005.00001.00008.00010.00012,161322,161401,26312,26325,ref-mek.00003.00006.00002.00228,ref-mek.00003.00006.00002.00243,שגנב שלשה גניבות לב אביו ולב בית דין ולב אנשי ישראל ,וגנב שלש גנבות לב אביו ולב בית דין ולב ישראל שנאמר ויגנב אבשלום את לב אנשי ,ref-mek
22481,ref-y.3.5.1.8.10.2-ref-y.3.5.1.8.10.10,ref-mek.7.13.3.126-ref-mek.7.13.3.134,2261440,2261483,338190,338197,ref-y.00003.00005.00001.00008.00010.00002,ref-y.00003.00005.00001.00008.00010.00010,335659,335701,54450,54457,ref-mek.00007.00013.00003.00126,ref-mek.00007.00013.00003.00134,שגנב שלשה גניבות לב אביו ולב בית דין ולב ,שגנב שלש גניבות לב אביו ולב בית דין ולב ,ref-mek
22482,ref-y.3.5.1.8.10.198-ref-y.3.5.1.8.10.221,ref-mek.1.19.7.162-ref-mek.1.19.7.193,2262456,2262585,338364,338386,ref-y.00003.00005.00001.00008.00010.00198,ref-y.00003.00005.00001.00008.00010.00221,86871,87052,13691,13721,ref-mek.00001.00019.00007.00162,ref-mek.00001.00019.00007.00193,מרים חמתינה למשה שעה אחת שנאמר ותתצב אחותו מרחוק וגו' לפיכך נתעכבו לה ישדאל שבעת ימים במדבר שנאמר והעם לא נסע עד האסף מרים ,מרים המתינה למשה שעה אחת שנאמר ותתצב אחותו מרחוק לדעה והמקום עכב לה במדבר הארון והשכינה והכהנים והלויים וכל ישראל שבעת ימים עם ענני כבוד שנאמר והעם לא נסע עד האסף מרים ,ref-mek
22483,ref-y.3.5.1.8.10.248-ref-y.3.5.1.8.10.263,ref-mek.3.10.3.92-ref-mek.3.10.3.118,2262719,2262786,338407,338420,ref-y.00003.00005.00001.00008.00010.00248,ref-y.00003.00005.00001.00008.00010.00263,175739,175856,28772,28792,ref-mek.00003.00010.00003.00092,ref-mek.00003.00010.00003.00118,לדיעת כי מלאה הארץ דיעה את יי' מה יעשה לו כי לא יעשה י' אלהים דבר ,דעה אלא_רוח_הקדש שנאמר כי מלאה הארץ דעה את ה' וגו' מה יעשה לו אין עשייה אלא_רוח_הקדש שנאמר כי לא יעשה ה' אלהים דבר ,ref-mek
22484,ref-y.3.5.1.10.1.2-ref-y.3.5.1.10.1.10,ref-mek.1.19.7.194-ref-mek.1.19.7.202,2262825,2262870,338428,338435,ref-y.00003.00005.00001.00010.00001.00002,ref-y.00003.00005.00001.00010.00001.00010,87053,87098,13722,13729,ref-mek.00001.00019.00007.00194,ref-mek.00001.00019.00007.00202,יוסף זכה לקבור את אביו ואין באחיו גדול ממנו ,יוסף זכה לקבור את אביו שאין באחיו גדול ממנו ,ref-mek
22485,ref-y.3.5.1.10.3.64-ref-y.3.5.1.10.3.88,ref-mek.4.1.1.141-ref-mek.4.1.1.161,2263936,2264062,338607,338629,ref-y.00003.00005.00001.00010.00003.00064,ref-y.00003.00005.00001.00010.00003.00088,177290,177394,29033,29053,ref-mek.00004.00001.00001.00141,ref-mek.00004.00001.00001.00161,ובני ישראל נסעו מבארות בני יעקן מוסרה שם מת אחרן וכי במוסירות מת אהרן והלא בהר ההר מת הדא_היא_דכתיב ויעל אחרן הכהן אל ,ובני ישראל נסעו מבארות בני יעקן וגו' שם מת אהרן וכי במוסרה מת והלא לא מת אלא בהר ההר שנאמר ויעל ,ref-mek
22486,ref-y.3.5.1.10.4.44-ref-y.3.5.1.10.4.49,ref-mek.3.3.1.474-ref-mek.3.3.1.478,2264914,2264944,338770,338775,ref-y.00003.00005.00001.00010.00004.00044,ref-y.00003.00005.00001.00010.00004.00049,148049,148072,24036,24040,ref-mek.00003.00003.00001.00474,ref-mek.00003.00003.00001.00478,אנכי ארד עמך מצרים ואנכי אעלך ,אנכי ארד עמך מצרימה עלו ,ref-mek
22487,ref-y.3.5.1.10.5.55-ref-y.3.5.1.10.5.61,ref-mek.2.2.2.51-ref-mek.2.2.2.57,2265345,2265374,338844,338850,ref-y.00003.00005.00001.00010.00005.00055,ref-y.00003.00005.00001.00010.00005.00061,94475,94504,14964,14970,ref-mek.00002.00002.00002.00051,ref-mek.00002.00002.00002.00057,עלה אל הר העברים הזה הר נבו ,עלה אל הר העברים הזה הר נבו ,ref-mek
22488,ref-y.3.5.1.10.5.108-ref-y.3.5.1.10.5.114,ref-mek.7.18.3.128-ref-mek.7.18.3.134,2265612,2265649,338893,338899,ref-y.00003.00005.00001.00010.00005.00108,ref-y.00003.00005.00001.00010.00005.00114,354780,354814,57528,57534,ref-mek.00007.00018.00003.00128,ref-mek.00007.00018.00003.00134,יבוא שלום ינוחו על משכבותם הולך נכוחו ,יבא שלום ינוחו על משכבם הולך נכוחו ,ref-mek
22489,ref-y.3.5.2.1.8.8-ref-y.3.5.2.1.8.20,ref-mek.1.18.3.342-ref-mek.1.18.3.355,2267819,2267880,339233,339243,ref-y.00003.00005.00002.00001.00008.00008,ref-y.00003.00005.00002.00001.00008.00020,74694,74759,11717,11728,ref-mek.00001.00018.00003.00342,ref-mek.00001.00018.00003.00355,מה מנחת שנאמר להלן שעורין אף בן שעורין אמר_רבי_לעזר נאמר כאן ,מה זה בעיניכם האמור להלן על_גובה_של ראש אף בין עיניך האמור כאן ,ref-mek
22490,ref-y.3.5.2.1.8.8-ref-y.3.5.2.1.8.31,ref-mek.5.3.2.18-ref-mek.5.3.2.30,2267819,2267942,339233,339254,ref-y.00003.00005.00002.00001.00008.00008,ref-y.00003.00005.00002.00001.00008.00031,220672,220733,36268,36280,ref-mek.00005.00003.00002.00018,ref-mek.00005.00003.00002.00030,מה מנחת שנאמר להלן שעורין אף בן שעורין אמר_רבי_לעזר נאמר כאן אביב ונאמר במצרים אביב מה אביב האמור במצרים שעורין אף כאן ,נאמר כאן שלוח ונאמר להלן שילוח מה שלוח האמור להלן גט אף כאן ,ref-mek
22491,ref-y.3.5.2.1.8.8-ref-y.3.5.2.1.8.22,ref-mek.7.1.2.114-ref-mek.7.1.2.128,2267819,2267892,339233,339245,ref-y.00003.00005.00002.00001.00008.00008,ref-y.00003.00005.00002.00001.00008.00022,285420,285495,46810,46822,ref-mek.00007.00001.00002.00114,ref-mek.00007.00001.00002.00128,מה מנחת שנאמר להלן שעורין אף בן שעורין אמר_רבי_לעזר נאמר כאן אביב ונאמר ,נאמר כאן עברי ונאמר להלן עברי מה עברי האמור להלן בבן ישראל_הכתוב_מדבר אף ,ref-mek
22492,ref-y.3.5.2.2.4.44-ref-y.3.5.2.2.4.56,ref-mek.4.4.1.55-ref-mek.4.4.1.70,2269858,2269920,339565,339577,ref-y.00003.00005.00002.00002.00004.00044,ref-y.00003.00005.00002.00002.00004.00056,189258,189339,31008,31023,ref-mek.00004.00004.00001.00055,ref-mek.00004.00004.00001.00070,יהודה בני תן לי סנדלי ונתתי לו ופשט ידו לחלון ונתן לי ממנה ,נותנו לכם שלא תאמרו אין ספק בידו ליתנו לנו אלא הריני נותנה לכם ולבסוף אפרע מכם ,ref-mek
22493,ref-y.3.5.3.1.4.205-ref-y.3.5.3.1.4.214,ref-mek.4.4.4.50-ref-mek.4.4.4.57,2279561,2279618,341067,341076,ref-y.00003.00005.00003.00001.00004.00205,ref-y.00003.00005.00003.00001.00004.00214,192696,192738,31569,31576,ref-mek.00004.00004.00004.00050,ref-mek.00004.00004.00004.00057,שנאמר להלן שיריה נאכלין אף אזכרה שנאמר כאן שיריה נאכלין ,נאמר כאן לאכלה ונאמר להלן לחם אבירים אכל ,ref-mek
22494,ref-y.3.5.3.4.3.23-ref-y.3.5.3.4.3.33,ref-mek.7.18.3.204-ref-mek.7.18.3.216,2282397,2282454,341510,341519,ref-y.00003.00005.00003.00004.00003.00023,ref-y.00003.00005.00003.00004.00003.00033,355153,355220,57590,57602,ref-mek.00007.00018.00003.00204,ref-mek.00007.00018.00003.00216,מה אם מידת הפורענות מעוטה הרי היא מזכרת מידת הטוב מרובה ,ומה אם מדת פורענות מעוטה כשיחיד צועק על הרבים כך מדה טובה ורבים ,ref-mek
22495,ref-y.3.5.3.4.3.23-ref-y.3.5.3.4.3.34,ref-mek.1.8.1.453-ref-mek.1.8.1.469,2282397,2282471,341510,341520,ref-y.00003.00005.00003.00004.00003.00023,ref-y.00003.00005.00003.00004.00003.00034,26322,26422,4192,4204,ref-mek.00001.00008.00001.00453,ref-mek.00001.00008.00001.00469,מה אם מידת הפורענות מעוטה הרי היא מזכרת מידת הטוב מרובה על_אחת_כמה_וכמה א,"מהם והלא_דברים_קל_וחומר_ומה מדת פורענות מעוטה אמר הקב""ה לעשות ועשה מדה טובה מרובה על_אחת_כמה_וכמה ו",ref-mek
22496,ref-y.3.5.3.4.3.25-ref-y.3.5.3.4.3.34,ref-mek.1.14.3.64-ref-mek.1.14.3.74,2282403,2282471,341512,341520,ref-y.00003.00005.00003.00004.00003.00025,ref-y.00003.00005.00003.00004.00003.00034,50740,50815,7905,7915,ref-mek.00001.00014.00003.00064,ref-mek.00001.00014.00003.00074,מידת הפורענות מעוטה הרי היא מזכרת מידת הטוב מרובה על_אחת_כמה_וכמה א,"מדת פורענות מועטת העושה בסתר הקב""ה מפרסמו מדה טובה מרובה על_אחת_כמה_וכמה ו",ref-mek
22497,ref-y.3.5.3.4.5.99-ref-y.3.5.3.4.6.4,ref-mek.1.17.1.477-ref-mek.1.17.1.488,2283667,2283732,341707,341715,ref-y.00003.00005.00003.00004.00005.00099,ref-y.00003.00005.00003.00004.00006.00004,64376,64431,10109,10116,ref-mek.00001.00017.00001.00477,ref-mek.00001.00017.00001.00488,אין הדור יתום שרבי_אלעזר_בן_עזריה שרוי בתוכו מטורנה שאלה את רבי ,אין הדור יתום שר'_אלעזר_בן_עזריה שרוי בתוכו אמרו לו רבי ,ref-mek
22498,ref-y.3.5.3.8.3.1-ref-y.3.5.3.8.3.15,ref-mek.7.3.1.68-ref-mek.7.3.1.75,2290961,2291030,342816,342827,ref-y.00003.00005.00003.00008.00003.00001,ref-y.00003.00005.00003.00008.00003.00015,292986,293025,47952,47958,ref-mek.00007.00003.00001.00068,ref-mek.00007.00003.00001.00075,האיש מוכר את בתו דכתיב וכי ימכר איש את בתו לאמה האיש מקדש את בתו ,האיש מוכר את בתו ואין האשה מוכרת בתה ,ref-mek
22499,ref-y.3.5.3.8.3.1-ref-y.3.5.3.8.3.22,ref-mek.7.3.1.103-ref-mek.7.3.1.118,2290961,2291066,342816,342833,ref-y.00003.00005.00003.00008.00003.00001,ref-y.00003.00005.00003.00008.00003.00022,293158,293228,47977,47987,ref-mek.00007.00003.00001.00103,ref-mek.00007.00003.00001.00118,האיש מוכר את בתו דכתיב וכי ימכר איש את בתו לאמה האיש מקדש את בתו דכתיב את בתי נתתי לאיש הזה לאשה ,איש איש מוכר את בתו ואין אשה מוכרת את בתה וכי_ימכור_איש את בתו האיש ,ref-mek
22500,ref-y.3.5.3.8.3.1-ref-y.3.5.3.8.3.11,ref-mek.7.3.1.155-ref-mek.7.3.1.171,2290961,2291012,342816,342824,ref-y.00003.00005.00003.00008.00003.00001,ref-y.00003.00005.00003.00008.00003.00011,293408,293488,48015,48025,ref-mek.00007.00003.00001.00155,ref-mek.00007.00003.00001.00171,האיש מוכר את בתו דכתיב וכי ימכר איש את בתו לאמה ,בתו האיש מוכר את בתו ואינו מוכר את בנו וכי_ימכור_איש האיש מוכר את עצמו ואין ,ref-mek
22501,ref-y.3.5.3.8.6.18-ref-y.3.5.3.8.6.41,ref-mek.7.15.1.134-ref-mek.7.15.1.147,2291495,2291618,342903,342921,ref-y.00003.00005.00003.00008.00006.00018,ref-y.00003.00005.00003.00008.00006.00041,340469,340546,55219,55232,ref-mek.00007.00015.00001.00134,ref-mek.00007.00015.00001.00147,בגניבה אחת אבל בשתי גניבות נמכר ונשנה ר'_ירמיה_בעי גנב משל שותפות מה_את_עבד_לה בגניבה אחת כשתי גניבות היה גונב ומוציא ,וגונב מבית האיש לפטור הגונב מאחר הגנב אם ימצא הגנב שנים ישלם הגנב משלם ,ref-mek
22502,ref-y.3.5.5.3.3.132-ref-y.3.5.5.3.3.157,ref-mek.3.1.1.1186-ref-mek.3.1.1.1206,2306056,2306198,345088,345110,ref-y.00003.00005.00005.00003.00003.00132,ref-y.00003.00005.00005.00003.00003.00157,139551,139666,22587,22606,ref-mek.00003.00001.00001.01186,ref-mek.00003.00001.00001.01206,אמו אף הן פתחו את פיהן בשירה ובשבח ואמרו זה אלי ואנויהו רבי_מאיר_אומר אפילו עוברין ממעי אימותיהן היו אומ' שירה שנאמר במקהלות ברכו אלהים ,שנאמר אשירה לה' וגו' ר' מאיר אמר אף עוברין שבמעי אמן פתחו פיהן ואמרו שירה לפני המקום שנאמר במקהלות ברכו אלהים ,ref-mek
22503,ref-y.3.5.5.3.3.169-ref-y.3.5.5.3.3.187,ref-mek.4.1.1.243-ref-mek.4.1.1.257,2306259,2306366,345122,345140,ref-y.00003.00005.00005.00003.00003.00169,ref-y.00003.00005.00005.00003.00003.00187,177869,177959,29126,29140,ref-mek.00004.00001.00001.00243,ref-mek.00004.00001.00001.00257,ראו פיגרי אנשים חטאים שהיו משעבדין בהן בפרך בעבודה קשה וכולם פגרים מתים מושלכים על שפת הים ביקשו לומר ,שראו בפגרי האנשים שהעבידום בפרך ובעבודה קשה כולן פגרים מתים מוטלין על שפת הים אמרו ,ref-mek
22504,ref-y.3.5.5.4.2.17-ref-y.3.5.5.4.2.35,ref-mek.3.1.1.730-ref-mek.3.1.1.749,2306634,2306727,345177,345193,ref-y.00003.00005.00005.00004.00002.00017,ref-y.00003.00005.00005.00004.00002.00035,137144,137243,22173,22188,ref-mek.00003.00001.00001.00730,ref-mek.00003.00001.00001.00749,משה אמ' אשירה והן_עונין_אחריו אשירה ליי' כי גאה גאה סוס ורוכבו רמה בים משה אמ' עזי וזמרת ,משה היה פותח ואומר אשירה לה'_כי_גאה_גאה וישראל אומר סוס ורוכבו רמה בים משה היה אומר עוזי וזמרת ,ref-mek
22505,ref-y.3.5.5.5.5.47-ref-y.3.5.5.5.5.65,ref-mek.3.6.2.264-ref-mek.3.6.2.278,2308220,2308322,345448,345465,ref-y.00003.00005.00005.00005.00005.00047,ref-y.00003.00005.00005.00005.00005.00065,161511,161588,26344,26356,ref-mek.00003.00006.00002.00264,ref-mek.00003.00006.00002.00278,ואהבת את יי' אלהיך בכל לבבך ובכל נפשך ובכל מאודך רחמתיה בכל לבי ורחמתיה בכל ממוני ובכל נפשי לא ,בכל לבבם ובכל נפשם שנאמר ואהבת את_ה'_אלהיך בכל לבבך ובכל נפשך וגו' ולא ,ref-mek
22506,ref-y.3.5.7.2.1.25-ref-y.3.5.7.2.1.30,ref-mek.6.4.2.66-ref-mek.6.4.2.72,2316305,2316342,346683,346688,ref-y.00003.00005.00007.00002.00001.00025,ref-y.00003.00005.00007.00002.00001.00030,249484,249525,41118,41124,ref-mek.00006.00004.00002.00066,ref-mek.00006.00004.00002.00072,שבכולן משה ידבר והאלהים יעננו בקול ,יכולה לשמוע משה ידבר והאלהים יעננו בקול ,ref-mek
22507,ref-y.3.5.7.2.1.65-ref-y.3.5.7.2.1.78,ref-mek.7.4.3.59-ref-mek.7.4.3.70,2316527,2316595,346721,346733,ref-y.00003.00005.00007.00002.00001.00065,ref-y.00003.00005.00007.00002.00001.00078,301363,301424,49273,49283,ref-mek.00007.00004.00003.00059,ref-mek.00007.00004.00003.00070,תימר קודם למתן תורה הרי פרשת וידוי מעשר הרי הוא לאחר מתן תורה והוא ,אומר קודם מתן תורה היינו מוזהרים על שפיכות דמים לאחר מתן תורה ,ref-mek
22508,ref-y.3.5.7.3.3.36-ref-y.3.5.7.3.3.54,ref-mek.1.18.4.282-ref-mek.1.18.4.303,2318253,2318351,346996,347014,ref-y.00003.00005.00007.00003.00003.00036,ref-y.00003.00005.00007.00003.00003.00054,76979,77094,12046,12067,ref-mek.00001.00018.00004.00282,ref-mek.00001.00018.00004.00303,נאמר כאן אלוני מורה ונאמר להלן אלוני מורה מה אלוני מורה האמור להלן שכם אף אילוני מורה האמור כאן ,נאמר כאן מימים ימימה ונאמר להלן ימים תהיה גאולתו מה ימים האמור להלן לא יפחות משנים עשר חדש אף ימים האמורים כאן ,ref-mek
22509,ref-y.3.5.7.3.3.36-ref-y.3.5.7.3.3.50,ref-mek.5.3.2.18-ref-mek.5.3.2.29,2318253,2318328,346996,347010,ref-y.00003.00005.00007.00003.00003.00036,ref-y.00003.00005.00007.00003.00003.00050,220672,220729,36268,36279,ref-mek.00005.00003.00002.00018,ref-mek.00005.00003.00002.00029,נאמר כאן אלוני מורה ונאמר להלן אלוני מורה מה אלוני מורה האמור להלן שכם אף ,נאמר כאן שלוח ונאמר להלן שילוח מה שלוח האמור להלן גט אף ,ref-mek
22510,ref-y.3.5.7.3.3.36-ref-y.3.5.7.3.3.54,ref-mek.7.1.2.114-ref-mek.7.1.2.132,2318253,2318351,346996,347014,ref-y.00003.00005.00007.00003.00003.00036,ref-y.00003.00005.00007.00003.00003.00054,285420,285515,46810,46826,ref-mek.00007.00001.00002.00114,ref-mek.00007.00001.00002.00132,נאמר כאן אלוני מורה ונאמר להלן אלוני מורה מה אלוני מורה האמור להלן שכם אף אילוני מורה האמור כאן ,נאמר כאן עברי ונאמר להלן עברי מה עברי האמור להלן בבן ישראל_הכתוב_מדבר אף עבד עברי האמור כאן ,ref-mek
22511,ref-y.3.5.7.3.3.40-ref-y.3.5.7.3.3.54,ref-mek.7.4.2.154-ref-mek.7.4.2.166,2318273,2318351,347000,347014,ref-y.00003.00005.00007.00003.00003.00040,ref-y.00003.00005.00007.00003.00003.00054,300958,301023,49208,49220,ref-mek.00007.00004.00002.00154,ref-mek.00007.00004.00002.00166,ונאמר להלן אלוני מורה מה אלוני מורה האמור להלן שכם אף אילוני מורה האמור כאן ,ונאמר להלן מקום מה מקום האמור להלן אלפים אמה אף מקום האמור כאן ,ref-mek
22512,ref-y.3.5.7.3.3.40-ref-y.3.5.7.3.3.50,ref-mek.7.16.5.40-ref-mek.7.16.5.49,2318273,2318328,347000,347010,ref-y.00003.00005.00007.00003.00003.00040,ref-y.00003.00005.00007.00003.00003.00050,346915,346966,56239,56248,ref-mek.00007.00016.00005.00040,ref-mek.00007.00016.00005.00049,ונאמר להלן אלוני מורה מה אלוני מורה האמור להלן שכם אף ,ונאמר להלן מיתה מה מיתה האמורה להלן שבויה בכלל אף ,ref-mek
22513,ref-y.3.5.7.5.4.113-ref-y.3.5.7.5.4.119,ref-mek.3.9.5.13-ref-mek.3.9.5.19,2325068,2325107,348050,348056,ref-y.00003.00005.00007.00005.00004.00113,ref-y.00003.00005.00007.00005.00004.00119,172100,172139,28143,28149,ref-mek.00003.00009.00005.00013,ref-mek.00003.00009.00005.00019,בשמוע כל מלכי האמורי אשר בעבר הירדן ,כשמוע כל מלכי האמורי אשר בעבר הירדן ,ref-mek
22514,ref-y.3.5.8.1.1.42-ref-y.3.5.8.1.1.54,ref-mek.1.18.4.282-ref-mek.1.18.4.294,2327493,2327563,348416,348428,ref-y.00003.00005.00008.00001.00001.00042,ref-y.00003.00005.00008.00001.00001.00054,76979,77049,12046,12058,ref-mek.00001.00018.00004.00282,ref-mek.00001.00018.00004.00294,נאמר כאן נגישה ונאמר להלן ונגשו הכחנים בני לוי מה נגישה שנאמר להלן ,נאמר כאן מימים ימימה ונאמר להלן ימים תהיה גאולתו מה ימים האמור להלן ,ref-mek
22515,ref-y.3.5.8.1.1.42-ref-y.3.5.8.1.1.58,ref-mek.5.3.2.18-ref-mek.5.3.2.30,2327493,2327584,348416,348432,ref-y.00003.00005.00008.00001.00001.00042,ref-y.00003.00005.00008.00001.00001.00058,220672,220733,36268,36280,ref-mek.00005.00003.00002.00018,ref-mek.00005.00003.00002.00030,נאמר כאן נגישה ונאמר להלן ונגשו הכחנים בני לוי מה נגישה שנאמר להלן בלשון הקודש אף כאן ,נאמר כאן שלוח ונאמר להלן שילוח מה שלוח האמור להלן גט אף כאן ,ref-mek
22516,ref-y.3.5.8.1.1.42-ref-y.3.5.8.1.1.57,ref-mek.7.1.2.114-ref-mek.7.1.2.128,2327493,2327580,348416,348431,ref-y.00003.00005.00008.00001.00001.00042,ref-y.00003.00005.00008.00001.00001.00057,285420,285495,46810,46822,ref-mek.00007.00001.00002.00114,ref-mek.00007.00001.00002.00128,נאמר כאן נגישה ונאמר להלן ונגשו הכחנים בני לוי מה נגישה שנאמר להלן בלשון הקודש אף ,נאמר כאן עברי ונאמר להלן עברי מה עברי האמור להלן בבן ישראל_הכתוב_מדבר אף ,ref-mek
22517,ref-y.3.5.8.1.1.82-ref-y.3.5.8.1.1.94,ref-mek.1.18.4.282-ref-mek.1.18.4.294,2327701,2327768,348445,348457,ref-y.00003.00005.00008.00001.00001.00082,ref-y.00003.00005.00008.00001.00001.00094,76979,77049,12046,12058,ref-mek.00001.00018.00004.00282,ref-mek.00001.00018.00004.00294,נאמר כאן נגישה ונאמר להלן ונגש משה אל הערפל מה נגישה שנאמר להלן ,נאמר כאן מימים ימימה ונאמר להלן ימים תהיה גאולתו מה ימים האמור להלן ,ref-mek
22518,ref-y.3.5.8.1.1.82-ref-y.3.5.8.1.1.98,ref-mek.5.3.2.18-ref-mek.5.3.2.30,2327701,2327789,348445,348461,ref-y.00003.00005.00008.00001.00001.00082,ref-y.00003.00005.00008.00001.00001.00098,220672,220733,36268,36280,ref-mek.00005.00003.00002.00018,ref-mek.00005.00003.00002.00030,נאמר כאן נגישה ונאמר להלן ונגש משה אל הערפל מה נגישה שנאמר להלן בלשון הקודש אף כאן ,נאמר כאן שלוח ונאמר להלן שילוח מה שלוח האמור להלן גט אף כאן ,ref-mek
