,baseOrig,compOrig,baseCharStart,baseCharEnd,baseWdStart,baseWdEnd,baseRefStart,baseRefEnd,compCharStart,compCharEnd,compWdStart,compWdEnd,compRefStart,compRefEnd,baseStr,compStr,compWork
13675,ref-bible.0103.20.17.6-ref-bible.0103.20.17.19,ref-t.4.4.10.8.3-ref-t.4.4.10.8.17,233969,234029,40376,40387,ref-bible.00103.00020.00017.00006,ref-bible.00103.00020.00017.00019,917359,917444,145441,145453,ref-t.00004.00004.00010.00008.00003,ref-t.00004.00004.00010.00008.00017,בת אביו או בת אמו וראה את ערותה והיא תראה את ערותו חסד הוא ,נערה המאורשה אינו_חייב_עד שתהא נערה בתולה מאורשה והיא בבית אביה נערה ארוסה בבית ,ref-t
13676,ref-bible.0103.21.10.1-ref-bible.0103.21.10.7,ref-t.4.4.4.1.82-ref-t.4.4.4.1.88,235473,235510,40649,40655,ref-bible.00103.00021.00010.00001,ref-bible.00103.00021.00010.00007,892718,892755,141511,141517,ref-t.00004.00004.00004.00001.00082,ref-t.00004.00004.00004.00001.00088,והכהן הגדול מאחיו אשר יוצק על ראשו ,והכהן הגדול מאחיו אשר יוצק על ראשו ,ref-t
13677,ref-bible.0103.22.4.13-ref-bible.0103.22.6.1,ref-t.4.6.1.7.65-ref-t.4.6.1.7.74,236660,236789,40856,40884,ref-bible.00103.00022.00004.00013,ref-bible.00103.00022.00006.00001,948574,948614,150379,150388,ref-t.00004.00006.00001.00007.00065,ref-t.00004.00006.00001.00007.00074,אשר יטהר והנגע בכל טמא נפש או איש אשר תצא ממנו שכבת זרע או איש אשר יגע בכל שרץ אשר יטמא לו או באדם אשר יטמא לו לכל טמאתו נפש ,וכלל או נפש אשר תגע בכל דבר טמא כלל או ,ref-t
13678,ref-bible.0103.22.5.4-ref-bible.0103.22.5.16,ref-t.6.1.5.9.39-ref-t.6.1.6.1.13,236729,236785,40871,40883,ref-bible.00103.00022.00005.00004,ref-bible.00103.00022.00005.00016,1255723,1255798,198269,198282,ref-t.00006.00001.00005.00009.00039,ref-t.00006.00001.00006.00001.00013,יגע בכל שרץ אשר יטמא לו או באדם אשר יטמא לו לכל טמאתו ,במגע אין כלי חרש מיטמא אלא באב הטומאה ומשקין כל שאב הטומאה בשעתו ולא ,ref-t
13679,ref-bible.0103.22.5.4-ref-bible.0103.22.6.3,ref-t.6.1.4.13.19-ref-t.6.1.4.13.25,236729,236797,40871,40886,ref-bible.00103.00022.00005.00004,ref-bible.00103.00022.00006.00003,1251991,1252037,197722,197728,ref-t.00006.00001.00004.00013.00019,ref-t.00006.00001.00004.00013.00025,יגע בכל שרץ אשר יטמא לו או באדם אשר יטמא לו לכל טמאתו נפש אשר תגע ,במגע ובאויר והשאר מטמאות במגע ואין מטמאות ,ref-t
13680,ref-bible.0103.22.24.1-ref-bible.0103.22.24.4,ref-t.3.1.10.5.1-ref-t.3.1.10.5.4,237979,238006,41095,41098,ref-bible.00103.00022.00024.00001,ref-bible.00103.00022.00024.00004,533697,533720,83518,83521,ref-t.00003.00001.00010.00005.00001,ref-t.00003.00001.00010.00005.00004,ומעוך וכתות ונתוק וכרות ,מעוך וכתות נתוק וכרות ,ref-t
13681,ref-bible.0103.22.24.1-ref-bible.0103.22.24.4,ref-t.3.1.10.5.20-ref-t.3.1.10.5.24,237979,238006,41095,41098,ref-bible.00103.00022.00024.00001,ref-bible.00103.00022.00024.00004,533794,533825,83528,83532,ref-t.00003.00001.00010.00005.00020,ref-t.00003.00001.00010.00005.00024,ומעוך וכתות ונתוק וכרות ,מעוך וכתות בביצים נתוק וכרות ,ref-t
13682,ref-bible.0103.22.28.4-ref-bible.0103.22.28.10,ref-t.5.2.4.5.19-ref-t.5.2.4.5.25,238249,238280,41145,41151,ref-bible.00103.00022.00028.00004,ref-bible.00103.00022.00028.00010,1084076,1084107,171527,171533,ref-t.00005.00002.00004.00005.00019,ref-t.00005.00002.00004.00005.00025,אתו ואת בנו לא תשחטו ביום אחד ,אתו ואת בנו לא תשחטו ביום אחד ,ref-t
13683,ref-bible.0103.23.20.1-ref-bible.0103.23.20.12,ref-t.5.3.7.20.11-ref-t.5.3.7.20.27,239854,239915,41375,41384,ref-bible.00103.00023.00020.00001,ref-bible.00103.00023.00020.00012,1126578,1126660,177800,177814,ref-t.00005.00003.00007.00020.00011,ref-t.00005.00003.00007.00020.00027,והניף הכהן אתם על לחם הבכורים תנופה_לפני_יהוה על שני כבשים ,והניף אתם על לחם הבכורים תנופה אמרו_לו_והלא כבר נאמר תנופה לפני ייי על שני כבשים ,ref-t
13684,ref-bible.0103.23.22.9-ref-bible.0103.23.22.13,ref-t.1.2.2.14.18-ref-t.1.2.2.14.24,240071,240097,41404,41408,ref-bible.00103.00023.00022.00009,ref-bible.00103.00023.00022.00013,39798,39834,6523,6529,ref-t.00001.00002.00002.00014.00018,ref-t.00001.00002.00002.00014.00024,בקצרך ולקט קצירך לא תלקט ,הקצירה בלבד שנ' ולקט קצירך לא תלקט ,ref-t
13685,ref-bible.0103.23.23.1-ref-bible.0103.23.24.12,ref-t.2.10.3.6.3-ref-t.2.10.3.6.13,240135,240220,41414,41422,ref-bible.00103.00023.00023.00001,ref-bible.00103.00023.00024.00012,481266,481322,75210,75219,ref-t.00002.00010.00003.00006.00003,ref-t.00002.00010.00003.00006.00013,וידבר יהוה_אל_משה_לאמר_דבר_אל_בני_ישראל_לאמר בחדש השביעי באחד לחדש יהיה לכם שבתון ,דבר אל בני ישראל בחדש השביעי באחד לחדש יהיה לכם שבתון ,ref-t
13686,ref-bible.0103.24.7.1-ref-bible.0103.24.7.6,ref-t.5.3.11.15.56-ref-t.5.3.11.15.61,242010,242042,41678,41683,ref-bible.00103.00024.00007.00001,ref-bible.00103.00024.00007.00006,1147353,1147385,181226,181231,ref-t.00005.00003.00011.00015.00056,ref-t.00005.00003.00011.00015.00061,ונתת על המערכת לבנה זכה והיתה ,ונתת על המערכת לבונה זכה שתהא ,ref-t
13687,ref-bible.0103.24.8.1-ref-bible.0103.24.8.6,ref-t.5.3.7.7.37-ref-t.5.3.7.7.42,242068,242103,41688,41693,ref-bible.00103.00024.00008.00001,ref-bible.00103.00024.00008.00006,1122909,1122944,177160,177165,ref-t.00005.00003.00007.00007.00037,ref-t.00005.00003.00007.00007.00042,ביום השבת ביום השבת יערכנו לפני ,ביום השבת ביום השבת יערכנו לפני ,ref-t
13688,ref-bible.0103.25.7.4-ref-bible.0103.25.7.8,ref-t.1.5.5.1.20-ref-t.1.5.5.1.24,243461,243487,41917,41921,ref-bible.00103.00025.00007.00004,ref-bible.00103.00025.00007.00008,148378,148404,23410,23414,ref-t.00001.00005.00005.00001.00020,ref-t.00001.00005.00005.00001.00024,בארצך תהיה כל תבואתה לאכל ,בארצך תהיה כל תבואתה לאכל ,ref-t
13689,ref-bible.0103.25.7.4-ref-bible.0103.25.7.8,ref-t.1.5.5.20.27-ref-t.1.5.5.20.31,243461,243487,41917,41921,ref-bible.00103.00025.00007.00004,ref-bible.00103.00025.00007.00008,151062,151088,23832,23836,ref-t.00001.00005.00005.00020.00027,ref-t.00001.00005.00005.00020.00031,בארצך תהיה כל תבואתה לאכל ,בארצך תהיה כל תבואתה לאכל ,ref-t
13690,ref-bible.0103.25.15.8-ref-bible.0103.25.16.3,ref-t.5.5.5.1.14-ref-t.5.5.5.1.20,244045,244083,42024,42031,ref-bible.00103.00025.00015.00008,ref-bible.00103.00025.00016.00003,1196100,1196134,189077,189083,ref-t.00005.00005.00005.00001.00014,ref-t.00005.00005.00005.00001.00020,במספר שני תבואת ימכר לך לפי רב השנים ,במספר שני תבואות ימכר לך היתה שנה ,ref-t
13691,ref-bible.0103.25.21.5-ref-bible.0103.25.22.8,ref-t.5.8.3.5.16-ref-t.5.8.3.5.32,244411,244501,42085,42097,ref-bible.00103.00025.00021.00005,ref-bible.00103.00025.00022.00008,1238875,1238955,195725,195737,ref-t.00005.00008.00003.00005.00016,ref-t.00005.00008.00003.00005.00032,בשנה הששית ועשת את התבואה לשלש השנים וזרעתם את השנה השמינת ואכלתם מן התבואה ישן ,מהן אכל מביא שני אשמות תלוין ר'_ליעזר_או' מביא_חטאת_ואשם תלוי אכל שנייה מביא שלש ,ref-t
13692,ref-bible.0103.25.21.9-ref-bible.0103.25.22.15,ref-t.2.3.5.3.15-ref-t.2.3.5.3.24,244433,244538,42088,42104,ref-bible.00103.00025.00021.00009,ref-bible.00103.00025.00022.00015,351310,351364,54868,54877,ref-t.00002.00003.00005.00003.00015,ref-t.00002.00003.00005.00003.00024,התבואה לשלש השנים וזרעתם את השנה השמינת ואכלתם מן התבואה ישן עד השנה התשיעת עד בוא תבואתה תאכלו ,ומן הנקבות ובאה בן שנתה ובאה בת שתים ונאכלת לשני ,ref-t
13693,ref-bible.0103.25.25.1-ref-bible.0103.25.25.6,ref-t.5.5.5.9.34-ref-t.5.5.5.9.40,244636,244667,42124,42129,ref-bible.00103.00025.00025.00001,ref-bible.00103.00025.00025.00006,1197797,1197832,189368,189374,ref-t.00005.00005.00005.00009.00034,ref-t.00005.00005.00005.00009.00040,כי ימוך אחיך ומכר מאחזתו ובא ,וכי ימוך אחיך ומכר מאחזתו לא באת ,ref-t
13694,ref-bible.0103.25.29.1-ref-bible.0103.25.29.7,ref-t.5.5.5.9.47-ref-t.5.5.5.9.53,244914,244945,42175,42181,ref-bible.00103.00025.00029.00001,ref-bible.00103.00025.00029.00007,1197861,1197893,189380,189386,ref-t.00005.00005.00005.00009.00047,ref-t.00005.00005.00005.00009.00053,ואיש כי ימכר בית מושב עיר חומה ,ואיש כי ימכור בית מושב עיר חומה ,ref-t
13695,ref-bible.0103.25.35.1-ref-bible.0103.25.36.5,ref-t.5.5.5.9.74-ref-t.5.5.5.9.85,245368,245450,42262,42278,ref-bible.00103.00025.00035.00001,ref-bible.00103.00025.00036.00005,1197980,1198038,189405,189416,ref-t.00005.00005.00005.00009.00074,ref-t.00005.00005.00005.00009.00085,וכי ימוך אחיך ומטה ידו עמך והחזקת בו גר ותושב וחי עמך אל תקח מאתו נשך ותרבית ,וכי ימוך אחיך ומטה ידו עמך ואו' אל תקח מאתו נשך ותרבית ,ref-t
13696,ref-bible.0103.25.37.4-ref-bible.0103.25.38.10,ref-t.1.3.5.16.10-ref-t.1.3.5.17.2,245491,245575,42286,42298,ref-bible.00103.00025.00037.00004,ref-bible.00103.00025.00038.00010,73125,73170,11813,11823,ref-t.00001.00003.00005.00016.00010,ref-t.00001.00003.00005.00017.00002,תתן לו בנשך ובמרבית לא תתן אכלך אני_יהוה_אלהיכם אשר הוצאתי אתכם_מארץ_מצרים לתת לכם ,צאנו אם נתן להן שכרן נותן להם לשם טובה לא יתן ,ref-t
13697,ref-bible.0103.25.39.1-ref-bible.0103.25.39.7,ref-t.5.5.5.9.94-ref-t.5.5.5.9.100,245606,245637,42303,42309,ref-bible.00103.00025.00039.00001,ref-bible.00103.00025.00039.00007,1198074,1198105,189424,189430,ref-t.00005.00005.00005.00009.00094,ref-t.00005.00005.00005.00009.00100,וכי ימוך אחיך עמך ונמכר לך לא ,כי ימוך אחיך עמך ונמכר לך ולא ,ref-t
13698,ref-bible.0103.25.47.10-ref-bible.0103.25.47.17,ref-t.5.5.5.9.114-ref-t.5.5.5.9.127,246158,246195,42405,42412,ref-bible.00103.00025.00047.00010,ref-bible.00103.00025.00047.00017,1198166,1198233,189444,189457,ref-t.00005.00005.00005.00009.00114,ref-t.00005.00005.00005.00009.00127,ונמכר לגר תושב עמך או לעקר משפחת גר ,ונמכר לגר תושב ולא לגר תושב אלא לעובד ע'ז שנ' או לעקר משפחת גר ,ref-t
13699,ref-bible.0103.27.4.6-ref-bible.0103.27.5.8,ref-t.2.4.3.26.20-ref-t.2.4.3.26.38,250076,250121,43062,43071,ref-bible.00103.00027.00004.00006,ref-bible.00103.00027.00005.00008,386315,386410,60352,60368,ref-t.00002.00004.00003.00026.00020,ref-t.00002.00004.00003.00026.00038,שלשים שקל ואם מבן חמש שנים ועד בן עשרים שנה ,שנה ולהלן הוא אומ' ומבן שלשים שנה אם נאמ' מבן חמש ועשרים למה נאמ' מבן שלשים ואם נאמ' מבן ,ref-t
13700,ref-bible.0103.27.4.6-ref-bible.0103.27.5.9,ref-t.5.4.7.2.17-ref-t.5.4.7.2.31,250076,250127,43062,43072,ref-bible.00103.00027.00004.00006,ref-bible.00103.00027.00005.00009,1176038,1176104,185803,185817,ref-t.00005.00004.00007.00002.00017,ref-t.00005.00004.00007.00002.00031,שלשים שקל ואם מבן חמש שנים ועד בן עשרים שנה והיה ,שמתעשרת בת שנתה היתה לו בהמה של שתים ושלש שנים אם מכיר בה של שנה ,ref-t
13701,ref-bible.0103.27.4.6-ref-bible.0103.27.5.6,ref-t.6.6.1.1.34-ref-t.6.6.1.1.45,250076,250111,43062,43069,ref-bible.00103.00027.00004.00006,ref-bible.00103.00027.00005.00006,1399853,1399906,220359,220367,ref-t.00006.00006.00001.00001.00034,ref-t.00006.00006.00001.00001.00045,שלשים שקל ואם מבן חמש שנים ועד בן ,שלש שנים ועד בן חמש שנים ר'_יוסי_הגלילי_אומ' פרים בני ,ref-t
13702,ref-bible.0103.27.8.11-ref-bible.0103.27.8.17,ref-t.5.5.2.15.28-ref-t.5.5.2.15.34,250393,250424,43123,43128,ref-bible.00103.00027.00008.00011,ref-bible.00103.00027.00008.00017,1185218,1185250,187315,187320,ref-t.00005.00005.00002.00015.00028,ref-t.00005.00005.00002.00015.00034,על פי אשר תשיג יד הנדר יעריכנו ,על פי אשר תשיג יד הנודר יעריכנו ,ref-t
13703,ref-bible.0103.27.8.18-ref-bible.0103.27.9.10,ref-t.2.4.3.4.52-ref-t.2.4.3.4.64,250425,250479,43129,43138,ref-bible.00103.00027.00008.00018,ref-bible.00103.00027.00009.00010,382544,382618,59747,59759,ref-t.00002.00004.00003.00004.00052,ref-t.00002.00004.00003.00004.00064,הכהן ואם בהמה אשר יקריבו ממנה קרבן ליהוה כל אשר יתן ,ממנו ומקריבין אותן לגבי מזבח ואין ניאותין בהן אבל מועלין בהן ואם הקריבן ,ref-t
13704,ref-bible.0103.27.16.10-ref-bible.0103.27.16.16,ref-t.4.3.4.12.18-ref-t.4.3.4.12.23,250978,251012,43230,43236,ref-bible.00103.00027.00016.00010,ref-bible.00103.00027.00016.00016,853477,853508,135153,135158,ref-t.00004.00003.00004.00012.00018,ref-t.00004.00003.00004.00012.00023,זרעו זרע חמר שערים בחמשים שקל כסף ,זרע חומר שעורים בחמשים שקל כסף ,ref-t
13705,ref-bible.0103.27.16.10-ref-bible.0103.27.16.16,ref-t.5.5.4.11.10-ref-t.5.5.4.11.16,250978,251012,43230,43236,ref-bible.00103.00027.00016.00010,ref-bible.00103.00027.00016.00016,1191317,1191352,188316,188322,ref-t.00005.00005.00004.00011.00010,ref-t.00005.00005.00004.00011.00016,זרעו זרע חמר שערים בחמשים שקל כסף ,בחמשים שקל כסף בית זרע חומר שעורים ,ref-t
13706,ref-bible.0103.27.19.14-ref-bible.0103.27.21.5,ref-t.5.5.5.5.28-ref-t.5.5.5.6.5,251211,251304,43273,43289,ref-bible.00103.00027.00019.00014,ref-bible.00103.00027.00021.00005,1197090,1197144,189249,189257,ref-t.00005.00005.00005.00005.00028,ref-t.00005.00005.00005.00006.00005,לו ואם לא יגאל את השדה ואם מכר את השדה לאיש אחר לא יגאל עוד והיה השדה בצאתו ביבל קדש ,ולא נגאלה חלוטה היא שדה להקדיש אין_אדם_רשיי למכור שדה ,ref-t
13707,ref-bible.0103.27.28.12-ref-bible.0103.27.29.7,ref-t.5.5.4.23.23-ref-t.5.5.4.24.14,251775,251868,43374,43391,ref-bible.00103.00027.00028.00012,ref-bible.00103.00027.00029.00007,1194166,1194262,188761,188775,ref-t.00005.00005.00004.00023.00023,ref-t.00005.00005.00004.00024.00014,ובהמה ומשדה אחזתו לא ימכר ולא יגאל כל חרם קדש_קדשים_הוא ליהוה כל חרם אשר יחרם מן האדם לא ,החרים את כולן הרי הן מוחרמין ר'_לעזר_או' מאדם ולא כל אדם מבהמה ולא כל בהמה משדה אחוזתו ולא ,ref-t
13708,ref-bible.0103.27.28.19-ref-bible.0103.27.29.8,ref-t.5.5.4.34.7-ref-t.5.5.4.34.31,251813,251873,43381,43392,ref-bible.00103.00027.00028.00019,ref-bible.00103.00027.00029.00008,1195892,1196006,189036,189060,ref-t.00005.00005.00004.00034.00007,ref-t.00005.00005.00004.00034.00031,כל חרם קדש_קדשים_הוא ליהוה כל חרם אשר יחרם מן האדם לא יפדה ,אשר יחרים איש לייי וגו' אילו חרמי כהנים כל חרם קדש קדשים הוא לייי אילו חירמי גבוה כל חרם אשר יחרם מן האדם לא יפדה ,ref-t
13709,ref-bible.0104.3.36.5-ref-bible.0104.3.36.9,ref-t.3.5.13.1.10-ref-t.3.5.13.1.13,259342,259378,44383,44387,ref-bible.00104.00003.00036.00005,ref-bible.00104.00003.00036.00009,672984,673015,106675,106678,ref-t.00003.00005.00013.00001.00010,ref-t.00003.00005.00013.00001.00013,קרשי המשכן ובריחיו ועמדיו ואדניו ,קרשיו ובריחיו ועמודיו ואדניו ,ref-t
13710,ref-bible.0104.4.19.12-ref-bible.0104.4.20.3,ref-t.3.7.5.6.33-ref-t.3.7.5.7.4,261888,261953,44779,44791,ref-bible.00104.00004.00019.00012,ref-bible.00104.00004.00020.00003,723455,723522,114587,114598,ref-t.00003.00007.00005.00006.00033,ref-t.00003.00007.00005.00007.00004,ובניו יבאו ושמו אותם איש איש על עבדתו ואל משאו ולא יבאו לראות ,מביא ראיה על הבנים ואין צריך להביא על האשה נאמנת אשה שתאמר אילו ,ref-t
13711,ref-bible.0104.4.31.8-ref-bible.0104.4.31.12,ref-t.3.5.13.1.10-ref-t.3.5.13.1.13,262717,262754,44903,44907,ref-bible.00104.00004.00031.00008,ref-bible.00104.00004.00031.00012,672984,673015,106675,106678,ref-t.00003.00005.00013.00001.00010,ref-t.00003.00005.00013.00001.00013,קרשי המשכן ובריחיו ועמודיו ואדניו ,קרשיו ובריחיו ועמודיו ואדניו ,ref-t
13712,ref-bible.0104.5.2.5-ref-bible.0104.5.2.14,ref-t.2.3.8.9.32-ref-t.2.3.8.9.41,263965,264013,45058,45067,ref-bible.00104.00005.00002.00005,ref-bible.00104.00005.00002.00014,364390,364439,56843,56852,ref-t.00002.00003.00008.00009.00032,ref-t.00002.00003.00008.00009.00041,וישלחו מן המחנה כל צרוע וכל זב וכל טמא לנפש ,וישלחו מן המחנה כל צרוע וכל זב בשעה שטמא נפש ,ref-t
13713,ref-bible.0104.5.8.12-ref-bible.0104.5.8.18,ref-t.4.1.10.18.31-ref-t.4.1.10.18.37,264435,264468,45127,45133,ref-bible.00104.00005.00008.00012,ref-bible.00104.00005.00008.00018,775860,775894,122713,122719,ref-t.00004.00001.00010.00018.00031,ref-t.00004.00001.00010.00018.00037,מלבד איל הכפרים אשר יכפר בו עליו ,מלבד איל הכפורים אשר יכפר בו עליו ,ref-t
13714,ref-bible.0104.5.9.8-ref-bible.0104.5.13.2,ref-t.5.1.11.8.50-ref-t.5.1.11.8.67,264504,264670,45139,45164,ref-bible.00104.00005.00009.00008,ref-bible.00104.00005.00013.00002,1057388,1057474,167289,167303,ref-t.00005.00001.00011.00008.00050,ref-t.00005.00001.00011.00008.00067,יקריבו לכהן לו יהיה ואיש את קדשיו לו יהיו איש אשר יתן לכהן לו יהיה וידבר יהוה_אל_משה_לאמר_דבר_אל_בני_ישראל_ואמרת_אלהם איש איש כי תשטה אשתו ומעלה בו מעל ושכב איש ,אשר הקריב לכהן לו יהיה אם_כן_למה_נאמ' עולת איש אלא עלה שעלת לאיש עורה לכהנים ושלא ,ref-t
13715,ref-bible.0104.5.15.15-ref-bible.0104.5.15.22,ref-t.3.5.1.10.13-ref-t.3.5.1.10.20,264919,264953,45208,45215,ref-bible.00104.00005.00015.00015,ref-bible.00104.00005.00015.00022,623155,623190,98109,98116,ref-t.00003.00005.00001.00010.00013,ref-t.00003.00005.00001.00010.00020,לא יצק עליו שמן ולא יתן עליו לבנה ,לא יצק עליה שמן ולא יתן עליה לבונה ,ref-t
13716,ref-bible.0104.5.27.15-ref-bible.0104.5.28.9,ref-t.3.5.1.4.36-ref-t.3.5.1.4.53,265998,266099,45393,45409,ref-bible.00104.00005.00027.00015,ref-bible.00104.00005.00028.00009,622078,622182,97926,97942,ref-t.00003.00005.00001.00004.00036,ref-t.00003.00005.00001.00004.00053,וצבתה בטנה ונפלה ירכה והיתה האשה לאלה בקרב עמה ואם לא נטמאה האשה וטהרה הוא ונקתה ונזרעה זרע ,וצבתה בטנה ונפלה יריכה ולהצדיק צדיק לתת לו כצדקתו ואם לא נטמאה האשה וטהורה היא ונקתה ונזרעה זרע ,ref-t
13717,ref-bible.0104.5.28.1-ref-bible.0104.5.28.9,ref-t.3.5.1.10.62-ref-t.3.5.1.10.70,266050,266099,45402,45409,ref-bible.00104.00005.00028.00001,ref-bible.00104.00005.00028.00009,623401,623451,98151,98158,ref-t.00003.00005.00001.00010.00062,ref-t.00003.00005.00001.00010.00070,ואם לא נטמאה האשה וטהרה הוא ונקתה ונזרעה זרע ,ואם לא נטמאה האשה וטהורה היא ונקתה ונזרעה זרע ,ref-t
13718,ref-bible.0104.8.8.9-ref-bible.0104.8.8.14,ref-t.6.6.1.1.48-ref-t.6.6.1.1.54,273849,273875,46234,46239,ref-bible.00104.00008.00008.00009,ref-bible.00104.00008.00008.00014,1399916,1399945,220370,220376,ref-t.00006.00006.00001.00001.00048,ref-t.00006.00006.00001.00001.00054,ופר שני בן בקר תקח לחטאת ,ופר שני פר בן בקר תקח לחטאת ,ref-t
13719,ref-bible.0104.8.8.9-ref-bible.0104.8.8.14,ref-t.6.6.1.2.5-ref-t.6.6.1.2.10,273849,273875,46234,46239,ref-bible.00104.00008.00008.00009,ref-bible.00104.00008.00008.00014,1400112,1400138,220406,220411,ref-t.00006.00006.00001.00002.00005,ref-t.00006.00006.00001.00002.00010,ופר שני בן בקר תקח לחטאת ,ופר שני בן בקר תקח לחטאת ,ref-t
13720,ref-bible.0104.8.8.9-ref-bible.0104.8.8.14,ref-t.6.6.1.2.32-ref-t.6.6.1.2.37,273849,273875,46234,46239,ref-bible.00104.00008.00008.00009,ref-bible.00104.00008.00008.00014,1400244,1400270,220432,220437,ref-t.00006.00006.00001.00002.00032,ref-t.00006.00006.00001.00002.00037,ופר שני בן בקר תקח לחטאת ,ופר שני בן בקר תקח לחטאת ,ref-t
13721,ref-bible.0104.8.8.9-ref-bible.0104.8.8.14,ref-t.6.6.1.2.39-ref-t.6.6.1.2.44,273849,273875,46234,46239,ref-bible.00104.00008.00008.00009,ref-bible.00104.00008.00008.00014,1400274,1400298,220439,220444,ref-t.00006.00006.00001.00002.00039,ref-t.00006.00006.00001.00002.00044,ופר שני בן בקר תקח לחטאת ,פר שני בן בקר תקח לחטאת ,ref-t
13722,ref-bible.0104.8.8.9-ref-bible.0104.8.8.14,ref-t.6.6.1.3.6-ref-t.6.6.1.3.11,273849,273875,46234,46239,ref-bible.00104.00008.00008.00009,ref-bible.00104.00008.00008.00014,1400500,1400526,220480,220485,ref-t.00006.00006.00001.00003.00006,ref-t.00006.00006.00001.00003.00011,ופר שני בן בקר תקח לחטאת ,ופר שני בן בקר תקח לחטאת ,ref-t
13723,ref-bible.0104.8.8.9-ref-bible.0104.8.8.14,ref-t.6.6.1.3.31-ref-t.6.6.1.3.36,273849,273875,46234,46239,ref-bible.00104.00008.00008.00009,ref-bible.00104.00008.00008.00014,1400613,1400639,220501,220506,ref-t.00006.00006.00001.00003.00031,ref-t.00006.00006.00001.00003.00036,ופר שני בן בקר תקח לחטאת ,ופר שני בן בקר תקח לחטאת ,ref-t
13724,ref-bible.0104.9.10.9-ref-bible.0104.9.10.17,ref-t.2.3.8.1.16-ref-t.2.3.8.1.27,275903,275947,46520,46528,ref-bible.00104.00009.00010.00009,ref-bible.00104.00009.00010.00017,362215,362267,56512,56520,ref-t.00002.00003.00008.00001.00016,ref-t.00002.00003.00008.00001.00027,יהיה טמא לנפש או בדרך רחקה לכם או לדרתיכם ,שהיה טמא או בדרך רחוקה אם_כן_למה_נאמ' טמא או בדרך ,ref-t
13725,ref-bible.0104.11.21.12-ref-bible.0104.11.22.4,ref-t.3.5.6.8.40-ref-t.3.5.6.8.50,280771,280824,47324,47334,ref-bible.00104.00011.00021.00012,ref-bible.00104.00011.00022.00004,645939,645997,102062,102072,ref-t.00003.00005.00006.00008.00040,ref-t.00003.00005.00006.00008.00050,אמרת בשר אתן להם ואכלו חדש ימים הצאן ובקר ישחט להם ,יאמרו בשר דגים וחגבים אנו מבקשין שנ' הצאן ובקר ישחט להם ,ref-t
13726,ref-bible.0104.11.22.1-ref-bible.0104.11.22.10,ref-t.3.5.6.7.4-ref-t.3.5.6.7.16,280804,280848,47331,47339,ref-bible.00104.00011.00022.00001,ref-bible.00104.00011.00022.00010,644730,644788,101839,101850,ref-t.00003.00005.00006.00007.00004,ref-t.00003.00005.00006.00007.00016,הצאן ובקר ישחט להם ומצא להם אם את כל דגי ,הצאן ובקר ישחט להם ומצ' להם וכי מספיק להם אם את כל דגי ,ref-t
13727,ref-bible.0104.11.23.8-ref-bible.0104.11.24.3,ref-t.3.5.6.8.54-ref-t.3.5.6.8.64,280907,280949,47349,47356,ref-bible.00104.00011.00023.00008,ref-bible.00104.00011.00024.00003,646015,646066,102076,102082,ref-t.00003.00005.00006.00008.00054,ref-t.00003.00005.00006.00008.00064,עתה תראה היקרך דברי אם לא ויצא משה וידבר ,עתה תראה היקרך דברי אם לא ורואה_אני_את_דברי מדברי ,ref-t
13728,ref-bible.0104.11.31.1-ref-bible.0104.11.31.14,ref-t.3.5.4.3.130-ref-t.3.5.4.3.161,281499,281567,47454,47467,ref-bible.00104.00011.00031.00001,ref-bible.00104.00011.00031.00014,633039,633189,99829,99848,ref-t.00003.00005.00004.00003.00130,ref-t.00003.00005.00004.00003.00161,ורוח נסע מאת יהוה ויגז שלוים מן הים ויטש על המחנה כדרך יום כה ,ורוח נסע מאת ייי ויגז שלוים מן הים וגו' שתי אמות היתה_גבוהה_מן_הארץ דברי_ר'_עקיבא_ר' לעזר בנו_של_ר'_יוסי_הגלילי_אומ' ויטש אל המחנה כדרך יום כה ,ref-t
13729,ref-bible.0104.13.28.1-ref-bible.0104.13.28.6,ref-t.3.5.9.2.53-ref-t.3.5.9.2.58,284379,284405,47964,47969,ref-bible.00104.00013.00028.00001,ref-bible.00104.00013.00028.00006,660972,660999,104592,104597,ref-t.00003.00005.00009.00002.00053,ref-t.00003.00005.00009.00002.00058,אפס כי עז העם הישב בארץ ,אפס כי עז העם היושב בארץ ,ref-t
13730,ref-bible.0104.14.18.6-ref-bible.0104.14.18.11,ref-t.2.5.4.13.15-ref-t.2.5.4.13.22,286187,286214,48271,48276,ref-bible.00104.00014.00018.00006,ref-bible.00104.00014.00018.00011,410754,410793,64319,64325,ref-t.00002.00005.00004.00013.00015,ref-t.00002.00005.00004.00013.00022,נשא עון ופשע ונקה לא ינקה ,נושא עון ופשע וחטאה ונקה עד כאן מנקה ,ref-t
