,baseOrig,compOrig,baseCharStart,baseCharEnd,baseWdStart,baseWdEnd,baseRefStart,baseRefEnd,compCharStart,compCharEnd,compWdStart,compWdEnd,compRefStart,compRefEnd,baseStr,compStr,compWork
14194,ref-bible.0301.33.2.1-ref-bible.0301.33.2.7,ref-t.5.5.2.7.28-ref-t.5.5.2.7.34,1171704,1171741,198633,198639,ref-bible.00301.00033.00002.00001,ref-bible.00301.00033.00002.00007,1183661,1183696,187048,187054,ref-t.00005.00005.00002.00007.00028,ref-t.00005.00005.00002.00007.00034,הודו ליהוה בכנור בנבל עשור זמרו לו ,הודו לייי בכנור בנבל עשור זמרו לו ,ref-t
14195,ref-bible.0301.34.8.1-ref-bible.0301.34.8.6,ref-t.1.1.6.25.41-ref-t.1.1.6.25.46,1172764,1172798,198829,198834,ref-bible.00301.00034.00008.00001,ref-bible.00301.00034.00008.00006,34400,34435,5628,5633,ref-t.00001.00001.00006.00025.00041,ref-t.00001.00001.00006.00025.00046,חנה מלאך יהוה סביב ליראיו ויחלצם ,חונה מלאך ייי סביב ליריאיו ויחלצם ,ref-t
14196,ref-bible.0301.35.10.1-ref-bible.0301.35.10.6,ref-t.1.1.6.7.48-ref-t.1.1.6.7.53,1173729,1173758,199010,199015,ref-bible.00301.00035.00010.00001,ref-bible.00301.00035.00010.00006,29614,29642,4834,4839,ref-t.00001.00001.00006.00007.00048,ref-t.00001.00001.00006.00007.00053,כל עצמותי תאמרנה יהוה מי כמוך ,כל עצמותי תאמרנה ייי מי כמוך ,ref-t
14197,ref-bible.0301.37.21.1-ref-bible.0301.37.21.7,ref-t.2.12.1.7.17-ref-t.2.12.1.7.23,1175894,1175930,199413,199419,ref-bible.00301.00037.00021.00001,ref-bible.00301.00037.00021.00007,496543,496577,77613,77619,ref-t.00002.00012.00001.00007.00017,ref-t.00002.00012.00001.00007.00023,לוה רשע ולא ישלם וצדיק חונן ונותן ,לוה רשע ולא ישלם צדיק חונן ונותן ,ref-t
14198,ref-bible.0301.38.3.2-ref-bible.0301.38.4.2,ref-t.5.6.3.7.32-ref-t.5.6.3.7.40,1176752,1176788,199567,199574,ref-bible.00301.00038.00003.00002,ref-bible.00301.00038.00004.00002,1210446,1210493,191263,191271,ref-t.00005.00006.00003.00007.00032,ref-t.00005.00006.00003.00007.00040,חציך נחתו בי ותנחת עלי ידך אין מתם ,חציה תחת חטאת וחציה תחת עולה הכל מודין שתמות ,ref-t
14199,ref-bible.0301.47.6.6-ref-bible.0301.47.9.4,ref-t.2.8.2.13.80-ref-t.2.8.2.13.97,1183456,1183545,200819,200836,ref-bible.00301.00047.00006.00006,ref-bible.00301.00047.00009.00004,455963,456047,71215,71230,ref-t.00002.00008.00002.00013.00080,ref-t.00002.00008.00002.00013.00097,שופר זמרו אלהים זמרו זמרו למלכנו זמרו כי מלך כל הארץ אלהים זמרו משכיל מלך אלהים על גוים ,שופר כגון זמרו לאלהים זמרו וגו' כי מלך על כל הארץ אלים זמרו משכיל מלך אלים על גוים ,ref-t
14200,ref-bible.0301.50.5.1-ref-bible.0301.50.6.2,ref-t.4.4.13.11.21-ref-t.4.4.13.11.38,1185229,1185274,201160,201168,ref-bible.00301.00050.00005.00001,ref-bible.00301.00050.00006.00002,927894,927977,147101,147116,ref-t.00004.00004.00013.00011.00021,ref-t.00004.00004.00013.00011.00038,אספו לי חסידי כרתי בריתי עלי זבח ויגידו שמים ,אספו לי חסידי על שם שעשו עמי גמילות חסדים כרתי בריתי על שום שנכרתו על ידי עלי זבח ,ref-t
14201,ref-bible.0301.50.8.1-ref-bible.0301.50.9.4,ref-t.5.3.7.9.32-ref-t.5.3.7.9.40,1185352,1185408,201184,201193,ref-bible.00301.00050.00008.00001,ref-bible.00301.00050.00009.00004,1123841,1123881,177322,177329,ref-t.00005.00003.00007.00009.00032,ref-t.00005.00003.00007.00009.00040,לא על זבחיך אוכיחך ועולתיך לנגדי תמיד לא אקח מביתך פר ,לא על זבחיך אוכיחך וגו' לא אקח מביתך פר ,ref-t
14202,ref-bible.0301.50.10.1-ref-bible.0301.50.12.5,ref-t.5.3.7.9.43-ref-t.5.3.7.9.58,1185426,1185511,201196,201214,ref-bible.00301.00050.00010.00001,ref-bible.00301.00050.00012.00005,1123891,1123955,177332,177347,ref-t.00005.00003.00007.00009.00043,ref-t.00005.00003.00007.00009.00058,כי לי כל חיתו יער בהמות בהררי אלף ידעתי כל עוף הרים וזיז שדי עמדי אם ארעב לא אמר לך ,אם ארעב לא אומר לך וגו' ידעתי כל עוף הרים וגו' כי לי כל חיתו יער ,ref-t
14203,ref-bible.0301.50.23.1-ref-bible.0301.50.23.6,ref-t.5.1.11.2.9-ref-t.5.1.11.2.14,1185931,1185962,201293,201298,ref-bible.00301.00050.00023.00001,ref-bible.00301.00050.00023.00006,1055963,1055995,167056,167061,ref-t.00005.00001.00011.00002.00009,ref-t.00005.00001.00011.00002.00014,זבח תודה יכבדנני ושם דרך אראנו ,זובח תודה יכבדנני ושם דרך אראנו ,ref-t
14204,ref-bible.0301.55.18.1-ref-bible.0301.55.18.5,ref-t.1.1.3.6.47-ref-t.1.1.3.6.51,1188660,1188690,201798,201802,ref-bible.00301.00055.00018.00001,ref-bible.00301.00055.00018.00005,10664,10694,1764,1768,ref-t.00001.00001.00003.00006.00047,ref-t.00001.00001.00003.00006.00051,ערב ובקר וצהרים אשיחה ואהמה ,ערב ובקר וצהרים אשיחה ואהמה ,ref-t
14205,ref-bible.0301.57.1.1-ref-bible.0301.57.1.5,ref-t.3.5.9.7.5-ref-t.3.5.9.7.9,1189628,1189653,201985,201989,ref-bible.00301.00057.00001.00001,ref-bible.00301.00057.00001.00005,662709,662734,104892,104896,ref-t.00003.00005.00009.00007.00005,ref-t.00003.00005.00009.00007.00009,למנצח אל תשחת לדוד מכתם ,למנצח אל תשחת לדוד מכתם ,ref-t
14206,ref-bible.0301.58.1.1-ref-bible.0301.58.2.3,ref-t.3.5.9.7.5-ref-t.3.5.9.7.12,1190172,1190212,202086,202093,ref-bible.00301.00058.00001.00001,ref-bible.00301.00058.00002.00003,662709,662749,104892,104899,ref-t.00003.00005.00009.00007.00005,ref-t.00003.00005.00009.00007.00012,למנצח אל תשחת לדוד מכתם האמנם אלם צדק ,למנצח אל תשחת לדוד מכתם האמנם אלם צדק ,ref-t
14207,ref-bible.0301.59.1.1-ref-bible.0301.59.1.5,ref-t.3.5.9.7.5-ref-t.3.5.9.7.9,1190679,1190704,202185,202189,ref-bible.00301.00059.00001.00001,ref-bible.00301.00059.00001.00005,662709,662734,104892,104896,ref-t.00003.00005.00009.00007.00005,ref-t.00003.00005.00009.00007.00009,למנצח אל תשחת לדוד מכתם ,למנצח אל תשחת לדוד מכתם ,ref-t
14208,ref-bible.0301.66.18.1-ref-bible.0301.66.19.2,ref-t.1.2.1.4.13-ref-t.1.2.1.4.24,1195284,1195323,203040,203048,ref-bible.00301.00066.00018.00001,ref-bible.00301.00066.00019.00002,34997,35048,5730,5738,ref-t.00001.00002.00001.00004.00013,ref-t.00001.00002.00001.00004.00024,און אם ראיתי בלבי לא ישמע אדני אכן שמע ,אם און ראיתי בלבי לא ישמע ייי הא מה_אני_מקיים שמעו ,ref-t
14209,ref-bible.0301.69.2.1-ref-bible.0301.69.3.5,ref-t.1.1.4.18.211-ref-t.1.1.4.18.222,1197383,1197443,203424,203435,ref-bible.00301.00069.00002.00001,ref-bible.00301.00069.00003.00005,20769,20828,3391,3402,ref-t.00001.00001.00004.00018.00211,ref-t.00001.00001.00004.00018.00222,הושיעני אלהים כי באו מים עד נפש טבעתי ביון מצולה ואין מעמד ,הושיעני אלים כי באו מים עד נפש טבעתי ביון מצולה ואין מעמד ,ref-t
14210,ref-bible.0301.69.32.1-ref-bible.0301.69.32.6,ref-t.5.2.3.20.39-ref-t.5.2.3.20.44,1198665,1198699,203662,203667,ref-bible.00301.00069.00032.00001,ref-bible.00301.00069.00032.00006,1081146,1081178,171057,171062,ref-t.00005.00002.00003.00020.00039,ref-t.00005.00002.00003.00020.00044,ותיטב ליהוה משור פר מקרן מפריס ,ותיטב לייי משור פר מקרין מפריס ,ref-t
14211,ref-bible.0301.69.32.1-ref-bible.0301.69.32.6,ref-t.5.2.3.21.28-ref-t.5.2.3.21.33,1198665,1198699,203662,203667,ref-bible.00301.00069.00032.00001,ref-bible.00301.00069.00032.00006,1081308,1081342,171082,171087,ref-t.00005.00002.00003.00021.00028,ref-t.00005.00002.00003.00021.00033,ותיטב ליהוה משור פר מקרן מפריס ,ותיטב לייי משור פר מקרין ומפריס ,ref-t
14212,ref-bible.0301.72.18.6-ref-bible.0301.72.19.3,ref-t.2.9.3.9.51-ref-t.2.9.3.9.56,1201041,1201072,204095,204100,ref-bible.00301.00072.00018.00006,ref-bible.00301.00072.00019.00003,471207,471239,73623,73628,ref-t.00002.00009.00003.00009.00051,ref-t.00002.00009.00003.00009.00056,עשה נפלאות לבדו וברוך שם כבודו ,עושה נפלאות לבדו וברוך שם כבודו ,ref-t
14213,ref-bible.0301.76.2.5-ref-bible.0301.76.3.5,ref-t.1.1.1.14.69-ref-t.1.1.1.15.7,1203652,1203692,204597,204603,ref-bible.00301.00076.00002.00005,ref-bible.00301.00076.00003.00005,4279,4329,710,717,ref-t.00001.00001.00001.00014.00069,ref-t.00001.00001.00001.00015.00007,גדול שמו ויהי בשלם סכו ומעונתו בציון ,לגדול' כיוצא בו ויהי בשלם סוכו ומעונתו בציון ,ref-t
14214,ref-bible.0301.78.36.1-ref-bible.0301.78.38.3,ref-t.4.1.7.9.43-ref-t.4.1.7.9.60,1206445,1206531,205105,205119,ref-bible.00301.00078.00036.00001,ref-bible.00301.00078.00038.00003,755558,755655,119596,119613,ref-t.00004.00001.00007.00009.00043,ref-t.00004.00001.00007.00009.00060,ויפתוהו בפיהם ובלשונם יכזבו לו ולבם לא נכון עמו ולא נאמנו בבריתו והוא רחום יכפר ,ויפתוהו בפיהם ובלשונם יכזבו לו לו ולבם לא נכון עמו ולא נאמנו בבריתו אע'פ כן והוא רחום יכפר ,ref-t
14215,ref-bible.0301.81.4.1-ref-bible.0301.81.5.4,ref-t.2.8.1.11.15-ref-t.2.8.1.11.23,1209482,1209532,205639,205648,ref-bible.00301.00081.00004.00001,ref-bible.00301.00081.00005.00004,448845,448889,70122,70130,ref-t.00002.00008.00001.00011.00015,ref-t.00002.00008.00001.00011.00023,תקעו בחדש שופר בכסה ליום חגנו כי חק לישראל הוא ,תקעו בחדש שופר וגו' ואו' כי חק לישראל הוא ,ref-t
14216,ref-bible.0301.82.1.4-ref-bible.0301.82.1.9,ref-t.4.4.1.9.51-ref-t.4.4.1.9.56,1210069,1210097,205741,205746,ref-bible.00301.00082.00001.00004,ref-bible.00301.00082.00001.00009,882832,882860,139933,139938,ref-t.00004.00004.00001.00009.00051,ref-t.00004.00004.00001.00009.00056,נצב בעדת אל בקרב אלהים ישפט ,נצב בעדת אל בקרב אלים ישפוט ,ref-t
14217,ref-bible.0301.85.12.1-ref-bible.0301.85.12.6,ref-t.1.8.5.25.10-ref-t.1.8.5.25.15,1212054,1212086,206116,206121,ref-bible.00301.00085.00012.00001,ref-bible.00301.00085.00012.00006,214844,214876,33841,33846,ref-t.00001.00008.00005.00025.00010,ref-t.00001.00008.00005.00025.00015,אמת מארץ תצמח וצדק משמים נשקף ,אמת מארץ תצמח וצדק משמים נשקף ,ref-t
14218,ref-bible.0301.90.17.1-ref-bible.0301.90.17.9,ref-t.5.3.7.8.57-ref-t.5.3.7.8.66,1216684,1216736,206976,206984,ref-bible.00301.00090.00017.00001,ref-bible.00301.00090.00017.00009,1123611,1123661,177283,177292,ref-t.00005.00003.00007.00008.00057,ref-t.00005.00003.00007.00008.00066,ויהי נעם אדני אלהינו עלינו ומעשה ידינו כוננה עלינו ,על מעשה ידיכם והן אומ' ויהי נועם ייי אלינו עלינו ,ref-t
14219,ref-bible.0301.104.15.1-ref-bible.0301.104.15.7,ref-t.2.3.10.4.11-ref-t.2.3.10.4.20,1224635,1224672,208435,208441,ref-bible.00301.00104.00015.00001,ref-bible.00301.00104.00015.00007,371432,371480,57968,57975,ref-t.00002.00003.00010.00004.00011,ref-t.00002.00003.00010.00004.00020,ויין ישמח לבב אנוש להצהיל פנים משמן ,ביין דכת' ויין ישמח לבב אנוש ר'_יהודה_או' נשים ,ref-t
14220,ref-bible.0301.106.6.1-ref-bible.0301.106.6.5,ref-t.2.5.2.1.103-ref-t.2.5.2.1.107,1227244,1227274,208908,208912,ref-bible.00301.00106.00006.00001,ref-bible.00301.00106.00006.00005,393603,393635,61555,61559,ref-t.00002.00005.00002.00001.00103,ref-t.00002.00005.00002.00001.00107,חטאנו עם אבותינו העוינו הרשענו ,חטאנו עם אבותינו העוינו והרשענו ,ref-t
14221,ref-bible.0301.122.2.1-ref-bible.0301.122.2.5,ref-t.3.5.11.13.7-ref-t.3.5.11.13.11,1242744,1242775,211705,211709,ref-bible.00301.00122.00002.00001,ref-bible.00301.00122.00002.00005,669391,669423,106044,106048,ref-t.00003.00005.00011.00013.00007,ref-t.00003.00005.00011.00013.00011,עמדות היו רגלינו בשעריך ירושלם ,עומדות היו רגלינו בשעריך ירושלם ,ref-t
14222,ref-bible.0301.127.1.1-ref-bible.0301.127.1.8,ref-t.2.5.1.9.18-ref-t.2.5.1.9.25,1244107,1244145,211946,211953,ref-bible.00301.00127.00001.00001,ref-bible.00301.00127.00001.00008,389557,389594,60885,60892,ref-t.00002.00005.00001.00009.00018,ref-t.00002.00005.00001.00009.00025,שיר המעלות לשלמה אם יהוה לא יבנה בית ,שיר המעלות לשלמה אם ייי לא יבנה בית ,ref-t
14223,ref-bible.0301.132.12.10-ref-bible.0301.132.14.8,ref-t.5.1.13.20.49-ref-t.5.1.13.20.64,1245843,1245930,212264,212283,ref-bible.00301.00132.00012.00010,ref-bible.00301.00132.00014.00008,1067543,1067618,168840,168855,ref-t.00005.00001.00013.00020.00049,ref-t.00005.00001.00013.00020.00064,עדי עד ישבו לכסא לך כי בחר יהוה בציון אוה למושב לו זאת מנוחתי עדי עד פה אשב כי אותיה ,בחר ייי בציון אוה למושב לו וגו' ואו' זאת מנוחתי עדי עד פה אשב כי איויתיה ,ref-t
14224,ref-bible.0301.135.19.1-ref-bible.0301.135.20.6,ref-t.4.9.2.13.12-ref-t.4.9.2.13.27,1247112,1247184,212499,212507,ref-bible.00301.00135.00019.00001,ref-bible.00301.00135.00020.00006,1012831,1012900,160678,160689,ref-t.00004.00009.00002.00013.00012,ref-t.00004.00009.00002.00013.00027,בית ישראל ברכו_את_יהוה בית אהרן ברכו_את_יהוה בית הלוי ברכו_את_יהוה יראי ,בית ישראל ברכו את ייי בית אהרן ברכו את ייי בית הלוי ברכו את ייי יראי ,ref-t
14225,ref-bible.0301.137.5.1-ref-bible.0301.137.6.6,ref-t.3.5.15.14.10-ref-t.3.5.15.14.20,1248304,1248360,212659,212668,ref-bible.00301.00137.00005.00001,ref-bible.00301.00137.00006.00006,682959,683015,108338,108347,ref-t.00003.00005.00015.00014.00010,ref-t.00003.00005.00015.00014.00020,אם אשכחך ירושלם תשכח ימיני תדבק לשוני לחכי אם לא אזכרכי ,אם אשכחך ירושלם תשכח ימיני תדבק לשוני לחכי אם לא אזכרכי ,ref-t
14226,ref-bible.0301.137.7.1-ref-bible.0301.137.7.13,ref-t.1.1.1.15.87-ref-t.1.1.1.15.103,1248395,1248457,212675,212686,ref-bible.00301.00137.00007.00001,ref-bible.00301.00137.00007.00013,4731,4822,793,808,ref-t.00001.00001.00001.00015.00087,ref-t.00001.00001.00001.00015.00103,זכר יהוה לבני אדום את יום ירושלם האמרים ערו ערו עד היסוד בה ,זכור ייי לבני אדום את יום ירושלם אימתי כשיעקרו יסודותיה ממנה האמרים ערו ערו עד היסוד בה ,ref-t
14227,ref-bible.0301.139.21.1-ref-bible.0301.139.22.3,ref-t.2.1.13.5.106-ref-t.2.1.13.5.113,1249699,1249757,212927,212935,ref-bible.00301.00139.00021.00001,ref-bible.00301.00139.00022.00003,273218,273261,42732,42739,ref-t.00002.00001.00013.00005.00106,ref-t.00002.00001.00013.00005.00113,הלוא משנאיך יהוה אשנא ובתקוממיך אתקוטט תכלית שנאה שנאתים ,הלא משנאיך ייי אשנא וגו' תכלית שנאה שנאתים ,ref-t
14228,ref-bible.0302.3.4.1-ref-bible.0302.3.4.7,ref-t.2.4.2.2.46-ref-t.2.4.2.2.52,1258072,1258109,214442,214448,ref-bible.00302.00003.00004.00001,ref-bible.00302.00003.00004.00007,376870,376906,58823,58829,ref-t.00002.00004.00002.00002.00046,ref-t.00002.00004.00002.00002.00052,ומצא חן ושכל טוב בעיני אלהים ואדם ,ומצא חן ושכל טוב בעיני אלים ואדם ,ref-t
14229,ref-bible.0302.5.8.1-ref-bible.0302.5.8.8,ref-t.5.2.2.24.136-ref-t.5.2.2.24.143,1260553,1260590,214915,214922,ref-bible.00302.00005.00008.00001,ref-bible.00302.00005.00008.00008,1076405,1076442,170293,170300,ref-t.00005.00002.00002.00024.00136,ref-t.00005.00002.00002.00024.00143,הרחק מעליה דרכך ואל תקרב אל פתח ביתה ,הרחק מעליה דרכך ואל תקרב אל פתח ביתה ,ref-t
14230,ref-bible.0302.6.26.1-ref-bible.0302.6.26.7,ref-t.3.5.1.2.99-ref-t.3.5.1.2.105,1262116,1262142,215212,215218,ref-bible.00302.00006.00026.00001,ref-bible.00302.00006.00026.00007,621452,621478,97824,97830,ref-t.00003.00005.00001.00002.00099,ref-t.00003.00005.00001.00002.00105,כי בעד אשה זונה עד ככר לחם ,כי בעד אשה זונה עד ככר לחם ,ref-t
14231,ref-bible.0302.7.13.7-ref-bible.0302.7.14.6,ref-t.5.3.7.9.92-ref-t.5.3.7.9.103,1262972,1263013,215381,215388,ref-bible.00302.00007.00013.00007,ref-bible.00302.00007.00014.00006,1124120,1124185,177379,177390,ref-t.00005.00003.00007.00009.00092,ref-t.00005.00003.00007.00009.00103,ותאמר לו זבחי שלמים עלי היום שלמתי נדרי ,שאמרתי לך זבח לאלים תודה אלא שתהא מודה בי ותשלם לעליון נדריך ,ref-t
14232,ref-bible.0302.9.1.1-ref-bible.0302.9.1.6,ref-t.4.4.8.9.27-ref-t.4.4.8.9.33,1264881,1264913,215737,215742,ref-bible.00302.00009.00001.00001,ref-bible.00302.00009.00001.00006,911037,911074,144454,144460,ref-t.00004.00004.00008.00009.00027,ref-t.00004.00004.00008.00009.00033,חכמות בנתה ביתה חצבה עמודיה שבעה ,חכמות נשים בנתה ביתה חצבה עמודיה שבעה ,ref-t
14233,ref-bible.0302.9.1.1-ref-bible.0302.9.2.4,ref-t.4.4.8.9.47-ref-t.4.4.8.9.58,1264881,1264933,215737,215746,ref-bible.00302.00009.00001.00001,ref-bible.00302.00009.00002.00004,911142,911206,144473,144484,ref-t.00004.00004.00008.00009.00047,ref-t.00004.00004.00008.00009.00058,חכמות בנתה ביתה חצבה עמודיה שבעה טבחה טבחה מסכה יינה ,בחכמה חצבה עמודיה שבעה אלו שבע' ימי בראשית טבחה טבחה מסכה יינה ,ref-t
14234,ref-bible.0302.10.7.1-ref-bible.0302.10.7.6,ref-t.2.5.2.8.90-ref-t.2.5.2.8.98,1265747,1265778,215909,215914,ref-bible.00302.00010.00007.00001,ref-bible.00302.00010.00007.00006,397821,397867,62267,62275,ref-t.00002.00005.00002.00008.00090,ref-t.00002.00005.00002.00008.00098,זכר צדיק לברכה ושם רשעים ירקב ,זכר צדיק לברכה ועל אילו נאמ' ושם רשעים ירקב ,ref-t
14235,ref-bible.0302.10.7.1-ref-bible.0302.10.7.6,ref-t.2.9.3.8.85-ref-t.2.9.3.8.97,1265747,1265778,215909,215914,ref-bible.00302.00010.00007.00001,ref-bible.00302.00010.00007.00006,470857,470923,73567,73578,ref-t.00002.00009.00003.00008.00085,ref-t.00002.00009.00003.00008.00097,זכר צדיק לברכה ושם רשעים ירקב ,זכר צדיק לברכה ועל ירבעם בן נבט וחביריו הוא או' ושם רשעים ירקב ,ref-t
14236,ref-bible.0302.11.30.1-ref-bible.0302.11.30.6,ref-t.1.2.4.18.89-ref-t.1.2.4.18.94,1267812,1267840,216304,216309,ref-bible.00302.00011.00030.00001,ref-bible.00302.00011.00030.00006,49959,49987,8156,8161,ref-t.00001.00002.00004.00018.00089,ref-t.00001.00002.00004.00018.00094,פרי צדיק עץ חיים ולקח נפשות ,פרי צדיק עץ חיים ולוקח נפש' ,ref-t
14237,ref-bible.0302.16.2.1-ref-bible.0302.16.2.6,ref-t.3.1.1.11.17-ref-t.3.1.1.11.22,1272440,1272468,217206,217211,ref-bible.00302.00016.00002.00001,ref-bible.00302.00016.00002.00006,510773,510800,79851,79856,ref-t.00003.00001.00001.00011.00017,ref-t.00003.00001.00001.00011.00022,כל דרכי איש זך בעיניו ותכן ,כל דרך איש זך בעיניו ותכן ,ref-t
14238,ref-bible.0302.17.28.1-ref-bible.0302.17.28.8,ref-t.2.3.9.2.28-ref-t.2.3.9.2.40,1274747,1274784,217665,217672,ref-bible.00302.00017.00028.00001,ref-bible.00302.00017.00028.00008,367470,367534,57377,57387,ref-t.00002.00003.00009.00002.00028,ref-t.00002.00003.00009.00002.00040,גם אויל מחריש חכם יחשב אטם שפתיו נבון ,גם אויל מחריש חכם ייחשב ואין_צריך_לומ' חכם מחריש אטם שפתיו נבון ,ref-t
14239,ref-bible.0302.19.14.1-ref-bible.0302.19.14.7,ref-t.4.2.3.25.144-ref-t.4.2.3.25.150,1276219,1276256,217959,217965,ref-bible.00302.00019.00014.00001,ref-bible.00302.00019.00014.00007,799333,799369,126526,126532,ref-t.00004.00002.00003.00025.00144,ref-t.00004.00002.00003.00025.00150,בית והון נחלת אבות ומיהוה אשה משכלת ,בית והון נחלת אבות ומייי אשה משכלת ,ref-t
14240,ref-bible.0302.21.2.1-ref-bible.0302.21.2.7,ref-t.3.1.1.11.17-ref-t.3.1.1.11.23,1278017,1278050,218320,218326,ref-bible.00302.00021.00002.00001,ref-bible.00302.00021.00002.00007,510773,510805,79851,79857,ref-t.00003.00001.00001.00011.00017,ref-t.00003.00001.00001.00011.00023,כל דרך איש ישר בעיניו ותכן לבות ,כל דרך איש זך בעיניו ותכן לבות ,ref-t
14241,ref-bible.0302.23.10.1-ref-bible.0302.23.10.8,ref-t.6.7.2.7.10-ref-t.6.7.2.7.17,1280688,1280725,218844,218851,ref-bible.00302.00023.00010.00001,ref-bible.00302.00023.00010.00008,1433434,1433472,225646,225653,ref-t.00006.00007.00002.00007.00010,ref-t.00006.00007.00002.00007.00017,אל תסג גבול עולם ובשדי יתומים אל תבא ,אל תסג גבול עולם ובשדה יתומים אל תבוא ,ref-t
14242,ref-bible.0302.23.26.1-ref-bible.0302.23.26.8,ref-t.2.8.2.7.69-ref-t.2.8.2.7.75,1281282,1281321,218960,218967,ref-bible.00302.00023.00026.00001,ref-bible.00302.00023.00026.00008,453747,453781,70902,70908,ref-t.00002.00008.00002.00007.00069,ref-t.00002.00008.00002.00007.00075,תנה בני לבך לי ועיניך דרכי תרצנה תצרנה ,תנה בני לבך לי ועיניך דרכי תצורנה ,ref-t
14243,ref-bible.0302.24.26.1-ref-bible.0302.24.26.5,ref-t.4.3.9.11.54-ref-t.4.3.9.11.58,1282725,1282751,219238,219242,ref-bible.00302.00024.00026.00001,ref-bible.00302.00024.00026.00005,871652,871679,138069,138073,ref-t.00004.00003.00009.00011.00054,ref-t.00004.00003.00009.00011.00058,שפתים ישק משיב דברים נכחים ,שפתים ישק משיב דברים נכוחים ,ref-t
14244,ref-bible.0302.24.27.4-ref-bible.0302.24.27.9,ref-t.3.5.7.20.130-ref-t.3.5.7.21.14,1282769,1282800,219246,219251,ref-bible.00302.00024.00027.00004,ref-bible.00302.00024.00027.00009,653821,653899,103407,103420,ref-t.00003.00005.00007.00020.00130,ref-t.00003.00005.00007.00021.00014,ועתדה בשדה לך אחר ובנית ביתך ,ביתך זו אשה דבר אחר הכן_בחוץ_מלאכתך זו מקרא ועתדה בשדה לך זו משנה אחר ובנית ,ref-t
14245,ref-bible.0302.24.27.4-ref-bible.0302.24.28.1,ref-t.3.5.7.21.32-ref-t.3.5.7.21.48,1282769,1282803,219246,219252,ref-bible.00302.00024.00027.00004,ref-bible.00302.00024.00028.00001,653974,654060,103435,103448,ref-t.00003.00005.00007.00021.00032,ref-t.00003.00005.00007.00021.00048,ועתדה בשדה לך אחר ובנית ביתך אל ,ובנית ביתיך אילו הלכות דבר אחר הכן_בחוץ_מלאכתך זה מדרש ועתדה בשדה לך אילו הלכות אחר ,ref-t
14246,ref-bible.0302.24.27.4-ref-bible.0302.24.28.1,ref-t.3.5.7.21.51-ref-t.3.5.7.21.67,1282769,1282803,219246,219252,ref-bible.00302.00024.00027.00004,ref-bible.00302.00024.00028.00001,654073,654162,103451,103464,ref-t.00003.00005.00007.00021.00051,ref-t.00003.00005.00007.00021.00067,ועתדה בשדה לך אחר ובנית ביתך אל ,אילו הגדות דבר אחר הכן_בחוץ_מלאכתך אילו הלכות ועתדה בשדה לך אילו אגדות אחר ובנית ביתיך ,ref-t
14247,ref-bible.0302.24.27.4-ref-bible.0302.24.27.9,ref-t.3.5.7.21.83-ref-t.3.5.7.21.91,1282769,1282800,219246,219251,ref-bible.00302.00024.00027.00004,ref-bible.00302.00024.00027.00009,654234,654279,103473,103481,ref-t.00003.00005.00007.00021.00083,ref-t.00003.00005.00007.00021.00091,ועתדה בשדה לך אחר ובנית ביתך ,ועתדה בשדה לך זה מעשה הטוב אחר ובנית ביתך ,ref-t
14248,ref-bible.0302.26.18.1-ref-bible.0302.26.19.3,ref-t.3.5.6.5.225-ref-t.3.5.6.5.231,1284903,1284943,219675,219682,ref-bible.00302.00026.00018.00001,ref-bible.00302.00026.00019.00003,644175,644214,101747,101753,ref-t.00003.00005.00006.00005.00225,ref-t.00003.00005.00006.00005.00231,כמתלהלה הירה זקים חצים ומות כן איש רמה ,כמתלהלה היורה זיקים וגומר כן איש רמה ,ref-t
14249,ref-bible.0302.26.23.1-ref-bible.0302.26.23.9,ref-t.4.1.7.9.63-ref-t.4.1.7.9.71,1285106,1285147,219712,219720,ref-bible.00302.00026.00023.00001,ref-bible.00302.00026.00023.00009,755667,755710,119616,119624,ref-t.00004.00001.00007.00009.00063,ref-t.00004.00001.00007.00009.00071,כסף סיגים מצפה על חרש שפתים דלקים ולב רע ,כסף סיגים מצופה על חרש שפתים דולקים ולב רע ,ref-t
14250,ref-bible.0302.28.17.1-ref-bible.0302.28.17.6,ref-t.2.5.4.11.20-ref-t.2.5.4.11.25,1287137,1287160,220104,220109,ref-bible.00302.00028.00017.00001,ref-bible.00302.00028.00017.00006,410401,410425,64257,64262,ref-t.00002.00005.00004.00011.00020,ref-t.00002.00005.00004.00011.00025,אדם עשק בדם נפש עד בור ,אדם עשוק בדם נפש עד בור ,ref-t
14251,ref-bible.0302.29.24.1-ref-bible.0302.29.24.9,ref-t.4.1.7.13.77-ref-t.4.1.7.13.85,1288516,1288556,220372,220380,ref-bible.00302.00029.00024.00001,ref-bible.00302.00029.00024.00009,756628,756668,119768,119776,ref-t.00004.00001.00007.00013.00077,ref-t.00004.00001.00007.00013.00085,חולק עם גנב שונא נפשו אלה ישמע ולא יגיד ,חולק עם גנב שונא נפשו אלה ישמע ולא יגיד ,ref-t
