,baseOrig,compOrig,baseCharStart,baseCharEnd,baseWdStart,baseWdEnd,baseRefStart,baseRefEnd,compCharStart,compCharEnd,compWdStart,compWdEnd,compRefStart,compRefEnd,baseStr,compStr,bRange,cRange,baseOrder,compOrder,lev,jac,lcsseq
1151,ref-bible.0208.10.16.1-ref-bible.0208.10.16.11,ref-sifre-d.312.2.8-ref-sifre-d.312.2.18,887597,887649,150820,150830,ref-bible.208.10.16.1,ref-bible.208.10.16.11,319963,320015,53504,53514,ref-sifre-d.312.2.8,ref-sifre-d.312.2.18,לא כאלה חלק יעקב כי יוצר הכל הוא וישראל שבט נחלתו ,לא כאלה חלק יעקב כי יוצר הכל הוא וישראל שבט נחלתו ,11,11,1151,1196,0.0,0.0,0.0
1152,ref-bible.0208.11.5.1-ref-bible.0208.11.5.10,ref-sifre-d.320.6.97-ref-sifre-d.320.6.107,888585,888652,150980,150988,ref-bible.208.11.5.1,ref-bible.208.11.5.10,331899,331967,55577,55586,ref-sifre-d.320.6.97,ref-sifre-d.320.6.107,למען הקים את השבועה אשר נשבעתי לאבותיכם לתת להם ארץ זבת חלב ודבש כ,למען הקים את השבועה אשר נשבע ה' לאבותיכם לתת לנו ארץ זבת חלב ודבש ו,14,15,1152,1263,0.08955223880597014,0.12676056338028174,0.08955223880597014
1153,ref-bible.0208.11.13.1-ref-bible.0208.11.13.6,ref-sifre-d.321.12.10-ref-sifre-d.321.12.15,889374,889402,151086,151091,ref-bible.208.11.13.1,ref-bible.208.11.13.6,333949,333977,55935,55940,ref-sifre-d.321.12.10,ref-sifre-d.321.12.15,כי מספר עריך היו אלהיך יהודה ,כי מספר עריך היו אלהיך יהודה ,6,6,1153,1279,0.0,0.0,0.0
1154,ref-bible.0208.12.6.20-ref-bible.0208.12.7.6,ref-sifre-d.318.8.20-ref-sifre-d.318.8.26,890753,890792,151340,151345,ref-bible.208.12.6.20,ref-bible.208.12.7.6,328663,328695,55024,55028,ref-sifre-d.318.8.20,ref-sifre-d.318.8.26,אליך טובות עזבתי את ביתי נטשתי את נחלתי ,לכם עזבתי את ביתי נטשתי את נחלתי ,8,7,1154,1240,0.225,0.26190476190476186,0.225
1155,ref-bible.0208.14.16.1-ref-bible.0208.14.16.8,ref-sifre-d.321.4.5-ref-sifre-d.321.4.16,894735,894777,152007,152014,ref-bible.208.14.16.1,ref-bible.208.14.16.8,333155,333226,55798,55807,ref-sifre-d.321.4.5,ref-sifre-d.321.4.16,והעם אשר המה נבאים להם יהיו משלכים בחצות ,שיהיו מאווים ברעב ומושלכים בחוצות וכן הוא אומר והעם אשר המה נבאים ,8,12,1155,1274,0.7727272727272727,0.4029850746268657,0.6666666666666666
1157,ref-bible.0208.14.18.1-ref-bible.0208.14.18.12,ref-sifre-d.321.10.19-ref-sifre-d.321.10.30,894978,895040,152049,152060,ref-bible.208.14.18.1,ref-bible.208.14.18.12,333670,333732,55886,55897,ref-sifre-d.321.10.19,ref-sifre-d.321.10.30,אם יצאתי השדה והנה חללי חרב ואם באתי העיר והנה תחלואי רעב ,אם יצאתי השדה והנה חללי חרב ואם באתי העיר והנה תחלואי רעב ,12,12,1157,1276,0.0,0.0,0.0
1158,ref-bible.0208.14.21.1-ref-bible.0208.14.21.8,ref-sifre-d.318.10.15-ref-sifre-d.318.10.22,895233,895267,152097,152104,ref-bible.208.14.21.1,ref-bible.208.14.21.8,328908,328944,55066,55073,ref-sifre-d.318.10.15,ref-sifre-d.318.10.22,אל תנאץ למען שמך אל תנבל כסא כבודך ,אל תנאץ למען שמך ואל תנבל כסא כבודך ,8,8,1158,1241,0.027777777777777776,0.02777777777777779,0.027777777777777776
1159,ref-bible.0208.14.22.14-ref-bible.0208.15.1.9,ref-sifre-d.26.9.6-ref-sifre-d.26.9.15,895365,895441,152123,152135,ref-bible.208.14.22.14,ref-bible.208.15.1.9,29577,29622,4982,4991,ref-sifre-d.26.9.6,ref-sifre-d.26.9.15,ונקוה לך כי אתה עשית את כל אלה ויאמר יהוה אלי אם יעמד משה ושמואל לפני אין ,משה לפני המקום הודיעני אם אתה עושה לי או אין ,17,10,1159,133,0.6756756756756757,0.41333333333333333,0.6216216216216216
1160,ref-bible.0208.15.2.1-ref-bible.0208.15.2.23,ref-sifre-d.43.29.45-ref-sifre-d.43.29.64,895477,895597,152142,152160,ref-bible.208.15.2.1,ref-bible.208.15.2.23,83785,83886,14095,14112,ref-sifre-d.43.29.45,ref-sifre-d.43.29.64,והיה כי יאמרו אליך אנה נצא ואמרת אליהם כה אמר יהוה אשר למות למות ואשר לחרב לחרב ואשר לרעב לרעב ואשר לשבי לשבי ,והיה כי יאמר אליך אנה נצא ואמרת כה אמר ה' אלהים אשר לחרב לחרב ואשר לרעב לרעב ואשר לשבי לשבי ,23,20,1160,346,0.2,0.18018018018018023,0.2
1161,ref-bible.0208.16.9.15-ref-bible.0208.16.10.1,ref-sifre-d.342.2.187-ref-sifre-d.342.2.196,897768,897811,152540,152548,ref-bible.208.16.9.15,ref-bible.208.16.10.1,353174,353223,59239,59248,ref-sifre-d.342.2.187,ref-sifre-d.342.2.196,קול ששון וקול שמחה קול חתן וקול כלה והיה ,קול ששון קול שמחה קול חתן וקול כלה כילחרבה תהיה ,9,10,1161,1386,0.20833333333333334,0.21999999999999997,0.1875
1162,ref-bible.0208.16.18.1-ref-bible.0208.16.18.5,ref-sifre-d.325.2.28-ref-sifre-d.325.2.33,898656,898688,152680,152684,ref-bible.208.16.18.1,ref-bible.208.16.18.5,340324,340364,57051,57056,ref-sifre-d.325.2.28,ref-sifre-d.325.2.33,ושלמתי ראשונה משנה עונם וחטאתם ,ושלמתי ראשונה ושנייה משנה עונם וחטאתם ,5,6,1162,1312,0.18421052631578946,0.1842105263157895,0.18421052631578946
1163,ref-bible.0208.17.2.5-ref-bible.0208.17.3.1,ref-sifre-d.60.4.15-ref-sifre-d.60.4.26,899064,899096,152750,152756,ref-bible.208.17.2.5,ref-bible.208.17.3.1,107037,107100,17935,17946,ref-sifre-d.60.4.15,ref-sifre-d.60.4.26,על עץ רענן על גבעות הגבהות הררי ,על ההרים הרמים ועל הגבעות ותחת כל עץ רענן אלהיהם על ההרים ,7,12,1163,472,0.6379310344827587,0.5,0.6206896551724138
1164,ref-bible.0208.17.12.1-ref-bible.0208.17.13.4,ref-sifre-d.37.5.47-ref-sifre-d.37.5.56,899754,899806,152879,152888,ref-bible.208.17.12.1,ref-bible.208.17.13.4,54184,54239,9090,9099,ref-sifre-d.37.5.47,ref-sifre-d.37.5.56,כסא כבוד מרום מראשון מקום מקדשנו מקוה ישראל יהוה כל ,"כסא כבוד מרום מראשון מקום מקדשנו א""י שהיתה חביבה מכל ",10,10,1164,211,0.2641509433962264,0.18965517241379315,0.20754716981132076
1165,ref-bible.0208.19.5.13-ref-bible.0208.19.5.19,ref-sifre-d.148.12.3-ref-sifre-d.148.14.4,903296,903329,153464,153470,ref-bible.208.19.5.13,ref-bible.208.19.5.19,179043,179107,29883,29893,ref-sifre-d.148.12.3,ref-sifre-d.148.14.4,צויתי ולא דברתי ולא עלתה על לבי ,צויתי בתורה ולא דברתי בעשרת הדברות לנביאים ולא עלתה על לבי ,7,11,1165,730,0.4576271186440678,0.4576271186440678,0.4576271186440678
1166,ref-bible.0208.22.10.1-ref-bible.0208.22.10.17,ref-sifre-d.43.29.90-ref-sifre-d.43.29.106,907922,907995,154220,154234,ref-bible.208.22.10.1,ref-bible.208.22.10.17,84026,84102,14136,14150,ref-sifre-d.43.29.90,ref-sifre-d.43.29.106,אל תבכו למת ואל תנדו לו בכו בכו להלך כי לא ישוב עוד וראה את ארץ מולדתו ,אל תבכו למת ואל תנודו לו בכו בכה להולך כי לא ישוב עוד וראה את ארץ מולדתו ,17,17,1166,350,0.0410958904109589,0.0273972602739726,0.0410958904109589
1167,ref-bible.0208.22.19.1-ref-bible.0208.22.19.7,ref-sifre-d.43.29.114-ref-sifre-d.43.29.120,908625,908666,154347,154353,ref-bible.208.22.19.1,ref-bible.208.22.19.7,84135,84176,14158,14164,ref-sifre-d.43.29.114,ref-sifre-d.43.29.120,קבורת חמור יקבר סחוב והשלך מהלאה לשערי ,קבורת חמור יקבר סחוב והשלך מהלאה לשערי ,7,7,1167,351,0.0,0.0,0.0
1168,ref-bible.0208.23.27.15-ref-bible.0208.23.28.11,ref-sifre-d.177.1.88-ref-sifre-d.178.1.9,911608,911672,154844,154856,ref-bible.208.23.27.15,ref-bible.208.23.28.11,194923,194991,32526,32539,ref-sifre-d.177.1.88,ref-sifre-d.178.1.9,שמי בבעל הנביא אשר אתו חלום יספר חלום ואשר דברי אתו ידבר דברי ,אשר יזיד לדבר דבר בשמי אך הנביא אשר יזיד לדבר דבר בשמי ואשר ידבר ,13,14,1168,789,0.676923076923077,0.3924050632911392,0.49230769230769234
1169,ref-bible.0208.25.10.3-ref-bible.0208.25.10.10,ref-sifre-d.342.2.187-ref-sifre-d.342.2.194,914493,914530,155290,155297,ref-bible.208.25.10.3,ref-bible.208.25.10.10,353174,353209,59239,59246,ref-sifre-d.342.2.187,ref-sifre-d.342.2.194,קול ששון וקול שמחה קול חתן וקול כלה ,קול ששון קול שמחה קול חתן וקול כלה ,8,8,1169,1384,0.027777777777777776,0.02777777777777779,0.027777777777777776
1170,ref-bible.0208.26.18.20-ref-bible.0208.26.18.29,ref-sifre-d.43.13.120-ref-sifre-d.43.13.129,918409,918464,155901,155910,ref-bible.208.26.18.20,ref-bible.208.26.18.29,79650,79704,13387,13396,ref-sifre-d.43.13.120,ref-sifre-d.43.13.129,ציון שדה תחרש וירושלים עיים תהיה והר הבית לבמות יער ,ציון שדה תחרש וירושלם עיין תהיה והר הבית לבמות יער ,10,10,1170,326,0.038461538461538464,0.05660377358490565,0.038461538461538464
1171,ref-bible.0208.27.16.19-ref-bible.0208.27.16.27,ref-sifre-d.178.2.12-ref-sifre-d.178.2.20,920601,920645,156252,156260,ref-bible.208.27.16.19,ref-bible.208.27.16.27,195102,195143,32560,32568,ref-sifre-d.178.2.12,ref-sifre-d.178.2.20,לאמר הנה כלי בית יהוה מושבים מבבלה עתה מהרה ,אמר הנה כלי בית ה' מושבים מבבלה עתה מהרה ,9,9,1171,790,0.09090909090909091,0.11111111111111116,0.09090909090909091
1172,ref-bible.0208.27.21.8-ref-bible.0208.27.22.4,ref-sifre-d.178.2.21-ref-sifre-d.178.2.29,921092,921167,156328,156340,ref-bible.208.27.21.8,ref-bible.208.27.22.4,195144,195192,32569,32577,ref-sifre-d.178.2.21,ref-sifre-d.178.2.29,על הכלים הנותרים בית יהוה ובית מלך יהודה וירושלם בבלה יובאו ושמה יהיו ,על הכלים הנותרים בית ה' בבלה יובאו ושמה יהיו ,13,9,1172,791,0.37142857142857144,0.3802816901408451,0.37142857142857144
1173,ref-bible.0208.30.5.5-ref-bible.0208.30.7.13,ref-sifre-d.1.3.41-ref-sifre-d.1.3.69,925908,926094,157065,157100,ref-bible.208.30.5.5,ref-bible.208.30.7.13,641,781,104,132,ref-sifre-d.1.3.41,ref-sifre-d.1.3.69,קול חרדה שמענו פחד ואין שלום שאלו נא וראו אם ילד זכר מדוע ראיתי כל גבר ידיו על חלציו כיולדה ונהפכו כל פנים לירקון הוי כי גדול היום ההוא מאין כמהו ועת צרה היא ליעקב וממנה יושע ,קול חרדה שמענו פחד ואין שלום שאלו נא וראו אם יולד זכר מדוע ראיתי כל גבר ידיו על חלציו כיולדה הוי כי היום ההוא עת צרה ליעקב וממנה יושע ,37,29,1173,1,0.24571428571428572,0.23428571428571432,0.24
1174,ref-bible.0208.30.6.1-ref-bible.0208.30.6.6,ref-sifre-d.319.1.72-ref-sifre-d.319.1.78,925938,925962,157071,157076,ref-bible.208.30.6.1,ref-bible.208.30.6.6,330162,330191,55281,55287,ref-sifre-d.319.1.72,ref-sifre-d.319.1.78,שאלו נא וראו אם ילד זכר ,שאלו נא וראו אם יולד איש זכר ,6,7,1174,1253,0.1724137931034483,0.1724137931034483,0.1724137931034483
1175,ref-bible.0208.31.6.1-ref-bible.0208.31.6.10,ref-sifre-d.37.17.115-ref-sifre-d.37.17.124,927632,927680,157369,157377,ref-bible.208.31.6.1,ref-bible.208.31.6.10,57344,57391,9653,9661,ref-sifre-d.37.17.115,ref-sifre-d.37.17.124,כי יש יום קראו נצרים בהר אפרים קומו ונעלה ציון ,כי יש יום קראו נוצרים בהר אפרים קומו נעלה ציון ,10,10,1175,221,0.0425531914893617,0.0,0.02127659574468085
1176,ref-bible.0208.31.12.1-ref-bible.0208.31.12.14,ref-sifre-d.43.6.13-ref-sifre-d.43.6.26,928127,928197,157451,157464,ref-bible.208.31.12.1,ref-bible.208.31.12.14,76305,76374,12828,12841,ref-sifre-d.43.6.13,ref-sifre-d.43.6.26,ובאו ורננו במרום ציון ונהרו אל טוב יהוה על דגן ועל תירש ועל יצהר ,ובאו ורננו במרום ציון ונהרו אל טוב ה' על דגן ועל תירוש ועל יצהר ,14,14,1176,306,0.06153846153846154,0.045454545454545414,0.046153846153846156
1177,ref-bible.0208.31.13.1-ref-bible.0208.31.13.9,ref-sifre-d.342.2.203-ref-sifre-d.342.3.1,928260,928314,157477,157485,ref-bible.208.31.13.1,ref-bible.208.31.13.9,353256,353301,59255,59262,ref-sifre-d.342.2.203,ref-sifre-d.342.3.1,אז תשמח בתולה במחול ובחרים וזקנים יחדו והפכתי אבלם ,אז תשמח בתולה במחול בחורים וזקנים יחדיו אבל ,9,8,1177,1387,0.19607843137254902,0.13725490196078427,0.17647058823529413
1178,ref-bible.0208.31.21.7-ref-bible.0208.31.21.19,ref-sifre-d.43.34.78-ref-sifre-d.43.34.105,928919,928981,157594,157606,ref-bible.208.31.21.7,ref-bible.208.31.21.19,85529,85677,14385,14409,ref-sifre-d.43.34.78,ref-sifre-d.43.34.105,שתי לבך למסלה דרך הלכתי הלכת שובי בתולת ישראל שבי אל עריך אלה ,"שיתי לבך למסלה דרך הלכת אמר להם הקב""ה לישראל בני ראו באלו דרכים הלכתם ועשו תשובה מיד אתם חוזרים לעריכם שנאמר שובי בתולת ישראל שובי אל עריך אלה ",13,28,1178,354,0.5664335664335665,0.5664335664335665,0.5664335664335665
1179,ref-bible.0208.32.21.9-ref-bible.0208.32.21.15,ref-sifre-d.301.21.19-ref-sifre-d.301.21.26,932376,932424,158143,158149,ref-bible.208.32.21.9,ref-bible.208.32.21.15,286731,286791,47997,48004,ref-sifre-d.301.21.19,ref-sifre-d.301.21.26,ובמופתים וביד חזקה ובאזרוע נטויה ובמורא גדול ,ובמופתים ובמלחמה וביד חזקה ובזרוע נטויה ובמוראים גדולים ,7,8,1179,1096,0.23214285714285715,0.22807017543859653,0.21428571428571427
1180,ref-bible.0208.32.22.6-ref-bible.0208.32.22.11,ref-sifre-d.320.6.101-ref-sifre-d.320.6.107,932448,932491,158153,158158,ref-bible.208.32.22.6,ref-bible.208.32.22.11,331920,331967,55580,55586,ref-sifre-d.320.6.101,ref-sifre-d.320.6.107,אשר נשבעת לאבותם לתת להם ארץ זבת חלב ודבש ו,אשר נשבע ה' לאבותיכם לתת לנו ארץ זבת חלב ודבש ו,10,11,1180,1264,0.14893617021276595,0.16326530612244894,0.14893617021276595
1181,ref-bible.0208.32.35.15-ref-bible.0208.32.35.21,ref-sifre-d.148.12.1-ref-sifre-d.148.14.4,933610,933640,158332,158337,ref-bible.208.32.35.15,ref-bible.208.32.35.21,179036,179107,29882,29893,ref-sifre-d.148.12.1,ref-sifre-d.148.14.4,אשר לא צויתים ולא עלתה על לבי ,אשר לא צויתי בתורה ולא דברתי בעשרת הדברות לנביאים ולא עלתה על לבי ,7,13,1181,729,0.5454545454545454,0.5454545454545454,0.5454545454545454
1182,ref-bible.0208.33.10.9-ref-bible.0208.33.10.25,ref-sifre-d.329.1.4-ref-sifre-d.329.1.21,935260,935355,158598,158611,ref-bible.208.33.10.9,ref-bible.208.33.10.25,342450,342549,57420,57437,ref-sifre-d.329.1.4,ref-sifre-d.329.1.21,אתם אמרים חרב הוא מאין אדם ומאין בהמה בערי יהודה ובחצות ירושלם הנשמות מאין אדם ומאין יושב ,אני אני הוא זאת תשובה לאומרים אין רשות בשמים האומר אין רשות בשמים משיבים אותו ואומרים לו ואין ,17,18,1182,1320,0.6914893617021277,0.28037383177570097,0.5319148936170213
1184,ref-bible.0208.33.11.1-ref-bible.0208.33.11.8,ref-sifre-d.342.2.187-ref-sifre-d.342.2.194,935368,935405,158614,158621,ref-bible.208.33.11.1,ref-bible.208.33.11.8,353174,353209,59239,59246,ref-sifre-d.342.2.187,ref-sifre-d.342.2.194,קול ששון וקול שמחה קול חתן וקול כלה ,קול ששון קול שמחה קול חתן וקול כלה ,8,8,1184,1385,0.027777777777777776,0.02777777777777779,0.027777777777777776
1185,ref-bible.0208.34.18.16-ref-bible.0208.34.18.22,ref-sifre-d.171.4.41-ref-sifre-d.171.4.47,938510,938550,159083,159089,ref-bible.208.34.18.16,ref-bible.208.34.18.22,191468,191508,31951,31957,ref-sifre-d.171.4.41,ref-sifre-d.171.4.47,העגל אשר כרתו לשנים ויעברו בין בתריו ,העגל אשר כרתו לשנים ויעברו בין בתריו ,7,7,1185,769,0.0,0.0,0.0
1186,ref-bible.0208.35.5.12-ref-bible.0208.35.6.14,ref-sifre-d.28.1.31-ref-sifre-d.28.1.41,939332,939404,159216,159231,ref-bible.208.35.5.12,ref-bible.208.35.6.14,32767,32813,5518,5527,ref-sifre-d.28.1.31,ref-sifre-d.28.1.41,שתו יין ויאמרו לא נשתה יין כי יונדב בן רכב אבינו צוה עלינו לאמר לא תשתו ,שלא לשתות יין ל' יום אמר מה גזר עלי שלא אשתה ,16,11,1186,139,0.6111111111111112,0.5,0.5833333333333334
1187,ref-bible.0208.36.18.1-ref-bible.0208.36.19.1,ref-sifre-d.36.2.109-ref-sifre-d.36.2.138,942477,942558,159705,159717,ref-bible.208.36.18.1,ref-bible.208.36.19.1,51715,51871,8681,8709,ref-sifre-d.36.2.109,ref-sifre-d.36.2.138,ויאמר להם ברוך מפיו יקרא אלי את כל הדברים האלה ואני כתב על הספר בדיו ויאמרו ,"כתב האמור להלן על הספר ובדיו אף כתב האמור כאן על הספר ובדיו ואע""פ שאין ראיה לדבר זכר לדבר ויאמר להם ברוך מפיו יקרא אלי את כל הדברים האלה ואני ",16,30,1187,208,0.704225352112676,0.46478873239436624,0.6338028169014085
1189,ref-bible.0208.36.18.1-ref-bible.0208.36.19.3,ref-sifre-d.357.28.53-ref-sifre-d.357.28.58,942477,942568,159705,159719,ref-bible.208.36.18.1,ref-bible.208.36.19.3,386404,386436,64928,64933,ref-sifre-d.357.28.53,ref-sifre-d.357.28.58,ויאמר להם ברוך מפיו יקרא אלי את כל הדברים האלה ואני כתב על הספר בדיו ויאמרו השרים אל ,ויאמר אליהם ברוך מפיו יקרא אלי ,18,6,1189,1510,0.6823529411764706,0.6352941176470588,0.6588235294117647
1191,ref-bible.0208.36.30.17-ref-bible.0208.36.30.22,ref-sifre-d.43.30.21-ref-sifre-d.43.30.26,943707,943743,159894,159899,ref-bible.208.36.30.17,ref-bible.208.36.30.22,84291,84331,14185,14190,ref-sifre-d.43.30.21,ref-sifre-d.43.30.26,תהיה משלכת לחרב ביום ולקרח בלילה ,שהיתה מושלכת לחורב ביום ולקרח בלילה ,6,6,1191,352,0.1111111111111111,0.08333333333333337,0.1111111111111111
1192,ref-bible.0208.41.5.2-ref-bible.0208.41.5.9,ref-sifre-d.324.1.84-ref-sifre-d.324.1.90,952621,952666,161353,161360,ref-bible.208.41.5.2,ref-bible.208.41.5.9,339027,339069,56818,56824,ref-sifre-d.324.1.84,ref-sifre-d.324.1.90,אנשים משכם משלו ומשמרון שמנים איש מגלחי זקן ,משתה שמנים משתה שמרים שמנים ממוחים מזוקקים ,8,7,1192,1304,0.5681818181818182,0.38888888888888884,0.4318181818181818
1193,ref-bible.0208.43.11.7-ref-bible.0208.43.11.15,ref-sifre-d.43.29.56-ref-sifre-d.43.29.64,957200,957249,162062,162070,ref-bible.208.43.11.7,ref-bible.208.43.11.15,83835,83886,14104,14112,ref-sifre-d.43.29.56,ref-sifre-d.43.29.64,אשר למות למות ואשר לשבי לשבי ואשר לחרב לחרב ,אשר לחרב לחרב ואשר לרעב לרעב ואשר לשבי לשבי ,9,9,1193,347,0.4090909090909091,0.24,0.3181818181818182
1194,ref-bible.0208.44.10.6-ref-bible.0208.44.10.14,ref-sifre-d.41.9.25-ref-sifre-d.41.9.33,958391,958442,162240,162248,ref-bible.208.44.10.6,ref-bible.208.44.10.14,69783,69831,11743,11751,ref-sifre-d.41.9.25,ref-sifre-d.41.9.33,ולא יראו ולא הלכו בתורתי ובחקתי אשר נתתי לפניכם ,תורתי אשר נתתי לפניהם ולא שמעו בקולי ולא הלכו ,9,9,1194,276,0.8125,0.2264150943396226,0.5625
1195,ref-bible.0208.49.30.6-ref-bible.0208.49.30.20,ref-sifre-d.12.2.31-ref-sifre-d.12.2.37,969099,969176,164073,164083,ref-bible.208.49.30.6,ref-bible.208.49.30.20,15595,15637,2631,2637,ref-sifre-d.12.2.31,ref-sifre-d.12.2.37,ישבי חצור נאם יהוה כי יעץ עליכם נבוכדראצר מלך בבל עצה וחשב עליהם עליכם מחשבה ,יושב ויועץ עליכם עצות ומחשב עליכם מחשבות ,15,7,1195,77,0.5974025974025974,0.5432098765432098,0.5454545454545454
1196,ref-bible.0208.51.19.1-ref-bible.0208.51.19.10,ref-sifre-d.312.2.8-ref-sifre-d.312.2.18,974684,974731,165074,165083,ref-bible.208.51.19.1,ref-bible.208.51.19.10,319963,320015,53504,53514,ref-sifre-d.312.2.8,ref-sifre-d.312.2.18,לא כאלה חלק יעקוב כי יוצר הכל הוא ושבט נחלתו ,לא כאלה חלק יעקב כי יוצר הכל הוא וישראל שבט נחלתו ,10,11,1196,1197,0.14,0.13725490196078427,0.12
1197,ref-bible.0208.51.64.1-ref-bible.0208.51.64.17,ref-sifre-d.342.3.12-ref-sifre-d.342.3.28,977975,978060,165641,165657,ref-bible.208.51.64.1,ref-bible.208.51.64.17,353363,353448,59272,59288,ref-sifre-d.342.3.12,ref-sifre-d.342.3.28,ואמרת ככה תשקע בבל ולא תקום מפני הרעה אשר אנכי מביא עליה ויעפו עד הנה דברי ירמיהו ,ואמרת ככה תשקע בבל ולא תקום מפני הרעה אשר אנכי מביא עליה ועיפו עד הנה דברי ירמיהו ,17,17,1197,1388,0.024390243902439025,0.0,0.012195121951219513
1198,ref-bible.0209.3.10.13-ref-bible.0209.3.11.9,ref-sifre-d.335.1.21-ref-sifre-d.335.1.30,984751,984805,166751,166761,ref-bible.209.3.10.13,ref-bible.209.3.11.9,347497,347543,58277,58285,ref-sifre-d.335.1.21,ref-sifre-d.335.1.30,ובאזניך שמע ולך בא אל הגולה אל בני עמך ודברת אליהם ,ובאזניך שמע ושים לבך אל כל אשר אני דובר אליך ,11,10,1198,1352,0.39215686274509803,0.2857142857142857,0.3333333333333333
1199,ref-bible.0209.3.17.3-ref-bible.0209.3.18.1,ref-sifre-d.13.6.31-ref-sifre-d.14.1.3,985208,985271,166828,166838,ref-bible.209.3.17.3,ref-bible.209.3.18.1,17053,17130,2871,2883,ref-sifre-d.13.6.31,ref-sifre-d.14.1.3,צפה נתתיך לבית ישראל ושמעת מפי דבר והזהרת אותם ממני באמרי ,צופה נתתיך לבית ישראל ושמעת מפי דבר והזהרת אותם ממני ותענו אותי ותאמרו ,11,13,1199,81,0.2112676056338028,0.20833333333333337,0.2112676056338028
1200,ref-bible.0209.4.4.2-ref-bible.0209.4.5.6,ref-sifre-d.344.5.14-ref-sifre-d.344.5.29,986408,986518,167039,167058,ref-bible.209.4.4.2,ref-bible.209.4.5.6,361867,361942,60696,60709,ref-sifre-d.344.5.14,ref-sifre-d.344.5.29,שכב על צדך השמאלי ושמת את עון בית ישראל עליו מספר הימים אשר תשכב עליו תשא את עונם ואני נתתי לך את שני עונם ,שכב על צדך הימני ושמת עון בית ישראל עליו ואומר ואני נתתי לך את שני עונם ,24,16,1200,1413,0.3644859813084112,0.3271028037383178,0.3644859813084112
1202,ref-bible.0209.4.6.1-ref-bible.0209.4.6.13,ref-sifre-d.344.5.14-ref-sifre-d.344.5.32,986573,986644,167068,167078,ref-bible.209.4.6.1,ref-bible.209.4.6.13,361867,361956,60696,60711,ref-sifre-d.344.5.14,ref-sifre-d.344.5.32,וכלית את אלה ושכבת על צדך הימיני הימני שנית ונשאת את עון בית יהודה ,שכב על צדך הימני ושמת עון בית ישראל עליו ואומר ואני נתתי לך את שני עונם וכלית את אלה ,14,19,1202,1414,0.6470588235294118,0.2921348314606742,0.5529411764705883
1204,ref-bible.0209.5.16.1-ref-bible.0209.5.16.6,ref-sifre-d.321.3.11-ref-sifre-d.321.3.16,988878,988908,167447,167451,ref-bible.209.5.16.1,ref-bible.209.5.16.6,333104,333134,55789,55793,ref-sifre-d.321.3.11,ref-sifre-d.321.3.16,בשלחי את חצי הרעב הרעים בהם ,בשלחי את חצי הרעב הרעים בהם ,6,6,1204,1273,0.0,0.0,0.0
1205,ref-bible.0209.7.15.4-ref-bible.0209.7.16.3,ref-sifre-d.321.10.30-ref-sifre-d.321.11.3,991232,991315,167817,167830,ref-bible.209.7.15.4,ref-bible.209.7.16.3,333729,333809,55897,55910,ref-sifre-d.321.10.30,ref-sifre-d.321.11.3,והרעב מבית אשר בשדה בחרב ימות ואשר בעיר רעב ודבר יאכלנו ופלטו פליטיהם והיו ,רעב ואומר ואשר בשדה בחרב יומת ואשר בעיר רעב ודבר יאכלנו ומחדרים אימה היה ,14,14,1205,1277,0.30666666666666664,0.2168674698795181,0.22666666666666666
1206,ref-bible.0209.8.10.2-ref-bible.0209.8.10.8,ref-sifre-d.306.1.219-ref-sifre-d.306.1.224,992933,992969,168107,168113,ref-bible.209.8.10.2,ref-bible.209.8.10.8,296262,296295,49607,49612,ref-sifre-d.306.1.219,ref-sifre-d.306.1.224,ואראה והנה כל תבנית רמש ובהמה שקץ ,ואראה והנה תבנית רמש ובהמה שקץ ,7,6,1206,1138,0.08823529411764706,0.08823529411764708,0.08823529411764706
1207,ref-bible.0209.11.20.2-ref-bible.0209.11.20.8,ref-sifre-d.42.2.31-ref-sifre-d.42.2.38,998118,998156,168985,168991,ref-bible.209.11.20.2,ref-bible.209.11.20.8,73260,73305,12342,12348,ref-sifre-d.42.2.31,ref-sifre-d.42.2.38,בחקתי ילכו ואת משפטי ישמרו ועשו אתם ,בחקתי תלכו ואם את משפטי תשמורו ועשיתם אותם ,7,8,1207,294,0.23255813953488372,0.20454545454545459,0.23255813953488372
