,baseOrig,compOrig,baseCharStart,baseCharEnd,baseWdStart,baseWdEnd,baseRefStart,baseRefEnd,compCharStart,compCharEnd,compWdStart,compWdEnd,compRefStart,compRefEnd,baseStr,compStr,bRange,cRange,baseOrder,compOrder,dam-lev,jac
629,ref-sifre-n.39.1.88-ref-sifre-n.39.1.102,ref-b.3.01.24a.74-ref-b.3.01.24a.95,62837,62916,9056,9070,ref-sifre-n.39.1.88,ref-sifre-n.39.1.102,2826561,2826663,412274,412291,ref-b.3.1.24a.74,ref-b.3.1.24a.95,נאמר כאן ברכה ונאמר להלן ברכה מה ברכה האמורה להלן בעמידה אף ברכה האמורה כאן ,נאמר כאן יקום על שם אחיו ונאמר להלן על שם אחיהם יקראו בנחלתם מה שם האמור להלן נחלה אף שם האמור כאן ,15,22,545,629,0.5151515151515151,0.6666666666666667
630,ref-sifre-n.73.2.58-ref-sifre-n.73.2.74,ref-b.3.01.24a.74-ref-b.3.01.24a.95,98137,98229,14768,14784,ref-sifre-n.73.2.58,ref-sifre-n.73.2.74,2826561,2826663,412274,412291,ref-b.3.1.24a.74,ref-b.3.1.24a.95,נאמר כאן תרועה ונאמר להלן תרועה מה תרועה האמורה להלן תקיעה לאחר תרועה אף תרועה האמורה כאן ,נאמר כאן יקום על שם אחיו ונאמר להלן על שם אחיהם יקראו בנחלתם מה שם האמור להלן נחלה אף שם האמור כאן ,17,22,862,630,0.5555555555555556,0.6875
631,ref-sifre-n.73.2.136-ref-sifre-n.73.2.152,ref-b.3.01.24a.74-ref-b.3.01.24a.95,98548,98642,14835,14851,ref-sifre-n.73.2.136,ref-sifre-n.73.2.152,2826561,2826663,412274,412291,ref-b.3.1.24a.74,ref-b.3.1.24a.95,נאמר כאן תרועה ונאמר להלן תרועה מה תרועה האמורה להלן תוקע ומריע ותוקע אף תרועה האמורה כאן ,נאמר כאן יקום על שם אחיו ונאמר להלן על שם אחיהם יקראו בנחלתם מה שם האמור להלן נחלה אף שם האמור כאן ,17,22,872,631,0.5858585858585859,0.6875
632,ref-sifre-n.113.1.59-ref-sifre-n.113.1.73,ref-b.3.01.24a.74-ref-b.3.01.24a.95,168004,168079,26424,26438,ref-sifre-n.113.1.59,ref-sifre-n.113.1.73,2826561,2826663,412274,412291,ref-b.3.1.24a.74,ref-b.3.1.24a.95,נאמר כאן מדבר ונאמר להלן מדבר מה מדבר האמור להלן צלפחד אף מדבר האמור כאן ,נאמר כאן יקום על שם אחיו ונאמר להלן על שם אחיהם יקראו בנחלתם מה שם האמור להלן נחלה אף שם האמור כאן ,15,22,1299,632,0.494949494949495,0.6666666666666667
633,ref-sifre-n.124.1.255-ref-sifre-n.124.1.271,ref-b.3.01.24a.74-ref-b.3.01.24a.95,212297,212387,33518,33534,ref-sifre-n.124.1.255,ref-sifre-n.124.1.271,2826561,2826663,412274,412291,ref-b.3.1.24a.74,ref-b.3.1.24a.95,נאמרה כאן לקיחה ונאמרה להלן שמות יב לקיחה מה לקיחה האמורה להלן שלשה אף לקיחה האמורה כאן ,נאמר כאן יקום על שם אחיו ונאמר להלן על שם אחיהם יקראו בנחלתם מה שם האמור להלן נחלה אף שם האמור כאן ,17,22,1640,633,0.48484848484848486,0.625
634,ref-sifre-n.142.2.71-ref-sifre-n.142.2.91,ref-b.3.01.24a.74-ref-b.3.01.24a.95,253472,253582,40355,40375,ref-sifre-n.142.2.71,ref-sifre-n.142.2.91,2826561,2826663,412274,412291,ref-b.3.1.24a.74,ref-b.3.1.24a.95,נאמרה כאן שמירה ונאמר להלן שמות יב שמירה מה שמירה האמורה להלן מבקרו ד' ימים קודם שחיטתו אף שמירה האמורה כאן ,נאמר כאן יקום על שם אחיו ונאמר להלן על שם אחיהם יקראו בנחלתם מה שם האמור להלן נחלה אף שם האמור כאן ,21,22,1951,634,0.6018518518518519,0.7
635,ref-sifre-n.142.2.212-ref-sifre-n.142.2.228,ref-b.3.01.24a.74-ref-b.3.01.24a.95,254184,254273,40470,40484,ref-sifre-n.142.2.212,ref-sifre-n.142.2.228,2826561,2826663,412274,412291,ref-b.3.1.24a.74,ref-b.3.1.24a.95,נאמר כאן במועדו ונא' להלן במועדו מה מועדו האמור להלן דוחה את השבת אף מועדו האמור כאן ,נאמר כאן יקום על שם אחיו ונאמר להלן על שם אחיהם יקראו בנחלתם מה שם האמור להלן נחלה אף שם האמור כאן ,17,22,1960,635,0.5555555555555556,0.7894736842105263
636,ref-sifre-n.157.8.90-ref-sifre-n.157.8.109,ref-b.3.01.24a.74-ref-b.3.01.24a.95,281484,281574,44898,44917,ref-sifre-n.157.8.90,ref-sifre-n.157.8.109,2826561,2826663,412274,412291,ref-b.3.1.24a.74,ref-b.3.1.24a.95,נאמר כאן בגד ונאמר להלן בגד מה בגד האמור להלן עשה בו כל מעשה עזים כשק אף בגד האמור כאן ,נאמר כאן יקום על שם אחיו ונאמר להלן על שם אחיהם יקראו בנחלתם מה שם האמור להלן נחלה אף שם האמור כאן ,20,22,2227,636,0.5555555555555556,0.7222222222222222
637,ref-sifre-n.75.1.39-ref-sifre-n.75.1.58,ref-b.3.01.24a.74-ref-b.3.01.24a.97,99798,99906,15032,15051,ref-sifre-n.75.1.39,ref-sifre-n.75.1.58,2826561,2826675,412274,412293,ref-b.3.1.24a.74,ref-b.3.1.24a.97,נאמר כאן כהנים ונאמר להלן כהנים מה כהנים האמור להלן תמימים ולא בעלי מומין אף כהנים האמור כאן תמימים ולא ,נאמר כאן יקום על שם אחיו ונאמר להלן על שם אחיהם יקראו בנחלתם מה שם האמור להלן נחלה אף שם האמור כאן לנחלה ולא ,20,24,894,637,0.5596330275229358,0.5882352941176471
638,ref-sifre-n.128.2.2-ref-sifre-n.128.2.21,ref-b.3.01.24a.74-ref-b.3.01.24a.97,224877,224976,35523,35542,ref-sifre-n.128.2.2,ref-sifre-n.128.2.21,2826561,2826675,412274,412293,ref-b.3.1.24a.74,ref-b.3.1.24a.97,נאמרה כאן לקיחה ונאמרה להלן שמות יב לקיחה מה לקיחה האמורה להלן ג' אף לקיחה האמורה כאן ג' אזוב לא ,נאמר כאן יקום על שם אחיו ונאמר להלן על שם אחיהם יקראו בנחלתם מה שם האמור להלן נחלה אף שם האמור כאן לנחלה ולא ,20,24,1775,638,0.5137614678899083,0.6842105263157895
639,ref-sifre-n.22.1.193-ref-sifre-n.22.1.207,ref-b.3.01.24a.75-ref-b.3.01.24a.95,33539,33623,5122,5136,ref-sifre-n.22.1.193,ref-sifre-n.22.1.207,2826566,2826663,412275,412291,ref-b.3.1.24a.75,ref-b.3.1.24a.95,כאן הפלאה ונאמר להלן הפלאה מה הפלאה האמורה להלן בנדר ובנדבה אף הפלאה האמורה כאן ,כאן יקום על שם אחיו ונאמר להלן על שם אחיהם יקראו בנחלתם מה שם האמור להלן נחלה אף שם האמור כאן ,15,21,294,639,0.5638297872340425,0.6875
640,ref-sifre-n.25.1.406-ref-sifre-n.25.1.420,ref-b.3.01.24a.75-ref-b.3.01.24a.95,41623,41697,6317,6331,ref-sifre-n.25.1.406,ref-sifre-n.25.1.420,2826566,2826663,412275,412291,ref-b.3.1.24a.75,ref-b.3.1.24a.95,כאן פרוע ונאמר להלן פרוע מה פרוע האמור להלן גידול שער אף פרוע האמור כאן ,כאן יקום על שם אחיו ונאמר להלן על שם אחיהם יקראו בנחלתם מה שם האמור להלן נחלה אף שם האמור כאן ,15,21,326,640,0.5319148936170213,0.6875
641,ref-sifre-n.110.1.111-ref-sifre-n.110.1.126,ref-b.3.01.24a.75-ref-b.3.01.24a.95,156996,157074,24646,24661,ref-sifre-n.110.1.111,ref-sifre-n.110.1.126,2826566,2826663,412275,412291,ref-b.3.1.24a.75,ref-b.3.1.24a.95,כאן לחם עוני ונאמר להלן לחם מה לחם האמור להלן חמשת המינים אף לחם האמור כאן ,כאן יקום על שם אחיו ונאמר להלן על שם אחיהם יקראו בנחלתם מה שם האמור להלן נחלה אף שם האמור כאן ,16,21,1174,641,0.48936170212765956,0.625
642,ref-sifre-n.153.3.18-ref-sifre-n.153.3.33,ref-b.3.01.24a.75-ref-b.3.01.24a.95,264941,265016,42271,42286,ref-sifre-n.153.3.18,ref-sifre-n.153.3.33,2826566,2826663,412275,412291,ref-b.3.1.24a.75,ref-b.3.1.24a.95,כאן נדר ונאמר להלן נדר מה נדר האמור להלן נדר ונדבה עמו אף נדר האמור כאן ,כאן יקום על שם אחיו ונאמר להלן על שם אחיהם יקראו בנחלתם מה שם האמור להלן נחלה אף שם האמור כאן ,16,21,2080,642,0.574468085106383,0.6875
643,ref-sifre-n.123.1.105-ref-sifre-n.123.1.113,ref-b.3.01.24a.80-ref-b.3.01.24a.90,205777,205822,32509,32517,ref-sifre-n.123.1.105,ref-sifre-n.123.1.113,2826586,2826641,412277,412286,ref-b.3.1.24a.80,ref-b.3.1.24a.90,ונאמר להלן ויקרא טז חקה מה חקה האמורה להלן ,ונאמר להלן על שם אחיהם יקראו בנחלתם מה שם האמור להלן ,9,11,1604,643,0.4339622641509434,0.6
644,ref-sifre-n.133.4.14-ref-sifre-n.133.4.29,ref-b.3.01.24a.86-ref-b.3.01.24a.95,239003,239072,37906,37921,ref-sifre-n.133.4.14,ref-sifre-n.133.4.29,2826616,2826663,412282,412291,ref-b.3.1.24a.86,ref-b.3.1.24a.95,להלן דברים כה שם מה שם האמור להלן נחלה אף שם האמור כאן נחלה ומה שם ,בנחלתם מה שם האמור להלן נחלה אף שם האמור כאן ,16,10,1873,644,0.3880597014925373,0.33333333333333337
648,ref-sifre-n.75.1.24-ref-sifre-n.75.1.40,ref-b.3.01.32b.192-ref-b.3.01.32b.204,99716,99806,15018,15033,ref-sifre-n.75.1.24,ref-sifre-n.75.1.40,2849768,2849838,415754,415765,ref-b.3.1.32b.192,ref-b.3.1.32b.204,"הכהנים בין תמימים ובין בעלי מומין דברי ר' טרפון ר""ע אומר תמימים ולא בעלי מומין נאמר כאן ",לכהנים תמימים הותרה ולא לבעלי מומין יש כאן משום בעלי מומין ויש כאן ,17,13,884,648,0.5113636363636364,0.625
649,ref-sifre-n.75.1.40-ref-sifre-n.75.1.52,ref-b.3.01.32b.192-ref-b.3.01.32b.204,99803,99874,15033,15045,ref-sifre-n.75.1.40,ref-sifre-n.75.1.52,2849768,2849838,415754,415765,ref-b.3.1.32b.192,ref-b.3.1.32b.204,כאן כהנים ונאמר להלן כהנים מה כהנים האמור להלן תמימים ולא בעלי מומין ,לכהנים תמימים הותרה ולא לבעלי מומין יש כאן משום בעלי מומין ויש כאן ,13,13,900,649,0.7101449275362319,0.6153846153846154
650,ref-sifre-n.115.1.1008-ref-sifre-n.115.1.1023,ref-b.3.01.47a.307-ref-b.3.01.47a.324,175529,175618,27667,27682,ref-sifre-n.115.1.1008,ref-sifre-n.115.1.1023,2901378,2901478,423091,423108,ref-b.3.1.47a.307,ref-b.3.1.47a.324,עליהם יאמר להם עבדי אתם כיון שיצאו למדבר התחיל לגזור עליהם מקצת מצות קלות ומקצת חמורות ,עליהם אם אומר יודע אני ואיני כדאי מקבלין אותו מיד ומודיעין אותו מקצת מצות קלות ומקצת מצות חמורות ,16,18,1345,650,0.4948453608247423,0.55
651,ref-sifre-n.78.1.724-ref-sifre-n.78.1.728,ref-b.3.01.47b.190-ref-b.3.01.47b.198,105732,105759,15984,15988,ref-sifre-n.78.1.724,ref-sifre-n.78.1.728,2902913,2902963,423340,423348,ref-b.3.1.47b.190,ref-b.3.1.47b.198,ואלהיך אלהי באשר תמות אמות ,"ואלהיך אלהי ארבע מיתות נמסרו לב""ד באשר תמותי אמות ",5,9,924,651,0.46,0.6
652,ref-sifre-n.121.1.391-ref-sifre-n.121.1.408,ref-b.3.01.48a.207-ref-b.3.01.48a.226,203869,203952,32210,32227,ref-sifre-n.121.1.391,ref-sifre-n.121.1.408,2904889,2904988,423646,423663,ref-b.3.1.48a.207,ref-b.3.1.48a.226,מה להלן שהיא עולה אף כאן שהיא עולה אי מה להלן במאה ואחד אף כאן במאה ואחד אמרת ,מה להלן העברה אף כאן העברה רבי עקיבא אומר נאמר עשיה בראש ונאמר עשיה בצפרנים מה להלן ניוול אף כאן ,18,20,1600,652,0.6185567010309279,0.8235294117647058
653,ref-sifre-n.160.2.113-ref-sifre-n.160.2.124,ref-b.3.01.48b.112-ref-b.3.01.48b.126,285226,285286,45504,45513,ref-sifre-n.160.2.113,ref-sifre-n.160.2.124,2905797,2905859,423790,423802,ref-b.3.1.48b.112,ref-b.3.1.48b.126,"לגרים מנין ת""ל ולגר ותושב בתוכם או אינו אלא כשם שהגר הוא ",והגר זה גר תושב אתה אומר זה גר תושב או אינו אלא גר צדק כשהוא ,12,15,2247,653,0.5737704918032787,0.7142857142857143
654,ref-sifre-n.103.1.182-ref-sifre-n.103.1.190,ref-b.3.01.49b.47-ref-b.3.01.49b.54,140879,140921,21983,21990,ref-sifre-n.103.1.182,ref-sifre-n.103.1.190,2908779,2908818,424210,424216,ref-b.3.1.49b.47,ref-b.3.1.49b.54,כי לא יראני האדם וחי כשהוא חי אינו רואה ,כי לא יראני האדם וחי ואת אמרת ואראה ,9,8,1044,654,0.275,0.5
656,ref-sifre-n.134.2.289-ref-sifre-n.134.3.12,ref-b.3.01.54b.445-ref-b.3.01.54b.460,241669,241748,38349,38359,ref-sifre-n.134.2.289,ref-sifre-n.134.3.12,2924685,2924769,426597,426611,ref-b.3.1.54b.445,ref-b.3.1.54b.460,ומתה וירשה ואם אין אחים לאביו ממשפחתו ממשפחת אביו או אינו אלא ממשפחת אמו ,אב קרויה משפחה משפחת אם אינה קרויה משפחה והדתנן אמרו לו מתה אשתך ונשא אחותה מאביה ,14,16,1910,656,0.6585365853658537,0.8235294117647058
657,ref-sifre-n.21.1.150-ref-sifre-n.21.1.155,ref-b.3.01.58a.213-ref-b.3.01.58a.219,32286,32321,4929,4934,ref-sifre-n.21.1.150,ref-sifre-n.21.1.155,2935989,2936029,428171,428177,ref-b.3.1.58a.213,ref-b.3.1.58a.219,ונקה האיש מעון כשהאיש מנוקה מעון ,ונקה האיש מעון בזמן שהאיש מנוקה מעון ,6,7,281,657,0.13513513513513514,0.19999999999999996
658,ref-sifre-n.154.1.2-ref-sifre-n.154.1.9,ref-b.3.01.59a.72-ref-b.3.01.59a.97,271849,271897,43335,43342,ref-sifre-n.154.1.2,ref-sifre-n.154.1.9,2938242,2938381,428455,428473,ref-b.3.1.59a.72,ref-b.3.1.59a.97,אלמנה וגרושה מן הנישואין אתה אומר מן הנישואין ,"אלמנה מן הנישואין פשיטא מהו דתימא לילף אלמנה אלמנה מתמר מה להלן מן הנישואין אף כאן מן הנישואין קמ""ל ואימא הכי נמי דומיא דגרושה מה גרושה ",8,26,2147,658,0.7426470588235294,0.7647058823529411
659,ref-sifre-n.157.6.77-ref-sifre-n.157.6.86,ref-b.3.01.60b.86-ref-b.3.01.60b.95,280741,280787,44773,44780,ref-sifre-n.157.6.77,ref-sifre-n.157.6.86,2942657,2942703,429058,429065,ref-b.3.1.60b.86,ref-b.3.1.60b.95,וכל הטף בנשים אשר לא ידעו משכב זכר החיו לכם ,וכל הטף בנשים אשר לא ידעו משכב זכר החיו לכם ,10,10,2214,659,0.0,0.0
660,ref-sifre-n.157.6.77-ref-sifre-n.157.6.86,ref-b.3.01.60b.136-ref-b.3.01.60b.145,280741,280787,44773,44780,ref-sifre-n.157.6.77,ref-sifre-n.157.6.86,2942904,2942950,429100,429107,ref-b.3.1.60b.136,ref-b.3.1.60b.145,וכל הטף בנשים אשר לא ידעו משכב זכר החיו לכם ,וכל הטף בנשים אשר לא ידעו משכב זכר החיו לכם ,10,10,2215,660,0.0,0.0
661,ref-sifre-n.157.6.16-ref-sifre-n.157.6.26,ref-b.3.01.60b.159-ref-b.3.01.60b.178,280419,280482,44725,44735,ref-sifre-n.157.6.16,ref-sifre-n.157.6.26,2943018,2943124,429119,429131,ref-b.3.1.60b.159,ref-b.3.1.60b.178,ראויה ליבעל כשהוא אומר כל הטף בנשים הרי שאינה ראויה ליבעל ,אשה יודעת איש בראויה ליבעל הכתוב מדבר אתה אומר בראויה ליבעל או אינו אלא נבעלה ממש כשהוא אומר וכל הטף ,11,20,2211,661,0.6732673267326733,0.6
663,ref-sifre-n.157.6.77-ref-sifre-n.157.6.84,ref-b.3.01.60b.177-ref-b.3.01.60b.184,280741,280778,44773,44778,ref-sifre-n.157.6.77,ref-sifre-n.157.6.84,2943115,2943152,429130,429135,ref-b.3.1.60b.177,ref-b.3.1.60b.184,וכל הטף בנשים אשר לא ידעו משכב זכר ,וכל הטף בנשים אשר לא ידעו משכב זכר ,8,8,2213,663,0.0,0.0
664,ref-sifre-n.115.1.151-ref-sifre-n.115.1.165,ref-b.3.01.61b.231-ref-b.3.01.61b.242,170979,171054,26911,26925,ref-sifre-n.115.1.151,ref-sifre-n.115.1.165,2947034,2947087,429663,429674,ref-b.3.1.61b.231,ref-b.3.1.61b.242,"כולה ציצית ת""ל גדילים אי גדילים שומע אני יעשה כולה גדילים ת""ל ציצית הא כיצד ","יכול קטנה ת""ל אשה אי אשה יכול בוגרת ת""ל בתולה הא כיצד ",15,12,1324,664,0.5526315789473685,0.8461538461538461
665,ref-sifre-n.153.4.163-ref-sifre-n.153.4.174,ref-b.3.01.61b.232-ref-b.3.01.61b.249,266582,266638,42548,42559,ref-sifre-n.153.4.163,ref-sifre-n.153.4.174,2947039,2947125,429664,429681,ref-b.3.1.61b.232,ref-b.3.1.61b.249,"קטנה ת""ל אשה הא כיצד יצתה מכלל קטנה ולכלל בגרות לא באת ","קטנה ת""ל אשה אי אשה יכול בוגרת ת""ל בתולה הא כיצד יצתה מכלל קטנות ולכלל בגרות לא באתה ",12,18,2104,665,0.36470588235294116,0.25
666,ref-sifre-n.18.1.183-ref-sifre-n.18.1.187,ref-b.3.01.63a.131-ref-b.3.01.63a.135,29864,29891,4541,4545,ref-sifre-n.18.1.183,ref-sifre-n.18.1.187,2953614,2953641,430619,430623,ref-b.3.1.63a.131,ref-b.3.1.63a.135,ונברכו בך כל משפחות האדמה ,ונברכו בך כל משפחות האדמה ,5,5,266,666,0.0,0.0
667,ref-sifre-n.133.3.115-ref-sifre-n.133.3.123,ref-b.3.01.63b.693-ref-b.3.01.63b.701,238890,238925,37887,37894,ref-sifre-n.133.3.115,ref-sifre-n.133.3.123,2959103,2959139,431503,431510,ref-b.3.1.63b.693,ref-b.3.1.63b.701,ובנים לא היו לו שאם היתה לו בן לא ,ובנים לא היו להם הא היו להם בנים לא ,9,9,1868,667,0.3055555555555556,0.6
668,ref-sifre-n.115.1.377-ref-sifre-n.115.1.383,ref-b.3.01.72a.20-ref-b.3.01.72a.26,172156,172190,27110,27116,ref-sifre-n.115.1.377,ref-sifre-n.115.1.383,2985513,2985547,435243,435249,ref-b.3.1.72a.20,ref-b.3.1.72a.26,ויהי בחצי הלילה וה' הכה כל בכור ,ויהי בחצי הלילה וה' הכה כל בכור ,7,7,1331,668,0.0,0.0
669,ref-sifre-n.127.5.1-ref-sifre-n.127.5.5,ref-b.3.01.72b.280-ref-b.3.01.72b.284,224118,224148,35411,35415,ref-sifre-n.127.5.1,ref-sifre-n.127.5.5,2988757,2988787,435716,435720,ref-b.3.1.72b.280,ref-b.3.1.72b.284,ולקחו לטמא מעפר שריפת החטאת ,ולקחו לטמא מעפר שריפת החטאת ,5,5,1732,669,0.0,0.0
670,ref-sifre-n.78.1.839-ref-sifre-n.78.1.845,ref-b.3.01.76b.64-ref-b.3.01.76b.70,106381,106410,16086,16092,ref-sifre-n.78.1.839,ref-sifre-n.78.1.845,3001351,3001381,437537,437543,ref-b.3.1.76b.64,ref-b.3.1.76b.70,לא תבואו בם והם לא יבואו בכם ,לא תבואו בהם והם לא יבואו בכם ,7,7,932,670,0.03333333333333333,0.0
671,ref-sifre-n.69.2.42-ref-sifre-n.69.2.46,ref-b.3.01.77a.96-ref-b.3.01.77a.100,93860,93885,14083,14087,ref-sifre-n.69.2.42,ref-sifre-n.69.2.46,3003350,3003375,437854,437858,ref-b.3.1.77a.96,ref-b.3.1.77a.100,ויאמרו אליו איה שרה אשתך ,ויאמרו אליו איה שרה אשתך ,5,5,812,671,0.0,0.0
672,ref-sifre-n.114.1.214-ref-sifre-n.114.1.220,ref-b.3.01.78a.188-ref-b.3.01.78a.194,169975,170010,26743,26748,ref-sifre-n.114.1.214,ref-sifre-n.114.1.220,3007973,3008008,438520,438525,ref-b.3.1.78a.188,ref-b.3.1.78a.194,היה לי חבר מתלמידי רבי עקיבא ואמר ,היה לי חבר מתלמידי רבי עקיבא ואמר ,7,7,1309,672,0.0,0.0
673,ref-sifre-n.133.4.108-ref-sifre-n.133.4.114,ref-b.3.01.78a.188-ref-b.3.01.78a.194,239443,239477,37988,37993,ref-sifre-n.133.4.108,ref-sifre-n.133.4.114,3007973,3008008,438520,438525,ref-b.3.1.78a.188,ref-b.3.1.78a.194,היה לי חבר מתלמידי ר' עקיבא ואמר ,היה לי חבר מתלמידי רבי עקיבא ואמר ,7,7,1879,673,0.058823529411764705,0.33333333333333337
674,ref-sifre-n.16.1.24-ref-sifre-n.16.1.36,ref-b.3.01.86a.112-ref-b.3.01.86a.127,27086,27148,4122,4134,ref-sifre-n.16.1.24,ref-sifre-n.16.1.36,3031975,3032054,441880,441891,ref-b.3.1.86a.112,ref-b.3.1.86a.127,מה וכתב האמור להלן כשר בכל אדם אף וכתב האמור כאן כשר בכל ,מה שעריך האמור להלן מעשר עני אף שעריך האמור כאן מעשר עני ואמר רחמנא לא תוכל ,13,16,240,674,0.5394736842105263,0.6923076923076923
675,ref-sifre-n.101.1.90-ref-sifre-n.101.1.102,ref-b.3.01.86a.112-ref-b.3.01.86a.127,138552,138611,21591,21603,ref-sifre-n.101.1.90,ref-sifre-n.101.1.102,3031975,3032054,441880,441891,ref-b.3.1.86a.112,ref-b.3.1.86a.127,מה מעשה האמור להלן של ספיר אף מעשה האמור כאן של ספיר מכל ,מה שעריך האמור להלן מעשר עני אף שעריך האמור כאן מעשר עני ואמר רחמנא לא תוכל ,13,16,1035,675,0.4342105263157895,0.6923076923076923
676,ref-sifre-n.122.1.96-ref-sifre-n.122.1.103,ref-b.3.01.86a.193-ref-b.3.01.86a.198,204617,204660,32332,32338,ref-sifre-n.122.1.96,ref-sifre-n.122.1.103,3032389,3032423,441946,441950,ref-b.3.1.86a.193,ref-b.3.1.86a.198,ואכלתם אותו בכל מקום אף בקבר אתם וביתכם ,ואכלתם אותו בכל מקום אתם וביתכם ,8,6,1601,676,0.2,0.25
677,ref-sifre-n.37.1.73-ref-sifre-n.37.1.81,ref-b.3.01.86b.367-ref-b.3.01.86b.373,60326,60371,8642,8649,ref-sifre-n.37.1.73,ref-sifre-n.37.1.81,3035008,3035045,442325,442331,ref-b.3.1.86b.367,ref-b.3.1.86b.373,שאתה אומר כי את חזה התנופה ואת שוק התרומה ,אמר ואת חזה התנופה ואת שוק התרומה ,9,7,520,677,0.21428571428571427,0.1428571428571429
679,ref-sifre-n.7.2.61-ref-sifre-n.7.2.75,ref-b.3.01.95a.23-ref-b.3.01.95a.33,15002,15078,2203,2215,ref-sifre-n.7.2.61,ref-sifre-n.7.2.75,3060028,3060086,445798,445806,ref-b.3.1.95a.23,ref-b.3.1.95a.33,שאין האוסר אוסר כל ימיו כשבא איסור הקל על איסור הקלה אסר את אוסריו מקום ,נאסר האוסר מקום שבא על איסור חמור אינו דין שנאסר האוסר ,15,11,91,679,0.5833333333333334,0.6923076923076923
681,ref-sifre-n.7.2.61-ref-sifre-n.7.2.74,ref-b.3.01.95a.382-ref-b.3.01.95a.388,15002,15073,2203,2214,ref-sifre-n.7.2.61,ref-sifre-n.7.2.74,3061855,3061891,446058,446064,ref-b.3.1.95a.382,ref-b.3.1.95a.388,שאין האוסר אוסר כל ימיו כשבא איסור הקל על איסור הקלה אסר את אוסריו ,איסור קל שאין האוסרה אוסרה כל ימיו ,14,7,90,681,0.6417910447761194,0.375
683,ref-sifre-n.7.2.61-ref-sifre-n.7.2.92,ref-b.3.01.95a.406-ref-b.3.01.95a.425,15002,15173,2203,2228,ref-sifre-n.7.2.61,ref-sifre-n.7.2.92,3061968,3062077,446075,446092,ref-b.3.1.95a.406,ref-b.3.1.95a.425,שאין האוסר אוסר כל ימיו כשבא איסור הקל על איסור הקלה אסר את אוסריו מקום שהאוסר אוסר כל ימיו כשבא איסור חמור על איסור חמורה אינו דין שיהיה אוסר את אוסריו תלמוד לומר ,"שאין האוסרה אוסרה כל ימיו נאסר האוסר הבא על איסור חמור שהאוסרה אוסרה כל ימיו אינו דין שנאסר האוסרה ת""ל ",33,20,93,683,0.5060975609756098,0.5
684,ref-sifre-n.7.2.77-ref-sifre-n.7.2.92,ref-b.3.01.95a.407-ref-b.3.01.95a.425,15087,15173,2217,2228,ref-sifre-n.7.2.77,ref-sifre-n.7.2.92,3061974,3062077,446076,446092,ref-b.3.1.95a.407,ref-b.3.1.95a.425,אוסר כל ימיו כשבא איסור חמור על איסור חמורה אינו דין שיהיה אוסר את אוסריו תלמוד לומר ,"האוסרה אוסרה כל ימיו נאסר האוסר הבא על איסור חמור שהאוסרה אוסרה כל ימיו אינו דין שנאסר האוסרה ת""ל ",17,19,94,684,0.5714285714285714,0.5625
685,ref-sifre-n.7.2.21-ref-sifre-n.7.2.36,ref-b.3.01.95a.411-ref-b.3.01.95a.425,14810,14894,2184,2194,ref-sifre-n.7.2.21,ref-sifre-n.7.2.36,3061996,3062077,446080,446092,ref-b.3.1.95a.411,ref-b.3.1.95a.425,אסר את אוסרו כשבא איסור חמור על איסור חמורה אינו דין שהוא אוסר את אוסרו תלמוד לומר ,"נאסר האוסר הבא על איסור חמור שהאוסרה אוסרה כל ימיו אינו דין שנאסר האוסרה ת""ל ",17,15,88,685,0.5301204819277109,0.6875
686,ref-sifre-n.134.2.69-ref-sifre-n.134.2.91,ref-b.3.01.98b.153-ref-b.3.01.98b.162,240532,240644,38162,38181,ref-sifre-n.134.2.69,ref-sifre-n.134.2.91,3074524,3074570,447962,447971,ref-b.3.1.98b.153,ref-b.3.1.98b.162,"האחים ומנין שהאב יורש אמרת ק""ו ומה אחים מן האב שאינן באים אלא מכח אב הרי הם יורשים את האב שאין אחים באים ",אחין מן האב ומקצתן אחין מן האם אחין מן האם ,23,10,1893,686,0.6666666666666666,0.75
687,ref-sifre-n.30.1.833-ref-sifre-n.30.1.854,ref-b.3.01.104a.204-ref-b.3.01.104a.213,53512,53624,7816,7829,ref-sifre-n.30.1.833,ref-sifre-n.30.1.854,3093307,3093351,450716,450725,ref-b.3.1.104a.204,ref-b.3.1.104a.213,נאמר כאן נזיר ונאמר להלן נזיר מה נזיר האמור להלן עשה בו ימים שלאחר נזירות בימים שבתוך נזירות עד הבאת קרבן אף ,נאמר כאן אזן ונאמר להלן אזן מה להלן ימין אף ,22,10,439,687,0.6330275229357798,0.5714285714285714
