,baseOrig,compOrig,baseCharStart,baseCharEnd,baseWdStart,baseWdEnd,baseRefStart,baseRefEnd,compCharStart,compCharEnd,compWdStart,compWdEnd,compRefStart,compRefEnd,baseStr,compStr,bRange,cRange,baseOrder,compOrder,lev,jac,lcsseq
238,ref-t.3.4.6.4.14-ref-t.3.4.6.4.29,ref-sifre-n.153.3.154-ref-sifre-n.153.3.170,621307,621387,97563,97576,ref-t.3.4.6.4.14,ref-t.3.4.6.4.29,265597,265681,42375,42389,ref-sifre-n.153.3.154,ref-sifre-n.153.3.170,מפר את נדרן ואין כופן לשתות יין וליטמא למתים אבל עבדו ושפחתו אין מפר את נדרן ,שאין מפר נדרי עצמו משנודר הרי הוא מיפר נדרי עצמו עד שלא ידור מקום שמפר נדרי אשתו ,16,17,238,849,0.7407407407407407,0.4509803921568627,0.5308641975308642
240,ref-t.3.4.6.4.14-ref-t.3.4.6.4.29,ref-sifre-n.153.10.34-ref-sifre-n.153.10.41,621307,621387,97563,97576,ref-t.3.4.6.4.14,ref-t.3.4.6.4.29,271547,271591,43284,43291,ref-sifre-n.153.10.34,ref-sifre-n.153.10.41,מפר את נדרן ואין כופן לשתות יין וליטמא למתים אבל עבדו ושפחתו אין מפר את נדרן ,שמיפר נדרי אשתו משנדרה אינו דין שיפר נדרי ,16,8,240,868,0.6753246753246753,0.5833333333333333,0.6363636363636364
241,ref-t.3.5.1.2.31-ref-t.3.5.1.2.57,ref-sifre-n.7.3.79-ref-sifre-n.7.3.101,622044,622174,97680,97698,ref-t.3.5.1.2.31,ref-t.3.5.1.2.57,15638,15750,2299,2313,ref-sifre-n.7.3.79,ref-sifre-n.7.3.101,כדי חזרת דקל ר' יהושע אומ' כדי מזיגת הכוס בן עזיי אומ' כדי מזיגת הכוס לשתותו ר' עקיבא אומ' כדי לצלות ביצה ר' יהודה בן פתירה אומ' ,כדי להקיף דקל דברי ר' ישמעאל ר' אליעזר אומר כדי מזיגת הכוס ר' יהושע אומר כדי לשתותו בן עזאי אומר כדי לצלות ביצה ,27,23,241,47,0.5426356589147286,0.26618705035971224,0.4108527131782946
243,ref-t.3.5.1.2.109-ref-t.3.5.1.2.167,ref-sifre-n.8.1.29-ref-sifre-n.8.1.89,622415,622704,97739,97788,ref-t.3.5.1.2.109,ref-t.3.5.1.2.167,17663,17952,2604,2650,ref-sifre-n.8.1.29,ref-sifre-n.8.1.89,בעלה נאמן עליה מקל וחומר ומה נדה שחייבין על ביאתה כרת בעלה נאמן עליה סוטה שאין חייבין על ביאתה כרת אינו דין שיהא בעלה נאמן עליה אמרו לו וכל שכן הואיל ואין חייבין על ביאתה כרת לא יהא בעלה נאמן עליה דבר אחר לא אם אמרת בנדה שיש לזה התר אחר איסורה תאמר בסוטה שאין לה היתר לאחר איסורה ,בעלה נאמן עליה מקל וחומר ומה נדה שחיבים על ביאתה כרת בעלה נאמן עליה סוטה שאין חיבים על ביאתה כרת אינו דין שיהא בעלה נאמן עליה אמרו לו כל שכן הואיל ואין חיבים על ביאתה כרת לא יהא בעלה נאמן עליה דבר אחר אמרו לו לא אם אמרת בנדה שיש לה היתר אחר איסורה תאמר בסוטה שאין לה היתר אתר איסורה ,59,61,243,81,0.06713780918727916,0.05862068965517242,0.045936395759717315
245,ref-t.3.5.1.6.28-ref-t.3.5.1.6.43,ref-sifre-n.12.1.213-ref-sifre-n.12.1.229,623355,623434,97895,97908,ref-t.3.5.1.6.28,ref-t.3.5.1.6.43,24381,24465,3707,3723,ref-sifre-n.12.1.213,ref-sifre-n.12.1.229,הללו דומין אלא לסם יבש שנתון על גבי בשר חי ואין מזיקו ולכשמוצא שם מכה מחלחל ,האלו למה הן דומין לסם יבש הניתן על בשר חי ואין מזיקו כשהוא מוצא מכה מתחיל לחלחל ,16,17,245,113,0.4,0.18604651162790697,0.25
246,ref-t.3.5.1.7.36-ref-t.3.5.1.7.46,ref-sifre-n.11.1.57-ref-sifre-n.11.1.68,623762,623809,97962,97969,ref-t.3.5.1.7.36,ref-t.3.5.1.7.46,22313,22363,3364,3372,ref-sifre-n.11.1.57,ref-sifre-n.11.1.68,נאה לא היה מגלחו ואם היה שערה נאה לא היה סותרו ,נאה לא היה מגלהו ואם היה שערה נאה לא היה הי סותרו ,11,12,246,104,0.08,0.0980392156862745,0.08
247,ref-t.3.5.1.10.12-ref-t.3.5.1.10.24,ref-sifre-n.8.1.258-ref-sifre-n.8.1.283,624080,624137,98016,98026,ref-t.3.5.1.10.12,ref-t.3.5.1.10.24,18803,18933,2793,2815,ref-sifre-n.8.1.258,ref-sifre-n.8.1.283,שנ' לא יצק עליה שמן ולא יתן עליה לבונה ר' שמעון אומ' כל ,אמרת על השמן יהא עובר שאין יכול לחזור וללקט על לבונה לא יהיה עובר שיכול לחזור וללקטה תלמוד לומר לא ישים יצק עליו שמן ולא יתן ,13,26,247,87,0.744,0.5968992248062015,0.72
249,ref-t.3.5.1.10.43-ref-t.3.5.1.10.65,ref-sifre-n.8.1.329-ref-sifre-n.8.1.347,624236,624352,98042,98061,ref-t.3.5.1.10.43,ref-t.3.5.1.10.65,19158,19264,2857,2873,ref-sifre-n.8.1.329,ref-sifre-n.8.1.347,כל זכרון שבתור' נאמרו לטובה חוץ מזו שנ' מנחת זכרון מזכרת עון ר' עקיבא אומ' אף זו לטובה שנ' ואם לא נטמאה האשה ,"כל הזכרונות שבתורה לטובה וזו לפורענות דברי ר' טרפון ר""ע אומר אף זאת לטובה שנאמר ואם לא נממאה האשה ",23,19,249,90,0.41284403669724773,0.275,0.3394495412844037
250,ref-t.3.5.2.2.4-ref-t.3.5.2.2.11,ref-sifre-n.15.1.90-ref-sifre-n.15.1.95,624755,624796,98134,98141,ref-t.3.5.2.2.4,ref-t.3.5.2.2.11,26011,26040,3958,3963,ref-sifre-n.15.1.90,ref-sifre-n.15.1.95,אמן שלא נטמאתי אמן שאיני עתידה ליטמא לא ,אמן שלא נטמאתי אמן שלא אטמא ,8,6,250,117,0.375,0.30000000000000004,0.35
251,ref-t.3.5.2.3.12-ref-t.3.5.2.3.18,ref-sifre-n.17.1.93-ref-sifre-n.17.1.99,625147,625185,98201,98207,ref-t.3.5.2.3.12,ref-t.3.5.2.3.18,28189,28225,4289,4295,ref-sifre-n.17.1.93,ref-sifre-n.17.1.99,ואין מגילתה כשירה להשקות בה סוטה אחרת ,ואין מגלתה כשרה להשקות בה סוטה אחרת ,7,7,251,129,0.05263157894736842,0.052631578947368474,0.05263157894736842
252,ref-t.3.5.2.3.19-ref-t.3.5.2.3.29,ref-sifre-n.17.1.36-ref-sifre-n.17.1.46,625186,625250,98208,98218,ref-t.3.5.2.3.19,ref-t.3.5.2.3.29,27878,27943,4246,4256,ref-sifre-n.17.1.36,ref-sifre-n.17.1.46,נמחקה המגלה ואמרה איני שותה מרערעין אותה ומשקין אותה בעל כרחה ,נמחקה המגלה ואמרה איני שותה מערערים אותה ומשקים אותה בעל כורחה ,11,11,252,127,0.07936507936507936,0.07692307692307687,0.06349206349206349
253,ref-t.3.5.2.3.70-ref-t.3.5.2.3.78,ref-sifre-n.17.1.38-ref-sifre-n.17.1.46,625455,625505,98251,98259,ref-t.3.5.2.3.70,ref-t.3.5.2.3.78,27891,27943,4248,4256,ref-sifre-n.17.1.38,ref-sifre-n.17.1.46,ואמרה איני שותה מרערעין אותה ומשקין אותה על כרחה ,ואמרה איני שותה מערערים אותה ומשקים אותה בעל כורחה ,9,9,253,128,0.11764705882352941,0.1132075471698113,0.09803921568627451
254,ref-t.3.5.2.3.82-ref-t.3.5.2.3.91,ref-sifre-n.8.1.303-ref-sifre-n.8.1.309,625519,625575,98261,98270,ref-t.3.5.2.3.82,ref-t.3.5.2.3.91,19023,19059,2832,2838,ref-sifre-n.8.1.303,ref-sifre-n.8.1.309,שתי קנאות האמורות בפרשת קנאה קנאה אחת היא שמקנא לבעל ,קנאות הוא שתי קנאות כשם שקנאה לבעל ,10,7,254,89,0.49056603773584906,0.4,0.4716981132075472
255,ref-t.3.5.2.3.146-ref-t.3.5.2.3.167,ref-sifre-n.19.1.160-ref-sifre-n.19.1.177,625860,625988,98317,98338,ref-t.3.5.2.3.146,ref-t.3.5.2.3.167,30758,30863,4683,4700,ref-sifre-n.19.1.160,ref-sifre-n.19.1.177,שאם היתה יולדת בצער יולדת בריוח נקבות יולדת זכרים כעורין יולדת נאין שחורין יולדת לבנים קצרין יולדת ארוכין אחד אחד יולדת שניים ,שאם היתה ילדת בצער יולדת בריוח נקבות יולדת זכרים אחד יולדת שנים שחורים יולדת לבנים קצרים יולדת ארוכים ,22,18,255,132,0.25396825396825395,0.2325581395348837,0.24603174603174602
256,ref-t.3.5.3.1.8-ref-t.3.5.3.1.13,ref-sifre-n.106.1.63-ref-sifre-n.106.1.68,627342,627372,98547,98552,ref-t.3.5.3.1.8,ref-t.3.5.3.1.13,145179,145209,22695,22700,ref-sifre-n.106.1.63,ref-sifre-n.106.1.68,שבמדה שאדם מודד בה מודדין לו ,שבמדה שאדם מודד בה מודדים לו ,6,6,256,394,0.034482758620689655,0.06666666666666665,0.034482758620689655
257,ref-t.3.5.3.13.26-ref-t.3.5.3.13.30,ref-sifre-n.84.4.288-ref-sifre-n.84.4.292,630220,630247,99063,99067,ref-t.3.5.3.13.26,ref-t.3.5.3.13.30,115662,115689,17660,17664,ref-sifre-n.84.4.288,ref-sifre-n.84.4.292,מרכבות פרעה וחילו ירה בים ,מרכבות פרעו וחילו ירה בים ,5,5,257,358,0.038461538461538464,0.07407407407407407,0.038461538461538464
258,ref-t.3.5.4.1.4-ref-t.3.5.4.1.11,ref-sifre-n.106.1.63-ref-sifre-n.106.1.68,631994,632036,99379,99386,ref-t.3.5.4.1.4,ref-t.3.5.4.1.11,145179,145209,22695,22700,ref-sifre-n.106.1.63,ref-sifre-n.106.1.68,מדת פורענות שבמדה שאדם מודד בה מודדין לו ,שבמדה שאדם מודד בה מודדים לו ,8,6,258,395,0.3170731707317073,0.33333333333333337,0.3170731707317073
259,ref-t.3.5.4.1.12-ref-t.3.5.4.1.20,ref-sifre-n.8.1.388-ref-sifre-n.8.1.407,632037,632088,99387,99395,ref-t.3.5.4.1.12,ref-t.3.5.4.1.20,19462,19556,2900,2916,ref-sifre-n.8.1.388,ref-sifre-n.8.1.407,מדת הטוב מנין אמרת מרובה מדת הטוב ממדת הפורענות ,מרובה מדת טובה או מדת פורענות הוי אומר מדת טובה אם מדת פורענות מעטה הרי היא מזכרת עון מדה טובה ,9,20,259,93,0.6736842105263158,0.49473684210526314,0.6210526315789474
261,ref-t.3.5.4.1.28-ref-t.3.5.4.1.39,ref-sifre-n.112.2.275-ref-sifre-n.112.2.289,632125,632180,99403,99414,ref-t.3.5.4.1.28,ref-t.3.5.4.1.39,167072,167141,26273,26287,ref-sifre-n.112.2.275,ref-sifre-n.112.2.289,פוקד עון אבות על בנים ועל בני בנים על שלשים ועל רבעים ,"פוקד עון אבות על בנים יכול אף עכו""ם נפקדת על בנים על שלשים ועל רבעים ",12,15,261,497,0.2753623188405797,0.24285714285714288,0.2608695652173913
262,ref-t.3.5.4.1.46-ref-t.3.5.4.1.52,ref-sifre-n.8.1.388-ref-sifre-n.8.1.395,632216,632254,99421,99427,ref-t.3.5.4.1.46,ref-t.3.5.4.1.52,19462,19500,2900,2907,ref-sifre-n.8.1.388,ref-sifre-n.8.1.395,הוי אומ' מרובה מדת הטוב ממדת פורענות ,מרובה מדת טובה או מדת פורענות הוי אומר ,7,8,262,91,0.5897435897435898,0.14634146341463417,0.3333333333333333
264,ref-t.3.5.4.2.127-ref-t.3.5.4.2.133,ref-sifre-n.82.1.63-ref-sifre-n.82.1.71,633215,633255,99581,99587,ref-t.3.5.4.2.127,ref-t.3.5.4.2.133,110568,110613,16822,16829,ref-sifre-n.82.1.63,ref-sifre-n.82.1.71,והולך שנא' וארון ברית ייי נוסע לפניהם ,נלך נירש ארץ ישראל וארון ברית ה' נוסע לפניהם ,7,9,264,348,0.4,0.27083333333333337,0.3333333333333333
265,ref-t.3.5.4.2.127-ref-t.3.5.4.2.133,ref-sifre-n.82.1.87-ref-sifre-n.82.1.95,633215,633255,99581,99587,ref-t.3.5.4.2.127,ref-t.3.5.4.2.133,110696,110742,16845,16852,ref-sifre-n.82.1.87,ref-sifre-n.82.1.95,והולך שנא' וארון ברית ייי נוסע לפניהם ,ונלך ונירש את א'י וארון ברית ה' נוסע לפניהם ,7,9,265,349,0.3181818181818182,0.1777777777777778,0.2727272727272727
266,ref-t.3.5.4.2.128-ref-t.3.5.4.2.133,ref-sifre-n.82.1.118-ref-sifre-n.82.1.123,633222,633255,99582,99587,ref-t.3.5.4.2.128,ref-t.3.5.4.2.133,110851,110882,16873,16878,ref-sifre-n.82.1.118,ref-sifre-n.82.1.123,שנא' וארון ברית ייי נוסע לפניהם ,או' וארון ברית יי' נוסע לפניהם ,6,6,266,352,0.125,0.1470588235294118,0.09375
267,ref-t.3.5.4.3.22-ref-t.3.5.4.3.75,ref-sifre-n.89.1.187-ref-sifre-n.89.1.232,633523,633781,99636,99685,ref-t.3.5.4.3.22,ref-t.3.5.4.3.75,125231,125464,19309,19350,ref-sifre-n.89.1.187,ref-sifre-n.89.1.232,לשד השמן כיוצא מן הדד שמן מה דד זה עיקר לתינוק והכל טפל לו כך היה המן עיקר לישראל והכל טפל לו כך היה המן עיקר לישראל והכל טפל להם דבר אחר מה הדד הזה אפי' תינוק יונק הימנו כל היום אינו מזיקו כך נעשה המן שאפי' ישראל אוכלין אותו כל היום כולו אין ,"אותו ד""א והיה טעמו כטעם לשד השמן מה הדד הזה לתינוק עיקר והכל טפילה לו כך היה המן עיקר לישראל והכל טפילה להם ד""א מה הדד הזה אפילו תינוק יונק הימנו כל היום כולו אינו מזיקו כך המן אפילו ישראל אוכלים מהם כל היום כולו אינו ",54,46,267,374,0.37037037037037035,0.18503937007874016,0.2757201646090535
269,ref-t.3.5.4.3.28-ref-t.3.5.4.3.52,ref-sifre-n.89.1.263-ref-sifre-n.89.1.274,633553,633671,99642,99666,ref-t.3.5.4.3.28,ref-t.3.5.4.3.52,125620,125681,19380,19391,ref-sifre-n.89.1.263,ref-sifre-n.89.1.274,מה דד זה עיקר לתינוק והכל טפל לו כך היה המן עיקר לישראל והכל טפל לו כך היה המן עיקר לישראל והכל טפל להם דבר אחר ,"ד""א מה הדד הזה תינוק ומצטער בשעה שפורש ממנו כך היו ישראל ",26,12,269,377,0.7232142857142857,0.5677966101694916,0.6517857142857143
270,ref-t.3.5.4.3.36-ref-t.3.5.4.3.56,ref-sifre-n.89.1.234-ref-sifre-n.89.1.249,633588,633684,99650,99669,ref-t.3.5.4.3.36,ref-t.3.5.4.3.56,125471,125552,19352,19367,ref-sifre-n.89.1.234,ref-sifre-n.89.1.249,כך היה המן עיקר לישראל והכל טפל לו כך היה המן עיקר לישראל והכל טפל להם דבר אחר מה הדד הזה ,"ד""א מה הדד הזה שהוא מין אחד ומשתנה למינים הרבה כך היה המן משתנה להם לישראל ",21,16,270,376,0.7333333333333333,0.41346153846153844,0.5888888888888889
272,ref-t.3.5.4.3.156-ref-t.3.5.4.3.168,ref-sifre-n.97.1.24-ref-sifre-n.97.1.34,634175,634234,99748,99760,ref-t.3.5.4.3.156,ref-t.3.5.4.3.168,134394,134447,20878,20888,ref-sifre-n.97.1.24,ref-sifre-n.97.1.34,ויטש אל המחנה כדרך יום כה ודיי מה ת'ל שוב וכדרך יום כה ,ויטוש על המחנה כדרך יום כה כלפי צפון וכדרך יום כה ,13,11,272,387,0.2545454545454545,0.2786885245901639,0.23636363636363636
274,ref-t.3.5.4.3.159-ref-t.3.5.4.3.171,ref-sifre-n.97.1.36-ref-sifre-n.97.1.56,634191,634251,99751,99763,ref-t.3.5.4.3.159,ref-t.3.5.4.3.171,134453,134563,20890,20905,ref-sifre-n.97.1.36,ref-sifre-n.97.1.56,כדרך יום כה ודיי מה ת'ל שוב וכדרך יום כה מלמד שהיתה עולה ,דרום ר' שמעון אומר כדרך יום כה מלמעלן וכדרך יום כה מלמטן וכאמתים על פני כל הארץ מלמד שהיתה פורחת ועולה ,13,21,274,389,0.6019417475728155,0.46153846153846156,0.5728155339805825
275,ref-t.3.5.4.7.8-ref-t.3.5.4.7.17,ref-sifre-n.106.1.135-ref-sifre-n.106.1.144,636413,636465,100141,100147,ref-t.3.5.4.7.8,ref-t.3.5.4.7.17,145552,145606,22764,22772,ref-sifre-n.106.1.135,ref-sifre-n.106.1.144,נתעסק בו אלא המקום ברוך הוא שנ' ויקבור אותו בגיא ,"נתעסק בו אלא הקב""ה שנאמר דברים לד ויקבור אותו בגיא ",10,10,275,396,0.3333333333333333,0.2142857142857143,0.2549019607843137
276,ref-t.3.5.4.7.23-ref-t.3.5.4.7.32,ref-sifre-n.106.1.210-ref-sifre-n.106.1.219,636494,636545,100153,100162,ref-t.3.5.4.7.23,ref-t.3.5.4.7.32,145918,145966,22833,22842,ref-sifre-n.106.1.210,ref-sifre-n.106.1.219,של שכינה כארבעת מילין מחלקו של ראובן לחלקו של גד ,"של הקב""ה ארבעת מיל מחלקו של ראובן לחלקו של גד ",10,10,276,400,0.14285714285714285,0.2075471698113207,0.14285714285714285
277,ref-t.3.5.4.7.34-ref-t.3.5.4.7.52,ref-sifre-n.106.1.181-ref-sifre-n.106.1.187,636551,636642,100164,100182,ref-t.3.5.4.7.34,ref-t.3.5.4.7.52,145784,145816,22805,22811,ref-sifre-n.106.1.181,ref-sifre-n.106.1.187,בתוך שדה נחלתו של ראובן ונקבר בתוך שדה נחלתו של גד מניין שמת בתוך שדה נחלתו של ראובן שנ' ,נקבר אלא בתוך נחלתו של גד שנאמר ,19,7,277,399,0.7078651685393258,0.6555555555555556,0.7078651685393258
280,ref-t.3.5.4.7.53-ref-t.3.5.4.7.67,ref-sifre-n.134.4.5-ref-sifre-n.134.4.16,636643,636712,100183,100197,ref-t.3.5.4.7.53,ref-t.3.5.4.7.67,241954,242007,38393,38404,ref-sifre-n.134.4.5,ref-sifre-n.134.4.16,עלה אל הר העברים הזה הר נבו ואין נבו אלא נחלתו של ראובן שנ' ובני ,עלה אל הר העברים הזה הר נבו זו נחלה בני ראובן ובני ,15,12,280,792,0.3076923076923077,0.26865671641791045,0.2923076923076923
281,ref-t.3.5.4.7.93-ref-t.3.5.4.8.11,ref-sifre-n.106.1.217-ref-sifre-n.106.1.232,636835,636915,100223,100236,ref-t.3.5.4.7.93,ref-t.3.5.4.8.11,145954,146038,22840,22855,ref-sifre-n.106.1.217,ref-sifre-n.106.1.232,חלקת מחוקק ספון ומלאכי השרת סופדין ואומ' לפניו צדקת ייי עשה ומשפטיו עם ישראל ,לחלקו של גד ומלאכי השרת מקלסים אותו ואומר דברים לג צדקת ה' עשה ומשפטיו עם ישראל ,14,16,281,401,0.4,0.31182795698924726,0.3125
282,ref-t.3.5.4.11.16-ref-t.3.5.4.11.30,ref-sifre-n.18.1.57-ref-sifre-n.18.1.72,637339,637419,100306,100318,ref-t.3.5.4.11.16,ref-t.3.5.4.11.30,29097,29191,4434,4446,ref-sifre-n.18.1.57,ref-sifre-n.18.1.72,תחלה והשאר לא פלטו שנ' ואת האנשים אשר פתח הבית הכו וגו' פרעה התחיל בעביר' ,התחילה הפורענות כיוצא בו אתה אומר ואת האנשים אשר פתח הבית הכו בסנורים מי שהתחיל בעבירה ,15,16,282,131,0.39080459770114945,0.32291666666666663,0.3563218390804598
284,ref-t.3.5.5.4.23-ref-t.3.5.5.4.28,ref-sifre-n.8.1.475-ref-sifre-n.8.1.480,639116,639154,100611,100616,ref-t.3.5.5.4.23,ref-t.3.5.5.4.28,19880,19912,2978,2983,ref-sifre-n.8.1.475,ref-sifre-n.8.1.480,שנ' ונקתה ונזרעה זרע בראויה להזריע ,שנאמר ונקתה ונזרעה זרע מה זרע ,6,6,284,95,0.3142857142857143,0.2432432432432432,0.2571428571428571
285,ref-t.3.5.5.4.24-ref-t.3.5.5.4.33,ref-sifre-n.19.1.180-ref-sifre-n.19.1.191,639121,639181,100612,100621,ref-t.3.5.5.4.24,ref-t.3.5.5.4.33,30872,30946,4702,4711,ref-sifre-n.19.1.180,ref-sifre-n.19.1.191,ונקתה ונזרעה זרע בראויה להזריע יצאת זו שאין ראויה להזריע ,ונקתה ונזרעה זרע להוציא את האיילונית שאינה ראויה לילד דבר אחר ונזרעה ,10,12,285,133,0.5217391304347826,0.273972602739726,0.4057971014492754
286,ref-t.3.5.5.8.36-ref-t.3.5.5.8.43,ref-sifre-n.1.7.87-ref-sifre-n.1.7.96,639846,639887,100728,100734,ref-t.3.5.5.8.36,ref-t.3.5.5.8.43,4664,4715,655,663,ref-sifre-n.1.7.87,ref-sifre-n.1.7.96,נטמאת שנים אומ' נטמאת ואחד אומ' לא נטמאת ,טומאתם ואומר ולא יטמאו את מחניהם א אומר ולא תטמא ,8,10,286,25,0.5510204081632653,0.3928571428571429,0.42857142857142855
287,ref-t.3.5.5.9.115-ref-t.3.5.5.9.121,ref-sifre-n.7.1.4-ref-sifre-n.7.1.23,640496,640528,100842,100848,ref-t.3.5.5.9.115,ref-t.3.5.5.9.121,13635,13729,1985,1999,ref-sifre-n.7.1.4,ref-sifre-n.7.1.23,שנ' כי יקח איש אשה ובעלה וגו' ,ואמרת אליהם איש איש כי תשטה אשתו למה נאמרה פרשה זו לפי שהוא אומר כי יקח איש אשה ובעלה וגומר ,7,20,287,46,0.6956521739130435,0.7021276595744681,0.6956521739130435
288,ref-t.3.5.6.1.42-ref-t.3.5.6.1.58,ref-sifre-n.14.1.84-ref-sifre-n.14.1.97,642705,642794,101224,101240,ref-t.3.5.6.1.42,ref-t.3.5.6.1.58,25157,25226,3823,3836,ref-sifre-n.14.1.84,ref-sifre-n.14.1.97,אלים באברהם ונאמ' ירא אלים באיוב מה ירא אלים אשר באברהם מאהבה עשה אף ירא אלים האמור ,אלה ונאמר להלן אלה מה אלה האמורה כאן עשה שבועה כאלה אף אלה האמורה ,17,14,288,115,0.5952380952380952,0.48484848484848486,0.4880952380952381
290,ref-t.3.5.6.7.4-ref-t.3.5.6.7.12,ref-sifre-n.95.1.31-ref-sifre-n.95.1.52,645819,645863,101744,101752,ref-t.3.5.6.7.4,ref-t.3.5.6.7.12,131612,131720,20388,20407,ref-sifre-n.95.1.31,ref-sifre-n.95.1.52,הצאן ובקר ישחט להם ומצ' להם וכי מספיק להם ,הצאן ובקר ישחט להם ומצא להם אפילו אתה מכניס להם כל צאן ובקר ספיקין הן להן ואני אומר וכי מפני שאין להם ,9,22,290,383,0.6078431372549019,0.6019417475728155,0.6078431372549019
291,ref-t.3.5.6.7.141-ref-t.3.5.6.7.169,ref-sifre-n.95.1.133-ref-sifre-n.95.1.157,646498,646648,101868,101893,ref-t.3.5.6.7.141,ref-t.3.5.6.7.169,132157,132287,20485,20509,ref-sifre-n.95.1.133,ref-sifre-n.95.1.157,"אמר משה לפני הק""בה רבונו של עולם כך הגון להם שתתן להם ותמיתם אומרי' לאדם טול ככר ורד לשאול אומרי' לחמור טול כור שעורין ונחתוך את ראשו יהיו אומרי' ",אמר משה לפני המקום אדני כלום הגון להם שתתן להם ותהרגם אומרים לחמור טול כור של חטים ונחתוך ראשך אומרים לאדם טול ככר ורד לשאול ,29,25,291,384,0.4931506849315068,0.24025974025974028,0.410958904109589
292,ref-t.3.5.7.4.21-ref-t.3.5.7.4.28,ref-sifre-n.12.1.26-ref-sifre-n.12.1.34,650025,650079,102470,102477,ref-t.3.5.7.4.21,ref-t.3.5.7.4.28,23399,23451,3550,3557,ref-sifre-n.12.1.26,ref-sifre-n.12.1.34,האלה משביעו אותו בשבועה האמורה בתורה שנ' ואשביעך ,האמורה כאן היא נשבעת מאליה תלמוד לומר והשביע אותה ,8,9,292,111,0.7,0.35,0.52
293,ref-t.3.5.7.17.56-ref-t.3.5.7.17.62,ref-sifre-n.139.2.44-ref-sifre-n.139.2.52,653263,653297,103019,103025,ref-t.3.5.7.17.56,ref-t.3.5.7.17.62,250290,250337,39827,39835,ref-sifre-n.139.2.44,ref-sifre-n.139.2.52,שנ' וישלח אתם משה אלף למטה לצבא ,שנאמר במדבר לא וישלח אותם משה אלף למטה לצבא ,7,9,293,793,0.29545454545454547,0.3111111111111111,0.29545454545454547
294,ref-t.3.5.7.17.57-ref-t.3.5.7.17.66,ref-sifre-n.157.4.1-ref-sifre-n.157.4.10,653268,653317,103020,103029,ref-t.3.5.7.17.57,ref-t.3.5.7.17.66,278388,278438,44361,44370,ref-sifre-n.157.4.1,ref-sifre-n.157.4.10,וישלח אתם משה אלף למטה לצבא אתם ואת פינחס מגיד ,וישלח אותם משה אלף למטה לצבא אותם ואת פנחס מגיד ,10,10,294,894,0.0625,0.061224489795918324,0.041666666666666664
295,ref-t.3.5.7.17.70-ref-t.3.5.7.17.78,ref-sifre-n.157.4.40-ref-sifre-n.157.4.50,653336,653382,103033,103041,ref-t.3.5.7.17.70,ref-t.3.5.7.17.78,278595,278654,44399,44409,ref-sifre-n.157.4.40,ref-sifre-n.157.4.50,וכלי הקדש זה ארון שנ' ולא יבאו לראות כבלע ,וכלי הקודש זה ארון שנאמר במדבר ד ולא יבואו לראות כבלע ,9,11,295,895,0.24074074074074073,0.2545454545454545,0.24074074074074073
296,ref-t.3.5.7.18.22-ref-t.3.5.7.18.51,ref-sifre-n.82.1.94-ref-sifre-n.82.1.113,653549,653705,103070,103098,ref-t.3.5.7.18.22,ref-t.3.5.7.18.51,110731,110833,16851,16870,ref-sifre-n.82.1.94,ref-sifre-n.82.1.113,היה בו ספר תורה שנאמ' וארון ברית ייי נסע לפניהם וגו' וזה ששרוי עמהן במחנה זה שהיו בו לוחות ושברי לוחות שנ' וארון ברית ייי ומשה לא משו מקרב המחנה ,נוסע לפניהם ארון זה שיצא עמהם במחנה היו בו שכרי לוחות שנאמר וארון ברית ה' ומשה לא משו מקרב המחנה ,30,20,296,351,0.43448275862068964,0.37583892617449666,0.41379310344827586
297,ref-t.3.5.7.18.26-ref-t.3.5.7.18.31,ref-sifre-n.82.1.118-ref-sifre-n.82.1.123,653565,653598,103073,103078,ref-t.3.5.7.18.26,ref-t.3.5.7.18.31,110851,110882,16873,16878,ref-sifre-n.82.1.118,ref-sifre-n.82.1.123,שנאמ' וארון ברית ייי נסע לפניהם ,או' וארון ברית יי' נוסע לפניהם ,6,6,297,353,0.15625,0.19999999999999996,0.125
299,ref-t.3.5.7.22.82-ref-t.3.5.7.22.91,ref-sifre-n.10.1.196-ref-sifre-n.10.1.205,655867,655914,103463,103472,ref-t.3.5.7.22.82,ref-t.3.5.7.22.91,21749,21797,3269,3278,ref-sifre-n.10.1.196,ref-sifre-n.10.1.205,נאמ' כאן אחר ונאמ' להלן אחר מה אחר שנאמ' להלן ,נאמר כאן עפר ונאמר להלן עפר מה עפר האמורה להלן ,10,10,299,98,0.2765957446808511,0.39655172413793105,0.2553191489361702
300,ref-t.3.5.7.22.82-ref-t.3.5.7.22.91,ref-sifre-n.116.1.236-ref-sifre-n.116.1.250,655867,655914,103463,103472,ref-t.3.5.7.22.82,ref-t.3.5.7.22.91,179116,179191,28281,28293,ref-sifre-n.116.1.236,ref-sifre-n.116.1.250,נאמ' כאן אחר ונאמ' להלן אחר מה אחר שנאמ' להלן ,ונאמר להלן אתך מה אתך האמור להלן כאן בלוים הכתוב מדבר אף אתך האמור כאן ,10,15,300,516,0.647887323943662,0.5375,0.6197183098591549
