,baseOrig,compOrig,baseCharStart,baseCharEnd,baseWdStart,baseWdEnd,baseRefStart,baseRefEnd,compCharStart,compCharEnd,compWdStart,compWdEnd,compRefStart,compRefEnd,baseStr,compStr,bRange,cRange,baseOrder,compOrder,dam-lev,jac
1129,ref-sifre-n.39.1.199-ref-sifre-n.39.1.216,ref-b.3.05.38a.104-ref-b.3.05.38a.110,63404,63504,9149,9162,ref-sifre-n.39.1.199,ref-sifre-n.39.1.216,3910353,3910401,570045,570051,ref-b.3.5.38a.104,ref-b.3.5.38a.110,בנשיאת כפים אף בניו בנשיאת כפים כה תברכו את בני ישראל בשם המפורש אתה אומר בשם המפורש או אינו אלא ,בנשיאות כפים אתה אומר בנשיאות כפים או אינו אלא ,20,9,555,1129,0.6082474226804123,0.5454545454545454
1131,ref-sifre-n.39.1.139-ref-sifre-n.39.1.200,ref-b.3.05.38a.104-ref-b.3.05.38a.178,63106,63416,9099,9150,ref-sifre-n.39.1.139,ref-sifre-n.39.1.200,3910353,3910731,570045,570099,ref-b.3.5.38a.104,ref-b.3.5.38a.178,"בנשיאת כפים אתה אומר בנשיאת כפים או בנשיאת כפים ושלא בנשיאת כפים תלמוד לומר וישא אהרן את ידיו אל העם ויברכם מה אהרן בנשיאת כפים אף בניו בנשיאת כפים ר' יונתן אומר או מה להלן ראש חודש וקרבן צבור וכ""ג אף כאן ראש חודש וקרבן צבור וכ""ג תלמוד לומר כי בו בחר ה' אלהיך וגו' מקיש בניו לו מה הוא בנשיאת כפים ",בנשיאות כפים אתה אומר בנשיאות כפים או אינו אלא שלא בנשיאות כפים נאמר כאן כה תברכו ונאמר להלן וישא אהרן את ידיו אל העם ויברכם מה להלן בנשיאות כפים אף כאן בנשיאות כפים קשיא ליה לר' יונתן אי מה להלן כהן גדול וראש חודש ועבודת צבור אף כאן כהן גדול וראש חודש ועבודת ציבור ר' נתן אומר אינו צריך הרי הוא אומר הוא ובניו כל הימים מקיש בניו לו מה הוא בנשיאות כפים אף בניו ,62,75,552,1131,0.38227146814404434,0.5
1132,ref-sifre-n.39.1.72-ref-sifre-n.39.1.97,ref-b.3.05.38a.106-ref-b.3.05.38a.130,62749,62888,9044,9065,ref-sifre-n.39.1.72,ref-sifre-n.39.1.97,3910367,3910493,570047,570068,ref-b.3.5.38a.106,ref-b.3.5.38a.130,אתה אומר בעמידה או אינו אלא בעמידה ושלא בעמידה תלמוד לומר ואלה יעמדו לברך את ישראל נאמר כאן ברכה ונאמר להלן ברכה מה ברכה האמורה להלן ,אתה אומר בנשיאות כפים או אינו אלא שלא בנשיאות כפים נאמר כאן כה תברכו ונאמר להלן וישא אהרן את ידיו אל העם ויברכם מה להלן ,26,25,541,1132,0.5864661654135338,0.65
1133,ref-sifre-n.39.1.132-ref-sifre-n.39.1.203,ref-b.3.05.38a.122-ref-b.3.05.38a.179,63071,63432,9096,9153,ref-sifre-n.39.1.132,ref-sifre-n.39.1.203,3910451,3910740,570061,570100,ref-b.3.5.38a.122,ref-b.3.5.38a.179,"ברכה בעמידה כה תברכו את בני ישראל בנשיאת כפים אתה אומר בנשיאת כפים או בנשיאת כפים ושלא בנשיאת כפים תלמוד לומר וישא אהרן את ידיו אל העם ויברכם מה אהרן בנשיאת כפים אף בניו בנשיאת כפים ר' יונתן אומר או מה להלן ראש חודש וקרבן צבור וכ""ג אף כאן ראש חודש וקרבן צבור וכ""ג תלמוד לומר כי בו בחר ה' אלהיך וגו' מקיש בניו לו מה הוא בנשיאת כפים אף בניו בנשיאת ",וישא אהרן את ידיו אל העם ויברכם מה להלן בנשיאות כפים אף כאן בנשיאות כפים קשיא ליה לר' יונתן אי מה להלן כהן גדול וראש חודש ועבודת צבור אף כאן כהן גדול וראש חודש ועבודת ציבור ר' נתן אומר אינו צריך הרי הוא אומר הוא ובניו כל הימים מקיש בניו לו מה הוא בנשיאות כפים אף בניו בנשיאות ,72,58,550,1133,0.5578034682080925,0.5526315789473684
1134,ref-sifre-n.39.1.210-ref-sifre-n.39.1.224,ref-b.3.05.38a.194-ref-b.3.05.38a.207,63460,63535,9156,9166,ref-sifre-n.39.1.210,ref-sifre-n.39.1.224,3910818,3910887,570110,570120,ref-b.3.5.38a.194,ref-b.3.5.38a.207,בשם המפורש אתה אומר בשם המפורש או אינו אלא בכנוי תלמוד לומר ושמו את שמי ,"בשם המפורש אתה אומר בשם המפורש או אינו אלא בכינוי ת""ל ושמו את שמי ",15,14,556,1134,0.125,0.2222222222222222
1135,ref-sifre-n.43.1.14-ref-sifre-n.43.1.28,ref-b.3.05.38a.194-ref-b.3.05.38a.207,72636,72712,10600,10610,ref-sifre-n.43.1.14,ref-sifre-n.43.1.28,3910818,3910887,570110,570120,ref-b.3.5.38a.194,ref-b.3.5.38a.207,בשם המפורש אתה אומר בשם המפורש או אינו אלא בכינוי תלמוד לומר ושמו את שמי ,"בשם המפורש אתה אומר בשם המפורש או אינו אלא בכינוי ת""ל ושמו את שמי ",15,14,654,1135,0.1095890410958904,0.2222222222222222
1137,ref-sifre-n.29.1.147-ref-sifre-n.29.1.159,ref-b.3.05.38a.204-ref-b.3.05.38a.227,48850,48920,7298,7309,ref-sifre-n.29.1.147,ref-sifre-n.29.1.159,3910871,3910980,570118,570138,ref-b.3.5.38a.204,ref-b.3.5.38a.227,תלמוד לומר שמיני נאמר כאן שמיני ונאמר להלן שמיני מה שמיני האמור להלן ,"ת""ל ושמו את שמי שמי המיוחד לי יכול אף בגבולין כן נאמר כאן ושמו את שמי ונאמר להלן לשום את שמו שם מה להלן ",13,24,385,1137,0.5865384615384616,0.6923076923076923
1139,ref-sifre-n.133.4.14-ref-sifre-n.133.4.30,ref-b.3.05.38a.212-ref-b.3.05.38a.227,239003,239079,37906,37922,ref-sifre-n.133.4.14,ref-sifre-n.133.4.30,3910908,3910980,570125,570138,ref-b.3.5.38a.212,ref-b.3.5.38a.227,להלן דברים כה שם מה שם האמור להלן נחלה אף שם האמור כאן נחלה ומה שם האמור ,אף בגבולין כן נאמר כאן ושמו את שמי ונאמר להלן לשום את שמו שם מה להלן ,17,16,1874,1139,0.7123287671232876,0.5454545454545454
1140,ref-sifre-n.10.1.196-ref-sifre-n.10.1.206,ref-b.3.05.38a.215-ref-b.3.05.38a.231,21749,21801,3269,3279,ref-sifre-n.10.1.196,ref-sifre-n.10.1.206,3910923,3910999,570128,570141,ref-b.3.5.38a.215,ref-b.3.5.38a.231,נאמר כאן עפר ונאמר להלן עפר מה עפר האמורה להלן כאן ,נאמר כאן ושמו את שמי ונאמר להלן לשום את שמו שם מה להלן בית הבחירה אף כאן ,11,17,174,1140,0.5342465753424658,0.5555555555555556
1141,ref-sifre-n.121.1.383-ref-sifre-n.121.1.396,ref-b.3.05.38a.215-ref-b.3.05.38a.231,203829,203894,32202,32215,ref-sifre-n.121.1.383,ref-sifre-n.121.1.396,3910923,3910999,570128,570141,ref-b.3.5.38a.215,ref-b.3.5.38a.231,נאמר כאן מלאה ונאמר להלן דברים כב מלאה מה להלן שהיא עולה אף כאן ,נאמר כאן ושמו את שמי ונאמר להלן לשום את שמו שם מה להלן בית הבחירה אף כאן ,14,17,1574,1141,0.3835616438356164,0.6153846153846154
1142,ref-sifre-n.127.5.22-ref-sifre-n.127.5.38,ref-b.3.05.38a.215-ref-b.3.05.38a.231,224231,224307,35430,35444,ref-sifre-n.127.5.22,ref-sifre-n.127.5.38,3910923,3910999,570128,570141,ref-b.3.5.38a.215,ref-b.3.5.38a.231,נאמר כאן עפר ונאמר להלן במדבר ה עפר מה עפר האמור להלן על פני המים אף כאן ,נאמר כאן ושמו את שמי ונאמר להלן לשום את שמו שם מה להלן בית הבחירה אף כאן ,17,17,1748,1142,0.547945205479452,0.6153846153846154
1143,ref-sifre-n.39.1.241-ref-sifre-n.39.1.260,ref-b.3.05.38a.242-ref-b.3.05.38a.268,63618,63713,9175,9191,ref-sifre-n.39.1.241,ref-sifre-n.39.1.260,3911052,3911183,570145,570165,ref-b.3.5.38a.242,ref-b.3.5.38a.268,בכל המקום אשר אזכיר את שמי זה מקרא מסורס בכל מקום שאני נגלה עליך שם תהיה מזכיר את שמי היכן ,"בכל המקום אשר אזכיר את שמי אבוא אליך בכל מקום ס""ד אלא מקרא זה מסורס הוא בכל מקום אשר אבוא אליך וברכתיך שם אזכיר את שמי והיכן ",20,27,557,1143,0.416,0.42105263157894735
1144,ref-sifre-n.39.1.333-ref-sifre-n.39.1.354,ref-b.3.05.38a.297-ref-b.3.05.38a.307,64081,64186,9247,9261,ref-sifre-n.39.1.333,ref-sifre-n.39.1.354,3911332,3911386,570185,570193,ref-b.3.5.38a.297,ref-b.3.5.38a.307,פנים כנגד פנים כה תברכו את בני ישראל שיהיה כל הקהל שומע או בינו לבין עצמו תלמוד לומר אמור להם שיהיה כל ,"ת""ל אמור להם לכולהו תניא אידך כה תברכו פנים כנגד פנים ",22,11,562,1144,0.7572815533980582,0.736842105263158
1145,ref-sifre-n.39.1.319-ref-sifre-n.39.1.332,ref-b.3.05.38a.297-ref-b.3.05.38a.312,64015,64080,9234,9246,ref-sifre-n.39.1.319,ref-sifre-n.39.1.332,3911332,3911410,570185,570198,ref-b.3.5.38a.297,ref-b.3.5.38a.312,פנים אתה אומר פנים כנגד פנים או מול כנגד פנים תלמוד לומר אמור להם ,"ת""ל אמור להם לכולהו תניא אידך כה תברכו פנים כנגד פנים אתה אומר פנים כנגד פנים ",14,16,561,1145,0.6282051282051282,0.5833333333333333
1147,ref-sifre-n.43.1.42-ref-sifre-n.43.1.71,ref-b.3.05.38b.9-ref-b.3.05.38b.34,72786,72964,10620,10644,ref-sifre-n.43.1.42,ref-sifre-n.43.1.71,3911807,3911945,570256,570275,ref-b.3.5.38b.9,ref-b.3.5.38b.34,תברכו אין לי אלא ברכה לישראל ברכה לכהנים מנין תלמוד לומר ואני אברכם ואני אברכם שלא יהיו ישראל אומרים ברכותיהם תלויות בכהניהם תלמוד לומר ואני אברכם שלא יהיו הכהנים אומרים ,לברכת כהנים שנאמר ושמו את שמי על בני ישראל ואני אברכם ואמר רבי יהושע בן לוי כל כהן שמברך מתברך ושאינו מברך אין מתברך שנאמר ואברכה ,30,26,657,1147,0.6529411764705882,0.7391304347826086
1149,ref-sifre-n.39.1.153-ref-sifre-n.39.1.159,ref-b.3.05.38b.89-ref-b.3.05.38b.95,63187,63221,9112,9117,ref-sifre-n.39.1.153,ref-sifre-n.39.1.159,3912207,3912241,570308,570313,ref-b.3.5.38b.89,ref-b.3.5.38b.95,וישא אהרן את ידיו אל העם ויברכם ,וישא אהרן את ידיו אל העם ויברכם ,7,7,554,1149,0.0,0.0
1150,ref-sifre-n.157.4.1-ref-sifre-n.157.4.8,ref-b.3.05.42b.467-ref-b.3.05.42b.474,278388,278428,44361,44368,ref-sifre-n.157.4.1,ref-sifre-n.157.4.8,3927604,3927644,572612,572619,ref-b.3.5.42b.467,ref-b.3.5.42b.474,וישלח אותם משה אלף למטה לצבא אותם ואת ,וישלח אותם משה אלף למטה לצבא אותם ואת ,8,8,2204,1150,0.0,0.0
1151,ref-sifre-n.157.4.31-ref-sifre-n.157.4.39,ref-b.3.05.42b.502-ref-b.3.05.42b.509,278542,278594,44390,44398,ref-sifre-n.157.4.31,ref-sifre-n.157.4.39,3927797,3927839,572647,572654,ref-b.3.5.42b.502,ref-b.3.5.42b.509,אבי אמו שנאמר בראשית לז והמדנים מכרו אותו למצרים ,אבי אמו שנאמר והמדנים מכרו אותו אל מצרים ,9,8,2205,1151,0.24489795918367346,0.4545454545454546
1152,ref-sifre-n.119.5.399-ref-sifre-n.119.5.410,ref-b.3.05.43a.174-ref-b.3.05.43a.206,200532,200588,31693,31701,ref-sifre-n.119.5.399,ref-sifre-n.119.5.410,3928775,3928941,572806,572829,ref-b.3.5.43a.174,ref-b.3.5.43a.206,"אין לי אלא בפני הבית שלא בפני הבית מנין ת""ל לנחלה מה ","בית אין לי אלא בית מנין לרבות בית התבן ובית הבקר ובית העצים ובית האוצרות ת""ל אשר בנה מכל מקום יכול שאני מרבה אף הבונה בית שער אכסדרה ומרפסת תלמוד לומר בית מה ",12,33,1532,1152,0.740506329113924,0.8333333333333334
1153,ref-sifre-n.62.1.31-ref-sifre-n.62.1.37,ref-b.3.05.46a.10-ref-b.3.05.46a.19,87146,87187,12994,13000,ref-sifre-n.62.1.31,ref-sifre-n.62.1.37,3940770,3940822,574447,574456,ref-b.3.5.46a.10,ref-b.3.5.46a.19,שנים פוסלים בלוים ואין מומים פוסלים בהם ,שאין השנים פוסלות בה מום פוסל בה עגלה ששנים פוסלות ,7,10,746,1153,0.6274509803921569,0.5714285714285714
1154,ref-sifre-n.123.1.544-ref-sifre-n.123.1.560,ref-b.3.05.46a.10-ref-b.3.05.46a.26,207933,208009,32830,32840,ref-sifre-n.123.1.544,ref-sifre-n.123.1.560,3940770,3940851,574447,574461,ref-b.3.5.46a.10,ref-b.3.5.46a.26,שאין המום פוסל בה עול פסל בה פרה שהמום פוסל בה אינו דין שיהא העול פוסל בה ,שאין השנים פוסלות בה מום פוסל בה עגלה ששנים פוסלות בה אינו דין שיהא מום פוסל בה ,17,17,1616,1154,0.2375,0.6666666666666667
1156,ref-sifre-n.63.1.77-ref-sifre-n.63.1.83,ref-b.3.05.46a.11-ref-b.3.05.46a.24,87782,87816,13094,13100,ref-sifre-n.63.1.77,ref-sifre-n.63.1.83,3940776,3940843,574448,574459,ref-b.3.5.46a.11,ref-b.3.5.46a.24,פסל מומים פסל שנים כאן שפסל מומים ,השנים פוסלות בה מום פוסל בה עגלה ששנים פוסלות בה אינו דין שיהא מום ,7,14,760,1156,0.6567164179104478,0.5555555555555556
1157,ref-sifre-n.123.1.428-ref-sifre-n.123.1.443,ref-b.3.05.46a.99-ref-b.3.05.46a.113,207369,207453,32748,32760,ref-sifre-n.123.1.428,ref-sifre-n.123.1.443,3941205,3941278,574518,574532,ref-b.3.5.46a.99,ref-b.3.5.46a.113,ומה מוקדשים שאין מלאכה פוסלת בהם מום פוסל בהם עגלה ערופה שמלאכה פוסלת בה אינו דין ,ומה עגלה שאין מום פוסל בה עבודה פוסלת בה קדשים שמום פוסלת בהן אינו דין ,16,15,1607,1157,0.4146341463414634,0.3846153846153846
1158,ref-sifre-n.123.1.543-ref-sifre-n.123.1.570,ref-b.3.05.46a.100-ref-b.3.05.46a.116,207928,208063,32829,32848,ref-sifre-n.123.1.543,ref-sifre-n.123.1.570,3941210,3941296,574519,574535,ref-b.3.5.46a.100,ref-b.3.5.46a.116,עגלה שאין המום פוסל בה עול פסל בה פרה שהמום פוסל בה אינו דין שיהא העול פוסל בה הרי מוקדשים יוכיחו שהמום פוסל בהם ואין עול פוסל בהם ,עגלה שאין מום פוסל בה עבודה פוסלת בה קדשים שמום פוסלת בהן אינו דין שעבודה פוסלת בהן ,28,17,1615,1158,0.5267175572519084,0.5
1159,ref-sifre-n.62.1.32-ref-sifre-n.62.1.38,ref-b.3.05.46a.101-ref-b.3.05.46a.111,87151,87193,12995,13001,ref-sifre-n.62.1.32,ref-sifre-n.62.1.38,3941215,3941269,574520,574530,ref-b.3.5.46a.101,ref-b.3.5.46a.111,פוסלים בלוים ואין מומים פוסלים בהם ומבן ,שאין מום פוסל בה עבודה פוסלת בה קדשים שמום פוסלת בהן ,7,11,747,1159,0.6792452830188679,0.8
1161,ref-sifre-n.63.1.78-ref-sifre-n.63.1.86,ref-b.3.05.46a.102-ref-b.3.05.46a.115,87786,87833,13095,13103,ref-sifre-n.63.1.78,ref-sifre-n.63.1.86,3941221,3941292,574521,574534,ref-b.3.5.46a.102,ref-b.3.5.46a.115,מומים פסל שנים כאן שפסל מומים אינו דין שיפסול ,מום פוסל בה עבודה פוסלת בה קדשים שמום פוסלת בהן אינו דין שעבודה פוסלת ,9,14,763,1161,0.6142857142857143,0.6363636363636364
1164,ref-sifre-n.123.1.583-ref-sifre-n.123.1.597,ref-b.3.05.46a.106-ref-b.3.05.46a.116,208120,208200,32856,32868,ref-sifre-n.123.1.583,ref-sifre-n.123.1.597,3941239,3941296,574525,574535,ref-b.3.5.46a.106,ref-b.3.5.46a.116,פוסל בה לא אם אמרת במוקדשים שאין נפסלים בשחור ובלבן לפיכך אין העול פוסל בהם ,פוסלת בה קדשים שמום פוסלת בהן אינו דין שעבודה פוסלת בהן ,15,11,1620,1164,0.5526315789473685,1.0
1165,ref-sifre-n.123.1.613-ref-sifre-n.123.1.636,ref-b.3.05.46a.248-ref-b.3.05.46a.264,208277,208393,32883,32901,ref-sifre-n.123.1.613,ref-sifre-n.123.1.636,3941954,3942028,574646,574657,ref-b.3.5.46a.248,ref-b.3.5.46a.264,"עול בעול שאינו של עבודה הכתוב מדבר מנין לעשות שאר עבודה כעול אמרת ק""ו הוא ומה עגלה שאין המום פוסל בה עשה בה שאר ","עול אין לי אלא עול שאר עבודות מנין אמרת ק""ו ומה עגלה שאין מום פוסל בה שאר ",24,17,1632,1165,0.45535714285714285,0.4117647058823529
1167,ref-sifre-n.123.1.528-ref-sifre-n.123.1.551,ref-b.3.05.46a.248-ref-b.3.05.46a.268,207851,207966,32818,32835,ref-sifre-n.123.1.528,ref-sifre-n.123.1.551,3941954,3942049,574646,574661,ref-b.3.5.46a.248,ref-b.3.5.46a.268,"עול בעול שלא לעובדה הכתוב מדבר ואם תאמר בעול של עובדה אמרת ק""ו הוא ומה עגלה שאין המום פוסל בה עול פסל בה פרה ","עול אין לי אלא עול שאר עבודות מנין אמרת ק""ו ומה עגלה שאין מום פוסל בה שאר עבודות פוסלות בה פרה ",24,21,1614,1167,0.48623853211009177,0.47058823529411764
1168,ref-sifre-n.123.1.430-ref-sifre-n.123.1.443,ref-b.3.05.46a.260-ref-b.3.05.46a.273,207382,207453,32750,32760,ref-sifre-n.123.1.430,ref-sifre-n.123.1.443,3942007,3942072,574653,574666,ref-b.3.5.46a.260,ref-b.3.5.46a.273,שאין מלאכה פוסלת בהם מום פוסל בהם עגלה ערופה שמלאכה פוסלת בה אינו דין ,שאין מום פוסל בה שאר עבודות פוסלות בה פרה שמום פוסל בה אינו דין ,14,14,1610,1168,0.4142857142857143,0.6428571428571428
1169,ref-sifre-n.123.1.567-ref-sifre-n.123.1.598,ref-b.3.05.46a.260-ref-b.3.05.46a.281,208045,208205,32845,32869,ref-sifre-n.123.1.567,ref-sifre-n.123.1.598,3942007,3942115,574653,574672,ref-b.3.5.46a.260,ref-b.3.5.46a.281,ואין עול פוסל בהם והן יוכיחו לפרה שאף על פי שהמום פוסל בה לא יהיה עול פוסל בה לא אם אמרת במוקדשים שאין נפסלים בשחור ובלבן לפיכך אין העול פוסל בהם תאמר ,שאין מום פוסל בה שאר עבודות פוסלות בה פרה שמום פוסל בה אינו דין ששאר עבודות פוסלין בה ואם נפשך לומר נאמר ,32,22,1619,1169,0.5894039735099338,0.7272727272727273
1170,ref-sifre-n.62.1.18-ref-sifre-n.62.1.25,ref-b.3.05.46a.266-ref-b.3.05.46a.276,87073,87118,12981,12988,ref-sifre-n.62.1.18,ref-sifre-n.62.1.25,3942036,3942092,574659,574669,ref-b.3.5.46a.266,ref-b.3.5.46a.276,פסלו במומים כאן שפסלו שנים אינו דין שיפסלו ,פוסלות בה פרה שמום פוסל בה אינו דין ששאר עבודות פוסלין ,8,11,745,1170,0.5818181818181818,0.7
1171,ref-sifre-n.63.1.77-ref-sifre-n.63.1.86,ref-b.3.05.46a.266-ref-b.3.05.46a.276,87782,87833,13094,13103,ref-sifre-n.63.1.77,ref-sifre-n.63.1.86,3942036,3942092,574659,574669,ref-b.3.5.46a.266,ref-b.3.5.46a.276,פסל מומים פסל שנים כאן שפסל מומים אינו דין שיפסול ,פוסלות בה פרה שמום פוסל בה אינו דין ששאר עבודות פוסלין ,10,11,762,1171,0.6545454545454545,0.7
1172,ref-sifre-n.123.1.559-ref-sifre-n.123.1.570,ref-b.3.05.46a.310-ref-b.3.05.46a.322,208002,208063,32839,32848,ref-sifre-n.123.1.559,ref-sifre-n.123.1.570,3942251,3942317,574695,574706,ref-b.3.5.46a.310,ref-b.3.5.46a.322,פוסל בה הרי מוקדשים יוכיחו שהמום פוסל בהם ואין עול פוסל בהם ,פוסלות בה אי נמי קדשים יוכיחו שמום פוסל בהן ואין עבודה פוסלת בהן ,12,13,1618,1172,0.2153846153846154,0.5
1174,ref-sifre-n.123.1.583-ref-sifre-n.123.1.598,ref-b.3.05.46a.310-ref-b.3.05.46a.323,208120,208205,32856,32869,ref-sifre-n.123.1.583,ref-sifre-n.123.1.598,3942251,3942322,574695,574707,ref-b.3.5.46a.310,ref-b.3.5.46a.323,פוסל בה לא אם אמרת במוקדשים שאין נפסלים בשחור ובלבן לפיכך אין העול פוסל בהם תאמר ,פוסלות בה אי נמי קדשים יוכיחו שמום פוסל בהן ואין עבודה פוסלת בהן נאמר ,16,14,1621,1174,0.5185185185185185,0.8823529411764706
1176,ref-sifre-n.121.1.383-ref-sifre-n.121.1.398,ref-b.3.05.46a.323-ref-b.3.05.46a.334,203829,203905,32202,32217,ref-sifre-n.121.1.383,ref-sifre-n.121.1.398,3942318,3942372,574707,574718,ref-b.3.5.46a.323,ref-b.3.5.46a.334,נאמר כאן מלאה ונאמר להלן דברים כב מלאה מה להלן שהיא עולה אף כאן שהיא עולה ,נאמר כאן עול ונאמר להלן עול מה להלן שאר עבודות אף כאן ,16,12,1596,1176,0.44594594594594594,0.5
1177,ref-sifre-n.127.5.22-ref-sifre-n.127.5.38,ref-b.3.05.46a.323-ref-b.3.05.46a.334,224231,224307,35430,35444,ref-sifre-n.127.5.22,ref-sifre-n.127.5.38,3942318,3942372,574707,574718,ref-b.3.5.46a.323,ref-b.3.5.46a.334,נאמר כאן עפר ונאמר להלן במדבר ה עפר מה עפר האמור להלן על פני המים אף כאן ,נאמר כאן עול ונאמר להלן עול מה להלן שאר עבודות אף כאן ,17,12,1749,1177,0.4520547945205479,0.5
1178,ref-sifre-n.158.3.57-ref-sifre-n.158.3.66,ref-b.3.05.46a.329-ref-b.3.05.46a.345,283460,283503,45221,45230,ref-sifre-n.158.3.57,ref-sifre-n.158.3.66,3942347,3942427,574713,574729,ref-b.3.5.46a.329,ref-b.3.5.46a.345,לבוא אל המחנה ומה להלן עד הערב אף כאן עד ,מה להלן שאר עבודות אף כאן שאר עבודות וממקום שבאתה מה להלן עד שתמשוך אף כאן עד ,10,17,2238,1178,0.6025641025641025,0.7142857142857143
1179,ref-sifre-n.158.3.57-ref-sifre-n.158.3.66,ref-b.3.05.46a.338-ref-b.3.05.46a.345,283460,283503,45221,45230,ref-sifre-n.158.3.57,ref-sifre-n.158.3.66,3942392,3942427,574722,574729,ref-b.3.5.46a.338,ref-b.3.5.46a.345,לבוא אל המחנה ומה להלן עד הערב אף כאן עד ,שבאתה מה להלן עד שתמשוך אף כאן עד ,10,8,2237,1179,0.4146341463414634,0.6363636363636364
1180,ref-sifre-n.123.1.612-ref-sifre-n.123.1.624,ref-b.3.05.46a.359-ref-b.3.05.46a.371,208272,208341,32882,32894,ref-sifre-n.123.1.612,ref-sifre-n.123.1.624,3942501,3942555,574741,574749,ref-b.3.5.46a.359,ref-b.3.5.46a.371,עליה עול בעול שאינו של עבודה הכתוב מדבר מנין לעשות שאר עבודה כעול ,"עול אין לי אלא עול שאר עבודות מנין ת""ל אשר לא עלה עליה ",13,13,1631,1180,0.6363636363636364,0.6363636363636364
1182,ref-sifre-n.123.1.524-ref-sifre-n.123.1.529,ref-b.3.05.46a.397-ref-b.3.05.46a.411,207835,207860,32815,32819,ref-sifre-n.123.1.524,ref-sifre-n.123.1.529,3942678,3942740,574769,574775,ref-b.3.5.46a.397,ref-b.3.5.46a.411,אשר לא עלה עליה עול בעול ,אשר לא עלה עליה כלל עול פרט כלל ופרט אין בכלל אלא מה שבפרט עול ,6,15,1612,1182,0.6031746031746031,0.7142857142857143
1183,ref-sifre-n.123.1.609-ref-sifre-n.123.1.614,ref-b.3.05.46a.397-ref-b.3.05.46a.411,208261,208286,32880,32884,ref-sifre-n.123.1.609,ref-sifre-n.123.1.614,3942678,3942740,574769,574775,ref-b.3.5.46a.397,ref-b.3.5.46a.411,אשר לא עלה עליה עול בעול ,אשר לא עלה עליה כלל עול פרט כלל ופרט אין בכלל אלא מה שבפרט עול ,6,15,1629,1183,0.6031746031746031,0.7142857142857143
1184,ref-sifre-n.123.1.607-ref-sifre-n.123.1.617,ref-b.3.05.46a.426-ref-b.3.05.46a.444,208254,208302,32878,32887,ref-sifre-n.123.1.607,ref-sifre-n.123.1.617,3942807,3942883,574785,574797,ref-b.3.5.46a.426,ref-b.3.5.46a.444,"בה ת""ל אשר לא עלה עליה עול בעול שאינו של עבודה ","עול אין לי אלא עול שאר עבודות מנין ת""ל אשר לא עובד בה מ""מ א""כ מה ת""ל עול עול ",11,19,1628,1184,0.7012987012987013,0.5555555555555556
1185,ref-sifre-n.41.1.130-ref-sifre-n.41.1.139,ref-b.3.05.46b.373-ref-b.3.05.46b.383,66125,66179,9565,9574,ref-sifre-n.41.1.130,ref-sifre-n.41.1.139,3945652,3945714,575233,575241,ref-b.3.5.46b.373,ref-b.3.5.46b.383,לוית חן ואומר כי לוית חן הם לראשך וענקים לגרגרותיך ,לויה יעסוק בתורה שנאמר כי לוית חן הם לראשך וענקים לגרגרותיך ,10,11,596,1185,0.23333333333333334,0.4
1186,ref-sifre-n.81.1.47-ref-sifre-n.81.1.58,ref-b.3.05.46b.403-ref-b.3.05.46b.411,109947,110016,16715,16726,ref-sifre-n.81.1.47,ref-sifre-n.81.1.58,3945822,3945871,575257,575265,ref-b.3.5.46b.403,ref-b.3.5.46b.411,אותו ארבע מאות שנה וארבעים שנה שנאמר ויהי כשמונים שנה וארבע מאות ,ארבע מאות שנה שנאמר ועבדום וענו אותם ארבע מאות ,12,9,945,1186,0.49230769230769234,0.625
1187,ref-sifre-n.81.1.75-ref-sifre-n.81.1.80,ref-b.3.05.46b.403-ref-b.3.05.46b.412,110101,110132,16741,16746,ref-sifre-n.81.1.75,ref-sifre-n.81.1.80,3945822,3945875,575257,575266,ref-b.3.5.46b.403,ref-b.3.5.46b.412,אותו ארבעים שנה וארבע מאות שנה ,ארבע מאות שנה שנאמר ועבדום וענו אותם ארבע מאות שנה ,6,10,947,1187,0.49019607843137253,0.7142857142857143
