,baseOrig,compOrig,baseCharStart,baseCharEnd,baseWdStart,baseWdEnd,baseRefStart,baseRefEnd,compCharStart,compCharEnd,compWdStart,compWdEnd,compRefStart,compRefEnd,baseStr,compStr,bRange,cRange,baseOrder,compOrder,lev,jac,lcsseq
749,ref-bible.0105.24.15.1-ref-bible.0105.24.15.11,ref-sifre-d.278.1.57-ref-sifre-d.278.2.4,388330,388384,64988,64998,ref-bible.105.24.15.1,ref-bible.105.24.15.11,263433,263493,44007,44018,ref-sifre-d.278.1.57,ref-sifre-d.278.2.4,ביומו תתן שכרו ולא תבוא עליו השמש כי עני הוא ואליו ,ביומו תתן שכרו ומשום ולא תבא עליו השמש כי עני הוא ואליו ,11,12,749,1013,0.125,0.0892857142857143,0.10714285714285714
750,ref-bible.0105.24.15.4-ref-bible.0105.24.15.11,ref-sifre-d.279.1.20-ref-sifre-d.279.2.4,388346,388384,64991,64998,ref-bible.105.24.15.4,ref-bible.105.24.15.11,264182,264220,44129,44136,ref-sifre-d.279.1.20,ref-sifre-d.279.2.4,ולא תבוא עליו השמש כי עני הוא ואליו ,ולא תבוא עליו השמש כי עני הוא ואליו ,8,8,750,1015,0.0,0.0,0.0
751,ref-bible.0105.24.15.16-ref-bible.0105.24.15.23,ref-sifre-d.279.4.1-ref-sifre-d.279.4.28,388401,388436,65002,65009,ref-bible.105.24.15.16,ref-bible.105.24.15.23,264448,264575,44169,44196,ref-sifre-d.279.4.1,ref-sifre-d.279.4.28,ולא יקרא עליך אל יהוה והיה בך חטא ,"ולא יקרא עליך אל ה' יכול מצוה שלא לקרות ת""ל וקרא עליך יכול מצותו לקרות ת""ל ולא יקרא עליך אל ה' יכול אם קרא עליך יהיה בך חטא ",8,28,751,1017,0.7258064516129032,0.7258064516129032,0.7258064516129032
753,ref-bible.0105.24.16.1-ref-bible.0105.24.16.10,ref-sifre-d.87.3.3-ref-sifre-d.87.3.12,388437,388482,65010,65017,ref-bible.105.24.16.1,ref-bible.105.24.16.10,131788,131833,22012,22021,ref-sifre-d.87.3.3,ref-sifre-d.87.3.12,לא יומתו אבות על בנים ובנים לא יומתו על אבות ,לא יומתו אבות על בנים ובנים לא יומתו על אבות ,10,10,753,559,0.0,0.0,0.0
754,ref-bible.0105.24.16.1-ref-bible.0105.24.16.13,ref-sifre-d.280.1.1-ref-sifre-d.280.1.27,388437,388499,65010,65020,ref-bible.105.24.16.1,ref-bible.105.24.16.13,264718,264845,44222,44242,ref-sifre-d.280.1.1,ref-sifre-d.280.1.27,לא יומתו אבות על בנים ובנים לא יומתו על אבות איש בחטאו יומתו ,לא יומתו אבות על בנים וכי מה בא הכתוב ללמדנו שלא יומתו אבות על ידי בנים ולא בנים על ידי אבות והרי כבר נאמר איש בחטאו יומתו ,13,27,754,1020,0.5284552845528455,0.5040650406504066,0.5203252032520326
756,ref-bible.0105.24.16.6-ref-bible.0105.24.16.13,ref-sifre-d.280.3.1-ref-sifre-d.280.3.12,388459,388499,65013,65020,ref-bible.105.24.16.6,ref-bible.105.24.16.13,265064,265134,44281,44292,ref-sifre-d.280.3.1,ref-sifre-d.280.3.12,ובנים לא יומתו על אבות איש בחטאו יומתו ,איש בחטאו יומתו גדולים מתים בעון עצמם ובנים קטנים מתים בעון אבותם ל,8,13,756,1028,0.6865671641791045,0.4411764705882353,0.6567164179104478
757,ref-bible.0105.24.19.1-ref-bible.0105.24.19.6,ref-sifre-d.282.3.7-ref-sifre-d.282.3.12,388623,388653,65044,65049,ref-bible.105.24.19.1,ref-bible.105.24.19.6,265858,265890,44416,44421,ref-sifre-d.282.3.7,ref-sifre-d.282.3.12,כי תקצר קצירך בשדך ושכחת עמר ,כי תקצור קצירך בשדך ושכחת עומר ,6,6,757,1031,0.06451612903225806,0.06451612903225812,0.06451612903225806
758,ref-bible.0105.24.19.14-ref-bible.0105.24.19.21,ref-sifre-d.283.5.59-ref-sifre-d.283.6.8,388695,388735,65057,65062,ref-bible.105.24.19.14,ref-bible.105.24.19.21,267791,267831,44725,44731,ref-sifre-d.283.5.59,ref-sifre-d.283.6.8,יהיה למען יברכך יהוה אלהיך בכל מעשה ידיך ,יהיה למען יברכך ה' א להיך בכל מעשה ידיך ,8,9,758,1032,0.0975609756097561,0.11627906976744184,0.07317073170731707
759,ref-bible.0105.25.1.5-ref-bible.0105.25.2.5,ref-sifre-d.286.2.14-ref-sifre-d.286.4.16,388924,389014,65097,65110,ref-bible.105.25.1.5,ref-bible.105.25.2.5,269530,269662,45035,45057,ref-sifre-d.286.2.14,ref-sifre-d.286.4.16,אנשים ונגשו אל המשפט ושפטום והצדיקו את הצדיק והרשיעו את הרשע והיה אם בן הכות הרשע ,"איש מנין ת""ל ונגשו אל המשפט ושפטום בעל כרחם והצדיקו את הצדיק והרשיעו את הרשע יכול כל מרשיעים לוקים ת""ל והיה אם בן הכות הרשע ",16,25,759,1035,0.3548387096774194,0.33870967741935487,0.3548387096774194
760,ref-bible.0105.25.3.8-ref-bible.0105.25.3.14,ref-sifre-d.286.11.25-ref-sifre-d.286.12.3,389093,389127,65125,65131,ref-bible.105.25.3.8,ref-bible.105.25.3.14,270826,270871,45254,45261,ref-sifre-d.286.11.25,ref-sifre-d.286.12.3,על אלה מכה רבה ונקלה אחיך לעיניך ,על הראשונות שהן מכה רבה ונקלה אחיך לעיניך ,7,8,760,1037,0.23809523809523808,0.2558139534883721,0.23809523809523808
761,ref-bible.0105.25.5.11-ref-bible.0105.25.5.17,ref-sifre-d.288.4.1-ref-sifre-d.288.4.7,389190,389222,65144,65150,ref-bible.105.25.5.11,ref-bible.105.25.5.17,273523,273555,45699,45705,ref-sifre-d.288.4.1,ref-sifre-d.288.4.7,לא תהיה אשת המת החוצה לאיש זר ,לא תהיה אשת המת החוצה לאיש זר ,7,7,761,1044,0.0,0.0,0.0
762,ref-bible.0105.25.5.11-ref-bible.0105.25.5.17,ref-sifre-d.288.4.28-ref-sifre-d.288.4.34,389190,389222,65144,65150,ref-bible.105.25.5.11,ref-bible.105.25.5.17,273649,273681,45726,45732,ref-sifre-d.288.4.28,ref-sifre-d.288.4.34,לא תהיה אשת המת החוצה לאיש זר ,לא תהי' אשת המת החוצה לאיש זר ,7,7,762,1045,0.03333333333333333,0.06451612903225812,0.03333333333333333
763,ref-bible.0105.25.5.11-ref-bible.0105.25.5.17,ref-sifre-d.288.4.79-ref-sifre-d.288.4.85,389190,389222,65144,65150,ref-bible.105.25.5.11,ref-bible.105.25.5.17,273915,273947,45775,45781,ref-sifre-d.288.4.79,ref-sifre-d.288.4.85,לא תהיה אשת המת החוצה לאיש זר ,לא תהיה אשת המת החוצה לאיש זר ,7,7,763,1046,0.0,0.0,0.0
764,ref-bible.0105.25.5.24-ref-bible.0105.25.6.10,ref-sifre-d.289.1.37-ref-sifre-d.289.3.5,389253,389306,65157,65166,ref-bible.105.25.5.24,ref-bible.105.25.6.10,274483,274550,45878,45889,ref-sifre-d.289.1.37,ref-sifre-d.289.3.5,ויבמה והיה הבכור אשר תלד יקום על שם אחיו המת ולא ,ליבם אשר תלד פרט לאילונית שאינה ראויה לילד יקום על שם אחיו ולא ,11,13,764,1047,0.5555555555555556,0.4225352112676056,0.47619047619047616
765,ref-bible.0105.25.6.9-ref-bible.0105.25.7.4,ref-sifre-d.289.4.22-ref-sifre-d.289.6.4,389297,389342,65165,65172,ref-bible.105.25.6.9,ref-bible.105.25.7.4,274777,274867,45935,45950,ref-sifre-d.289.4.22,ref-sifre-d.289.6.4,המת ולא ימחה שמו מישראל ואם לא יחפץ האיש ,המת ריבה הכתוב ולא ימחה שמו מישראל פרט לסריס לאשת סריס ששמו מחוי ואם לא יחפץ האיש ,9,17,765,1048,0.5,0.5,0.5
766,ref-bible.0105.25.7.12-ref-bible.0105.25.7.19,ref-sifre-d.289.8.11-ref-sifre-d.289.9.6,389380,389429,65179,65186,ref-bible.105.25.7.12,ref-bible.105.25.7.19,275247,275287,46018,46024,ref-sifre-d.289.8.11,ref-sifre-d.289.9.6,הזקנים ואמרה מאין יבמי להקים לאחיו שם בישראל ,בזקנים מאן יבמי להקים לאחיו שם בישראל ,8,7,766,1049,0.17777777777777778,0.19565217391304346,0.17777777777777778
768,ref-bible.0105.25.7.19-ref-bible.0105.25.8.6,ref-sifre-d.289.10.21-ref-sifre-d.290.2.2,389422,389473,65186,65195,ref-bible.105.25.7.19,ref-bible.105.25.8.6,275658,275775,46095,46116,ref-sifre-d.289.10.21,ref-sifre-d.290.2.2,בישראל לא אבה יבמי וקראו לו זקני עירו ודברו אליו ,בישראל ולא בגרים לא אבה יבמי ולא שלא אבה בה המקום וקראו לו זקני עירו מצוה בזקני עירו ולא בשלוחם ודברו אליו ,10,22,768,1051,0.5420560747663551,0.5420560747663552,0.5420560747663551
769,ref-bible.0105.25.8.7-ref-bible.0105.25.9.5,ref-sifre-d.290.3.1-ref-sifre-d.291.1.5,389474,389533,65196,65205,ref-bible.105.25.8.7,ref-bible.105.25.9.5,275985,276117,46158,46181,ref-sifre-d.290.3.1,ref-sifre-d.291.1.5,ועמד ואמר לא חפצתי לקחתה ונגשה יבמתו אליו לעיני הזקנים ,ועמד ואמר לא חפצתי לקחתה מלמד שאין אומר דבריו אלא בעמידה לא חפצתי לקחתה ולא שלא חפץ בה המקום ונגשה יבמתו אליו לעיני הזקנים ,10,24,769,1052,0.5528455284552846,0.5528455284552846,0.5528455284552846
771,ref-bible.0105.25.9.14-ref-bible.0105.25.9.22,ref-sifre-d.291.7.44-ref-sifre-d.291.8.6,389582,389620,65214,65220,ref-bible.105.25.9.14,ref-bible.105.25.9.22,277173,277235,46363,46373,ref-sifre-d.291.7.44,ref-sifre-d.291.8.6,ככה יעשה לאיש אשר לא יבנה את בית אחיו ,ככה יעשה לאיש כל דבר שהוא מעשה באיש אשר לא יבנה את בית אחיו ,9,14,771,1054,0.36666666666666664,0.3666666666666667,0.36666666666666664
772,ref-bible.0105.25.10.5-ref-bible.0105.25.11.3,ref-sifre-d.291.10.38-ref-sifre-d.292.1.3,389644,389668,65225,65229,ref-bible.105.25.10.5,ref-bible.105.25.11.3,277573,277608,46427,46433,ref-sifre-d.291.10.38,ref-sifre-d.292.1.3,חלוץ הנעל כי ינצו אנשים ,חלוץ הנעל חלוץ הנעל כי ינצו אנשים ,5,7,772,1055,0.29411764705882354,0.2941176470588235,0.29411764705882354
773,ref-bible.0105.25.11.4-ref-bible.0105.25.11.12,ref-sifre-d.292.2.15-ref-sifre-d.292.4.13,389669,389715,65230,65237,ref-bible.105.25.11.4,ref-bible.105.25.11.12,277922,278055,46496,46516,ref-sifre-d.292.2.15,ref-sifre-d.292.4.13,יחדו איש ואחיו וקרבה אשת האחד להציל את אישה ,"יחדו מ""ממכל מקום איש ואחיו פרט לעבדים שאין להם אחוה דברי ר' יהודה וקרבה אשת האחד ושלחה אשת איש ולא אשת שליח ב""ד להציל את אישה ",9,26,773,1058,0.6507936507936508,0.6507936507936508,0.6507936507936508
774,ref-bible.0105.25.13.5-ref-bible.0105.25.15.5,ref-sifre-d.294.3.8-ref-sifre-d.294.4.6,389799,389887,65251,65265,ref-bible.105.25.13.5,ref-bible.105.25.15.5,278868,278974,46643,46661,ref-sifre-d.294.3.8,ref-sifre-d.294.4.6,אבן ואבן גדולה וקטנה לא יהיה לך בביתך איפה ואיפה גדולה וקטנה אבן שלמה וצדק יהיה לך ,אבן שלמה וצדק הרי הוא ב יהיה לך ואם עברת על אבן ואבן הרי הוא ב לא יהיה לך לא יהיה לך בביתך איפה ואיפה ,17,25,774,1059,0.6568627450980392,0.36283185840707965,0.5392156862745098
775,ref-bible.0105.25.18.1-ref-bible.0105.25.18.8,ref-sifre-d.296.4.1-ref-sifre-d.296.5.5,390048,390089,65290,65297,ref-bible.105.25.18.1,ref-bible.105.25.18.8,280948,281010,47008,47020,ref-sifre-d.296.4.1,ref-sifre-d.296.5.5,אשר קרך בדרך ויזנב בך כל הנחשלים אחריך ,אשר קרך בדרך אין קרך אלא נזדמן לך ויזנב בך כל הנחשלים אחריך ,8,13,775,1064,0.35,0.35,0.35
777,ref-bible.0105.25.18.9-ref-bible.0105.25.19.8,ref-sifre-d.296.6.1-ref-sifre-d.296.8.9,390090,390165,65298,65309,ref-bible.105.25.18.9,ref-bible.105.25.19.8,281088,281176,47033,47048,ref-sifre-d.296.6.1,ref-sifre-d.296.8.9,ואתה עיף ויגע ולא ירא אלהים והיה בהניח יהוה אלהיך לך מכל איביך מסביב ,ואתה עיף ויגע ישראל ולא ירא א להים עמלק והיה בהניח ה' א להיך לך מכל אויביך מסביב ,14,18,777,1065,0.20987654320987653,0.1707317073170732,0.18518518518518517
778,ref-bible.0105.25.19.16-ref-bible.0105.25.19.22,ref-sifre-d.296.9.19-ref-sifre-d.296.10.6,390199,390233,65312,65317,ref-bible.105.25.19.16,ref-bible.105.25.19.22,281291,281324,47067,47072,ref-sifre-d.296.9.19,ref-sifre-d.296.10.6,לרשתה תמחה את זכר עמלק מתחת השמים ,תירש תמחה את זכר עמלק מתחת השמים ,7,7,778,1066,0.11764705882352941,0.08571428571428574,0.08823529411764706
779,ref-bible.0105.25.19.17-ref-bible.0105.25.19.22,ref-sifre-d.296.10.12-ref-sifre-d.296.10.18,390205,390233,65313,65317,ref-bible.105.25.19.17,ref-bible.105.25.19.22,281349,281381,47075,47080,ref-sifre-d.296.10.12,ref-sifre-d.296.10.18,תמחה את זכר עמלק מתחת השמים ,מחה אמחה את זכר עמלק מתחת השמים ,6,7,779,1069,0.15625,0.18181818181818177,0.15625
780,ref-bible.0105.26.1.12-ref-bible.0105.26.2.4,ref-sifre-d.297.3.1-ref-sifre-d.297.4.4,390291,390337,65324,65330,ref-bible.105.26.1.12,ref-bible.105.26.2.4,281760,281845,47146,47159,ref-sifre-d.297.3.1,ref-sifre-d.297.4.4,וירשתה וישבת בה ולקחת מראשית כל פרי האדמה ,וירשתה וישבתה בה מה שתירש תכבש ותשב בשכר שתירש תשב ולקחת מראשית כל פרי האדמה ,8,15,780,1071,0.45454545454545453,0.4545454545454546,0.45454545454545453
781,ref-bible.0105.26.3.1-ref-bible.0105.26.3.8,ref-sifre-d.298.3.1-ref-sifre-d.298.3.10,390436,390478,65341,65348,ref-bible.105.26.3.1,ref-bible.105.26.3.8,283680,283728,47474,47482,ref-sifre-d.298.3.1,ref-sifre-d.298.3.10,ובאת אל הכהן אשר יהיה בימים ההם ואמרת ,ובאת אל הכהן אשר יהיה בימים ההם זו היא שאמר ,8,10,781,1074,0.18181818181818182,0.1777777777777778,0.1590909090909091
782,ref-bible.0105.26.4.1-ref-bible.0105.26.4.7,ref-sifre-d.63.9.6-ref-sifre-d.63.9.12,390556,390596,65358,65364,ref-bible.105.26.4.1,ref-bible.105.26.4.7,111892,111932,18726,18732,ref-sifre-d.63.9.6,ref-sifre-d.63.9.12,ולקח הכהן הטנא מידך והניחו לפני מזבח ,ולקח הכהן הטנא מידך והניחו לפני מזבח ,7,7,782,491,0.0,0.0,0.0
783,ref-bible.0105.26.5.2-ref-bible.0105.26.5.9,ref-sifre-d.301.3.1-ref-sifre-d.301.3.10,390615,390656,65368,65373,ref-bible.105.26.5.2,ref-bible.105.26.5.9,284842,284887,47665,47672,ref-sifre-d.301.3.1,ref-sifre-d.301.3.10,ואמרת לפני יהוה אלהיך ארמי אבד אבי וירד ,ואמרת לפני ה' א' ארמי אובד אבי מלמד שלא ירד ,8,10,783,1076,0.38636363636363635,0.31999999999999995,0.2727272727272727
784,ref-bible.0105.26.5.8-ref-bible.0105.26.5.18,ref-sifre-d.301.4.59-ref-sifre-d.301.5.4,390647,390701,65372,65382,ref-bible.105.26.5.8,ref-bible.105.26.5.18,285242,285280,47741,47747,ref-sifre-d.301.4.59,ref-sifre-d.301.5.4,אבי וירד מצרימה ויגר שם במתי מעט ויהי שם לגוי גדול ,ירדו אבותיך מצרימה ויהי שם לגוי גדול ,11,7,784,1080,0.49019607843137253,0.3076923076923077,0.4117647058823529
785,ref-bible.0105.26.10.8-ref-bible.0105.26.11.13,ref-sifre-d.301.34.4-ref-sifre-d.301.37.4,391017,391152,65427,65447,ref-bible.105.26.10.8,ref-bible.105.26.11.13,288122,288250,48218,48240,ref-sifre-d.301.34.4,ref-sifre-d.301.37.4,אשר נתתה לי יהוה והנחתו לפני יהוה אלהיך והשתחוית לפני יהוה אלהיך ושמחת בכל הטוב אשר נתן לך יהוה אלהיך ולביתך אתה והלוי והגר אשר ,שמחות בשעת שמחה בכל הטוב זה השיר אשר נתן לך ה' א להיך ולביתך מלמד שאדם מביא בכורים מנכסי אשתו וקורא אתה והלוי והגר אשר ,25,25,785,1106,0.6171875,0.3856209150326797,0.484375
787,ref-bible.0105.26.12.3-ref-bible.0105.26.12.11,ref-sifre-d.105.1.1-ref-sifre-d.105.1.13,391167,391214,65451,65458,ref-bible.105.26.12.3,ref-bible.105.26.12.11,142563,142628,23851,23862,ref-sifre-d.105.1.1,ref-sifre-d.105.1.13,לעשר את כל מעשר תבואתך בשנה השלישת שנת המעשר ,עשר תעשר את כל תבואת זרעך היוצא השדה שנה שנה מלמד שאין מעשרים ,9,13,787,601,0.5806451612903226,0.3538461538461538,0.5
788,ref-bible.0105.26.12.3-ref-bible.0105.26.12.11,ref-sifre-d.302.1.86-ref-sifre-d.302.1.101,391167,391214,65451,65458,ref-bible.105.26.12.3,ref-bible.105.26.12.11,288960,289059,48366,48380,ref-sifre-d.302.1.86,ref-sifre-d.302.1.101,לעשר את כל מעשר תבואתך בשנה השלישת שנת המעשר ,במעשר בבעור תלמוד לומר בשנה השלישית שנה שחייבת במעשר יצאת שנה שביעית שאינה חייבת במעשר יכול ,9,16,788,1108,0.6847826086956522,0.5268817204301075,0.6413043478260869
790,ref-bible.0105.26.12.3-ref-bible.0105.26.12.19,ref-sifre-d.302.1.117-ref-sifre-d.303.2.3,391167,391270,65451,65466,ref-bible.105.26.12.3,ref-bible.105.26.12.19,289132,289241,48391,48404,ref-sifre-d.302.1.117,ref-sifre-d.303.2.3,לעשר את כל מעשר תבואתך בשנה השלישת שנת המעשר ונתתה ללוי לגר ליתום ולאלמנה ואכלו בשעריך ושבעו ,מעשרות תלמוד לומר מעשר תבואתך ריבה ונתת ללוי לגר ליתום ולאלמנה תן לכל אחד ואחד חלקו ואכלו בשעריך ושבעו ,17,19,790,1110,0.5145631067961165,0.2807017543859649,0.32038834951456313
791,ref-bible.0105.26.13.15-ref-bible.0105.26.14.7,ref-sifre-d.303.11.10-ref-sifre-d.303.13.11,391354,391439,65476,65491,ref-bible.105.26.13.15,ref-bible.105.26.14.7,289829,289927,48505,48521,ref-sifre-d.303.11.10,ref-sifre-d.303.13.11,ככל מצותך אשר צויתני לא עברתי ממצותיך ולא שכחתי לא אכלתי באני ממנו ולא בערתי ממנו ,כלום כאשר צויתני לא נתתיו למי שאינו ראוי לא עברתי ממצותי' ולא הפרשתי ממין על שאינו מינו לא מן ,16,19,791,1111,0.5957446808510638,0.2912621359223301,0.425531914893617
792,ref-bible.0105.26.13.19-ref-bible.0105.26.14.8,ref-sifre-d.303.14.1-ref-sifre-d.303.16.4,391376,391445,65480,65492,ref-bible.105.26.13.19,ref-bible.105.26.14.8,290018,290129,48540,48559,ref-sifre-d.303.14.1,ref-sifre-d.303.16.4,לא עברתי ממצותיך ולא שכחתי לא אכלתי באני ממנו ולא בערתי ממנו בטמא ,ולא שכחתי לא שכחתי מהזכיר שמך ולברכך לא אכלתי באוני ממנו הא אם אכלו אינו יכול להתוודות ולא בערתי ממנו בטמא ,13,21,792,1112,0.5327102803738317,0.4128440366972477,0.4953271028037383
793,ref-bible.0105.26.13.22-ref-bible.0105.26.14.8,ref-sifre-d.72.5.6-ref-sifre-d.72.5.13,391394,391445,65483,65492,ref-bible.105.26.13.22,ref-bible.105.26.14.8,117574,117615,19680,19687,ref-sifre-d.72.5.6,ref-sifre-d.72.5.13,ולא שכחתי לא אכלתי באני ממנו ולא בערתי ממנו בטמא ,לא אכלתי באוני ממנו ולא בערתי ממנו בטמא ,10,8,793,511,0.22448979591836735,0.18367346938775508,0.20408163265306123
795,ref-bible.0105.26.14.1-ref-bible.0105.26.14.12,ref-sifre-d.303.16.14-ref-sifre-d.303.17.7,391405,391465,65485,65496,ref-bible.105.26.14.1,ref-bible.105.26.14.12,290173,290210,48569,48576,ref-sifre-d.303.16.14,ref-sifre-d.303.17.7,לא אכלתי באני ממנו ולא בערתי ממנו בטמא ולא נתתי ממנו למת ,טמא ולא נתתי ממנו למת לא לקחתי ממנו ,12,8,795,1114,0.543859649122807,0.423728813559322,0.5263157894736842
797,ref-bible.0105.26.14.17-ref-bible.0105.26.15.4,ref-sifre-d.303.18.1-ref-sifre-d.303.19.4,391488,391539,65501,65508,ref-bible.105.26.14.17,ref-bible.105.26.15.4,290323,290391,48597,48607,ref-sifre-d.303.18.1,ref-sifre-d.303.19.4,עשיתי ככל אשר צויתני השקיפה ממעון קדשך מן השמים ,עשיתי ככל אשר צויתני שמחתי ושמחתי בו השקיפה ממעון קדשך מן השמים ,9,12,797,1116,0.25,0.25,0.25
798,ref-bible.0105.26.15.1-ref-bible.0105.26.15.4,ref-sifre-d.303.19.15-ref-sifre-d.303.19.18,391510,391539,65505,65508,ref-bible.105.26.15.1,ref-bible.105.26.15.4,290440,290469,48617,48620,ref-sifre-d.303.19.15,ref-sifre-d.303.19.18,השקיפה ממעון קדשך מן השמים ,השקיפה ממעון קדשך מן השמים ,5,5,798,1117,0.0,0.0,0.0
799,ref-bible.0105.27.26.9-ref-bible.0105.28.1.12,ref-sifre-d.41.1.23-ref-sifre-d.41.1.30,393559,393646,65794,65803,ref-bible.105.27.26.9,ref-bible.105.28.1.12,68658,68697,11536,11543,ref-sifre-d.41.1.23,ref-sifre-d.41.1.30,לעשות אותם ואמר כל העם אמן והיה אם שמוע תשמע בקול יהוה אלהיך לשמר לעשות את כל מצותיו ,"במעשה ת""ל והיה אם שמוע תשמעו אל מצותי ",18,8,799,267,0.611764705882353,0.5697674418604651,0.6
800,ref-bible.0105.28.5.1-ref-bible.0105.28.6.6,ref-sifre-d.40.10.67-ref-sifre-d.40.10.80,393863,393914,65836,65843,ref-bible.105.28.5.1,ref-bible.105.28.6.6,66772,66858,11249,11261,ref-sifre-d.40.10.67,ref-sifre-d.40.10.80,ברוך טנאך ומשארתך ברוך אתה בבאך וברוך אתה בצאתך ,ברוך טנאך ומשארתך ומנין אף בכניסה וביציאה שנאמר ברוך אתה בבואך וברוך אתה בצאתך ,9,14,800,254,0.3924050632911392,0.3924050632911392,0.3924050632911392
801,ref-bible.0105.28.8.1-ref-bible.0105.28.8.9,ref-sifre-d.40.10.28-ref-sifre-d.40.10.36,394003,394048,65859,65866,ref-bible.105.28.8.1,ref-bible.105.28.8.9,66556,66600,11214,11221,ref-sifre-d.40.10.28,ref-sifre-d.40.10.36,יצו יהוה אתך את הברכה באסמיך ובכל משלח ידך ,יצו ה' אתך את הברכה באסמיך ובכל משלח ידיך ,9,9,801,252,0.09302325581395349,0.06818181818181823,0.06976744186046512
802,ref-bible.0105.28.12.1-ref-bible.0105.28.12.16,ref-sifre-d.306.4.58-ref-sifre-d.306.4.72,394308,394382,65906,65918,ref-bible.105.28.12.1,ref-bible.105.28.12.16,298413,298487,49975,49987,ref-sifre-d.306.4.58,ref-sifre-d.306.4.72,יפתח יהוה לך את אוצרו הטוב את השמים לתת מטר ארצך בעתו ולברך את כל מעשה ,יפתח ה' לך את אוצרו הטוב את השמים לתת מטר ארצך בעתו וכשאין ישראל עושים ,16,15,802,1146,0.22535211267605634,0.20253164556962022,0.16901408450704225
803,ref-bible.0105.28.13.10-ref-bible.0105.28.14.1,ref-sifre-d.41.1.1-ref-sifre-d.41.1.18,394469,394542,65935,65944,ref-bible.105.28.13.10,ref-bible.105.28.14.1,68536,68628,11518,11531,ref-sifre-d.41.1.1,ref-sifre-d.41.1.18,תהיה למטה כי תשמע אל מצות יהוה אלהיך אשר אנכי מצוך היום לשמר ולעשות ולא ,והיה אם שמע תשמעו אל מצותי למה נאמר לפי שהוא אומר ולמדתם אותם ושמרתם לעשותם שומע אני שלא ,15,18,803,263,0.5393258426966292,0.39,0.4606741573033708
804,ref-bible.0105.28.16.1-ref-bible.0105.28.17.3,ref-sifre-d.40.11.43-ref-sifre-d.40.11.53,394747,394797,65965,65973,ref-bible.105.28.16.1,ref-bible.105.28.17.3,67327,67388,11342,11351,ref-sifre-d.40.11.43,ref-sifre-d.40.11.53,ארור אתה בעיר וארור אתה בשדה ארור טנאך ומשארתך ,ארור אתה בעיר ומנין אף בעיסה תלמוד לומר ארור טנאך ומשארתך ,9,11,804,256,0.3275862068965517,0.30645161290322576,0.3275862068965517
806,ref-bible.0105.28.19.1-ref-bible.0105.28.19.6,ref-sifre-d.40.11.60-ref-sifre-d.40.11.65,394849,394881,65983,65988,ref-bible.105.28.19.1,ref-bible.105.28.19.6,67427,67460,11357,11362,ref-sifre-d.40.11.60,ref-sifre-d.40.11.65,ארור אתה בבאך וארור אתה בצאתך ,ארור אתה בבואך וארור אתה בצאתך ,6,6,806,258,0.03225806451612903,0.032258064516129004,0.03225806451612903
807,ref-bible.0105.28.19.5-ref-bible.0105.28.20.7,ref-sifre-d.40.11.29-ref-sifre-d.40.11.37,394871,394915,65987,65993,ref-bible.105.28.19.5,ref-bible.105.28.20.7,67253,67298,11330,11337,ref-sifre-d.40.11.29,ref-sifre-d.40.11.37,אתה בצאתך ישלח יהוה בך את המארה את המהומה ,אותו ואומר ישלח ה' בך את המארה ואת המהומה ,9,9,807,255,0.2619047619047619,0.2857142857142857,0.19047619047619047
808,ref-bible.0105.29.1.16-ref-bible.0105.29.1.22,ref-sifre-d.357.43.8-ref-sifre-d.357.43.14,398872,398913,66672,66677,ref-bible.105.29.1.16,ref-bible.105.29.1.22,389796,389837,65537,65542,ref-sifre-d.357.43.8,ref-sifre-d.357.43.14,בארץ מצרים לפרעה ולכל עבדיו ולכל ארצו ,בארץ מצרים לפרעה ולכל עבדיו ולכל ארצו ,7,7,808,1527,0.0,0.0,0.0
809,ref-bible.0105.29.9.1-ref-bible.0105.29.9.10,ref-sifre-d.48.9.58-ref-sifre-d.48.9.67,399384,399442,66750,66757,ref-bible.105.29.9.1,ref-bible.105.29.9.10,94367,94423,15829,15836,ref-sifre-d.48.9.58,ref-sifre-d.48.9.67,אתם נצבים היום כלכם לפני יהוה אלהיכם ראשיכם שבטיכם זקניכם ,אתם נצבים היום כלכם לפני ה' אלהיכם ראשיכם שבטיכם זקניכם ,10,10,809,384,0.05172413793103448,0.06779661016949157,0.05172413793103448
810,ref-bible.0105.29.25.1-ref-bible.0105.29.25.5,ref-sifre-d.148.8.10-ref-sifre-d.148.8.16,400810,400845,67004,67008,ref-bible.105.29.25.1,ref-bible.105.29.25.5,178688,178732,29829,29835,ref-sifre-d.148.8.10,ref-sifre-d.148.8.16,וילכו ויעבדו אלהים אחרים וישתחוו ,וילך ויעבוד אלהים אחרים ומנין אף למשתחוה ,5,7,810,723,0.34146341463414637,0.31818181818181823,0.2926829268292683
