,baseOrig,compOrig,baseCharStart,baseCharEnd,baseWdStart,baseWdEnd,baseRefStart,baseRefEnd,compCharStart,compCharEnd,compWdStart,compWdEnd,compRefStart,compRefEnd,baseStr,compStr,bRange,cRange,baseOrder,compOrder,dam-lev,jac
1676,ref-sifre-n.127.5.22-ref-sifre-n.127.5.43,ref-b.4.06.35b.454-ref-b.4.06.35b.467,224231,224330,35430,35447,ref-sifre-n.127.5.22,ref-sifre-n.127.5.43,6455495,6455558,940513,940526,ref-b.4.6.35b.454,ref-b.4.6.35b.467,נאמר כאן עפר ונאמר להלן במדבר ה עפר מה עפר האמור להלן על פני המים אף כאן על פני המים ומה להלן ,נאמר כאן אלה ונאמר להלן אלה מה להלן שבועה אף כאן שבועה מה להלן ,22,14,1769,1676,0.46808510638297873,0.5833333333333333
1678,ref-sifre-n.14.1.62-ref-sifre-n.14.1.78,ref-b.4.06.35b.568-ref-b.4.06.35b.584,25057,25136,3810,3820,ref-sifre-n.14.1.62,ref-sifre-n.14.1.78,6456040,6456132,940603,940618,ref-b.4.6.35b.568,ref-b.4.6.35b.584,עמך למה נאמר לפי שהוא אומר ושמעה קול אלה אין לי אלא אלה מנין לעשות שבועה כאלה ,ומנין לעשות ושבועה שאין עמה אלה כשבועה שיש עמה אלה תלמוד לומר ושמעה קול אלה ושמעה אלה ,17,17,215,1678,0.6744186046511628,0.5333333333333333
1679,ref-sifre-n.84.4.201-ref-sifre-n.84.4.208,ref-b.4.06.36a.12-ref-b.4.06.36a.19,115241,115280,17587,17594,ref-sifre-n.84.4.201,ref-sifre-n.84.4.208,6456309,6456348,940650,940657,ref-b.4.6.36a.12,ref-b.4.6.36a.19,אורו מרוז אמר מלאך ה' אורו ארור יושביה ,אורו מרוז אמר מלאך ה' אורו ארור יושביה ,8,8,961,1679,0.0,0.0
1680,ref-sifre-n.157.5.267-ref-sifre-n.157.5.275,ref-b.4.08.2b.240-ref-b.4.08.2b.244,280162,280207,44678,44686,ref-sifre-n.157.5.267,ref-sifre-n.157.5.275,6504584,6504610,947301,947305,ref-b.4.8.2b.240,ref-b.4.8.2b.244,שנאמר שמות יד ה' ילחם לכם ובזמן שאין עושים ,מלחמות אני עשיתי שנאמר ה' ,9,5,2208,1680,0.7441860465116279,0.7272727272727273
1681,ref-sifre-n.84.5.133-ref-sifre-n.84.5.140,ref-b.4.08.3b.320-ref-b.4.08.3b.327,117411,117458,17948,17955,ref-sifre-n.84.5.133,ref-sifre-n.84.5.140,6509858,6509902,948083,948090,ref-b.4.8.3b.320,ref-b.4.8.3b.327,באלפים ורבבות שנא' רכב אלהים רבותים אלפי שנאן ,אלף עולמות שנאמר רכב אלהים רבותים אלפי שנאן ,8,8,975,1681,0.21739130434782608,0.4444444444444444
1682,ref-sifre-n.102.1.112-ref-sifre-n.102.1.119,ref-b.4.08.3b.322-ref-b.4.08.3b.327,139275,139318,21716,21723,ref-sifre-n.102.1.112,ref-sifre-n.102.1.119,6509869,6509902,948085,948090,ref-b.4.8.3b.322,ref-b.4.8.3b.327,שנאמר תהלים סח רכב אלהים רבותיים אלפי שנאן ,שנאמר רכב אלהים רבותים אלפי שנאן ,8,6,1039,1682,0.23255813953488372,0.25
1683,ref-sifre-n.85.1.63-ref-sifre-n.85.1.71,ref-b.4.08.4b.18-ref-b.4.08.4b.30,117881,117919,18034,18042,ref-sifre-n.85.1.63,ref-sifre-n.85.1.71,6514600,6514652,948804,948814,ref-b.4.8.4b.18,ref-b.4.8.4b.30,ומה הלאיתיך ענה בי מיכה ו עמי זכור נא ,עמי זכר נא מה יעץ בלק מלך מואב ומה ענה אותו בלעם בן ,9,13,977,1683,0.6923076923076923,0.6923076923076923
1684,ref-sifre-n.106.1.243-ref-sifre-n.106.1.248,ref-b.4.08.5a.73-ref-b.4.08.5a.78,146091,146123,22865,22870,ref-sifre-n.106.1.243,ref-sifre-n.106.1.248,6517383,6517415,949231,949236,ref-b.4.8.5a.73,ref-b.4.8.5a.78,והלך לפניך צדקך וכבוד ה' יאספך ,והלך לפניך צדקך וכבוד ה' יאספך ,6,6,1079,1684,0.0,0.0
1686,ref-sifre-n.116.1.342-ref-sifre-n.116.1.352,ref-b.4.08.11a.111-ref-b.4.08.11a.119,179748,179813,28377,28387,ref-sifre-n.116.1.342,ref-sifre-n.116.1.352,6540963,6541021,952850,952858,ref-b.4.8.11a.111,ref-b.4.8.11a.119,מבחוץ אתה אומר הכהנים מבפנים והלוים מבחוץ או אלו ואלו מבפנים ,"מבחוץ ואילו הקב""ה עבדיו מבפנים והוא משמרן מבחוץ שנאמר ",11,9,1392,1686,0.5901639344262295,0.7
1687,ref-sifre-n.40.1.87-ref-sifre-n.40.1.106,ref-b.4.08.11a.117-ref-b.4.08.11a.123,64722,64818,9345,9363,ref-sifre-n.40.1.87,ref-sifre-n.40.1.106,6541003,6541041,952856,952862,ref-b.4.8.11a.117,ref-b.4.8.11a.123,שומר ישראל ואומר ה' שומרך ה' צלך על יד ימינך ואומר ה' ישמרך מכל רע ואומר ה' ישמר צאתך ובואך ,משמרן מבחוץ שנאמר ה' ישמר צאתך ובואך ,20,7,571,1687,0.6521739130434783,0.75
1688,ref-sifre-n.40.1.99-ref-sifre-n.40.1.106,ref-b.4.08.11a.117-ref-b.4.08.11a.123,64778,64818,9356,9363,ref-sifre-n.40.1.99,ref-sifre-n.40.1.106,6541003,6541041,952856,952862,ref-b.4.8.11a.117,ref-b.4.8.11a.123,ישמרך מכל רע ואומר ה' ישמר צאתך ובואך ,משמרן מבחוץ שנאמר ה' ישמר צאתך ובואך ,8,7,572,1688,0.2631578947368421,0.6363636363636364
1689,ref-sifre-n.42.2.547-ref-sifre-n.42.2.551,ref-b.4.08.11a.308-ref-b.4.08.11a.312,69360,69395,10092,10096,ref-sifre-n.42.2.547,ref-sifre-n.42.2.551,6541984,6542019,953007,953011,ref-b.4.8.11a.308,ref-b.4.8.11a.312,ואומר בשלום תמות ובמשרפות אבותיך ,שנאמר בשלום תמות ובמשרפות אבותיך ,5,5,622,1689,0.09090909090909091,0.33333333333333337
1690,ref-sifre-n.115.2.23-ref-sifre-n.115.2.29,ref-b.4.08.17a.334-ref-b.4.08.17a.341,176695,176731,27866,27872,ref-sifre-n.115.2.23,ref-sifre-n.115.2.29,6562238,6562280,955980,955987,ref-b.4.8.17a.334,ref-b.4.8.17a.341,שמע שיש זונה בכרכי הים מיתה נוטלת ,שמע שיש זונה אחת בכרכי הים והיתה נוטלת ,7,8,1350,1690,0.15384615384615385,0.1428571428571429
1691,ref-sifre-n.92.1.214-ref-sifre-n.92.1.218,ref-b.4.08.17a.436-ref-b.4.08.17a.440,129478,129511,20024,20028,ref-sifre-n.92.1.214,ref-sifre-n.92.1.218,6562781,6562814,956078,956082,ref-b.4.8.17a.436,ref-b.4.8.17a.440,שנאמר וחפרה הלבנה ובושה החמה ,שנאמר וחפרה הלבנה ובושה החמה ,5,5,1005,1691,0.0,0.0
1692,ref-sifre-n.42.3.279-ref-sifre-n.42.3.284,ref-b.4.08.24b.39-ref-b.4.08.24b.44,71807,71849,10464,10469,ref-sifre-n.42.3.279,ref-sifre-n.42.3.284,6588623,6588665,959979,959984,ref-b.4.8.24b.39,ref-b.4.8.24b.44,הבקר לעולה והמוריגים וכלי הבקר לעצים ,הבקר לעולה והמוריגים וכלי הבקר לעצים ,6,6,646,1692,0.0,0.0
1693,ref-sifre-n.84.3.43-ref-sifre-n.84.3.56,ref-b.4.08.24b.647-ref-b.4.08.24b.660,114076,114154,17415,17427,ref-sifre-n.84.3.43,ref-sifre-n.84.3.56,6591723,6591799,960433,960445,ref-b.4.8.24b.647,ref-b.4.8.24b.660,ויהי בנוסם מפני בני ישראל והם במורד בית חורון וה' השליך עליהם אבנים גדולות ,ויהי בנוסם מפני בני ישראל הם במורד בית חורון וה' השליך עליהם אבנים גדולות ,14,14,956,1693,0.013333333333333334,0.0
1694,ref-sifre-n.105.1.162-ref-sifre-n.105.1.169,ref-b.4.08.32b.99-ref-b.4.08.32b.108,143051,143088,22344,22351,ref-sifre-n.105.1.162,ref-sifre-n.105.1.169,6618403,6618453,964419,964426,ref-b.4.8.32b.99,ref-b.4.8.32b.108,כמת מה המת מטמא באהל אף מצורע מטמא ,מתים מה מת מטמא באהל אף תקרובת עבודת כוכבים מטמאה ,8,10,1056,1694,0.44,0.6666666666666667
1695,ref-sifre-n.24.1.75-ref-sifre-n.24.1.82,ref-b.4.08.34a.102-ref-b.4.08.34a.110,38482,38537,5873,5880,ref-sifre-n.24.1.75,ref-sifre-n.24.1.82,6622978,6623037,965074,965079,ref-b.4.8.34a.102,ref-b.4.8.34a.110,החרצנים ואלו הן הזגים החרצנים אלו החיצונים והזגים ,"החרצנים והזגים של עובדי כוכבים וכו' ת""ר החרצנים והזגים ",8,9,316,1695,0.4727272727272727,0.8
1696,ref-sifre-n.125.1.1-ref-sifre-n.125.1.8,ref-b.4.08.37b.165-ref-b.4.08.37b.172,216434,216475,34169,34176,ref-sifre-n.125.1.1,ref-sifre-n.125.1.8,6635340,6635381,966863,966870,ref-b.4.8.37b.165,ref-b.4.8.37b.172,הנוגע במת לכל נפש אדם וטמא שבעת ימים ,הנוגע במת לכל נפש אדם וטמא שבעת ימים ,8,8,1671,1696,0.0,0.0
1697,ref-sifre-n.130.1.140-ref-sifre-n.130.1.147,ref-b.4.08.37b.178-ref-b.4.08.37b.185,227942,227983,36019,36026,ref-sifre-n.130.1.140,ref-sifre-n.130.1.147,6635405,6635451,966874,966881,ref-b.4.8.37b.178,ref-b.4.8.37b.185,"טומאת ז' ת""ל והנפש הנוגעת תטמא עד הערב ",הטמא יטמא וכתיב והנפש הנוגעת תטמא עד הערב ,8,8,1806,1697,0.2619047619047619,0.5
1698,ref-sifre-n.103.1.94-ref-sifre-n.103.1.105,ref-b.4.08.43a.262-ref-b.4.08.43a.272,140424,140485,21911,21922,ref-sifre-n.103.1.94,ref-sifre-n.103.1.105,6657970,6658029,970096,970105,ref-b.4.8.43a.262,ref-b.4.8.43a.272,בו במראה ולא בחידות אמרתי לו לפרוש מן האשה במראה זו מראה ,שבהן מראה את ההדיוטות ואומר להן כזה ראיתם או כזה ראיתם ,12,11,1043,1698,0.7017543859649122,0.6923076923076923
1699,ref-sifre-n.105.1.162-ref-sifre-n.105.1.169,ref-b.4.08.47b.590-ref-b.4.08.47b.599,143051,143088,22344,22351,ref-sifre-n.105.1.162,ref-sifre-n.105.1.169,6673821,6673870,972331,972338,ref-b.4.8.47b.590,ref-b.4.8.47b.599,כמת מה המת מטמא באהל אף מצורע מטמא ,מתים מה מת מטמא באהל אף תקרובת עבודת כוכבים מטמא ,8,10,1057,1699,0.42857142857142855,0.6666666666666667
1700,ref-sifre-n.111.3.93-ref-sifre-n.111.3.101,ref-b.4.10.3a.174-ref-b.4.10.3a.191,162413,162456,25509,25517,ref-sifre-n.111.3.93,ref-sifre-n.111.3.101,6758018,6758114,984604,984618,ref-b.4.10.3a.174,ref-b.4.10.3a.191,שבט שעשה על הוראת בית דינו ועשו שאר שבטים ,שבט שעשה בהוראת בית דינו ומאן חכמי' רבי יהודה היא דתניא שבט שעשה בהוראת בית דינו אותו השבט ,9,18,1222,1700,0.6483516483516484,0.6153846153846154
1702,ref-sifre-n.111.3.153-ref-sifre-n.111.3.161,ref-b.4.10.3a.174-ref-b.4.10.3a.192,162707,162748,25559,25567,ref-sifre-n.111.3.153,ref-sifre-n.111.3.161,6758018,6758119,984604,984619,ref-b.4.10.3a.174,ref-b.4.10.3a.192,שבט שעשה על הוראת בית דינו אותו שבט חייב ,שבט שעשה בהוראת בית דינו ומאן חכמי' רבי יהודה היא דתניא שבט שעשה בהוראת בית דינו אותו השבט חייב ,9,19,1232,1702,0.5833333333333334,0.5
1703,ref-sifre-n.111.3.121-ref-sifre-n.111.3.128,ref-b.4.10.3a.185-ref-b.4.10.3a.192,162548,162586,25531,25538,ref-sifre-n.111.3.121,ref-sifre-n.111.3.128,6758077,6758119,984612,984619,ref-b.4.10.3a.185,ref-b.4.10.3a.192,"שבט שעשה על הוראת ב""ד אותו השבט חייב ",שבט שעשה בהוראת בית דינו אותו השבט חייב ,8,8,1225,1703,0.225,0.375
1705,ref-sifre-n.111.3.172-ref-sifre-n.111.3.186,ref-b.4.10.5a.54-ref-b.4.10.5a.66,162802,162871,25578,25590,ref-sifre-n.111.3.172,ref-sifre-n.111.3.186,6766121,6766189,985876,985888,ref-b.4.10.5a.54,ref-b.4.10.5a.66,שבט מביא פר ושאר כל השבטים מביאים על ידו ומה הם מביאים על ידו שנים ,שבטים מביאין שני פרים חטאו ז' מביאין ז' ושאר שבטים שלא חטאו מביאין ,15,13,1239,1705,0.6567164179104478,0.5833333333333333
1706,ref-sifre-n.111.2.35-ref-sifre-n.111.2.42,ref-b.4.10.5a.55-ref-b.4.10.5a.69,161580,161621,25381,25388,ref-sifre-n.111.2.35,ref-sifre-n.111.2.42,6766127,6766201,985877,985891,ref-b.4.10.5a.55,ref-b.4.10.5a.69,לעולה מביא פר לחטאת כאן שהצבור מביא פר ,מביאין שני פרים חטאו ז' מביאין ז' ושאר שבטים שלא חטאו מביאין על ידיהן פר ,8,15,1211,1706,0.6986301369863014,0.7692307692307692
1708,ref-sifre-n.111.2.35-ref-sifre-n.111.2.42,ref-b.4.10.5a.93-ref-b.4.10.5a.102,161580,161621,25381,25388,ref-sifre-n.111.2.35,ref-sifre-n.111.2.42,6766316,6766366,985909,985917,ref-b.4.10.5a.93,ref-b.4.10.5a.102,לעולה מביא פר לחטאת כאן שהצבור מביא פר ,שחטאו מביאין ז' פרים ובית דין מביאין על ידיהן פר ,8,10,1212,1708,0.6326530612244898,0.7272727272727273
1710,ref-sifre-n.111.3.157-ref-sifre-n.111.3.177,ref-b.4.10.5a.583-ref-b.4.10.5a.607,162726,162830,25563,25583,ref-sifre-n.111.3.157,ref-sifre-n.111.3.177,6768748,6768882,986282,986302,ref-b.4.10.5a.583,ref-b.4.10.5a.607,"בית דינו אותו שבט חייב ושאר כל השבטים פטורים עשה על הוראת ב""ד הגדול אותו שבט מביא פר ושאר כל השבטים ","מביאין פר תא שמע רבי יהודה אומר שבט שעשה בהוראת בית דינו אותו השבט חייב ושאר כל השבטים פטורין ובהוראת ב""ד הגדול אפילו שאר שבטים ",21,25,1237,1710,0.59375,0.4285714285714286
1711,ref-sifre-n.111.3.93-ref-sifre-n.111.3.101,ref-b.4.10.5a.590-ref-b.4.10.5a.596,162413,162456,25509,25517,ref-sifre-n.111.3.93,ref-sifre-n.111.3.101,6768780,6768817,986285,986291,ref-b.4.10.5a.590,ref-b.4.10.5a.596,שבט שעשה על הוראת בית דינו ועשו שאר שבטים ,שבט שעשה בהוראת בית דינו אותו השבט ,9,7,1223,1711,0.2857142857142857,0.375
1713,ref-sifre-n.111.3.121-ref-sifre-n.111.3.139,ref-b.4.10.5a.590-ref-b.4.10.5a.621,162548,162643,25531,25549,ref-sifre-n.111.3.121,ref-sifre-n.111.3.139,6768780,6768952,986285,986309,ref-b.4.10.5a.590,ref-b.4.10.5a.621,"שבט שעשה על הוראת ב""ד אותו השבט חייב שהוא לבדו מביא עשה על הוראת ב""ד הגדול מנין ששאר שבטים ","שבט שעשה בהוראת בית דינו אותו השבט חייב ושאר כל השבטים פטורין ובהוראת ב""ד הגדול אפילו שאר שבטים חייבים שמע מינה אמר רב אשי מתניתין נמי דיקא דקתני ועשה אותו השבט על ",19,32,1229,1713,0.6097560975609756,0.5925925925925926
1714,ref-sifre-n.111.3.157-ref-sifre-n.111.3.175,ref-b.4.10.5a.623-ref-b.4.10.5a.660,162726,162819,25563,25581,ref-sifre-n.111.3.157,ref-sifre-n.111.3.175,6768958,6769158,986311,986344,ref-b.4.10.5a.623,ref-b.4.10.5a.660,"בית דינו אותו שבט חייב ושאר כל השבטים פטורים עשה על הוראת ב""ד הגדול אותו שבט מביא פר ושאר ",אותו השבט חייב ושאר כל השבטים פטורין למה לי למיתנא ושאר שבטים פטורים הא תנא אותו השבט חייב וכיון דתנא אותו השבט חייב ממילא ידענא שאר שבטים פטורין אלא הא קמשמע לן דבהוראת בית דינו הוא דשאר שבטים ,19,38,1236,1714,0.6907216494845361,0.72
1716,ref-sifre-n.111.3.153-ref-sifre-n.111.3.183,ref-b.4.10.5a.661-ref-b.4.10.5a.691,162707,162859,25559,25588,ref-sifre-n.111.3.153,ref-sifre-n.111.3.183,6769159,6769315,986345,986367,ref-b.4.10.5a.661,ref-b.4.10.5a.691,"שבט שעשה על הוראת בית דינו אותו שבט חייב ושאר כל השבטים פטורים עשה על הוראת ב""ד הגדול אותו שבט מביא פר ושאר כל השבטים מביאים על ידו ומה הם מביאים ","פטורים אבל בהוראת ב""ד הגדול אפילו שאר שבטים חייבין שמע מינה איבעיא להו שבט אחד שעשה בהוראת בית דין הגדול לרבי שמעון מי מייתי או לא תא שמע מה הן מביאין ",31,31,1234,1716,0.6225165562913907,0.56
1717,ref-sifre-n.111.3.132-ref-sifre-n.111.3.139,ref-b.4.10.5a.663-ref-b.4.10.5a.676,162603,162643,25542,25549,ref-sifre-n.111.3.132,ref-sifre-n.111.3.139,6769170,6769245,986347,986357,ref-b.4.10.5a.663,ref-b.4.10.5a.676,"עשה על הוראת ב""ד הגדול מנין ששאר שבטים ","בהוראת ב""ד הגדול אפילו שאר שבטים חייבין שמע מינה איבעיא להו שבט אחד שעשה ",8,14,1230,1717,0.7123287671232876,0.6666666666666667
1718,ref-sifre-n.111.3.121-ref-sifre-n.111.3.139,ref-b.4.10.5a.665-ref-b.4.10.5a.678,162548,162643,25531,25549,ref-sifre-n.111.3.121,ref-sifre-n.111.3.139,6769182,6769261,986349,986359,ref-b.4.10.5a.665,ref-b.4.10.5a.678,"שבט שעשה על הוראת ב""ד אותו השבט חייב שהוא לבדו מביא עשה על הוראת ב""ד הגדול מנין ששאר שבטים ",הגדול אפילו שאר שבטים חייבין שמע מינה איבעיא להו שבט אחד שעשה בהוראת בית דין ,19,15,1228,1718,0.7252747252747253,0.65
1720,ref-sifre-n.111.3.342-ref-sifre-n.111.3.353,ref-b.4.10.7a.32-ref-b.4.10.7a.39,163651,163709,25724,25735,ref-sifre-n.111.3.342,ref-sifre-n.111.3.353,6774376,6774419,987103,987109,ref-b.4.10.7a.32,ref-b.4.10.7a.39,משיח מביא פר כאן שהצבור מביאים פר אינו דין שמשיח מביא פר ,צבור בפר ואין מביאין אשם תלוי ומשיח בפר ,12,8,1252,1720,0.5614035087719298,0.8181818181818181
1721,ref-sifre-n.111.2.36-ref-sifre-n.111.2.49,ref-b.4.10.7a.291-ref-b.4.10.7a.309,161587,161665,25382,25395,ref-sifre-n.111.2.36,ref-sifre-n.111.2.49,6775655,6775741,987271,987283,ref-b.4.10.7a.291,ref-b.4.10.7a.309,מביא פר לחטאת כאן שהצבור מביא פר לעולה אינו דין שמביא פר לחטאת תלמוד לומר ,"יביא פר לעצמו ת""ל על חטאתו אשר חטא הא כיצד חטא בפני עצמו מביא בפני עצמו חטא עם הצבור ",15,19,1213,1721,0.6588235294117647,0.7777777777777778
1722,ref-sifre-n.10.1.196-ref-sifre-n.10.1.206,ref-b.4.10.7b.277-ref-b.4.10.7b.295,21749,21801,3269,3279,ref-sifre-n.10.1.196,ref-sifre-n.10.1.206,6777454,6777543,987533,987543,ref-b.4.10.7b.277,ref-b.4.10.7b.295,נאמר כאן עפר ונאמר להלן עפר מה עפר האמורה להלן כאן ,נאמר כאן מעיני ונאמר להלן מעיני מה להלן אין חייבין אלא על העלם דבר עם שגגת מעשה אף כאן ,11,19,180,1722,0.5747126436781609,0.7333333333333334
1724,ref-sifre-n.116.1.236-ref-sifre-n.116.1.251,ref-b.4.10.7b.277-ref-b.4.10.7b.295,179116,179196,28281,28294,ref-sifre-n.116.1.236,ref-sifre-n.116.1.251,6777454,6777543,987533,987543,ref-b.4.10.7b.277,ref-b.4.10.7b.295,ונאמר להלן אתך מה אתך האמור להלן כאן בלוים הכתוב מדבר אף אתך האמור כאן להלן ,נאמר כאן מעיני ונאמר להלן מעיני מה להלן אין חייבין אלא על העלם דבר עם שגגת מעשה אף כאן ,16,19,1385,1724,0.6781609195402298,0.5625
1725,ref-sifre-n.121.1.383-ref-sifre-n.121.1.396,ref-b.4.10.7b.277-ref-b.4.10.7b.295,203829,203894,32202,32215,ref-sifre-n.121.1.383,ref-sifre-n.121.1.396,6777454,6777543,987533,987543,ref-b.4.10.7b.277,ref-b.4.10.7b.295,נאמר כאן מלאה ונאמר להלן דברים כב מלאה מה להלן שהיא עולה אף כאן ,נאמר כאן מעיני ונאמר להלן מעיני מה להלן אין חייבין אלא על העלם דבר עם שגגת מעשה אף כאן ,14,19,1584,1725,0.5057471264367817,0.5
1726,ref-sifre-n.127.5.22-ref-sifre-n.127.5.38,ref-b.4.10.7b.277-ref-b.4.10.7b.295,224231,224307,35430,35444,ref-sifre-n.127.5.22,ref-sifre-n.127.5.38,6777454,6777543,987533,987543,ref-b.4.10.7b.277,ref-b.4.10.7b.295,נאמר כאן עפר ונאמר להלן במדבר ה עפר מה עפר האמור להלן על פני המים אף כאן ,נאמר כאן מעיני ונאמר להלן מעיני מה להלן אין חייבין אלא על העלם דבר עם שגגת מעשה אף כאן ,17,19,1757,1726,0.5057471264367817,0.6666666666666667
1727,ref-sifre-n.111.3.359-ref-sifre-n.112.1.5,ref-b.4.10.7b.382-ref-b.4.10.7b.387,163734,163782,25739,25746,ref-sifre-n.111.3.359,ref-sifre-n.112.1.5,6778002,6778036,987610,987615,ref-b.4.10.7b.382,ref-b.4.10.7b.387,בשגגה להוציא את המשיח ואם נפש אחת תחטא בשגגה ,בשגגה יצא משיח שאין חטאתו בשגגה ,9,6,1253,1727,0.4444444444444444,0.8181818181818181
1728,ref-sifre-n.111.3.229-ref-sifre-n.111.3.241,ref-b.4.10.7b.428-ref-b.4.10.7b.437,163088,163149,25630,25642,ref-sifre-n.111.3.229,ref-sifre-n.111.3.241,6778236,6778286,987651,987658,ref-b.4.10.7b.428,ref-b.4.10.7b.437,וחטאתם זו חטאת על שגגתם זו פר העלם דבר של צבור חטאתם כשגגתם ,חטאו בשגגה יצא זה שאין חטאו בשגגה אלא בהעלם דבר ,13,10,1244,1728,0.75,0.8
1729,ref-sifre-n.111.3.359-ref-sifre-n.112.1.5,ref-b.4.10.7b.461-ref-b.4.10.7b.466,163734,163782,25739,25746,ref-sifre-n.111.3.359,ref-sifre-n.112.1.5,6778392,6778425,987678,987683,ref-b.4.10.7b.461,ref-b.4.10.7b.466,בשגגה להוציא את המשיח ואם נפש אחת תחטא בשגגה ,בשגגה יצא משיח שאין חטאו בשגגה ,9,6,1254,1729,0.4222222222222222,0.8181818181818181
1731,ref-sifre-n.111.3.202-ref-sifre-n.111.3.208,ref-b.4.10.7b.793-ref-b.4.10.7b.803,162949,162989,25604,25610,ref-sifre-n.111.3.202,ref-sifre-n.111.3.208,6780153,6780216,987897,987907,ref-b.4.10.7b.793,ref-b.4.10.7b.803,פר ומתחייב שעיר פר לעולה ושעיר לחטאת ,פר לעולה ושעיר לחטאת הני נייתי איפכא פר לחטאת ושעיר לעולה ,7,11,1241,1731,0.6206896551724138,0.5
1732,ref-sifre-n.111.1.35-ref-sifre-n.111.1.41,ref-b.4.10.7b.836-ref-b.4.10.7b.842,160072,160105,25137,25142,ref-sifre-n.111.1.35,ref-sifre-n.111.1.41,6780367,6780400,987925,987930,ref-b.4.10.7b.836,ref-b.4.10.7b.842,תשגו ולא תעשו את כל המצות האלה ,תשגו ולא תעשו את כל המצות האלה ,7,7,1204,1732,0.0,0.0
1733,ref-sifre-n.111.1.89-ref-sifre-n.111.1.97,ref-b.4.10.7b.836-ref-b.4.10.7b.849,160352,160393,25180,25187,ref-sifre-n.111.1.89,ref-sifre-n.111.1.97,6780367,6780438,987925,987937,ref-b.4.10.7b.836,ref-b.4.10.7b.849,תשגו ולא תעשו את כל המצות באו כל המצות ,תשגו ולא תעשו את כל המצות האלה איזו היא מצוה שהיא שקולה ככל המצות ,9,14,1205,1733,0.42424242424242425,0.5
1734,ref-sifre-n.112.1.8-ref-sifre-n.112.1.22,ref-b.4.10.9a.204-ref-b.4.10.9a.215,163793,163871,25748,25762,ref-sifre-n.112.1.8,ref-sifre-n.112.1.22,6783095,6783157,988328,988339,ref-b.4.10.9a.204,ref-b.4.10.9a.215,"היתה בכלל כל המצות שהיחיד מביא עליהם כשבה או שעירה נשיא מביא שעיר משיח וב""ד ","היה נותן כלל כל שהיחיד באשם תלוי הנשיא כיוצא בו משיח וב""ד ",15,12,1255,1734,0.4868421052631579,0.7777777777777778
1735,ref-sifre-n.111.3.296-ref-sifre-n.111.3.308,ref-b.4.10.9b.235-ref-b.4.10.10a.8,163437,163499,25687,25697,ref-sifre-n.111.3.296,ref-sifre-n.111.3.308,6785034,6785086,988616,988625,ref-b.4.10.9b.235,ref-b.4.10.10a.8,"ומשיח מביא קרבן פר על כל המצות ומביא קרבן על עכו""ם אם למדתי ","משיח מביא פר מנא ה""מ דתנו רבנן והקריב על חטאתו מלמד ",13,11,1248,1735,0.55,0.8421052631578947
1737,ref-sifre-n.112.1.266-ref-sifre-n.112.1.277,ref-b.4.10.9b.235-ref-b.4.10.10a.9,165188,165244,25950,25961,ref-sifre-n.112.1.266,ref-sifre-n.112.1.277,6785034,6785093,988616,988626,ref-b.4.10.9b.235,ref-b.4.10.10a.9,קרבן פר על המצות מביא על עבודת גלולים אף משיח שמביא פר ,"משיח מביא פר מנא ה""מ דתנו רבנן והקריב על חטאתו מלמד שמביא ",12,12,1265,1737,0.7068965517241379,0.7058823529411764
1738,ref-sifre-n.8.1.157-ref-sifre-n.8.1.168,ref-b.4.10.10a.6-ref-b.4.10.10a.45,18327,18379,2706,2717,ref-sifre-n.8.1.157,ref-sifre-n.8.1.168,6785073,6785278,988623,988648,ref-b.4.10.10a.6,ref-b.4.10.10a.45,באה על תטא ומנחה זו באה על חטא אם למדתי למנחת חוטא ,"על חטאתו מלמד שמביא חטאתו משעבר שיכול והלא דין הוא ומה נשיא שמביא בשגגת מעשה אין מביא חטאתו משעבר משיח שאין מביא בשגגת מעשה אלא על העלם דבר עם שגגת מעשה כ""ש תלמוד לומר והקריב על חטאתו מלמד שמביא על ",12,40,137,1738,0.8232323232323232,0.9259259259259259
1739,ref-sifre-n.8.1.190-ref-sifre-n.8.1.200,ref-b.4.10.10a.6-ref-b.4.10.10a.46,18482,18529,2733,2743,ref-sifre-n.8.1.190,ref-sifre-n.8.1.200,6785073,6785284,988623,988649,ref-b.4.10.10a.6,ref-b.4.10.10a.46,באה על חטא וזו באה על חטא אם למדתי למנחת חוטא ,"על חטאתו מלמד שמביא חטאתו משעבר שיכול והלא דין הוא ומה נשיא שמביא בשגגת מעשה אין מביא חטאתו משעבר משיח שאין מביא בשגגת מעשה אלא על העלם דבר עם שגגת מעשה כ""ש תלמוד לומר והקריב על חטאתו מלמד שמביא על חטאתו ",11,41,139,1739,0.8333333333333334,0.92
1740,ref-sifre-n.8.1.156-ref-sifre-n.8.1.170,ref-b.4.10.10a.169-ref-b.4.10.10a.184,18322,18390,2705,2719,ref-sifre-n.8.1.156,ref-sifre-n.8.1.170,6785935,6786019,988745,988758,ref-b.4.10.10a.169,ref-b.4.10.10a.184,חוטא באה על תטא ומנחה זו באה על חטא אם למדתי למנחת חוטא שאינה באה ,חטאתו משעבר אינו מביא על הקודמות נשיא שאין מביא חטאתו משעבר אינו דין שלא יביא על ,15,16,136,1740,0.7160493827160493,0.9411764705882353
