,baseOrig,compOrig,baseCharStart,baseCharEnd,baseWdStart,baseWdEnd,baseRefStart,baseRefEnd,compCharStart,compCharEnd,compWdStart,compWdEnd,compRefStart,compRefEnd,baseStr,compStr,compWork
4290,ref-mek.3.1.1.164-ref-mek.3.1.1.172,ref-sifre-d.178.2.55-ref-sifre-d.178.2.60,134574,134626,21641,21649,ref-mek.00003.00001.00001.00164,ref-mek.00003.00001.00001.00172,195314,195344,32600,32605,ref-sifre-d.00178.00002.00055,ref-sifre-d.00178.00002.00060,ה' וגו' הששי שאמרה דבורה וברק שנאמר ותשר דבורה ,ה' וגו' ואיזה הדבר אשר דברו ,ref-sifre-d
4291,ref-mek.3.1.1.228-ref-mek.3.1.1.255,ref-sifre-d.62.1.37-ref-sifre-d.62.1.63,134923,135052,21699,21724,ref-mek.00003.00001.00001.00228,ref-mek.00003.00001.00001.00255,109121,109247,18256,18281,ref-sifre-d.00062.00001.00037,ref-sifre-d.00062.00001.00063,זכור ה' לדוד את כל ענותו אשר נשבע לה' נדר לאביר יעקב אם אבא באהל ביתי אם אעלה על ערש יצועי עד אמצא מקום לה' משכנות לאביר יעקב ,זכור ה' לדוד את כל ענותו אשר נשבע לה' נדר לאביר יעקב אם אבא באהל ביתי אם אתן שנת לעיני עד אמצא מקום לה' משכנות לאביר יעקב ,ref-sifre-d
4292,ref-mek.3.1.1.256-ref-mek.3.1.1.261,ref-sifre-d.352.11.34-ref-sifre-d.352.11.39,135053,135088,21725,21730,ref-mek.00003.00001.00001.00256,ref-mek.00003.00001.00001.00261,370944,370979,62278,62283,ref-sifre-d.00352.00011.00034,ref-sifre-d.00352.00011.00039,הנה שמענוה באפרתה מצאנוה בשדה יער ,הנה שמענוה באפרתה מצאנוה בשדי יער ,ref-sifre-d
4293,ref-mek.3.1.1.317-ref-mek.3.1.1.321,ref-sifre-d.48.5.142-ref-sifre-d.48.5.146,135353,135376,21781,21785,ref-mek.00003.00001.00001.00317,ref-mek.00003.00001.00001.00321,92613,92636,15550,15554,ref-sifre-d.00048.00005.00142,ref-sifre-d.00048.00005.00146,תורת ה' תמימה משיבת נפש ,תורת ה' תמימה משיבת נפש ,ref-sifre-d
4294,ref-mek.3.1.1.375-ref-mek.3.1.1.388,ref-sifre-d.26.10.26-ref-sifre-d.27.1.5,135628,135694,21835,21848,ref-mek.00003.00001.00001.00375,ref-mek.00003.00001.00001.00388,30292,30336,5108,5116,ref-sifre-d.00026.00010.00026,ref-sifre-d.00027.00001.00005,והלא עם ה' הם שנאמר והם עמך ונחלתך ואומר באמרו להם עם ה' אלה ,ואומר אלהים לא תקלל ה' אלהים אתה החלות אתה ,ref-sifre-d
4295,ref-mek.3.1.1.629-ref-mek.3.1.1.641,ref-sifre-d.1.3.47-ref-sifre-d.1.3.59,136988,137045,22073,22085,ref-mek.00003.00001.00001.00629,ref-mek.00003.00001.00001.00641,671,728,110,122,ref-sifre-d.00001.00003.00047,ref-sifre-d.00001.00003.00059,שאלו נא וראו אם יולד זכר מדוע ראיתי כל גבר ידיו על חלציו ,שאלו נא וראו אם יולד זכר מדוע ראיתי כל גבר ידיו על חלציו ,ref-sifre-d
4296,ref-mek.3.1.1.629-ref-mek.3.1.1.634,ref-sifre-d.319.1.72-ref-sifre-d.319.1.78,136988,137013,22073,22078,ref-mek.00003.00001.00001.00629,ref-mek.00003.00001.00001.00634,330162,330191,55281,55287,ref-sifre-d.00319.00001.00072,ref-sifre-d.00319.00001.00078,שאלו נא וראו אם יולד זכר ,שאלו נא וראו אם יולד איש זכר ,ref-sifre-d
4297,ref-mek.3.1.1.688-ref-mek.3.1.1.701,ref-sifre-d.355.27.5-ref-sifre-d.355.27.14,137289,137364,22130,22140,ref-mek.00003.00001.00001.00688,ref-mek.00003.00001.00001.00701,380799,380852,63978,63987,ref-sifre-d.00355.00027.00005,ref-sifre-d.00355.00027.00014,לאמר ר'_נחמיה_אומר שרתה רוח הקדש על ישראל ואמרו שירה והשירה שהיו אומרים ,אומר אין כאל ורוח הקודש אומרת אל ישורון ישראל אומר ,ref-sifre-d
4298,ref-mek.3.1.1.740-ref-mek.3.1.1.744,ref-sifre-d.190.18.32-ref-sifre-d.190.18.38,137564,137589,22170,22174,ref-mek.00003.00001.00001.00740,ref-mek.00003.00001.00001.00744,203957,203992,34020,34026,ref-sifre-d.00190.00018.00032,ref-sifre-d.00190.00018.00038,אומר סוס ורוכבו רמה בים ,שנאמר שמות טו סוס ורוכבו רמה בים ,ref-sifre-d
4299,ref-mek.3.1.1.900-ref-mek.3.1.1.915,ref-sifre-d.354.7.62-ref-sifre-d.354.7.78,138414,138495,22311,22326,ref-mek.00003.00001.00001.00900,ref-mek.00003.00001.00001.00915,376392,376474,63205,63221,ref-sifre-d.00354.00007.00062,ref-sifre-d.00354.00007.00078,ואומר אשר לו הים והוא עשהו אומר לי הכסף ולי הזהב וגו' ואומר הן הנפשות לי ,אמרתי לו פרנסתך במה הוא אמר לי מחלזון אמרתי לו ומי מצוי אמר לי השמים מקום בים ,ref-sifre-d
4300,ref-mek.3.1.1.964-ref-mek.3.1.1.970,ref-sifre-d.26.10.7-ref-sifre-d.26.10.12,138749,138781,22371,22377,ref-mek.00003.00001.00001.00964,ref-mek.00003.00001.00001.00970,30200,30228,5092,5097,ref-sifre-d.00026.00010.00007,ref-sifre-d.00026.00010.00012,רחמן שנאמר ה' ה' אל רחום וחנון ,רחמים שנא' ה' אל רחום וחנון ,ref-sifre-d
4301,ref-mek.3.1.1.966-ref-mek.3.1.1.970,ref-sifre-d.49.1.8-ref-sifre-d.49.1.12,138761,138781,22373,22377,ref-mek.00003.00001.00001.00966,ref-mek.00003.00001.00001.00970,96492,96512,16170,16174,ref-sifre-d.00049.00001.00008,ref-sifre-d.00049.00001.00012,ה' ה' אל רחום וחנון ,ה' ה' אל רחום וחנון ,ref-sifre-d
4302,ref-mek.3.1.1.1006-ref-mek.3.1.1.1023,ref-sifre-d.298.3.35-ref-sifre-d.299.1.3,138974,139072,22411,22426,ref-mek.00003.00001.00001.01006,ref-mek.00003.00001.00001.01023,283845,283912,47500,47511,ref-sifre-d.00298.00003.00035,ref-sifre-d.00299.00001.00003,אל ואומר הצור תמים פעלו וגו' אשירה_לה'_שהוא נאמן שנאמר האל הנאמן וגו' ואומר אל אמונה ואין ,אל תאמר מה היה שהימים הראשונים היו טובים מאלה ואמרת אליו שאינך ,ref-sifre-d
4303,ref-mek.3.1.1.1069-ref-mek.3.1.1.1084,ref-sifre-d.343.12.34-ref-sifre-d.343.12.41,139305,139379,22470,22483,ref-mek.00003.00001.00001.01069,ref-mek.00003.00001.00001.01084,359368,359409,60272,60279,ref-sifre-d.00343.00012.00034,ref-sifre-d.00343.00012.00041,אות הוא בתוך צבא שלו וכן_הוא_אומר ואתא מרבבות קדש אתא הוא בתוך רבבות קדש ,ואתא מרבבות קודש אות הוא בתוך רבבות קודש ,ref-sifre-d
4304,ref-mek.3.1.1.1098-ref-mek.3.1.1.1121,ref-sifre-d.343.12.103-ref-sifre-d.343.12.121,139445,139576,22495,22518,ref-mek.00003.00001.00001.01098,ref-mek.00003.00001.00001.01121,359743,359847,60337,60354,ref-sifre-d.00343.00012.00103,ref-sifre-d.00343.00012.00121,דודי צח ואדום ואומר ראשו כתם פז ואומר עיניו כיונים על אפיקי מים ואומר לחייו כערוגת הבשם ידיו גלילי זהב ואומר שוקיו עמודי שש ,דודי צח ואדום דגול מרבבה ראשו כתם פז עיניו כיונים לחייו כערוגות הבושם ידיו גלילי זהב שוקיו עמודי שש ,ref-sifre-d
4305,ref-mek.3.2.1.126-ref-mek.3.2.1.143,ref-sifre-d.43.8.12-ref-sifre-d.43.8.23,140820,140928,22726,22743,ref-mek.00003.00002.00001.00126,ref-mek.00003.00002.00001.00143,76806,76872,12907,12918,ref-sifre-d.00043.00008.00012,ref-sifre-d.00043.00008.00023,שורו עבר ולא יגעיל תפלט פרתו ולא תשכל ואומר ישלחו כצאן עויליהם וילדיהם ירקדון ישאו בתוף וכנור וישמחו ,שורו עיבר ולא יגעיל תפלט פרתו ולא תשכל ישאו בתוף וכנור וישמחו ,ref-sifre-d
4306,ref-mek.3.2.1.157-ref-mek.3.2.1.218,ref-sifre-d.43.8.38-ref-sifre-d.43.8.91,140985,141306,22757,22806,ref-mek.00003.00002.00001.00157,ref-mek.00003.00002.00001.00218,76953,77220,12933,12978,ref-sifre-d.00043.00008.00038,ref-sifre-d.00043.00008.00091,אמרו לא טפת גשמים הוא אין אנו צריכין לו אלא ואיד יעלה מן הארץ והשקה את כל פני האדמה אמר להם הקדוש_ברוך_הוא שוטים בטובה שהשפעתי לכם אתם מתגאים בה לפני בה אני נפרע מכם שנאמר ויהי הגשם על הארץ ארבעים יום וארבעים לילה ר' יוסי בן דורמסקית אומר הם נתנו עיניהם העליונה בתחתונה כדי לעשות תאוותם והקדוש_ברוך_הוא פתח ,"אמרו טיפה אחת של גשמים היא אין אנו צריכים לו ואד יעלה מן הארץ והשקה את פני האדמה אמר_להם_הקב""ה בטובה שהיטבתי לכם אתם מתגאים בה אני אפרע מכם ויהי הגשם על הארץ מ' יום ומ' לילה ר'_יוסי_בן דורמסקית אומר הם נתנו עיניהם עליונה ותחתונה כדי לעשות תאותם אף הקב""ה פתח ",ref-sifre-d
4307,ref-mek.3.2.1.224-ref-mek.3.2.1.237,ref-sifre-d.43.8.99-ref-sifre-d.43.9.5,141344,141425,22812,22823,ref-mek.00003.00002.00001.00224,ref-mek.00003.00002.00001.00237,77266,77352,12986,12998,ref-sifre-d.00043.00008.00099,ref-sifre-d.00043.00009.00005,ביום ההוא נבקעו כל מעיינות תהום וארובות השמים נפתחו וכן_אתה_מוצא באנשי מגדל ,ביום הזה נבקעו כל מעיינות תהום רבה וארובות השמים נפתחו וכן_אתה_מוצא באנשי המגדל ,ref-sifre-d
4308,ref-mek.3.2.1.248-ref-mek.3.2.1.255,ref-sifre-d.43.9.46-ref-sifre-d.43.9.53,141483,141529,22832,22839,ref-mek.00003.00002.00001.00248,ref-mek.00003.00002.00001.00255,77577,77621,13039,13046,ref-sifre-d.00043.00009.00046,ref-sifre-d.00043.00009.00053,ויאמרו הבה נבנה לנו עיר ומגדל וראשו השמימה ,שאמרו הבה נבנה לנו עיר ומגדל וראשו בשמים ,ref-sifre-d
4309,ref-mek.3.2.1.262-ref-mek.3.2.1.282,ref-sifre-d.43.9.63-ref-sifre-d.43.10.20,141559,141663,22846,22862,ref-mek.00003.00002.00001.00262,ref-mek.00003.00002.00001.00282,77662,77774,13054,13073,ref-sifre-d.00043.00009.00063,ref-sifre-d.00043.00010.00020,משם וכן_את_מוצא באנשי סדום שבמה שנתגאו לפניו בו נפרע_מהם_שנאמר ארץ ממנה יצא לחם ותחתיה נהפך כמו אש ,משם על פני האדמה וכן_אתה_מוצא באנשי סדום שלא מרדו אלא מתוך שביעה שנא' בהם ארץ ממנה יצא לחם תחתיה נהפך כמו אש ,ref-sifre-d
4310,ref-mek.3.2.1.315-ref-mek.3.2.1.363,ref-sifre-d.43.10.24-ref-sifre-d.43.10.61,141829,142103,22894,22939,ref-mek.00003.00002.00001.00315,ref-mek.00003.00002.00001.00363,77790,77992,13077,13110,ref-sifre-d.00043.00010.00024,ref-sifre-d.00043.00010.00061,"הרי מזון יוצא מאצלנו וכסף וזהב ואבנים טובות ומרגליות יוצאות מאצלנו בואו ונשכח תורת רגל מארצנו אמר להם הקב""ה שוטים שבעולם בטובה שהשפעתי לכם אתם מתגאים אתם אמרתם נשכח תורת רגל מארצנו אף אני אשכח אתכם מן העולם שנאמר פרץ נחל מעם גר הנשכחים מני רגל דלו מאנוש נעו ",הרי מזון אצלינו נעמוד ונשכח תורת רגל מבינינו אמר להם המקום בטובות שהיטבתי לכם אתם מבקשים לשכח תורת הרגל מביניכם אני משכח אתכם מן העולם מה_נאמר_בהם פרץ נחל מעם גר הנשכחים מני רגל דלו מאנוש נעו ,ref-sifre-d
4311,ref-mek.3.2.1.330-ref-mek.3.2.1.342,ref-sifre-d.52.4.29-ref-sifre-d.52.4.38,141922,141999,22909,22919,ref-mek.00003.00002.00001.00330,ref-mek.00003.00002.00001.00342,101364,101414,17006,17013,ref-sifre-d.00052.00004.00029,ref-sifre-d.00052.00004.00038,"מארצנו אמר להם הקב""ה שוטים שבעולם בטובה שהשפעתי לכם אתם מתגאים אתם אמרתם ","ארצנו אמר_להם_הקב""ה עלו ושלכם אני שומר לפי שנאמר ",ref-sifre-d
4312,ref-mek.3.2.1.365-ref-mek.3.2.1.378,ref-sifre-d.43.10.69-ref-sifre-d.43.10.79,142111,142199,22941,22954,ref-mek.00003.00002.00001.00365,ref-mek.00003.00002.00001.00378,78032,78110,13118,13128,ref-sifre-d.00043.00010.00069,ref-sifre-d.00043.00010.00079,ישליו אוהלים לשודים ובטוחות למרגיזי אל מי גרם להם לאשר הביא אלוה בידו וכן_הוא_אומר ,ישליו אוהלים לשודדים ובטוחות למרגיזי אל לאשר הביא אלוה בידו וכן_הוא_אומר ,ref-sifre-d
4313,ref-mek.3.2.1.389-ref-mek.3.2.1.407,ref-sifre-d.43.10.97-ref-sifre-d.43.10.115,142252,142344,22963,22980,ref-mek.00003.00002.00001.00389,ref-mek.00003.00002.00001.00407,78187,78283,13144,13161,ref-sifre-d.00043.00010.00097,ref-sifre-d.00043.00010.00115,הנה זה היה עון סדום אחותך גאון שבעת לחם ושלות השקט היה לה ולכך ויד עני ואביון לא החזיקה ,הנה זה היה עון סדום אחותך גאון שבעת לחם ושלות השקט היה לה ולבנותיה ויד עני ואביון לא החזיקה ,ref-sifre-d
4314,ref-mek.3.2.1.425-ref-mek.3.2.1.456,ref-sifre-d.43.11.16-ref-sifre-d.43.11.50,142424,142601,22995,23022,ref-mek.00003.00002.00001.00425,ref-mek.00003.00002.00001.00456,78405,78595,13180,13210,ref-sifre-d.00043.00011.00016,ref-sifre-d.00043.00011.00050,"ותשקן את אביהן יין בלילה הוא וכי מאין היה להם במערה אלא שזמן להם הקב""ה כענין שנאמר והיה ביום ההוא יטפו ההרים עסיס אם כן זימן הקב""ה למכעיסיו קל וחומר לעושי רצונו ","משקה ואומר ותשקין את אביהם יין בלילה ההוא וכי מאין להם יין במערה אלא שנזדמן להם יין לשעה וכן_הוא_אומר והיה ביום ההוא יטפו ההרים עסיס אם כן נתן הקב""ה למכעיסיו ק""ו לעושי רצונו ",ref-sifre-d
4315,ref-mek.3.2.1.448-ref-mek.3.2.1.456,ref-sifre-d.43.12.77-ref-sifre-d.43.12.83,142551,142601,23016,23022,ref-mek.00003.00002.00001.00448,ref-mek.00003.00002.00001.00456,78992,79028,13273,13278,ref-sifre-d.00043.00012.00077,ref-sifre-d.00043.00012.00083,"אם כן זימן הקב""ה למכעיסיו קל וחומר לעושי רצונו ","אם כן עשה למכעיסיו ק""ו לעושי רצונו ",ref-sifre-d
4316,ref-mek.3.2.1.643-ref-mek.3.2.1.663,ref-sifre-d.325.1.25-ref-sifre-d.325.1.32,143591,143705,23190,23210,ref-mek.00003.00002.00001.00643,ref-mek.00003.00002.00001.00663,340146,340188,57020,57027,ref-sifre-d.00325.00001.00025,ref-sifre-d.00325.00001.00032,נפרע ממנו שנאמר ביד מלאכיך חרפת ה' וגו' ואומר אני קרתי ושתיתי מים וגו' ואומר ויצא מלאך ה' ויך במחנה אשור ,פרעה ואומר ויצא מלאך ה' ויך במחנה אשור ,ref-sifre-d
4317,ref-mek.3.2.1.776-ref-mek.3.2.1.782,ref-sifre-d.190.18.35-ref-sifre-d.190.18.41,144287,144319,23311,23317,ref-mek.00003.00002.00001.00776,ref-mek.00003.00002.00001.00782,203972,204005,34023,34029,ref-sifre-d.00190.00018.00035,ref-sifre-d.00190.00018.00041,סוס ורוכבו רמה בים וכי סוס א' ,סוס ורוכבו רמה בים וכי סוס אחד ,ref-sifre-d
4318,ref-mek.3.2.1.776-ref-mek.3.2.1.787,ref-sifre-d.190.20.16-ref-sifre-d.190.21.7,144287,144352,23311,23322,ref-mek.00003.00002.00001.00776,ref-mek.00003.00002.00001.00787,204168,204220,34062,34070,ref-sifre-d.00190.00020.00016,ref-sifre-d.00190.00021.00007,סוס ורוכבו רמה בים וכי סוס א' הוא ורכבו א' הוא והלא_כבר_נאמר ,בסוס ורכב סוס ורכב וכי סוס אחד הם והלא_כבר_נאמר ,ref-sifre-d
4319,ref-mek.3.2.1.806-ref-mek.3.2.1.818,ref-sifre-d.190.19.4-ref-sifre-d.190.20.6,144439,144504,23335,23347,ref-mek.00003.00002.00001.00806,ref-mek.00003.00002.00001.00818,204084,204126,34044,34052,ref-sifre-d.00190.00019.00004,ref-sifre-d.00190.00020.00006,כסוס א' ורכבו כיוצא בו אתה אומר כי תצא למלחמה על אויבך וראית ,אויבך אתה נלחם וראית סוס רכב מה הם יוצאים ,ref-sifre-d
4320,ref-mek.3.2.1.813-ref-mek.3.2.1.823,ref-sifre-d.190.18.35-ref-sifre-d.190.18.49,144474,144526,23342,23352,ref-mek.00003.00002.00001.00813,ref-mek.00003.00002.00001.00823,203972,204042,34023,34036,ref-sifre-d.00190.00018.00035,ref-sifre-d.00190.00018.00049,כי תצא למלחמה על אויבך וראית סוס ורכב וכי סוס א' ,סוס ורוכבו רמה בים וכי סוס אחד היה מתניתין  כי תצא למלחמה על אויבך ,ref-sifre-d
4321,ref-mek.3.2.1.869-ref-mek.3.2.1.885,ref-sifre-d.62.2.1-ref-sifre-d.62.2.17,144767,144851,23390,23404,ref-mek.00003.00002.00001.00869,ref-mek.00003.00002.00001.00885,109448,109539,18320,18334,ref-sifre-d.00062.00002.00001,ref-sifre-d.00062.00002.00017,כתוב א' אומר רמה בים וכתוב_אחד_אומר ירה בים כיצד יתקיימו ב' כתובים הללו רמה שהיו ,כתוב אחד אומר באחד שבטי וכתוב_אחד_אומר מכל שבטיכם כיצד יתקיימו ב' כתובים הללו יודעים היו ,ref-sifre-d
4322,ref-mek.3.2.1.993-ref-mek.3.2.1.1001,ref-sifre-d.190.18.30-ref-sifre-d.190.18.38,145417,145464,23505,23513,ref-mek.00003.00002.00001.00993,ref-mek.00003.00002.00001.01001,203947,203992,34018,34026,ref-sifre-d.00190.00018.00030,ref-sifre-d.00190.00018.00038,הסוס ודן אותם יחד שנאמר סוס ורוכבו רמה בים ,כסוס אחד שנאמר שמות טו סוס ורוכבו רמה בים ,ref-sifre-d
4323,ref-mek.3.3.1.1-ref-mek.3.3.1.12,ref-sifre-d.343.7.55-ref-sifre-d.343.7.65,145953,146006,23595,23606,ref-mek.00003.00003.00001.00001,ref-mek.00003.00003.00001.00012,357914,357961,60027,60037,ref-sifre-d.00343.00007.00055,ref-sifre-d.00343.00007.00065,עזי וזמרת יה אין עזי אלא תורה שנאמר ה' עז לעמו יתן ,ה' עוז לעמו יתן ואין עוז אלא תורה שנ' עמו עוז ,ref-sifre-d
4324,ref-mek.3.3.1.64-ref-mek.3.3.1.76,ref-sifre-d.212.3.4-ref-sifre-d.212.3.17,146262,146339,23653,23665,ref-mek.00003.00003.00001.00064,ref-mek.00003.00003.00001.00076,215663,215745,36025,36038,ref-sifre-d.00212.00003.00004,ref-sifre-d.00212.00003.00017,אימרה ועשיתיו אימרה עשאני אימרה דכתיב וה' האמירך היום אף אני עשיתיו שנאמר ,נאמרה עשיה בראש ונאמרה עשיה בצפרנים מה עשיה האמורה בראש העברה אף עשיה האמורה ,ref-sifre-d
4325,ref-mek.3.3.1.64-ref-mek.3.3.1.76,ref-sifre-d.212.4.4-ref-sifre-d.212.4.17,146262,146339,23653,23665,ref-mek.00003.00003.00001.00064,ref-mek.00003.00003.00001.00076,215776,215855,36042,36055,ref-sifre-d.00212.00004.00004,ref-sifre-d.00212.00004.00017,אימרה ועשיתיו אימרה עשאני אימרה דכתיב וה' האמירך היום אף אני עשיתיו שנאמר ,נאמר עשיה בראש ונאמר עשיה בצפרנים מה עשיה האמורה בראש נוול אף עשיה האמורה ,ref-sifre-d
4326,ref-mek.3.3.1.73-ref-mek.3.3.1.82,ref-sifre-d.49.1.92-ref-sifre-d.49.1.104,146319,146367,23662,23670,ref-mek.00003.00003.00001.00073,ref-mek.00003.00003.00001.00082,96901,96972,16251,16263,ref-sifre-d.00049.00001.00092,ref-sifre-d.00049.00001.00104,אף אני עשיתיו שנאמר את ה' האמרת היום והרי כל ,ואומר כל הנקרא בשמי ולכבודי בראתיו יצרתיו אף עשיתיו ואו' כל פעל ה' ,ref-sifre-d
4327,ref-mek.3.3.1.113-ref-mek.3.3.1.120,ref-sifre-d.306.37.298-ref-sifre-d.306.37.306,146529,146566,23701,23708,ref-mek.00003.00003.00001.00113,ref-mek.00003.00003.00001.00120,310288,310334,51904,51912,ref-sifre-d.00306.00037.00298,ref-sifre-d.00306.00037.00306,ישראל אומר שמע ישראל ה' אלהינו ה' אחד ,ישראל מלמטה שנאמר שמע ישראל ה' אלהינו ה' אחד ,ref-sifre-d
4328,ref-mek.3.3.1.113-ref-mek.3.3.1.160,ref-sifre-d.355.27.2-ref-sifre-d.355.27.35,146529,146786,23701,23748,ref-mek.00003.00003.00001.00113,ref-mek.00003.00003.00001.00160,380781,380960,63975,64008,ref-sifre-d.00355.00027.00002,ref-sifre-d.00355.00027.00035,ישראל אומר שמע ישראל ה' אלהינו ה' אחד ורוח הקדש צווחת ואומרת אשריך ישראל מי כמוך ישראל אומר מי כה' אלהינו בכל קראנו אליו ורוח הקדש צווחת ואומרת ומי גוי גדול אשר לו אלהים קרובים אליו ישראל אומר כי תפארת עוזמו אתה וגו' ורוח הקדש צווחת ואומרת ישראל ,כאל ישורון ישראל אומר אין כאל ורוח הקודש אומרת אל ישורון ישראל אומר מי כמוך באלים ה' ורוח הקודש אומרת אשריך ישראל מי כמוך ישראל אומר שמע ישראל ה' אלהינו ה' אחד ורוח הקודש ,ref-sifre-d
4329,ref-mek.3.3.1.115-ref-mek.3.3.1.120,ref-sifre-d.31.1.1-ref-sifre-d.31.1.6,146540,146566,23703,23708,ref-mek.00003.00003.00001.00115,ref-mek.00003.00003.00001.00120,36468,36494,6171,6176,ref-sifre-d.00031.00001.00001,ref-sifre-d.00031.00001.00006,שמע ישראל ה' אלהינו ה' אחד ,שמע ישראל ה' אלהינו ה' אחד ,ref-sifre-d
4330,ref-mek.3.3.1.117-ref-mek.3.3.1.120,ref-sifre-d.31.7.52-ref-sifre-d.31.7.55,146550,146566,23705,23708,ref-mek.00003.00003.00001.00117,ref-mek.00003.00003.00001.00120,39662,39678,6710,6713,ref-sifre-d.00031.00007.00052,ref-sifre-d.00031.00007.00055,ה' אלהינו ה' אחד ,ה' אלהינו ה' אחד ,ref-sifre-d
4331,ref-mek.3.3.1.117-ref-mek.3.3.1.120,ref-sifre-d.31.10.2-ref-sifre-d.31.10.5,146550,146566,23705,23708,ref-mek.00003.00003.00001.00117,ref-mek.00003.00003.00001.00120,40352,40368,6818,6821,ref-sifre-d.00031.00010.00002,ref-sifre-d.00031.00010.00005,ה' אלהינו ה' אחד ,ה' אלהינו ה' אחד ,ref-sifre-d
4332,ref-mek.3.3.1.117-ref-mek.3.3.1.120,ref-sifre-d.31.10.10-ref-sifre-d.31.10.15,146550,146566,23705,23708,ref-mek.00003.00003.00001.00117,ref-mek.00003.00003.00001.00120,40385,40413,6824,6828,ref-sifre-d.00031.00010.00010,ref-sifre-d.00031.00010.00015,ה' אלהינו ה' אחד ,ה' אלהינו בעולם הזה ה' אחד ,ref-sifre-d
4333,ref-mek.3.3.1.121-ref-mek.3.3.1.136,ref-sifre-d.356.9.2-ref-sifre-d.356.9.12,146567,146653,23709,23724,ref-mek.00003.00003.00001.00121,ref-mek.00003.00003.00001.00136,382361,382424,64253,64263,ref-sifre-d.00356.00009.00002,ref-sifre-d.00356.00009.00012,ורוח הקדש צווחת ואומרת אשריך ישראל מי כמוך ישראל אומר מי כה' אלהינו בכל קראנו אליו ,ישראל ישראל אומרים מי כמוך באלים ורוח הקדש אומרת אשריך ישראל ,ref-sifre-d
4334,ref-mek.3.3.1.149-ref-mek.3.3.1.163,ref-sifre-d.355.27.56-ref-sifre-d.355.27.74,146719,146799,23737,23751,ref-mek.00003.00003.00001.00149,ref-mek.00003.00003.00001.00163,381077,381173,64029,64047,ref-sifre-d.00355.00027.00056,ref-sifre-d.00355.00027.00074,ישראל אומר כי תפארת עוזמו אתה וגו' ורוח הקדש צווחת ואומרת ישראל אשר בך אתפאר ,ורוח הקודש אומרת עם זו יצרתי לי ישראל אומר כי תפארת עוזמו ורוח הקודש אומר ישראל אשר בך אתפאר ,ref-sifre-d
4335,ref-mek.3.3.1.291-ref-mek.3.3.1.296,ref-sifre-d.49.1.46-ref-sifre-d.49.1.52,147480,147510,23860,23865,ref-mek.00003.00003.00001.00291,ref-mek.00003.00003.00001.00296,96678,96712,16206,16212,ref-sifre-d.00049.00001.00046,ref-sifre-d.00049.00001.00052,רחום וחנון אף אתה רחום וחנון ,רחום וחנון אף אתה הוי רחום וחנון ,ref-sifre-d
4336,ref-mek.3.3.1.349-ref-mek.3.3.1.403,ref-sifre-d.343.12.56-ref-sifre-d.343.12.105,147792,148082,23906,23956,ref-mek.00003.00003.00001.00349,ref-mek.00003.00003.00001.00403,359488,359757,60294,60339,ref-sifre-d.00343.00012.00056,ref-sifre-d.00343.00012.00105,אומות העולם שואלין את ישראל מה דודך מדוד שככה השבעתנו שכך אתם מתים לעולם עליו וכך אתם נהרגין עליו שנאמר על כן עלמות אהבוך אהבנוך עד מות וכתיב כי עליך הורגנו כל היום הרי אתם נאים הרי אתם גיבורים בואו והתערבו עמנו וישראל אומרים להן מכירים אתם אותו נאמר לכם מקצת שבחו דודי צח ואדום ,אומות העולם משאלים את ישראל ואומר להם מה דודך מדוד שכך אתם מומתים עליו שכך אתם נהרגים עליו כענין שנ' על כן עלמות אהבוך ואומר כי עליך הורגנו כל היום כולכם נאים כולכם גבורים בואו והתערבו עמנו וישראל אומרים להם נאמר לכם מקצת שבחו ואתם מכירים אותו דודי צח ואדום ,ref-sifre-d
