,baseOrig,compOrig,baseCharStart,baseCharEnd,baseWdStart,baseWdEnd,baseRefStart,baseRefEnd,compCharStart,compCharEnd,compWdStart,compWdEnd,compRefStart,compRefEnd,baseStr,compStr,compWork
4496,ref-mek.6.2.7.74-ref-mek.6.2.7.87,ref-sifre-d.356.13.34-ref-sifre-d.357.1.2,243294,243362,39926,39939,ref-mek.00006.00002.00007.00074,ref-mek.00006.00002.00007.00087,383329,383403,64427,64440,ref-sifre-d.00356.00013.00034,ref-sifre-d.00357.00001.00002,לך מראש ההר ואתה עולה שנאמר ויקרא ה' למשה אל ראש ההר ויעל משה ,לי אחי ואתה על במותינו תדרוך כענין שנא' ויקרא משה אל כל ישראל ויעל משה ,ref-sifre-d
4497,ref-mek.6.2.7.156-ref-mek.6.2.7.171,ref-sifre-d.306.8.126-ref-sifre-d.306.8.139,243703,243790,39999,40012,ref-mek.00006.00002.00007.00156,ref-mek.00006.00002.00007.00171,300177,300250,50259,50272,ref-sifre-d.00306.00008.00126,ref-sifre-d.00306.00008.00139,מקבלים אתם עליכם עונשים בשמחה הרי אתם מקבלים שכר ואם לאו הרי אתם מקבלים עליכם פורענות ,אתם שאם זכיתם אתם מקבלים שכר ואם חטאתם אתם מקבלים פורענות ואתם חסין על ,ref-sifre-d
4498,ref-mek.6.3.6.21-ref-mek.6.3.6.33,ref-sifre-d.171.3.23-ref-sifre-d.171.3.32,247338,247403,40602,40614,ref-mek.00006.00003.00006.00021,ref-mek.00006.00003.00006.00033,191052,191107,31882,31891,ref-sifre-d.00171.00003.00023,ref-sifre-d.00171.00003.00032,לגזרה שווה מה היו נכונים כאן לפרוש מן האשה אף היו נכונים האמור ,לגזרה שוה מה העברה האמורה כאן באש אף העברה האמורה ,ref-sifre-d
4499,ref-mek.6.4.1.14-ref-mek.6.4.1.23,ref-sifre-d.343.13.51-ref-sifre-d.343.14.11,249074,249125,40891,40900,ref-mek.00006.00004.00001.00014,ref-mek.00006.00004.00001.00023,360280,360347,60430,60444,ref-sifre-d.00343.00013.00051,ref-sifre-d.00343.00014.00011,ה' באש מגיד שהתורה אש ומאש נתנה ובאש נמשלה ומה ,ה' חוצב להבות אש אש דת למו מגיד הכתוב שדברי תורה נמשלו באש מה אש ,ref-sifre-d
4500,ref-mek.6.4.1.28-ref-mek.6.4.1.37,ref-sifre-d.343.14.40-ref-sifre-d.343.14.51,249142,249185,40905,40913,ref-mek.00006.00004.00001.00028,ref-mek.00006.00004.00001.00037,360479,360532,60466,60474,ref-sifre-d.00343.00014.00040,ref-sifre-d.00343.00014.00051,קרב אדם אצלה נכוה רחק ממנה צנן אין לו לאדם ,קרוב לה נכוה רחוק ממנה צונן כך_דברי_תורה כל זמן שאדם ,ref-sifre-d
4501,ref-mek.6.4.4.43-ref-mek.6.4.4.49,ref-sifre-d.1.20.15-ref-sifre-d.1.20.21,251293,251323,41269,41275,ref-mek.00006.00004.00004.00043,ref-mek.00006.00004.00004.00049,4648,4678,770,776,ref-sifre-d.00001.00020.00015,ref-sifre-d.00001.00020.00021,כי לה' עין אדם וכל שבטי ישראל ,כי לה' עין אדם וכל שבטי ישראל ,ref-sifre-d
4502,ref-mek.6.5.1.54-ref-mek.6.5.1.70,ref-sifre-d.9.1.31-ref-sifre-d.9.1.48,252680,252767,41511,41527,ref-mek.00006.00005.00001.00054,ref-mek.00006.00005.00001.00070,12960,13055,2176,2190,ref-sifre-d.00009.00001.00031,ref-sifre-d.00009.00001.00048,הוציא ישראל ממצרים קרע להם הים הוריד להם המן העלה להם הבאר הגיז להם השליו עשה להם ,ישראל אדם שהוציאם ממצרים וקרע להם את הים והוריד להם את המן והגיז להם את השליו ועשה להם ,ref-sifre-d
4503,ref-mek.6.5.1.54-ref-mek.6.5.1.70,ref-sifre-d.337.1.122-ref-sifre-d.337.1.141,252680,252767,41511,41527,ref-mek.00006.00005.00001.00054,ref-mek.00006.00005.00001.00070,349559,349667,58615,58630,ref-sifre-d.00337.00001.00122,ref-sifre-d.00337.00001.00141,הוציא ישראל ממצרים קרע להם הים הוריד להם המן העלה להם הבאר הגיז להם השליו עשה להם ,שהוציאנו ממצרים וקרע לנו את הים והוריד לנו את התורה והוריד לנו את המן והגיז לנו את השליו ועשה לנו ,ref-sifre-d
4504,ref-mek.6.5.1.54-ref-mek.6.5.1.70,ref-sifre-d.339.1.26-ref-sifre-d.339.1.41,252680,252767,41511,41527,ref-mek.00006.00005.00001.00054,ref-mek.00006.00005.00001.00070,350359,350447,58757,58769,ref-sifre-d.00339.00001.00026,ref-sifre-d.00339.00001.00041,הוציא ישראל ממצרים קרע להם הים הוריד להם המן העלה להם הבאר הגיז להם השליו עשה להם ,שהוציאנו ממצרים וקרע לנו את הים והוריד לנו את התורה והגיז לנו את השליו ועשה לנו ,ref-sifre-d
4505,ref-mek.6.5.1.58-ref-mek.6.5.1.68,ref-sifre-d.355.9.17-ref-sifre-d.355.9.24,252704,252759,41515,41525,ref-mek.00006.00005.00001.00058,ref-mek.00006.00005.00001.00068,378191,378230,63524,63531,ref-sifre-d.00355.00009.00017,ref-sifre-d.00355.00009.00024,להם הים הוריד להם המן העלה להם הבאר הגיז להם השליו ,עולה להן והמן יורד להם ושליו מצוי להם ,ref-sifre-d
4506,ref-mek.6.5.1.61-ref-mek.6.5.1.70,ref-sifre-d.313.10.12-ref-sifre-d.313.10.20,252719,252767,41518,41527,ref-mek.00006.00005.00001.00061,ref-mek.00006.00005.00001.00070,321772,321810,53819,53827,ref-sifre-d.00313.00010.00012,ref-sifre-d.00313.00010.00020,להם המן העלה להם הבאר הגיז להם השליו עשה להם ,באר עולה להם מן עולה להם שליו מצוי להם ,ref-sifre-d
4507,ref-mek.6.5.1.226-ref-mek.6.5.1.240,ref-sifre-d.328.4.35-ref-sifre-d.328.4.45,253578,253650,41652,41664,ref-mek.00006.00005.00001.00226,ref-mek.00006.00005.00001.00240,342374,342426,57404,57414,ref-sifre-d.00328.00004.00035,ref-sifre-d.00328.00004.00045,אני לשעבר אני לעתיד לבא אני לעולם הזה אני לעולם הבא שנאמר ראו עתה כי ,שנאמר ראו עתה כי אני אני הוא זאת תשובה לאומרים אין ,ref-sifre-d
4508,ref-mek.6.5.1.226-ref-mek.6.5.1.240,ref-sifre-d.329.1.1-ref-sifre-d.329.1.10,253578,253650,41652,41664,ref-mek.00006.00005.00001.00226,ref-mek.00006.00005.00001.00240,342439,342484,57417,57426,ref-sifre-d.00329.00001.00001,ref-sifre-d.00329.00001.00010,אני לשעבר אני לעתיד לבא אני לעולם הזה אני לעולם הבא שנאמר ראו עתה כי ,ראו עתה כי אני אני הוא זאת תשובה לאומרים אין ,ref-sifre-d
4509,ref-mek.6.5.1.241-ref-mek.6.5.1.254,ref-sifre-d.346.2.97-ref-sifre-d.346.2.108,253651,253709,41665,41676,ref-mek.00006.00005.00001.00241,ref-mek.00006.00005.00001.00254,363662,363715,60985,60996,ref-sifre-d.00346.00002.00097,ref-sifre-d.00346.00002.00108,אני אני הוא עד זקנה אני הוא כה_אמר_ה' מלך ישראל וגואלו ה' ,ה' ואני אל כשאתם עדי אני אל וכשאין אתם עדי אין אני ,ref-sifre-d
4510,ref-mek.6.5.1.248-ref-mek.6.5.1.259,ref-sifre-d.329.1.41-ref-sifre-d.329.1.52,253679,253737,41672,41681,ref-mek.00006.00005.00001.00248,ref-mek.00006.00005.00001.00259,342644,342703,57456,57465,ref-sifre-d.00329.00001.00041,ref-sifre-d.00329.00001.00052,כה_אמר_ה' מלך ישראל וגואלו ה' צבאות אני ראשון ואני אחרון ,כה_אמר_ה' מלך ישראל וגואלו ה' צבבאות אני ראשון ואני אחרון ,ref-sifre-d
4511,ref-mek.6.5.1.405-ref-mek.6.5.1.412,ref-sifre-d.343.8.23-ref-sifre-d.343.8.30,254512,254555,41806,41813,ref-mek.00006.00005.00001.00405,ref-mek.00006.00005.00001.00412,358124,358167,60060,60067,ref-sifre-d.00343.00008.00023,ref-sifre-d.00343.00008.00030,ה' בצאתך משעיר בצעדך משדה אדום ארץ רעשה ,ה' בצאתך משעיר בצעדך משדה אדום ארץ רעשה ,ref-sifre-d
4512,ref-mek.6.5.1.486-ref-mek.6.5.1.504,ref-sifre-d.343.6.24-ref-sifre-d.343.6.41,254949,255033,41880,41893,ref-mek.00006.00005.00001.00486,ref-mek.00006.00005.00001.00504,356515,356593,59791,59803,ref-sifre-d.00343.00006.00024,ref-sifre-d.00343.00006.00041,בני עשו הרשע ואמר להם מקבלים אתם את התורה אמרו לו מה כתוב בה אמר_להם_לא תרצח אמרו ,בני עשו ואמר להם מקבלים אתם את התורה אמרו לו מה כתוב בה אמר_להם_לא תרצח אמרו ,ref-sifre-d
4513,ref-mek.6.5.1.486-ref-mek.6.5.1.533,ref-sifre-d.343.6.57-ref-sifre-d.343.6.83,254949,255170,41880,41915,ref-mek.00006.00005.00001.00486,ref-mek.00006.00005.00001.00533,356666,356788,59819,59840,ref-sifre-d.00343.00006.00057,ref-sifre-d.00343.00006.00083,בני עשו הרשע ואמר להם מקבלים אתם את התורה אמרו לו מה כתוב בה אמר_להם_לא תרצח אמרו זו היא ירושה שהורישנו אבינו שנאמר על חרבך תחיה נגלה על בני עמון ומואב אמר להם מקבלים אתם את התורה אמרו לו מה כתוב בה אמר_להם_לא תנאף ,אביו שנאמר על חרבך תחיה הלך לו אצל בני עמון ומואב ואמר להם מקבלים אתם את התורה אמרו לו מה כתוב בו אמר_להם_לא תנאף אמרו ,ref-sifre-d
4514,ref-mek.6.5.1.491-ref-mek.6.5.1.504,ref-sifre-d.343.6.103-ref-sifre-d.343.6.116,254973,255033,41885,41893,ref-mek.00006.00005.00001.00491,ref-mek.00006.00005.00001.00504,356883,356944,59859,59867,ref-sifre-d.00343.00006.00103,ref-sifre-d.00343.00006.00116,מקבלים אתם את התורה אמרו לו מה כתוב בה אמר_להם_לא תרצח אמרו ,מקבלים אתם את התורה אמרו לו מה כתוב בה אמר_להם_לא תגנוב אמרו ,ref-sifre-d
4515,ref-mek.6.5.1.516-ref-mek.6.5.1.564,ref-sifre-d.343.6.92-ref-sifre-d.343.6.115,255091,255320,41904,41939,ref-mek.00006.00005.00001.00516,ref-mek.00006.00005.00001.00564,356826,356939,59849,59866,ref-sifre-d.00343.00006.00092,ref-sifre-d.00343.00006.00115,בני עמון ומואב אמר להם מקבלים אתם את התורה אמרו לו מה כתוב בה אמר_להם_לא תנאף אמר לו כלנו מניאו דכתיב ותהרין שתי בנות לוט מאביהן והיאך נקבלה נגלה על בני ישמעאל אמר להם מקבלין אתם את התורה אמרו לו מה כתוב בה אמר_להם_לא תגנוב ,ותהרן שתי בנות לוט מאביהם הלך ומצא בני ישמעאל אמר להם מקבלים אתם את התורה אמרו לו מה כתוב בה אמר_להם_לא תגנוב ,ref-sifre-d
4516,ref-mek.6.5.1.521-ref-mek.6.5.1.530,ref-sifre-d.343.6.28-ref-sifre-d.343.6.37,255115,255165,41908,41914,ref-mek.00006.00005.00001.00521,ref-mek.00006.00005.00001.00530,356533,356583,59795,59801,ref-sifre-d.00343.00006.00028,ref-sifre-d.00343.00006.00037,מקבלים אתם את התורה אמרו לו מה כתוב בה אמר_להם_לא ,מקבלים אתם את התורה אמרו לו מה כתוב בה אמר_להם_לא ,ref-sifre-d
4517,ref-mek.6.5.1.552-ref-mek.6.5.1.561,ref-sifre-d.343.6.28-ref-sifre-d.343.6.37,255264,255314,41932,41938,ref-mek.00006.00005.00001.00552,ref-mek.00006.00005.00001.00561,356533,356583,59795,59801,ref-sifre-d.00343.00006.00028,ref-sifre-d.00343.00006.00037,מקבלין אתם את התורה אמרו לו מה כתוב בה אמר_להם_לא ,מקבלים אתם את התורה אמרו לו מה כתוב בה אמר_להם_לא ,ref-sifre-d
4518,ref-mek.6.5.1.552-ref-mek.6.5.1.561,ref-sifre-d.343.6.70-ref-sifre-d.343.6.79,255264,255314,41932,41938,ref-mek.00006.00005.00001.00552,ref-mek.00006.00005.00001.00561,356728,356778,59832,59838,ref-sifre-d.00343.00006.00070,ref-sifre-d.00343.00006.00079,מקבלין אתם את התורה אמרו לו מה כתוב בה אמר_להם_לא ,מקבלים אתם את התורה אמרו לו מה כתוב בו אמר_להם_לא ,ref-sifre-d
4519,ref-mek.6.5.1.600-ref-mek.6.5.1.605,ref-sifre-d.311.3.13-ref-sifre-d.311.3.18,255493,255524,41970,41975,ref-mek.00006.00005.00001.00600,ref-mek.00006.00005.00001.00605,318509,318539,53268,53273,ref-sifre-d.00311.00003.00013,ref-sifre-d.00311.00003.00018,עמד וימודד ארץ ראה ויתר גויים ,עמד וימודד ארץ ראה ויתר גוים ,ref-sifre-d
4520,ref-mek.6.5.1.611-ref-mek.6.5.1.621,ref-sifre-d.343.6.175-ref-sifre-d.343.6.184,255547,255607,41980,41989,ref-mek.00006.00005.00001.00611,ref-mek.00006.00005.00001.00621,357232,357279,59918,59926,ref-sifre-d.00343.00006.00175,ref-sifre-d.00343.00006.00184,בשבע מצות שנצטוו בני נח שקבלו עליהן אינן יכולין לעמוד בהן ,שבע מצות שקיבלו עליהם בני נח לא יכלו לעמוד בהם ,ref-sifre-d
4521,ref-mek.6.5.1.612-ref-mek.6.5.1.621,ref-sifre-d.343.6.229-ref-sifre-d.343.6.237,255553,255607,41981,41989,ref-mek.00006.00005.00001.00612,ref-mek.00006.00005.00001.00621,357527,357570,59969,59976,ref-sifre-d.00343.00006.00229,ref-sifre-d.00343.00006.00237,מצות שנצטוו בני נח שקבלו עליהן אינן יכולין לעמוד בהן ,מצות שקיבלו עליהם בני נח לא יכלו לעמוד בהם ,ref-sifre-d
4522,ref-mek.6.6.1.155-ref-mek.6.6.1.170,ref-sifre-d.43.16.2-ref-sifre-d.43.16.17,257333,257412,42256,42267,ref-mek.00006.00006.00001.00155,ref-mek.00006.00006.00001.00170,80374,80453,13515,13526,ref-sifre-d.00043.00016.00002,ref-sifre-d.00043.00016.00017,אלהים אחרים וכי אלוהות הן והלא_כבר_נאמר ונתון את אלהיהם באש כי לא אלהים המה ,אלהים אחרים וכי אלהים הוא והלא_כבר_נאמר ונתון את אלהיהם באש כי לא אלהים המה ,ref-sifre-d
4523,ref-mek.6.6.1.174-ref-mek.6.6.1.222,ref-sifre-d.43.16.26-ref-sifre-d.43.18.4,257429,257701,42269,42309,ref-mek.00006.00006.00001.00174,ref-mek.00006.00006.00001.00222,80488,80646,13534,13558,ref-sifre-d.00043.00016.00026,ref-sifre-d.00043.00018.00004,אלהים אחרים אלא שאחרים קוראין אותם אלוהות דבר אחר אלהים אחרים שהם מאחרין הטובה מלבא לעולם דבר אחר אלהים אחרים שהם עושין את אלהיהם אחרונים דבר אחר אלהים אחרים שהם אחרונים לעובדיהם וכן_הוא_אומר והן יצעק אליו ולא יענה ומצרתו לא יושיענו ר'_יוסי_אומר אלהים אחרים למה ,"אלהים אחרים שעושים את עובדיהם אחרים ד""א למה נקרא שמם אלהים אחרים שאחרים הם לעובדיהם וכן_הוא_אומר אף יצעק אליו ולא יענה מצרתו לא יושיענו ר'_יוסי_אומר למה ",ref-sifre-d
4524,ref-mek.6.6.1.177-ref-mek.6.6.1.195,ref-sifre-d.43.21.5-ref-sifre-d.43.22.3,257445,257553,42272,42288,ref-mek.00006.00006.00001.00177,ref-mek.00006.00006.00001.00195,81488,81568,13717,13729,ref-sifre-d.00043.00021.00005,ref-sifre-d.00043.00022.00003,שאחרים קוראין אותם אלוהות דבר אחר אלהים אחרים שהם מאחרין הטובה מלבא לעולם דבר אחר אלהים אחרים שהם עושין ,אחרים שהן אחרים במעשיהם שמי שהם אחרים שבמעשיהם קראם אלהות והשתחויתם להם להם ,ref-sifre-d
4525,ref-mek.6.6.1.230-ref-mek.6.6.1.297,ref-sifre-d.43.18.7-ref-sifre-d.43.19.34,257741,258091,42313,42374,ref-mek.00006.00006.00001.00230,ref-mek.00006.00006.00001.00297,80656,81049,13561,13634,ref-sifre-d.00043.00018.00007,ref-sifre-d.00043.00019.00034,לומר אלו נקראו בשמו כבר היה בהם צורך אלו נקראו בשמו ואין בהם צורך ואימתי נקראו בשמו בימי אנוש בן שת שנאמר אז הוחל לקרוא בשם ה' באותה שעה עלה אוקיינוס והציף שלישו של עולם אמר להם המקום אתם עושים מעשה חדש וקראתם עצמכם בשמי אף אני אעשה מעשה חדש ואקרא עצמי בשמי שנאמר הקורא למי הים וישפכם על פני הארץ ה' שמו ר'_אליעזר_אומר אלהים אחרים ,"אלהים אחרים שלא ליתן פתחון פה לבאי העולם לומר אלו הן נקראים על שמם היה בהם צורך והרי נקראים על שמו ולא היה בהם צורך ואימתי נקראים על שמו בימי דור אנוש שנאמר ולשת גם הוא יולד בן ויקרא שמו אנוש אז הוחל לקרוא בשם ה' באותה שעה עלה אוקיינוס והציף שלישו של עולם אמר_להם_הקב""ה אתם עשיתם מעשה חדש וקראתם על שמי אף אני אעשה מעשה חדש ואקרא על שמי שנא' הקורא למי הים וישפכם ה' צבאות שמו ",ref-sifre-d
4526,ref-mek.6.6.1.292-ref-mek.6.6.1.330,ref-sifre-d.43.19.54-ref-sifre-d.43.19.87,258061,258232,42371,42404,ref-mek.00006.00006.00001.00292,ref-mek.00006.00006.00001.00330,81136,81298,13651,13681,ref-sifre-d.00043.00019.00054,ref-sifre-d.00043.00019.00087,שמו ר'_אליעזר_אומר אלהים אחרים שהם מחדשים להם אלהות בכל יום הא כיצד היה לו של זהב נצרך לו עשאו של כסף של כסף ונצרך לו עשאו של נחשת היה לו של נחשת ונצרך לו עשאו של ברזל ,שמם אלהים אחרים שמחדשים להם אלוהות הרבה שאם היה של זהב וצריך לו עושהו של כסף ואם היה של כסף וצריך לו עושהו של נחושת ואם היה של נחושת וצריך לו עושהו של ברזל ,ref-sifre-d
4527,ref-mek.6.6.1.346-ref-mek.6.6.1.355,ref-sifre-d.43.19.40-ref-sifre-d.43.19.48,258303,258351,42416,42423,ref-mek.00006.00006.00001.00346,ref-mek.00006.00006.00001.00355,81072,81111,13639,13647,ref-sifre-d.00043.00019.00040,ref-sifre-d.00043.00019.00048,שם עבודה זרה לא היה מספיק להם כל העורות שבעולם ,"שמה של ע""ז לא ספקו להם כל עורות שבעולם ",ref-sifre-d
4528,ref-mek.6.6.1.363-ref-mek.6.6.1.371,ref-sifre-d.43.20.8-ref-sifre-d.43.20.16,258385,258437,42427,42435,ref-mek.00006.00006.00001.00363,ref-mek.00006.00006.00001.00371,81407,81459,13702,13710,ref-sifre-d.00043.00020.00008,ref-sifre-d.00043.00020.00016,לשון שתפסה תורה למולך כל שתמליכנו עליך אפילו קיסם ,לשון שתפסה תורה מולך כל שימליכוהו עליהם אפילו קיסם ,ref-sifre-d
4529,ref-mek.6.6.1.413-ref-mek.6.6.1.420,ref-sifre-d.306.15.24-ref-sifre-d.306.15.31,258646,258688,42471,42478,ref-mek.00006.00006.00001.00413,ref-mek.00006.00006.00001.00420,302391,302436,50607,50613,ref-sifre-d.00306.00015.00024,ref-sifre-d.00306.00015.00031,אני חי וקיים לעולם ולעולמי עולמים אף אתה ,שהם קיימים לעולם ולעולמי עולמים אמר להם אני ,ref-sifre-d
4530,ref-mek.6.6.1.414-ref-mek.6.6.1.418,ref-sifre-d.47.7.8-ref-sifre-d.47.7.12,258650,258681,42472,42476,ref-mek.00006.00006.00001.00414,ref-mek.00006.00006.00001.00418,88934,88969,14934,14938,ref-sifre-d.00047.00007.00008,ref-sifre-d.00047.00007.00012,חי וקיים לעולם ולעולמי עולמים ,חיים וקיימים לעולם ולעולמי עולמים ,ref-sifre-d
4531,ref-mek.6.6.1.414-ref-mek.6.6.1.418,ref-sifre-d.47.7.41-ref-sifre-d.47.7.45,258650,258681,42472,42476,ref-mek.00006.00006.00001.00414,ref-mek.00006.00006.00001.00418,89116,89151,14959,14963,ref-sifre-d.00047.00007.00041,ref-sifre-d.00047.00007.00045,חי וקיים לעולם ולעולמי עולמים ,חיים וקיימים לעולם ולעולמי עולמים ,ref-sifre-d
4532,ref-mek.6.6.2.63-ref-mek.6.6.2.93,ref-sifre-d.43.19.67-ref-sifre-d.43.19.82,258993,259121,42526,42545,ref-mek.00006.00006.00002.00063,ref-mek.00006.00006.00002.00093,81203,81274,13663,13676,ref-sifre-d.00043.00019.00067,ref-sifre-d.00043.00019.00082,יעשה של כסף תלמוד_לומר_אלהי כסף לא_יעשה_לו של כסף אבל_יעשה_לו של זהב תלמוד לומר ואלהי זהב לא_יעשה_לו של זהב אבל_יעשה_לו של נחשת ,עושהו של כסף ואם היה של כסף וצריך לו עושהו של נחושת ואם היה של נחושת ,ref-sifre-d
4533,ref-mek.6.6.3.55-ref-mek.6.6.3.67,ref-sifre-d.43.22.47-ref-sifre-d.43.22.56,260204,260272,42700,42707,ref-mek.00006.00006.00003.00055,ref-mek.00006.00006.00003.00067,81784,81832,13763,13770,ref-sifre-d.00043.00022.00047,ref-sifre-d.00043.00022.00056,זובח לאלהים יחרם בלתי לה' לבדו עונש_שמענו_אזהרה_מנין_תלמוד_לומר להם ,"זובח לאלהים יחרם בלתי לה' לבדו אלא מה ת""ל אלהים ",ref-sifre-d
4534,ref-mek.6.6.3.89-ref-mek.6.6.3.95,ref-sifre-d.40.2.5-ref-sifre-d.40.2.11,260373,260405,42725,42731,ref-mek.00006.00006.00003.00089,ref-mek.00006.00006.00003.00095,64514,64545,10877,10883,ref-sifre-d.00040.00002.00005,ref-sifre-d.00040.00002.00011,הנה לא ינום ולא יישן שומר ישראל ,הנה לא ינום ולא ישן שומר ישראל ,ref-sifre-d
4535,ref-mek.6.6.3.118-ref-mek.6.6.3.124,ref-sifre-d.40.2.5-ref-sifre-d.40.2.11,260513,260545,42753,42759,ref-mek.00006.00006.00003.00118,ref-mek.00006.00006.00003.00124,64514,64545,10877,10883,ref-sifre-d.00040.00002.00005,ref-sifre-d.00040.00002.00011,הנה לא ינום ולא יישן שומר ישראל ,הנה לא ינום ולא ישן שומר ישראל ,ref-sifre-d
4536,ref-mek.6.6.3.265-ref-mek.6.6.3.271,ref-sifre-d.318.13.4-ref-sifre-d.318.13.9,261230,261279,42879,42885,ref-mek.00006.00006.00003.00265,ref-mek.00006.00006.00003.00271,329177,329220,55113,55118,ref-sifre-d.00318.00013.00004,ref-sifre-d.00318.00013.00009,והרי אתם עובדין לחמה וללבנה ולכוכבים ולמזלות ,הם שעובדים לחמה וללבנה לכוכבים ולמזלות ,ref-sifre-d
4537,ref-mek.6.7.1.103-ref-mek.6.7.1.120,ref-sifre-d.334.1.11-ref-sifre-d.334.1.30,262781,262866,43145,43160,ref-mek.00006.00007.00001.00103,ref-mek.00006.00007.00001.00120,346588,346688,58130,58147,ref-sifre-d.00334.00001.00011,ref-sifre-d.00334.00001.00030,אי אפשר לומר לא ינקה שכבר נאמר ינקה ואי אפשר לומר ינקה שכבר נאמר לא ינקה אמור מעתה ,אי אפשר לומר ויבוא משה שכבר נאמר וילך משה ואי אפשר לומר וילך משה שכבר נאמ' ויבא משה אמור מעתה ,ref-sifre-d
4538,ref-mek.6.7.1.103-ref-mek.6.7.1.120,ref-sifre-d.352.13.50-ref-sifre-d.352.13.69,262781,262866,43145,43160,ref-mek.00006.00007.00001.00103,ref-mek.00006.00007.00001.00120,372111,372205,62485,62502,ref-sifre-d.00352.00013.00050,ref-sifre-d.00352.00013.00069,אי אפשר לומר לא ינקה שכבר נאמר ינקה ואי אפשר לומר ינקה שכבר נאמר לא ינקה אמור מעתה ,אי אפשר לומר שקלי זהב שכבר נאמר שקלי כסף ואי אפשר שקלי כסף שהרי כבר נאמר שקלי זהב אמור מעתה ,ref-sifre-d
4539,ref-mek.6.7.1.103-ref-mek.6.7.1.120,ref-sifre-d.352.13.74-ref-sifre-d.352.13.91,262781,262866,43145,43160,ref-mek.00006.00007.00001.00103,ref-mek.00006.00007.00001.00120,372227,372313,62507,62521,ref-sifre-d.00352.00013.00074,ref-sifre-d.00352.00013.00091,אי אפשר לומר לא ינקה שכבר נאמר ינקה ואי אפשר לומר ינקה שכבר נאמר לא ינקה אמור מעתה ,ואי אפשר לומר נ' שכבר נאמר שש מאות ואי אפשר לומר ו' מאות שכבר נאמר חמשים אמור מעתה ,ref-sifre-d
4540,ref-mek.6.7.2.1-ref-mek.6.7.2.36,ref-sifre-d.233.1.1-ref-sifre-d.233.3.10,264411,264610,43412,43445,ref-mek.00006.00007.00002.00001,ref-mek.00006.00007.00002.00036,234174,234363,39075,39110,ref-sifre-d.00233.00001.00001,ref-sifre-d.00233.00003.00010,זכור ושמור שניהם נאמרו בדבור אחד מחלליה_מות_יומת וביום השבת שני כבשים שניהם בדבור אחד נאמרו ערות אשת אחיך ויבמה יבא עליה שניהם נאמרו בדבור אחד לא תלבש שעטנז וגדילים תעשה לך שניהם נאמרו בדבור ,גדילים תעשה לך אמור מעתה שניהם נאמרו בדבור אחד זכור ושמור נאמרו בדבור אחד מחלליה מות יומת וביום השבת שני כבשים בני שנה נאמרו בדבור אחד ערות אשת אחיך לא תגלה יבמה יבא עליה נאמרו בדבור ,ref-sifre-d
4541,ref-mek.6.7.2.3-ref-mek.6.7.2.50,ref-sifre-d.233.5.1-ref-sifre-d.234.1.7,264423,264677,43414,43457,ref-mek.00006.00007.00002.00003,ref-mek.00006.00007.00002.00050,234447,234568,39126,39147,ref-sifre-d.00233.00005.00001,ref-sifre-d.00234.00001.00007,שניהם נאמרו בדבור אחד מחלליה_מות_יומת וביום השבת שני כבשים שניהם בדבור אחד נאמרו ערות אשת אחיך ויבמה יבא עליה שניהם נאמרו בדבור אחד לא תלבש שעטנז וגדילים תעשה לך שניהם נאמרו בדבור אחד מה שאי אפשר לאדם לומר כן שנאמר אחת דבר אלוהים שתים זו שמענו ,נאמר מה שאי אפשר לבשר ודם לומר שני דברים כאחד שנאמר אחת דבר א להים שתים זו שמעתי גדילים תעשה לך למה_נאמר_לפי שנאמר ,ref-sifre-d
